title,author,created_date,url,full_permalink,score,ups,downs,num_comments,sanitized_title,image_file,chart_type,high_level_categories
National Debt,sandycat3,2012-09-02 04:58:18,http://demonocracy.info/infographics/usa/us_debt/us_debt.html,https://www.reddit.com/r/dataisbeautiful/comments/z7vmh/national_debt/,29,29,0,7,National Debt,2012-09-0001.jpg,none,"finance, national debt, symbolism"
Drug prevalence around the world,HeartandSoul,2012-09-03 22:51:31,http://www.guardian.co.uk/news/datablog/interactive/2012/jul/02/drug-use-map-world,https://www.reddit.com/r/dataisbeautiful/comments/zaz1z/drug_prevalence_around_the_world/,142,142,0,26,Drug prevalence around the world,2012-09-0004.jpg,none,none
Tracing the Origins of Indo-European Languages - Graphic,farfaraway,2012-09-04 12:07:57,http://www.nytimes.com/interactive/2012/08/24/science/0824-origins.html?ref=science,https://www.reddit.com/r/dataisbeautiful/comments/zbykg/tracing_the_origins_of_indoeuropean_languages/,117,117,0,12,Tracing the Origins of Indo-European Languages - Graphic,2012-09-0005.jpg,none,"languages, history, cartography"
"Canadian Labour in Graphics: Who is employed, who isn’t and how the workforce breaks down",salvia_d,2012-09-04 19:50:05,http://news.nationalpost.com/2012/09/03/labour-in-canada/,https://www.reddit.com/r/dataisbeautiful/comments/zco9q/canadian_labour_in_graphics_who_is_employed_who/,43,43,0,1,"Canadian Labour in Graphics Who is employed, who isn’t and how the workforce breaks down",2012-09-0006.jpg,none,"employment, workforce, canada, labour"
Are songs getting sadder? Sure looks that way.,johnkeefe,2012-09-07 16:47:39,http://www.studio360.org/2012/sep/07/why-pop-music-so-sad/,https://www.reddit.com/r/dataisbeautiful/comments/zih6y/are_songs_getting_sadder_sure_looks_that_way/,26,26,0,11,Are songs getting sadder Sure looks that way.,2012-09-0008.jpg,none,none
Interactive real-time flight map. (x-post from r/technology),dpitch40,2012-09-12 19:27:31,http://www.flightradar24.com/,https://www.reddit.com/r/dataisbeautiful/comments/zs4lw/interactive_realtime_flight_map_xpost_from/,26,26,0,2,Interactive real-time flight map. (x-post from rtechnology),2012-09-0021.jpg,none,none
UK multi-millionaires mapped: where do the wealthy live?,hhugohhh,2012-09-13 14:55:15,http://www.guardian.co.uk/news/datablog/interactive/2012/sep/13/money-uk-multi-millionaires-regional-breakdown?CMP=twt_gu,https://www.reddit.com/r/dataisbeautiful/comments/ztoh8/uk_multimillionaires_mapped_where_do_the_wealthy/,7,7,0,2,UK multi-millionaires mapped where do the wealthy live,2012-09-0022.jpg,none,none
Measuring the Human Urban Footprint,OneTwelve,2012-09-14 21:19:24,http://lsecities.net/media/objects/articles/measuring-the-human-urban-footprint,https://www.reddit.com/r/dataisbeautiful/comments/zwadc/measuring_the_human_urban_footprint/,10,10,0,0,Measuring the Human Urban Footprint,2012-09-0025.jpg,none,none
The Collapse of Print Advertising in One Graph,pozorvlak,2012-09-17 23:25:24,http://www.theatlantic.com/business/archive/2012/02/the-collapse-of-print-advertising-in-1-graph/253736/,https://www.reddit.com/r/dataisbeautiful/comments/101s1y/the_collapse_of_print_advertising_in_one_graph/,7,7,0,1,The Collapse of Print Advertising in One Graph,2012-09-0031.jpg,none,none
3D Newick Tree Visualization Using Walrus. ,Illuminatesfolly,2012-09-18 03:04:40,http://www.caida.org/tools/visualization/walrus/gallery1/,https://www.reddit.com/r/dataisbeautiful/comments/10263o/3d_newick_tree_visualization_using_walrus/,3,3,0,3,3D Newick Tree Visualization Using Walrus.,2012-09-0032.jpg,none,"3d visualization, trees, graph theory, software tools, data visualization"
A collection of visualisations and maps in today's Guardian,BleinKottle,2012-09-21 13:47:06,http://www.guardian.co.uk/commentisfree/interactive/2012/sep/07/weird-maps-to-rival-apple-in-pictures,https://www.reddit.com/r/dataisbeautiful/comments/108x2x/a_collection_of_visualisations_and_maps_in_todays/,5,5,0,0,A collection of visualisations and maps in today's Guardian,2012-09-0039.jpg,none,"media, news, logo"
Bit Torrent Legal Downloads,JeffreyRodriguez,2012-09-22 05:03:16,http://featuredcontent.utorrent.com/too-legit/,https://www.reddit.com/r/dataisbeautiful/comments/10abb7/bit_torrent_legal_downloads/,5,5,0,4,Bit Torrent Legal Downloads,2012-09-0041.jpg,none,"technology, downloads, bittorrent, legal"
Interactive map from the Economist: Comparing U.S. States with Countries (by GDP or Population),cdal233,2012-09-22 19:49:54,http://www.economist.com/blogs/dailychart/2011/01/us_equivalents,https://www.reddit.com/r/dataisbeautiful/comments/10b6i3/interactive_map_from_the_economist_comparing_us/,5,5,0,2,Interactive map from the Economist Comparing U.S. States with Countries (by GDP or Population),2012-09-0043.jpg,none,none
Game of Thrones S2 social media data visualised,aladata,2012-09-23 18:12:19,http://aladata.co.uk/game-of-thrones-a-la-data/,https://www.reddit.com/r/dataisbeautiful/comments/10cma5/game_of_thrones_s2_social_media_data_visualised/,8,8,0,0,Game of Thrones S2 social media data visualised,2012-09-0046.jpg,none,none
"The social geography of Sheffield, a large British city, through a beautiful animation",lonelyinacrowd,2012-09-26 12:21:35,http://www.youtube.com/watch?v=8SNKHTHROR4,https://www.reddit.com/r/dataisbeautiful/comments/10i46b/the_social_geography_of_sheffield_a_large_british/,7,7,0,1,"The social geography of Sheffield, a large British city, through a beautiful animation",2012-09-0051.jpg,none,"geography, social dynamics, urban studies, sheffield, animation"
Mapping the world's population by Latitude & Longitude,ufology,2012-09-26 14:49:50,http://www.good.is/posts/mapping-the-world-s-population-by-latitude-longitude/,https://www.reddit.com/r/dataisbeautiful/comments/10ib96/mapping_the_worlds_population_by_latitude/,12,12,0,3,Mapping the world's population by Latitude & Longitude,2012-09-0053.jpg,none,none
Composite of Playboy Centerfolds in each decade from 1970's-2000's (completely SFW),novalsi,2012-09-27 20:16:17,http://imgur.com/AfSPi,https://www.reddit.com/r/dataisbeautiful/comments/10kwzb/composite_of_playboy_centerfolds_in_each_decade/,874,874,0,67,Composite of Playboy Centerfolds in each decade from 1970's-2000's (completely SFW),2012-09-0058.jpg,none,"culture, magazines, photography, media, trends"
A timelapse of my thesis being written.,Grahar64,2012-09-27 23:45:47,http://www.youtube.com/watch?v=DIdeu-uRiVI,https://www.reddit.com/r/dataisbeautiful/comments/10laib/a_timelapse_of_my_thesis_being_written/,23,23,0,4,A timelapse of my thesis being written.,2012-09-0059.jpg,none,"writing, thesis, academic, productivity"
Patent Arms Race Fuels Mobile's Doomsday Machine,marquis_of_chaos,2012-09-29 12:03:13,http://www.wired.com/business/2012/09/patent-arms-race-fuels-mobiles-doomsday-machine/,https://www.reddit.com/r/dataisbeautiful/comments/10nxe5/patent_arms_race_fuels_mobiles_doomsday_machine/,4,4,0,1,Patent Arms Race Fuels Mobile's Doomsday Machine,2012-09-0063.jpg,none,"patents, mobile technology, competition, innovation"
"Cloud Globe. Raw data, rawest representation. Amazing insights.",201109212215,2012-09-30 13:26:46,http://workshop.chromeexperiments.com/cloudglobe/,https://www.reddit.com/r/dataisbeautiful/comments/10pjmw/cloud_globe_raw_data_rawest_representation/,97,97,0,3,"Cloud Globe. Raw data, rawest representation. Amazing insights.",2012-09-0065.jpg,none,"geography, meteorology, earth sciences"
