title,author,created_date,url,full_permalink,score,ups,downs,num_comments,sanitized_title,image_file,chart_type,high_level_categories
The poisoning of the name 'Hillary',arvi1000,2013-02-01 15:46:29,http://nymag.com/thecut/2013/01/hillary-most-poisoned-baby-name-in-us-history.html,https://www.reddit.com/r/dataisbeautiful/comments/17p5a4/the_poisoning_of_the_name_hillary/,0,0,0,2,The poisoning of the name 'Hillary',2013-02-0000.jpg,none,none
Currency in Circulation via Federal Reserve Bank of St. Louis,dreezyforsheezy,2013-02-01 18:00:25,http://research.stlouisfed.org/fredgraph.png?g=f9w,https://www.reddit.com/r/dataisbeautiful/comments/17pelq/currency_in_circulation_via_federal_reserve_bank/,13,13,0,19,Currency in Circulation via Federal Reserve Bank of St. Louis,2013-02-0001.jpg,none,none
A Heart made with data.,cybercuzco,2013-02-03 21:19:20,http://youtu.be/hiKgDOXlPfk,https://www.reddit.com/r/dataisbeautiful/comments/17tr6n/a_heart_made_with_data/,8,8,0,1,A Heart made with data.,2013-02-0008.jpg,none,"art, heart, design"
What people said about GoDaddy's Super Bowl commercial,ReviewSignal,2013-02-05 02:53:52,http://reviewsignal.com/images/blog/godaddysuperbowl2013.png,https://www.reddit.com/r/dataisbeautiful/comments/17wqs7/what_people_said_about_godaddys_super_bowl/,31,31,0,15,What people said about GoDaddy's Super Bowl commercial,2013-02-0011.jpg,none,none
"Jail, Prison, Parole, and Probation Populations in the US, 1980-2009",RomneysBainer,2013-02-06 01:30:42,http://felonvoting.procon.org/view.resource.php?resourceID=004353,https://www.reddit.com/r/dataisbeautiful/comments/17yyoz/jail_prison_parole_and_probation_populations_in/,11,11,0,5,"Jail, Prison, Parole, and Probation Populations in the US, 1980-2009",2013-02-0018.jpg,none,none
A history of the world in 100 seconds using geogaphical coordinates of historical events.,mollyak_x,2013-02-07 18:36:03,http://www.ragtag.info/2011/feb/2/history-world-100-seconds/,https://www.reddit.com/r/dataisbeautiful/comments/182tps/a_history_of_the_world_in_100_seconds_using/,37,37,0,7,A history of the world in 100 seconds using geogaphical coordinates of historical events.,2013-02-0022.jpg,none,none
The Motley Roots of Data Visualization in 19th Century Census Charts,irregardless,2013-02-09 15:03:04,http://www.theatlanticcities.com/design/2013/01/motley-roots-data-visualization-19th-century-census-charts/4500/,https://www.reddit.com/r/dataisbeautiful/comments/186z8x/the_motley_roots_of_data_visualization_in_19th/,32,32,0,2,The Motley Roots of Data Visualization in 19th Century Census Charts,2013-02-0033.jpg,none,"census, data visualization, history"
"The Storm's Tally: snowfall, incidents, and customers without power, from the New England blizzard",Epistaxis,2013-02-10 15:06:29,http://www.nytimes.com/interactive/2013/02/09/nyregion/the-storms-tally.html,https://www.reddit.com/r/dataisbeautiful/comments/188xvd/the_storms_tally_snowfall_incidents_and_customers/,19,19,0,2,"The Storm's Tally snowfall, incidents, and customers without power, from the New England blizzard",2013-02-0037.jpg,none,none
"Not necessarily beautiful, but certainly useful today",Vermilious,2013-02-11 16:58:16,http://en.wikipedia.org/wiki/List_of_popes_(graphical),https://www.reddit.com/r/dataisbeautiful/comments/18bej9/not_necessarily_beautiful_but_certainly_useful/,17,17,0,3,"Not necessarily beautiful, but certainly useful today",2013-02-0042.jpg,none,"papacy, history, religion"
The State of our Union is … dumber: How the linguistic standard of the presidential address has declined,KarmaAgent,2013-02-12 21:47:42,http://www.guardian.co.uk/world/interactive/2013/feb/12/state-of-the-union-reading-level,https://www.reddit.com/r/dataisbeautiful/comments/18ehg9/the_state_of_our_union_is_dumber_how_the/,92,92,0,28,The State of our Union is … dumber How the linguistic standard of the presidential address has declined,2013-02-0047.jpg,none,none
Nova | Earth From Space - Fantastic visualizations of satellite data,master_luke,2013-02-14 03:42:04,http://www.pbs.org/wgbh/nova/space/earth-from-space.html,https://www.reddit.com/r/dataisbeautiful/comments/18hpz6/nova_earth_from_space_fantastic_visualizations_of/,8,8,0,0,Nova Earth From Space - Fantastic visualizations of satellite data,2013-02-0053.jpg,none,"space, earth, satellite, visualization"
Interactive gas price map for  the United States,CaffeinatedGuy,2013-02-14 04:02:21,http://gasbuddy.com/gb_gastemperaturemap.aspx,https://www.reddit.com/r/dataisbeautiful/comments/18hr80/interactive_gas_price_map_for_the_united_states/,6,6,0,1,Interactive gas price map for the United States,2013-02-0054.jpg,none,"gas prices, united states, mobile app, transportation"
Very detailed map about Swiss internet broadband and high definition television access from its Federal Office of Communications.,I_am_Legend______ARY,2013-02-14 18:05:16,http://map.geo.admin.ch/?topic=nga,https://www.reddit.com/r/dataisbeautiful/comments/18iz14/very_detailed_map_about_swiss_internet_broadband/,7,7,0,2,Very detailed map about Swiss internet broadband and high definition television access from its Federal Office of Communications.,2013-02-0059.jpg,none,"switzerland, internet, broadband, television, communications, access"
Visualizing App Connections as a Related Web of Icons,makeshifthoop,2013-02-14 23:40:05,https://appstorerankings.net/node/discover-new-apps-for-iphone-and-ipad.html,https://www.reddit.com/r/dataisbeautiful/comments/18jqq5/visualizing_app_connections_as_a_related_web_of/,2,2,0,0,Visualizing App Connections as a Related Web of Icons,2013-02-0063.jpg,none,none
"Deep Inside: A Study of 10,000 Porn Stars and Their Careers",fala2000,2013-02-15 12:14:48,http://jonmillward.com/blog/studies/deep-inside-a-study-of-10000-porn-stars/,https://www.reddit.com/r/dataisbeautiful/comments/18kt26/deep_inside_a_study_of_10000_porn_stars_and_their/,159,159,0,14,"Deep Inside A Study of 10,000 Porn Stars and Their Careers",2013-02-0064.jpg,none,"adult industry, careers, demographics, film credits"
Map of International Plane Routes,mscroggs,2013-02-15 19:20:31,http://planefinder.net/route/ORD/,https://www.reddit.com/r/dataisbeautiful/comments/18lg0y/map_of_international_plane_routes/,15,15,0,1,Map of International Plane Routes,2013-02-0067.jpg,none,"transportation, aviation, travel, routes, global"
Crunching the Numbers on Love,fstorino,2013-02-16 00:09:49,http://www.freakonomics.com/2013/02/14/crunching-the-numbers-on-love/,https://www.reddit.com/r/dataisbeautiful/comments/18lzxi/crunching_the_numbers_on_love/,0,0,0,0,Crunching the Numbers on Love,2013-02-0069.jpg,none,"relationships, data analysis, love"
An Interactive Analysis of Tolkien's Works [OC],stenkall,2013-02-16 21:53:24,http://lotrproject.com/statistics/books/,https://www.reddit.com/r/dataisbeautiful/comments/18np26/an_interactive_analysis_of_tolkiens_works_oc/,119,119,0,1,An Interactive Analysis of Tolkien's Works OC,2013-02-0074.jpg,none,"tolkien, literature, analysis"
Every meteorite fall on earth mapped,unquietwiki,2013-02-16 23:58:10,http://www.guardian.co.uk/news/datablog/interactive/2013/feb/15/meteorite-fall-map?intcmp=239,https://www.reddit.com/r/dataisbeautiful/comments/18nww0/every_meteorite_fall_on_earth_mapped/,130,130,0,30,Every meteorite fall on earth mapped,2013-02-0075.jpg,none,none
Interact and generate your digital art on Silk,healthanalyst,2013-02-18 06:15:54,http://new.weavesilk.com/,https://www.reddit.com/r/dataisbeautiful/comments/18qk67/interact_and_generate_your_digital_art_on_silk/,0,0,0,1,Interact and generate your digital art on Silk,2013-02-0080.jpg,none,"digital art, interaction, creativity"
Visualizing the Structure of Trailers for Oscar-nominated Films (Dissecting a Trailer),anhydrous1,2013-02-19 20:28:35,http://www.nytimes.com/interactive/2013/02/19/movies/awardsseason/oscar-trailers.html,https://www.reddit.com/r/dataisbeautiful/comments/18u6r7/visualizing_the_structure_of_trailers_for/,25,25,0,0,Visualizing the Structure of Trailers for Oscar-nominated Films (Dissecting a Trailer),2013-02-0084.jpg,none,none
U.S. overlaid on the Moon for a sense of scale,telnet_reddit_80,2013-02-19 21:58:19,http://flowingdata.com/2013/02/19/united-states-overlaid-on-the-moon-for-a-sense-of-scale/,https://www.reddit.com/r/dataisbeautiful/comments/18ue2t/us_overlaid_on_the_moon_for_a_sense_of_scale/,18,18,0,2,U.S. overlaid on the Moon for a sense of scale,2013-02-0085.jpg,none,"space, geography, scale, u.s., moon"
The Geography of Happiness According to 10 Million Tweets - Alexis C. Madrigal,shankapotomus007,2013-02-19 22:16:53,http://www.theatlantic.com/technology/archive/2013/02/the-geography-of-happiness-according-to-10-million-tweets/273286/#,https://www.reddit.com/r/dataisbeautiful/comments/18ufkn/the_geography_of_happiness_according_to_10/,14,14,0,3,The Geography of Happiness According to 10 Million Tweets - Alexis C. Madrigal,2013-02-0086.jpg,none,none
Obesity worldwide: the map of the world's weight | The Guardian DataBlog,healthanalyst,2013-02-20 05:01:38,http://www.guardian.co.uk/news/datablog/interactive/2013/feb/19/obesity-map-of-world-weight,https://www.reddit.com/r/dataisbeautiful/comments/18vatz/obesity_worldwide_the_map_of_the_worlds_weight/,13,13,0,4,Obesity worldwide the map of the world's weight The Guardian DataBlog,2013-02-0087.jpg,none,none
"An infographic showing when fruits, vegetables and herbs are in season.",Anansian,2013-02-20 18:25:20,http://exp.lore.com/post/25597306333/absolutely-gorgeous-minimalist-infographics-of,https://www.reddit.com/r/dataisbeautiful/comments/18wdpm/an_infographic_showing_when_fruits_vegetables_and/,32,32,0,2,"An infographic showing when fruits, vegetables and herbs are in season.",2013-02-0089.jpg,none,none
"UK Flood Map, Live Data",Shoothill,2013-02-21 14:15:57,http://www.shoothill.com/flood,https://www.reddit.com/r/dataisbeautiful/comments/18ycx0/uk_flood_map_live_data/,6,6,0,0,"UK Flood Map, Live Data",2013-02-0092.jpg,none,none
Twitter's languages of New York mapped,hokiebeer,2013-02-21 17:40:32,http://www.guardian.co.uk/news/datablog/interactive/2013/feb/21/twitter-languages-new-york-mapped?CMP=twt_gu,https://www.reddit.com/r/dataisbeautiful/comments/18yqhr/twitters_languages_of_new_york_mapped/,2,2,0,0,Twitter's languages of New York mapped,2013-02-0094.jpg,none,none
Analysing Languages in the New York Twittersphere,MattHardwick,2013-02-22 09:00:57,http://urbanmovements.posterous.com/analysing-languages-in-the-new-york-twittersp,https://www.reddit.com/r/dataisbeautiful/comments/190h4j/analysing_languages_in_the_new_york_twittersphere/,40,40,0,2,Analysing Languages in the New York Twittersphere,2013-02-0096.jpg,none,none
All the Harry Potter frames from all the movies condensed into one picture. (xpost from /r/movies),IsItManOrMonster,2013-02-24 07:08:14,http://i.imgur.com/GpflOmx.jpg,https://www.reddit.com/r/dataisbeautiful/comments/194gmp/all_the_harry_potter_frames_from_all_the_movies/,458,458,0,111,All the Harry Potter frames from all the movies condensed into one picture. (xpost from rmovies),2013-02-0098.jpg,none,"movies, harry potter, film, visual art"
Refugee Influx Threatens Balance in Lebanon - Graphic,healthanalyst,2013-02-24 20:03:16,http://www.nytimes.com/interactive/2013/02/23/world/middleeast/Refugee-Influx-Threatens-Balance-in-Lebanon.html,https://www.reddit.com/r/dataisbeautiful/comments/195auv/refugee_influx_threatens_balance_in_lebanon/,14,14,0,0,Refugee Influx Threatens Balance in Lebanon - Graphic,2013-02-0100.jpg,none,"refugees, lebanon, demographics, migration, geography"
Platform data collected from Unity's editor and web player over a few years.,toastb0x,2013-02-24 21:27:59,http://stats.unity3d.com/web/index-mac.html,https://www.reddit.com/r/dataisbeautiful/comments/195gw6/platform_data_collected_from_unitys_editor_and/,5,5,0,1,Platform data collected from Unity's editor and web player over a few years.,2013-02-0101.jpg,none,"gaming, unity"
Maps & data of useless but interesting data,cruzdre,2013-02-25 01:44:49,http://www.buzzfeed.com/awesomer/maps-you-never-knew-you-needed?dummy=1,https://www.reddit.com/r/dataisbeautiful/comments/195ymp/maps_data_of_useless_but_interesting_data/,41,41,0,11,Maps & data of useless but interesting data,2013-02-0103.jpg,none,"maps, data, geography, interesting facts"
"Gun laws in the US, state by state [interactive visualization]",Pun_isher,2013-02-26 22:08:08,http://www.guardian.co.uk/world/interactive/2013/jan/15/gun-laws-united-states,https://www.reddit.com/r/dataisbeautiful/comments/19aabv/gun_laws_in_the_us_state_by_state_interactive/,278,278,0,123,"Gun laws in the US, state by state interactive visualization",2013-02-0105.jpg,none,none
"Global view of warming temperatures, let’s you see how things have changed over time in a location of your choosing | New Scientist",healthanalyst,2013-02-27 01:27:42,http://warmingworld.newscientistapps.com/,https://www.reddit.com/r/dataisbeautiful/comments/19aq39/global_view_of_warming_temperatures_lets_you_see/,4,4,0,0,"Global view of warming temperatures, let’s you see how things have changed over time in a location of your choosing New Scientist",2013-02-0111.jpg,none,none
Here's What Beer Costs In Every NBA Arena,whiskeydeltatango,2013-02-27 19:36:51,http://www.businessinsider.com/the-most-expensive-beer-in-the-nba-is-sold-by-the-knicks-and-suns-sports-chart-of-the-day-2013-2,https://www.reddit.com/r/dataisbeautiful/comments/19cfn3/heres_what_beer_costs_in_every_nba_arena/,0,0,0,1,Here's What Beer Costs In Every NBA Arena,2013-02-0112.jpg,none,none
Hockey Day Across America 2013,Ananke123,2013-02-27 20:39:08,http://robbsdatavizgallery.blogspot.com/2013/02/hockey-day-across-america-2013.html,https://www.reddit.com/r/dataisbeautiful/comments/19cku6/hockey_day_across_america_2013/,2,2,0,0,Hockey Day Across America 2013,2013-02-0113.jpg,none,"hockey, sports, america, events, 2013"
"[OC] Looking at the reading grade level for every episode of Star Trek, and its slow decline after about 1995",jradavenport,2013-02-28 16:27:38,http://www.ifweassume.com/2013/02/stat-trek-ii-wrath-of-cant.html,https://www.reddit.com/r/dataisbeautiful/comments/19ehp7/oc_looking_at_the_reading_grade_level_for_every/,185,185,0,29,"OC Looking at the reading grade level for every episode of Star Trek, and its slow decline after about 1995",2013-02-0116.jpg,none,none
