title,author,created_date,url,full_permalink,score,ups,downs,num_comments,sanitized_title,image_file,chart_type,high_level_categories
"A (non-random) cohort analysis looking at when American high school students moved from ""one-strapping"" their backpacks to two-strapping.",yodatsracist,2013-11-01 17:55:09,http://www.slate.com/articles/life/cool_story/2013/10/two_straps_on_a_backpack_or_one_strap_what_s_cool.single.html,https://www.reddit.com/r/dataisbeautiful/comments/1pp8jw/a_nonrandom_cohort_analysis_looking_at_when/,29,29,0,5,A (non-random) cohort analysis looking at when American high school students moved from one-strapping their backpacks to two-strapping.,2013-11-0004.jpg,none,"education, fashion, cultural trends, backpacks, high school"
Server stability for video game Path of Exile: Before and after server fixes,Atrioventricular,2013-11-03 09:33:13,https://www.pathofexile.com/forum/view-thread/575351/page/1/#p5102694,https://www.reddit.com/r/dataisbeautiful/comments/1psv67/server_stability_for_video_game_path_of_exile/,36,36,0,9,Server stability for video game Path of Exile Before and after server fixes,2013-11-0010.jpg,none,"video games, path of exile, server stability"
"How the world is failing at its climate goals, in one giant chart",pnewell,2013-11-05 23:20:55,http://washingtonpost.com/blogs/wonkblog/wp/2013/11/05/how-the-world-is-failing-at-its-climate-goals-in-one-giant-chart/,https://www.reddit.com/r/dataisbeautiful/comments/1pzho9/how_the_world_is_failing_at_its_climate_goals_in/,24,24,0,3,"How the world is failing at its climate goals, in one giant chart",2013-11-0022.jpg,none,none
113 years of football player transfers in 60 seconds,andreasklinger,2013-11-06 20:31:23,http://www.11freunde.de/node/286917,https://www.reddit.com/r/dataisbeautiful/comments/1q1s7t/113_years_of_football_player_transfers_in_60/,13,13,0,1,113 years of football player transfers in 60 seconds,2013-11-0031.jpg,none,none
All soccer transfers since 1900 visualised. (x-post from r/soccer),effkay8,2013-11-07 07:27:02,http://vimeo.com/77775892,https://www.reddit.com/r/dataisbeautiful/comments/1q369r/all_soccer_transfers_since_1900_visualised_xpost/,20,20,0,0,All soccer transfers since 1900 visualised. (x-post from rsoccer),2013-11-0035.jpg,none,"soccer, sports, transfers, history"
100 different people playing a custom Super Mario Bros level [OC],Stabyourself,2013-11-07 10:18:50,http://i.imgur.com/0bSQEMF.png,https://www.reddit.com/r/dataisbeautiful/comments/1q3csw/100_different_people_playing_a_custom_super_mario/,2186,2186,0,124,100 different people playing a custom Super Mario Bros level OC,2013-11-0037.png,none,"video games, super mario bros, custom levels, gaming, entertainment"
Map of countries that are the most and least welcome to foreigners,Stan125,2013-11-07 15:15:37,http://www.washingtonpost.com/blogs/worldviews/wp/2013/03/21/a-fascinating-map-of-countries-color-coded-by-their-openness-to-foreigners/,https://www.reddit.com/r/dataisbeautiful/comments/1q3rni/map_of_countries_that_are_the_most_and_least/,7,7,0,2,Map of countries that are the most and least welcome to foreigners,2013-11-0039.jpg,none,none
"Haiyan- Category 5 super typhoon, with maximum sustained winds exceeding 160 mph [story in comments]",pnewell,2013-11-07 16:33:00,http://www.washingtonpost.com/blogs/capital-weather-gang/files/2013/11/rbtop0-haiyan.jpg,https://www.reddit.com/r/dataisbeautiful/comments/1q3y1d/haiyan_category_5_super_typhoon_with_maximum/,12,12,0,5,"Haiyan- Category 5 super typhoon, with maximum sustained winds exceeding 160 mph story in comments",2013-11-0041.jpg,none,"weather, typhoon, meteorology, natural disasters"
Interactive map: North American trade flows,Beaglesworth,2013-11-07 16:34:32,http://www.brookings.edu/research/interactives/2013/metro-north-america,https://www.reddit.com/r/dataisbeautiful/comments/1q3y5w/interactive_map_north_american_trade_flows/,13,13,0,0,Interactive map North American trade flows,2013-11-0042.jpg,none,none
Gender representation in videogames [OC] [crosspost from r/games],thevideogamesurvey,2013-11-08 13:52:03,http://imgur.com/a/Jvf4C?gallery,https://www.reddit.com/r/dataisbeautiful/comments/1q6c4a/gender_representation_in_videogames_oc_crosspost/,612,612,0,197,Gender representation in videogames OC crosspost from rgames,2013-11-0045.jpg,none,none
Distribution of NFL teams in a bag of Peanut Butter Snickers [OC],yellowjacketcoder,2013-11-09 03:32:20,http://imgur.com/FPBIFhZ,https://www.reddit.com/r/dataisbeautiful/comments/1q83ok/distribution_of_nfl_teams_in_a_bag_of_peanut/,750,750,0,93,Distribution of NFL teams in a bag of Peanut Butter Snickers OC,2013-11-0051.jpg,none,"candy, sports, nfl, distribution"
"Visualising the 979,498 British and Commonwealth war dead from First World War [OC]",purpleglory,2013-11-09 14:33:08,http://www.codehesive.com/commonwealthww1/,https://www.reddit.com/r/dataisbeautiful/comments/1q8v5s/visualising_the_979498_british_and_commonwealth/,504,504,0,33,"Visualising the 979,498 British and Commonwealth war dead from First World War OC",2013-11-0052.jpg,none,"history, military, world war i, british, commonwealth"
How NBA team salaries correlate to winning,Karmakameleeon,2013-11-09 22:38:46,http://www.basesandbaskets.com/2013/11/nba-salaries-vs-winning-games.html,https://www.reddit.com/r/dataisbeautiful/comments/1q9s1e/how_nba_team_salaries_correlate_to_winning/,10,10,0,2,How NBA team salaries correlate to winning,2013-11-0054.jpg,none,"sports, basketball, nba, economics, salaries"
"NOAA Environmental Visualization Laboratory - Deep, Warm Water Fuels Haiyan Intensification",pnewell,2013-11-10 00:31:02,http://www.nnvl.noaa.gov/MediaDetail2.php?MediaID=1452&MediaTypeID=1,https://www.reddit.com/r/dataisbeautiful/comments/1q9zv9/noaa_environmental_visualization_laboratory_deep/,8,8,0,2,"NOAA Environmental Visualization Laboratory - Deep, Warm Water Fuels Haiyan Intensification",2013-11-0055.jpg,none,"weather, environment, climate, hurricanes, noaa"
The rise of the South: changes to state and regional Congressional delegations over time,Beaglesworth,2013-11-10 01:47:51,http://www.brookings.edu/research/interactives/2013/congressional-apportionment-by-region,https://www.reddit.com/r/dataisbeautiful/comments/1qa4zo/the_rise_of_the_south_changes_to_state_and/,50,50,0,6,The rise of the South changes to state and regional Congressional delegations over time,2013-11-0056.jpg,none,none
Etymology maps,NeonAardvark,2013-11-14 13:48:24,http://www.theguardian.com/news/datablog/interactive/2013/nov/14/pain-in-the-ananas-etymology-maps,https://www.reddit.com/r/dataisbeautiful/comments/1qm32f/etymology_maps/,518,518,0,43,Etymology maps,2013-11-0083.jpg,none,"etymology, language, maps"
I took that Congressional gridlock/unity chart and made an interactive version going back to 1857 [OC],Beaglesworth,2013-11-14 16:30:38,http://bl.ocks.org/cingraham/7461221,https://www.reddit.com/r/dataisbeautiful/comments/1qmexa/i_took_that_congressional_gridlockunity_chart_and/,16,16,0,4,I took that Congressional gridlockunity chart and made an interactive version going back to 1857 OC,2013-11-0084.jpg,none,none
Business Insider: The Future of Digital,ElectroSauce,2013-11-14 19:49:02,http://read.bi/1e1jkDu,https://www.reddit.com/r/dataisbeautiful/comments/1qmwra/business_insider_the_future_of_digital/,0,0,0,0,Business Insider The Future of Digital,2013-11-0085.jpg,none,none
The 15 Most Popular US Cities for Millennials,newdecade1986,2013-11-14 20:12:37,http://www.theatlantic.com/business/archive/2013/11/the-15-most-popular-cities-for-millennials-dc-is-1/281480/,https://www.reddit.com/r/dataisbeautiful/comments/1qmyz9/the_15_most_popular_us_cities_for_millennials/,0,0,0,0,The 15 Most Popular US Cities for Millennials,2013-11-0086.jpg,none,none
Interactive chart: how skills affect income mobility,Beaglesworth,2013-11-16 17:53:12,http://www.brookings.edu/research/interactives/2013/income-mobility-and-education,https://www.reddit.com/r/dataisbeautiful/comments/1qrqmh/interactive_chart_how_skills_affect_income/,16,16,0,1,Interactive chart how skills affect income mobility,2013-11-0093.jpg,none,none
Social Network Analysis of countries' mutual and opposing positions in the Trans Pacific Partnership free-trade treaty's leaked secret negotiations,floatrock,2013-11-19 06:13:05,http://www.washingtonpost.com/blogs/monkey-cage/wp/2013/11/18/the-united-states-is-isolated-in-the-trans-pacific-partnership-negotiations/,https://www.reddit.com/r/dataisbeautiful/comments/1qykam/social_network_analysis_of_countries_mutual_and/,6,6,0,0,Social Network Analysis of countries' mutual and opposing positions in the Trans Pacific Partnership free-trade treaty's leaked secret negotiations,2013-11-0101.jpg,none,none
"Here's Waldo: Waldo's location in all seven books, on one scatter plot",NickDouglas,2013-11-19 16:42:33,http://www.slate.com/articles/arts/culturebox/2013/11/where_s_waldo_a_new_strategy_for_locating_the_missing_man_in_martin_hanford.html,https://www.reddit.com/r/dataisbeautiful/comments/1qzibi/heres_waldo_waldos_location_in_all_seven_books_on/,1066,1066,0,81,"Here's Waldo Waldo's location in all seven books, on one scatter plot",2013-11-0102.jpg,none,none
A* Path-Finding a la Super Mario,shaggorama,2013-11-20 16:30:32,http://www.youtube.com/watch?v=DlkMs4ZHHr8,https://www.reddit.com/r/dataisbeautiful/comments/1r2fdc/a_pathfinding_a_la_super_mario/,664,664,0,81,A Path-Finding a la Super Mario,2013-11-0107.jpg,none,"gaming, algorithms, path-finding, super mario, ai"
BBC - Future - Science & Environment - Doctor Who: 50 years of time travel in the TARDIS,StuWard,2013-11-20 23:35:44,http://www.bbc.com/future/story/20131119-doctor-who-travels-through-time,https://www.reddit.com/r/dataisbeautiful/comments/1r3j0h/bbc_future_science_environment_doctor_who_50/,7,7,0,0,BBC - Future - Science & Environment - Doctor Who 50 years of time travel in the TARDIS,2013-11-0109.jpg,none,"science fiction, television, doctor who, entertainment, pop culture"
"Which fossil fuel companies are most responsible for climate change? – interactive. All but 7 of the 90 companies found to have caused the climate crisis deal in oil, gas and coal. Some of the top companies are also funding climate change denial campaigns",pnewell,2013-11-21 13:42:12,http://www.theguardian.com/environment/interactive/2013/nov/20/which-fossil-fuel-companies-responsible-climate-change-interactive,https://www.reddit.com/r/dataisbeautiful/comments/1r4yug/which_fossil_fuel_companies_are_most_responsible/,5,5,0,3,Which fossil fuel companies are most responsible for climate change – interactive. All but 7 of the 90 companies found to have caused the climate cris,2013-11-0114.jpg,none,none
All Deaths in Game of Thrones [*quantitative spoilers* credit to /u/ma_petite_choufleur],ForScale,2013-11-21 13:52:29,http://i.imgur.com/X5JznsJ.jpg,https://www.reddit.com/r/dataisbeautiful/comments/1r4zfs/all_deaths_in_game_of_thrones_quantitative/,14,14,0,10,All Deaths in Game of Thrones quantitative spoilers credit to uma_petite_choufleur,2013-11-0115.jpg,none,"game of thrones, literature, books, deaths"
"Track the anonymous money that has flowed through an expanding network of ""political nonprofits"" into elections around the country since 2008. [OC]",opensecrets,2013-11-21 18:44:09,http://www.opensecrets.org/outsidespending/nonprof_growth.php,https://www.reddit.com/r/dataisbeautiful/comments/1r5ndc/track_the_anonymous_money_that_has_flowed_through/,3,3,0,0,Track the anonymous money that has flowed through an expanding network of political nonprofits into elections around the country since 2008. OC,2013-11-0120.jpg,none,none
Watch economic insecurity spread like a virus over a quarter-century [The Washington Post],Karmakameleeon,2013-11-22 05:42:54,http://www.washingtonpost.com/blogs/govbeat/wp/2013/11/21/watch-economic-insecurity-spread-like-a-virus-over-a-quarter-century/?tid=sm_fb,https://www.reddit.com/r/dataisbeautiful/comments/1r77ck/watch_economic_insecurity_spread_like_a_virus/,16,16,0,0,Watch economic insecurity spread like a virus over a quarter-century The Washington Post,2013-11-0125.jpg,none,none
Favorite Thanksgiving foods by US state,slmatcw,2013-11-22 16:51:03,http://www.computerworld.com/s/article/9244204/Big_data_meets_Thanksgiving,https://www.reddit.com/r/dataisbeautiful/comments/1r85zb/favorite_thanksgiving_foods_by_us_state/,23,23,0,4,Favorite Thanksgiving foods by US state,2013-11-0127.jpg,none,none
"Time warner is dying - stats to prove it, hurray!",SirGrumbleBear,2013-11-24 17:31:49,http://www.reddit.com/r/dataisbeautiful/comments/1rcvsw/time_warner_is_dying_stats_to_prove_it_hurray/,https://www.reddit.com/r/dataisbeautiful/comments/1rcvsw/time_warner_is_dying_stats_to_prove_it_hurray/,171,171,0,22,"Time warner is dying - stats to prove it, hurray!",2013-11-0138.jpg,none,"media, television, entertainment, trends"
BBC News - Scotland in numbers,c3aye,2013-11-26 11:37:24,http://www.bbc.co.uk/news/uk-scotland-24866266,https://www.reddit.com/r/dataisbeautiful/comments/1rhn0n/bbc_news_scotland_in_numbers/,61,61,0,0,BBC News - Scotland in numbers,2013-11-0150.jpg,none,none
Property Taxes and Home Values by US County,sammyj75,2013-11-26 15:41:41,http://www.brookings.edu/research/interactives/2013/county-property-taxes-map,https://www.reddit.com/r/dataisbeautiful/comments/1ri0eg/property_taxes_and_home_values_by_us_county/,578,578,0,125,Property Taxes and Home Values by US County,2013-11-0151.jpg,none,none
The Anchorman Universe (Graph Viz),udfalkso,2013-11-26 23:47:06,http://iknow.io/insight/challenge-find-a-better-comedy-seeder-than-anchorman-49/,https://www.reddit.com/r/dataisbeautiful/comments/1rj7j3/the_anchorman_universe_graph_viz/,5,5,0,3,The Anchorman Universe (Graph Viz),2013-11-0154.jpg,none,"movies, entertainment, comedy"
"Global breast cancer incidence and mortality, based on development status of countries",elitist_cantabrigian,2013-11-27 13:53:23,http://www.nytimes.com/interactive/2013/10/15/health/where-is-breast-cancer.html,https://www.reddit.com/r/dataisbeautiful/comments/1rkkgp/global_breast_cancer_incidence_and_mortality/,20,20,0,3,"Global breast cancer incidence and mortality, based on development status of countries",2013-11-0157.jpg,none,none
Real-time visualisation of orders on shopify,zlz,2013-11-29 20:58:12,http://incoming.shopify.com/,https://www.reddit.com/r/dataisbeautiful/comments/1rqc6s/realtime_visualisation_of_orders_on_shopify/,48,48,0,0,Real-time visualisation of orders on shopify,2013-11-0163.jpg,none,"e-commerce, shopify, real-time, orders"
Another kind of data: a visual representation of Bach's Toccata and Fugue in D minor by Musanim,will_upvote_anything,2013-11-30 16:30:14,http://www.youtube.com/watch?v=ipzR9bhei_o,https://www.reddit.com/r/dataisbeautiful/comments/1rs1yk/another_kind_of_data_a_visual_representation_of/,157,157,0,18,Another kind of data a visual representation of Bach's Toccata and Fugue in D minor by Musanim,2013-11-0165.jpg,none,"music, bach, visual representation, classical music, toccata and fugue"
