title,author,created_date,url,full_permalink,score,ups,downs,num_comments,sanitized_title,image_file,chart_type,high_level_categories
Council on Foreign Relations' Invisible Armies Insurgency Tracker,davidystephenson,2013-05-01 14:14:39,http://www.cfr.org/wars-and-warfare/invisible-armies-insurgency-tracker/p29917?cid=emc-situation_report_pitch-insurgency_tracker-043013,https://www.reddit.com/r/dataisbeautiful/comments/1dhcji/council_on_foreign_relations_invisible_armies/,10,10,0,0,Council on Foreign Relations' Invisible Armies Insurgency Tracker,2013-05-0001.jpg,none,"politics, foreign relations, insurgency, global affairs"
Large collection of beautiful visualised data,martinmcflyjr,2013-05-01 14:38:38,http://www.stamen.com/,https://www.reddit.com/r/dataisbeautiful/comments/1dhe34/large_collection_of_beautiful_visualised_data/,25,25,0,0,Large collection of beautiful visualised data,2013-05-0002.jpg,none,"communication, meetings, video conferencing"
"Too often, people make simple charts hard to read by using software defaults and not thinking about reader needs. Here's one simple fix that can better represent the data and make it easier to read.",nothingtolookat,2013-05-02 18:19:02,http://www.allanalytics.com/author.asp?section_id=3072&doc_id=262539&,https://www.reddit.com/r/dataisbeautiful/comments/1dkd76/too_often_people_make_simple_charts_hard_to_read/,14,14,0,0,"Too often, people make simple charts hard to read by using software defaults and not thinking about reader needs. Here's one simple fix that can bette",2013-05-0008.jpg,none,none
The world in the last 200 years,Paracelse,2013-05-02 23:45:27,http://www.youtube.com/watch?v=e8OEuj6-pVg,https://www.reddit.com/r/dataisbeautiful/comments/1dl3bt/the_world_in_the_last_200_years/,14,14,0,3,The world in the last 200 years,2013-05-0011.jpg,none,"history, world, countries, geopolitics"
Animated global income distribution projections to 2030,Beaglesworth,2013-05-03 15:04:18,http://www.brookings.edu/research/interactives/2013/ending-extreme-poverty#poverty_line,https://www.reddit.com/r/dataisbeautiful/comments/1dmeih/animated_global_income_distribution_projections/,128,128,0,12,Animated global income distribution projections to 2030,2013-05-0014.jpg,none,none
Video of all Earthquakes from 01/01/2010 to 05/01/2013 in Japan,BullBoxerBAB,2013-05-03 22:05:57,http://www.youtube.com/watch?v=UOo7EnBYxps,https://www.reddit.com/r/dataisbeautiful/comments/1dn9au/video_of_all_earthquakes_from_01012010_to/,33,33,0,12,Video of all Earthquakes from 01012010 to 05012013 in Japan,2013-05-0016.jpg,none,"earthquakes, japan, natural disasters, geography, seismology"
Stress Analysis data shown on a 3d printed model (x-post /r/3dprinting),peeloo,2013-05-05 11:36:05,http://i.imgur.com/HcAN0lO.jpg,https://www.reddit.com/r/dataisbeautiful/comments/1dq77r/stress_analysis_data_shown_on_a_3d_printed_model/,1429,1429,0,43,Stress Analysis data shown on a 3d printed model (x-post r3dprinting),2013-05-0018.jpg,none,"stress analysis, 3d printing, engineering"
Number of films shot in each state [OC],Zacoppotamus,2013-05-06 12:10:06,https://github.com/zacoppotamus/MovieVisualization,https://www.reddit.com/r/dataisbeautiful/comments/1dsdgl/number_of_films_shot_in_each_state_oc/,64,64,0,16,Number of films shot in each state OC,2013-05-0021.jpg,none,none
Food Stamps Recipients by County (interactive map),terrortot,2013-05-06 14:12:42,http://www.slate.com/articles/news_and_politics/map_of_the_week/2013/04/food_stamp_recipients_by_county_an_interactive_tool_showing_local_snap_data.html,https://www.reddit.com/r/dataisbeautiful/comments/1dsjlv/food_stamps_recipients_by_county_interactive_map/,21,21,0,2,Food Stamps Recipients by County (interactive map),2013-05-0022.jpg,none,none
Random walk I made with non-uniform distribution. 2000 walkers for 10000 steps.,superlaser1,2013-05-06 22:16:24,http://imgur.com/a/cpYZp,https://www.reddit.com/r/dataisbeautiful/comments/1dtksl/random_walk_i_made_with_nonuniform_distribution/,5,5,0,5,Random walk I made with non-uniform distribution. 2000 walkers for 10000 steps.,2013-05-0028.jpg,none,"random walk, simulation, probability, mathematics"
3D visualization of our 100 000 closest stars.,lazyink,2013-05-07 14:37:07,http://workshop.chromeexperiments.com/stars/??fsrc=scn/=tw/dc,https://www.reddit.com/r/dataisbeautiful/comments/1dv36k/3d_visualization_of_our_100_000_closest_stars/,915,915,0,97,3D visualization of our 100 000 closest stars.,2013-05-0031.jpg,none,"astronomy, stars, space, 3d visualization"
How to go viral: Gangnam Style and The Harlem Shake Twitter influences compared. Pretty.,Pupmup,2013-05-07 17:25:38,http://www.guardian.co.uk/news/datablog/interactive/2013/may/07/how-to-go-viral-gangnam-style-harlem-shake?utm_source=twitterfeed&utm_medium=twitter,https://www.reddit.com/r/dataisbeautiful/comments/1dvftl/how_to_go_viral_gangnam_style_and_the_harlem/,7,7,0,0,How to go viral Gangnam Style and The Harlem Shake Twitter influences compared. Pretty.,2013-05-0032.jpg,none,none
"What different sorting algorithms sound like [video, 1:30]",eucalyptustree,2013-05-08 12:37:30,http://www.youtube.com/watch?v=t8g-iYGHpEA,https://www.reddit.com/r/dataisbeautiful/comments/1dxf8s/what_different_sorting_algorithms_sound_like/,39,39,0,2,"What different sorting algorithms sound like video, 130",2013-05-0038.jpg,none,"algorithms, sorting, sound, visualization"
Boston Among the Most Segregated City in America,Nahtanos,2013-05-08 21:03:31,http://blackstonian.com/info/2013/05/business-insider-names-boston-among-the-most-segregated-cities-in-america/,https://www.reddit.com/r/dataisbeautiful/comments/1dyfz5/boston_among_the_most_segregated_city_in_america/,5,5,0,1,Boston Among the Most Segregated City in America,2013-05-0041.jpg,none,"segregation, demographics, urban studies, usa, cities"
TV Show Rankings Over Time,TannerLD,2013-05-08 23:27:38,http://glimmer.rstudio.com/pssguy/TVShowRatings/,https://www.reddit.com/r/dataisbeautiful/comments/1dyrfr/tv_show_rankings_over_time/,4,4,0,0,TV Show Rankings Over Time,2013-05-0043.jpg,none,none
square meter price for Paris apartment for each subway station,233C,2013-05-09 11:38:26,http://www.meilleursagents.com/prix-immobilier/metro-paris/,https://www.reddit.com/r/dataisbeautiful/comments/1dzue2/square_meter_price_for_paris_apartment_for_each/,23,23,0,2,square meter price for Paris apartment for each subway station,2013-05-0044.jpg,none,none
The fall of AOL dial up and the rise of Netflix streaming video,newDieTacos,2013-05-09 13:22:04,http://www.splatf.com/2013/05/aol-netflix-chart/,https://www.reddit.com/r/dataisbeautiful/comments/1dzz4o/the_fall_of_aol_dial_up_and_the_rise_of_netflix/,69,69,0,5,The fall of AOL dial up and the rise of Netflix streaming video,2013-05-0045.jpg,none,none
A Time-Lapse Map of Every Nuclear Explosion Since 1945 - by Isao Hashimoto,righteousmoss,2013-05-09 13:46:23,http://www.youtube.com/watch?v=LLCF7vPanrY,https://www.reddit.com/r/dataisbeautiful/comments/1e00ko/a_timelapse_map_of_every_nuclear_explosion_since/,202,202,0,59,A Time-Lapse Map of Every Nuclear Explosion Since 1945 - by Isao Hashimoto,2013-05-0046.jpg,none,"nuclear, explosions, history, military, global events, geography"
Google Flu Trends | United States,julian88888888,2013-05-09 14:20:28,http://www.google.org/flutrends/us/#US,https://www.reddit.com/r/dataisbeautiful/comments/1e02ru/google_flu_trends_united_states/,3,3,0,1,Google Flu Trends United States,2013-05-0048.jpg,none,none
"A Century of Cicadas: 137 Years, 23 Broods",Beaglesworth,2013-05-09 14:58:45,http://www.nytimes.com/interactive/science/a-century-of-cicadas.html,https://www.reddit.com/r/dataisbeautiful/comments/1e05d2/a_century_of_cicadas_137_years_23_broods/,70,70,0,3,"A Century of Cicadas 137 Years, 23 Broods",2013-05-0049.jpg,none,none
The Art of Data Visualization | PBS [7:45],Zephyr42,2013-05-09 17:50:52,http://youtu.be/AdSZJzb-aX8,https://www.reddit.com/r/dataisbeautiful/comments/1e0ig2/the_art_of_data_visualization_pbs_745/,8,8,0,0,The Art of Data Visualization PBS 745,2013-05-0051.jpg,none,"data visualization, art, pbs"
"Geographic distribution of the mortgage interest deduction, by state and zip code",Beaglesworth,2013-05-10 00:51:48,http://www.pewstates.org/research/data-visualizations/the-geographic-distribution-of-the-mortgage-interest-deduction-85899469379,https://www.reddit.com/r/dataisbeautiful/comments/1e1f4e/geographic_distribution_of_the_mortgage_interest/,3,3,0,0,"Geographic distribution of the mortgage interest deduction, by state and zip code",2013-05-0055.jpg,none,none
Counterfeit vs. Genuine iPhone charger voltage output (full article in comments),large-farva,2013-05-10 12:53:05,http://imgur.com/a/4i8Ti#0,https://www.reddit.com/r/dataisbeautiful/comments/1e2djb/counterfeit_vs_genuine_iphone_charger_voltage/,111,111,0,16,Counterfeit vs. Genuine iPhone charger voltage output (full article in comments),2013-05-0058.jpg,none,"electronics, chargers, voltage, counterfeit products, technology"
Keeling Curve - graph shows how much CO2 human activities have released into the atmosphere,murk_merchant,2013-05-10 18:11:14,http://www.guardian.co.uk/environment/interactive/2013/may/10/climate-warming-gas-carbon-dioxide-levels-interactive,https://www.reddit.com/r/dataisbeautiful/comments/1e2yqw/keeling_curve_graph_shows_how_much_co2_human/,0,0,0,0,Keeling Curve - graph shows how much CO2 human activities have released into the atmosphere,2013-05-0062.jpg,none,none
Mapping hate speech: homophobia and racism on twitter,jamestown112,2013-05-10 18:32:52,http://www.guardian.co.uk/news/datablog/interactive/2013/may/10/twitter-geography-hate-racism-homophobia,https://www.reddit.com/r/dataisbeautiful/comments/1e30e7/mapping_hate_speech_homophobia_and_racism_on/,27,27,0,11,Mapping hate speech homophobia and racism on twitter,2013-05-0063.jpg,none,none
Flavour network,nxpnsv,2013-05-10 20:31:02,http://www.flavourjournal.com/content/2/1/4/figure/F1?highres=y,https://www.reddit.com/r/dataisbeautiful/comments/1e3991/flavour_network/,17,17,0,1,Flavour network,2013-05-0064.jpg,none,none
The Hopometer - Visualising beer strength and bitterness,Ananke123,2013-05-12 16:04:04,http://paintbynumbersblog.blogspot.co.uk/2013/05/the-hopometer-visualising-beer-strength.html,https://www.reddit.com/r/dataisbeautiful/comments/1e6ruz/the_hopometer_visualising_beer_strength_and/,9,9,0,2,The Hopometer - Visualising beer strength and bitterness,2013-05-0069.jpg,none,"beer, strength, bitterness, beverages"
Dialect Map Of U.S. Shows How Americans Speak By Region,average_gilbert,2013-05-13 14:56:14,http://www.huffingtonpost.com/2013/05/09/dialect-map-of-the-us-region-aschmann_n_3245496.html?utm_hp_ref=fb&ir=Books&src=sp&comm_ref=false,https://www.reddit.com/r/dataisbeautiful/comments/1e8w7i/dialect_map_of_us_shows_how_americans_speak_by/,11,11,0,6,Dialect Map Of U.S. Shows How Americans Speak By Region,2013-05-0072.jpg,none,none
Clustering analysis of scientific paper citations shows formation and establishment of neuroscience as a new field over the last decade.,LesTP,2013-05-13 15:32:42,http://imgur.com/Q5IMyBt,https://www.reddit.com/r/dataisbeautiful/comments/1e8yoi/clustering_analysis_of_scientific_paper_citations/,615,615,0,36,Clustering analysis of scientific paper citations shows formation and establishment of neuroscience as a new field over the last decade.,2013-05-0073.jpg,none,none
Money on the Bench - visualizing amount paid to injured MLB players,nthitz,2013-05-14 01:26:52,http://www.nytimes.com/interactive/2013/05/13/sports/baseball/money-on-the-bench.html?_r=0,https://www.reddit.com/r/dataisbeautiful/comments/1eaa5o/money_on_the_bench_visualizing_amount_paid_to/,7,7,0,5,Money on the Bench - visualizing amount paid to injured MLB players,2013-05-0077.jpg,none,"baseball, sports, injuries, mlb, players"
Where the jobs are for young college grads? College-educated 20- to 30-year-olds hit metro areas in big numbers from 2006 to 2011. About 80% had jobs. Here are totals for 2011 and the percentage change from 2006,healthanalyst,2013-05-14 02:49:34,http://www.usatoday.com/story/news/nation/2013/05/11/college-grad-jobs-major-metros/2149915/,https://www.reddit.com/r/dataisbeautiful/comments/1eagms/where_the_jobs_are_for_young_college_grads/,0,0,0,1,Where the jobs are for young college grads College-educated 20- to 30-year-olds hit metro areas in big numbers from 2006 to 2011. About 80% had jobs.,2013-05-0078.jpg,none,none
An interactive visualization of which episodes recurring jokes in Arrested Development show up in,alilja,2013-05-15 04:43:56,http://recurringdevelopments.com,https://www.reddit.com/r/dataisbeautiful/comments/1ed5o6/an_interactive_visualization_of_which_episodes/,57,57,0,2,An interactive visualization of which episodes recurring jokes in Arrested Development show up in,2013-05-0080.jpg,none,"television, comedy, episodes, jokes, arrested development"
An interactive visualisation of running jokes in Arrested Development,tecumsehvalley,2013-05-15 14:16:17,http://recurringdevelopments.com/,https://www.reddit.com/r/dataisbeautiful/comments/1edswu/an_interactive_visualisation_of_running_jokes_in/,1,1,0,1,An interactive visualisation of running jokes in Arrested Development,2013-05-0081.jpg,none,"television, comedy, jokes, entertainment"
The evolution of the Firefox's code base.,Semaphor,2013-05-15 20:17:48,http://almossawi.com/firefox/,https://www.reddit.com/r/dataisbeautiful/comments/1eekm4/the_evolution_of_the_firefoxs_code_base/,13,13,0,4,The evolution of the Firefox's code base.,2013-05-0083.jpg,none,none
Gatsby Cannes buzz on twitter analyzed (french article).,seadeaf,2013-05-16 16:45:20,"http://www.telerama.fr/festival-de-cannes/2013/autopsie-d-un-buzz-gatsby-peut-remercier-cannes,97519.php?fb_action_ids=10152871201775604&fb_action_types=og.recommends&fb_source=other_multiline&action_object_map=%7B%2210152871201775604%22%3A447955311961679%7D&action_type_map=%7B%2210152871201775604%22%3A%22og.recommends%22%7D&action_ref_map=%5B%5D",https://www.reddit.com/r/dataisbeautiful/comments/1egju0/gatsby_cannes_buzz_on_twitter_analyzed_french/,16,16,0,0,Gatsby Cannes buzz on twitter analyzed (french article).,2013-05-0085.jpg,none,"social media, twitter, film, cannes, the great gatsby"
The Ultimate Spaceship Face-off: A highly speculative search for the fastest ship in science fiction.,jeweloree,2013-05-16 17:30:10,http://www.slate.com/articles/arts/map_of_the_week/2013/05/star_trek_enterprise_vs_star_wars_millennium_falcon_which_ship_is_fastest.html,https://www.reddit.com/r/dataisbeautiful/comments/1egn6i/the_ultimate_spaceship_faceoff_a_highly/,112,112,0,38,The Ultimate Spaceship Face-off A highly speculative search for the fastest ship in science fiction.,2013-05-0086.jpg,none,"science fiction, spaceships, comparison"
Changes in global life expectancy over the past 20 years,Beaglesworth,2013-05-17 20:32:31,http://blog.thomsonreuters.com/index.php/global-life-expectancy-graphic-of-the-day/,https://www.reddit.com/r/dataisbeautiful/comments/1ejf4y/changes_in_global_life_expectancy_over_the_past/,27,27,0,0,Changes in global life expectancy over the past 20 years,2013-05-0088.jpg,none,none
Perpetual Ocean: two years worth of surface currents from the ECCO2 model of global ocean and sea-ice,buildmonkey,2013-05-17 20:51:42,http://www.youtube.com/watch?gl=GB&client=mv-google&hl=en-GB&v=xusdWPuWAoU&nomobile=1,https://www.reddit.com/r/dataisbeautiful/comments/1ejghs/perpetual_ocean_two_years_worth_of_surface/,128,128,0,19,Perpetual Ocean two years worth of surface currents from the ECCO2 model of global ocean and sea-ice,2013-05-0089.jpg,none,"ocean, currents, global warming, sea-ice, climate science"
"Different take on running jokes in Arrested Development, this one from NPR [xpost from r/arresteddevelopment]",Beaglesworth,2013-05-17 22:12:40,http://apps.npr.org/arrested-development/,https://www.reddit.com/r/dataisbeautiful/comments/1ejm77/different_take_on_running_jokes_in_arrested/,299,299,0,19,"Different take on running jokes in Arrested Development, this one from NPR xpost from rarresteddevelopment",2013-05-0090.jpg,none,none
Graphing Parking: blog series that visualizes parking requirements for different land uses around the country,Pixelated_Penguin,2013-05-18 18:15:08,http://graphingparking.wordpress.com/,https://www.reddit.com/r/dataisbeautiful/comments/1el5l9/graphing_parking_blog_series_that_visualizes/,11,11,0,2,Graphing Parking blog series that visualizes parking requirements for different land uses around the country,2013-05-0092.jpg,none,"parking, land use, urban planning, transportation"
Interactive graph of the popularity of baby names from the 1880s to the present. Type in the first few letters of a name to see similar names and stats.,MonkfishPrincess,2013-05-19 16:59:41,http://www.babynamewizard.com/voyager#prefix=lav&ms=false&exact=false,https://www.reddit.com/r/dataisbeautiful/comments/1emzav/interactive_graph_of_the_popularity_of_baby_names/,28,28,0,10,Interactive graph of the popularity of baby names from the 1880s to the present. Type in the first few letters of a name to see similar names and stat,2013-05-0093.jpg,none,none
"The worlds best countries, apparently.",Kazaril,2013-05-20 06:53:51,http://www.thedailybeast.com/newsweek/2010/08/15/interactive-infographic-of-the-worlds-best-countries.html,https://www.reddit.com/r/dataisbeautiful/comments/1eojar/the_worlds_best_countries_apparently/,0,0,0,0,"The worlds best countries, apparently.",2013-05-0094.jpg,none,none
Visualization of the Persecution of the Bahá'í community in Iran,gagnonje5000,2013-05-20 19:35:17,http://threatwiki.thesentinelproject.org/iranvisualization,https://www.reddit.com/r/dataisbeautiful/comments/1epo85/visualization_of_the_persecution_of_the_baháí/,8,8,0,1,Visualization of the Persecution of the Bahá'í community in Iran,2013-05-0100.jpg,none,"persecution, bahá'í, iran, human rights, social issues"
Satellite map showing Oklahoma tornado damage with path of tornado overlaid.,error9900,2013-05-23 15:05:53,http://apps.npr.org/moore-oklahoma-tornado-damage/,https://www.reddit.com/r/dataisbeautiful/comments/1ewn4l/satellite_map_showing_oklahoma_tornado_damage/,296,296,0,34,Satellite map showing Oklahoma tornado damage with path of tornado overlaid.,2013-05-0109.jpg,none,"natural disasters, tornado, damage, oklahoma, satellite imagery"
Twisting & Turning on Tornado Data: Beth Schultz discusses several dataviz images and how they capture the Oklahoma city tornado data (or fail to).,nothingtolookat,2013-05-23 19:02:52,http://www.allanalytics.com/author.asp?section_id=1411&doc_id=263679&cid=amp_twt_es,https://www.reddit.com/r/dataisbeautiful/comments/1ex5cm/twisting_turning_on_tornado_data_beth_schultz/,1,1,0,0,Twisting & Turning on Tornado Data Beth Schultz discusses several dataviz images and how they capture the Oklahoma city tornado data (or fail to).,2013-05-0112.jpg,none,none
"Interactive aerial views of Moore, OK before/after Monday's EF-5 tornado",skewTlogP,2013-05-23 21:11:24,http://tmappsevents.esri.com/website/swipe_moore/,https://www.reddit.com/r/dataisbeautiful/comments/1exfyv/interactive_aerial_views_of_moore_ok_beforeafter/,14,14,0,0,"Interactive aerial views of Moore, OK beforeafter Monday's EF-5 tornado",2013-05-0113.jpg,none,"natural disasters, tornado, geography, moore ok, ef-5 tornado, aerial views"
Today's Front Pages,ioinc,2013-05-24 21:28:14,http://www.newseum.org/todaysfrontpages/flash/,https://www.reddit.com/r/dataisbeautiful/comments/1ezuk0/todays_front_pages/,5,5,0,0,Today's Front Pages,2013-05-0117.jpg,none,"freedom, first amendment, expression, rights"
"Mapping Dylan: Every street, town, and city that Bob Dylan has ever sung about",diogeneselpirata,2013-05-24 22:17:43,http://www.slate.com/articles/arts/map_of_the_week/2013/05/bob_dylan_map_every_place_mentioned_in_a_bob_dylan_song.html,https://www.reddit.com/r/dataisbeautiful/comments/1ezxw1/mapping_dylan_every_street_town_and_city_that_bob/,37,37,0,1,"Mapping Dylan Every street, town, and city that Bob Dylan has ever sung about",2013-05-0118.jpg,none,none
Bridge Collapses And Structurally Deficient Bridges Across The Country (INFOGRAPHIC),srtad,2013-05-25 00:35:38,http://www.huffingtonpost.com/2013/05/24/bridge-collapses-structurally-deficient-_n_3333649.html,https://www.reddit.com/r/dataisbeautiful/comments/1f06fx/bridge_collapses_and_structurally_deficient/,13,13,0,1,Bridge Collapses And Structurally Deficient Bridges Across The Country (INFOGRAPHIC),2013-05-0120.jpg,none,none
"Off the Charts: Under Obama, Stocks Do Better",Beaglesworth,2013-05-25 02:16:17,http://www.nytimes.com/interactive/2013/05/24/business/Under-Obama-Stocks-Do-Better.html?ref=economy,https://www.reddit.com/r/dataisbeautiful/comments/1f0cad/off_the_charts_under_obama_stocks_do_better/,14,14,0,7,"Off the Charts Under Obama, Stocks Do Better",2013-05-0121.jpg,none,none
Tax Rates across U.S. Companies visualized by Mike Bostock et al. at the New York Times,healthanalyst,2013-05-25 23:08:36,http://www.nytimes.com/interactive/2013/05/25/sunday-review/corporate-taxes.html,https://www.reddit.com/r/dataisbeautiful/comments/1f1xno/tax_rates_across_us_companies_visualized_by_mike/,159,159,0,25,Tax Rates across U.S. Companies visualized by Mike Bostock et al. at the New York Times,2013-05-0124.jpg,none,none
Discovery of asteroids 1980-2012. Data supplied by Lowell Observatory and Minor Planet Center.,bendvis,2013-05-27 02:12:44,http://youtu.be/xJsUDcSc6hE,https://www.reddit.com/r/dataisbeautiful/comments/1f44di/discovery_of_asteroids_19802012_data_supplied_by/,10,10,0,0,Discovery of asteroids 1980-2012. Data supplied by Lowell Observatory and Minor Planet Center.,2013-05-0127.jpg,none,"astronomy, asteroids, discovery, space, science"
Volatility at World's End: Two Decades of Movement in Markets. Implied vs. Realized volatility over time.,cornwallis098,2013-05-27 14:53:48,http://www.youtube.com/watch?feature=player_embedded&v=xlKWdd_DhW0,https://www.reddit.com/r/dataisbeautiful/comments/1f50q0/volatility_at_worlds_end_two_decades_of_movement/,7,7,0,1,Volatility at World's End Two Decades of Movement in Markets. Implied vs. Realized volatility over time.,2013-05-0131.jpg,none,"finance, markets, volatility, trends, investment"
The Effective Tax Rate of Companies in the S&P 500 over a 6-year Period,austinwarren,2013-05-29 00:03:09,http://www.nytimes.com/interactive/2013/05/25/sunday-review/corporate-taxes.html?_r=0,https://www.reddit.com/r/dataisbeautiful/comments/1f8gdx/the_effective_tax_rate_of_companies_in_the_sp_500/,5,5,0,0,The Effective Tax Rate of Companies in the S&P 500 over a 6-year Period,2013-05-0135.jpg,none,none
The Stunning Fall Of Generation X (x-post from /r/GenX),eleemosynary,2013-05-29 02:37:29,http://www.businessinsider.com/generation-x-least-prepared-for-retirement-charts-2013-5?op=1,https://www.reddit.com/r/dataisbeautiful/comments/1f8sid/the_stunning_fall_of_generation_x_xpost_from_rgenx/,8,8,0,1,The Stunning Fall Of Generation X (x-post from rGenX),2013-05-0136.jpg,none,none
Mind-Blowing Visualization Of 'The Rite Of Spring',eleemosynary,2013-05-29 12:31:17,http://www.youtube.com/watch?feature=player_embedded&v=02tkp6eeh40,https://www.reddit.com/r/dataisbeautiful/comments/1f9j9u/mindblowing_visualization_of_the_rite_of_spring/,55,55,0,6,Mind-Blowing Visualization Of 'The Rite Of Spring',2013-05-0138.jpg,none,"music, art, visualization, performance, creativity"
The geography of Tweets - geotagged tweets visualized,chrisarchitect,2013-05-31 16:30:21,https://blog.twitter.com/2013/geography-tweets-3,https://www.reddit.com/r/dataisbeautiful/comments/1fety1/the_geography_of_tweets_geotagged_tweets/,22,22,0,1,The geography of Tweets - geotagged tweets visualized,2013-05-0142.jpg,none,"social media, twitter, communication"
"Periodic table, Life Magazine, 1949",Beaglesworth,2013-05-31 20:39:59,http://io9.com/damn-this-periodic-table-is-beautiful-510648468,https://www.reddit.com/r/dataisbeautiful/comments/1ffcqx/periodic_table_life_magazine_1949/,59,59,0,6,"Periodic table, Life Magazine, 1949",2013-05-0145.jpg,none,none
