title,author,created_date,url,full_permalink,score,ups,downs,num_comments,sanitized_title,image_file,chart_type,high_level_categories
UK public opinion and party policies on privatization,pozorvlak,2014-12-01,http://weownit.org.uk/privatisation-people-vs-politicians,https://www.reddit.com/r/dataisbeautiful/comments/2nykyb/uk_public_opinion_and_party_policies_on/,0,0,0,3,UK public opinion and party policies on privatization,2014-12-0006.jpg,none,"privatization, public opinion, party policies, uk, politics"
The incline in Robbie Williams' listeners trend the week Robin Williams died,bored1000,2014-12-01,http://www.last.fm/music/Robbie+Williams?ac=robb,https://www.reddit.com/r/dataisbeautiful/comments/2nyv6c/the_incline_in_robbie_williams_listeners_trend/,2,2,0,2,The incline in Robbie Williams' listeners trend the week Robin Williams died,2014-12-0007.jpg,none,"music, trends, celebrities, events"
How much money can you save this Cyber Monday on data tech and training?,andrewfogg,2014-12-01,http://blog.import.io/post/the-ultimate-data-sale,https://www.reddit.com/r/dataisbeautiful/comments/2o02dd/how_much_money_can_you_save_this_cyber_monday_on/,0,0,0,1,How much money can you save this Cyber Monday on data tech and training,2014-12-0015.jpg,none,none
"The Divorce Surge Is Over, but the Myth Lives On - ""If current trends continue, nearly two-thirds of marriages will never involve a divorce""",mhmass44,2014-12-02,http://www.nytimes.com/2014/12/02/upshot/the-divorce-surge-is-over-but-the-myth-lives-on.html?referrer=&abt=0002&abg=0,https://www.reddit.com/r/dataisbeautiful/comments/2o2f25/the_divorce_surge_is_over_but_the_myth_lives_on/,26,26,0,15,"The Divorce Surge Is Over, but the Myth Lives On - If current trends continue, nearly two-thirds of marriages will never involve a divorce",2014-12-0025.jpg,none,"divorce, marriage, relationships, trends"
The Pb effect... Visualization is about 25% of the way down.,circular_file,2014-12-02,http://www.motherjones.com/environment/2013/01/lead-crime-link-gasoline,https://www.reddit.com/r/dataisbeautiful/comments/2o36vy/the_pb_effect_visualization_is_about_25_of_the/,6,6,0,1,The Pb effect... Visualization is about 25% of the way down.,2014-12-0027.jpg,none,none
Chicago Criminal Activity by Time of Day [OC],tc_io,2014-12-03,http://www.visart.io/chicagocrime/timeofday/,https://www.reddit.com/r/dataisbeautiful/comments/2o6l4t/chicago_criminal_activity_by_time_of_day_oc/,11,11,0,2,Chicago Criminal Activity by Time of Day OC,2014-12-0039.jpg,none,none
Eating less meat essential to curb climate change,rhiever,2014-12-03,http://www.theguardian.com/environment/2014/dec/03/eating-less-meat-curb-climate-change,https://www.reddit.com/r/dataisbeautiful/comments/2o6p5g/eating_less_meat_essential_to_curb_climate_change/,6,6,0,1,Eating less meat essential to curb climate change,2014-12-0040.jpg,none,"climate change, environment, meat consumption"
Interactive correlation matrix and scatter plot of all NBA team statistical data since the 1951 season [OC],abresler,2014-12-03,http://asbcllc.com/blog/2014/december/nba_team_corr_matrix/scaled/,https://www.reddit.com/r/dataisbeautiful/comments/2o708s/interactive_correlation_matrix_and_scatter_plot/,3,3,0,1,Interactive correlation matrix and scatter plot of all NBA team statistical data since the 1951 season OC,2014-12-0042.jpg,none,none
NASA's funding as a % of Federal Budget,j4ck4ll,2014-12-04,http://www.huffingtonpost.com/howard-steven-friedman/nasa-funding-federal-budget_b_1464070.html,https://www.reddit.com/r/dataisbeautiful/comments/2o8i30/nasas_funding_as_a_of_federal_budget/,0,0,0,2,NASA's funding as a % of Federal Budget,2014-12-0046.jpg,none,none
Young Adults: Then and Now,Juzernejm,2014-12-04,http://census.socialexplorer.com/young-adults/#/,https://www.reddit.com/r/dataisbeautiful/comments/2o9q6q/young_adults_then_and_now/,7,7,0,1,Young Adults Then and Now,2014-12-0049.jpg,none,"youth, technology, lifestyle"
Height differences of couples,Disagreed,2014-12-04,http://fivethirtyeight.com/datalab/how-common-is-it-for-a-man-to-be-shorter-than-his-partner/,https://www.reddit.com/r/dataisbeautiful/comments/2o9xfz/height_differences_of_couples/,80,80,0,16,Height differences of couples,2014-12-0051.jpg,none,none
TED - Alisa Miller: The news about the news (Video with graphs and stats about news distortion).,omghloy,2014-12-04,http://www.ted.com/talks/alisa_miller_shares_the_news_about_the_news?language=en,https://www.reddit.com/r/dataisbeautiful/comments/2oavxl/ted_alisa_miller_the_news_about_the_news_video/,18,18,0,0,TED - Alisa Miller The news about the news (Video with graphs and stats about news distortion).,2014-12-0053.jpg,none,"media, news, information, ted talk"
Afghanistan: where has all the aid money gone? – interactive [OC],cath_levett,2014-12-05,http://www.theguardian.com/global-development/ng-interactive/2014/dec/04/-sp-afghanistan-aid-how-spent,https://www.reddit.com/r/dataisbeautiful/comments/2ocyav/afghanistan_where_has_all_the_aid_money_gone/,21,21,0,2,Afghanistan where has all the aid money gone – interactive OC,2014-12-0055.jpg,none,"aid, afghanistan, humanitarian, distribution"
Mapping Migration in the United States,afb82,2014-12-05,http://www.nytimes.com/2014/08/16/upshot/mapping-migration-in-the-united-states-since-1900.html?abt=0002&abg=1,https://www.reddit.com/r/dataisbeautiful/comments/2oe1vb/mapping_migration_in_the_united_states/,1,1,0,3,Mapping Migration in the United States,2014-12-0059.jpg,none,none
Celebrity Trust Ratings After Major Scandals,lastchancexi,2014-12-05,http://fivethirtyeight.com/datalab/bill-cosby-rape-allegations-most-trusted-celebrities/,https://www.reddit.com/r/dataisbeautiful/comments/2oelpi/celebrity_trust_ratings_after_major_scandals/,0,0,0,2,Celebrity Trust Ratings After Major Scandals,2014-12-0061.jpg,none,"celebrity, scandals, trust"
The shortest path through the 48 continental state capitals (animated) - Driving edition [OC],hyped83,2014-12-05,http://i.imgur.com/uNv2195.gif,https://www.reddit.com/r/dataisbeautiful/comments/2of7nr/the_shortest_path_through_the_48_continental/,98,98,0,42,The shortest path through the 48 continental state capitals (animated) - Driving edition OC,2014-12-0063.png,none,none
Wages are finally growing with jobs — but stil not at pre-recession levels [OC],Jgrovum,2014-12-06,http://dadaviz.com/i/2264,https://www.reddit.com/r/dataisbeautiful/comments/2ogpt7/wages_are_finally_growing_with_jobs_but_stil_not/,16,16,0,3,Wages are finally growing with jobs — but stil not at pre-recession levels OC,2014-12-0066.jpg,none,none
The Most Stressed Out ZIP Codes In America,LittleToke,2014-12-06,http://www.movoto.com/blog/top-ten/most-stressed-zip-codes/,https://www.reddit.com/r/dataisbeautiful/comments/2ogw5r/the_most_stressed_out_zip_codes_in_america/,11,11,0,0,The Most Stressed Out ZIP Codes In America,2014-12-0067.jpg,none,none
Uber’s not a $40 billion start-up. It’s a mid-sized car company.,Princesie,2014-12-07,http://www.washingtonpost.com/blogs/the-switch/wp/2014/12/05/ubers-not-a-40-billion-start-up-its-a-mid-sized-car-company/?Post+generic=%3Ftid%3Dsm_twitter_washingtonpost,https://www.reddit.com/r/dataisbeautiful/comments/2ok5ww/ubers_not_a_40_billion_startup_its_a_midsized_car/,16,16,0,23,Uber’s not a $40 billion start-up. It’s a mid-sized car company.,2014-12-0074.jpg,none,"transportation, ride-sharing, health, uber"
MAP: Watch How Low-Wage Worker Strikes Spread To 190+ Cities,rspix000,2014-12-07,http://thinkprogress.org/economy/2014/12/04/3599733/fast-food-strikes-map-191/,https://www.reddit.com/r/dataisbeautiful/comments/2ok9kv/map_watch_how_lowwage_worker_strikes_spread_to/,0,0,0,0,MAP Watch How Low-Wage Worker Strikes Spread To 190+ Cities,2014-12-0075.jpg,none,none
White High School Dropouts Have More Wealth Than Black And Hispanic College Graduates,nowhathappenedwas,2014-12-07,http://www.demos.org/blog/9/23/14/white-high-school-dropouts-have-more-wealth-black-and-hispanic-college-graduates,https://www.reddit.com/r/dataisbeautiful/comments/2oky1a/white_high_school_dropouts_have_more_wealth_than/,2,2,0,8,White High School Dropouts Have More Wealth Than Black And Hispanic College Graduates,2014-12-0078.jpg,none,none
"Why college isn't for everyone, explained in a single graph",GottlobFrege,2014-12-08,http://fortune.com/2014/09/05/college-worth-value-debt-salaries/,https://www.reddit.com/r/dataisbeautiful/comments/2omagn/why_college_isnt_for_everyone_explained_in_a/,40,40,0,14,"Why college isn't for everyone, explained in a single graph",2014-12-0081.jpg,none,"education, costs, college, financial considerations"
2014 Real Time Chicago Crime and Murder Stats,blindingdawn,2014-12-08,http://heyjackass.com/category/2014-chicago-crime-murder-stats/,https://www.reddit.com/r/dataisbeautiful/comments/2onfmq/2014_real_time_chicago_crime_and_murder_stats/,4,4,0,2,2014 Real Time Chicago Crime and Murder Stats,2014-12-0082.jpg,none,"crime, chicago, violence, statistics"
Scrabble: What makes good players good?,rhiever,2014-12-08,http://iq.brenbarn.net/2012/06/16/scrabble-what-makes-good-players-good/,https://www.reddit.com/r/dataisbeautiful/comments/2onphw/scrabble_what_makes_good_players_good/,13,13,0,2,Scrabble What makes good players good,2014-12-0085.jpg,none,none
Top 200 weekly Spotify songs (featuring gender and age demographics),KristjanHrannar,2014-12-08,http://charts.spotify.com/,https://www.reddit.com/r/dataisbeautiful/comments/2opicd/top_200_weekly_spotify_songs_featuring_gender_and/,5,5,0,1,Top 200 weekly Spotify songs (featuring gender and age demographics),2014-12-0091.jpg,none,"music, demographics, gender, age, spotify, charts"
Gay vs. Straight: Where Do They Meet? [OC],Ouroboros18,2014-12-09,http://dadaviz.com/i/2287,https://www.reddit.com/r/dataisbeautiful/comments/2or1uw/gay_vs_straight_where_do_they_meet_oc/,2,2,0,8,Gay vs. Straight Where Do They Meet OC,2014-12-0096.jpg,none,none
Mapping Migration: An interactive map of where each state's citizens were born.,GinGimlet,2014-12-09,http://www.nytimes.com/2014/08/16/upshot/mapping-migration-in-the-united-states-since-1900.html?WT.mc_id=AD-D-E-KEYWEE-SOC-FP-DEC-AUD-DEV-DSK-1201-1231&ad-keywords=AD1214KW&kwp_0=5612&kwp_1=113726&kwp_4=43336&abt=0002&abg=0,https://www.reddit.com/r/dataisbeautiful/comments/2orjia/mapping_migration_an_interactive_map_of_where/,5,5,0,0,Mapping Migration An interactive map of where each state's citizens were born.,2014-12-0098.jpg,none,none
Margaret and David: 30 years of movie reviews visualised,Twitchy_throttle,2014-12-09,http://www.abc.net.au/news/2014-12-09/at-the-movies-data-reveals-margaret-and-david-likes-and-dislikes/5951130,https://www.reddit.com/r/dataisbeautiful/comments/2otgj7/margaret_and_david_30_years_of_movie_reviews/,3,3,0,0,Margaret and David 30 years of movie reviews visualised,2014-12-0105.jpg,none,none
"Evolution of the climate of France since 1900 (click on ""cliquez ici pour voir toutes les années"" in ""Ecart à la normale"").",loulan,2014-12-10,http://www.lemonde.fr/les-decodeurs/visuel/2014/12/09/comment-le-climat-de-la-france-s-est-rechauffe-depuis-1900_4537295_4355770.html,https://www.reddit.com/r/dataisbeautiful/comments/2oufqb/evolution_of_the_climate_of_france_since_1900/,1,1,0,0,Evolution of the climate of France since 1900 (click on cliquez ici pour voir toutes les années in Ecart à la normale).,2014-12-0110.jpg,none,none
A Global Network For CIA Torture,Princesie,2014-12-10,http://www.theguardian.com/us-news/2014/dec/09/cia-torture-methods-waterboarding-sleep-deprivation,https://www.reddit.com/r/dataisbeautiful/comments/2oui3q/a_global_network_for_cia_torture/,5,5,0,0,A Global Network For CIA Torture,2014-12-0112.jpg,none,"politics, human rights, international relations, cia, torture"
Measuring elephant tusk and rhino horn exports (GIF),Ouroboros18,2014-12-10,http://www.theguardian.com/news/datablog/2014/dec/09/difficulties-measuring-ivory-rhino-horn-exports,https://www.reddit.com/r/dataisbeautiful/comments/2oum5f/measuring_elephant_tusk_and_rhino_horn_exports_gif/,0,0,0,1,Measuring elephant tusk and rhino horn exports (GIF),2014-12-0113.jpg,none,"wildlife, elephants, animals, nature, conservation"
Venture Investors in African Startups,Ouroboros18,2014-12-10,https://info.crunchbase.com/2014/12/venture-investors-see-promise-in-african-startups/,https://www.reddit.com/r/dataisbeautiful/comments/2oumw8/venture_investors_in_african_startups/,0,0,0,0,Venture Investors in African Startups,2014-12-0114.jpg,none,none
"Whales synchronize their songs across oceans, and there’s sheet music to prove it.",yaph,2014-12-10,https://medium.com/@dealville/whales-synchronize-their-songs-across-oceans-and-theres-sheet-music-to-prove-it-b1667f603844,https://www.reddit.com/r/dataisbeautiful/comments/2oux3v/whales_synchronize_their_songs_across_oceans_and/,296,296,0,12,"Whales synchronize their songs across oceans, and there’s sheet music to prove it.",2014-12-0116.jpg,none,"music, whales, synchronization, oceans"
Where federal spending matters most: Some states rely on certain programs much more than others. [OC],Jgrovum,2014-12-10,http://imgur.com/hc5KkKi,https://www.reddit.com/r/dataisbeautiful/comments/2ov61t/where_federal_spending_matters_most_some_states/,46,46,0,4,Where federal spending matters most Some states rely on certain programs much more than others. OC,2014-12-0119.jpg,none,none
"The CIA Torture Report: Without Text, Just Redactions [OC]",Princesie,2014-12-10,http://dadaviz.com/i/2349,https://www.reddit.com/r/dataisbeautiful/comments/2ovjor/the_cia_torture_report_without_text_just/,28,28,0,8,"The CIA Torture Report Without Text, Just Redactions OC",2014-12-0123.jpg,none,none
Live Tweeting and Buzzer Beating: A Power BI demo about Twitter usage and NBA games,KDRIUP,2014-12-10,https://www.youtube.com/watch?v=hfqbNuP_l3A,https://www.reddit.com/r/dataisbeautiful/comments/2owdje/live_tweeting_and_buzzer_beating_a_power_bi_demo/,0,0,0,0,Live Tweeting and Buzzer Beating A Power BI demo about Twitter usage and NBA games,2014-12-0127.jpg,none,"twitter, nba, social media, sports, data analysis"
Sleep Patterns in Select Countries - By Jawbone,KyuraGrof,2014-12-11,https://jawbone.com/blog/2014-year-review/,https://www.reddit.com/r/dataisbeautiful/comments/2oyfjk/sleep_patterns_in_select_countries_by_jawbone/,2,2,0,4,Sleep Patterns in Select Countries - By Jawbone,2014-12-0133.jpg,none,none
NATS: Santas Flight Path Through UK Airspace Aided By UK Air Traffic Control. Serious Business.,dahmerBundy,2014-12-11,http://nats.aero/blog/2014/12/yuletide-24/,https://www.reddit.com/r/dataisbeautiful/comments/2oymfq/nats_santas_flight_path_through_uk_airspace_aided/,9,9,0,1,NATS Santas Flight Path Through UK Airspace Aided By UK Air Traffic Control. Serious Business.,2014-12-0135.jpg,none,"aviation, santa, uk, holidays, air traffic control"
"Which Royal Meeting Got More Media Mentions, Obama or Jay Z and Beyonce?",Princesie,2014-12-11,http://blogs.wsj.com/speakeasy/2014/12/10/which-royal-meeting-got-more-media-mentions-obama-or-jay-z-and-beyonce/?mod=e2tw,https://www.reddit.com/r/dataisbeautiful/comments/2oypcb/which_royal_meeting_got_more_media_mentions_obama/,1,1,0,1,"Which Royal Meeting Got More Media Mentions, Obama or Jay Z and Beyonce",2014-12-0136.jpg,none,"media, celebrities, royals, meetings"
The Innovation Cloud: Hot IP Terms That Didn't Exist in the 1970s [OC],botman55,2014-12-11,http://anthonygarvan.com/2014/12/11/the-innovation-cloud-most-popular-words-in-patents-today-that-didnt-exist-in-the-1970s/,https://www.reddit.com/r/dataisbeautiful/comments/2oz1fn/the_innovation_cloud_hot_ip_terms_that_didnt/,0,0,0,1,The Innovation Cloud Hot IP Terms That Didn't Exist in the 1970s OC,2014-12-0137.jpg,none,none
Employee Strength : IBM + HP + Microsoft greater than Oracle + Cisco + SAP + Apple + Amazon + Google + Yahoo,iam963,2014-12-11,http://smartdatacollective.com/infocaptor/286226/employee-analysis-how-does-growth-employee-strength-relate-profits,https://www.reddit.com/r/dataisbeautiful/comments/2oz5rk/employee_strength_ibm_hp_microsoft_greater_than/,0,0,0,7,Employee Strength IBM + HP + Microsoft greater than Oracle + Cisco + SAP + Apple + Amazon + Google + Yahoo,2014-12-0139.jpg,none,"technology, companies, employee strength"
Top College Football Conferences by Venture Capital Activity [OC],PitchBookData,2014-12-11,http://dataviz.pitchbook.com/Conference-Power-Rank/,https://www.reddit.com/r/dataisbeautiful/comments/2ozk1q/top_college_football_conferences_by_venture/,3,3,0,2,Top College Football Conferences by Venture Capital Activity OC,2014-12-0142.jpg,none,none
[Make Your Own Dataviz] Killings by law enforcement officers in the USA (from 2009-01-01 to 2014-12-09),Aquassaut,2014-12-11,http://public.opendatasoft.com/explore/dataset/killings-by-law-enforcement-officers-in-the-usa,https://www.reddit.com/r/dataisbeautiful/comments/2ozku1/make_your_own_dataviz_killings_by_law_enforcement/,6,6,0,0,Make Your Own Dataviz Killings by law enforcement officers in the USA (from 2009-01-01 to 2014-12-09),2014-12-0143.jpg,none,none
Dropbox's Competitors based on High Natural Language Processing Similarities [OC],PitchBookData,2014-12-11,http://dataviz.pitchbook.com/company-similarity-dropbox/,https://www.reddit.com/r/dataisbeautiful/comments/2ozlvi/dropboxs_competitors_based_on_high_natural/,8,8,0,6,Dropbox's Competitors based on High Natural Language Processing Similarities OC,2014-12-0144.jpg,none,"technology, competition, natural language processing, business intelligence"
Immigration Trends - Permanent Resident Applications by Country 2013 [OC],tc_io,2014-12-11,http://www.visart.io/immigrationtrends/3-map-of-permanent-residents-in-2013-by-country-e1417799151449/,https://www.reddit.com/r/dataisbeautiful/comments/2ozmwo/immigration_trends_permanent_resident/,3,3,0,5,Immigration Trends - Permanent Resident Applications by Country 2013 OC,2014-12-0146.jpg,none,none
The rise of men who don't work -- and what they do instead,cingraham,2014-12-11,http://www.nytimes.com/2014/12/12/upshot/the-rise-of-men-who-dont-work-and-what-they-do-instead.html?abt=0002&abg=0,https://www.reddit.com/r/dataisbeautiful/comments/2p0yol/the_rise_of_men_who_dont_work_and_what_they_do/,10,10,0,13,The rise of men who don't work -- and what they do instead,2014-12-0147.jpg,none,none
Visualising ocean tides [OC],cr42yr1ch,2014-12-12,http://calculatedimages.blogspot.de/2014/12/tides.html,https://www.reddit.com/r/dataisbeautiful/comments/2p2nbf/visualising_ocean_tides_oc/,31,31,0,6,Visualising ocean tides OC,2014-12-0151.jpg,none,"ocean, tides, geography, earth science, water levels"
Wind visualization,julian88888888,2014-12-12,https://www.windyty.com/,https://www.reddit.com/r/dataisbeautiful/comments/2p2yxx/wind_visualization/,21,21,0,3,Wind visualization,2014-12-0155.jpg,none,"weather, wind, meteorology"
50 Closest Pairs Of World Capitals [OC],darinhq,2014-12-12,http://imgur.com/FBpCTey,https://www.reddit.com/r/dataisbeautiful/comments/2p42tr/50_closest_pairs_of_world_capitals_oc/,26,26,0,16,50 Closest Pairs Of World Capitals OC,2014-12-0157.jpg,none,none
Amazing Animation Shows All Flights Over The World's Busiest Airport In 24 Hours (UK Heathrow),StevenMaurer,2014-12-13,http://www.businessinsider.com/uk-airspace-heathrow-flights-time-lapse-2014-12,https://www.reddit.com/r/dataisbeautiful/comments/2p5ig2/amazing_animation_shows_all_flights_over_the/,0,0,0,2,Amazing Animation Shows All Flights Over The World's Busiest Airport In 24 Hours (UK Heathrow),2014-12-0161.jpg,none,"aviation, transportation, airports, uk, heathrow, travel"
Can a simple algebra test predict programming aptitude?,rhiever,2014-12-13,http://www.codeup.com/can-a-simple-algebra-test-predict-programming-aptitude/,https://www.reddit.com/r/dataisbeautiful/comments/2p6u3p/can_a_simple_algebra_test_predict_programming/,7,7,0,6,Can a simple algebra test predict programming aptitude,2014-12-0166.jpg,none,none
50 Most Common US County Names [OC],darinhq,2014-12-14,http://imgur.com/bZvulCc,https://www.reddit.com/r/dataisbeautiful/comments/2pbdw1/50_most_common_us_county_names_oc/,33,33,0,12,50 Most Common US County Names OC,2014-12-0175.jpg,none,none
8 surprising energy stats to remember from 2014,Princesie,2014-12-15,http://venturebeat.com/2014/12/12/8-energy-numbers-to-remember-from-2014/,https://www.reddit.com/r/dataisbeautiful/comments/2pcfpu/8_surprising_energy_stats_to_remember_from_2014/,0,0,0,1,8 surprising energy stats to remember from 2014,2014-12-0177.jpg,none,"energy, solar power, renewable energy, environment"
Winter Tires in Canada [OC],mdross1,2014-12-15,http://www.mikerobe007.ca/2014/12/winter-tires-in-canada.html,https://www.reddit.com/r/dataisbeautiful/comments/2pdwr5/winter_tires_in_canada_oc/,15,15,0,5,Winter Tires in Canada OC,2014-12-0184.jpg,none,"winter, canada, weather, transportation, safety"
Favorite NFL team by US County [Source: Twitter data],EditorialComplex,2014-12-15,https://interactive.twitter.com/nfl_followers2014/,https://www.reddit.com/r/dataisbeautiful/comments/2petwf/favorite_nfl_team_by_us_county_source_twitter_data/,0,0,0,3,Favorite NFL team by US County Source Twitter data,2014-12-0191.jpg,none,none
What Percentage Of Women Have Breast Implants?,Eiskaffee,2014-12-15,http://fivethirtyeight.com/datalab/dear-mona-what-percentage-of-women-have-breast-implants/,https://www.reddit.com/r/dataisbeautiful/comments/2pfrdw/what_percentage_of_women_have_breast_implants/,12,12,0,4,What Percentage Of Women Have Breast Implants,2014-12-0194.jpg,none,none
6 facts about Japan’s downbeat economy | Pew Research Center,jimrosenz,2014-12-16,http://www.pewresearch.org/fact-tank/2014/11/25/6-facts-about-japans-downbeat-economy/,https://www.reddit.com/r/dataisbeautiful/comments/2pfz04/6_facts_about_japans_downbeat_economy_pew/,1,1,0,0,6 facts about Japan’s downbeat economy Pew Research Center,2014-12-0195.jpg,none,"japan, economy, society, demographics"
Naturalized Persons in 2013 by Country,2pacsecure,2014-12-16,http://www.visart.io/?attachment_id=2045,https://www.reddit.com/r/dataisbeautiful/comments/2pg684/naturalized_persons_in_2013_by_country/,0,0,0,1,Naturalized Persons in 2013 by Country,2014-12-0197.jpg,none,none
At what point in their lives do our leaders become president? [OC],WStHappenings,2014-12-16,http://www.pivotalbyte.com/projects/presidents/,https://www.reddit.com/r/dataisbeautiful/comments/2pgsy6/at_what_point_in_their_lives_do_our_leaders/,8,8,0,13,At what point in their lives do our leaders become president OC,2014-12-0198.jpg,none,none
Internet Penetration per 1000 Inhabitants in African Nations (2012) [OC],AMT_io,2014-12-16,http://www.visart.io/africa-the-final-frontier-in-the-digital-revolution/finalfrontier_map1/,https://www.reddit.com/r/dataisbeautiful/comments/2pies6/internet_penetration_per_1000_inhabitants_in/,1,1,0,7,Internet Penetration per 1000 Inhabitants in African Nations (2012) OC,2014-12-0205.jpg,none,none
Russian Ruble trajectory on the Earth map(dollar exchange rate == latitude and euro exchange rate == longitude),godlikesme,2014-12-16,http://vtambourine.github.io/ruble-journey/,https://www.reddit.com/r/dataisbeautiful/comments/2pipll/russian_ruble_trajectory_on_the_earth_mapdollar/,0,0,0,3,Russian Ruble trajectory on the Earth map(dollar exchange rate == latitude and euro exchange rate == longitude),2014-12-0207.jpg,none,none
Whites Have More Wealth Than Blacks And Hispanics With Similar Incomes,Princesie,2014-12-17,http://www.demos.org/blog/9/25/14/whites-have-more-wealth-blacks-and-hispanics-similar-incomes,https://www.reddit.com/r/dataisbeautiful/comments/2pk8io/whites_have_more_wealth_than_blacks_and_hispanics/,0,0,0,0,Whites Have More Wealth Than Blacks And Hispanics With Similar Incomes,2014-12-0213.jpg,none,none
"Obesity by Occupation: In the US police, firefighters, and security guards lead the pack.",Geographist,2014-12-17,http://www.wsj.com/articles/memo-to-staff-time-to-lose-a-few-pounds-1418775776?KEYWORDS=pounds,https://www.reddit.com/r/dataisbeautiful/comments/2pkuio/obesity_by_occupation_in_the_us_police/,3237,3237,0,1228,"Obesity by Occupation In the US police, firefighters, and security guards lead the pack.",2014-12-0216.jpg,none,"obesity, occupations, health, workforce, united states"
How To Impress With Charts [OC]. reboot of Russian currency 2014 trends,NewAlexandria,2014-12-17,http://imgur.com/XQgoATL,https://www.reddit.com/r/dataisbeautiful/comments/2pl74x/how_to_impress_with_charts_oc_reboot_of_russian/,3,3,0,3,How To Impress With Charts OC. reboot of Russian currency 2014 trends,2014-12-0220.jpg,none,"charts, data visualization, russian currency, 2014, trends"
Can a machine learn to flag comments automatically?,jrgifford,2014-12-17,https://meta.stackoverflow.com/questions/280546/can-a-machine-be-taught-to-flag-comments-automatically?stw=2,https://www.reddit.com/r/dataisbeautiful/comments/2pl76b/can_a_machine_learn_to_flag_comments_automatically/,0,0,0,1,Can a machine learn to flag comments automatically,2014-12-0221.jpg,none,"machine learning, automation, technology"
Crime Rates Over Time in Top US Cities [OC],tc_io,2014-12-17,http://www.visart.io/?attachment_id=2069,https://www.reddit.com/r/dataisbeautiful/comments/2plhud/crime_rates_over_time_in_top_us_cities_oc/,1,1,0,1,Crime Rates Over Time in Top US Cities OC,2014-12-0223.jpg,none,none
The countries with the fastest public wifi,Princesie,2014-12-18,http://www.businessinsider.com/fastest-public-wifi-2014-12?utm_content=buffer87feb&utm_medium=social&utm_source=twitter.com&utm_campaign=buffer,https://www.reddit.com/r/dataisbeautiful/comments/2pnyu1/the_countries_with_the_fastest_public_wifi/,0,0,0,1,The countries with the fastest public wifi,2014-12-0227.jpg,none,none
