title,author,created_date,url,full_permalink,score,ups,downs,num_comments,sanitized_title,image_file,chart_type,high_level_categories
"This map is bad news for China's economy, good news for America's.",rstevens94,2014-05-01,http://www.vox.com/2014/5/1/5671834/this-map-is-bad-news-for-chinas-economy-good-news-for-americas,https://www.reddit.com/r/dataisbeautiful/comments/24hb36/this_map_is_bad_news_for_chinas_economy_good_news/,0,0,0,11,"This map is bad news for China's economy, good news for America's.",2014-05-0003.jpg,none,"economy, china, america, manufacturing, industry"
Every execution in US history,connorkmiec93,2014-05-02,http://time.com/82375/every-execution-in-u-s-history-in-a-single-chart/?hpt=hp_t3,https://www.reddit.com/r/dataisbeautiful/comments/24jl0v/every_execution_in_us_history/,352,352,0,131,Every execution in US history,2014-05-0006.jpg,none,"capital punishment, history, united states, law, justice"
Strength of the french army since 1620,Pelomar,2014-05-02,http://www.lemonde.fr/international/visuel/2013/04/30/evolution-des-effectifs-de-l-armee-de-terre-depuis-quatre-siecles_3168466_3210.html,https://www.reddit.com/r/dataisbeautiful/comments/24k4yv/strength_of_the_french_army_since_1620/,67,67,0,9,Strength of the french army since 1620,2014-05-0008.jpg,none,none
Worldwide Chocolate Consumption,Pun_isher,2014-05-02,http://blog.plot.ly/post/84310676632/worldwide-chocolate-consumption,https://www.reddit.com/r/dataisbeautiful/comments/24kd3x/worldwide_chocolate_consumption/,8,8,0,0,Worldwide Chocolate Consumption,2014-05-0009.jpg,none,none
Rappers sorted by size of vocabulary [x-post /r/hiphopheads],Jointi,2014-05-03,http://mdaniels.com/vocab/analysis.html,https://www.reddit.com/r/dataisbeautiful/comments/24nw9p/rappers_sorted_by_size_of_vocabulary_xpost/,2901,2901,0,577,Rappers sorted by size of vocabulary x-post rhiphopheads,2014-05-0011.jpg,none,"music, hip hop, linguistics"
Every burn in Joel McHale’s brutal White House Correspondents’ Dinner speech,schmidtjosh,2014-05-05,http://www.washingtonpost.com/blogs/reliable-source/wp/2014/05/04/every-burn-in-joel-mchales-brutal-white-house-correspondents-dinner-speech/,https://www.reddit.com/r/dataisbeautiful/comments/24qwi2/every_burn_in_joel_mchales_brutal_white_house/,0,0,0,0,Every burn in Joel McHale’s brutal White House Correspondents’ Dinner speech,2014-05-0019.jpg,none,none
Spotify listening data visualized,Qingy,2014-05-05,http://musicmachinery.com/2014/05/02/the-skip/,https://www.reddit.com/r/dataisbeautiful/comments/24s79x/spotify_listening_data_visualized/,19,19,0,0,Spotify listening data visualized,2014-05-0022.jpg,none,none
Population pyramids: Powerful predictors of the future - Kim Preshoff,albert_yonson,2014-05-05,https://www.youtube.com/watch?v=RLmKfXwWQtE,https://www.reddit.com/r/dataisbeautiful/comments/24s8xs/population_pyramids_powerful_predictors_of_the/,18,18,0,0,Population pyramids Powerful predictors of the future - Kim Preshoff,2014-05-0024.jpg,none,"demographics, population, future, trends"
Where Americans Think They Live [OC],bennstancil,2014-05-06,http://blog.modeanalytics.com/where-americans-think-they-live/,https://www.reddit.com/r/dataisbeautiful/comments/24vpm6/where_americans_think_they_live_oc/,29,29,0,12,Where Americans Think They Live OC,2014-05-0032.jpg,none,none
Visualizing how sampling error and statistical noise moves markets,floatrock,2014-05-06,http://www.nytimes.com/2014/05/02/upshot/how-not-to-be-misled-by-the-jobs-report.html?rref=upshot,https://www.reddit.com/r/dataisbeautiful/comments/24wdqp/visualizing_how_sampling_error_and_statistical/,19,19,0,0,Visualizing how sampling error and statistical noise moves markets,2014-05-0034.jpg,none,"statistics, markets, sampling error, noise"
"What it’s like to be 100 years old, in 10 charts",superdaniel,2014-05-06,http://www.washingtonpost.com/news/to-your-health/wp/2014/05/05/what-its-like-be-100-years-old-in-10-charts/?hpid=z1,https://www.reddit.com/r/dataisbeautiful/comments/24wesz/what_its_like_to_be_100_years_old_in_10_charts/,21,21,0,4,"What it’s like to be 100 years old, in 10 charts",2014-05-0035.jpg,none,none
"An interactive, 3D visualisation of Q1 2014 data Numbeo [OC]",truelovevip,2014-05-07,http://www.doc.gold.ac.uk/~ma201rh/dataglobe/,https://www.reddit.com/r/dataisbeautiful/comments/24yh00/an_interactive_3d_visualisation_of_q1_2014_data/,26,26,0,7,"An interactive, 3D visualisation of Q1 2014 data Numbeo OC",2014-05-0041.jpg,none,"data visualization, global, interactive, 3d, q1 2014, numbeo"
The Rapidly Rising Cost of College [OC],radioopensource,2014-05-08,http://radioopensource.org/higher-ed-by-the-numbers/,https://www.reddit.com/r/dataisbeautiful/comments/2526ry/the_rapidly_rising_cost_of_college_oc/,0,0,0,3,The Rapidly Rising Cost of College OC,2014-05-0051.jpg,none,"education, college, costs, economics, value"
TRAVIC - Transit Visualization Client traffic visualization all over the world,brzpf,2014-05-08,http://tracker.geops.ch/,https://www.reddit.com/r/dataisbeautiful/comments/252a0r/travic_transit_visualization_client_traffic/,1,1,0,1,TRAVIC - Transit Visualization Client traffic visualization all over the world,2014-05-0053.jpg,none,"transportation, transit, geography, maps, global"
Spotify pricing around the world [Matias Singers],edix0009,2014-05-08,http://mts.io/projects/spotify-pricing/,https://www.reddit.com/r/dataisbeautiful/comments/252auf/spotify_pricing_around_the_world_matias_singers/,3,3,0,2,Spotify pricing around the world Matias Singers,2014-05-0054.jpg,none,none
Healthmap shows real time health issues and outbreaks from around the world.,hoosakiwi,2014-05-08,http://healthmap.org/en/,https://www.reddit.com/r/dataisbeautiful/comments/2533bo/healthmap_shows_real_time_health_issues_and/,5,5,0,1,Healthmap shows real time health issues and outbreaks from around the world.,2014-05-0056.jpg,none,"health, outbreaks, real-time, global"
things that correlate,martyO3,2014-05-09,http://tylervigen.com,https://www.reddit.com/r/dataisbeautiful/comments/254g4f/things_that_correlate/,2218,2218,0,216,things that correlate,2014-05-0059.jpg,none,none
The London Evolution Animation,kostasdizas,2014-05-10,https://www.youtube.com/watch?v=NB5Oz9b84jM,https://www.reddit.com/r/dataisbeautiful/comments/2595du/the_london_evolution_animation/,55,55,0,2,The London Evolution Animation,2014-05-0071.jpg,none,"london, history, urban development, animation"
One day of public transportation in Budapest,mrgann,2014-05-11,https://www.youtube.com/watch?v=YwTiPO-UDgQ,https://www.reddit.com/r/dataisbeautiful/comments/259q6q/one_day_of_public_transportation_in_budapest/,13,13,0,1,One day of public transportation in Budapest,2014-05-0072.jpg,none,"transportation, public transport, budapest, urban, mobility"
European parties' discourse orientation (european vs national) on twitter [OC],dataholic,2014-05-12,http://apps.morelab.deusto.es/eu_elections/mentions/,https://www.reddit.com/r/dataisbeautiful/comments/25d1cb/european_parties_discourse_orientation_european/,3,3,0,2,European parties' discourse orientation (european vs national) on twitter OC,2014-05-0082.jpg,none,none
Visualization of how much daytime changes every day as a function of latitude [OC],Mock_Twain,2014-05-12,http://www.ifweassume.com/2014/05/the-sun-also-risessets.html,https://www.reddit.com/r/dataisbeautiful/comments/25dgx5/visualization_of_how_much_daytime_changes_every/,15,15,0,1,Visualization of how much daytime changes every day as a function of latitude OC,2014-05-0086.jpg,none,"daylight, latitude, astronomy, geography"
This D3 sample was good for a laugh (link to blog in comments),brotherwayne,2014-05-12,http://jsfiddle.net/thudfactor/6YyvZ/,https://www.reddit.com/r/dataisbeautiful/comments/25dj6d/this_d3_sample_was_good_for_a_laugh_link_to_blog/,0,0,0,1,This D3 sample was good for a laugh (link to blog in comments),2014-05-0087.jpg,none,none
"Where were you on Sept. 11, 2001?",Entopy,2014-05-12,http://www.nytimes.com/interactive/2011/09/08/us/sept-11-reckoning/where-were-you-september-11-map.html,https://www.reddit.com/r/dataisbeautiful/comments/25dx4g/where_were_you_on_sept_11_2001/,0,0,0,1,"Where were you on Sept. 11, 2001",2014-05-0089.jpg,none,"history, events, 9/11"
1500 colleges plotted by their 4 year cost and 30 year return on investment [OC],mohanros,2014-05-12,http://radioopensource.org/dealing-in-dreams/,https://www.reddit.com/r/dataisbeautiful/comments/25e14g/1500_colleges_plotted_by_their_4_year_cost_and_30/,91,91,0,37,1500 colleges plotted by their 4 year cost and 30 year return on investment OC,2014-05-0090.jpg,none,none
Why has Austrian charitable giving failed to recover since the recession?,Slimpickering,2014-05-13,http://futureworldgiving.org/2014/05/12/why-has-austrian-giving-failed-to-recover-since-the-recession/,https://www.reddit.com/r/dataisbeautiful/comments/25fvtl/why_has_austrian_charitable_giving_failed_to/,0,0,0,0,Why has Austrian charitable giving failed to recover since the recession,2014-05-0095.jpg,none,none
2014 Population by country,ash_hafez,2014-05-13,http://hosting.datacopia.com/20140520.195594.3c29f7d2-0e47-46e9-93d6-b1aa7e8cf41f.png,https://www.reddit.com/r/dataisbeautiful/comments/25hoak/2014_population_by_country/,3,3,0,5,2014 Population by country,2014-05-0100.jpg,none,none
Total number of tanks per country,BACON_BATTLE,2014-05-13,http://www.globalfirepower.com/armor-tanks-total.asp,https://www.reddit.com/r/dataisbeautiful/comments/25hxhu/total_number_of_tanks_per_country/,8,8,0,0,Total number of tanks per country,2014-05-0104.jpg,none,none
A day of NYC's bike-share [OC],CitiRides,2014-05-13,http://www.youtube.com/watch?v=SKJ6BsycvJA,https://www.reddit.com/r/dataisbeautiful/comments/25i4ai/a_day_of_nycs_bikeshare_oc/,7,7,0,4,A day of NYC's bike-share OC,2014-05-0105.jpg,none,"transportation, nyc, bike-share, urban mobility"
Interactive Visualization of Australian Federal Budget: Revenue and Spending,InnerCityTrendy,2014-05-13,http://www.abc.net.au/news/interactives/federal-budget-2014/#spending/breakdown/2014/general-public-services,https://www.reddit.com/r/dataisbeautiful/comments/25i9fw/interactive_visualization_of_australian_federal/,13,13,0,2,Interactive Visualization of Australian Federal Budget Revenue and Spending,2014-05-0106.jpg,none,none
Twitter & Reddit topics during week one of MH-370's disappearance [OC],decisiveUI,2014-05-14,http://visualizing.org/visualizations/hierarchie,https://www.reddit.com/r/dataisbeautiful/comments/25jjbk/twitter_reddit_topics_during_week_one_of_mh370s/,13,13,0,2,Twitter & Reddit topics during week one of MH-370's disappearance OC,2014-05-0110.jpg,none,none
Such a great example of using audio to illustrate data (2010),keeferc,2014-05-16,http://www.nytimes.com/interactive/2010/02/26/sports/olympics/20100226-olysymphony.html,https://www.reddit.com/r/dataisbeautiful/comments/25onc6/such_a_great_example_of_using_audio_to_illustrate/,8,8,0,0,Such a great example of using audio to illustrate data (2010),2014-05-0129.jpg,none,"sports, skiing, audio, 2010"
"Lesbian, gay, bisexual and transgender rights around the world",DrByg,2014-05-16,http://www.theguardian.com/world/ng-interactive/2014/may/-sp-gay-rights-world-lesbian-bisexual-transgender,https://www.reddit.com/r/dataisbeautiful/comments/25pfv4/lesbian_gay_bisexual_and_transgender_rights/,193,193,0,43,"Lesbian, gay, bisexual and transgender rights around the world",2014-05-0133.jpg,none,none
States Most & Least Dependent on the Federal Government; Wallethub,thabe331,2014-05-16,http://wallethub.com/edu/states-most-least-dependent-on-the-federal-government/2700/,https://www.reddit.com/r/dataisbeautiful/comments/25pk18/states_most_least_dependent_on_the_federal/,214,214,0,96,States Most & Least Dependent on the Federal Government; Wallethub,2014-05-0134.jpg,none,"federal government, states, dependency, finance, economics"
California Fire Season,Pun_isher,2014-05-16,http://www.nytimes.com/2014/05/16/us/as-california-battles-fires-fears-of-worse-ahead.html?_r=0,https://www.reddit.com/r/dataisbeautiful/comments/25r13o/california_fire_season/,3,3,0,0,California Fire Season,2014-05-0136.jpg,none,"wildfires, california, emergencies, environment"
"Online Dating Myths busted via surprising data analysis on male and female facial attitudes, photo context, and skin exposure.",brighterside,2014-05-17,http://blog.okcupid.com/index.php/the-4-big-myths-of-profile-pictures/,https://www.reddit.com/r/dataisbeautiful/comments/25u113/online_dating_myths_busted_via_surprising_data/,157,157,0,15,"Online Dating Myths busted via surprising data analysis on male and female facial attitudes, photo context, and skin exposure.",2014-05-0143.jpg,none,"online dating, myths, gender, analysis, photography, facial expressions, skin exposure"
Ice melt from Greenland alone has raised sea levels by more than a quarter-inch since 1992,Pun_isher,2014-05-20,http://www.nytimes.com/2014/05/20/science/the-melting-isnt-glacial.html#glaciers-rivers-of-ice,https://www.reddit.com/r/dataisbeautiful/comments/2618s8/ice_melt_from_greenland_alone_has_raised_sea/,3,3,0,1,Ice melt from Greenland alone has raised sea levels by more than a quarter-inch since 1992,2014-05-0159.jpg,none,"climate change, ice melt, greenland, sea level rise, environment"
Graph of famous singers' ranges.,wazywazy,2014-05-20,http://www.concerthotels.com/worlds-greatest-vocal-ranges,https://www.reddit.com/r/dataisbeautiful/comments/2619ex/graph_of_famous_singers_ranges/,154,154,0,50,Graph of famous singers' ranges.,2014-05-0160.jpg,none,"music, singers, vocal range, celebrities"
"Global internet use by gender: in the big economies, the web could be considered a ""boys club"" says WashPost (article in comments)",scalesthefish,2014-05-21,http://www.visualizing.org/visualizations/maps-internet-users-gender,https://www.reddit.com/r/dataisbeautiful/comments/263jna/global_internet_use_by_gender_in_the_big/,0,0,0,3,"Global internet use by gender in the big economies, the web could be considered a boys club says WashPost (article in comments)",2014-05-0171.jpg,none,none
The most common age in America is now 22,Pun_isher,2014-05-23,http://www.nytimes.com/2014/05/24/business/younger-turn-for-a-graying-nation.html?_r=0,https://www.reddit.com/r/dataisbeautiful/comments/26att9/the_most_common_age_in_america_is_now_22/,24,24,0,10,The most common age in America is now 22,2014-05-0184.jpg,none,none
3D Animation of Environmental Groundwater Sampling & Illustration in Blender [OC],esanderson,2014-05-23,http://youtu.be/ELoWK4yUfr8?t=5m3s,https://www.reddit.com/r/dataisbeautiful/comments/26az3y/3d_animation_of_environmental_groundwater/,7,7,0,1,3D Animation of Environmental Groundwater Sampling & Illustration in Blender OC,2014-05-0185.jpg,none,"environment, groundwater, sampling, 3d animation, blender, engineering"
Historical Stream Flows of the Willamette River,Geographist,2014-05-25,http://i.imgur.com/fGg671R.png,https://www.reddit.com/r/dataisbeautiful/comments/26fz8a/historical_stream_flows_of_the_willamette_river/,1941,1941,0,81,Historical Stream Flows of the Willamette River,2014-05-0195.jpg,none,"geography, rivers, history, oregon"
/r/DataIsBeautiful User Survey - Please fill this out if you haven't already,rhiever,2014-05-25,https://docs.google.com/forms/d/1qVTB4jEd2xYFSXGLZJdUEo5sq81tkxbqnkvTFYhwdQM/viewform,https://www.reddit.com/r/dataisbeautiful/comments/26gure/rdataisbeautiful_user_survey_please_fill_this_out/,20,20,0,4,rDataIsBeautiful User Survey - Please fill this out if you haven't already,2014-05-0197.jpg,none,"survey, feedback, reddit, dataisbeautiful"
"Comparing The Top Artists, Past And Present, By Vocal Range",Anapestic,2014-05-25,http://www.huffingtonpost.com/2014/05/20/top-artists-vocal-range_n_5357698.html?ncid=fcbklnkushpmg00000063,https://www.reddit.com/r/dataisbeautiful/comments/26gy5n/comparing_the_top_artists_past_and_present_by/,9,9,0,4,"Comparing The Top Artists, Past And Present, By Vocal Range",2014-05-0198.jpg,none,none
MLB Instant Replay Database,nickclass,2014-05-27,http://baseballsavant.com/apps/replays.php,https://www.reddit.com/r/dataisbeautiful/comments/26m1c0/mlb_instant_replay_database/,0,0,0,0,MLB Instant Replay Database,2014-05-0215.jpg,none,"baseball, data, technology, sports"
[OC] Power laws in Reddit and earthquakes. Data scraped from reddit and plotted with plotly.,jesse09,2014-05-27,http://bballnumbers.svbtle.com/power-laws-similarities-in-reddits-voting-system-and-earthquakes,https://www.reddit.com/r/dataisbeautiful/comments/26mzpx/oc_power_laws_in_reddit_and_earthquakes_data/,0,0,0,3,OC Power laws in Reddit and earthquakes. Data scraped from reddit and plotted with plotly.,2014-05-0220.jpg,none,"mathematics, power laws, reddit, earthquakes"
Where UK immigrants were born: 1951-2011,fstorino,2014-05-27,http://www.theguardian.com/news/datablog/interactive/2013/dec/17/where-uk-immigrants-born-1951-2011-census-ons,https://www.reddit.com/r/dataisbeautiful/comments/26nvfk/where_uk_immigrants_were_born_19512011/,8,8,0,5,Where UK immigrants were born 1951-2011,2014-05-0225.jpg,none,none
Google ISP streaming performance rankings,-Gavin-,2014-05-29,http://www.google.com/get/videoqualityreport/,https://www.reddit.com/r/dataisbeautiful/comments/26twio/google_isp_streaming_performance_rankings/,22,22,0,1,Google ISP streaming performance rankings,2014-05-0248.jpg,none,"performance, internet, streaming, google, isp"
"12% of Americans are in the 1% for at least a year, 80% spend a year on the other end -- Plotly",mathieurenaud,2014-05-29,http://blog.plot.ly/post/87019046912/two-graphs-on-economic-inequality-in-the-us,https://www.reddit.com/r/dataisbeautiful/comments/26u38x/12_of_americans_are_in_the_1_for_at_least_a_year/,1,1,0,0,"12% of Americans are in the 1% for at least a year, 80% spend a year on the other end -- Plotly",2014-05-0250.jpg,none,none
The Reading Rainbow Kickstarter has raised over $3M in 3 days. Exploring how the donations are distributed by amount [OC],Mock_Twain,2014-05-31,http://www.ifweassume.com/2014/05/kickstarting-reading-rainbow.html,https://www.reddit.com/r/dataisbeautiful/comments/26ymbb/the_reading_rainbow_kickstarter_has_raised_over/,1350,1350,0,97,The Reading Rainbow Kickstarter has raised over $3M in 3 days. Exploring how the donations are distributed by amount OC,2014-05-0264.jpg,none,"crowdfunding, fundraising, donations"
Interactive distance vs. time chart of the journeys by Frodo and Bilbo in the Hobbit and the Lord of the Rings,stenkall,2014-05-31,http://lotrproject.com/timedistance/,https://www.reddit.com/r/dataisbeautiful/comments/26zfau/interactive_distance_vs_time_chart_of_the/,11,11,0,0,Interactive distance vs. time chart of the journeys by Frodo and Bilbo in the Hobbit and the Lord of the Rings,2014-05-0265.jpg,none,"fantasy, literature, tolkien, journeys, middle-earth"
