title,author,created_date,url,full_permalink,score,ups,downs,num_comments,sanitized_title,image_file,chart_type,high_level_categories
How long will you live in this world (an interactive visualization)?,Remozito,2014-12-18,http://population.io/,https://www.reddit.com/r/dataisbeautiful/comments/2poh3w/how_long_will_you_live_in_this_world_an/,70,70,0,26,How long will you live in this world (an interactive visualization),2014-12-0228.jpg,none,none
Map of the happiest and unhappiest places to live in the US,UnbridledTruth,2014-12-18,http://news.ubc.ca/2014/07/21/unhappy-cities/,https://www.reddit.com/r/dataisbeautiful/comments/2pot8i/map_of_the_happiest_and_unhappiest_places_to_live/,515,515,0,258,Map of the happiest and unhappiest places to live in the US,2014-12-0231.jpg,none,none
Created DNA from tumblr blogs [OC],-Kookaburra-,2014-12-19,http://atomdesigns.tumblr.com/post/104832676672/this-is-dna-my-tumblr-driven-data-artwork-i,https://www.reddit.com/r/dataisbeautiful/comments/2prxx3/created_dna_from_tumblr_blogs_oc/,0,0,0,1,Created DNA from tumblr blogs OC,2014-12-0235.jpg,none,none
Best of /r/DataIsBeautiful Nominations (August - December 2014),rhiever,2014-12-19,https://docs.google.com/forms/d/1P2N2sv_0PR-JPiZ01bj0NrEsVyuD_22PBbKCi8FIjyU/viewform,https://www.reddit.com/r/dataisbeautiful/comments/2psdvg/best_of_rdataisbeautiful_nominations_august/,346,346,0,22,Best of rDataIsBeautiful Nominations (August - December 2014),2014-12-0236.jpg,none,"data visualization, reddit, nominations, 2014"
Kobe vs. Jordan,sixfigurekid,2014-12-19,http://espn.go.com/espn/feature/story/_/id/12019262/kobe-vs-jordan,https://www.reddit.com/r/dataisbeautiful/comments/2pt25j/kobe_vs_jordan/,1523,1523,0,515,Kobe vs. Jordan,2014-12-0237.jpg,none,"basketball, sports, athletes, competition"
Supercomputing-enabled visualization of a virtual class-5 tornadogenesis (Leigh Orf's research out of CMU).,jman904,2014-12-19,https://www.youtube.com/watch?feature=player_detailpage&v=7U5cp-wgMOM#t=381,https://www.reddit.com/r/dataisbeautiful/comments/2ptquw/supercomputingenabled_visualization_of_a_virtual/,7,7,0,0,Supercomputing-enabled visualization of a virtual class-5 tornadogenesis (Leigh Orf's research out of CMU).,2014-12-0238.jpg,none,"supercomputing, visualization, weather, tornado, research, simulation"
Peak Break-Up Times On Facebook,jsq,2014-12-20,http://www.informationisbeautiful.net/2010/peak-break-up-times-on-facebook/,https://www.reddit.com/r/dataisbeautiful/comments/2pw0h8/peak_breakup_times_on_facebook/,1603,1603,0,296,Peak Break-Up Times On Facebook,2014-12-0242.jpg,none,none
Measuring Russia's Growing Energy Dependence: Rolling Correlations b/w Change in Oil Price & Ruble's Value Over Time [OC],mra1385,2014-12-20,http://karimfoda.com/2014/12/18/russia-left-in-the-ruble-2/,https://www.reddit.com/r/dataisbeautiful/comments/2pw9o2/measuring_russias_growing_energy_dependence/,3,3,0,1,Measuring Russia's Growing Energy Dependence Rolling Correlations bw Change in Oil Price & Ruble's Value Over Time OC,2014-12-0243.jpg,none,none
Mapping human migration in the US,lovekeepsherintheair,2014-12-20,http://www.nytimes.com/2014/08/16/upshot/mapping-migration-in-the-united-states-since-1900.html?WT.mc_id=AD-D-E-KEYWEE-SOC-FP-DEC-AUD-DEV-DSK-1201-1231&ad-keywords=AD1214KW&kwp_0=5612&kwp_1=113729&kwp_4=43339&_r=0&abt=0002&abg=0&module=ArrowsNav&contentCollection=The%20Upshot&action=keypress&region=FixedLeft&pgtype=article,https://www.reddit.com/r/dataisbeautiful/comments/2py5wg/mapping_human_migration_in_the_us/,0,0,0,0,Mapping human migration in the US,2014-12-0246.jpg,none,none
Booze calculator (BBC),purplescientist,2014-12-21,http://www.bbc.co.uk/news/health-30500372,https://www.reddit.com/r/dataisbeautiful/comments/2pyfxq/booze_calculator_bbc/,0,0,0,1,Booze calculator (BBC),2014-12-0248.jpg,none,"alcohol, holidays, bbc, drinks"
100m Olympic Gold Medalists over Time,ccb621,2014-12-21,https://www.youtube.com/watch?v=_L_vq5JYQlE,https://www.reddit.com/r/dataisbeautiful/comments/2q0qqd/100m_olympic_gold_medalists_over_time/,4,4,0,0,100m Olympic Gold Medalists over Time,2014-12-0251.jpg,none,"sports, olympics, athletics, sprinting, history, competition"
How Okcupid users rate each other based on photography,not_enough_characte,2014-12-21,http://blog.okcupid.com/index.php/dont-be-ugly-by-accident/,https://www.reddit.com/r/dataisbeautiful/comments/2q18wc/how_okcupid_users_rate_each_other_based_on/,2,2,0,7,How Okcupid users rate each other based on photography,2014-12-0253.jpg,none,"dating, online platforms, photography, social interaction"
Data about the redditors who send me pictures [OC],PmButtPics4ADrawing,2014-12-22,http://imgur.com/a/m2iAc,https://www.reddit.com/r/dataisbeautiful/comments/2q2l2m/data_about_the_redditors_who_send_me_pictures_oc/,3919,3919,0,805,Data about the redditors who send me pictures OC,2014-12-0257.jpg,none,none
Washington Post chart of partisan voting index versus 2014 house election results,Opheltes,2014-12-22,http://www.washingtonpost.com/blogs/the-fix/wp/2014/12/08/the-chart-summarizing-the-2014-election-that-we-never-intended-for-you-to-see/?tid=hybrid_1.1_default_strip_3,https://www.reddit.com/r/dataisbeautiful/comments/2q2vce/washington_post_chart_of_partisan_voting_index/,0,0,0,0,Washington Post chart of partisan voting index versus 2014 house election results,2014-12-0259.jpg,none,none
Visualizing Doctor's Note on ER Visits caused by Christmas Decorations [OC],iquantny,2014-12-22,http://iquantny.tumblr.com/post//quantifying-the-perils-of-decorating-for-christmas,https://www.reddit.com/r/dataisbeautiful/comments/2q3dgy/visualizing_doctors_note_on_er_visits_caused_by/,0,0,0,1,Visualizing Doctor's Note on ER Visits caused by Christmas Decorations OC,2014-12-0260.jpg,none,none
Video of a DDoS set to music,Reelix,2014-12-22,https://www.youtube.com/watch?v=ZNG3rW2UX7w,https://www.reddit.com/r/dataisbeautiful/comments/2q51w8/video_of_a_ddos_set_to_music/,7,7,0,3,Video of a DDoS set to music,2014-12-0262.jpg,none,"cybersecurity, ddos, visualization"
These airlines lose your luggage the most often,Princesie,2014-12-23,http://www.washingtonpost.com/blogs/wonkblog/wp/2014/12/18/these-airlines-lose-your-luggage-the-most-often/,https://www.reddit.com/r/dataisbeautiful/comments/2q69n5/these_airlines_lose_your_luggage_the_most_often/,0,0,0,0,These airlines lose your luggage the most often,2014-12-0266.jpg,none,"airlines, luggage, travel, customer service"
Where Are the Hardest Places to Live in the U.S.?,newjerseybred,2014-12-23,http://www.nytimes.com/2014/06/26/upshot/where-are-the-hardest-places-to-live-in-the-us.html?WT.mc_id=AD-D-E-KEYWEE-SOC-FP-DEC-AUD-DEV-DSK-1201-1231&ad-keywords=AD1214KW&kwp_0=5613&kwp_1=113731&kwp_4=43341&_r=0&abt=0002&abg=0,https://www.reddit.com/r/dataisbeautiful/comments/2q6l3z/where_are_the_hardest_places_to_live_in_the_us/,13,13,0,26,Where Are the Hardest Places to Live in the U.S.,2014-12-0268.jpg,none,"living conditions, u.s., socioeconomic factors"
This is how we move.,n30chan,2014-12-23,http://cities.human.co,https://www.reddit.com/r/dataisbeautiful/comments/2q6oi2/this_is_how_we_move/,22,22,0,4,This is how we move.,2014-12-0270.jpg,none,none
"Two maps: Felon disenfranchisement in the U.S. Over 20% of all black citizens in Florida, Kentucky, and Virginia are legally prohibited from voting. Overall, 5.8 million Americans can't vote because of their criminal records.",almodozo,2014-12-23,http://www.vox.com/2014/10/5/6906875/state-prisoner-voting-law-felon-disenfranchisement-map-virginia,https://www.reddit.com/r/dataisbeautiful/comments/2q8ckz/two_maps_felon_disenfranchisement_in_the_us_over/,19,19,0,15,"Two maps Felon disenfranchisement in the U.S. Over 20% of all black citizens in Florida, Kentucky, and Virginia are legally prohibited from voting. Ov",2014-12-0274.jpg,none,none
The most important words in politics for each month of 2014,Princesie,2014-12-24,http://www.washingtonpost.com/blogs/the-fix/wp/2014/12/23/the-most-important-words-in-politics-for-each-month-of-2014/,https://www.reddit.com/r/dataisbeautiful/comments/2q9eeq/the_most_important_words_in_politics_for_each/,38,38,0,1,The most important words in politics for each month of 2014,2014-12-0279.jpg,none,"politics, media, journalism"
2008 US election turnout vs poverty and education levels,zmekus,2014-12-26,http://statchatva.org/2012/08/01/national-turnout-rates-and-rankings/,https://www.reddit.com/r/dataisbeautiful/comments/2qf9gd/2008_us_election_turnout_vs_poverty_and_education/,76,76,0,10,2008 US election turnout vs poverty and education levels,2014-12-0289.jpg,none,none
Abstract grammatical data portrait of Harry Potter and the Philosopher's Stone. [OC],sagar_sm,2014-12-26,http://www.seaflection.com/colorpress/,https://www.reddit.com/r/dataisbeautiful/comments/2qhmws/abstract_grammatical_data_portrait_of_harry/,17,17,0,5,Abstract grammatical data portrait of Harry Potter and the Philosopher's Stone. OC,2014-12-0292.jpg,none,"literature, fantasy, harry potter, data visualization, grammar"
What Americans love and hate doing over holidays,mrmillersd,2014-12-28,http://fivethirtyeight.com/features/americans-love-the-holidays-but-spend-them-doing-things-they-hate/,https://www.reddit.com/r/dataisbeautiful/comments/2qleug/what_americans_love_and_hate_doing_over_holidays/,0,0,0,0,What Americans love and hate doing over holidays,2014-12-0298.jpg,none,"holidays, christmas, traditions, culture"
What The Next Generation Of Economists Is Working On,mrmillersd,2014-12-28,http://fivethirtyeight.com/features/what-the-next-generation-of-economists-are-working-on/,https://www.reddit.com/r/dataisbeautiful/comments/2qlggt/what_the_next_generation_of_economists_is_working/,0,0,0,1,What The Next Generation Of Economists Is Working On,2014-12-0299.jpg,none,"education, graduates, careers, economics"
What’s The Most Common Street Name In America?,mrmillersd,2014-12-28,http://fivethirtyeight.com/datalab/whats-the-most-common-street-name-in-america/,https://www.reddit.com/r/dataisbeautiful/comments/2qlguo/whats_the_most_common_street_name_in_america/,4,4,0,2,What’s The Most Common Street Name In America,2014-12-0300.jpg,none,none
"How today's NFL games affect next season's schedules, and how those schedules affect expected results [OC]",bennstancil,2014-12-28,http://blog.modeanalytics.com/next-nfl-season/,https://www.reddit.com/r/dataisbeautiful/comments/2qmcr9/how_todays_nfl_games_affect_next_seasons/,6,6,0,1,"How today's NFL games affect next season's schedules, and how those schedules affect expected results OC",2014-12-0301.jpg,none,"sports, nfl, schedules"
Minimum Age of Marriage in Women Across the Globe [OC],tc_io,2014-12-28,http://www.visart.io/is-that-legal-a-breakdown-of-culture-through-data-and-age-limits/marriagewomenage/,https://www.reddit.com/r/dataisbeautiful/comments/2qn16b/minimum_age_of_marriage_in_women_across_the_globe/,7,7,0,5,Minimum Age of Marriage in Women Across the Globe OC,2014-12-0304.jpg,none,none
A number of super data-porny maps,Bloomsday1972,2014-12-28,http://statchatva.org/2012/06/11/the-nations-changing-political-topography/,https://www.reddit.com/r/dataisbeautiful/comments/2qnqky/a_number_of_super_dataporny_maps/,4,4,0,1,A number of super data-porny maps,2014-12-0307.jpg,none,"demographics, data visualization, maps, research, public service"
College Football’s Bloated Bowl Season In 3 Charts,rhiever,2014-12-29,http://fivethirtyeight.com/datalab/college-footballs-bloated-bowl-season-in-3-charts/,https://www.reddit.com/r/dataisbeautiful/comments/2qpwj0/college_footballs_bloated_bowl_season_in_3_charts/,12,12,0,1,College Football’s Bloated Bowl Season In 3 Charts,2014-12-0312.jpg,none,"college football, sports, bowl games"
A State-by-State Look at Where Each Generation Lives,47854379min,2014-12-29,http://www.governing.com/topics/urban/gov-generational-population-data-maps-by-state.html,https://www.reddit.com/r/dataisbeautiful/comments/2qqnmr/a_statebystate_look_at_where_each_generation_lives/,6,6,0,4,A State-by-State Look at Where Each Generation Lives,2014-12-0316.jpg,none,"demographics, geography, usa, generations"
"Yes, Your Parents Are Having Sex [OC]",Ouroboros18,2014-12-30,http://dadaviz.com/i/2622,https://www.reddit.com/r/dataisbeautiful/comments/2qtwj6/yes_your_parents_are_having_sex_oc/,156,156,0,92,"Yes, Your Parents Are Having Sex OC",2014-12-0328.jpg,none,none
Text messages area graph - I text my girlfriend more than I thought [OC],donut3,2014-12-30,http://imgur.com/kwTG1LZ,https://www.reddit.com/r/dataisbeautiful/comments/2qu9lc/text_messages_area_graph_i_text_my_girlfriend/,25,25,0,9,Text messages area graph - I text my girlfriend more than I thought OC,2014-12-0330.jpg,none,none
"The 2,128 Native American Mascots People Aren’t Talking About: Where Native Americans live, and where sports teams reference them.",bone-dry,2014-12-30,http://fivethirtyeight.com/features/the-2128-native-american-mascots-people-arent-talking-about/,https://www.reddit.com/r/dataisbeautiful/comments/2quefv/the_2128_native_american_mascots_people_arent/,4,4,0,12,"The 2,128 Native American Mascots People Aren’t Talking About Where Native Americans live, and where sports teams reference them.",2014-12-0331.jpg,none,"native americans, mascots, sports, culture, representation"
Driving ranges for the Model S series of Tesla vehicles,8bitremixguy,2014-12-30,http://www.teslamotors.com/blog/driving-range-model-s-family,https://www.reddit.com/r/dataisbeautiful/comments/2qvam9/driving_ranges_for_the_model_s_series_of_tesla/,0,0,0,1,Driving ranges for the Model S series of Tesla vehicles,2014-12-0335.jpg,none,none
The magnetic field along the galactic plane (x-post r/spaceporn),kaylai,2014-12-30,http://www.esa.int/var/esa/storage/images/esa_multimedia/images/2014/12/the_magnetic_field_along_the_galactic_plane/15110855-1-eng-GB/The_magnetic_field_along_the_Galactic_plane.jpg,https://www.reddit.com/r/dataisbeautiful/comments/2qvx7h/the_magnetic_field_along_the_galactic_plane_xpost/,12,12,0,2,The magnetic field along the galactic plane (x-post rspaceporn),2014-12-0337.jpg,none,"astronomy, space, science, galaxy, magnetic field"
Visualizing historical Wind Data (19 Oct. 2005) from NOAA.gov shows outline of continents and hurricane Wilma [OC],josdirksen,2014-12-31,"https://imgur.com/fSskiM4,1OQ8g5c,q73o9vv#0",https://www.reddit.com/r/dataisbeautiful/comments/2qwtzs/visualizing_historical_wind_data_19_oct_2005_from/,3,3,0,1,Visualizing historical Wind Data (19 Oct. 2005) from NOAA.gov shows outline of continents and hurricane Wilma OC,2014-12-0339.jpg,none,"weather, wind, hurricanes, historical data, noaa, geography, climate"
A break down of power generation in Ontario Canada,malokovich,2014-12-31,http://live.gridwatch.ca/home-page.html,https://www.reddit.com/r/dataisbeautiful/comments/2qyezu/a_break_down_of_power_generation_in_ontario_canada/,982,982,0,239,A break down of power generation in Ontario Canada,2014-12-0343.jpg,none,"energy, power generation, ontario, canada"
"Visual data representation of reddit's /r/CoonTown survey I made, asking participants various questions based on their beliefs. Warning: Not for the faint-hearted. [OC]",DinDoNuffins,2014-12-31,http://i.imgur.com/unsrHre.png,https://www.reddit.com/r/dataisbeautiful/comments/2qyyxe/visual_data_representation_of_reddits_rcoontown/,57,57,0,45,"Visual data representation of reddit's rCoonTown survey I made, asking participants various questions based on their beliefs. Warning Not for the fain",2014-12-0347.png,none,none
