title,author,created_date,url,full_permalink,score,ups,downs,num_comments,sanitized_title,image_file,chart_type,high_level_categories
Real-Time Wikipedia Edits Map,-Gavin-,2014-01-01,http://hatnote.com/,https://www.reddit.com/r/dataisbeautiful/comments/1u5wvj/realtime_wikipedia_edits_map/,28,28,0,3,Real-Time Wikipedia Edits Map,2014-01-0003.jpg,none,none
"Tweeting ""Happy New Year"" around the world",yaph,2014-01-01,http://twitter.github.io/interactive/newyear2014/,https://www.reddit.com/r/dataisbeautiful/comments/1u6cq2/tweeting_happy_new_year_around_the_world/,16,16,0,0,Tweeting Happy New Year around the world,2014-01-0007.jpg,none,"social media, new year, twitter"
What Can We Learn About America From The Stuff We Put Up Our Asses?,brizzle42,2014-01-02,http://regressing.deadspin.com/what-can-we-learn-about-america-from-the-stuff-we-put-u-1492250446/@Tom-Scocca,https://www.reddit.com/r/dataisbeautiful/comments/1u8x2p/what_can_we_learn_about_america_from_the_stuff_we/,325,325,0,45,What Can We Learn About America From The Stuff We Put Up Our Asses,2014-01-0013.jpg,none,"humor, america, culture"
"250 million protests worldwide, from 1979-2013, visualized in one time-lapse image",odinsgrudge,2014-01-03,http://ultraculture.org/blog/2013/08/26/watch-a-jaw-dropping-visualization-of-every-protest-since-1979/,https://www.reddit.com/r/dataisbeautiful/comments/1ud71d/250_million_protests_worldwide_from_19792013/,0,0,0,1,"250 million protests worldwide, from 1979-2013, visualized in one time-lapse image",2014-01-0020.jpg,none,"protests, activism, society, politics"
All dialogues of seinfeld (9 seasons) in a words cloud [OC],jacknotdead,2014-01-04,http://www.getsettalk.com/t/nuage-de-mots-series/7,https://www.reddit.com/r/dataisbeautiful/comments/1uen34/all_dialogues_of_seinfeld_9_seasons_in_a_words/,31,31,0,8,All dialogues of seinfeld (9 seasons) in a words cloud OC,2014-01-0023.jpg,none,none
Crowdsourcing Pokemon WonderTrade Data [OC],theirondeveloper,2014-01-05,http://www.wondertradeanalytics.com/data/pokemon,https://www.reddit.com/r/dataisbeautiful/comments/1ug4lu/crowdsourcing_pokemon_wondertrade_data_oc/,6,6,0,5,Crowdsourcing Pokemon WonderTrade Data OC,2014-01-0026.jpg,none,pokémon
Australian Heatwave Tracker,nbktdis,2014-01-05,http://www.abc.net.au/news/specials/heatwave-tracker/,https://www.reddit.com/r/dataisbeautiful/comments/1uhm9h/australian_heatwave_tracker/,12,12,0,0,Australian Heatwave Tracker,2014-01-0032.jpg,none,none
Infographics Lie. Here's How To Spot The B.S.,rhiever,2014-01-06,http://www.fastcodesign.com/3024273/infographic-of-the-day/infographics-lie-heres-how-to-spot-the-bs,https://www.reddit.com/r/dataisbeautiful/comments/1ujhhd/infographics_lie_heres_how_to_spot_the_bs/,60,60,0,5,Infographics Lie. Here's How To Spot The B.S.,2014-01-0038.jpg,none,"geography, maps, world"
100 Years of Rock (In Less Than A Minute),Vinnytsia,2014-01-06,http://www.concerthotels.com/100-years-of-rock,https://www.reddit.com/r/dataisbeautiful/comments/1ujxe9/100_years_of_rock_in_less_than_a_minute/,18,18,0,5,100 Years of Rock (In Less Than A Minute),2014-01-0039.jpg,none,"music, rock, history, genres"
"State migration flows, an adaptation of vizynary's work",Vinnytsia,2014-01-06,http://bl.ocks.org/cingraham/7663357,https://www.reddit.com/r/dataisbeautiful/comments/1uk6nc/state_migration_flows_an_adaptation_of_vizynarys/,17,17,0,4,"State migration flows, an adaptation of vizynary's work",2014-01-0040.jpg,none,none
Every Singe Curse Word in The Wolf of Wall Stree,PoopsMcG,2014-01-08,http://www.vulture.com/2014/01/wolf-of-wall-street-counting-all-the-curse-words.html,https://www.reddit.com/r/dataisbeautiful/comments/1uqv1f/every_singe_curse_word_in_the_wolf_of_wall_stree/,3,3,0,0,Every Singe Curse Word in The Wolf of Wall Stree,2014-01-0057.jpg,none,"film, language, entertainment"
A Fishy-Looking Test Score Distribution,pingish,2014-01-09,http://priceonomics.com/a-fishy-looking-test-score-distribution/,https://www.reddit.com/r/dataisbeautiful/comments/1uuwp7/a_fishylooking_test_score_distribution/,46,46,0,6,A Fishy-Looking Test Score Distribution,2014-01-0065.jpg,none,none
The Joy of Statistics: Hans Rosling,MarlinMr,2014-01-14,https://www.youtube.com/watch?v=CiCQepmcuj8,https://www.reddit.com/r/dataisbeautiful/comments/1v7cux/the_joy_of_statistics_hans_rosling/,6,6,0,1,The Joy of Statistics Hans Rosling,2014-01-0093.jpg,none,"statistics, data visualization, hans rosling, technology"
"The world’s taste for whiskey, visualized [X-Post from /r/whiskey]",ARatherOddOne,2014-01-14,http://qz.com/166242/the-worlds-taste-for-whiskey-visualized/,https://www.reddit.com/r/dataisbeautiful/comments/1v8chp/the_worlds_taste_for_whiskey_visualized_xpost/,5,5,0,0,"The world’s taste for whiskey, visualized X-Post from rwhiskey",2014-01-0097.jpg,none,"whiskey, beverages, consumer preferences"
Global Air Traffic over 24 hours,jumbodumbothoughts,2014-01-16,http://youtu.be/1XBwjQsOEeg,https://www.reddit.com/r/dataisbeautiful/comments/1vceho/global_air_traffic_over_24_hours/,5,5,0,0,Global Air Traffic over 24 hours,2014-01-0106.jpg,none,"aviation, air traffic, global, transportation"
ChaserTracer from DataTechArt - Audio and Video Representation of Storm Chaser Positions and Storm Reports for May 2011,atw527,2014-01-16,http://www.youtube.com/watch?v=q33uVVhJB8s,https://www.reddit.com/r/dataisbeautiful/comments/1vec53/chasertracer_from_datatechart_audio_and_video/,0,0,0,0,ChaserTracer from DataTechArt - Audio and Video Representation of Storm Chaser Positions and Storm Reports for May 2011,2014-01-0109.jpg,none,"storms, weather, geography, usa, 2011"
Global map of preventable outbreaks (there is a vaccine for it),the_raven42,2014-01-16,http://www.cfr.org/interactives/GH_Vaccine_Map/#map,https://www.reddit.com/r/dataisbeautiful/comments/1veh33/global_map_of_preventable_outbreaks_there_is_a/,14,14,0,1,Global map of preventable outbreaks (there is a vaccine for it),2014-01-0111.jpg,none,none
Drinking stats by state [OC],ChingaSaurus,2014-01-17,http://www.mylanderpages.com/tayloredginton/how-drunk-is-your-state,https://www.reddit.com/r/dataisbeautiful/comments/1vfbtl/drinking_stats_by_state_oc/,4,4,0,1,Drinking stats by state OC,2014-01-0113.jpg,none,none
The UK minimum wag: its history and comparison with other countries',big_al11,2014-01-17,http://www.theguardian.com/news/datablog/2013/oct/01/uk-minimum-wage-history-in-numbers,https://www.reddit.com/r/dataisbeautiful/comments/1vfyka/the_uk_minimum_wag_its_history_and_comparison/,0,0,0,2,The UK minimum wag its history and comparison with other countries',2014-01-0114.jpg,none,none
"After seeing the NFL's, here's last year's college football offenses and defenses [OC]",e8odie,2014-01-17,http://imgur.com/a/JhukL,https://www.reddit.com/r/dataisbeautiful/comments/1vhay0/after_seeing_the_nfls_heres_last_years_college/,14,14,0,2,"After seeing the NFL's, here's last year's college football offenses and defenses OC",2014-01-0121.jpg,none,none
How toilet paper explains the world,free_hugs1,2014-01-20,http://www.washingtonpost.com/blogs/wonkblog/wp/2014/01/20/how-toilet-paper-explains-the-world/?hpid=z4,https://www.reddit.com/r/dataisbeautiful/comments/1voyrr/how_toilet_paper_explains_the_world/,7,7,0,0,How toilet paper explains the world,2014-01-0134.jpg,none,"geopolitics, culture, consumer behavior"
I built a visualization of Bitcoin's regulatory status around the world.,bitlegal,2014-01-23,http://www.bitlegal.io/,https://www.reddit.com/r/dataisbeautiful/comments/1vz5hg/i_built_a_visualization_of_bitcoins_regulatory/,11,11,0,2,I built a visualization of Bitcoin's regulatory status around the world.,2014-01-0161.jpg,none,none
Triple J's Hottest 100s analysed. Every track that has made Australia's youth radio's annual best of list.,Allergy_Man,2014-01-23,http://www.theguardian.com/news/datablog/interactive/2014/jan/23/hottest-100-every-genre-interactive?CMP=soc_567,https://www.reddit.com/r/dataisbeautiful/comments/1vzhnd/triple_js_hottest_100s_analysed_every_track_that/,7,7,0,1,Triple J's Hottest 100s analysed. Every track that has made Australia's youth radio's annual best of list.,2014-01-0163.jpg,none,none
Sportsnation: west all stars vs. east all stars,excelquestion,2014-01-24,http://espn.go.com/espn/fp/flashPollResultsState?sportIndex=sportsnation&pollId=4157579,https://www.reddit.com/r/dataisbeautiful/comments/1w3190/sportsnation_west_all_stars_vs_east_all_stars/,3,3,0,2,Sportsnation west all stars vs. east all stars,2014-01-0165.jpg,none,"sports, basketball, teams, competition"
WSJ's Billion-Dollar Startup Club,ghodaz,2014-01-27,http://graphics.wsj.com/billion-dollar-club/,https://www.reddit.com/r/dataisbeautiful/comments/1wals7/wsjs_billiondollar_startup_club/,5,5,0,0,WSJ's Billion-Dollar Startup Club,2014-01-0176.jpg,none,"startups, business, finance, entrepreneurship"
"Snow depth at the summit of Mt. Mansfield in VT, current vs. historical average",Beaglesworth,2014-01-27,http://www.uvm.edu/skivt-l/?Page=depths.php,https://www.reddit.com/r/dataisbeautiful/comments/1wanyu/snow_depth_at_the_summit_of_mt_mansfield_in_vt/,6,6,0,0,"Snow depth at the summit of Mt. Mansfield in VT, current vs. historical average",2014-01-0177.jpg,none,"skiing, vermont, sports, recreation"
Health and Wealth of Nations D3 and Cesium Demo [Original Source],yaph,2014-01-27,http://cesiumjs.org/d3cesium/,https://www.reddit.com/r/dataisbeautiful/comments/1wb24s/health_and_wealth_of_nations_d3_and_cesium_demo/,6,6,0,1,Health and Wealth of Nations D3 and Cesium Demo Original Source,2014-01-0178.jpg,none,"health, wealth, nations, data visualization, d3, cesium"
"The Economic History of the Last 2,000 Years in 1 Little Graph",spinzka,2014-01-27,http://www.theatlantic.com/business/archive/2012/06/the-economic-history-of-the-last-2-000-years-in-1-little-graph/258676/,https://www.reddit.com/r/dataisbeautiful/comments/1wbz3v/the_economic_history_of_the_last_2000_years_in_1/,6,6,0,4,"The Economic History of the Last 2,000 Years in 1 Little Graph",2014-01-0181.jpg,none,none
"Visualization of surface winds (lines and black arrows) and temperatures (shaded colors) on Monday morning, as the latest Arctic blast swept from the Midwest to the South and East. Credit: earth.nullschool.net. via Climate Central",pnewell,2014-01-28,http://i.imgur.com/TORs4or.png,https://www.reddit.com/r/dataisbeautiful/comments/1wde6b/visualization_of_surface_winds_lines_and_black/,11,11,0,2,"Visualization of surface winds (lines and black arrows) and temperatures (shaded colors) on Monday morning, as the latest Arctic blast swept from the",2014-01-0184.jpg,none,"weather, climate, arctic, winds, temperatures, geography"
[OC] Galactic Map Projections: 6 different projections of the Milky Way Galaxy traced by 2.5million stars measured in the infrared,Mock_Twain,2014-01-28,http://www.ifweassume.com/2014/01/galactic-map-projections.html,https://www.reddit.com/r/dataisbeautiful/comments/1wdlnl/oc_galactic_map_projections_6_different/,8,8,0,1,OC Galactic Map Projections 6 different projections of the Milky Way Galaxy traced by 2.5million stars measured in the infrared,2014-01-0188.jpg,none,none
From 'Ripples' To 'RonPaulCoin'; There Are Now 83 Cryptocurrencies In The World,cuteman,2014-01-28,http://coinmarketcap.com/ripple.html,https://www.reddit.com/r/dataisbeautiful/comments/1wff8l/from_ripples_to_ronpaulcoin_there_are_now_83/,2,2,0,1,From 'Ripples' To 'RonPaulCoin'; There Are Now 83 Cryptocurrencies In The World,2014-01-0194.jpg,none,none
The State of The Union address minute by minute on Twitter,p3t3ypablo,2014-01-29,http://twitter.github.io/interactive/sotu2014/#p1,https://www.reddit.com/r/dataisbeautiful/comments/1wgwhj/the_state_of_the_union_address_minute_by_minute/,183,183,0,15,The State of The Union address minute by minute on Twitter,2014-01-0199.jpg,none,none
Surprising Test Results For Some Of The World's Richest Students,xav1,2014-01-29,http://www.huffingtonpost.com/2014/01/23/pisa-wealth_n_4641669.html,https://www.reddit.com/r/dataisbeautiful/comments/1wi36u/surprising_test_results_for_some_of_the_worlds/,24,24,0,5,Surprising Test Results For Some Of The World's Richest Students,2014-01-0203.jpg,none,none
Men's 100-Meter freestyle medalists,98aidan,2014-01-29,http://youtube.com/watch?v=VWAkhFJm7Q0,https://www.reddit.com/r/dataisbeautiful/comments/1wiu85/mens_100meter_freestyle_medalists/,31,31,0,0,Men's 100-Meter freestyle medalists,2014-01-0206.jpg,none,"sports, swimming, olympics, athletes"
Interactive timeline: How medical marijuana regulations developed in Massachusetts since the 2012 ballot vote,mnwill,2014-01-30,http://www.masslive.com/politics/index.ssf/2014/01/interactive_timeline_how_medic.html,https://www.reddit.com/r/dataisbeautiful/comments/1wkk3l/interactive_timeline_how_medical_marijuana/,2,2,0,0,Interactive timeline How medical marijuana regulations developed in Massachusetts since the 2012 ballot vote,2014-01-0207.jpg,none,"medical marijuana, massachusetts, regulations, policy, law, healthcare"
"Top companies, by number of mentions in rap song lyrics. [OC]",tresliso,2014-01-31,http://www.ibtimes.com/rap-clout-index-how-worlds-biggest-companies-rank-1552467,https://www.reddit.com/r/dataisbeautiful/comments/1wo4mj/top_companies_by_number_of_mentions_in_rap_song/,11,11,0,4,"Top companies, by number of mentions in rap song lyrics. OC",2014-01-0220.jpg,none,none
