title,author,created_date,url,full_permalink,score,ups,downs,num_comments,sanitized_title,image_file,chart_type,high_level_categories
Why is the Most-Viewed Gaming Video on YouTube About Cars 2? [OC],minimaxir,2015-06-15,http://minimaxir.com/2015/06/cars-2/,https://www.reddit.com/r/dataisbeautiful/comments/39x6rt/why_is_the_mostviewed_gaming_video_on_youtube/,6,6,0,4,Why is the Most-Viewed Gaming Video on YouTube About Cars 2 OC,2015-06-0188.jpg,none,"movies, gaming, youtube"
"I made a site that ranks 500 cities on cost of living, weather, internet speed and other metrics called Nomad List",levelsi,2015-06-15,https://nomadlist.com/?v=2.0,https://www.reddit.com/r/dataisbeautiful/comments/39x78m/i_made_a_site_that_ranks_500_cities_on_cost_of/,3581,3581,0,904,"I made a site that ranks 500 cities on cost of living, weather, internet speed and other metrics called Nomad List",2015-06-0189.jpg,none,"remote work, travel, cost of living, weather, internet speed, digital nomads"
What's your place in the world population?,army_ant,2015-06-15,http://population.io/,https://www.reddit.com/r/dataisbeautiful/comments/39y084/whats_your_place_in_the_world_population/,43,43,0,14,What's your place in the world population,2015-06-0192.jpg,none,none
Scientists have discovered how the month you’re born matters for your health,Pun_isher,2015-06-15,http://www.washingtonpost.com/blogs/wonkblog/wp/2015/06/15/what-your-birth-month-means-for-your-risk-of-disease/?postshare=7221434402099337,https://www.reddit.com/r/dataisbeautiful/comments/39ypbo/scientists_have_discovered_how_the_month_youre/,5,5,0,4,Scientists have discovered how the month you’re born matters for your health,2015-06-0194.jpg,none,none
The most uniquely popular cuisine in every state,geargirl,2015-06-16,http://www.washingtonpost.com/blogs/wonkblog/wp/2015/06/12/map-the-most-uniquely-popular-cuisine-in-every-state/?tid=hybrid_experimentrandom_1_na,https://www.reddit.com/r/dataisbeautiful/comments/3a0y58/the_most_uniquely_popular_cuisine_in_every_state/,14,14,0,18,The most uniquely popular cuisine in every state,2015-06-0197.jpg,none,none
Executive Compensation at Public and Private Colleges [OC],lolatu2,2015-06-16,https://slemma.com/share/0aadc51f037e322bfceed00566af18dac6ae80bf,https://www.reddit.com/r/dataisbeautiful/comments/3a1cdt/executive_compensation_at_public_and_private/,5,5,0,2,Executive Compensation at Public and Private Colleges OC,2015-06-0199.jpg,none,none
Reviving the Statistical Atlas of the United States with New Data,jxf,2015-06-16,http://flowingdata.com/2015/06/16/reviving-the-statistical-atlas-of-the-united-states-with-new-data/,https://www.reddit.com/r/dataisbeautiful/comments/3a1r30/reviving_the_statistical_atlas_of_the_united/,8,8,0,1,Reviving the Statistical Atlas of the United States with New Data,2015-06-0201.jpg,none,"statistics, united states, data analysis, government, 21st century"
Chart: The animals that are most likely to kill you this summer,newsjunkienyc,2015-06-16,http://www.washingtonpost.com/blogs/wonkblog/wp/2015/06/16/chart-the-animals-that-are-most-likely-to-kill-you-this-summer/,https://www.reddit.com/r/dataisbeautiful/comments/3a2nem/chart_the_animals_that_are_most_likely_to_kill/,45,45,0,14,Chart The animals that are most likely to kill you this summer,2015-06-0204.jpg,none,"animals, danger, summer, safety"
android version adoption rates over time,wobblymint,2015-06-16,https://en.wikipedia.org/wiki/Android_version_history#/media/File:Android_historical_version_distribution_-_vector.svg,https://www.reddit.com/r/dataisbeautiful/comments/3a3tir/android_version_adoption_rates_over_time/,2,2,0,2,android version adoption rates over time,2015-06-0208.jpg,none,"technology, mobile, operating systems"
"2001-2011 demographic change in most European Countries + Turkey (blue = decrease, red = increase)",muyuu,2015-06-17,http://www.bbr.bund.de/BBSR/DE/Home/Topthemen/Downloads/bevoelkerungsentwicklung.jpg;jsessionid=CBEC77589631748C4CC702FD561F1B52.live2053?__blob=publicationFile&v=2,https://www.reddit.com/r/dataisbeautiful/comments/3a51zd/20012011_demographic_change_in_most_european/,114,114,0,44,"2001-2011 demographic change in most European Countries + Turkey (blue = decrease, red = increase)",2015-06-0211.jpg,none,none
Five Years of Greek Misery Laid Bare in Five Depressing Charts - Bloomberg Business,jimrosenz,2015-06-18,http://www.bloomberg.com/news/articles/2015-06-18/five-years-of-greek-misery-laid-bare-in-five-depressing-charts,https://www.reddit.com/r/dataisbeautiful/comments/3a9kmj/five_years_of_greek_misery_laid_bare_in_five/,0,0,0,0,Five Years of Greek Misery Laid Bare in Five Depressing Charts - Bloomberg Business,2015-06-0218.jpg,none,"greece, economy, politics, european union"
"Are we too tough on criminals after they serve their time? Some states have more than 1,800 laws restricting what ex-offenders can do.",Jgrovum,2015-06-18,http://www.pewtrusts.org/en/research-and-analysis/blogs/stateline/2015/6/18/states-try-to-remove-barriers-for-ex-offenders,https://www.reddit.com/r/dataisbeautiful/comments/3a9zxr/are_we_too_tough_on_criminals_after_they_serve/,137,137,0,29,"Are we too tough on criminals after they serve their time Some states have more than 1,800 laws restricting what ex-offenders can do.",2015-06-0220.jpg,none,none
Maps: Where you’re most likely to get killed by animals this summer - The Washington Post,jimrosenz,2015-06-18,http://www.washingtonpost.com/blogs/wonkblog/wp/2015/06/17/maps-where-youre-most-likely-to-get-killed-by-animals-this-summer/,https://www.reddit.com/r/dataisbeautiful/comments/3aa27m/maps_where_youre_most_likely_to_get_killed_by/,0,0,0,0,Maps Where you’re most likely to get killed by animals this summer - The Washington Post,2015-06-0222.jpg,none,none
The ratio of the USD to the Zimbabwean Dollar is 10^23 to 1,sarahbotts,2015-06-18,https://en.wikipedia.org/wiki/Zimbabwean_dollar#Hyperinflation,https://www.reddit.com/r/dataisbeautiful/comments/3aabxn/the_ratio_of_the_usd_to_the_zimbabwean_dollar_is/,4,4,0,2,The ratio of the USD to the Zimbabwean Dollar is 10^23 to 1,2015-06-0224.jpg,none,"currency, economics, hyperinflation, zimbabwe, money"
Why so many kids can't sit still in school today,sarahbotts,2015-06-18,http://www.washingtonpost.com/blogs/answer-sheet/wp/2014/07/08/why-so-many-kids-cant-sit-still-in-school-today/,https://www.reddit.com/r/dataisbeautiful/comments/3aacvq/why_so_many_kids_cant_sit_still_in_school_today/,246,246,0,88,Why so many kids can't sit still in school today,2015-06-0226.jpg,none,"education, childhood, attention, schools, behavior"
Invisible Infrastructure - Explore the data insights behind the 14 major sectors of the U.S. economy,chrisarchitect,2015-06-18,http://www.theatlantic.com/sponsored/seagate/the-invisible-infrastructure/377/,https://www.reddit.com/r/dataisbeautiful/comments/3aaqrx/invisible_infrastructure_explore_the_data/,0,0,0,0,Invisible Infrastructure - Explore the data insights behind the 14 major sectors of the U.S. economy,2015-06-0227.jpg,none,"infrastructure, economy, data, sectors"
Charts and data of deadly police encounters in the US,Benentono,2015-06-18,http://www.fastcompany.com/3045724/fatal-encounters-crowdsourcing-deaths-by-police,https://www.reddit.com/r/dataisbeautiful/comments/3abocp/charts_and_data_of_deadly_police_encounters_in/,13,13,0,3,Charts and data of deadly police encounters in the US,2015-06-0231.jpg,none,none
Black Americans Are Killed At 12 Times The Rate Of People In Other Developed Countries,sha_man,2015-06-18,http://fivethirtyeight.com/datalab/black-americans-are-killed-at-12-times-the-rate-of-people-in-other-developed-countries/,https://www.reddit.com/r/dataisbeautiful/comments/3ac4ko/black_americans_are_killed_at_12_times_the_rate/,3036,3036,0,3464,Black Americans Are Killed At 12 Times The Rate Of People In Other Developed Countries,2015-06-0232.jpg,none,none
The Shootings in a Charleston Church,Pun_isher,2015-06-18,http://www.nytimes.com/interactive/2015/06/18/us/charleston-church-shooting-maps-and-suspect.html?smid=tw-share&_r=0,https://www.reddit.com/r/dataisbeautiful/comments/3ackw9/the_shootings_in_a_charleston_church/,0,0,0,0,The Shootings in a Charleston Church,2015-06-0233.jpg,none,"charleston, shootings, church, events, crime"
You have to see how many more people are killed by guns in America to actually believe it,pateras,2015-06-19,http://www.washingtonpost.com/blogs/wonkblog/wp/2015/06/18/you-have-to-see-how-many-more-people-are-killed-by-guns-in-america-to-really-believe-it/,https://www.reddit.com/r/dataisbeautiful/comments/3ad6ez/you_have_to_see_how_many_more_people_are_killed/,0,0,0,33,You have to see how many more people are killed by guns in America to actually believe it,2015-06-0236.jpg,none,"guns, america, violence, politics, second amendment"
"Not physically beautiful, but informationally compelling... Metadata: Australians’ phone and internet details accessed 334,658 times in 2013-14",Matti_Matti_Matti,2015-06-19,http://www.theguardian.com/news/datablog/2015/jun/19/metadata-australians-phone-and-internet-details-accessed-334658-times-in-2013-14,https://www.reddit.com/r/dataisbeautiful/comments/3adyl2/not_physically_beautiful_but_informationally/,1,1,0,2,"Not physically beautiful, but informationally compelling... Metadata Australians’ phone and internet details accessed 334,658 times in 2013-14",2015-06-0237.jpg,none,"telecommunications, privacy, australia, data access"
Is the Pope Right About the World?,jimrosenz,2015-06-19,http://www.theatlantic.com/international/archive/2013/12/is-the-pope-right-about-the-world/282276/,https://www.reddit.com/r/dataisbeautiful/comments/3adzf8/is_the_pope_right_about_the_world/,0,0,0,1,Is the Pope Right About the World,2015-06-0238.jpg,none,"religion, world affairs, papacy"
Some things you should know about Steam,trunksx34,2015-06-19,https://medium.com/@galyonkin/some-things-you-should-know-about-steam-5eaffcf33218,https://www.reddit.com/r/dataisbeautiful/comments/3aefym/some_things_you_should_know_about_steam/,216,216,0,24,Some things you should know about Steam,2015-06-0240.jpg,none,none
What low income families spend on the Lottery vs what they pay in taxes [OC],hlake,2015-06-19,http://metrocosm.com/could-the-lottery-be-the-largest-tax/,https://www.reddit.com/r/dataisbeautiful/comments/3afqb9/what_low_income_families_spend_on_the_lottery_vs/,23,23,0,11,What low income families spend on the Lottery vs what they pay in taxes OC,2015-06-0247.jpg,none,none
Visualizing mass murder data from Mother Jones using Tableau [OC],thecity2,2015-06-19,http://www.d3coder.com/thecity/wp-content/uploads/2015/06/mass-murder-data.png,https://www.reddit.com/r/dataisbeautiful/comments/3agmuh/visualizing_mass_murder_data_from_mother_jones/,8,8,0,9,Visualizing mass murder data from Mother Jones using Tableau OC,2015-06-0250.png,none,none
"Guns in America: For every criminal killed in self-defense, 34 innocent people die - The Washington Post",jimrosenz,2015-06-19,http://www.washingtonpost.com/blogs/wonkblog/wp/2015/06/19/guns-in-america-for-every-criminal-killed-in-self-defense-34-innocent-people-die/,https://www.reddit.com/r/dataisbeautiful/comments/3agqh1/guns_in_america_for_every_criminal_killed_in/,617,617,0,729,"Guns in America For every criminal killed in self-defense, 34 innocent people die - The Washington Post",2015-06-0251.jpg,none,"guns, crime, self-defense, violence, america, washington post"
John Oliver's youtube visualisation.,urltv_007,2015-06-21,http://youtrends.gauravgarg.me/result?name=john+olliver,https://www.reddit.com/r/dataisbeautiful/comments/3al5jn/john_olivers_youtube_visualisation/,2,2,0,1,John Oliver's youtube visualisation.,2015-06-0264.jpg,none,"television, comedy, entertainment"
Oil Well - every cooking oil compared,ChemicalNovae,2015-06-21,http://www.informationisbeautiful.net/visualizations/oil-well-every-cooking-oil-compared/,https://www.reddit.com/r/dataisbeautiful/comments/3al9im/oil_well_every_cooking_oil_compared/,32,32,0,11,Oil Well - every cooking oil compared,2015-06-0266.jpg,none,none
Some common ways that people misrepresent data with charts,Notmyrealname,2015-06-21,http://news.nationalgeographic.com/2015/06/150619-data-points-five-ways-to-lie-with-charts/?utm_source=Facebook&utm_medium=Social&utm_content=link_fb20150620news-charts&utm_campaign=Content&sf10141208=1,https://www.reddit.com/r/dataisbeautiful/comments/3alsq2/some_common_ways_that_people_misrepresent_data/,652,652,0,58,Some common ways that people misrepresent data with charts,2015-06-0268.jpg,none,none
How emergency clinicians determine regular vs. irregular,danwin,2015-06-21,http://emupdates.com/2015/04/14/how-emergency-clinicians-determine-regular-vs-irregular/,https://www.reddit.com/r/dataisbeautiful/comments/3am3sy/how_emergency_clinicians_determine_regular_vs/,167,167,0,24,How emergency clinicians determine regular vs. irregular,2015-06-0269.jpg,none,"healthcare, cardiology, ecg, emergency, diagnostics"
The hungriest people in the world,flashbunnny,2015-06-21,http://news.nationalgeographic.com/2015/05/150527-hunger-fao-report-undernourished-hungry/,https://www.reddit.com/r/dataisbeautiful/comments/3amso5/the_hungriest_people_in_the_world/,3,3,0,1,The hungriest people in the world,2015-06-0272.jpg,none,none
The Massacre In Charleston Is Unlikely To Lead To Gun Control Legislation | FiveThirtyEight,jimrosenz,2015-06-21,http://fivethirtyeight.com/datalab/the-massacre-in-charleston-is-unlikely-to-lead-to-gun-control-legislation/,https://www.reddit.com/r/dataisbeautiful/comments/3ao0dl/the_massacre_in_charleston_is_unlikely_to_lead_to/,0,0,0,5,The Massacre In Charleston Is Unlikely To Lead To Gun Control Legislation FiveThirtyEight,2015-06-0277.jpg,none,none
"War is declining. If it seems otherwise, part of the explanation is that we forgot most of the wars in the past. Here is an empirical view on the last 600 years. [OC]",Max_OurWorldinData,2015-06-22,http://ourworldindata.org/data/war-peace/war-and-peace-before-1945/,https://www.reddit.com/r/dataisbeautiful/comments/3apbp3/war_is_declining_if_it_seems_otherwise_part_of/,2762,2762,0,441,"War is declining. If it seems otherwise, part of the explanation is that we forgot most of the wars in the past. Here is an empirical view on the last",2015-06-0280.jpg,none,none
The Median Age Of Every Country In The World [OC],CJMinard,2015-06-22,http://dadaviz.com/i/4145,https://www.reddit.com/r/dataisbeautiful/comments/3apglm/the_median_age_of_every_country_in_the_world_oc/,26,26,0,7,The Median Age Of Every Country In The World OC,2015-06-0282.jpg,none,none
CEO to employee pay gaps within companies,whydoesthisitch,2015-06-22,http://www.payscale.com/data-packages/ceo-income,https://www.reddit.com/r/dataisbeautiful/comments/3apzdq/ceo_to_employee_pay_gaps_within_companies/,5,5,0,7,CEO to employee pay gaps within companies,2015-06-0284.jpg,none,"compensation, business, pay gaps, employment, management"
Map of crimes (with type) around any US address.,everettknag,2015-06-22,https://www.addressreport.com,https://www.reddit.com/r/dataisbeautiful/comments/3aqxnw/map_of_crimes_with_type_around_any_us_address/,2,2,0,3,Map of crimes (with type) around any US address.,2015-06-0287.jpg,none,none
Reviving the Statistical Atlas of the United States with New Data,misplaced_my_pants,2015-06-22,http://flowingdata.com/2015/06/16/reviving-the-statistical-atlas-of-the-united-states-with-new-data,https://www.reddit.com/r/dataisbeautiful/comments/3as0ti/reviving_the_statistical_atlas_of_the_united/,6,6,0,1,Reviving the Statistical Atlas of the United States with New Data,2015-06-0289.jpg,none,"statistics, data visualization, united states, government, analyses"
How Old Is Your Flag? Sovereign States By Century Of Current Flag Adoption [OC],MrBeanie88,2015-06-23,http://dadaviz.com/i/4299,https://www.reddit.com/r/dataisbeautiful/comments/3at2qy/how_old_is_your_flag_sovereign_states_by_century/,23,23,0,39,How Old Is Your Flag Sovereign States By Century Of Current Flag Adoption OC,2015-06-0292.jpg,none,none
People with more guns tend to kill more people... with guns.,rhiever,2015-06-23,http://www.motherjones.com/politics/2013/01/pro-gun-myths-fact-check,https://www.reddit.com/r/dataisbeautiful/comments/3atigf/people_with_more_guns_tend_to_kill_more_people/,0,0,0,170,People with more guns tend to kill more people... with guns.,2015-06-0294.jpg,none,"guns, safety, myths, violence, gender issues"
300 interviews in 30 days,carljoseph,2015-06-23,http://blog.triplebyte.com/three-hundred-programming-interviews-in-thirty-days,https://www.reddit.com/r/dataisbeautiful/comments/3awcfe/300_interviews_in_30_days/,1,1,0,0,300 interviews in 30 days,2015-06-0303.jpg,none,"interviews, time, communications"
China's urban population has doubled in size since 1994 [OC],thedatavizwiz,2015-06-23,https://slemma.com/share/f1c85a6356cd31e3281e26d504888494be5ee96d,https://www.reddit.com/r/dataisbeautiful/comments/3awe9u/chinas_urban_population_has_doubled_in_size_since/,2,2,0,2,China's urban population has doubled in size since 1994 OC,2015-06-0304.jpg,none,"population, demographics, china, urbanization, growth"
The price of Team Fortress 2 keys during the Steam Summer Sale,Pikamander2,2015-06-23,http://steamcommunity.com/market/listings/440/Mann%20Co.%20Supply%20Crate%20Key#pricehistory,https://www.reddit.com/r/dataisbeautiful/comments/3awiv6/the_price_of_team_fortress_2_keys_during_the/,5,5,0,2,The price of Team Fortress 2 keys during the Steam Summer Sale,2015-06-0305.jpg,none,none
"This watercolor chart compares economic growth to energy efficiency... As economies get richer, growth requires less power.",kmcollin,2015-06-23,http://www.bloomberg.com/news/articles/2015-06-23/the-way-humans-get-electricity-is-about-to-change-forever,https://www.reddit.com/r/dataisbeautiful/comments/3awod3/this_watercolor_chart_compares_economic_growth_to/,2,2,0,0,"This watercolor chart compares economic growth to energy efficiency... As economies get richer, growth requires less power.",2015-06-0306.jpg,none,none
Most mutual funds still can't beat their benchmark | Business Insider,jimrosenz,2015-06-24,http://www.businessinsider.com.au/large-cap-equity-funds-underperform-the-sp-500-2015-6,https://www.reddit.com/r/dataisbeautiful/comments/3aws78/most_mutual_funds_still_cant_beat_their_benchmark/,1,1,0,0,Most mutual funds still can't beat their benchmark Business Insider,2015-06-0307.jpg,none,"finance, investing, mutual funds"
Private prison contracts map,hlake,2015-06-24,https://www.muckrock.com/news/archives/2015/jan/05/cca-private-prison-contract-map/,https://www.reddit.com/r/dataisbeautiful/comments/3awxeo/private_prison_contracts_map/,3,3,0,0,Private prison contracts map,2015-06-0308.jpg,none,none
10 years of reddit in 11 graphs [OC],CJMinard,2015-06-24,http://dadaviz.com/t/reddit10,https://www.reddit.com/r/dataisbeautiful/comments/3axuam/10_years_of_reddit_in_11_graphs_oc/,2311,2311,0,244,10 years of reddit in 11 graphs OC,2015-06-0311.jpg,none,none
Billionaires 2015 [OC],lolatu2,2015-06-24,https://slemma.com/share/2165ce139eb27253d2ddf47358449c315047d919,https://www.reddit.com/r/dataisbeautiful/comments/3ay82q/billionaires_2015_oc/,2,2,0,1,Billionaires 2015 OC,2015-06-0316.jpg,none,"business, wealth, economy"
Tactile data visualization for an exhibit highlighting the relationship between failure and success [OC],Pun_isher,2015-06-24,http://www.columnfivemedia.com/case-studies/fear-of-failure-creative-success,https://www.reddit.com/r/dataisbeautiful/comments/3az6ch/tactile_data_visualization_for_an_exhibit/,3,3,0,1,Tactile data visualization for an exhibit highlighting the relationship between failure and success OC,2015-06-0324.jpg,none,"failure, success, exhibits, creativity, art"
Women's World Cup: Quarterfinalist Visualizations and Analysis [OC],genomer,2015-06-24,http://statsthatmatter.org/uswnt-statistics/,https://www.reddit.com/r/dataisbeautiful/comments/3b0b25/womens_world_cup_quarterfinalist_visualizations/,4,4,0,1,Women's World Cup Quarterfinalist Visualizations and Analysis OC,2015-06-0326.jpg,none,"sports, soccer, women's world cup, analysis"
Spanish domination of World Soccer.,theirishcampfire,2015-06-25,http://www.lemonde.fr/les-decodeurs/visuel/2015/06/11/la-domination-de-l-espagne-sur-le-foot-mondial-en-une-infographie_4652236_4355770.html,https://www.reddit.com/r/dataisbeautiful/comments/3b339w/spanish_domination_of_world_soccer/,15,15,0,3,Spanish domination of World Soccer.,2015-06-0334.jpg,none,none
[OC] Chicago New Construction & Demo Permits 2006-2010,KIG_Analytics,2015-06-25,https://youtu.be/3prrNVC0Lcg,https://www.reddit.com/r/dataisbeautiful/comments/3b3f1k/oc_chicago_new_construction_demo_permits_20062010/,3,3,0,2,OC Chicago New Construction & Demo Permits 2006-2010,2015-06-0335.jpg,none,"urban planning, construction, permits, chicago, demographics"
Bordering Countries with Large GDP per Capita Differences [OC],lolatu2,2015-06-25,https://slemma.com/share/8cb74fb67e9dd29443f3ecfb9f93a8e4779b2468,https://www.reddit.com/r/dataisbeautiful/comments/3b3k0n/bordering_countries_with_large_gdp_per_capita/,2,2,0,1,Bordering Countries with Large GDP per Capita Differences OC,2015-06-0338.jpg,none,none
Exponential Growth Of Global Solar PV Production & Installation,sasuke2490,2015-06-25,http://cleantechnica.com/2014/07/22/exponential-growth-global-solar-pv-production-installation/,https://www.reddit.com/r/dataisbeautiful/comments/3b4655/exponential_growth_of_global_solar_pv_production/,5,5,0,0,Exponential Growth Of Global Solar PV Production & Installation,2015-06-0341.jpg,none,none
Just How Big is the Gender Gap in Fine Art?,jimrosenz,2015-06-25,http://priceonomics.com/just-how-big-is-the-gender-gap-in-fine-art/,https://www.reddit.com/r/dataisbeautiful/comments/3b4si0/just_how_big_is_the_gender_gap_in_fine_art/,0,0,0,3,Just How Big is the Gender Gap in Fine Art,2015-06-0342.jpg,none,none
Visualizing 100 Years of Earthquakes,GeoGeoGeoGeo,2015-06-25,http://geovisualist.com/2015/06/22/visualizing-100-years-of-earthquakes/?utm_campaign=CartoDB&utm_content=17247347&utm_medium=social&utm_source=twitter,https://www.reddit.com/r/dataisbeautiful/comments/3b5bc7/visualizing_100_years_of_earthquakes/,1,1,0,0,Visualizing 100 Years of Earthquakes,2015-06-0344.jpg,none,none
How important is the EU to UK trade? | City A.M.,jimrosenz,2015-06-26,http://www.cityam.com/218917/how-important-eu-uk-trade?utm_source=dlvr.it&utm_medium=twitter,https://www.reddit.com/r/dataisbeautiful/comments/3b6jbo/how_important_is_the_eu_to_uk_trade_city_am/,2,2,0,0,How important is the EU to UK trade City A.M.,2015-06-0347.jpg,none,"trade, eu, uk, economics"
Beautiful visualization of Facebook conversation,AuGraeber,2015-06-26,https://www.youtube.com/watch?v=Key82sLrrqA,https://www.reddit.com/r/dataisbeautiful/comments/3b6peg/beautiful_visualization_of_facebook_conversation/,4,4,0,1,Beautiful visualization of Facebook conversation,2015-06-0348.jpg,none,"social media, facebook, communication"
Gay Marriage Has Been Legalized Nationwide by U.S. Supreme Court - here's how same-sex marriage was implemented state-by-state,rhiever,2015-06-26,http://www.bloomberg.com/news/articles/2015-06-26/gay-marriage-legalized-nationwide-by-u-s-supreme-court-ibdovxv1,https://www.reddit.com/r/dataisbeautiful/comments/3b75ja/gay_marriage_has_been_legalized_nationwide_by_us/,65,65,0,22,Gay Marriage Has Been Legalized Nationwide by U.S. Supreme Court - here's how same-sex marriage was implemented state-by-state,2015-06-0350.jpg,none,"lgbtq+, rights, law, u.s. supreme court, social change"
"Population of US, Canada, and Europe by degrees of latitude north (3rd image on page)",Numendil,2015-06-27,http://www.prooffreader.com/2013/11/canada-strong-and-free-but-maybe-not-as.html,https://www.reddit.com/r/dataisbeautiful/comments/3bb8l9/population_of_us_canada_and_europe_by_degrees_of/,39,39,0,6,"Population of US, Canada, and Europe by degrees of latitude north (3rd image on page)",2015-06-0369.jpg,none,none
New research shows that middle-class black and Hispanic households live in poorer neighborhoods than white and Asian families with comparable incomes. The findings underscore how specific groups face steeper hurdles to upward mobility.,drewiepoodle,2015-06-27,http://www.nytimes.com/2015/06/25/upshot/middle-class-black-families-in-low-income-neighborhoods.html?abt=0002&abg=0,https://www.reddit.com/r/dataisbeautiful/comments/3bd6fr/new_research_shows_that_middleclass_black_and/,8,8,0,1,New research shows that middle-class black and Hispanic households live in poorer neighborhoods than white and Asian families with comparable incomes.,2015-06-0374.jpg,none,"demographics, socioeconomics, neighborhoods, race, income, mobility"
Ten years of reddit,LemonWarlord,2015-06-28,https://www.youtube.com/watch?v=ZzXdXAqch5Y,https://www.reddit.com/r/dataisbeautiful/comments/3beq3z/ten_years_of_reddit/,13,13,0,2,Ten years of reddit,2015-06-0381.jpg,none,"reddit, anniversary, social media"
Animated world map of geotagged tweets mentioning 'sunrise' in different languages,rhiever,2015-06-28,http://cartodb.s3.amazonaws.com/static_vizz/sunrise.html?title=true&description=true&search=false&shareable=true&cartodb_logo=true&layer_selector=false&legends=false&scrollwheel=true&sublayer_options=1%7C1&sql=&zoom=2&r=1&center_lat=22.917922936146045&center_lon=51.328125#,https://www.reddit.com/r/dataisbeautiful/comments/3bevrb/animated_world_map_of_geotagged_tweets_mentioning/,93,93,0,10,Animated world map of geotagged tweets mentioning 'sunrise' in different languages,2015-06-0382.jpg,none,none
