title,author,created_date,url,full_permalink,score,ups,downs,num_comments,sanitized_title,image_file,chart_type,high_level_categories
"The 25 largest subreddits and the 1,666 mods (and bots) that keep them going: an analysis [OC]",CJMinard,2015-06-29,http://dadaviz.com/t/redditmods/,https://www.reddit.com/r/dataisbeautiful/comments/3bi125/the_25_largest_subreddits_and_the_1666_mods_and/,57,57,0,23,"The 25 largest subreddits and the 1,666 mods (and bots) that keep them going an analysis OC",2015-06-0389.jpg,none,none
"Deaths, Education, Poverty and The Tile Grid Map [OC]",lolatu2,2015-06-29,https://slemma.com/share/449282038483fe487f1330fbbe79409b32569927,https://www.reddit.com/r/dataisbeautiful/comments/3bia64/deaths_education_poverty_and_the_tile_grid_map_oc/,5,5,0,2,"Deaths, Education, Poverty and The Tile Grid Map OC",2015-06-0391.jpg,none,none
Matching Every Supreme Court Vote Combination to Historical Cases [OC],arm5077,2015-06-29,http://www.nationaljournal.com/domesticpolicy/make-your-own-supreme-court-decision-and-see-how-the-real-one-voted-20150629,https://www.reddit.com/r/dataisbeautiful/comments/3bk4cl/matching_every_supreme_court_vote_combination_to/,1,1,0,1,Matching Every Supreme Court Vote Combination to Historical Cases OC,2015-06-0394.jpg,none,"law, supreme court, cases, history"
Top Professions in America That Are Lacking in Diversity - The Atlantic,jimrosenz,2015-06-30,http://www.theatlantic.com/business/archive/2015/06/diversity-jobs-professions-america/396632/?utm_source=SFFB,https://www.reddit.com/r/dataisbeautiful/comments/3bliuz/top_professions_in_america_that_are_lacking_in/,0,0,0,0,Top Professions in America That Are Lacking in Diversity - The Atlantic,2015-06-0395.jpg,none,"diversity, professions, america, society"
World Cup Semifinal Statistical Preview with Visualizations [OC],genomer,2015-06-30,http://statsthatmatter.org/world-cup-semifinal-statistical-preview/,https://www.reddit.com/r/dataisbeautiful/comments/3blixb/world_cup_semifinal_statistical_preview_with/,6,6,0,2,World Cup Semifinal Statistical Preview with Visualizations OC,2015-06-0396.jpg,none,none
Male and Female Anatomical Differences [OC],lolatu2,2015-06-30,https://slemma.com/share/a27657b900452e8df59ab74bda00cef8462c658d,https://www.reddit.com/r/dataisbeautiful/comments/3bmljg/male_and_female_anatomical_differences_oc/,151,151,0,22,Male and Female Anatomical Differences OC,2015-06-0400.jpg,none,"anatomy, gender differences"
This Is The Hourly Wage You Need To Afford A 2-Bedroom Apartment Around The U.S.,iissmarter,2015-06-30,http://www.huffingtonpost.com/2015/06/01/minimum-wage-apartment-hourly-salary-housing-costs_n_7472472.html,https://www.reddit.com/r/dataisbeautiful/comments/3bnab5/this_is_the_hourly_wage_you_need_to_afford_a/,44,44,0,54,This Is The Hourly Wage You Need To Afford A 2-Bedroom Apartment Around The U.S.,2015-06-0403.jpg,none,none
The most educated new source audience is.....BuzzFeed?,bogazicicat,2015-06-30,http://dadaviz.com/i/4303,https://www.reddit.com/r/dataisbeautiful/comments/3bngb6/the_most_educated_new_source_audience_isbuzzfeed/,0,0,0,4,The most educated new source audience is.....BuzzFeed,2015-06-0407.jpg,none,"gambling, poker, cards, game"
this map shows where to live to retire rich,RyRyrodriguez,2015-06-30,http://www.gobankingrates.com/personal-finance/best-worst-states-retire-rich/,https://www.reddit.com/r/dataisbeautiful/comments/3bnkal/this_map_shows_where_to_live_to_retire_rich/,1,1,0,0,this map shows where to live to retire rich,2015-06-0408.jpg,none,none
This is why the South does not want to give up its battle flag [OC],isaacfab,2015-06-30,http://www.isaacfaber.com/thoughts/2015/6/28/this-is-why-the-south-does-not-want-to-give-up-its-battle-flag,https://www.reddit.com/r/dataisbeautiful/comments/3bnp1x/this_is_why_the_south_does_not_want_to_give_up/,32,32,0,41,This is why the South does not want to give up its battle flag OC,2015-06-0410.jpg,none,"history, culture, symbols, southern united states"
"The Extreme Economic Outlier That Is Greece, In 7 Charts | FiveThirtyEight",jimrosenz,2015-06-30,http://fivethirtyeight.com/datalab/the-extreme-economic-outlier-that-is-greece-in-7-charts/?ex_cid=538fb,https://www.reddit.com/r/dataisbeautiful/comments/3bo8qs/the_extreme_economic_outlier_that_is_greece_in_7/,6,6,0,0,"The Extreme Economic Outlier That Is Greece, In 7 Charts FiveThirtyEight",2015-06-0411.jpg,none,"economics, greece, outlier, fivethirtyeight"
