title,author,created_date,url,full_permalink,score,ups,downs,num_comments,sanitized_title,image_file,chart_type,high_level_categories
The way Uber fares are calculated is a mess | Fusion,jimrosenz,2015-06-01,http://fusion.net/story/140655/the-way-uber-fares-are-calculated-is-a-mess/?utm_source=twitter&utm_medium=social&utm_campaign=thisisfusion&hootPostID=c6a7c015ae3465d7eb861e125d6ed643,https://www.reddit.com/r/dataisbeautiful/comments/382c88/the_way_uber_fares_are_calculated_is_a_mess_fusion/,103,103,0,40,The way Uber fares are calculated is a mess Fusion,2015-06-0001.jpg,none,"transportation, ride-sharing, uber, technology, urban, economics"
Fatal police shootings in 2015 approaching 400 nationwide,CJMinard,2015-06-01,http://www.washingtonpost.com/national/fatal-police-shootings-in-2015-approaching-400-nationwide/2015/05/30/d322256a-058e-11e5-a428-c984eb077d4e_story.html?hpid=z1,https://www.reddit.com/r/dataisbeautiful/comments/382j6l/fatal_police_shootings_in_2015_approaching_400/,2590,2590,0,1267,Fatal police shootings in 2015 approaching 400 nationwide,2015-06-0002.jpg,none,none
Google Government Removal Requests [OC],lolatu2,2015-06-01,https://slemma.com/share/a5c7867d54054ab13c073320ecd4bac6a6d36bba,https://www.reddit.com/r/dataisbeautiful/comments/382ygg/google_government_removal_requests_oc/,6,6,0,2,Google Government Removal Requests OC,2015-06-0004.jpg,none,none
OPEC’s Struggle With Falling Crude-Oil Prices,PM_me_munsterlanders,2015-06-01,http://graphics.wsj.com/gallery/opec-price-war,https://www.reddit.com/r/dataisbeautiful/comments/383mqg/opecs_struggle_with_falling_crudeoil_prices/,1,1,0,0,OPEC’s Struggle With Falling Crude-Oil Prices,2015-06-0007.jpg,none,none
Explorable NYC Taxi Vis Created with PanTera [OC],PanTera_io,2015-06-01,http://pantera.io/blog/2015/06/01/embed-and-explore.html,https://www.reddit.com/r/dataisbeautiful/comments/384ctm/explorable_nyc_taxi_vis_created_with_pantera_oc/,3,3,0,2,Explorable NYC Taxi Vis Created with PanTera OC,2015-06-0008.jpg,none,none
2015 College Baseball World Series Statistics Visualized,MaGoGo,2015-06-01,http://www.ncaa.com/2015-college-baseball-tournament-statistics,https://www.reddit.com/r/dataisbeautiful/comments/384f56/2015_college_baseball_world_series_statistics/,1,1,0,1,2015 College Baseball World Series Statistics Visualized,2015-06-0009.jpg,none,none
The Counted: People killed by police in the US,Pun_isher,2015-06-01,http://www.theguardian.com/us-news/ng-interactive/2015/jun/01/the-counted-police-killings-us-database,https://www.reddit.com/r/dataisbeautiful/comments/385cu1/the_counted_people_killed_by_police_in_the_us/,27,27,0,16,The Counted People killed by police in the US,2015-06-0011.jpg,none,"police, united states, incidents, social issues"
An interactive map that illustrates the immigrant populations across Australia. The map shows the largest immigrant population for that area. Data taken from the 2011 census,lanson15,2015-06-02,http://www.sbs.com.au/news/map/where-australias-immigrants-were-born-sydney,https://www.reddit.com/r/dataisbeautiful/comments/386a6s/an_interactive_map_that_illustrates_the_immigrant/,22,22,0,0,An interactive map that illustrates the immigrant populations across Australia. The map shows the largest immigrant population for that area. Data tak,2015-06-0012.jpg,none,none
Overdue Payments to IMF at Risk of Doubling?,MrBeanie88,2015-06-02,http://www.bloomberg.com/news/articles/2015-06-01/will-greece-join-these-deadbeats-that-missed-debt-payments-to-the-imf-,https://www.reddit.com/r/dataisbeautiful/comments/389ccu/overdue_payments_to_imf_at_risk_of_doubling/,2,2,0,0,Overdue Payments to IMF at Risk of Doubling,2015-06-0018.jpg,none,"finance, imf, payments, risk"
I Animated the Heart Rate During Marriage Proposal Post [OC],jakeinfusino,2015-06-02,https://www.youtube.com/watch?v=JcY2_Gzx_TQ,https://www.reddit.com/r/dataisbeautiful/comments/389fa7/i_animated_the_heart_rate_during_marriage/,12,12,0,4,I Animated the Heart Rate During Marriage Proposal Post OC,2015-06-0019.jpg,none,"heart rate, marriage proposal, emotions, relationships"
A fantastic set of seven classic graphs revisualized for interactivity,Hari___Seldon,2015-06-02,http://blog.plot.ly/post/120532468127/how-to-analyze-data-seven-modern-remakes-of-the,https://www.reddit.com/r/dataisbeautiful/comments/38a2zq/a_fantastic_set_of_seven_classic_graphs/,6,6,0,3,A fantastic set of seven classic graphs revisualized for interactivity,2015-06-0021.jpg,none,"data visualization, interactivity, technology, plotly"
The number of billionaires and their (combined) wealth over the last 15 years [OC],CJMinard,2015-06-03,http://dadaviz.com/i/4169,https://www.reddit.com/r/dataisbeautiful/comments/38d0rt/the_number_of_billionaires_and_their_combined/,1,1,0,3,The number of billionaires and their (combined) wealth over the last 15 years OC,2015-06-0023.jpg,none,none
The world uses 68% less land to produce the same quantity of crops compared to 50 years ago.,Max_OurWorldinData,2015-06-03,http://ourworldindata.org/data/food-agriculture/land-use-in-agriculture/#arable-land-per-crop-production-index-for-the-world-since-1961ref,https://www.reddit.com/r/dataisbeautiful/comments/38d8wh/the_world_uses_68_less_land_to_produce_the_same/,5287,5287,0,1784,The world uses 68% less land to produce the same quantity of crops compared to 50 years ago.,2015-06-0025.jpg,none,"agriculture, land use, crops, sustainability, global trends"
NOAA tracks of all tropical cyclones from 1950-2005.,BumpUrGood,2015-06-03,https://www.facebook.com/scienceonasphere/videos/10155664626995083/?fref=nf,https://www.reddit.com/r/dataisbeautiful/comments/38dr05/noaa_tracks_of_all_tropical_cyclones_from_19502005/,15,15,0,3,NOAA tracks of all tropical cyclones from 1950-2005.,2015-06-0026.jpg,none,"weather, climate, tropical cyclones, hurricanes, storms, noaa, geography"
IBM has been awarded an average of 21 patents per day so far in 2015,Pun_isher,2015-06-03,http://qz.com/418068/ibm-has-been-awarded-an-average-of-21-patents-per-day-so-far-in-2015/,https://www.reddit.com/r/dataisbeautiful/comments/38ek5t/ibm_has_been_awarded_an_average_of_21_patents_per/,17,17,0,1,IBM has been awarded an average of 21 patents per day so far in 2015,2015-06-0031.jpg,none,none
We're Eating Less Meat - Yet Factory Farms Are Still Growing,lnfinity,2015-06-04,http://www.motherjones.com/tom-philpott/2015/06/factory-farms-keep-getting-bigger,https://www.reddit.com/r/dataisbeautiful/comments/38ie68/were_eating_less_meat_yet_factory_farms_are_still/,42,42,0,17,We're Eating Less Meat - Yet Factory Farms Are Still Growing,2015-06-0036.jpg,none,"agriculture, meat consumption, factory farming, livestock"
Presidential Campaigns vs. Start-Ups: The Money Race,CJMinard,2015-06-04,http://www.nytimes.com/2015/06/07/upshot/why-a-presidential-campaign-is-the-ultimate-start-up.html?rref=upshot,https://www.reddit.com/r/dataisbeautiful/comments/38iiwc/presidential_campaigns_vs_startups_the_money_race/,2,2,0,0,Presidential Campaigns vs. Start-Ups The Money Race,2015-06-0039.jpg,none,none
What Makes People Happy? [OC],sukritmohan,2015-06-04,https://jawbone.com/blog/what-makes-people-happy/,https://www.reddit.com/r/dataisbeautiful/comments/38jcm7/what_makes_people_happy_oc/,1,1,0,2,What Makes People Happy OC,2015-06-0042.jpg,none,none
UK General Election 2015 on Twitter - The Numbers,danielflopes,2015-06-04,http://www.whitesmith.co/blog/uk-general-election-twitter-stats/,https://www.reddit.com/r/dataisbeautiful/comments/38jlq0/uk_general_election_2015_on_twitter_the_numbers/,1,1,0,0,UK General Election 2015 on Twitter - The Numbers,2015-06-0043.jpg,none,"politics, elections, twitter, uk"
"Beer, Wine and Spirits: How Much Do Canadians Spend on Alcohol? [OC]",zgall111,2015-06-04,http://www.the10and3.com/beer-wine-spirits-how-much-do-canadians-spend-on-alcohol/,https://www.reddit.com/r/dataisbeautiful/comments/38jzcs/beer_wine_and_spirits_how_much_do_canadians_spend/,5,5,0,3,"Beer, Wine and Spirits How Much Do Canadians Spend on Alcohol OC",2015-06-0044.jpg,none,"alcohol, spending, canada"
"A stunning and frightening visualisation of WWI deaths from the British Empire, day by day.",siorge,2015-06-05,http://www.theguardian.com/news/datablog/interactive/2013/nov/11/commonwealth-deaths-first-world-war-interactive,https://www.reddit.com/r/dataisbeautiful/comments/38nft6/a_stunning_and_frightening_visualisation_of_wwi/,1419,1419,0,199,"A stunning and frightening visualisation of WWI deaths from the British Empire, day by day.",2015-06-0047.jpg,none,none
"Home healthcare work is one of the most poorly paid jobs in America, but how low the pay is varies widely state by state [OC]",Jgrovum,2015-06-05,http://www.pewtrusts.org/en/research-and-analysis/blogs/stateline/2015/6/05/as-demand-grows-states-consider-better-pay-benefits-for-home-care-workers,https://www.reddit.com/r/dataisbeautiful/comments/38nnjx/home_healthcare_work_is_one_of_the_most_poorly/,2,2,0,1,"Home healthcare work is one of the most poorly paid jobs in America, but how low the pay is varies widely state by state OC",2015-06-0048.jpg,none,none
A 3D live map of the London Underground,williamhpark,2015-06-05,http://brunoimbrizi.com/experiments/#/07,https://www.reddit.com/r/dataisbeautiful/comments/38nq4m/a_3d_live_map_of_the_london_underground/,26,26,0,11,A 3D live map of the London Underground,2015-06-0049.jpg,none,"transportation, london, subway, travel, public transit"
"The US is adding a lot of jobs now, but many states still haven't recovered from all the ones they lost during the recession. [OC]",Jgrovum,2015-06-05,http://www.pewtrusts.org/en/research-and-analysis/blogs/stateline/2015/5/13/which-states-have-the-most-job-growth-since-the-recession,https://www.reddit.com/r/dataisbeautiful/comments/38o55s/the_us_is_adding_a_lot_of_jobs_now_but_many/,1,1,0,1,"The US is adding a lot of jobs now, but many states still haven't recovered from all the ones they lost during the recession. OC",2015-06-0051.jpg,none,none
Look Who’s Driving R&D Now,jimrosenz,2015-06-05,http://www.bloomberg.com/news/articles/2015-06-04/look-who-s-driving-r-d-now,https://www.reddit.com/r/dataisbeautiful/comments/38o5rg/look_whos_driving_rd_now/,2,2,0,1,Look Who’s Driving R&D Now,2015-06-0052.jpg,none,none
Internet Trends!,verzuzula,2015-06-05,http://www.kpcb.com/internet-trends,https://www.reddit.com/r/dataisbeautiful/comments/38oj5t/internet_trends/,0,0,0,2,Internet Trends!,2015-06-0054.jpg,none,"internet, trends"
London Pisses A Lot Of Cocaine Down The Toilet Every Day,hcbaron,2015-06-06,http://www.vocativ.com/datas/data-data/london-pees-a-lot-of-cocaine-down-the-toilet-every-day/,https://www.reddit.com/r/dataisbeautiful/comments/38ror1/london_pisses_a_lot_of_cocaine_down_the_toilet/,18,18,0,6,London Pisses A Lot Of Cocaine Down The Toilet Every Day,2015-06-0061.jpg,none,none
Three Out Of Every Four Tornado Warnings Are False Alarms | FiveThirtyEight,jimrosenz,2015-06-06,http://fivethirtyeight.com/features/three-out-of-every-four-tornado-warnings-are-false-alarms/?ex_cid=538twitter,https://www.reddit.com/r/dataisbeautiful/comments/38utan/three_out_of_every_four_tornado_warnings_are/,23,23,0,9,Three Out Of Every Four Tornado Warnings Are False Alarms FiveThirtyEight,2015-06-0071.jpg,none,none
2015 Stanley Cup,danglesnipecelly69,2015-06-07,http://www.barsouthhockey.com/2015-stanley-cup-data/,https://www.reddit.com/r/dataisbeautiful/comments/38vvu3/2015_stanley_cup/,4,4,0,0,2015 Stanley Cup,2015-06-0074.jpg,none,"sports, hockey, stanley cup, 2015, nhl"
"Boston and Pittsburgh, America’s Most Successful Sports Cities",CJMinard,2015-06-07,http://www.nytimes.com/2015/06/05/upshot/boston-and-pittsburgh-americas-most-successful-sports-cities.html?rref=upshot&smid=tw-upshotnyt&_r=0,https://www.reddit.com/r/dataisbeautiful/comments/38x27t/boston_and_pittsburgh_americas_most_successful/,4,4,0,0,"Boston and Pittsburgh, America’s Most Successful Sports Cities",2015-06-0077.jpg,none,"sports, baseball, boston, pittsburgh, success"
"Age gap between male and female leads in romantic films [x-post Filmmakers, author /u/stephenfollows]",Kamala_Metamorph,2015-06-08,http://stephenfollows.com/are-male-leads-in-romantic-films-older-than-their-female-co-stars/,https://www.reddit.com/r/dataisbeautiful/comments/390cwy/age_gap_between_male_and_female_leads_in_romantic/,3,3,0,6,"Age gap between male and female leads in romantic films x-post Filmmakers, author ustephenfollows",2015-06-0082.jpg,none,"film, romance, gender, age difference"
Turkish Election 2015: Breakdown of parliamentary seats based on results and which parties came in first in each province,Bugisman3,2015-06-08,http://www.middleeasteye.net/news/turkish-crossroads-coalition-government-or-repeat-vote-1681363878,https://www.reddit.com/r/dataisbeautiful/comments/390nzt/turkish_election_2015_breakdown_of_parliamentary/,1,1,0,0,Turkish Election 2015 Breakdown of parliamentary seats based on results and which parties came in first in each province,2015-06-0083.jpg,none,none
Are companies using visas to replace American workers? Here's which states have the most at work now.,Jgrovum,2015-06-08,http://www.pewtrusts.org/en/research-and-analysis/blogs/stateline/2015/6/08/states-cities-call-for-skilled-foreign-workers-amid-abuse-claims,https://www.reddit.com/r/dataisbeautiful/comments/390ql7/are_companies_using_visas_to_replace_american/,198,198,0,121,Are companies using visas to replace American workers Here's which states have the most at work now.,2015-06-0084.jpg,none,none
The age of all current world leaders [OC],CJMinard,2015-06-08,http://dadaviz.com/i/4225,https://www.reddit.com/r/dataisbeautiful/comments/390ru7/the_age_of_all_current_world_leaders_oc/,28,28,0,24,The age of all current world leaders OC,2015-06-0085.jpg,none,none
The 13 cities where millennials can't afford to buy a home,Jgrovum,2015-06-08,http://www.bloomberg.com/news/articles/2015-06-08/these-are-the-13-cities-where-millennials-can-t-afford-a-home,https://www.reddit.com/r/dataisbeautiful/comments/390xns/the_13_cities_where_millennials_cant_afford_to/,2312,2312,0,1405,The 13 cities where millennials can't afford to buy a home,2015-06-0088.jpg,none,"real estate, millennials, housing market, affordability, cities"
.Hillary Clinton’s path to victory — not so narrow after all - The Washington Post,jimrosenz,2015-06-09,http://www.washingtonpost.com/blogs/the-fix/wp/2015/06/08/hillary-clintons-path-to-victory-not-so-narrow-after-all/?postshare=1701433814617592,https://www.reddit.com/r/dataisbeautiful/comments/394c3r/hillary_clintons_path_to_victory_not_so_narrow/,0,0,0,1,.Hillary Clinton’s path to victory — not so narrow after all - The Washington Post,2015-06-0100.jpg,none,"politics, elections, hillary clinton, campaign, new hampshire"
'Love is all you need!': The Beatles' lyrics analysis [OC],bjarnegosling,2015-06-09,http://www.reddit.com/r/dataisbeautiful/comments/394csv/love_is_all_you_need_the_beatles_lyrics_analysis/,https://www.reddit.com/r/dataisbeautiful/comments/394csv/love_is_all_you_need_the_beatles_lyrics_analysis/,0,0,0,1,'Love is all you need!' The Beatles' lyrics analysis OC,2015-06-0101.jpg,none,none
Last Call for Larsen B,CJMinard,2015-06-09,http://earthobservatory.nasa.gov/IOTD/view.php?id=86002&eocn=home&eoci=iotd_title,https://www.reddit.com/r/dataisbeautiful/comments/394qi1/last_call_for_larsen_b/,0,0,0,0,Last Call for Larsen B,2015-06-0102.jpg,none,"climate change, glaciers, ice shelf, environment"
The Recovery of U.S Company Financial Sentiments. [OC],RA_Fisher,2015-06-09,https://zapier.com/blog/design-analyze-survey/#gallup,https://www.reddit.com/r/dataisbeautiful/comments/396a78/the_recovery_of_us_company_financial_sentiments_oc/,3,3,0,2,The Recovery of U.S Company Financial Sentiments. OC,2015-06-0107.jpg,none,none
The Shark from Jaws is polling better than all included 2016 presidential candidates,BuckeyeSundae,2015-06-09,http://www.washingtonpost.com/blogs/wonkblog/wp/2015/06/09/the-shark-from-jaws-is-polling-better-than-all-of-the-2016-candidates/,https://www.reddit.com/r/dataisbeautiful/comments/396nqt/the_shark_from_jaws_is_polling_better_than_all/,270,270,0,31,The Shark from Jaws is polling better than all included 2016 presidential candidates,2015-06-0110.jpg,none,"elections, politics, humor"
How do presidential candidates spend 1 billion dollars?,Stammit,2015-06-09,http://www.nationaljournal.com/2016-elections/how-do-presidential-candidates-spend-1-billion-20150608,https://www.reddit.com/r/dataisbeautiful/comments/396tr2/how_do_presidential_candidates_spend_1_billion/,4,4,0,1,How do presidential candidates spend 1 billion dollars,2015-06-0111.jpg,none,none
"Profiles of Change: Employment, Earnings, and Occupations from 1990-2013 » Papers » The Hamilton Project",jimrosenz,2015-06-10,http://www.hamiltonproject.org/papers/profiles_of_change_employment_earnings_occupations_1990-2013/,https://www.reddit.com/r/dataisbeautiful/comments/3992cl/profiles_of_change_employment_earnings_and/,0,0,0,0,"Profiles of Change Employment, Earnings, and Occupations from 1990-2013 » Papers » The Hamilton Project",2015-06-0121.jpg,none,"employment, earnings, occupations, economics, labor market"
"30% of American's Pronounce the Word Meme as ""Me-me,"" and other interesting terms and pronunciations we use to describe technology",DumbCDA,2015-06-10,http://www.theatlantic.com/technology/archive/2014/06/why-fi-or-wiffy-how-americans-pronounce-techs-most-common-terms/373082/?utm_source=SFFB,https://www.reddit.com/r/dataisbeautiful/comments/399h3q/30_of_americans_pronounce_the_word_meme_as_meme/,3,3,0,7,"30% of American's Pronounce the Word Meme as Me-me, and other interesting terms and pronunciations we use to describe technology",2015-06-0122.jpg,none,none
Zodiac signs of all current heads of government,MrBeanie88,2015-06-10,http://dadaviz.com/i/4240,https://www.reddit.com/r/dataisbeautiful/comments/39ahv8/zodiac_signs_of_all_current_heads_of_government/,0,0,0,10,Zodiac signs of all current heads of government,2015-06-0123.jpg,none,none
Popularity of News Sources Across Generations [OC],lolatu2,2015-06-10,https://slemma.com/share/06eabbb70fa7daa66f57610470d973ada6446012,https://www.reddit.com/r/dataisbeautiful/comments/39ajp9/popularity_of_news_sources_across_generations_oc/,5,5,0,1,Popularity of News Sources Across Generations OC,2015-06-0124.jpg,none,none
Over 90% of Major US Crops are Genetically Engineered [OC],lolatu2,2015-06-11,https://slemma.com/share/c553a79fe8c03293d5e95228612191b19418e7c2,https://www.reddit.com/r/dataisbeautiful/comments/39fuuc/over_90_of_major_us_crops_are_genetically/,20,20,0,7,Over 90% of Major US Crops are Genetically Engineered OC,2015-06-0135.jpg,none,"agriculture, biotechnology, crops, genetics, united states"
The North-South Divide on Two-Parent Families,winstonl,2015-06-11,http://www.nytimes.com/2015/06/11/upshot/the-north-south-divide-on-two-parent-families.html?_r=0&abt=0002&abg=1,https://www.reddit.com/r/dataisbeautiful/comments/39fvwc/the_northsouth_divide_on_twoparent_families/,7,7,0,1,The North-South Divide on Two-Parent Families,2015-06-0136.jpg,none,none
"Sources of Government Revenue across the OECD, 2015 | Tax Foundation",jimrosenz,2015-06-11,http://taxfoundation.org/article/sources-government-revenue-across-oecd-2015?utm_content=buffer8c6fa&utm_medium=social&utm_source=facebook.com&utm_campaign=buffer,https://www.reddit.com/r/dataisbeautiful/comments/39fzaj/sources_of_government_revenue_across_the_oecd/,3,3,0,0,"Sources of Government Revenue across the OECD, 2015 Tax Foundation",2015-06-0139.jpg,none,none
"How Congress sees the world, in charts. Percent of each countries' mention by party.",sarcastasaur,2015-06-11,http://www.politico.com/agenda/story/2015/06/how-congress-sees-the-world-in-charts-000079?hp=b1_c1,https://www.reddit.com/r/dataisbeautiful/comments/39j0il/how_congress_sees_the_world_in_charts_percent_of/,18,18,0,6,"How Congress sees the world, in charts. Percent of each countries' mention by party.",2015-06-0146.jpg,none,"politics, congress, countries"
"Redditors on their own penises, IQs, personality types, and more (X-post from SampleSize) [OC]",ViceAdmiralObvious,2015-06-11,http://www.reddit.com/r/dataisbeautiful/comments/39j7s4/redditors_on_their_own_penises_iqs_personality/,https://www.reddit.com/r/dataisbeautiful/comments/39j7s4/redditors_on_their_own_penises_iqs_personality/,35,35,0,59,"Redditors on their own penises, IQs, personality types, and more (X-post from SampleSize) OC",2015-06-0149.jpg,none,none
Fitting 7.3 Billion people into the same building,OctagonCosplay,2015-06-12,http://waitbutwhy.com/2015/03/7-3-billion-people-one-building.html,https://www.reddit.com/r/dataisbeautiful/comments/39ln1j/fitting_73_billion_people_into_the_same_building/,752,752,0,63,Fitting 7.3 Billion people into the same building,2015-06-0155.jpg,none,"population, space, architecture"
I made a map showing where each Game of Thrones Would Rule [OC],lakeyjamie,2015-06-12,http://www.findthebest.com/w/5blCs9dTonX?&external_preview=1&data-script-version=true&rnd=2084075613,https://www.reddit.com/r/dataisbeautiful/comments/39m71i/i_made_a_map_showing_where_each_game_of_thrones/,5,5,0,2,I made a map showing where each Game of Thrones Would Rule OC,2015-06-0157.jpg,none,none
We Are Performing Too Many C-Sections [OC],isaacfab,2015-06-12,http://www.isaacfaber.com/thoughts/2015/5/17/we-are-performing-too-many-c-sections,https://www.reddit.com/r/dataisbeautiful/comments/39m8jz/we_are_performing_too_many_csections_oc/,15,15,0,5,We Are Performing Too Many C-Sections OC,2015-06-0158.jpg,none,"childbirth, healthcare, c-sections"
The average American woman now weighs as much as the average 1960s man - The Washington Post,jimrosenz,2015-06-13,http://www.washingtonpost.com/blogs/wonkblog/wp/2015/06/12/look-at-how-much-weight-weve-gained-since-the-1960s/,https://www.reddit.com/r/dataisbeautiful/comments/39opgd/the_average_american_woman_now_weighs_as_much_as/,987,987,0,288,The average American woman now weighs as much as the average 1960s man - The Washington Post,2015-06-0161.jpg,none,none
What Does the On-Demand Workforce Look Like? - The Atlantic,jimrosenz,2015-06-13,http://www.theatlantic.com/business/archive/2015/05/what-does-the-on-demand-workforce-look-like/393680/,https://www.reddit.com/r/dataisbeautiful/comments/39oqi8/what_does_the_ondemand_workforce_look_like_the/,0,0,0,0,What Does the On-Demand Workforce Look Like - The Atlantic,2015-06-0162.jpg,none,"gig economy, on-demand workforce, delivery, employment"
There is no gender gap in tech salaries - Quartz,jimrosenz,2015-06-14,http://qz.com/182977/there-is-no-gender-gap-in-tech-salaries/,https://www.reddit.com/r/dataisbeautiful/comments/39ru4b/there_is_no_gender_gap_in_tech_salaries_quartz/,238,238,0,120,There is no gender gap in tech salaries - Quartz,2015-06-0167.jpg,none,none
There Are Significant Business Costs to Replacing Employees | Center for American Progress,jimrosenz,2015-06-14,https://www.americanprogress.org/issues/labor/report/2012/11/16/44464/there-are-significant-business-costs-to-replacing-employees/,https://www.reddit.com/r/dataisbeautiful/comments/39smn8/there_are_significant_business_costs_to_replacing/,4,4,0,0,There Are Significant Business Costs to Replacing Employees Center for American Progress,2015-06-0169.jpg,none,none
Which bee has the worst sting? Bonus: where stings hurt the most [OC],Geographist,2015-06-14,http://www.joshuastevens.net/visualization/visual-guide-to-painful-insect-stings/,https://www.reddit.com/r/dataisbeautiful/comments/39stkm/which_bee_has_the_worst_sting_bonus_where_stings/,25,25,0,8,Which bee has the worst sting Bonus where stings hurt the most OC,2015-06-0171.jpg,none,none
Downvoted: Karma of Ellen Pao's 100 latest comments and submission [OC],CJMinard,2015-06-14,http://dadaviz.com/i/4257,https://www.reddit.com/r/dataisbeautiful/comments/39szdn/downvoted_karma_of_ellen_paos_100_latest_comments/,85,85,0,21,Downvoted Karma of Ellen Pao's 100 latest comments and submission OC,2015-06-0173.jpg,none,none
150 years of fertility rates for all countries in the world in one chart – from 5 children per woman down to 2. [OC],Max_OurWorldinData,2015-06-14,http://ourworldindata.org/data/population-growth-vital-statistics/fertility-rates/,https://www.reddit.com/r/dataisbeautiful/comments/39upf3/150_years_of_fertility_rates_for_all_countries_in/,19,19,0,14,150 years of fertility rates for all countries in the world in one chart – from 5 children per woman down to 2. OC,2015-06-0177.jpg,none,"fertility, demographics, global trends"
How Much Should a Landlord Pay a Tenant to Move Out of an Apartment?,jimrosenz,2015-06-15,http://priceonomics.com/how-much-should-a-landlord-pay-a-tenant-to-move/,https://www.reddit.com/r/dataisbeautiful/comments/39vx8c/how_much_should_a_landlord_pay_a_tenant_to_move/,1,1,0,0,How Much Should a Landlord Pay a Tenant to Move Out of an Apartment,2015-06-0181.jpg,none,"real estate, finance, rental agreements, tenant relationships"
Lumberjack: America's Deadliest Profession,jimrosenz,2015-06-15,http://priceonomics.com/how-the-lumberjack-became-such-a-deadly-profession/,https://www.reddit.com/r/dataisbeautiful/comments/39vy77/lumberjack_americas_deadliest_profession/,4,4,0,3,Lumberjack America's Deadliest Profession,2015-06-0182.jpg,none,"logging, safety, professions"
Billionaires Around the World [OC],lolatu2,2015-06-15,https://slemma.com/share/c9fe85adf241195438d47576a5d1b5e259eb5dbb,https://www.reddit.com/r/dataisbeautiful/comments/39wwc8/billionaires_around_the_world_oc/,70,70,0,5,Billionaires Around the World OC,2015-06-0185.jpg,none,none
