title,author,created_date,url,full_permalink,score,ups,downs,num_comments,sanitized_title,image_file,chart_type,high_level_categories
fivethirtyeight.com ranks top wedding lists,HotSauce7,2016-10-18 18:50:17,http://fivethirtyeight.com/features/the-ultimate-wedding-playlist/,https://www.reddit.com/r/dataisbeautiful/comments/585kgf/fivethirtyeightcom_ranks_top_wedding_lists/,6,6,0,2,fivethirtyeight.com ranks top wedding lists,2016-10-0244.jpg,none,"weddings, celebrations"
"Music Genre Preference Correlated To SAT Scores (Avg / Median / Range) - Artist Scatter Plot, Genre Column Range, & US Map + Metro Music Index [OC]",jonseagull,2016-10-18 22:46:39,http://ledgernote.com/features/high-sat-scores-taste-in-music/,https://www.reddit.com/r/dataisbeautiful/comments/586wtz/music_genre_preference_correlated_to_sat_scores/,11,11,0,5,"Music Genre Preference Correlated To SAT Scores (Avg Median Range) - Artist Scatter Plot, Genre Column Range, & US Map + Metro Music Index OC",2016-10-0246.jpg,none,none
The top 100 most cited papers,profcyclist,2016-10-19 22:43:36,http://www.nature.com/news/the-top-100-papers-1.16224,https://www.reddit.com/r/dataisbeautiful/comments/58dbyj/the_top_100_most_cited_papers/,11,11,0,0,The top 100 most cited papers,2016-10-0258.jpg,none,"research, citations, academic papers"
@HillaryClinton vs. @realDonaldTrump,dwaxe,2016-10-20 04:21:16,http://flowingdata.com/2016/10/19/hillaryclinton-vs-realdonaldtrump/,https://www.reddit.com/r/dataisbeautiful/comments/58ezfq/hillaryclinton_vs_realdonaldtrump/,24,24,0,19,@HillaryClinton vs. @realDonaldTrump,2016-10-0260.jpg,none,"politics, social media, public figures"
World POTUS: how the US election is being searched around the world,capt_pizzari,2016-10-20 11:44:35,http://www.worldpotus.com/#/,https://www.reddit.com/r/dataisbeautiful/comments/58gdp6/world_potus_how_the_us_election_is_being_searched/,0,0,0,5,World POTUS how the US election is being searched around the world,2016-10-0264.jpg,none,"politics, elections, internet searches"
Hillary vs Trump: Who is the most emotional during public speeches? [OC],cpdomina,2016-10-20 12:57:22,http://wonderif.pt/emotions_us_elections,https://www.reddit.com/r/dataisbeautiful/comments/58gofl/hillary_vs_trump_who_is_the_most_emotional_during/,33,33,0,8,Hillary vs Trump Who is the most emotional during public speeches OC,2016-10-0268.jpg,none,none
Election Predictions and Poll Data from DailyKos.com [OC],acrahen,2016-10-20 13:57:29,https://public.tableau.com/views/ElectionMakeover/Election?:embed=y&:display_count=yes&:showVizHome=no,https://www.reddit.com/r/dataisbeautiful/comments/58gyme/election_predictions_and_poll_data_from/,2,2,0,3,Election Predictions and Poll Data from DailyKos.com OC,2016-10-0272.jpg,none,"politics, elections, predictions"
Number of interruptions during the presidential debates (and other data),justinterlocutor,2016-10-20 14:31:37,http://fivethirtyeight.com/live-blog/third-presidential-debate-election-2016/,https://www.reddit.com/r/dataisbeautiful/comments/58h53k/number_of_interruptions_during_the_presidential/,3,3,0,0,Number of interruptions during the presidential debates (and other data),2016-10-0273.jpg,none,"politics, elections, debates"
"Analysis of over 35,000 web developer job postings in the US [OC]",J4ck-,2016-10-20 15:54:31,https://careerscore.com/insights,https://www.reddit.com/r/dataisbeautiful/comments/58hlks/analysis_of_over_35000_web_developer_job_postings/,13,13,0,3,"Analysis of over 35,000 web developer job postings in the US OC",2016-10-0275.jpg,none,"web development, jobs, career, workforce"
Count Yourself In - A tool to explore current and historical voter data in your state [OC],themersk,2016-10-20 17:19:24,http://countyourself.in,https://www.reddit.com/r/dataisbeautiful/comments/58i32p/count_yourself_in_a_tool_to_explore_current_and/,10,10,0,3,Count Yourself In - A tool to explore current and historical voter data in your state OC,2016-10-0280.jpg,none,"politics, voting, elections"
Let’s take Rudy Giuliani’s voter-fraud theories to their natural conclusion (perhaps the snarkiest data visualization I've seen),polynomials,2016-10-20 18:47:01,https://www.washingtonpost.com/news/the-fix/wp/2016/10/20/lets-take-rudy-giulianis-voter-fraud-theories-to-their-natural-conclusion/?postshare=5151476976654572&tid=ss_fb,https://www.reddit.com/r/dataisbeautiful/comments/58ilkb/lets_take_rudy_giulianis_voterfraud_theories_to/,18,18,0,6,Let’s take Rudy Giuliani’s voter-fraud theories to their natural conclusion (perhaps the snarkiest data visualization I've seen),2016-10-0282.jpg,none,none
How to walk through a grid to get there faster [OC],PerplexCity,2016-10-20 18:53:11,https://perplex.city/grid-unlock-2caee149d89f#.4r7wj7tjk,https://www.reddit.com/r/dataisbeautiful/comments/58imsq/how_to_walk_through_a_grid_to_get_there_faster_oc/,29,29,0,7,How to walk through a grid to get there faster OC,2016-10-0283.jpg,none,"navigation, efficiency, paths"
"Republicans polled on whether they think Trump's sexual assault, if proven true, would disqualify him from the presidency.",esporx,2016-10-20 21:29:42,https://today.yougov.com/news/2016/10/18/most-republicans-dont-think-sexual-assault-would-d/,https://www.reddit.com/r/dataisbeautiful/comments/58jif7/republicans_polled_on_whether_they_think_trumps/,4,4,0,22,"Republicans polled on whether they think Trump's sexual assault, if proven true, would disqualify him from the presidency.",2016-10-0284.jpg,none,none
Brain vs body mass for mammals,sataky,2016-10-21 01:02:12,http://community.wolfram.com/groups/-/m/t/946991,https://www.reddit.com/r/dataisbeautiful/comments/58kk0f/brain_vs_body_mass_for_mammals/,21,21,0,2,Brain vs body mass for mammals,2016-10-0286.jpg,none,none
"Map of Haitian immigration: Where they have settled since 2010 earthquake, overall [OC]",reporterjen,2016-10-21 15:51:14,http://www.pewtrusts.org/en/research-and-analysis/blogs/stateline/2016/10/21/after-hurricane-matthew-haitians-hope-for-change-in-us-policy,https://www.reddit.com/r/dataisbeautiful/comments/58nxj7/map_of_haitian_immigration_where_they_have/,6,6,0,1,"Map of Haitian immigration Where they have settled since 2010 earthquake, overall OC",2016-10-0291.jpg,none,none
"Level 3 internet outages in real time -- caused by a major DDos attack on Dyn, still ongoing",hlake,2016-10-21 18:48:12,http://downdetector.com/status/level3/map/,https://www.reddit.com/r/dataisbeautiful/comments/58ow57/level_3_internet_outages_in_real_time_caused_by_a/,10,10,0,2,"Level 3 internet outages in real time -- caused by a major DDos attack on Dyn, still ongoing",2016-10-0293.jpg,none,"internet, outages, cyberattacks, ddos, dyn, real-time"
Yankee doodle damage - the collateral cost of a 19th century whaling ship. [OC],joelfriesen,2016-10-21 18:48:34,https://www.hakaimagazine.com/infographic/collateral-damage-yankee-whaling,https://www.reddit.com/r/dataisbeautiful/comments/58ow7z/yankee_doodle_damage_the_collateral_cost_of_a/,6,6,0,1,Yankee doodle damage - the collateral cost of a 19th century whaling ship. OC,2016-10-0294.jpg,none,"whaling, history, environmental impact, 19th century, yankee, collateral damage"
Pokemon GO catch rate when throwing curve balls [OC],homu,2016-10-21 20:52:22,https://pokemongo.gamepress.gg/guct-curveballs,https://www.reddit.com/r/dataisbeautiful/comments/58pkci/pokemon_go_catch_rate_when_throwing_curve_balls_oc/,20,20,0,4,Pokemon GO catch rate when throwing curve balls OC,2016-10-0296.jpg,none,"pokemon, gaming, mobile games, mechanics"
Say “Hello” to the Era of the One-Word Song Title,jimrosenz,2016-10-22 03:45:02,https://priceonomics.com/say-hello-to-the-era-of-one-word-song-title/,https://www.reddit.com/r/dataisbeautiful/comments/58refu/say_hello_to_the_era_of_the_oneword_song_title/,31,31,0,3,Say “Hello” to the Era of the One-Word Song Title,2016-10-0299.jpg,none,none
Treatment of Minorities,profcyclist,2016-10-22 13:44:52,https://ourworldindata.org/treatment-of-minorities,https://www.reddit.com/r/dataisbeautiful/comments/58t6of/treatment_of_minorities/,20,20,0,15,Treatment of Minorities,2016-10-0302.jpg,none,"human rights, minorities, society"
Mapping Storm Patterns Over Lake Victoria,robbibt,2016-10-23 09:40:33,http://earthobservatory.nasa.gov/IOTD/view.php?id=88848,https://www.reddit.com/r/dataisbeautiful/comments/58xwfw/mapping_storm_patterns_over_lake_victoria/,5,5,0,0,Mapping Storm Patterns Over Lake Victoria,2016-10-0305.jpg,none,"weather, storms, geography, lake victoria"
How patent laws gave up on innovation [OC],alexgabriel_i,2016-10-23 18:18:12,https://deltanomics.wordpress.com/2016/10/23/how-patent-laws-gave-up-on-innovation/,https://www.reddit.com/r/dataisbeautiful/comments/58zvqf/how_patent_laws_gave_up_on_innovation_oc/,8,8,0,1,How patent laws gave up on innovation OC,2016-10-0309.jpg,none,"patents, innovation, law"
How expensive is a baby's first year? [OC],hammertime84,2016-10-23 20:08:15,http://www.thebabyeffect.com/2016/10/how-expensive-is-baby-12-month-update.html,https://www.reddit.com/r/dataisbeautiful/comments/590gk4/how_expensive_is_a_babys_first_year_oc/,66,66,0,20,How expensive is a baby's first year OC,2016-10-0310.jpg,none,"finance, money, economy"
"Who Marries Whom — This Chart Shows Who Marries CEOs, Doctors, Chefs and Janitors",zonination,2016-10-24 14:26:18,http://www.bloomberg.com/graphics/2016-who-marries-whom/,https://www.reddit.com/r/dataisbeautiful/comments/594rui/who_marries_whom_this_chart_shows_who_marries/,227,227,0,50,"Who Marries Whom — This Chart Shows Who Marries CEOs, Doctors, Chefs and Janitors",2016-10-0315.jpg,none,none
"How You Will Die — A simulator that takes your age, sex, etc., and simulates you what will most likely kill you.",zonination,2016-10-24 14:29:45,http://flowingdata.com/2016/01/19/how-you-will-die/,https://www.reddit.com/r/dataisbeautiful/comments/594sha/how_you_will_die_a_simulator_that_takes_your_age/,4323,4323,0,1098,"How You Will Die — A simulator that takes your age, sex, etc., and simulates you what will most likely kill you.",2016-10-0316.jpg,none,"mortality, simulation, health, predictions"
"Waste, Families Left Behind As Nuclear Plants Close",jstuartmill,2016-10-24 14:41:26,http://www.npr.org/2016/10/24/498842677/waste-families-left-behind-as-nuclear-plants-close?utm_medium=RSS&utm_campaign=technology,https://www.reddit.com/r/dataisbeautiful/comments/594umg/waste_families_left_behind_as_nuclear_plants_close/,2,2,0,1,"Waste, Families Left Behind As Nuclear Plants Close",2016-10-0318.jpg,none,"nuclear energy, waste management, families, industrial impact"
England open data visualized by postcode area [OC],vladatb,2016-10-25 07:38:30,http://www.plumplot.co.uk,https://www.reddit.com/r/dataisbeautiful/comments/599u3e/england_open_data_visualized_by_postcode_area_oc/,6,6,0,2,England open data visualized by postcode area OC,2016-10-0326.jpg,none,"england, data, postcode, house prices, crimes, population, car crashes"
Which Black Mirror episode was most disturbing [OC],GemmaJ123,2016-10-25 08:51:23,https://www.brandwatch.com/2016/10/react-black-mirror-season-three-social-data-review/,https://www.reddit.com/r/dataisbeautiful/comments/59a17h/which_black_mirror_episode_was_most_disturbing_oc/,511,511,0,328,Which Black Mirror episode was most disturbing OC,2016-10-0327.jpg,none,none
Studying chicken pox epidemiology using Google Trends,robbibt,2016-10-25 09:51:41,https://twitter.com/UofGpals/status/786907450029015040,https://www.reddit.com/r/dataisbeautiful/comments/59a79s/studying_chicken_pox_epidemiology_using_google/,11,11,0,2,Studying chicken pox epidemiology using Google Trends,2016-10-0328.jpg,none,none
Nobel Prize — All nominees and recipients from 1901 to 1964 [Interactive],zonination,2016-10-25 12:34:54,https://ria.ru/infografika/20151210/1339535142.html?lang=en,https://www.reddit.com/r/dataisbeautiful/comments/59ari6/nobel_prize_all_nominees_and_recipients_from_1901/,45,45,0,1,Nobel Prize — All nominees and recipients from 1901 to 1964 Interactive,2016-10-0330.jpg,none,"nobel prize, history, awards, nominees, recipients"
Interactive PGA Tour Golf Data,0wjc,2016-10-25 15:26:48,http://mattcourchene.com/interactive-golf-data/,https://www.reddit.com/r/dataisbeautiful/comments/59bmjg/interactive_pga_tour_golf_data/,2,2,0,1,Interactive PGA Tour Golf Data,2016-10-0334.jpg,none,none
Kentucky Trails Most States in Production of Benefit-Cost Analysis,megsee3,2016-10-25 16:54:56,https://www.mercatus.org/publications/kentucky-trails-most-states-production-benefit-cost-analysis,https://www.reddit.com/r/dataisbeautiful/comments/59c4jc/kentucky_trails_most_states_in_production_of/,2,2,0,1,Kentucky Trails Most States in Production of Benefit-Cost Analysis,2016-10-0335.jpg,none,none
What Drugs Cost Around the World,brunovonpuppendorf,2016-10-25 19:56:38,http://o.canada.com/business/interactive-what-illegal-drugs-cost-on-the-street-around-the-world,https://www.reddit.com/r/dataisbeautiful/comments/59d60g/what_drugs_cost_around_the_world/,14,14,0,3,What Drugs Cost Around the World,2016-10-0337.jpg,none,none
Rising Global Cancer Epidemic,lapivan,2016-10-26 06:32:01,http://www.cancer.org/research/infographicgallery/rising-global-cancer-epidemic,https://www.reddit.com/r/dataisbeautiful/comments/59g44d/rising_global_cancer_epidemic/,1,1,0,0,Rising Global Cancer Epidemic,2016-10-0342.jpg,none,"health, cancer, organizations"
Visualizing passing sequences - An analysis of Premier League season 2015/16,rjtavares,2016-10-26 11:49:21,https://medium.com/football-crunching/visualizing-passing-sequences-8988c09e53ad,https://www.reddit.com/r/dataisbeautiful/comments/59h2qe/visualizing_passing_sequences_an_analysis_of/,5,5,0,0,Visualizing passing sequences - An analysis of Premier League season 201516,2016-10-0345.jpg,none,"sports, soccer, premier league, data analysis, passing sequences, 2015/16 season"
America's public schools remain highly segregated,datard,2016-10-26 20:49:10,http://www.urban.org/urban-wire/americas-public-schools-remain-highly-segregated,https://www.reddit.com/r/dataisbeautiful/comments/59jzme/americas_public_schools_remain_highly_segregated/,0,0,0,1,America's public schools remain highly segregated,2016-10-0350.jpg,none,"education, segregation, society, schools"
Animation of a driving route. I'm looking for better (easier) way to do this.,mtairymd,2016-10-26 22:06:33,https://www.youtube.com/watch?v=2M8bmhR681c,https://www.reddit.com/r/dataisbeautiful/comments/59kexp/animation_of_a_driving_route_im_looking_for/,1,1,0,1,Animation of a driving route. I'm looking for better (easier) way to do this.,2016-10-0351.jpg,none,"driving, routes, animation, navigation"
The melting of West Antarica's ice shelves mapped by velocity and direction,robbibt,2016-10-26 23:41:11,http://www.ecowatch.com/ocean-warming-antarctica-glaciers-melting-2064507190.html,https://www.reddit.com/r/dataisbeautiful/comments/59kvy7/the_melting_of_west_antaricas_ice_shelves_mapped/,8,8,0,2,The melting of West Antarica's ice shelves mapped by velocity and direction,2016-10-0352.jpg,none,"climate change, antarctica, melting ice, geography, environment"
"Research paper: Pokémon Go and The Pulse of the City, measured using Mobile Data from Santiago, Chile [OC]",carnbycl,2016-10-27 02:48:23,https://arxiv.org/abs/1610.08098,https://www.reddit.com/r/dataisbeautiful/comments/59lqx2/research_paper_pokémon_go_and_the_pulse_of_the/,3,3,0,1,"Research paper Pokémon Go and The Pulse of the City, measured using Mobile Data from Santiago, Chile OC",2016-10-0355.jpg,none,none
Clinton vs. Trump: Follow the race for the White House with CBC's U.S. poll tracker,GameOfThrowsnz,2016-10-27 06:19:59,http://www.cbc.ca/news2/interactives/uspolltracker/,https://www.reddit.com/r/dataisbeautiful/comments/59mk11/clinton_vs_trump_follow_the_race_for_the_white/,3,3,0,0,Clinton vs. Trump Follow the race for the White House with CBC's U.S. poll tracker,2016-10-0358.jpg,none,"politics, elections, poll tracking, u.s., presidential race"
The relative popularity of genres around the world,rmeddy,2016-10-27 06:46:52,https://stephenfollows.com/relative-popularity-of-genres-around-the-world/,https://www.reddit.com/r/dataisbeautiful/comments/59mn1b/the_relative_popularity_of_genres_around_the_world/,8,8,0,1,The relative popularity of genres around the world,2016-10-0359.jpg,none,"genres, popularity, global, trends"
For all the gamers out there!,Monodojo,2016-10-27 10:01:06,http://euw.leagueoflegends.com/en/page/turbo-mode-data-behind-your-spell-spamming,https://www.reddit.com/r/dataisbeautiful/comments/59n6jg/for_all_the_gamers_out_there/,1,1,0,0,For all the gamers out there!,2016-10-0360.jpg,none,"gaming, video games, league of legends"
Nate Silver's 2016 Election Forecast,maretis,2016-10-27 12:07:43,http://projects.fivethirtyeight.com/2016-election-forecast/?ex_cid=2016-senate-forecast,https://www.reddit.com/r/dataisbeautiful/comments/59nls1/nate_silvers_2016_election_forecast/,6,6,0,1,Nate Silver's 2016 Election Forecast,2016-10-0362.jpg,none,"politics, elections, forecasts"
The Most Googled Prescription Brands By State [OC],iliadmusic,2016-10-27 15:43:15,http://www.coynecollege.edu/sites/default/files/prescriptions-by-state_0.png,https://www.reddit.com/r/dataisbeautiful/comments/59oo2j/the_most_googled_prescription_brands_by_state_oc/,1738,1738,0,429,The Most Googled Prescription Brands By State OC,2016-10-0369.jpg,none,none
Electoral College Interactive Map,thebgarrett,2016-10-27 16:05:39,https://www.reddit.com/r/dataisbeautiful/comments/59osnn/electoral_college_interactive_map/,https://www.reddit.com/r/dataisbeautiful/comments/59osnn/electoral_college_interactive_map/,5,5,0,0,Electoral College Interactive Map,2016-10-0370.jpg,none,"politics, elections, united states, electoral college"
Tree of Life [OC],Laun-Winter,2016-10-27 16:23:11,http://iainw.net/tree-of-life,https://www.reddit.com/r/dataisbeautiful/comments/59ow7t/tree_of_life_oc/,1,1,0,3,Tree of Life OC,2016-10-0371.jpg,none,"computing, algorithms, mathematics"
The Historical Rise in Food Stamp Dependency and Cost,megsee3,2016-10-27 16:25:26,https://www.mercatus.org/publications/historical-rise-food-stamp-dependency-and-cost,https://www.reddit.com/r/dataisbeautiful/comments/59owq1/the_historical_rise_in_food_stamp_dependency_and/,5,5,0,3,The Historical Rise in Food Stamp Dependency and Cost,2016-10-0372.jpg,none,none
Composers most frequently played by The New York Philharmonic.,shihn,2016-10-27 19:07:51,http://theanimo.com/s/ny-philharmonic-composer-freq,https://www.reddit.com/r/dataisbeautiful/comments/59puf0/composers_most_frequently_played_by_the_new_york/,6,6,0,4,Composers most frequently played by The New York Philharmonic.,2016-10-0375.jpg,none,none
New dataset shows fifteen years of Wikipedia’s quality trends (with vis of Biology article) [OC],halfak,2016-10-27 21:32:28,https://blog.wikimedia.org/2016/10/27/wikipedia-quality-trends-dataset/,https://www.reddit.com/r/dataisbeautiful/comments/59qnwc/new_dataset_shows_fifteen_years_of_wikipedias/,8,8,0,2,New dataset shows fifteen years of Wikipedia’s quality trends (with vis of Biology article) OC,2016-10-0376.jpg,none,none
Comparing edits to Trump's and Clinton's Wikipedia pages,callumacrae,2016-10-27 23:02:18,https://www.washingtonpost.com/graphics/politics/2016-election/presidential-wikipedias/,https://www.reddit.com/r/dataisbeautiful/comments/59r4ne/comparing_edits_to_trumps_and_clintons_wikipedia/,938,938,0,196,Comparing edits to Trump's and Clinton's Wikipedia pages,2016-10-0378.jpg,none,"politics, wikipedia, portraits, media, public figures"
Visualization of Skill Usage in League of Legends,thegiantanteater1000,2016-10-27 23:09:38,http://na.leagueoflegends.com/en/page/turbo-mode-data-behind-your-spell-spamming,https://www.reddit.com/r/dataisbeautiful/comments/59r5yy/visualization_of_skill_usage_in_league_of_legends/,0,0,0,0,Visualization of Skill Usage in League of Legends,2016-10-0379.jpg,none,"video games, league of legends, skills"
"Beard or Mo? The most searched facial hair visualised - Global, US and Australia!",alex_xender,2016-10-28 01:21:54,https://www.yellowoctopus.com.au/blog/beard-vs-mo-battle-royale/,https://www.reddit.com/r/dataisbeautiful/comments/59rsyl/beard_or_mo_the_most_searched_facial_hair/,1,1,0,0,"Beard or Mo The most searched facial hair visualised - Global, US and Australia!",2016-10-0380.jpg,none,none
I used EchoNest song attribution data to analyze the composition of Metallica's studio catalog. [OC],mskm203,2016-10-28 15:53:19,https://public.tableau.com/views/Metallica/AnAnalysisofAlbumStructure?:embed=y&:display_count=yes&:showVizHome=no#3,https://www.reddit.com/r/dataisbeautiful/comments/59v5nm/i_used_echonest_song_attribution_data_to_analyze/,2,2,0,1,I used EchoNest song attribution data to analyze the composition of Metallica's studio catalog. OC,2016-10-0385.jpg,none,"music, analysis, metallica, albums, song attributes"
2016 Data on America's Prison System,Slick512,2016-10-28 16:08:59,http://www.prisonpolicy.org/reports/pie2016.html,https://www.reddit.com/r/dataisbeautiful/comments/59v91c/2016_data_on_americas_prison_system/,17,17,0,3,2016 Data on America's Prison System,2016-10-0386.jpg,none,"prison system, criminal justice, advocacy, research, society"
Interactive Simulation of Uber vs Taxis [OC],ieatchipotle,2016-10-28 16:37:07,http://www.countingcalculi.com/interactives/uber_v_taxis/,https://www.reddit.com/r/dataisbeautiful/comments/59veuo/interactive_simulation_of_uber_vs_taxis_oc/,14,14,0,1,Interactive Simulation of Uber vs Taxis OC,2016-10-0387.jpg,none,"transportation, ride-sharing, uber, taxis, simulation"
Mapping every home run at Wrigley Field [OC],Thenextcorner,2016-10-28 16:50:38,http://wearefanatics.com/home-run-hotspots-wrigley-field/,https://www.reddit.com/r/dataisbeautiful/comments/59vhnl/mapping_every_home_run_at_wrigley_field_oc/,10,10,0,2,Mapping every home run at Wrigley Field OC,2016-10-0388.jpg,none,"baseball, home runs, sports, wrigley field, chicago cubs"
9th inning win probability by scenario,TheRealWa,2016-10-28 16:52:20,https://perplex.city/take-me-away-from-the-ballgame-5462be7b4599#.g0toe43gr,https://www.reddit.com/r/dataisbeautiful/comments/59vhzy/9th_inning_win_probability_by_scenario/,5,5,0,0,9th inning win probability by scenario,2016-10-0389.jpg,none,none
The 20 Most Extreme Cases Of ‘The Book Was Better Than The Movie’,datard,2016-10-30 00:27:58,http://fivethirtyeight.com/features/the-20-most-extreme-cases-of-the-book-was-better-than-the-movie/?ex_cid=538twitter,https://www.reddit.com/r/dataisbeautiful/comments/5a3k2w/the_20_most_extreme_cases_of_the_book_was_better/,22,22,0,25,The 20 Most Extreme Cases Of ‘The Book Was Better Than The Movie’,2016-10-0395.jpg,none,"books, movies, adaptations, entertainment"
Rio de Janeiro municipal elections apuration maps,RoundHK,2016-10-30 20:21:27,http://www.uol/eleicoes/especiais/raio-x-2016-2-turno-rio-de-janeiro.htm#raio-x-prefeitos-zonas-eleitorais-rio-de-janeiro,https://www.reddit.com/r/dataisbeautiful/comments/5a81yn/rio_de_janeiro_municipal_elections_apuration_maps/,5,5,0,1,Rio de Janeiro municipal elections apuration maps,2016-10-0402.jpg,none,none
Interactive Graphic comparing performance of top 50 gaming franchises,Blibbax,2016-10-31 16:02:52,https://www.badrhino.com/special/charted/#!/,https://www.reddit.com/r/dataisbeautiful/comments/5ad2w5/interactive_graphic_comparing_performance_of_top/,5,5,0,0,Interactive Graphic comparing performance of top 50 gaming franchises,2016-10-0410.jpg,none,"gaming, franchises, comparison"
Dog bites leading to hospitalization up 44 percent in California as larger breeds become more common [OC],Martinamisfan,2016-10-31 16:31:31,http://www.sacbee.com/site-services/databases/article111195082.html,https://www.reddit.com/r/dataisbeautiful/comments/5ad9e1/dog_bites_leading_to_hospitalization_up_44/,4,4,0,2,Dog bites leading to hospitalization up 44 percent in California as larger breeds become more common OC,2016-10-0411.jpg,none,none
