title,author,created_date,url,full_permalink,score,ups,downs,num_comments,sanitized_title,image_file,chart_type,high_level_categories
"New U.S. immigrants by region of birth: Asia on the rise, Latin America on the decline",rhiever,2016-09-01 12:52:16,http://fivethirtyeight.com/features/immigration-is-changing-much-more-than-the-immigration-debate/,https://www.reddit.com/r/dataisbeautiful/comments/50n0bw/new_us_immigrants_by_region_of_birth_asia_on_the/,19,19,0,4,"New U.S. immigrants by region of birth Asia on the rise, Latin America on the decline",2016-09-0006.jpg,none,"immigration, demographics, culture, usa"
"Rich City, Poor City: How Housing Supply Drives Regional Economic Inequality",Nashvillain2,2016-09-01 15:29:15,http://www.trulia.com/blog/trends/rich-city-poor-city/,https://www.reddit.com/r/dataisbeautiful/comments/50nr1n/rich_city_poor_city_how_housing_supply_drives/,5,5,0,1,"Rich City, Poor City How Housing Supply Drives Regional Economic Inequality",2016-09-0010.jpg,none,"housing, economic inequality, regional disparity, urban development"
"Tracking Job Gains, Losses, and National Employment in the US",yelper,2016-09-01 17:49:02,http://graphics.wsj.com/job-market-tracker/,https://www.reddit.com/r/dataisbeautiful/comments/50oig0/tracking_job_gains_losses_and_national_employment/,3,3,0,0,"Tracking Job Gains, Losses, and National Employment in the US",2016-09-0012.jpg,none,"employment, economics, job market, industries, united states"
Analyzing #first7jobs tweets with MonkeyLearn and R [OC],wildcodegowrong,2016-09-01 18:46:17,https://blog.monkeylearn.com/analyzing-first7jobs-tweets-monkeylearn-r/,https://www.reddit.com/r/dataisbeautiful/comments/50otl8/analyzing_first7jobs_tweets_with_monkeylearn_and/,6,6,0,2,Analyzing #first7jobs tweets with MonkeyLearn and R OC,2016-09-0015.jpg,none,none
These charts clearly show how some Olympic swimmers may have gotten an unfair advantage,aurora_lights,2016-09-01 20:00:28,https://www.washingtonpost.com/news/wonk/wp/2016/09/01/these-charts-clearly-show-how-some-olympic-swimmers-may-have-gotten-an-unfair-advantage/,https://www.reddit.com/r/dataisbeautiful/comments/50p7w9/these_charts_clearly_show_how_some_olympic/,70,70,0,4,These charts clearly show how some Olympic swimmers may have gotten an unfair advantage,2016-09-0016.jpg,none,"sports, swimming, olympics, competition, fairness"
Worst place to drive in each US state,jherritz,2016-09-01 20:01:34,https://blog.miosoft.com/2016/08/miosofts-worst-place-to-drive-in-each-us-state/,https://www.reddit.com/r/dataisbeautiful/comments/50p83m/worst_place_to_drive_in_each_us_state/,43,43,0,29,Worst place to drive in each US state,2016-09-0017.jpg,none,none
"A website that allows you to see the real coverage networks of the major cellular carriers, as reported by users.",pesadelo,2016-09-01 20:55:55,https://opensignal.com/,https://www.reddit.com/r/dataisbeautiful/comments/50phzq/a_website_that_allows_you_to_see_the_real/,19,19,0,0,"A website that allows you to see the real coverage networks of the major cellular carriers, as reported by users.",2016-09-0018.jpg,none,"mobile networks, user reports, technology"
Why Is Interracial Marriage on the Rise?,jimrosenz,2016-09-01 22:14:49,https://priceonomics.com/why-is-interracial-marriage-on-the-rise/,https://www.reddit.com/r/dataisbeautiful/comments/50pvpq/why_is_interracial_marriage_on_the_rise/,2,2,0,5,Why Is Interracial Marriage on the Rise,2016-09-0022.jpg,none,"interracial marriage, relationships, society, history"
40 maps that explain the world,SLCRD,2016-09-02 02:28:41,https://www.washingtonpost.com/news/worldviews/wp/2013/08/12/40-maps-that-explain-the-world/,https://www.reddit.com/r/dataisbeautiful/comments/50r0h2/40_maps_that_explain_the_world/,106,106,0,16,40 maps that explain the world,2016-09-0023.jpg,none,none
How long it takes cycling in cities before pollution means it does you more harm than good,mrcchapman,2016-09-02 10:06:43,https://ig.ft.com/sites/urban-cycling/,https://www.reddit.com/r/dataisbeautiful/comments/50si5p/how_long_it_takes_cycling_in_cities_before/,894,894,0,132,How long it takes cycling in cities before pollution means it does you more harm than good,2016-09-0024.jpg,none,"cycling, pollution, health, cities, transportation"
Mapping the parties around University of Arizona via police reports [OC],badjazzmaverick,2016-09-02 17:50:57,http://www.wildcat.arizona.edu/article/2016/09/wheres-the-party-at-just-follow-the-red-tags,https://www.reddit.com/r/dataisbeautiful/comments/50uifd/mapping_the_parties_around_university_of_arizona/,2,2,0,1,Mapping the parties around University of Arizona via police reports OC,2016-09-0026.jpg,none,"law enforcement, university, incidents, public safety"
Which industry pays the highest data analyst salary? [OC],rundy_mc,2016-09-02 19:29:44,https://www.springboard.com/blog/highest-data-analyst-salary/,https://www.reddit.com/r/dataisbeautiful/comments/50v0t8/which_industry_pays_the_highest_data_analyst/,19,19,0,10,Which industry pays the highest data analyst salary OC,2016-09-0028.jpg,none,none
Even though a growing share of Americans are reading e-books on tablets and smartphones research shows print books continue to be more popular.,book_worm1995,2016-09-03 05:25:51,http://www.pewinternet.org/2016/09/01/book-reading-2016/#the-share-of-americans-who-have-read-a-book-in-the-last-year-is-largely-unchanged-since-2012-more-americans-read-print-books-than-either-read-e-books-or-listen-to-audio-books,https://www.reddit.com/r/dataisbeautiful/comments/50xhf1/even_though_a_growing_share_of_americans_are/,19,19,0,4,Even though a growing share of Americans are reading e-books on tablets and smartphones research shows print books continue to be more popular.,2016-09-0032.jpg,none,"reading, books, technology, trends"
Cosmography Local Universe,PepperMill_NA,2016-09-03 16:46:35,https://youtu.be/WCHi4hioFEI,https://www.reddit.com/r/dataisbeautiful/comments/50zm2b/cosmography_local_universe/,4,4,0,0,Cosmography Local Universe,2016-09-0035.jpg,none,"universe, cosmography, astronomy"
"The CEO of the ""Online Abuse Prevention Initiative"" claimed that she deliberately provoked ""crap trolls"" to ""help an activist being terrorized"" and continued that the ""[activist] got some relief"". I tested the veracity of this theory. [OC]",banned_main_,2016-09-03 17:59:34,http://imgur.com/a/Hhcbs,https://www.reddit.com/r/dataisbeautiful/comments/50zy0w/the_ceo_of_the_online_abuse_prevention_initiative/,0,0,0,2,The CEO of the Online Abuse Prevention Initiative claimed that she deliberately provoked crap trolls to help an activist being terrorized and continue,2016-09-0036.jpg,none,"online abuse, activism, trolls, social media, harassment prevention"
"Summary of the Latest Federal Income Tax Data, 2015 Update",sometimescash,2016-09-03 23:56:58,http://taxfoundation.org/article/summary-latest-federal-income-tax-data-2015-update,https://www.reddit.com/r/dataisbeautiful/comments/511ia6/summary_of_the_latest_federal_income_tax_data/,8,8,0,3,"Summary of the Latest Federal Income Tax Data, 2015 Update",2016-09-0040.jpg,none,none
Suicide - Our World In Data,redditor_shootinx,2016-09-04 21:36:06,https://ourworldindata.org/suicide/,https://www.reddit.com/r/dataisbeautiful/comments/5164q3/suicide_our_world_in_data/,68,68,0,2,Suicide - Our World In Data,2016-09-0048.jpg,none,"suicide, global data, research"
"Japanese Musician Artist Clustering by 160,000 songs and 500 artists",naoyashiga,2016-09-05 13:16:31,http://docs.yahoo.co.jp/info/bigdata/special/2016/05/app/,https://www.reddit.com/r/dataisbeautiful/comments/519d08/japanese_musician_artist_clustering_by_160000/,1,1,0,0,"Japanese Musician Artist Clustering by 160,000 songs and 500 artists",2016-09-0056.jpg,none,none
"Visualizing Alan Rickman's Career, you know Hans Gruber from Die Hard",acrahen,2016-09-05 18:37:39,https://public.tableau.com/views/AlanRickman1946-2016/Rickman?:embed=y&:display_count=yes&:showVizHome=no,https://www.reddit.com/r/dataisbeautiful/comments/51aubh/visualizing_alan_rickmans_career_you_know_hans/,0,0,0,1,"Visualizing Alan Rickman's Career, you know Hans Gruber from Die Hard",2016-09-0059.jpg,none,"film, career, entertainment, alan rickman"
Kinda already knew this but it's still interesting,danhern1000,2016-09-05 21:09:46,http://indy100.independent.co.uk/article/the-chart-that-shows-where-the-most-cocaine-comes-from-in-the-world--bkVr1fLhduW,https://www.reddit.com/r/dataisbeautiful/comments/51blry/kinda_already_knew_this_but_its_still_interesting/,0,0,0,1,Kinda already knew this but it's still interesting,2016-09-0060.jpg,none,"drugs, substances, health, awareness"
"The Fastest 400m Sprinters in History: Splits, & Stride Length vs Stride Frequency",nathancrumpton,2016-09-06 03:38:52,https://zigapskraba.wordpress.com/2016/09/01/stride-length-vs-stride-frequency-in-the-400-metres/,https://www.reddit.com/r/dataisbeautiful/comments/51dbtn/the_fastest_400m_sprinters_in_history_splits/,9,9,0,1,"The Fastest 400m Sprinters in History Splits, & Stride Length vs Stride Frequency",2016-09-0062.jpg,none,"athletics, sprinting, track and field, olympics"
"Labor Day, Statistics of U.S. Labor Force",DataPro23,2016-09-06 08:12:15,https://www.answerminer.com/blog/labor-day-statistics-u-s-labor-force/,https://www.reddit.com/r/dataisbeautiful/comments/51e6w7/labor_day_statistics_of_us_labor_force/,1,1,0,0,"Labor Day, Statistics of U.S. Labor Force",2016-09-0064.jpg,none,none
An visual insight into the 200 largest companies in the world,d-qn,2016-09-06 14:02:57,http://www.mo.be/en/en/interactive-graphic-200-largest-companies-world,https://www.reddit.com/r/dataisbeautiful/comments/51fc3m/an_visual_insight_into_the_200_largest_companies/,0,0,0,2,An visual insight into the 200 largest companies in the world,2016-09-0069.jpg,none,none
"A Darknet Site Currently Offers 42,497 U.S. Credit Cards [OC]",CuriousGnu,2016-09-06 14:09:00,https://www.curiousgnu.com/darknet-credit-cards,https://www.reddit.com/r/dataisbeautiful/comments/51fcyf/a_darknet_site_currently_offers_42497_us_credit/,13,13,0,4,"A Darknet Site Currently Offers 42,497 U.S. Credit Cards OC",2016-09-0070.jpg,none,"cybersecurity, darknet, credit cards, united states, crime"
#catsofinstagram vs #dogsofinstagram,GemmaJ123,2016-09-06 15:18:01,http://www.ignitesocialmedia.com/social-media-analytics/cats-versus-dogs-instagram/,https://www.reddit.com/r/dataisbeautiful/comments/51fouc/catsofinstagram_vs_dogsofinstagram/,0,0,0,0,#catsofinstagram vs #dogsofinstagram,2016-09-0071.jpg,none,"pets, cats, dogs, social media, instagram"
A visualization of global tree cover levels,aDrunkLlama,2016-09-06 18:12:07,http://christinabergey.com/notes_code/treecover_globe/index.html,https://www.reddit.com/r/dataisbeautiful/comments/51gj2w/a_visualization_of_global_tree_cover_levels/,2,2,0,0,A visualization of global tree cover levels,2016-09-0073.jpg,none,none
"It would take 62,000 years to read all the books in existence - BBC's visualization for read a book day",sarahbotts,2016-09-06 19:30:34,https://www.twitter.com/BBCiWonder/status/773111705312387072,https://www.reddit.com/r/dataisbeautiful/comments/51gy8p/it_would_take_62000_years_to_read_all_the_books/,5,5,0,2,"It would take 62,000 years to read all the books in existence - BBC's visualization for read a book day",2016-09-0076.jpg,none,"books, reading, literature, statistics, estimation"
What Homer Simpson's 100+ jobs tell us about America's middle class,wease54,2016-09-06 20:09:20,http://www.vox.com/2016/9/6/12752476/the-simpsons-homer-middle-class,https://www.reddit.com/r/dataisbeautiful/comments/51h5px/what_homer_simpsons_100_jobs_tell_us_about/,3477,3477,0,577,What Homer Simpson's 100+ jobs tell us about America's middle class,2016-09-0077.jpg,none,none
New elevation map details Alaska like never before,sataky,2016-09-06 20:37:26,https://medium.com/the-white-house/new-elevation-map-details-alaska-like-never-before-b7a659f02a3a,https://www.reddit.com/r/dataisbeautiful/comments/51hbdm/new_elevation_map_details_alaska_like_never_before/,1,1,0,0,New elevation map details Alaska like never before,2016-09-0078.jpg,none,"alaska, nature, landscape, exploration"
Price comparison across Europe of 'premium brand' cigarettes.,badmother,2016-09-06 21:56:44,http://www.cafebabel.co.uk/lifestyle/article/map-of-the-week-the-prices-of-cigarettes-across-europe.html,https://www.reddit.com/r/dataisbeautiful/comments/51hq6k/price_comparison_across_europe_of_premium_brand/,3,3,0,3,Price comparison across Europe of 'premium brand' cigarettes.,2016-09-0079.jpg,none,"smoking, lifestyle, europe, brand, consumer products"
Detailed age map shows how Milky Way came together,HeuristicALgorithmic,2016-09-07 08:34:35,http://news.nd.edu/news/69448-detailed-age-map-shows-how-milky-way-came-together/,https://www.reddit.com/r/dataisbeautiful/comments/51k9ww/detailed_age_map_shows_how_milky_way_came_together/,6,6,0,0,Detailed age map shows how Milky Way came together,2016-09-0086.jpg,none,none
Big Board - little universe: See the universe in just 200 base-2 notations from the Planck Scale,brucecamber,2016-09-07 17:14:44,http://bblu.org,https://www.reddit.com/r/dataisbeautiful/comments/51md3s/big_board_little_universe_see_the_universe_in/,1,1,0,1,Big Board - little universe See the universe in just 200 base-2 notations from the Planck Scale,2016-09-0092.jpg,none,none
"Of 32 summer movies released through Aug. 19 by the six major studios, 17 lost a total of $915.6 million",toolroomknights,2016-09-07 18:32:23,http://www.bloomberg.com/news/articles/2016-09-01/hollywood-s-summertime-bombs-got-a-lot-more-disastrous-this-year,https://www.reddit.com/r/dataisbeautiful/comments/51mrio/of_32_summer_movies_released_through_aug_19_by/,1,1,0,2,"Of 32 summer movies released through Aug. 19 by the six major studios, 17 lost a total of $915.6 million",2016-09-0093.jpg,none,none
VisitNH's fall foliage visualization,UndeadCaesar,2016-09-07 21:32:28,http://www.visitnh.gov/vacation-ideas/Foliage-Tracker/,https://www.reddit.com/r/dataisbeautiful/comments/51npma/visitnhs_fall_foliage_visualization/,7,7,0,0,VisitNH's fall foliage visualization,2016-09-0096.jpg,none,"tourism, new hampshire, travel, nature"
How long does it take games to be cheap on Steam?,slayer1o00,2016-09-08 01:49:39,http://www.pcgamer.com/steam-sale-dates/,https://www.reddit.com/r/dataisbeautiful/comments/51owy4/how_long_does_it_take_games_to_be_cheap_on_steam/,21,21,0,1,How long does it take games to be cheap on Steam,2016-09-0099.jpg,none,"gaming, discounts, sales, steam, video games"
New estimates of the Australian gender gap,jimrosenz,2016-09-08 07:23:57,https://theconversation.com/will-the-real-gender-pay-gap-please-stand-up-64588,https://www.reddit.com/r/dataisbeautiful/comments/51q4st/new_estimates_of_the_australian_gender_gap/,1,1,0,3,New estimates of the Australian gender gap,2016-09-0102.jpg,none,none
Live reaction to announcements from Wednesday's Apple Event [OC],GemmaJ123,2016-09-08 08:54:25,https://www.brandwatch.com/2016/09/react-apple-event-went-social/,https://www.reddit.com/r/dataisbeautiful/comments/51qd2s/live_reaction_to_announcements_from_wednesdays/,2,2,0,1,Live reaction to announcements from Wednesday's Apple Event OC,2016-09-0103.jpg,none,"technology, apple, announcements, live reaction"
"Texting While Driving Statistics: 43% of drivers ignore no-texting laws, but 92% of them have never been pulled over for it",BlissWhiteShoes,2016-09-08 13:19:50,https://simpletexting.com/43-of-drivers-ignore-no-texting-laws/,https://www.reddit.com/r/dataisbeautiful/comments/51r951/texting_while_driving_statistics_43_of_drivers/,2250,2250,0,725,"Texting While Driving Statistics 43% of drivers ignore no-texting laws, but 92% of them have never been pulled over for it",2016-09-0108.jpg,none,"communication, technology, small businesses"
Hillary Clinton's adjusted gross income and taxes owed since 2000 [OC],TalentedGorilla,2016-09-08 14:11:29,https://www.datazar.com/file/f515164f2-776c-41a3-993b-07917a15133b,https://www.reddit.com/r/dataisbeautiful/comments/51rhhz/hillary_clintons_adjusted_gross_income_and_taxes/,2,2,0,4,Hillary Clinton's adjusted gross income and taxes owed since 2000 OC,2016-09-0109.jpg,none,none
Data-generated art: inkblot ghosts of altruism gene AVPR1a,sataky,2016-09-08 15:13:07,http://community.wolfram.com/groups/-/m/t/921020,https://www.reddit.com/r/dataisbeautiful/comments/51rs5q/datagenerated_art_inkblot_ghosts_of_altruism_gene/,2,2,0,0,Data-generated art inkblot ghosts of altruism gene AVPR1a,2016-09-0110.jpg,none,none
New Data reveals changing Consumer Sentiment around Apple Products,electron_monk,2016-09-08 23:44:22,http://www.dailydot.com/debug/iphone-7-release-consumer-sentiment-unu-unanimous-ai/,https://www.reddit.com/r/dataisbeautiful/comments/51udzn/new_data_reveals_changing_consumer_sentiment/,12,12,0,10,New Data reveals changing Consumer Sentiment around Apple Products,2016-09-0118.jpg,none,"technology, consumer sentiment, apple, products"
Death in the Grand Canyon - The complete and comprehensive history of grand canyon misadventures mapped in 3D,Imposter24,2016-09-09 01:34:05,http://www.esri.com/products/maps-we-love/death-grand-canyon,https://www.reddit.com/r/dataisbeautiful/comments/51uvun/death_in_the_grand_canyon_the_complete_and/,4,4,0,5,Death in the Grand Canyon - The complete and comprehensive history of grand canyon misadventures mapped in 3D,2016-09-0119.jpg,none,none
"Today I was reminded of this - ""1945-1998"" by ISAO HASHIMOTO",propagandhist,2016-09-09 06:34:37,https://www.youtube.com/watch?v=cjAqR1zICA0,https://www.reddit.com/r/dataisbeautiful/comments/51w1l3/today_i_was_reminded_of_this_19451998_by_isao/,20,20,0,1,Today I was reminded of this - 1945-1998 by ISAO HASHIMOTO,2016-09-0121.jpg,none,"nuclear weapons, history, global events, military, international relations"
Walleye decline & bass increase tied to climate warming of midwest lakes. Interactive visualization [OC],houndrunner,2016-09-09 13:41:29,https://owi.usgs.gov/vizlab/climate-change-walleye-bass/,https://www.reddit.com/r/dataisbeautiful/comments/51xfri/walleye_decline_bass_increase_tied_to_climate/,20,20,0,2,Walleye decline & bass increase tied to climate warming of midwest lakes. Interactive visualization OC,2016-09-0124.jpg,none,"climate change, freshwater fish, environment, ecology, lakes, midwest"
"Interactive visuals with all 27,000+ songs that have reached the Billboard Hot 100 organized by genre [OC]",jackbeckwith,2016-09-09 14:21:15,http://thedataface.com/genre-lifecycles/,https://www.reddit.com/r/dataisbeautiful/comments/51xmx5/interactive_visuals_with_all_27000_songs_that/,41,41,0,3,"Interactive visuals with all 27,000+ songs that have reached the Billboard Hot 100 organized by genre OC",2016-09-0125.jpg,none,"music, billboard hot 100, songs, genres"
Visualizing the Size of the U.S. National Debt,urbanachiever77,2016-09-09 16:44:01,http://money.visualcapitalist.com/visualizing-size-u-s-national-debt/,https://www.reddit.com/r/dataisbeautiful/comments/51ycr0/visualizing_the_size_of_the_us_national_debt/,3,3,0,5,Visualizing the Size of the U.S. National Debt,2016-09-0130.jpg,none,"economy, finance, u.s. national debt, government"
Climate Change: Earth Surface Temperature Data | Kaggle,vI-_-Iv,2016-09-09 18:19:53,https://www.kaggle.com/dmitriy19/d/berkeleyearth/climate-change-earth-surface-temperature-data/some-visualizations-for-climate-change/notebook,https://www.reddit.com/r/dataisbeautiful/comments/51yul0/climate_change_earth_surface_temperature_data/,3,3,0,0,Climate Change Earth Surface Temperature Data Kaggle,2016-09-0132.jpg,none,"climate change, earth, temperature, data, analysis"
How to analyze your steps data from your phone,scottyla19,2016-09-10 20:46:47,http://blog.yhat.com/posts/phone-steps-timeseries.html,https://www.reddit.com/r/dataisbeautiful/comments/5252p6/how_to_analyze_your_steps_data_from_your_phone/,15,15,0,0,How to analyze your steps data from your phone,2016-09-0138.jpg,none,"data analysis, fitness, technology"
Which Countries Contribute The Most To The UN?,xenonbro,2016-09-11 20:27:33,http://www.forbes.com/sites/niallmccarthy/2016/07/15/which-countries-contribute-the-most-to-the-united-nations-infographic/#37de851737b9,https://www.reddit.com/r/dataisbeautiful/comments/52ahtv/which_countries_contribute_the_most_to_the_un/,19,19,0,4,Which Countries Contribute The Most To The UN,2016-09-0146.jpg,none,none
Imgur Survey - Preliminary Results [OC],smileytechguy,2016-09-11 21:17:28,http://imgur.com/gallery/jgysO/,https://www.reddit.com/r/dataisbeautiful/comments/52aqzt/imgur_survey_preliminary_results_oc/,0,0,0,3,Imgur Survey - Preliminary Results OC,2016-09-0147.jpg,none,"survey, data collection, imgur"
Periodic table showing compounds formed by multiple clicked elements [OC],Lucent,2016-09-12 01:46:06,http://www.ptable.com/#Compound,https://www.reddit.com/r/dataisbeautiful/comments/52byx4/periodic_table_showing_compounds_formed_by/,28,28,0,11,Periodic table showing compounds formed by multiple clicked elements OC,2016-09-0148.jpg,none,none
(UK) Worst places to be a girl,GemmaJ123,2016-09-12 10:39:18,https://www.theguardian.com/society/2016/sep/12/girls-quality-of-life-shows-huge-variation-around-the-country-report,https://www.reddit.com/r/dataisbeautiful/comments/52dpcy/uk_worst_places_to_be_a_girl/,0,0,0,2,(UK) Worst places to be a girl,2016-09-0151.jpg,none,none
"What 100,000 Tweets About the Volkswagen Scandal Tell Us About Angry Customers",yourbasicgeek,2016-09-12 14:50:14,https://hbr.org/2016/09/what-100000-tweets-about-the-volkswagen-scandal-tell-us-about-angry-customers,https://www.reddit.com/r/dataisbeautiful/comments/52ep0w/what_100000_tweets_about_the_volkswagen_scandal/,7,7,0,1,"What 100,000 Tweets About the Volkswagen Scandal Tell Us About Angry Customers",2016-09-0154.jpg,none,"social media, customer sentiment, automotive industry, corporate scandals"
Number of Breweries and Brewpubs in the US from 1873 to present,sarahbotts,2016-09-12 21:48:35,https://www.brewersassociation.org/statistics/number-of-breweries/,https://www.reddit.com/r/dataisbeautiful/comments/52gws5/number_of_breweries_and_brewpubs_in_the_us_from/,2,2,0,0,Number of Breweries and Brewpubs in the US from 1873 to present,2016-09-0160.jpg,none,"breweries, beer industry, united states, history, business trends"
A treemap of the world's 244 million migrants [OC],d-qn,2016-09-13 15:30:01,http://www.swissinfo.ch/eng/migration-series--part-2-_with-244-million-immigrants-in-the-world--which-country-has-the-most-/42439122,https://www.reddit.com/r/dataisbeautiful/comments/52l29t/a_treemap_of_the_worlds_244_million_migrants_oc/,19,19,0,3,A treemap of the world's 244 million migrants OC,2016-09-0168.jpg,none,"migration, demographics, global trends, population"
I made a polar plot of the recently released global temperature anomaly data. The tunnel is approaching quickly .... [OC],climateplotter,2016-09-13 19:43:44,https://github.com/wvangeit/ClimateTunnel,https://www.reddit.com/r/dataisbeautiful/comments/52mgs3/i_made_a_polar_plot_of_the_recently_released/,13,13,0,6,I made a polar plot of the recently released global temperature anomaly data. The tunnel is approaching quickly .... OC,2016-09-0170.jpg,none,none
Which NFL Team Would Win in Scrabble? [OC],nickb500,2016-09-14 00:05:13,https://beckernick.github.io/nfl-scrabble/,https://www.reddit.com/r/dataisbeautiful/comments/52nrue/which_nfl_team_would_win_in_scrabble_oc/,2,2,0,3,Which NFL Team Would Win in Scrabble OC,2016-09-0173.jpg,none,"sports, nfl, scrabble, games"
Pokémon GO’s paying population dropped 79 percent but is still the most profitable mobile game,sarahbotts,2016-09-14 01:59:55,https://intelligence.slice.com/pokemon-gos-paying-population-dropped-79-percent-still-profitable-mobile-game/,https://www.reddit.com/r/dataisbeautiful/comments/52o9nl/pokémon_gos_paying_population_dropped_79_percent/,25,25,0,10,Pokémon GO’s paying population dropped 79 percent but is still the most profitable mobile game,2016-09-0174.jpg,none,none
What is this kind of visualisation called and what can I use to build one?,thundergolfer,2016-09-14 02:05:38,https://www.reddit.com/r/dataisbeautiful/comments/52oaiz/what_is_this_kind_of_visualisation_called_and/,https://www.reddit.com/r/dataisbeautiful/comments/52oaiz/what_is_this_kind_of_visualisation_called_and/,4,4,0,7,What is this kind of visualisation called and what can I use to build one,2016-09-0175.jpg,none,none
Hostile Neighbors: China vs. Japan,ManiaforBeatles,2016-09-14 03:15:41,http://www.pewglobal.org/2016/09/13/hostile-neighbors-china-vs-japan/,https://www.reddit.com/r/dataisbeautiful/comments/52ol10/hostile_neighbors_china_vs_japan/,4,4,0,0,Hostile Neighbors China vs. Japan,2016-09-0178.jpg,none,"geopolitics, international relations, china, japan"
Extremely detailed solar system simulator,hlake,2016-09-14 03:18:40,http://mgvez.github.io/jsorrery/?scenario=InnerSolarSystem&planetScale=8&lookFrom=earth&lookAt=moon&fov=10,https://www.reddit.com/r/dataisbeautiful/comments/52olfs/extremely_detailed_solar_system_simulator/,121,121,0,8,Extremely detailed solar system simulator,2016-09-0179.jpg,none,"astronomy, solar system, space, simulation"
Death in the Air: Air Pollution Costs Money and Lives,233C,2016-09-14 04:29:00,http://www.worldbank.org/en/news/infographic/2016/09/08/death-in-the-air-air-pollution-costs-money-and-lives,https://www.reddit.com/r/dataisbeautiful/comments/52oukw/death_in_the_air_air_pollution_costs_money_and/,1,1,0,0,Death in the Air Air Pollution Costs Money and Lives,2016-09-0180.jpg,none,"air pollution, environment, health, economics"
