title,author,created_date,url,full_permalink,score,ups,downs,num_comments,sanitized_title,image_file,chart_type,high_level_categories
James Bond's alcohol problem,dummyhole,2016-10-02 04:38:45,http://www.bbc.com/news/health-25349738,https://www.reddit.com/r/dataisbeautiful/comments/55gvu6/james_bonds_alcohol_problem/,14,14,0,2,James Bond's alcohol problem,2016-10-0008.jpg,none,none
"Beyond Four Corners, USA",sataky,2016-10-02 09:26:29,http://community.wolfram.com/groups/-/m/t/932548,https://www.reddit.com/r/dataisbeautiful/comments/55hl12/beyond_four_corners_usa/,11,11,0,0,"Beyond Four Corners, USA",2016-10-0010.jpg,none,none
The states that Americans sing about most,ahmed_imtiaz,2016-10-02 17:48:52,https://www.washingtonpost.com/news/wonk/wp/2016/10/01/the-states-that-americans-sing-about-most/?tid=sm_fb,https://www.reddit.com/r/dataisbeautiful/comments/55jb97/the_states_that_americans_sing_about_most/,399,399,0,75,The states that Americans sing about most,2016-10-0013.jpg,none,none
How Economics Went From Theory to Data - Bloomberg View,jimrosenz,2016-10-02 20:54:36,https://www.bloomberg.com/view/articles/2016-01-06/how-economics-went-from-theory-to-data?utm_campaign=MRUTweets&utm_content=bufferb74a3&utm_medium=social&utm_source=Twitter,https://www.reddit.com/r/dataisbeautiful/comments/55k7hi/how_economics_went_from_theory_to_data_bloomberg/,8,8,0,0,How Economics Went From Theory to Data - Bloomberg View,2016-10-0014.jpg,none,none
"BBC News - James Bond: Cars, catchphrases and kisses",jimrosenz,2016-10-03 06:39:52,http://www.bbc.co.uk/news/entertainment-arts-20026367,https://www.reddit.com/r/dataisbeautiful/comments/55mhcj/bbc_news_james_bond_cars_catchphrases_and_kisses/,2,2,0,0,"BBC News - James Bond Cars, catchphrases and kisses",2016-10-0016.jpg,none,none
"Exploring the post-rock world on Spotify, pt. 1 (survey results!)",dozzinale,2016-10-03 10:50:13,https://medium.com/@finalfire/exploring-the-post-rock-world-on-spotify-pt-1-7cfd33f028f9#.1cyb28dkx,https://www.reddit.com/r/dataisbeautiful/comments/55n3kr/exploring_the_postrock_world_on_spotify_pt_1/,18,18,0,3,"Exploring the post-rock world on Spotify, pt. 1 (survey results!)",2016-10-0017.jpg,none,"music, post-rock, spotify, survey"
Index Front Running: What Happens When a Stock is Added to an Index? [OC],cokechan,2016-10-03 16:44:57,http://www.signalplot.com/index-front-running-what-happens-when-a-stock-is-added-to-an-index/,https://www.reddit.com/r/dataisbeautiful/comments/55okgp/index_front_running_what_happens_when_a_stock_is/,5,5,0,1,Index Front Running What Happens When a Stock is Added to an Index OC,2016-10-0024.jpg,none,"finance, stock market, investment"
This Is Probably the Least You’ll Weigh All Year. Sorry.,kartik_sundar,2016-10-03 18:54:30,http://www.nytimes.com/2016/10/04/well/eat/low-point-weight-wireless-scales.html,https://www.reddit.com/r/dataisbeautiful/comments/55p96m/this_is_probably_the_least_youll_weigh_all_year/,0,0,0,1,This Is Probably the Least You’ll Weigh All Year. Sorry.,2016-10-0028.jpg,none,"weight, health, lifestyle, annual trends"
See mentions of cereal on Twitter in real time! [OC],meandmybadself,2016-10-03 20:23:05,http://cereal.social,https://www.reddit.com/r/dataisbeautiful/comments/55pqb1/see_mentions_of_cereal_on_twitter_in_real_time_oc/,17,17,0,17,See mentions of cereal on Twitter in real time! OC,2016-10-0029.jpg,none,"social media, twitter, cereal, mentions, real-time data"
Female representation in Canadian and international governments,amandavanf,2016-10-04 16:51:34,http://capitalnews.ca/female-politicians-face-uphill-climb-despite-gender-balanced-cabinet/,https://www.reddit.com/r/dataisbeautiful/comments/55ug58/female_representation_in_canadian_and/,1,1,0,4,Female representation in Canadian and international governments,2016-10-0036.jpg,none,none
So what's really going on with Canada Post?,AmandaVollmershausen,2016-10-05 01:48:56,http://capitalnews.ca/post/,https://www.reddit.com/r/dataisbeautiful/comments/55x4tm/so_whats_really_going_on_with_canada_post/,2,2,0,0,So what's really going on with Canada Post,2016-10-0042.jpg,none,"canada, politics, news"
Visualization of Colorado's changing population (1990-2040)[OC],LosPerrosGrandes,2016-10-05 17:50:08,http://andrewfulton.io/visualization/2016/10/05/co-pop-visualization.html,https://www.reddit.com/r/dataisbeautiful/comments/560rvq/visualization_of_colorados_changing_population/,1,1,0,7,Visualization of Colorado's changing population (1990-2040)OC,2016-10-0051.jpg,none,none
Watch the world's population age (The Human Mortality Database visualized) [OC],InInteraction,2016-10-05 17:58:39,https://www.statnews.com/2016/10/05/human-lifespan-limits/,https://www.reddit.com/r/dataisbeautiful/comments/560tkj/watch_the_worlds_population_age_the_human/,4,4,0,2,Watch the world's population age (The Human Mortality Database visualized) OC,2016-10-0052.jpg,none,"demographics, aging, population, human lifespan"
[OC] Mastering PokemomGO with Tableau visualization,saintvee,2016-10-05 18:20:43,http://bridgei2i.com/blog/acing-pokemon-go-with-tableau-visualization-bridgei2i-vizards/,https://www.reddit.com/r/dataisbeautiful/comments/560xsb/oc_mastering_pokemomgo_with_tableau_visualization/,0,0,0,0,OC Mastering PokemomGO with Tableau visualization,2016-10-0053.jpg,none,none
Immigrants Play a Disproportionate Role in American Entrepreneurship,jimrosenz,2016-10-05 21:23:32,https://hbr.org/2016/10/immigrants-play-a-disproportionate-role-in-american-entrepreneurship,https://www.reddit.com/r/dataisbeautiful/comments/561wdy/immigrants_play_a_disproportionate_role_in/,11,11,0,0,Immigrants Play a Disproportionate Role in American Entrepreneurship,2016-10-0057.jpg,none,"immigration, entrepreneurship, economy, demographics"
The Vox Vacation Index: Let economics help plan your next vacation,id53,2016-10-06 07:13:09,http://www.vox.com/a/vacation-index,https://www.reddit.com/r/dataisbeautiful/comments/5648dh/the_vox_vacation_index_let_economics_help_plan/,7,7,0,0,The Vox Vacation Index Let economics help plan your next vacation,2016-10-0061.jpg,none,"travel, economics, vacation planning"
The Racial Confidence Gap in Police Performance,jimrosenz,2016-10-06 08:04:06,http://www.pewsocialtrends.org/2016/09/29/the-racial-confidence-gap-in-police-performance/?utm_content=buffere735b&utm_medium=social&utm_source=twitter.com&utm_campaign=buffer,https://www.reddit.com/r/dataisbeautiful/comments/564daw/the_racial_confidence_gap_in_police_performance/,5,5,0,0,The Racial Confidence Gap in Police Performance,2016-10-0062.jpg,none,"race, confidence, police, performance, society"
India's ascent: Five opportunities for growth and transformation,lapivan,2016-10-06 11:17:50,http://www.mckinsey.com/global-themes/employment-and-growth/indias-ascent-five-opportunities-for-growth-and-transformation?cid=other-eml-alt-mip-mgi-oth-1608,https://www.reddit.com/r/dataisbeautiful/comments/564vig/indias_ascent_five_opportunities_for_growth_and/,1,1,0,0,India's ascent Five opportunities for growth and transformation,2016-10-0065.jpg,none,"india, growth, opportunities, transformation"
Natural language processing on the first 2016 presidential debate [OC],ooglag,2016-10-06 13:08:53,http://fouriestseries.tumblr.com/post/151287440363/natural-language-processing-on-the-first-2016,https://www.reddit.com/r/dataisbeautiful/comments/565a7y/natural_language_processing_on_the_first_2016/,60,60,0,9,Natural language processing on the first 2016 presidential debate OC,2016-10-0067.jpg,none,none
Tracking TV ads in the 2016 state races,keech6,2016-10-06 14:37:06,https://www.publicintegrity.org/2016/10/06/20290/tracking-tv-ads-2016-state-races,https://www.reddit.com/r/dataisbeautiful/comments/565odg/tracking_tv_ads_in_the_2016_state_races/,4,4,0,1,Tracking TV ads in the 2016 state races,2016-10-0070.jpg,none,none
The Rhetoric of Donald Trump [OC],enchantx,2016-10-06 15:41:40,http://codepen.io/eehayman/full/vXWyqo/,https://www.reddit.com/r/dataisbeautiful/comments/565zzy/the_rhetoric_of_donald_trump_oc/,9,9,0,2,The Rhetoric of Donald Trump OC,2016-10-0075.jpg,none,"politics, rhetoric, language, communication"
Hurricane Matthew,Lets_smile,2016-10-06 21:25:24,https://www.ventusky.com/?p=42.6%3B-73.6%3B3&l=gust&t=20161007%2F08&w=0xIAb9A9A,https://www.reddit.com/r/dataisbeautiful/comments/567ucc/hurricane_matthew/,237,237,0,9,Hurricane Matthew,2016-10-0085.jpg,none,"weather, hurricane, earth, climate, geography"
"Data shows truck drivers, construction workers and machinists are job titles more likely to support Donald Trump",hollidaychh,2016-10-06 22:01:57,http://www.payscale.com/career-news/2016/10/job-types-support-candidate-will-president-part-7,https://www.reddit.com/r/dataisbeautiful/comments/56810c/data_shows_truck_drivers_construction_workers_and/,12,12,0,8,"Data shows truck drivers, construction workers and machinists are job titles more likely to support Donald Trump",2016-10-0086.jpg,none,none
Why are Nobel Prize winners getting older? - BBC News,jimrosenz,2016-10-07 09:38:30,http://www.bbc.com/news/science-environment-37578899,https://www.reddit.com/r/dataisbeautiful/comments/56akk7/why_are_nobel_prize_winners_getting_older_bbc_news/,2,2,0,2,Why are Nobel Prize winners getting older - BBC News,2016-10-0093.jpg,none,"nobel prize, age, science, academia"
Damped oscillations in value of pound following flash crash,pyrophorus,2016-10-07 13:45:48,https://www.theguardian.com/business/2016/oct/07/confusion-as-pound-falls-10-in-insane-asian-trading-and-no-one-knows-why,https://www.reddit.com/r/dataisbeautiful/comments/56bf65/damped_oscillations_in_value_of_pound_following/,3,3,0,1,Damped oscillations in value of pound following flash crash,2016-10-0095.jpg,none,"finance, currency, economics, market events, pound, trading"
Coroners in Pennsylvania have blocked more organ donations than many other states combined.,rrsafety,2016-10-08 01:53:18,http://www.pennlive.com/news/2016/10/transplant_advocates_say_pa_co.html,https://www.reddit.com/r/dataisbeautiful/comments/56ewh8/coroners_in_pennsylvania_have_blocked_more_organ/,2795,2795,0,333,Coroners in Pennsylvania have blocked more organ donations than many other states combined.,2016-10-0100.jpg,none,"healthcare, organ donation, pennsylvania, legal issues"
What Are the Most Popular Marijuana Products?,jimrosenz,2016-10-09 07:02:52,https://priceonomics.com/what-are-the-most-popular-marijuana-products/,https://www.reddit.com/r/dataisbeautiful/comments/56l7gi/what_are_the_most_popular_marijuana_products/,0,0,0,4,What Are the Most Popular Marijuana Products,2016-10-0109.jpg,none,"marijuana, products, cannabis"
"Projection of the Total World Population by Level of Education, 1970 – 2100",jimrosenz,2016-10-10 09:18:17,https://ourworldindata.org/grapher/projection-of-world-population-SSP2-IIASA,https://www.reddit.com/r/dataisbeautiful/comments/56r5yg/projection_of_the_total_world_population_by_level/,3,3,0,6,"Projection of the Total World Population by Level of Education, 1970 – 2100",2016-10-0114.jpg,none,none
The State of American Jobs,kartik_sundar,2016-10-10 16:37:43,http://www.pewsocialtrends.org/2016/10/06/the-state-of-american-jobs/,https://www.reddit.com/r/dataisbeautiful/comments/56sw2l/the_state_of_american_jobs/,3,3,0,0,The State of American Jobs,2016-10-0118.jpg,none,"jobs, employment, economy"
World's Deadliest Animal (with updated data),thisisbillgates,2016-10-10 18:54:12,https://www.gatesnotes.com/Health/Mapping-the-End-of-Malaria,https://www.reddit.com/r/dataisbeautiful/comments/56tns2/worlds_deadliest_animal_with_updated_data/,161,161,0,30,World's Deadliest Animal (with updated data),2016-10-0121.jpg,none,none
Why Does Portland Have so Many Strip Clubs?,jimrosenz,2016-10-11 04:28:15,https://priceonomics.com/why-does-portland-have-so-many-strip-clubs/,https://www.reddit.com/r/dataisbeautiful/comments/56wdv2/why_does_portland_have_so_many_strip_clubs/,31,31,0,1,Why Does Portland Have so Many Strip Clubs,2016-10-0124.jpg,none,"strip clubs, entertainment, culture, portland"
Geo Twitter Sentiment Analysis Visualization that me and my friend developed as a minor school project [OC],petrbel,2016-10-11 08:10:05,https://github.com/vojtsek/twitter-sentiment,https://www.reddit.com/r/dataisbeautiful/comments/56x0va/geo_twitter_sentiment_analysis_visualization_that/,3,3,0,2,Geo Twitter Sentiment Analysis Visualization that me and my friend developed as a minor school project OC,2016-10-0127.jpg,none,none
Night Mountain Bike Trails Animated with Video [OC],acrahen,2016-10-11 12:25:17,https://public.tableau.com/views/NightBiking/NightBiking?:embed=y&:display_count=yes&:showVizHome=no,https://www.reddit.com/r/dataisbeautiful/comments/56xpyv/night_mountain_bike_trails_animated_with_video_oc/,6,6,0,2,Night Mountain Bike Trails Animated with Video OC,2016-10-0129.jpg,none,"mountain biking, trails, video, adventure, sports"
A Textual Analysis – The Rise and Fall of the Third Reich [OC],ygtbsme,2016-10-11 16:32:49,http://lstarnes.com/2016/10/05/rafo3r/,https://www.reddit.com/r/dataisbeautiful/comments/56ywgc/a_textual_analysis_the_rise_and_fall_of_the_third/,3,3,0,1,A Textual Analysis – The Rise and Fall of the Third Reich OC,2016-10-0135.jpg,none,"history, world war ii, nazi germany"
What New York Could Look Like in 2020,bonkavonk,2016-10-11 17:40:05,http://www.nationalgeographic.com/new-york-city-skyline-tallest-midtown-manhattan/,https://www.reddit.com/r/dataisbeautiful/comments/56z9q1/what_new_york_could_look_like_in_2020/,13,13,0,4,What New York Could Look Like in 2020,2016-10-0137.jpg,none,"urban planning, architecture, future forecasting, new york"
GoPro's Use of Fake Reviews on Amazon [OC],FakeFilter,2016-10-11 20:18:09,https://www.fakefilter.com/articles/gopros-massive-use-of-fake-reviews-on-amazon,https://www.reddit.com/r/dataisbeautiful/comments/5704v5/gopros_use_of_fake_reviews_on_amazon_oc/,20,20,0,8,GoPro's Use of Fake Reviews on Amazon OC,2016-10-0142.jpg,none,none
The State of American Retirement: How 401(k)s have failed most American workers,sarahbotts,2016-10-11 22:47:37,http://www.epi.org/publication/retirement-in-america,https://www.reddit.com/r/dataisbeautiful/comments/570wig/the_state_of_american_retirement_how_401ks_have/,4,4,0,8,The State of American Retirement How 401(k)s have failed most American workers,2016-10-0144.jpg,none,"retirement, american workers, 401(k), economics, social security"
"Why infectious bacteria are winning - bacterial infections are still killing about 700,000 people each year",zonination,2016-10-12 13:02:03,http://qz.com/576057/why-infectious-bacteria-are-winning/,https://www.reddit.com/r/dataisbeautiful/comments/573xfx/why_infectious_bacteria_are_winning_bacterial/,158,158,0,11,"Why infectious bacteria are winning - bacterial infections are still killing about 700,000 people each year",2016-10-0147.jpg,none,"health, bacteria, infections, disease, mortality"
Retirement Plans: Millennials vs Baby Boomers,latro12,2016-10-12 13:21:47,http://americanadvisorsgroup.com/2016/09/19/retirement-millennials-vs-baby-boomers/,https://www.reddit.com/r/dataisbeautiful/comments/5740ly/retirement_plans_millennials_vs_baby_boomers/,2164,2164,0,922,Retirement Plans Millennials vs Baby Boomers,2016-10-0149.jpg,none,none
E-Commerce KPI Study: There's (Finally) a Benchmark for That,ahmednabi,2016-10-12 21:41:58,https://moz.com/blog/ecommerce-kpi-benchmark-study,https://www.reddit.com/r/dataisbeautiful/comments/576pi3/ecommerce_kpi_study_theres_finally_a_benchmark/,1,1,0,0,E-Commerce KPI Study There's (Finally) a Benchmark for That,2016-10-0156.jpg,none,"e-commerce, kpi, benchmark, study"
Pew Research: The Relationship between Political Views and Stances on Climate Change,happiiiface,2016-10-13 03:27:59,http://www.pewinternet.org/2016/10/04/the-politics-of-climate/,https://www.reddit.com/r/dataisbeautiful/comments/578a97/pew_research_the_relationship_between_political/,4,4,0,0,Pew Research The Relationship between Political Views and Stances on Climate Change,2016-10-0160.jpg,none,none
Computer Memory Prices 1976-2016 [OC],acrahen,2016-10-13 03:41:16,https://public.tableau.com/views/ComputerMemoryPrices/Memory?:embed=y&:display_count=yes&:showVizHome=no,https://www.reddit.com/r/dataisbeautiful/comments/578c3z/computer_memory_prices_19762016_oc/,14,14,0,8,Computer Memory Prices 1976-2016 OC,2016-10-0161.jpg,none,none
What the US presidential election results would look like (broken down by state) if only women voted vs if only men voted,Bluegreeney,2016-10-13 04:46:01,http://fivethirtyeight.com/features/election-update-women-are-defeating-donald-trump/,https://www.reddit.com/r/dataisbeautiful/comments/578kv9/what_the_us_presidential_election_results_would/,6,6,0,4,What the US presidential election results would look like (broken down by state) if only women voted vs if only men voted,2016-10-0163.jpg,none,none
"3D representation of ""Big Data"" around politics",ericaG1981,2016-10-13 08:48:42,https://webhose.io/demo/big-data?cat=politics,https://www.reddit.com/r/dataisbeautiful/comments/579b14/3d_representation_of_big_data_around_politics/,0,0,0,3,3D representation of Big Data around politics,2016-10-0167.jpg,none,"big data, politics, technology"
The LA Times explains in detail why its US presidential polling data are so different from everyone else's,1Davide,2016-10-13 14:55:12,http://www.latimes.com/politics/la-na-pol-poll-faq-20161006-snap-story.html,https://www.reddit.com/r/dataisbeautiful/comments/57anla/the_la_times_explains_in_detail_why_its_us/,4199,4199,0,696,The LA Times explains in detail why its US presidential polling data are so different from everyone else's,2016-10-0176.jpg,none,"polling, elections, politics"
Which news outlets share an audience? [OC],richshaw,2016-10-13 16:45:32,https://elmoregreen.com/who-reads,https://www.reddit.com/r/dataisbeautiful/comments/57b8z9/which_news_outlets_share_an_audience_oc/,5,5,0,2,Which news outlets share an audience OC,2016-10-0178.jpg,none,none
Speeding through NYC: 1.2 Billion Row NYC Taxi Dataset,rocketcorner,2016-10-13 18:01:41,https://www.mapd.com/blog/2016/10/13/speeding-through-nyc-the-billion-row-nyc-taxi-dataset/,https://www.reddit.com/r/dataisbeautiful/comments/57bo5c/speeding_through_nyc_12_billion_row_nyc_taxi/,3,3,0,0,Speeding through NYC 1.2 Billion Row NYC Taxi Dataset,2016-10-0180.jpg,none,"transportation, nyc, data analysis, taxis"
"America's unique gun violence problem, in 17 maps and charts",DoremusJessup,2016-10-13 20:17:48,http://www.vox.com/2015/8/24/9183525/gun-violence-statistics,https://www.reddit.com/r/dataisbeautiful/comments/57ceov/americas_unique_gun_violence_problem_in_17_maps/,0,0,0,18,"America's unique gun violence problem, in 17 maps and charts",2016-10-0185.jpg,none,"firearms, gun violence, america, social issues"
How free time became screen time,jimrosenz,2016-10-13 21:53:30,https://www.brookings.edu/blog/social-mobility-memos/2016/09/13/how-free-time-became-screen-time/,https://www.reddit.com/r/dataisbeautiful/comments/57cx3m/how_free_time_became_screen_time/,9,9,0,2,How free time became screen time,2016-10-0187.jpg,none,"technology, leisure, screen time, society"
All Pop Music Since 1880 in One Clickable Map,GrayPartyOfCanada,2016-10-14 02:15:57,http://musicmap.info/,https://www.reddit.com/r/dataisbeautiful/comments/57e4jo/all_pop_music_since_1880_in_one_clickable_map/,5,5,0,2,All Pop Music Since 1880 in One Clickable Map,2016-10-0190.jpg,none,none
A very well done visualization of the history of music subgenres and their influence on each other,JumboPeanut,2016-10-14 10:17:39,http://musicmap.info/,https://www.reddit.com/r/dataisbeautiful/comments/57fnk6/a_very_well_done_visualization_of_the_history_of/,87,87,0,7,A very well done visualization of the history of music subgenres and their influence on each other,2016-10-0193.jpg,none,none
Your Life in Numbers,megsee3,2016-10-14 19:32:22,http://www.yourlifeinnumbers.org/,https://www.reddit.com/r/dataisbeautiful/comments/57i8ri/your_life_in_numbers/,27,27,0,2,Your Life in Numbers,2016-10-0199.jpg,none,none
What Americans know and don't know about science,jimrosenz,2016-10-15 22:29:35,http://www.pewinternet.org/2015/09/10/what-the-public-knows-and-does-not-know-about-science/,https://www.reddit.com/r/dataisbeautiful/comments/57ohgp/what_americans_know_and_dont_know_about_science/,41,41,0,20,What Americans know and don't know about science,2016-10-0204.jpg,none,"science, knowledge, society, america"
Wikipedia Knowledge: Everything leads to Philosophy,sataky,2016-10-16 00:31:10,http://community.wolfram.com/groups/-/m/t/943673,https://www.reddit.com/r/dataisbeautiful/comments/57p0oj/wikipedia_knowledge_everything_leads_to_philosophy/,21,21,0,7,Wikipedia Knowledge Everything leads to Philosophy,2016-10-0205.jpg,none,none
What Can Four Seasons of Basic NWSL Stats Tell Us? [OC],kryptobanana,2016-10-16 02:49:37,https://medium.com/positives-and-negatives/what-can-four-seasons-of-basic-nwsl-stats-tell-us-545bd1a4da2d#.h8bdprn1i,https://www.reddit.com/r/dataisbeautiful/comments/57pki1/what_can_four_seasons_of_basic_nwsl_stats_tell_us/,6,6,0,2,What Can Four Seasons of Basic NWSL Stats Tell Us OC,2016-10-0206.jpg,none,"sports, soccer, nwsl"
U.S. Energy Mapping System,Wildkingfilms,2016-10-16 04:58:03,http://www.eia.gov/state/maps.cfm?v=Electricity,https://www.reddit.com/r/dataisbeautiful/comments/57q10q/us_energy_mapping_system/,10,10,0,0,U.S. Energy Mapping System,2016-10-0207.jpg,none,none
The contours of Switzerland (Original source in German),razuliserm,2016-10-16 13:59:32,http://translate.google.com/translate?sl=de&tl=en&js=y&prev=_t&hl=en&ie=UTF-8&u=http%3A%2F%2Fwww.nzz.ch%2Fstorytelling%2Fkonturen-der-schweiz-die-schweiz-mit-handyantennen-neu-gezeichnet-ld.117913&edit-text=,https://www.reddit.com/r/dataisbeautiful/comments/57rish/the_contours_of_switzerland_original_source_in/,11,11,0,0,The contours of Switzerland (Original source in German),2016-10-0210.jpg,none,"geography, switzerland, maps"
Climate Change: The global threat to Indian Cities,Shahrukh_Lee,2016-10-17 15:32:10,http://visreport.com/india-cities-climate-change/,https://www.reddit.com/r/dataisbeautiful/comments/57xxi9/climate_change_the_global_threat_to_indian_cities/,16,16,0,0,Climate Change The global threat to Indian Cities,2016-10-0220.jpg,none,"climate change, global threat, india, cities"
Think food waste is harmless? Think again,clhart,2016-10-17 16:03:25,http://capitalnews.ca/from-plate-to-dumpster-the-food-waste-epidemic/,https://www.reddit.com/r/dataisbeautiful/comments/57y3oa/think_food_waste_is_harmless_think_again/,2,2,0,0,Think food waste is harmless Think again,2016-10-0221.jpg,none,none
A handful of individuals are behind most airport noise complaints,megsee3,2016-10-17 16:23:05,https://www.mercatus.org/publications/airport-noise-nimbyism,https://www.reddit.com/r/dataisbeautiful/comments/57y7pj/a_handful_of_individuals_are_behind_most_airport/,56,56,0,6,A handful of individuals are behind most airport noise complaints,2016-10-0223.jpg,none,none
The world’s most-sampled track is a 6 second drum solo,Werner__Herzog,2016-10-17 20:07:10,http://fivethirtyeight.com/features/the-most-sampled-song-of-all-time/?ex_cid=story-twitter,https://www.reddit.com/r/dataisbeautiful/comments/57zid4/the_worlds_mostsampled_track_is_a_6_second_drum/,46,46,0,7,The world’s most-sampled track is a 6 second drum solo,2016-10-0227.jpg,none,"music, sampling, drums"
Moore’s and Eroom’s Law in a Graph [OC],Aquincum,2016-10-17 20:37:09,https://medium.com/@BalintBotz/moores-law-and-eroom-s-law-in-a-graph-skyrocketing-pharma-r-d-costs-despite-quantum-leaps-in-5b6bd330484#.o6lhi1lll,https://www.reddit.com/r/dataisbeautiful/comments/57zokm/moores_and_erooms_law_in_a_graph_oc/,3,3,0,1,Moore’s and Eroom’s Law in a Graph OC,2016-10-0229.jpg,none,none
One Hundred Years of Solitude: how I analyzed my favorite book [OC],dozzinale,2016-10-17 22:50:41,https://medium.com/@finalfire/one-hundred-years-of-solitude-how-i-analyzed-my-favorite-book-6c20456480c8#.l6ld4ijrn,https://www.reddit.com/r/dataisbeautiful/comments/580emg/one_hundred_years_of_solitude_how_i_analyzed_my/,9,9,0,4,One Hundred Years of Solitude how I analyzed my favorite book OC,2016-10-0231.jpg,none,"literature, analysis, books"
"In California, gun sale rates often correlate with gun suicide rates [OC]",Martinamisfan,2016-10-18 00:57:26,http://www.sacbee.com/site-services/databases/article108859192.html,https://www.reddit.com/r/dataisbeautiful/comments/5810y4/in_california_gun_sale_rates_often_correlate_with/,1,1,0,5,"In California, gun sale rates often correlate with gun suicide rates OC",2016-10-0232.jpg,none,"guns, sales, suicide, california, correlation"
The Financial Times's visual vocabulary [pdf],tumbleweedrolls,2016-10-18 05:15:51,https://github.com/ft-interactive/chart-doctor/blob/master/visual-vocabulary/Visual-vocabulary.pdf,https://www.reddit.com/r/dataisbeautiful/comments/5825ey/the_financial_timess_visual_vocabulary_pdf/,3,3,0,0,The Financial Times's visual vocabulary pdf,2016-10-0234.jpg,none,none
"$sweethome - Rents, taxes, insurance: How far are you willing to go to save money? [OC]",ikarius3,2016-10-18 17:26:43,http://rts.ch/sweethome/,https://www.reddit.com/r/dataisbeautiful/comments/5852m0/sweethome_rents_taxes_insurance_how_far_are_you/,8,8,0,1,"$sweethome - Rents, taxes, insurance How far are you willing to go to save money OC",2016-10-0242.jpg,none,"housing, finance, savings, living costs"
Stocks rise as the dollar falls,heallikewolverine,2016-10-18 18:34:42,http://www.bloomberg.com/news/articles/2016-10-17/japan-stock-futures-track-u-s-declines-on-yen-while-kiwi-climbs,https://www.reddit.com/r/dataisbeautiful/comments/585h55/stocks_rise_as_the_dollar_falls/,3,3,0,0,Stocks rise as the dollar falls,2016-10-0243.jpg,none,"finance, economy, currency, stock market"
