title,author,created_date,url,full_permalink,score,ups,downs,num_comments,sanitized_title,image_file,chart_type,high_level_categories
salaries of record label execs (from assistants to CEOs),yungcheesy,2016-09-14 08:04:35,http://www.billboard.com/articles/business/6605624/record-label-salaries-music-industry,https://www.reddit.com/r/dataisbeautiful/comments/52pgt5/salaries_of_record_label_execs_from_assistants_to/,6,6,0,1,salaries of record label execs (from assistants to CEOs),2016-09-0181.jpg,none,"music industry, salaries, business, executives"
The Deadliest Animal in the World,zonination,2016-09-14 13:30:53,https://www.gatesnotes.com/Health/Most-Lethal-Animal-Mosquito-Week,https://www.reddit.com/r/dataisbeautiful/comments/52qh4f/the_deadliest_animal_in_the_world/,3406,3406,0,509,The Deadliest Animal in the World,2016-09-0183.jpg,none,"animals, insects, health, nature"
U.S. Map - Where Syrian refugees have settled,reporterjen,2016-09-14 14:16:36,http://www.pewtrusts.org/en/research-and-analysis/blogs/stateline/2016/09/14/despite-governors-protests-syrian-refugees-settle-across-the-us,https://www.reddit.com/r/dataisbeautiful/comments/52qokv/us_map_where_syrian_refugees_have_settled/,4,4,0,1,U.S. Map - Where Syrian refugees have settled,2016-09-0184.jpg,none,"refugee settlement, immigration, syria, u.s., demographics"
[OC] Experiment about acoustical imaging for our study. Turning the input data into an image of our object (a ukulele).,arcusaeterna,2016-09-14 21:38:52,https://www.reddit.com/r/dataisbeautiful/comments/52sweq/oc_experiment_about_acoustical_imaging_for_our/,https://www.reddit.com/r/dataisbeautiful/comments/52sweq/oc_experiment_about_acoustical_imaging_for_our/,16,16,0,4,OC Experiment about acoustical imaging for our study. Turning the input data into an image of our object (a ukulele).,2016-09-0191.jpg,none,"acoustics, imaging, experiments, music, ukulele"
[OC] Microplastics in our Nation's Waterways,lakranen,2016-09-15 16:27:08,https://owi.usgs.gov/vizlab/microplastics/,https://www.reddit.com/r/dataisbeautiful/comments/52wzzb/oc_microplastics_in_our_nations_waterways/,22,22,0,3,OC Microplastics in our Nation's Waterways,2016-09-0204.jpg,none,"microplastics, water pollution, environment, waterways"
Imgur Survey - First 2000 Responses [OC],smileytechguy,2016-09-16 01:53:10,http://imgur.com/gallery/RNPsv/,https://www.reddit.com/r/dataisbeautiful/comments/52zoxl/imgur_survey_first_2000_responses_oc/,3,3,0,2,Imgur Survey - First 2000 Responses OC,2016-09-0212.jpg,none,none
U.S. Death rate by age group.,NotHardcore,2016-09-16 03:01:23,http://www.data360.org/dsg.aspx?Data_Set_Group_Id=587,https://www.reddit.com/r/dataisbeautiful/comments/52zynj/us_death_rate_by_age_group/,23,23,0,6,U.S. Death rate by age group.,2016-09-0213.jpg,none,none
Terrorist attacks: Europe’s summer of violence in a global/historical context,whymesobad,2016-09-16 11:46:57,https://www.theguardian.com/world/2016/jul/28/there-is-less-of-a-terrorism-threat-now-experts-put-europes-summer-of-violence-in-context?CMP=share_btn_tw,https://www.reddit.com/r/dataisbeautiful/comments/531he0/terrorist_attacks_europes_summer_of_violence_in_a/,4,4,0,1,Terrorist attacks Europe’s summer of violence in a globalhistorical context,2016-09-0217.jpg,none,"terrorism, europe, violence, global context, historical context"
Here's a list of the avg. net speeds of countries.,curiousmallu,2016-09-16 17:24:40,https://en.wikipedia.org/wiki/List_of_countries_by_Internet_connection_speeds,https://www.reddit.com/r/dataisbeautiful/comments/5330xg/heres_a_list_of_the_avg_net_speeds_of_countries/,5,5,0,2,Here's a list of the avg. net speeds of countries.,2016-09-0222.jpg,none,none
Killing Season Chicago: a data driven installation of photographs from the 172 homicides in the City of Chicago between Memorial Day and Labor Day in the summer of 2010.,jasonfortheworld,2016-09-16 20:57:17,http://killingseasonchicago.com,https://www.reddit.com/r/dataisbeautiful/comments/5342sa/killing_season_chicago_a_data_driven_installation/,3,3,0,0,Killing Season Chicago a data driven installation of photographs from the 172 homicides in the City of Chicago between Memorial Day and Labor Day in t,2016-09-0226.jpg,none,"crime, chicago, homicides, photography, data visualization, summer 2010"
"All of the world's physical currency, gold, silver, and bitcoin is worth $12.7 trillion. The size of the national debt is nearly $20 trillion.",jfranzen939393,2016-09-17 18:27:40,http://www.visualcapitalist.com/visualizing-size-u-s-national-debt/,https://www.reddit.com/r/dataisbeautiful/comments/538g77/all_of_the_worlds_physical_currency_gold_silver/,4156,4156,0,2657,"All of the world's physical currency, gold, silver, and bitcoin is worth $12.7 trillion. The size of the national debt is nearly $20 trillion.",2016-09-0228.jpg,none,"economics, finance, national debt, currency, gold, bitcoin, u.s. government"
Video: A Day In The Life Of TriMet [OC] Data Source: Portland Trimet GTFS bus and lightrail data feed. Tools: DB4IoT,eimarboesjes,2016-09-18 00:34:36,http://db4iot.com/2016/09/a-day-in-the-life-of-trimet/,https://www.reddit.com/r/dataisbeautiful/comments/539z43/video_a_day_in_the_life_of_trimet_oc_data_source/,2,2,0,1,Video A Day In The Life Of TriMet OC Data Source Portland Trimet GTFS bus and lightrail data feed. Tools DB4IoT,2016-09-0231.jpg,none,"transportation, public transit, portland, oregon, bus, light rail, commuter rail, gtfs data"
Neural Network Zoo: Maps and descriptions of different types of networks,number3arm,2016-09-18 06:32:08,http://www.asimovinstitute.org/neural-network-zoo/,https://www.reddit.com/r/dataisbeautiful/comments/53b4fs/neural_network_zoo_maps_and_descriptions_of/,18,18,0,0,Neural Network Zoo Maps and descriptions of different types of networks,2016-09-0233.jpg,none,none
Typhoon in Taiwan right now,saddat,2016-09-18 09:35:23,https://www.ventusky.com/?p=27.8;123.9;4&l=wind/850hpa,https://www.reddit.com/r/dataisbeautiful/comments/53bj2a/typhoon_in_taiwan_right_now/,53,53,0,2,Typhoon in Taiwan right now,2016-09-0235.jpg,none,"weather, typhoon, taiwan, geography"
Journey to the Centre of the Earth,le_Maitre,2016-09-19 13:27:17,http://www.bbc.com/future/bespoke/story/20150306-journey-to-the-centre-of-earth/,https://www.reddit.com/r/dataisbeautiful/comments/53hj5a/journey_to_the_centre_of_the_earth/,1179,1179,0,62,Journey to the Centre of the Earth,2016-09-0251.jpg,none,"exploration, earth, geology, travel"
What hiring managers really think of your tattoos,The_Golden_Fang,2016-09-19 15:35:44,http://www.businessinsider.com/what-hiring-managers-think-of-your-tattoos-2016-9,https://www.reddit.com/r/dataisbeautiful/comments/53i4su/what_hiring_managers_really_think_of_your_tattoos/,4,4,0,11,What hiring managers really think of your tattoos,2016-09-0252.jpg,none,none
"What each state's veteran population looks like, in 10 maps",lallapalalable,2016-09-19 16:07:59,https://www.washingtonpost.com/blogs/govbeat/wp/2014/11/11/what-each-states-veteran-population-looks-like-in-10-maps/,https://www.reddit.com/r/dataisbeautiful/comments/53iao3/what_each_states_veteran_population_looks_like_in/,1,1,0,0,"What each state's veteran population looks like, in 10 maps",2016-09-0253.jpg,none,"veterans, demographics, united states, population"
"Lobbyist Donors to Presidential Candidates, 2016 Cycle",uswhole,2016-09-19 19:19:34,https://www.opensecrets.org/pres16/lobby.php,https://www.reddit.com/r/dataisbeautiful/comments/53j9vs/lobbyist_donors_to_presidential_candidates_2016/,13,13,0,4,"Lobbyist Donors to Presidential Candidates, 2016 Cycle",2016-09-0256.jpg,none,none
Highest resolution map of the entire human brain to date,sataky,2016-09-19 21:03:57,http://onlinelibrary.wiley.com/doi/10.1002/cne.24080/full,https://www.reddit.com/r/dataisbeautiful/comments/53jt1g/highest_resolution_map_of_the_entire_human_brain/,19,19,0,1,Highest resolution map of the entire human brain to date,2016-09-0258.jpg,none,"neuroscience, brain mapping, human brain, imagery, high resolution, anatomy"
"Here's where and when drunk driving accidents occur in Sacramento, CA [OC]",Martinamisfan,2016-09-20 04:08:10,http://www.sacbee.com/site-services/databases/article102237152.html,https://www.reddit.com/r/dataisbeautiful/comments/53lnkf/heres_where_and_when_drunk_driving_accidents/,5,5,0,2,"Here's where and when drunk driving accidents occur in Sacramento, CA OC",2016-09-0262.jpg,none,none
"When a pharmaceutical industry author contributed to a systematic review about the efficacy of a drug, the review is 22 time less likely to make a negative statement about the drug",azneo,2016-09-20 11:31:08,http://qz.com/784615/the-man-who-made-scientists-question-themselves-has-just-exposed-huge-flaws-in-evidence-used-to-give-drug-prescriptions/,https://www.reddit.com/r/dataisbeautiful/comments/53mwcv/when_a_pharmaceutical_industry_author_contributed/,988,988,0,33,"When a pharmaceutical industry author contributed to a systematic review about the efficacy of a drug, the review is 22 time less likely to make a neg",2016-09-0264.jpg,none,none
Every billion-dollar weather disaster in the U.S. since 1980 - Katrina cost the most,zonination,2016-09-20 13:03:46,https://www.washingtonpost.com/graphics/national/billion-dollar-disasters/,https://www.reddit.com/r/dataisbeautiful/comments/53n8p2/every_billiondollar_weather_disaster_in_the_us/,1483,1483,0,119,Every billion-dollar weather disaster in the U.S. since 1980 - Katrina cost the most,2016-09-0266.jpg,none,"weather, disasters, economics"
Interactive: voter registration rates by state,rwescott,2016-09-20 14:20:18,http://www.pewtrusts.org/en/research-and-analysis/blogs/stateline/2016/09/20/a-simple-potent-overhaul-for-motor-voter,https://www.reddit.com/r/dataisbeautiful/comments/53nkm3/interactive_voter_registration_rates_by_state/,0,0,0,0,Interactive voter registration rates by state,2016-09-0269.jpg,none,"politics, elections, voter registration"
Trouble Brewing? Brewer and Wholesaler Laws Restrict Craft Breweries,megsee3,2016-09-20 18:27:58,http://mercatus.org/publication/trouble-brewing-brewer-and-wholesaler-laws-restrict-craft-breweries,https://www.reddit.com/r/dataisbeautiful/comments/53otn3/trouble_brewing_brewer_and_wholesaler_laws/,3,3,0,0,Trouble Brewing Brewer and Wholesaler Laws Restrict Craft Breweries,2016-09-0273.jpg,none,"brewing, laws, craft breweries, regulations"
Global Price and Salary Comparison App [OC],4jerzy,2016-09-20 21:34:46,https://public.tableau.com/views/ComparePricesEverywhere/Dashboard1?:embed=y&:display_count=yes,https://www.reddit.com/r/dataisbeautiful/comments/53ps0w/global_price_and_salary_comparison_app_oc/,9,9,0,4,Global Price and Salary Comparison App OC,2016-09-0275.jpg,none,"globalization, economics, salary, cost of living, cities, comparison"
Young baseball players are more likely to wear flat-brimmed caps [OC],antiskocz,2016-09-21 00:35:04,https://vizthis.wordpress.com/2016/09/21/are-young-baseball-players-more-likely-to-wear-flat-brimmed-caps/,https://www.reddit.com/r/dataisbeautiful/comments/53qkzx/young_baseball_players_are_more_likely_to_wear/,4,4,0,5,Young baseball players are more likely to wear flat-brimmed caps OC,2016-09-0277.jpg,none,"baseball, sports, art"
Power of political coaltions (Aussie edition) [OC],liquidGhoul,2016-09-21 02:15:16,https://www.youtube.com/watch?v=t6D1vIdqtkM,https://www.reddit.com/r/dataisbeautiful/comments/53qzv1/power_of_political_coaltions_aussie_edition_oc/,4,4,0,1,Power of political coaltions (Aussie edition) OC,2016-09-0278.jpg,none,"politics, australia, coalitions"
"Twitch Streamer made a poll, 1,3k votes it was 62% vs 38%, and over 1,2k votes later... it's 62% vs 38%. Has anybody any bigger examples of this phenomenon?",portal23,2016-09-21 11:32:14,https://clips.twitch.tv/reckful/JoyousHerdKreygasm,https://www.reddit.com/r/dataisbeautiful/comments/53sow5/twitch_streamer_made_a_poll_13k_votes_it_was_62/,5,5,0,3,"Twitch Streamer made a poll, 1,3k votes it was 62% vs 38%, and over 1,2k votes later... it's 62% vs 38%. Has anybody any bigger examples of this pheno",2016-09-0280.jpg,none,"social media, twitch, polls, voting"
Area required for any number of houses or peoples in one place(google map) [OC],lesh1j,2016-09-21 19:14:32,http://mapinnumbers.com/whatarea/,https://www.reddit.com/r/dataisbeautiful/comments/53uvda/area_required_for_any_number_of_houses_or_peoples/,1,1,0,1,Area required for any number of houses or peoples in one place(google map) OC,2016-09-0287.jpg,none,none
Plethora of breakdowns for the incoming class of a top-5 university,NincomDongle,2016-09-22 04:34:16,https://www.chicagomaroon.com/article/2016/9/14/class-2020-survey/,https://www.reddit.com/r/dataisbeautiful/comments/53xcuc/plethora_of_breakdowns_for_the_incoming_class_of/,3,3,0,1,Plethora of breakdowns for the incoming class of a top-5 university,2016-09-0292.jpg,none,"university, education, ceremony"
Are Republicans or Democrats More Likely to Go Solar?,jimrosenz,2016-09-22 10:39:21,https://priceonomics.com/are-republicans-or-democrats-more-likely-to-go/,https://www.reddit.com/r/dataisbeautiful/comments/53yc6i/are_republicans_or_democrats_more_likely_to_go/,14,14,0,14,Are Republicans or Democrats More Likely to Go Solar,2016-09-0293.jpg,none,none
Ph.D. student identifies 10 dimensions of burrito perfection,rickywhy,2016-09-22 17:16:38,http://www.sandiegouniontribune.com/news/data-watch/sd-me-burrito-dimentions-20160922-story.html,https://www.reddit.com/r/dataisbeautiful/comments/5401p3/phd_student_identifies_10_dimensions_of_burrito/,1,1,0,2,Ph.D. student identifies 10 dimensions of burrito perfection,2016-09-0303.jpg,none,"burrito, food, analysis"
Islamic State and the crisis in Iraq and Syria in maps - BBC News,F8Tempter,2016-09-22 18:58:43,http://www.bbc.com/news/world-middle-east-27838034,https://www.reddit.com/r/dataisbeautiful/comments/540kxt/islamic_state_and_the_crisis_in_iraq_and_syria_in/,9,9,0,2,Islamic State and the crisis in Iraq and Syria in maps - BBC News,2016-09-0306.jpg,none,none
What Is Shakespeare's Most Popular Play?,jimrosenz,2016-09-22 23:49:17,https://priceonomics.com/what-is-shakespeares-most-popular-play/,https://www.reddit.com/r/dataisbeautiful/comments/541yvg/what_is_shakespeares_most_popular_play/,0,0,0,4,What Is Shakespeare's Most Popular Play,2016-09-0308.jpg,none,"literature, shakespeare, plays, theater"
Everybody Thinks They are Middle-Class,Kantor48,2016-09-24 15:08:46,https://www.bloomberg.com/features/2016-america-divided/middle-class/,https://www.reddit.com/r/dataisbeautiful/comments/54ahqj/everybody_thinks_they_are_middleclass/,5398,5398,0,3097,Everybody Thinks They are Middle-Class,2016-09-0322.jpg,none,"economics, society, class, perception"
"Visualizing the State of the Union, 1993-2016 [OC]",nickb500,2016-09-24 19:21:20,https://beckernick.github.io/sotu/,https://www.reddit.com/r/dataisbeautiful/comments/54blvr/visualizing_the_state_of_the_union_19932016_oc/,3,3,0,2,"Visualizing the State of the Union, 1993-2016 OC",2016-09-0325.jpg,none,"politics, government, speech, state of the union"
What if Everyone Lived in Just One City? - RealLifeLore,madiemoxie,2016-09-25 00:55:24,https://www.youtube.com/watch?v=r_iNRGac_uM,https://www.reddit.com/r/dataisbeautiful/comments/54czho/what_if_everyone_lived_in_just_one_city/,29,29,0,4,What if Everyone Lived in Just One City - RealLifeLore,2016-09-0327.jpg,none,"population, urbanization, cities, geography, demographics"
Two 8192 bit prime numbers represented in a visual format [OC],levidurfee,2016-09-25 06:36:41,https://cdn.levi.lol/i/B3sMKw.png,https://www.reddit.com/r/dataisbeautiful/comments/54e2mz/two_8192_bit_prime_numbers_represented_in_a/,6,6,0,5,Two 8192 bit prime numbers represented in a visual format OC,2016-09-0331.png,none,"mathematics, prime numbers, data visualization"
Tracking the temperature of my room [OC],akaryocyte,2016-09-26 15:54:51,https://github.com/daniel-wells/temperature-tracker,https://www.reddit.com/r/dataisbeautiful/comments/54l9p5/tracking_the_temperature_of_my_room_oc/,11,11,0,3,Tracking the temperature of my room OC,2016-09-0341.jpg,none,none
Visualizing Global Mapillary Connections,dharmabum28,2016-09-27 04:24:16,http://blog.mapillary.com/update/2016/09/25/visualizing-global-mapillary-connections.html,https://www.reddit.com/r/dataisbeautiful/comments/54ox8g/visualizing_global_mapillary_connections/,5,5,0,0,Visualizing Global Mapillary Connections,2016-09-0346.jpg,none,"global, connections, mapping, technology"
How lynxes move in their natural habitat (visualized data from radio telemetry),vobango,2016-09-27 05:44:49,https://youtu.be/6TBSPtEfXN8,https://www.reddit.com/r/dataisbeautiful/comments/54p6z6/how_lynxes_move_in_their_natural_habitat/,136,136,0,12,How lynxes move in their natural habitat (visualized data from radio telemetry),2016-09-0347.jpg,none,"wildlife, lynxes, habitat, movement, ecology"
Apartment Upgrade —How Much Does an Extra Room Cost?,uflorin,2016-09-27 13:20:08,http://www.rentcafe.com/blog/rental-market/apartment-upgrade-how-much-does-an-extra-room-cost/,https://www.reddit.com/r/dataisbeautiful/comments/54qiuq/apartment_upgrade_how_much_does_an_extra_room_cost/,4,4,0,0,Apartment Upgrade —How Much Does an Extra Room Cost,2016-09-0348.jpg,none,"real estate, housing, interior design"
[Meta] /r/dataisbeautiful made the SHORTLIST for the Information is Beautiful Awards!,zonination,2016-09-27 14:08:50,https://www.reddit.com/r/dataisbeautiful/comments/54qqcr/meta_rdataisbeautiful_made_the_shortlist_for_the/,https://www.reddit.com/r/dataisbeautiful/comments/54qqcr/meta_rdataisbeautiful_made_the_shortlist_for_the/,70,70,0,4,Meta rdataisbeautiful made the SHORTLIST for the Information is Beautiful Awards!,2016-09-0349.jpg,none,"data visualization, awards, design, creativity"
The comparison between American Jews and Israeli Jews: Surveys show similarities and vast differences in the way they both live.,EnergyBus,2016-09-27 20:42:24,http://www.pewforum.org/2016/09/27/american-and-israeli-jews-twin-portraits-from-pew-research-center-surveys/,https://www.reddit.com/r/dataisbeautiful/comments/54spky/the_comparison_between_american_jews_and_israeli/,40,40,0,4,The comparison between American Jews and Israeli Jews Surveys show similarities and vast differences in the way they both live.,2016-09-0353.jpg,none,"religion, culture, demographics, surveys"
"Every Hindi film song by Lata Mangeshkar, in one graphic [OC]",gurmanbh,2016-09-28 08:29:26,http://www.hindustantimes.com/static/lata-mangeshkar-every-hindi-film-song-one-graphic/,https://www.reddit.com/r/dataisbeautiful/comments/54vdui/every_hindi_film_song_by_lata_mangeshkar_in_one/,19,19,0,7,"Every Hindi film song by Lata Mangeshkar, in one graphic OC",2016-09-0357.jpg,none,none
The Difference Between Boomers and Everyone Else; IMDB Data Visualization,bananainacup,2016-09-28 13:23:25,https://oneroomwithaview.com/2016/09/28/three-things-imdb-confirms-millennials/,https://www.reddit.com/r/dataisbeautiful/comments/54waka/the_difference_between_boomers_and_everyone_else/,21,21,0,14,The Difference Between Boomers and Everyone Else; IMDB Data Visualization,2016-09-0359.jpg,none,none
"MAP: State by state, how income growth is outpacing GPD",reporterjen,2016-09-28 17:54:56,http://www.pewtrusts.org/en/research-and-analysis/blogs/stateline/2016/09/17/in-49-states-income-boost-outpaces-economic-growth,https://www.reddit.com/r/dataisbeautiful/comments/54xn2z/map_state_by_state_how_income_growth_is_outpacing/,6,6,0,1,"MAP State by state, how income growth is outpacing GPD",2016-09-0362.jpg,none,"logistics, transportation, shipping"
Visualization of Data-Backed Methods for Local Weather Prediction [OC],akumpf,2016-09-28 18:10:15,http://makefastworkshop.com/hacks/?p=20160928&z=1,https://www.reddit.com/r/dataisbeautiful/comments/54xpzk/visualization_of_databacked_methods_for_local/,2,2,0,2,Visualization of Data-Backed Methods for Local Weather Prediction OC,2016-09-0364.jpg,none,"weather, photography"
Announcing YouTube-8M: A Large and Diverse Labeled Video Dataset for Video Understanding Research,pyronautical,2016-09-28 20:27:12,https://research.googleblog.com/2016/09/announcing-youtube-8m-large-and-diverse.html,https://www.reddit.com/r/dataisbeautiful/comments/54yfw4/announcing_youtube8m_a_large_and_diverse_labeled/,8,8,0,1,Announcing YouTube-8M A Large and Diverse Labeled Video Dataset for Video Understanding Research,2016-09-0366.jpg,none,"video, datasets, research, machine learning, youtube, data analysis"
How the Military Became the Country's Largest Employer of Transgender Americans,jimrosenz,2016-09-28 23:48:38,https://priceonomics.com/how-the-military-became-the-countrys-largest/,https://www.reddit.com/r/dataisbeautiful/comments/54zeme/how_the_military_became_the_countrys_largest/,11,11,0,0,How the Military Became the Country's Largest Employer of Transgender Americans,2016-09-0368.jpg,none,none
"While Amazon Prime has more titles than Netflix or Hulu, Netflix has 15,000 more hours of viewable content",amccaleb,2016-09-28 23:54:43,http://www.cablefax.com/screenster/amazon-netflix-hulu-a-closer-look-at-offerings,https://www.reddit.com/r/dataisbeautiful/comments/54zfjb/while_amazon_prime_has_more_titles_than_netflix/,81,81,0,13,"While Amazon Prime has more titles than Netflix or Hulu, Netflix has 15,000 more hours of viewable content",2016-09-0369.jpg,none,"streaming services, amazon prime, netflix, hulu, entertainment, media consumption"
National Women's Soccer League Defensive Play[OC],kryptobanana,2016-09-29 08:27:59,https://medium.com/@nikitataparia/nwsl-defensive-play-fc3aa16f4db1#.srd94hacb,https://www.reddit.com/r/dataisbeautiful/comments/5517n1/national_womens_soccer_league_defensive_playoc/,8,8,0,1,National Women's Soccer League Defensive PlayOC,2016-09-0372.jpg,none,"sports, soccer, women's sports, national women's soccer league"
Which Countries Best Fit Your Values?,lapivan,2016-09-29 13:58:40,http://worldvalues.knoema.com/,https://www.reddit.com/r/dataisbeautiful/comments/552abh/which_countries_best_fit_your_values/,0,0,0,6,Which Countries Best Fit Your Values,2016-09-0376.jpg,none,"values, countries, culture, society"
AutoDC - Quickly create Dc.js dashboard prototypes from raw csv data. [OC],Weatherproof26,2016-09-29 14:06:24,https://www.reddit.com/r/dataisbeautiful/comments/552bka/autodc_quickly_create_dcjs_dashboard_prototypes/,https://www.reddit.com/r/dataisbeautiful/comments/552bka/autodc_quickly_create_dcjs_dashboard_prototypes/,5,5,0,0,AutoDC - Quickly create Dc.js dashboard prototypes from raw csv data. OC,2016-09-0377.jpg,none,"data visualization, dashboards, csv, automation"
"500,000 People Asked for Online Recommendations Since January 2016 [OC]",kubaB24,2016-09-29 14:58:06,http://blog.brand24.com/500-000-people-asked-for-online-recommendations-since-january-2016/,https://www.reddit.com/r/dataisbeautiful/comments/552k7s/500000_people_asked_for_online_recommendations/,8,8,0,3,"500,000 People Asked for Online Recommendations Since January 2016 OC",2016-09-0378.jpg,none,none
We mechanized a Donald Trump wig to reflect Trump's polling data in real time! [OC],dangb523,2016-09-29 16:35:55,http://huuge.ist/,https://www.reddit.com/r/dataisbeautiful/comments/5531yb/we_mechanized_a_donald_trump_wig_to_reflect/,3,3,0,1,We mechanized a Donald Trump wig to reflect Trump's polling data in real time! OC,2016-09-0379.jpg,none,none
"Approximate length of daylight, in hours, as a function of latitude and time of year",eaglessoar,2016-09-29 20:21:09,https://en.wikipedia.org/wiki/Twilight#/media/File:Daylight_Length.svg,https://www.reddit.com/r/dataisbeautiful/comments/55482o/approximate_length_of_daylight_in_hours_as_a/,8,8,0,0,"Approximate length of daylight, in hours, as a function of latitude and time of year",2016-09-0389.jpg,none,none
Process of creating an interactive watershed topology explorer,saint_glo,2016-09-30 03:14:43,https://www.youtube.com/watch?v=C4z-uSMhvVM,https://www.reddit.com/r/dataisbeautiful/comments/556175/process_of_creating_an_interactive_watershed/,7,7,0,1,Process of creating an interactive watershed topology explorer,2016-09-0392.jpg,none,none
Minutes of minimum-wage work required to buy a Big Mac around the world,portajohnjackoff,2016-09-30 12:09:42,http://blog.businesstripfriend.com/article/how-long-do-you-need-to-work-to-buy-the-big-mac,https://www.reddit.com/r/dataisbeautiful/comments/557l3c/minutes_of_minimumwage_work_required_to_buy_a_big/,38,38,0,7,Minutes of minimum-wage work required to buy a Big Mac around the world,2016-09-0395.jpg,none,none
The Seven Types of Global Cities - Brookings Institution,Confuzzled11820,2016-09-30 21:37:13,https://www.brookings.edu/research/redefining-global-cities/?utm_campaign=Metropolitan+Policy+Program&utm_source=hs_email&utm_medium=email&utm_content=35151846,https://www.reddit.com/r/dataisbeautiful/comments/55a7x5/the_seven_types_of_global_cities_brookings/,19,19,0,1,The Seven Types of Global Cities - Brookings Institution,2016-09-0398.jpg,none,none
The most educated women are the most likely to be married,jimrosenz,2016-09-30 23:55:45,https://www.brookings.edu/blog/social-mobility-memos/2016/08/19/the-most-educated-women-are-the-most-likely-to-be-married/,https://www.reddit.com/r/dataisbeautiful/comments/55at4q/the_most_educated_women_are_the_most_likely_to_be/,17,17,0,7,The most educated women are the most likely to be married,2016-09-0401.jpg,none,none
