title,author,created_date,url,full_permalink,score,ups,downs,num_comments,sanitized_title,image_file,chart_type,high_level_categories
AFC Wild Card Chances,macbeezy_,2018-01-01 01:35:40,https://twitter.com/bburkeespn/status/947638407462875136,https://www.reddit.com/r/dataisbeautiful/comments/7ncfup/afc_wild_card_chances/,1,1,,0,AFC Wild Card Chances,2018-01-0001.jpg,none,"sports, football, analytics"
I kept track of all my poops in 2017 [OC],3gcb,2018-01-01 15:32:25,https://imgur.com/gallery/ZQWDc,https://www.reddit.com/r/dataisbeautiful/comments/7nfnep/i_kept_track_of_all_my_poops_in_2017_oc/,3508,3508,,511,I kept track of all my poops in 2017 OC,2018-01-0012.jpg,none,none
Improved Technique for Predicting NBA Season Win%,pablote3,2018-01-01 19:07:59,https://www.kaggle.com/pablote/improved-technique-for-predicting-season-win,https://www.reddit.com/r/dataisbeautiful/comments/7ngvv0/improved_technique_for_predicting_nba_season_win/,1,1,,0,Improved Technique for Predicting NBA Season Win%,2018-01-0020.jpg,none,none
Which Black Mirror S4 episode is most disturbing? [OC],GemmaJ123,2018-01-02 15:11:55,https://www.brandwatch.com/blog/react-black-mirror-season-4/?utm_source=reddit&utm_medium=react&utm_term=blog&utm_campaign=01_2018_entertainment_blog,https://www.reddit.com/r/dataisbeautiful/comments/7nmyps/which_black_mirror_s4_episode_is_most_disturbing/,44,44,,14,Which Black Mirror S4 episode is most disturbing OC,2018-01-0041.jpg,none,none
"City Space Allocation in Amsterdam between Cars, Bikes and Rails",eMerzh,2018-01-22 07:36:07,https://whatthestreet.moovellab.com/amsterdam/explore/car?bike=0.19&rail=0.19&car=0.62,https://www.reddit.com/r/dataisbeautiful/comments/7s48ba/city_space_allocation_in_amsterdam_between_cars/,6,6,,1,"City Space Allocation in Amsterdam between Cars, Bikes and Rails",2018-01-0451.jpg,none,none
"They’re Waiting Longer, but U.S. Women Today More Likely to Have Children Than a Decade Ago",jimrosenz,2018-01-22 12:15:22,http://www.pewsocialtrends.org/2018/01/18/theyre-waiting-longer-but-u-s-women-today-more-likely-to-have-children-than-a-decade-ago/?utm_content=bufferd8cfc&utm_medium=social&utm_source=twitter.com&utm_campaign=buffer,https://www.reddit.com/r/dataisbeautiful/comments/7s5d7k/theyre_waiting_longer_but_us_women_today_more/,11,11,,0,"They’re Waiting Longer, but U.S. Women Today More Likely to Have Children Than a Decade Ago",2018-01-0454.jpg,none,"demographics, family, society, women"
Accessibility fireworks — Topi Tjukanov,Xoubuo,2018-01-22 17:35:29,https://tjukanov.org/accessibility-fireworks/,https://www.reddit.com/r/dataisbeautiful/comments/7s7dxe/accessibility_fireworks_topi_tjukanov/,2,2,,3,Accessibility fireworks — Topi Tjukanov,2018-01-0458.jpg,none,"geography, maps, africa"
"Ski resorts with the most snow in NA, Europe [OC]",gemmerich,2018-01-22 20:36:53,https://medium.com/numbers-vs-numbers/in-search-of-powder-32341149b102,https://www.reddit.com/r/dataisbeautiful/comments/7s8rum/ski_resorts_with_the_most_snow_in_na_europe_oc/,4,4,,4,"Ski resorts with the most snow in NA, Europe OC",2018-01-0462.jpg,none,"skiing, travel, snow, resorts, north america, europe"
I’m not sure if this counts as a visualisation. It is a post I made for fun to /sex graphing 10 years of my sex life in various ways. Someone suggest I x-post it here. [OC],accidentalporncouple,2018-01-22 22:55:07,https://redd.it/7s78lh,https://www.reddit.com/r/dataisbeautiful/comments/7s9t0o/im_not_sure_if_this_counts_as_a_visualisation_it/,53,53,,6,I’m not sure if this counts as a visualisation. It is a post I made for fun to sex graphing 10 years of my sex life in various ways. Someone suggest I,2018-01-0463.jpg,none,none
Visualising the careers of musicians-turned-actors from Bing Crosby to Harry Styles.,FloridaFan24,2018-01-22 23:53:02,https://www.economist.com/blogs/prospero/2018/01/new-ensembles,https://www.reddit.com/r/dataisbeautiful/comments/7sa7fb/visualising_the_careers_of_musiciansturnedactors/,3,3,,0,Visualising the careers of musicians-turned-actors from Bing Crosby to Harry Styles.,2018-01-0465.jpg,none,none
2018 Developer Skills Report by HackerRank,daniel_k91,2018-01-23 14:39:37,https://research.hackerrank.com/developer-skills/2018/,https://www.reddit.com/r/dataisbeautiful/comments/7sesta/2018_developer_skills_report_by_hackerrank/,12,12,,2,2018 Developer Skills Report by HackerRank,2018-01-0474.jpg,none,"developer skills, survey, technology, 2018"
Walgreens Flu Index,thats_not_gravy,2018-01-23 21:16:17,https://walgreens.maps.arcgis.com/apps/MapSeries/index.html?appid=40d0763cd3cc42428b26f85202108469,https://www.reddit.com/r/dataisbeautiful/comments/7shsv2/walgreens_flu_index/,2,2,,1,Walgreens Flu Index,2018-01-0481.jpg,none,none
"The United States vs China, Naval Power Comparison",BraveJerling,2018-01-24 14:51:11,http://www.maritimeherald.com/2018/united-states-vs-china-naval-power-comparison/,https://www.reddit.com/r/dataisbeautiful/comments/7snkca/the_united_states_vs_china_naval_power_comparison/,0,0,,4,"The United States vs China, Naval Power Comparison",2018-01-0493.jpg,none,none
The Australian Broadcasting Corporation's visualisation of every road death in Australia since 1989.,nicolauda,2018-01-25 03:06:16,http://www.abc.net.au/news/2018-01-25/every-road-death-in-australia-since-1989/9353794?smid=Page:%20ABC-Facebook_Organic&WT.tsrc=Facebook_Organic&sf180193551=1,https://www.reddit.com/r/dataisbeautiful/comments/7st1yl/the_australian_broadcasting_corporations/,4,4,,1,The Australian Broadcasting Corporation's visualisation of every road death in Australia since 1989.,2018-01-0511.jpg,none,none
Trans-Pacific Partnership's benefits 'very small',jimrosenz,2018-01-25 09:41:52,https://www.theguardian.com/world/2018/jan/25/trans-pacific-partnerships-benefit-to-australia-very-small?CMP=Share_AndroidApp_reddit_is_fun,https://www.reddit.com/r/dataisbeautiful/comments/7sv14a/transpacific_partnerships_benefits_very_small/,15,15,,10,Trans-Pacific Partnership's benefits 'very small',2018-01-0512.jpg,none,"economics, trade, trans-pacific partnership"
The Atlas Of Redistricting,pianoboy8,2018-01-25 19:54:16,https://projects.fivethirtyeight.com/redistricting-maps/,https://www.reddit.com/r/dataisbeautiful/comments/7syt22/the_atlas_of_redistricting/,9,9,,2,The Atlas Of Redistricting,2018-01-0527.jpg,none,none
A Year of Trump Tweets by Popularity [OC],its_danielle,2018-01-25 23:18:03,https://www.teenvogue.com/story/trump-tweet-analysis,https://www.reddit.com/r/dataisbeautiful/comments/7t0b74/a_year_of_trump_tweets_by_popularity_oc/,5,5,,4,A Year of Trump Tweets by Popularity OC,2018-01-0532.jpg,none,none
The data here is layed out like a video game. The content is also very interesting.,nathan8823,2018-01-26 16:21:09,http://highline.huffingtonpost.com/articles/en/poor-millennials/,https://www.reddit.com/r/dataisbeautiful/comments/7t5lad/the_data_here_is_layed_out_like_a_video_game_the/,5,5,,0,The data here is layed out like a video game. The content is also very interesting.,2018-01-0547.jpg,none,"video game, graphics, art"
The top 18 imports and exports around the world and the countries that move each of them the most,OakFace,2018-01-26 16:51:00,https://www.teletracnavman.com/infographics/top-imports-exports,https://www.reddit.com/r/dataisbeautiful/comments/7t5t6y/the_top_18_imports_and_exports_around_the_world/,3,3,,2,The top 18 imports and exports around the world and the countries that move each of them the most,2018-01-0550.jpg,none,"trade, imports, exports, global economy, countries"
Do birds count as data?,jkell05s,2018-01-26 16:57:59,https://www.popchartlab.com/products/birds-of-north-america,https://www.reddit.com/r/dataisbeautiful/comments/7t5v1u/do_birds_count_as_data/,0,0,,2,Do birds count as data,2018-01-0552.jpg,none,"birds, wildlife, nature, biology, zoology"
Speed under sail during the early Industrial Revolution,jimrosenz,2018-01-28 00:04:07,https://voxeu.org/article/speed-under-sail-during-early-industrial-revolution?utm_source=dlvr.it&utm_medium=twitter,https://www.reddit.com/r/dataisbeautiful/comments/7tgoxp/speed_under_sail_during_the_early_industrial/,0,0,,0,Speed under sail during the early Industrial Revolution,2018-01-0573.jpg,none,"maritime history, sailing, industrial revolution"
"Global deaths in conflicts, since 1400",cutelyaware,2018-01-28 00:12:58,https://ourworldindata.org/war-and-peace,https://www.reddit.com/r/dataisbeautiful/comments/7tgqw3/global_deaths_in_conflicts_since_1400/,43,43,,23,"Global deaths in conflicts, since 1400",2018-01-0575.jpg,none,"war, peace, conflicts, global, history"
Humans sniff their own hands after handshake,night_of_knee,2018-01-28 09:59:02,https://elifesciences.org/articles/05154,https://www.reddit.com/r/dataisbeautiful/comments/7tjgkh/humans_sniff_their_own_hands_after_handshake/,27,27,,9,Humans sniff their own hands after handshake,2018-01-0580.jpg,none,none
"Patterns of Twitter accounts using purchased, fake social media followers (visualization by the NYT)",m4coupe,2018-01-28 13:34:02,https://www.nytimes.com/interactive/2018/01/27/technology/social-media-bots.html#interactive-00bots-flocks,https://www.reddit.com/r/dataisbeautiful/comments/7tk96j/patterns_of_twitter_accounts_using_purchased_fake/,171,171,,9,"Patterns of Twitter accounts using purchased, fake social media followers (visualization by the NYT)",2018-01-0582.jpg,none,none
"20 titles, 20 years: Roger Federer's success in number",fxnba1218,2018-01-28 16:11:01,https://interactive.swissinfo.ch/2018_01_28_federer20/en.html?utm_content=buffer0f11c&utm_medium=social&utm_source=twitter.com&utm_campaign=buffer#/en,https://www.reddit.com/r/dataisbeautiful/comments/7tl2zy/20_titles_20_years_roger_federers_success_in/,11,11,,1,"20 titles, 20 years Roger Federer's success in number",2018-01-0585.jpg,none,"tennis, sports, success, achievements"
Satellite image of Burning Man perimeter changes tracked over the past few years using fitness tracking software,Introvertigo_,2018-01-28 21:37:10,https://labs.strava.com/heatmap/#13.34/-119.20808/40.78585/hot/all,https://www.reddit.com/r/dataisbeautiful/comments/7tnbfo/satellite_image_of_burning_man_perimeter_changes/,2,2,,1,Satellite image of Burning Man perimeter changes tracked over the past few years using fitness tracking software,2018-01-0592.jpg,none,"satellite, burning man, perimeter, changes, fitness tracking, geospatial data"
"Italian elections 2018: the online debate on ""Euro-exit"" | Network map",alexd_ricci,2018-01-29 12:22:12,http://www.euvisions.eu/italian-elections-online/,https://www.reddit.com/r/dataisbeautiful/comments/7trxnp/italian_elections_2018_the_online_debate_on/,4,4,,0,Italian elections 2018 the online debate on Euro-exit Network map,2018-01-0603.jpg,none,none
"20 Years, 20 Titles — Roger Federer in data",Er4zor,2018-01-29 12:48:30,https://interactive.swissinfo.ch/2018_01_28_federer20/en.html,https://www.reddit.com/r/dataisbeautiful/comments/7ts2fs/20_years_20_titles_roger_federer_in_data/,28,28,,0,"20 Years, 20 Titles — Roger Federer in data",2018-01-0604.jpg,none,"tennis, sports, achievements, career, athletes"
Mapping the perfect U.S. winter Olympic city [OC],timmeko,2018-01-29 13:57:10,https://www.washingtonpost.com/graphics/2018/national/happy-700-american-pyeongchang/,https://www.reddit.com/r/dataisbeautiful/comments/7tsg2w/mapping_the_perfect_us_winter_olympic_city_oc/,25,25,,5,Mapping the perfect U.S. winter Olympic city OC,2018-01-0605.jpg,none,"geography, winter sports, usa, olympics"
"Quantity and distribution of jokes in Marvel Cinematic Universe movies, by George Hatzis",TrueLink00,2018-01-29 16:10:57,https://www.visu.info/marvel-cinematic-universe-joke-count/,https://www.reddit.com/r/dataisbeautiful/comments/7ttbno/quantity_and_distribution_of_jokes_in_marvel/,10,10,,1,"Quantity and distribution of jokes in Marvel Cinematic Universe movies, by George Hatzis",2018-01-0607.jpg,none,"marvel cinematic universe, movies, humor, entertainment"
USA National Gas Price Heat Map (Very Beautiful!),bicureyooz,2018-01-29 18:30:46,https://www.gasbuddy.com/GasPriceMap?z=4,https://www.reddit.com/r/dataisbeautiful/comments/7tudn9/usa_national_gas_price_heat_map_very_beautiful/,4,4,,4,USA National Gas Price Heat Map (Very Beautiful!),2018-01-0609.jpg,none,none
Shiny dashboard exploring library book popularity at Toronto Public Library,inkhorn82,2018-01-29 18:39:05,https://donorscience.ca/explore-library-book-popularity-using-a-dashboard-with-access-to-over-100k-books!,https://www.reddit.com/r/dataisbeautiful/comments/7tufyr/shiny_dashboard_exploring_library_book_popularity/,3,3,,0,Shiny dashboard exploring library book popularity at Toronto Public Library,2018-01-0610.jpg,none,"library, books, toronto, data analysis"
A century of trends in adult human height,jimrosenz,2018-01-29 23:55:55,https://elifesciences.org/articles/13410/figures,https://www.reddit.com/r/dataisbeautiful/comments/7twrt3/a_century_of_trends_in_adult_human_height/,5,5,,2,A century of trends in adult human height,2018-01-0616.jpg,none,none
Breaking down census factors to determine the Amazon HQ2 Winner,p4rty0nw4yne,2018-01-30 17:29:55,https://looker.com/blog/the-data-has-spoken-amazon-hq-city-should-be,https://www.reddit.com/r/dataisbeautiful/comments/7u2nwc/breaking_down_census_factors_to_determine_the/,6,6,,1,Breaking down census factors to determine the Amazon HQ2 Winner,2018-01-0626.jpg,none,"business, economy, demographics, corporate location, amazon"
U.S. millennials are now 44% minority and the largest generation at 75 million.,TerpsFan20036,2018-01-30 18:31:13,https://www.brookings.edu/research/millennials/,https://www.reddit.com/r/dataisbeautiful/comments/7u34os/us_millennials_are_now_44_minority_and_the/,143,143,,47,U.S. millennials are now 44% minority and the largest generation at 75 million.,2018-01-0627.jpg,none,"demographics, minorities, generations, population, u.s. millennials"
"I analyzed my college's meme page in order to see if there was a best time to post, how reactions changed with the topic, and more! [OC]",reader313,2018-01-31 20:17:10,http://columbia.edu/~zda2105,https://www.reddit.com/r/dataisbeautiful/comments/7ucvks/i_analyzed_my_colleges_meme_page_in_order_to_see/,2,2,,2,"I analyzed my college's meme page in order to see if there was a best time to post, how reactions changed with the topic, and more! OC",2018-01-0644.jpg,none,"memes, social media, analysis"
Moon topography using Earth colors [OC],SiggyF,2018-01-02 21:21:56,https://imgur.com/IxOuM96,https://www.reddit.com/r/dataisbeautiful/comments/7npijj/moon_topography_using_earth_colors_oc/,568,568,,10,Moon topography using Earth colors OC,2018-01-0050.jpg,none,"moon, topography, space, earth"
PUBG AR recoil patterns,MaDJaM_UK,2018-01-03 13:46:24,https://youtu.be/_i70Cg5RrR0?t=4m25s,https://www.reddit.com/r/dataisbeautiful/comments/7nuq5e/pubg_ar_recoil_patterns/,2,2,,0,PUBG AR recoil patterns,2018-01-0067.jpg,none,"gaming, pubg, weapons, guides"
I tracked my partner's and my orgasms for all of 2017 [OC],smutblr,2018-01-03 15:50:31,https://imgur.com/a/wJb0w,https://www.reddit.com/r/dataisbeautiful/comments/7nvgra/i_tracked_my_partners_and_my_orgasms_for_all_of/,83,83,,24,I tracked my partner's and my orgasms for all of 2017 OC,2018-01-0071.jpg,none,none
US fatal police shootings by threat level 2017 [OC],jimrosenz,2018-01-04 09:42:40,https://utopiayouarestandinginit.com/2018/01/01/us-fatal-police-shootings-by-threat-level-2017/,https://www.reddit.com/r/dataisbeautiful/comments/7o1yqg/us_fatal_police_shootings_by_threat_level_2017_oc/,7,7,,8,US fatal police shootings by threat level 2017 OC,2018-01-0090.jpg,none,none
2017 Sexual Activity Analysis - NSFW maybe [OC],Thisandthat6996,2018-01-04 16:08:07,https://imgur.com/a/gBR4a,https://www.reddit.com/r/dataisbeautiful/comments/7o3xts/2017_sexual_activity_analysis_nsfw_maybe_oc/,5,5,,8,2017 Sexual Activity Analysis - NSFW maybe OC,2018-01-0097.jpg,none,none
[US politics] Marijuana use among 12th graders in medical vs non medical states,toohigh4anal,2018-01-04 17:01:41,https://learnaboutsam.org/annual-survey-students-shows-marijuana-use-among-grades-8-10-virtually-substances-decreasing/,https://www.reddit.com/r/dataisbeautiful/comments/7o4bo1/us_politics_marijuana_use_among_12th_graders_in/,3,3,,12,US politics Marijuana use among 12th graders in medical vs non medical states,2018-01-0099.jpg,none,none
Holiday gun sales dip as Americans get their shopping done early,alexgabriel_i,2018-01-04 17:11:17,https://www.bloomberg.com/news/articles/2018-01-04/holiday-gun-sales-dip-as-americans-get-their-shopping-done-early?cmpid=socialflow-twitter-business&utm_content=business&utm_campaign=socialflow-organic&utm_source=twitter&utm_medium=social,https://www.reddit.com/r/dataisbeautiful/comments/7o4e6j/holiday_gun_sales_dip_as_americans_get_their/,1,1,,0,Holiday gun sales dip as Americans get their shopping done early,2018-01-0100.jpg,none,none
Congressional Partisanship: A Visualization – Towards Data Science [OC],kaumaron,2018-01-04 17:56:56,https://towardsdatascience.com/congressional-partisanship-a-visualization-c7bc448fd3e,https://www.reddit.com/r/dataisbeautiful/comments/7o4pui/congressional_partisanship_a_visualization/,4,4,,2,Congressional Partisanship A Visualization – Towards Data Science OC,2018-01-0104.jpg,none,"politics, congress, architecture"
Online Harassment: What Americans Consider Crossing the Line,jimrosenz,2018-01-05 00:09:57,http://www.pewinternet.org/2018/01/04/crossing-the-line-what-counts-as-online-harassment/,https://www.reddit.com/r/dataisbeautiful/comments/7o74xj/online_harassment_what_americans_consider/,2,2,,0,Online Harassment What Americans Consider Crossing the Line,2018-01-0112.jpg,none,"online harassment, internet, social media, behavior, ethics"
How World War I Changed Marriage Patterns in Europe,jimrosenz,2018-01-06 11:27:25,https://www.stlouisfed.org/on-the-economy/2015/march/how-world-war-i-changed-marriage-patterns-in-europe?utm_source=Twitter&utm_medium=SM&utm_term=communities&utm_content=oteblog&utm_campaign=4167_3,https://www.reddit.com/r/dataisbeautiful/comments/7oirj8/how_world_war_i_changed_marriage_patterns_in/,3,3,,0,How World War I Changed Marriage Patterns in Europe,2018-01-0136.jpg,none,none
"A look at the top /r/progresspics posts; gender ratio, average end weight, etc. [OC]",DressedUpNowhere2Go,2018-01-07 16:17:34,https://smoothiegains.com/information-about-the-tops-r-progresspics-posts/,https://www.reddit.com/r/dataisbeautiful/comments/7orfht/a_look_at_the_top_rprogresspics_posts_gender/,7,7,,3,"A look at the top rprogresspics posts; gender ratio, average end weight, etc. OC",2018-01-0159.jpg,none,none
"Frequency of Transit Routes in Helsinki, Finland [OC]",hezec,2018-01-07 22:04:56,https://i.imgur.com/mr3sgMO.png,https://www.reddit.com/r/dataisbeautiful/comments/7otqf7/frequency_of_transit_routes_in_helsinki_finland_oc/,40,40,,3,"Frequency of Transit Routes in Helsinki, Finland OC",2018-01-0163.png,none,"transportation, transit, helsinki, finland, routes"
Searches of international travelers' electronic devices up by nearly 60 percent,pcharged,2018-01-08 15:48:18,https://channels.cc/c/9612c0b6-1623-43b7-8f29-739d841c2fc1,https://www.reddit.com/r/dataisbeautiful/comments/7ozcjr/searches_of_international_travelers_electronic/,87,87,,2,Searches of international travelers' electronic devices up by nearly 60 percent,2018-01-0172.jpg,none,"travel, airports, international travel"
The growing gap between the Premiership's Top Six and the rest [OC],vizinmypants,2018-01-08 19:51:05,https://public.tableau.com/views/Premiershiptop6vsbottom14/ThegrowinggapbetweenthePremiershipstopsixandtherest?:embed=y&:display_count=yes&:showVizHome=no,https://www.reddit.com/r/dataisbeautiful/comments/7p1533/the_growing_gap_between_the_premierships_top_six/,11,11,,3,The growing gap between the Premiership's Top Six and the rest OC,2018-01-0181.jpg,none,"sports, football, premiership, analysis, trends"
Tracking China's development as measured by various indicators from 1990-2015.,sirbowtie,2018-01-09 01:33:27,https://chinapower.csis.org/china-development-tracker/,https://www.reddit.com/r/dataisbeautiful/comments/7p3ldi/tracking_chinas_development_as_measured_by/,6,6,,0,Tracking China's development as measured by various indicators from 1990-2015.,2018-01-0189.jpg,none,none
"My ""distracting"" VS ""productive"" time in 2017according to RescueTime",criscmaia,2018-01-09 10:24:57,https://www.rescuetime.com/year-in-review/2017/B63efkY8ZSxd4A7hH5rUvqoDGGHvK3KqBYs5X4HB,https://www.reddit.com/r/dataisbeautiful/comments/7p699v/my_distracting_vs_productive_time_in/,5,5,,1,My distracting VS productive time in 2017according to RescueTime,2018-01-0193.jpg,none,"productivity, time management, focus, rescuetime"
Custom reports and Visualizations created using Tableau & R - based on the Google Analytics API [OC],canonicalized,2018-01-09 10:42:36,https://canonicalized.com/google-analytics-missing-custom-reports/,https://www.reddit.com/r/dataisbeautiful/comments/7p6bt9/custom_reports_and_visualizations_created_using/,1,1,,2,Custom reports and Visualizations created using Tableau & R - based on the Google Analytics API OC,2018-01-0195.jpg,none,"google analytics, tableau, data visualization, analytics, software"
The most popular memes of 2017 based on Google searches [OC],jackbeckwith,2018-01-10 01:14:24,http://thedataface.com/2018/01/culture/memes,https://www.reddit.com/r/dataisbeautiful/comments/7pbzgz/the_most_popular_memes_of_2017_based_on_google/,23,23,,3,The most popular memes of 2017 based on Google searches OC,2018-01-0212.jpg,none,"memes, internet culture, trends, 2017"
What is the most boring sport?,jimrosenz,2018-01-10 09:48:09,https://yougov.co.uk/news/2018/01/10/what-most-boring-sport/,https://www.reddit.com/r/dataisbeautiful/comments/7pel6k/what_is_the_most_boring_sport/,5,5,,21,What is the most boring sport,2018-01-0217.jpg,none,"sports, entertainment, opinions"
The Most Negative Places On Earth (According to Emoji Use),GemmaJ123,2018-01-10 12:16:49,https://www.brandwatch.com/blog/react-most-negative-places-on-earth/?utm_source=reddit&utm_medium=react&utm_term=report&utm_campaign=01_2018_research_blog,https://www.reddit.com/r/dataisbeautiful/comments/7pf7u6/the_most_negative_places_on_earth_according_to/,25,25,,5,The Most Negative Places On Earth (According to Emoji Use),2018-01-0220.jpg,none,"emotions, negativity, global trends, social media"
Interspecies comparison using a heatmap plot with dendrograms,antononcube,2018-01-10 16:07:40,http://community.wolfram.com/groups/-/m/t/1261444,https://www.reddit.com/r/dataisbeautiful/comments/7pgjg3/interspecies_comparison_using_a_heatmap_plot_with/,1,1,,1,Interspecies comparison using a heatmap plot with dendrograms,2018-01-0225.jpg,none,none
How cash-strapped college students increase poverty levels in small cities,geekdorknerd,2018-01-10 17:43:25,https://www.readfrontier.org/stories/how-strapped-college-students-increase-poverty-levels-in-small-cities/,https://www.reddit.com/r/dataisbeautiful/comments/7ph86o/how_cashstrapped_college_students_increase/,1,1,,0,How cash-strapped college students increase poverty levels in small cities,2018-01-0227.jpg,none,"education, poverty, small cities, students"
A video showing what Barry Bond's OBS would've been had he stood at plate without a baseball bat.,Assistantshrimp,2018-01-10 18:45:20,https://www.youtube.com/watch?v=JwMfT2cZGHg,https://www.reddit.com/r/dataisbeautiful/comments/7phohu/a_video_showing_what_barry_bonds_obs_wouldve_been/,21,21,,3,A video showing what Barry Bond's OBS would've been had he stood at plate without a baseball bat.,2018-01-0229.jpg,none,"sports, baseball, hypothetical analysis, statistics"
Our World in Data is an online publication that presents the empirical evidence on the development of human living conditions at a global scale.,wrgbyers,2018-01-10 18:59:41,https://ourworldindata.org/,https://www.reddit.com/r/dataisbeautiful/comments/7phsc8/our_world_in_data_is_an_online_publication_that/,1,1,,0,Our World in Data is an online publication that presents the empirical evidence on the development of human living conditions at a global scale.,2018-01-0230.jpg,none,"research, data, global development, human living conditions, information"
Very well-done year end summary of my tasks.,jasonhoblin,2018-01-10 20:03:23,https://todoist.com/review/2017/eyJhbGciOiJIUzI1NiIsInR5cCI6IkpXVCJ9.eyJqdGkiOiJpT05Lb3dKUCIsInVpZCI6OTg1NzI0NSwieWVhciI6MjAxN30.BVQFO2RuSU6PG0gKT8BoxbKIb7FH_fR831wFPq2QDtE,https://www.reddit.com/r/dataisbeautiful/comments/7pi9hz/very_welldone_year_end_summary_of_my_tasks/,9,9,,2,Very well-done year end summary of my tasks.,2018-01-0232.jpg,none,none
My text messaging patterns with friends [OC],klittlepage,2018-01-11 00:01:25,https://github.com/klittlepage/chatty/blob/master/chatty.ipynb,https://www.reddit.com/r/dataisbeautiful/comments/7pjz1z/my_text_messaging_patterns_with_friends_oc/,5,5,,2,My text messaging patterns with friends OC,2018-01-0235.jpg,none,"communication, text messaging, software, analysis, friends"
"How are hospitals in England are coping with the winter demand? As escalation beds are added, the percentage of ambulances that are delayed rises dramatically",feildingcage,2018-01-11 12:44:15,https://www.theguardian.com/society/ng-interactive/2018/jan/11/how-the-nhs-winter-beds-crisis-is-hitting-patient-care,https://www.reddit.com/r/dataisbeautiful/comments/7pnu55/how_are_hospitals_in_england_are_coping_with_the/,7,7,,0,"How are hospitals in England are coping with the winter demand As escalation beds are added, the percentage of ambulances that are delayed rises drama",2018-01-0242.jpg,none,"healthcare, hospitals, england, winter demand, ambulances, delays"
