title,author,created_date,url,full_permalink,score,ups,downs,num_comments,sanitized_title,image_file,chart_type,high_level_categories
"Todoist has a very nice ""Year in Review"" page for its users.",BevansDesign,2018-01-11 15:19:33,https://todoist.com/review/2017/eyJhbGciOiJIUzI1NiIsInR5cCI6IkpXVCJ9.eyJqdGkiOiJjempZcERqdyIsInVpZCI6NjgzMTg5LCJ5ZWFyIjoyMDE3fQ.5lMdrsi7po0v4-SvG7bW9QaAUNTI-9OnPJygbJHAhfM,https://www.reddit.com/r/dataisbeautiful/comments/7porli/todoist_has_a_very_nice_year_in_review_page_for/,0,0,,1,Todoist has a very nice Year in Review page for its users.,2018-01-0244.jpg,none,"review, year, todoist, productivity"
The frequency of Grey Poupon in hip-hop lyrics 1992-2016,GandalfTheWhey,2018-01-11 17:18:26,https://www.vox.com/videos/2016/10/12/13250360/grey-poupon-in-hip-hop,https://www.reddit.com/r/dataisbeautiful/comments/7ppmfu/the_frequency_of_grey_poupon_in_hiphop_lyrics/,2,2,,0,The frequency of Grey Poupon in hip-hop lyrics 1992-2016,2018-01-0245.jpg,none,"music, hip-hop, culture, lyrics, grey poupon"
Explaining Neural Network Predictions,deepPurpleHaze,2018-01-11 17:58:56,https://thehive.ai/blog/inside-a-neural-networks-mind,https://www.reddit.com/r/dataisbeautiful/comments/7ppwxa/explaining_neural_network_predictions/,23,23,,1,Explaining Neural Network Predictions,2018-01-0247.jpg,none,"neural networks, ai, machine learning, predictions"
Projected Arctic Shipping Routes change in next 60 years as Arctic Ice Melts,joshward1,2018-01-11 19:00:25,https://www.bloomberg.com/graphics/2017-arctic/the-economic-arctic/#2075,https://www.reddit.com/r/dataisbeautiful/comments/7pqd65/projected_arctic_shipping_routes_change_in_next/,8,8,,0,Projected Arctic Shipping Routes change in next 60 years as Arctic Ice Melts,2018-01-0249.jpg,none,"climate change, arctic, shipping, ice melt, environment"
One year in one image,meeseeksdeleteafter,2018-01-11 20:15:50,https://eirikso.com/2011/01/04/one-year-in-one-image/,https://www.reddit.com/r/dataisbeautiful/comments/7pqxjt/one_year_in_one_image/,74,74,,9,One year in one image,2018-01-0250.jpg,none,"seasons, nature, photography"
[x-post r/marvel] Social media data finds Black Panther is the most hyped superhero movie of 2018 [OC],GemmaJ123,2018-01-12 11:41:28,https://www.brandwatch.com/blog/react-superhero-movies-2018/?utm_source=reddit&utm_medium=react&utm_term=blog&utm_campaign=01_2018_entertainment_blog,https://www.reddit.com/r/dataisbeautiful/comments/7pw214/xpost_rmarvel_social_media_data_finds_black/,3,3,,3,x-post rmarvel Social media data finds Black Panther is the most hyped superhero movie of 2018 OC,2018-01-0257.jpg,none,"marvel, movies, superheroes, pop culture"
Investigating Cardcaptor Sakura & Taylor Swift who can make us enthusiastic like nobody else,pr33tish,2018-01-12 12:06:58,http://www.datasketch.es/june/,https://www.reddit.com/r/dataisbeautiful/comments/7pw640/investigating_cardcaptor_sakura_taylor_swift_who/,0,0,,0,Investigating Cardcaptor Sakura & Taylor Swift who can make us enthusiastic like nobody else,2018-01-0258.jpg,none,none
Mapped: How the entire planet's internet is linked by cables under the sea [OC],alfiek91,2018-01-12 14:07:24,http://www.telegraph.co.uk/travel/maps-and-graphics/underwater-sea-cables-beaches-uk/,https://www.reddit.com/r/dataisbeautiful/comments/7pwrtp/mapped_how_the_entire_planets_internet_is_linked/,39,39,,4,Mapped How the entire planet's internet is linked by cables under the sea OC,2018-01-0263.jpg,none,none
"I used analytics to try and predict College Football bowl outcomes, it went okay! Would love feedback. [OC]",ibmdave,2018-01-12 16:21:07,https://www.linkedin.com/pulse/confidence-bowl-pool-analytics-edition-dave-elder/?published=t,https://www.reddit.com/r/dataisbeautiful/comments/7pxmyc/i_used_analytics_to_try_and_predict_college/,3,3,,4,"I used analytics to try and predict College Football bowl outcomes, it went okay! Would love feedback. OC",2018-01-0268.jpg,none,"sports, college football, events"
"In case there is someone who wants to see how Africa is changing, I made a set of slides for you. [OC]",Max_OurWorldinData,2018-01-12 20:12:37,https://africaindata.org/,https://www.reddit.com/r/dataisbeautiful/comments/7pzbuk/in_case_there_is_someone_who_wants_to_see_how/,35,35,,6,"In case there is someone who wants to see how Africa is changing, I made a set of slides for you. OC",2018-01-0273.jpg,none,"africa, data, change, slides"
Mary Shelley's Frankenstein – in charts,shihn,2018-01-13 09:06:04,https://www.theguardian.com/books/gallery/2018/jan/13/mary-shelleys-frankenstein-in-charts,https://www.reddit.com/r/dataisbeautiful/comments/7q3i56/mary_shelleys_frankenstein_in_charts/,11,11,,1,Mary Shelley's Frankenstein – in charts,2018-01-0275.jpg,none,"literature, mary shelley, frankenstein, books"
Visualisation and sonification of USGS earthquake data for December 2017 [OC],struct78,2018-01-15 04:35:33,https://www.youtube.com/watch?v=6F9P-nwUweM,https://www.reddit.com/r/dataisbeautiful/comments/7qhbr3/visualisation_and_sonification_of_usgs_earthquake/,11,11,,3,Visualisation and sonification of USGS earthquake data for December 2017 OC,2018-01-0301.jpg,none,"earthquakes, data visualization, usgs, december 2017"
"In the EU in 2015, women earned 16.3 % less than men when comparing their average gross hourly earnings.",pr33tish,2018-01-15 09:13:33,http://ec.europa.eu/eurostat/cache/infographs/womenmen/bloc-2d.html?,https://www.reddit.com/r/dataisbeautiful/comments/7qil0v/in_the_eu_in_2015_women_earned_163_less_than_men/,0,0,,4,"In the EU in 2015, women earned 16.3 % less than men when comparing their average gross hourly earnings.",2018-01-0303.jpg,none,"gender equality, europe, earnings, 2015, economics"
Visualizing the Uncertainty in Data,zemcunha,2018-01-15 16:37:40,https://flowingdata.com/2018/01/08/visualizing-the-uncertainty-in-data/,https://www.reddit.com/r/dataisbeautiful/comments/7qktk9/visualizing_the_uncertainty_in_data/,17,17,,1,Visualizing the Uncertainty in Data,2018-01-0311.jpg,none,"uncertainty, visualization"
"Is San Francisco too expensive for ""San Francisco"" based startups? [OC]",emaercklein,2018-01-15 22:02:17,https://craft.co/reports/is-san-francisco-too-expensive-for-san-francisco-based-startups,https://www.reddit.com/r/dataisbeautiful/comments/7qnbnc/is_san_francisco_too_expensive_for_san_francisco/,6,6,,0,Is San Francisco too expensive for San Francisco based startups OC,2018-01-0317.jpg,none,none
The Happiest Places on Earth (According to Emoji Use),GemmaJ123,2018-01-16 12:33:07,https://www.brandwatch.com/blog/react-happiest-places-on-earth/?utm_source=reddit&utm_medium=react&utm_term=blog&utm_campaign=01_2017_topicanalysis_blog,https://www.reddit.com/r/dataisbeautiful/comments/7qs0j9/the_happiest_places_on_earth_according_to_emoji/,57,57,,14,The Happiest Places on Earth (According to Emoji Use),2018-01-0323.jpg,none,"emojis, happiness, culture, social media"
Using Spotify listening data as a proxy for measuring how early people start celebrating Christmas,Psythor,2018-01-16 12:57:31,http://www.gizmodo.co.uk/2018/01/data-reveals-we-were-already-getting-sick-of-christmas-by-december-28th/,https://www.reddit.com/r/dataisbeautiful/comments/7qs4rj/using_spotify_listening_data_as_a_proxy_for/,31,31,,1,Using Spotify listening data as a proxy for measuring how early people start celebrating Christmas,2018-01-0326.jpg,none,none
California vaccination rates before and after Senate Bill 277,N8CCRG,2018-01-16 14:51:21,https://www.nytimes.com/2018/01/16/upshot/measles-vaccination-california-students.html,https://www.reddit.com/r/dataisbeautiful/comments/7qss57/california_vaccination_rates_before_and_after/,43,43,,1,California vaccination rates before and after Senate Bill 277,2018-01-0328.jpg,none,none
The Quarterback Class of 1983,flerlagekr,2018-01-16 15:05:29,https://public.tableau.com/views/DuoDare5TheClassof1983/Classof1983?:embed=y&:display_count=yes,https://www.reddit.com/r/dataisbeautiful/comments/7qsvbo/the_quarterback_class_of_1983/,2,2,,0,The Quarterback Class of 1983,2018-01-0330.jpg,none,"sports, nfl, football, history, quarterbacks"
Where and when do passengers get on and off the tube? [OC],vizinmypants,2018-01-16 16:28:45,https://public.tableau.com/views/Whereandwhendopassengersgetonandoffthetube/Whereandwhendotubepassengersgetonandoff?:embed=y&:display_count=yes&:showVizHome=no,https://www.reddit.com/r/dataisbeautiful/comments/7qtg3j/where_and_when_do_passengers_get_on_and_off_the/,6,6,,4,Where and when do passengers get on and off the tube OC,2018-01-0337.jpg,none,"transportation, london, passenger flow, public transit"
The portion of VC-backed startups founded by women stays stubbornly stagnant,GemmaJ123,2018-01-17 09:23:54,https://techcrunch.com/2018/01/15/the-portion-of-vc-backed-startups-founded-by-women-stays-stubbornly-stagnant/,https://www.reddit.com/r/dataisbeautiful/comments/7qzus2/the_portion_of_vcbacked_startups_founded_by_women/,0,0,,0,The portion of VC-backed startups founded by women stays stubbornly stagnant,2018-01-0353.jpg,none,none
"Almost as many celebrities died in 2017 as in 2016, but the ones who did in 2016 we were much more famous",Psythor,2018-01-17 09:50:38,http://www.gizmodo.co.uk/2018/01/almost-as-many-celebrities-died-in-2017-as-2016-heres-why-you-didnt-notice/,https://www.reddit.com/r/dataisbeautiful/comments/7qzymu/almost_as_many_celebrities_died_in_2017_as_in/,15,15,,2,"Almost as many celebrities died in 2017 as in 2016, but the ones who did in 2016 we were much more famous",2018-01-0355.jpg,none,none
Visualising the careers of musicians-turned-actors,Snorky02,2018-01-17 12:08:03,http://www.economist.com/blogs/prospero/2018/01/new-ensembles,https://www.reddit.com/r/dataisbeautiful/comments/7r0jhu/visualising_the_careers_of_musiciansturnedactors/,2,2,,1,Visualising the careers of musicians-turned-actors,2018-01-0357.jpg,none,"entertainment, film, music, careers"
Jon Skeet's reputation in Stack Overflow,j3r3mias,2018-01-17 13:38:52,https://stackoverflow.blog/2018/01/15/thanks-million-jon-skeet/,https://www.reddit.com/r/dataisbeautiful/comments/7r107b/jon_skeets_reputation_in_stack_overflow/,5,5,,0,Jon Skeet's reputation in Stack Overflow,2018-01-0358.jpg,none,"technology, programming, stack overflow, achievements"
A Map of Every Known Diamond Mine in The World.,VanillaMonster,2018-01-17 16:08:47,https://public.tableau.com/views/MapofDiamondMines/Dashboard1?:embed=y&:display_count=yes,https://www.reddit.com/r/dataisbeautiful/comments/7r2020/a_map_of_every_known_diamond_mine_in_the_world/,6,6,,1,A Map of Every Known Diamond Mine in The World.,2018-01-0362.jpg,none,none
"A Look Into How Much Electricity Every State Generates, And Where It Comes From",VanillaMonster,2018-01-17 18:19:57,https://public.tableau.com/views/EnergyHexMapSizeMobileReady/Dashboard2?:embed=y&:display_count=yes&:showVizHome=no#3,https://www.reddit.com/r/dataisbeautiful/comments/7r3053/a_look_into_how_much_electricity_every_state/,16,16,,10,"A Look Into How Much Electricity Every State Generates, And Where It Comes From",2018-01-0363.jpg,none,"energy, electricity, states, generation, sources"
"Australia's Sharks, Snakes and Spiders: How Your Worst Fears Stack Up Against Reality",SweetButterCrumpets,2018-01-17 20:03:08,http://www.abc.net.au/news/2018-01-18/how-your-worst-fears-stack-up-against-reality/9277098,https://www.reddit.com/r/dataisbeautiful/comments/7r3swh/australias_sharks_snakes_and_spiders_how_your/,11,11,,10,"Australia's Sharks, Snakes and Spiders How Your Worst Fears Stack Up Against Reality",2018-01-0365.jpg,none,"wildlife, animals, fears, australia"
Webserver visualisation powered by CodeFlower mashed up with a realtime GoAccess websocket data feed. [OC],philipbattle,2018-01-17 20:09:52,https://www.digitalbook.io/technology.html,https://www.reddit.com/r/dataisbeautiful/comments/7r3uva/webserver_visualisation_powered_by_codeflower/,8,8,,3,Webserver visualisation powered by CodeFlower mashed up with a realtime GoAccess websocket data feed. OC,2018-01-0366.jpg,none,none
US Votes 2016 [OC],__ibowankenobi__,2018-01-18 05:22:22,http://bl.ocks.org/ibrahimtanyalcin/f0bf54f88c6859c985ee98bc5e56ae6f,https://www.reddit.com/r/dataisbeautiful/comments/7r7hnq/us_votes_2016_oc/,2,2,,2,US Votes 2016 OC,2018-01-0372.jpg,none,"elections, politics, usa"
China's debt-to-GDP ratio during 1980-1H17,pr33tish,2018-01-18 06:40:11,https://qz.com/1182504/chinas-economy-will-cool-this-year-but-its-a-good-thing/,https://www.reddit.com/r/dataisbeautiful/comments/7r7va3/chinas_debttogdp_ratio_during_19801h17/,1,1,,0,China's debt-to-GDP ratio during 1980-1H17,2018-01-0375.jpg,none,none
Worldwide distribution of volcanoes,mrcchapman,2018-01-18 09:24:41,http://www.dw.com/en/if-you-live-near-one-of-these-volcanos-move/a-42183816,https://www.reddit.com/r/dataisbeautiful/comments/7r8kcm/worldwide_distribution_of_volcanoes/,4,4,,0,Worldwide distribution of volcanoes,2018-01-0377.jpg,none,none
Women and Men in STEM Often at Odds Over Workplace Equity,jimrosenz,2018-01-18 09:30:14,http://www.pewsocialtrends.org/2018/01/09/women-and-men-in-stem-often-at-odds-over-workplace-equity/?utm_content=buffer4b2e7&utm_medium=social&utm_source=twitter.com&utm_campaign=buffer,https://www.reddit.com/r/dataisbeautiful/comments/7r8l5d/women_and_men_in_stem_often_at_odds_over/,6,6,,1,Women and Men in STEM Often at Odds Over Workplace Equity,2018-01-0378.jpg,none,"stem, workplace equity, gender, employment"
Text mining and sentiment analysis of the TripAdvisor reviews submitted by the visitors from the UK and the US,pr33tish,2018-01-18 11:42:06,https://www.promptcloud.com/blog/how-visitors-from-us-uk-review-popular-landmarks-tripadvisor,https://www.reddit.com/r/dataisbeautiful/comments/7r95hl/text_mining_and_sentiment_analysis_of_the/,2,2,,3,Text mining and sentiment analysis of the TripAdvisor reviews submitted by the visitors from the UK and the US,2018-01-0380.jpg,none,"artificial intelligence, technology, coding"
The London Time Machine - William Morgan's 1682 map of London compared to satellite imagery of London today [OC],alfiek91,2018-01-18 14:56:58,http://maps.arcgis.com/apps/StorytellingSwipe/index.html?appid=e5160a8d1d3649f09a756c317bd0b56b,https://www.reddit.com/r/dataisbeautiful/comments/7ra7gb/the_london_time_machine_william_morgans_1682_map/,40,40,,3,The London Time Machine - William Morgan's 1682 map of London compared to satellite imagery of London today OC,2018-01-0386.jpg,none,none
The Political Resolution in 2018 | US Only,ILoveRevenge,2018-01-18 15:01:30,http://www.mavens.us/posts/the-political-resolution/,https://www.reddit.com/r/dataisbeautiful/comments/7ra8ka/the_political_resolution_in_2018_us_only/,4,4,,1,The Political Resolution in 2018 US Only,2018-01-0387.jpg,none,none
Effectiveness of Personality Tests for Hiring,jimrosenz,2018-01-19 04:00:10,https://hbr.org/2014/08/the-problem-with-using-personality-tests-for-hiring,https://www.reddit.com/r/dataisbeautiful/comments/7rfot0/effectiveness_of_personality_tests_for_hiring/,7,7,,0,Effectiveness of Personality Tests for Hiring,2018-01-0407.jpg,none,none
Japan by the Numbers: 'Karoshi' - Tokyo Review,the_fedora_tippler,2018-01-19 12:33:31,http://www.tokyoreview.net/2017/10/japan-numbers-karoshi-overwork/,https://www.reddit.com/r/dataisbeautiful/comments/7ri0gu/japan_by_the_numbers_karoshi_tokyo_review/,3,3,,1,Japan by the Numbers 'Karoshi' - Tokyo Review,2018-01-0412.jpg,none,"japan, karoshi, tokyo, culture, work, society"
"The top 10 places people are moving, and how their choices differ by race",dont_tread_on_dc,2018-01-19 14:08:09,https://www.washingtonpost.com/news/wonk/wp/2018/01/18/the-top-10-places-people-are-moving-and-how-their-choices-differ-by-race/,https://www.reddit.com/r/dataisbeautiful/comments/7riitm/the_top_10_places_people_are_moving_and_how_their/,8,8,,0,"The top 10 places people are moving, and how their choices differ by race",2018-01-0414.jpg,none,none
A Map of Tree Diseases Killing Our National Parks [OC],VanillaMonster,2018-01-19 15:53:59,http://www.nobledatum.com/2018/01/18/tree-disease/,https://www.reddit.com/r/dataisbeautiful/comments/7rj7y7/a_map_of_tree_diseases_killing_our_national_parks/,1,1,,2,A Map of Tree Diseases Killing Our National Parks OC,2018-01-0417.jpg,none,none
World income organized from poorest to most wealthy in photos.,midnightsun183,2018-01-19 20:38:17,https://www.gapminder.org/dollar-street/matrix?thing=Families&countries=World&regions=World&zoom=4&row=1&lowIncome=26&highIncome=15000&lang=en,https://www.reddit.com/r/dataisbeautiful/comments/7rlblt/world_income_organized_from_poorest_to_most/,18,18,,11,World income organized from poorest to most wealthy in photos.,2018-01-0420.jpg,none,"income, wealth, poverty, families, global economics"
Edge detection via convolution with the Laplacian kernel [OC],sardines2,2018-01-20 14:49:55,https://imgur.com/a/pPpGD,https://www.reddit.com/r/dataisbeautiful/comments/7rqrrl/edge_detection_via_convolution_with_the_laplacian/,13,13,,5,Edge detection via convolution with the Laplacian kernel OC,2018-01-0431.jpg,none,"image processing, edge detection, convolution, laplacian, computer vision"
Wikipedia's Lamest Edit Wars,NicholasSnell,2018-01-21 03:38:38,https://informationisbeautiful.net/visualizations/wikipedia-lamest-edit-wars/,https://www.reddit.com/r/dataisbeautiful/comments/7rverm/wikipedias_lamest_edit_wars/,7948,7948,,808,Wikipedia's Lamest Edit Wars,2018-01-0440.jpg,none,none
The History of the World: Every Year,ccarlo42,2018-01-21 10:28:51,https://www.youtube.com/attribution_link?a=Hfpvyk-4CaM&u=%2Fwatch%3Fv%3D-6Wu0Q7x5D0%26feature%3Dshare,https://www.reddit.com/r/dataisbeautiful/comments/7rx0wr/the_history_of_the_world_every_year/,21,21,,2,The History of the World Every Year,2018-01-0442.jpg,none,"history, world, countries, timeline"
