title,author,created_date,url,full_permalink,score,ups,downs,num_comments,sanitized_title,image_file,chart_type,high_level_categories
Watching every home run Mike Trout has hit since 2015 from center field,lekniz,2019-09-03 02:18:49,https://twitter.com/darenw/status/1168554839795818496?s=19,https://www.reddit.com/r/dataisbeautiful/comments/cyypq9/watching_every_home_run_mike_trout_has_hit_since/,11,11,,1,Watching every home run Mike Trout has hit since 2015 from center field,2019-09-0017.jpg,none,"baseball, sports, home runs, mike trout"
Combined faces of top 200 NFL players (with positions) [OC],osmutiar,2019-09-03 22:41:09,https://i.redd.it/tm9zje9tigk31.jpg,https://www.reddit.com/r/dataisbeautiful/comments/czc3m8/combined_faces_of_top_200_nfl_players_with/,14860,14860,,786,Combined faces of top 200 NFL players (with positions) OC,2019-09-0030.jpg,none,"sports, nfl, athletes, positions"
The world's single-use plastic bottle consumption visualized,deltapilot97,2019-09-04 18:50:25,https://graphics.reuters.com/ENVIRONMENT-PLASTIC/0100B275155/index.html,https://www.reddit.com/r/dataisbeautiful/comments/czp276/the_worlds_singleuse_plastic_bottle_consumption/,31,31,,2,The world's single-use plastic bottle consumption visualized,2019-09-0044.jpg,none,"plastic, environment, waste, consumption"
Injuries in the NFL Over the Last 5 Seasons,RollstuhlGoebbels,2019-09-05 18:17:20,https://www.weisspaarz.com/nfl-injuries-over-five-seasons/,https://www.reddit.com/r/dataisbeautiful/comments/d04k5l/injuries_in_the_nfl_over_the_last_5_seasons/,12,12,,0,Injuries in the NFL Over the Last 5 Seasons,2019-09-0061.jpg,none,"sports, nfl, injuries, analysis"
OC: A data artwork generated from Donald Trump's Tweets,maptian,2019-09-05 20:27:07,http://sepsin.danmccarey.com,https://www.reddit.com/r/dataisbeautiful/comments/d06b9f/oc_a_data_artwork_generated_from_donald_trumps/,7,7,,3,OC A data artwork generated from Donald Trump's Tweets,2019-09-0064.jpg,none,"politics, social media, data analysis, digital art"
[OC] How dangerous cleaning the CHERNOBYL reactor roof REALLY was?,VizzuHQ,2019-09-07 09:59:19,https://v.redd.it/pafglml5a5l31,https://www.reddit.com/r/dataisbeautiful/comments/d0u6fc/oc_how_dangerous_cleaning_the_chernobyl_reactor/,328,328,,23,OC How dangerous cleaning the CHERNOBYL reactor roof REALLY was,2019-09-0076.png,none,"chernobyl, nuclear disaster, safety, history"
Why Drugs Are Hurting More People Than Ever,JSmurfington,2019-09-08 13:37:35,https://www.freethink.com/articles/drugs-are-hurting-more-people-than-ever-what-can-we-do-about,https://www.reddit.com/r/dataisbeautiful/comments/d1azhn/why_drugs_are_hurting_more_people_than_ever/,12,12,,4,Why Drugs Are Hurting More People Than Ever,2019-09-0088.jpg,none,"drugs, health, impact"
[OC] Fanalytx: NLP Analysis of /r/eagles Game Thread Comments,who_is_enginerd,2019-09-09 20:45:30,http://www.fanalytx.com/2019-week1-eagles-redskins,https://www.reddit.com/r/dataisbeautiful/comments/d1wtce/oc_fanalytx_nlp_analysis_of_reagles_game_thread/,1,1,,5,OC Fanalytx NLP Analysis of reagles Game Thread Comments,2019-09-0102.jpg,none,"sports, analytics, nlp, discussion threads"
Gitlab Maturity,archon810,2019-09-09 21:50:33,https://about.gitlab.com/direction/maturity/,https://www.reddit.com/r/dataisbeautiful/comments/d1xqfz/gitlab_maturity/,19,19,,3,Gitlab Maturity,2019-09-0104.jpg,none,none
[OC] Bouncing balls simulation on Observable!,G_Lesaine,2019-09-10 04:44:05,https://observablehq.com/@guillaume-lesaine/bouncing-lab,https://www.reddit.com/r/dataisbeautiful/comments/d22st7/oc_bouncing_balls_simulation_on_observable/,14,14,,4,OC Bouncing balls simulation on Observable!,2019-09-0108.jpg,none,"simulation, physics, animation"
NRK summery of this a Norwegian election,mba88,2019-09-10 13:07:04,https://www.nrk.no/slik-stemte-norge-1.14695107,https://www.reddit.com/r/dataisbeautiful/comments/d27aa4/nrk_summery_of_this_a_norwegian_election/,2,2,,1,NRK summery of this a Norwegian election,2019-09-0111.jpg,none,"politics, elections, norway"
Illuminating human activities using the Night Light [OC],ramizsami,2019-09-10 19:18:02,https://towardsdatascience.com/illuminating-human-activities-using-the-night-light-9caceaab7867,https://www.reddit.com/r/dataisbeautiful/comments/d2cqxd/illuminating_human_activities_using_the_night/,3,3,,6,Illuminating human activities using the Night Light OC,2019-09-0118.jpg,none,"geography, human activities, night light, illumination, global patterns"
The Major League Baseball record for home runs in a season was set tonight at 6106 and climbing. Here's an animation of every home run hit this year colored by exit velocity.,Prestwood,2019-09-12 07:40:45,https://twitter.com/darenw/status/1172003351229345794?s=20,https://www.reddit.com/r/dataisbeautiful/comments/d34imm/the_major_league_baseball_record_for_home_runs_in/,1226,1226,,96,The Major League Baseball record for home runs in a season was set tonight at 6106 and climbing. Here's an animation of every home run hit this year c,2019-09-0144.jpg,none,"sports, baseball, home runs, records, major league baseball"
"Composite view of Earth at night, showing the level of development (or light pollution) across the globe.",xXTheHillsHavePiesXx,2019-09-17 01:44:15,https://en.wikipedia.org/wiki/Electric_light#Public_lighting,https://www.reddit.com/r/dataisbeautiful/comments/d5a7gk/composite_view_of_earth_at_night_showing_the/,5,5,,1,"Composite view of Earth at night, showing the level of development (or light pollution) across the globe.",2019-09-0210.jpg,none,none
China’s polluted skies: how bad is it?,sdbernard,2019-09-18 07:56:31,https://ig.ft.com/china-pollution/,https://www.reddit.com/r/dataisbeautiful/comments/d5uhp9/chinas_polluted_skies_how_bad_is_it/,12,12,,10,China’s polluted skies how bad is it,2019-09-0226.jpg,none,"pollution, china, environment, air quality"
Dirty air: how India became the most polluted country on earth,sdbernard,2019-09-18 10:37:21,https://ig.ft.com/india-pollution/,https://www.reddit.com/r/dataisbeautiful/comments/d5vuj3/dirty_air_how_india_became_the_most_polluted/,24,24,,3,Dirty air how India became the most polluted country on earth,2019-09-0228.jpg,none,"pollution, environment, health, india"
"Why Donald Trump won in 2016 and the potential impact of automation, Andrew Yang’s argument (link in comments) [OC]",infinitemoment22,2019-09-19 22:21:12,https://v.redd.it/5tw87eyllmn31,https://www.reddit.com/r/dataisbeautiful/comments/d6lc2u/why_donald_trump_won_in_2016_and_the_potential/,30,30,,11,"Why Donald Trump won in 2016 and the potential impact of automation, Andrew Yang’s argument (link in comments) OC",2019-09-0254.png,none,"politics, elections, automation, economy"
Civilian deaths in Iraq and Syria from Coalition Airstrikes since August 2014,FeatsOfStrength,2019-09-19 22:40:32,https://airwars.org/conflict/coalition-in-iraq-and-syria/,https://www.reddit.com/r/dataisbeautiful/comments/d6llbt/civilian_deaths_in_iraq_and_syria_from_coalition/,7,7,,2,Civilian deaths in Iraq and Syria from Coalition Airstrikes since August 2014,2019-09-0255.jpg,none,"conflict, iraq, syria, airstrikes, civilian deaths"
Solar and Wind Power So Cheap They’re Outgrowing Subsidies,beavershaw,2019-09-20 08:56:04,https://www.bloomberg.com/news/features/2019-09-19/solar-and-wind-power-so-cheap-they-re-outgrowing-subsidies,https://www.reddit.com/r/dataisbeautiful/comments/d6s43d/solar_and_wind_power_so_cheap_theyre_outgrowing/,193,193,,5,Solar and Wind Power So Cheap They’re Outgrowing Subsidies,2019-09-0261.jpg,none,"renewable energy, solar power, wind power, subsidies, economics"
Weekly work hours since 1870,putthatdownisaid,2019-09-20 11:33:50,https://www.sloww.co/busy-feeling/,https://www.reddit.com/r/dataisbeautiful/comments/d6tl1d/weekly_work_hours_since_1870/,5,5,,3,Weekly work hours since 1870,2019-09-0262.jpg,none,none
The hard truths of climate change — by the numbers : A set of troubling charts shows how little progress nations have made toward limiting greenhouse-gas emissions,extra_good,2019-09-21 23:40:28,https://www.nature.com/immersive/d41586-019-02711-4/index.html,https://www.reddit.com/r/dataisbeautiful/comments/d7ih62/the_hard_truths_of_climate_change_by_the_numbers/,18,18,,4,The hard truths of climate change — by the numbers A set of troubling charts shows how little progress nations have made toward limiting greenhouse-ga,2019-09-0277.jpg,none,"climate change, pollution, environment, industry, infrastructure"
[OC] Blade Runner 2049..... represented by 1600 captures of the movie. Each of these is resized to 1px wide and extracted with the same time interval.,julekca,2019-09-22 08:50:18,https://i.redd.it/tkmqnoywz3o31.jpg,https://www.reddit.com/r/dataisbeautiful/comments/d7nw9p/oc_blade_runner_2049_represented_by_1600_captures/,26537,26537,,526,OC Blade Runner 2049..... represented by 1600 captures of the movie. Each of these is resized to 1px wide and extracted with the same time interval.,2019-09-0282.jpg,none,"movies, blade runner 2049, film analysis"
One hundred years of British politics [OC],rspeigal,2019-09-24 15:46:23,https://v.redd.it/u7ywdz5tbko31,https://www.reddit.com/r/dataisbeautiful/comments/d8p09j/one_hundred_years_of_british_politics_oc/,8465,8465,,373,One hundred years of British politics OC,2019-09-0311.png,none,"politics, uk, elections, history, voting trends"
Inspired by recent Blade Runner barcode - both films together [OC],Rick_Proza,2019-09-24 22:17:28,https://i.redd.it/2xighgbi9mo31.jpg,https://www.reddit.com/r/dataisbeautiful/comments/d8ue6x/inspired_by_recent_blade_runner_barcode_both/,9367,9367,,144,Inspired by recent Blade Runner barcode - both films together OC,2019-09-0315.jpg,none,"film, blade runner, visual arts"
2018 Median Household Income in the United States,OverflowDs,2019-09-26 14:11:32,https://www.census.gov/library/visualizations/interactive/2018-median-household-income.html,https://www.reddit.com/r/dataisbeautiful/comments/d9k67f/2018_median_household_income_in_the_united_states/,11,11,,2,2018 Median Household Income in the United States,2019-09-0346.jpg,none,none
[OC] Visualizing A Decentralized Blockchain Projects Code Activity,mitdralla,2019-09-26 17:19:42,https://projecthydro.org/blog/visualizing-a-decentralized-blockchain-projects-code-activity/,https://www.reddit.com/r/dataisbeautiful/comments/d9mqdm/oc_visualizing_a_decentralized_blockchain/,3,3,,4,OC Visualizing A Decentralized Blockchain Projects Code Activity,2019-09-0352.jpg,none,none
"[OC] Tomorrow is the Australian Rules Football Grand Final - my mate and I have ranked every team in the League's history, complete with an interactive chart",Nonederstand,2019-09-27 01:17:23,http://www.inforubiks.com/blog/ranking-every-afl-team-ever,https://www.reddit.com/r/dataisbeautiful/comments/d9t7zv/oc_tomorrow_is_the_australian_rules_football/,23,23,,6,"OC Tomorrow is the Australian Rules Football Grand Final - my mate and I have ranked every team in the League's history, complete with an interactive",2019-09-0364.jpg,none,"sports, australian rules football, event"
"An artistic visualization of weather data in Hamburg, Germany [OC]",colorblnd_foto,2019-09-27 16:44:03,https://i.redd.it/3fxzfc2016p31.jpg,https://www.reddit.com/r/dataisbeautiful/comments/da323x/an_artistic_visualization_of_weather_data_in/,17,17,,6,"An artistic visualization of weather data in Hamburg, Germany OC",2019-09-0371.jpg,none,"weather, hamburg, germany, art"
"Average General Annual Deductibles for Single Coverage, 2006-2019",MustangGuy1965,2019-09-28 14:54:04,https://www.kff.org/report-section/ehbs-2019-section-7-employee-cost-sharing/attachment/figure-7-10-10/,https://www.reddit.com/r/dataisbeautiful/comments/dagzu2/average_general_annual_deductibles_for_single/,7,7,,1,"Average General Annual Deductibles for Single Coverage, 2006-2019",2019-09-0379.jpg,none,none
The Millennial Question,koavf,2019-09-28 21:57:34,https://pudding.cool/2019/09/millennials/,https://www.reddit.com/r/dataisbeautiful/comments/damh9g/the_millennial_question/,3,3,,0,The Millennial Question,2019-09-0385.jpg,none,"millennials, trends, generational changes, lifestyle, culture"
An SSTV Audio encoding of Antonio Vivaldi- The Four Seasons- Summer- Presto. [OC],madding247,2019-09-29 22:21:59,https://i.redd.it/ooa9ltmjxlp31.jpg,https://www.reddit.com/r/dataisbeautiful/comments/db27y6/an_sstv_audio_encoding_of_antonio_vivaldi_the/,24,24,,5,An SSTV Audio encoding of Antonio Vivaldi- The Four Seasons- Summer- Presto. OC,2019-09-0399.jpg,none,"music, audio encoding, antonio vivaldi, the four seasons, summer, presto"
US Screentime & Smartphone Usage Stats for 2019,HungryGarlic89,2019-09-30 16:53:04,https://simpletexting.com/screentime-smartphone-usage-statistics/,https://www.reddit.com/r/dataisbeautiful/comments/dbeh0p/us_screentime_smartphone_usage_stats_for_2019/,6,6,,2,US Screentime & Smartphone Usage Stats for 2019,2019-09-0412.jpg,none,"technology, smartphones, screen time, usa, statistics, behavior"
[OC] Eight years of r/ForeverAloneDating visualised,pyzhianov,2019-09-30 17:21:45,https://pyzhianov.github.io/foreveralonedating-explorer/,https://www.reddit.com/r/dataisbeautiful/comments/dbew74/oc_eight_years_of_rforeveralonedating_visualised/,5,5,,4,OC Eight years of rForeverAloneDating visualised,2019-09-0413.jpg,none,"online dating, social media, trends, relationships"
U.S. Median Household Income Up in 2018 From 2017,OverflowDs,2019-09-30 18:27:09,https://www.census.gov/library/stories/2019/09/us-median-household-income-up-in-2018-from-2017.html,https://www.reddit.com/r/dataisbeautiful/comments/dbfvyn/us_median_household_income_up_in_2018_from_2017/,8,8,,2,U.S. Median Household Income Up in 2018 From 2017,2019-09-0414.jpg,none,"economy, finance, income, trends"
