title,author,created_date,url,full_permalink,score,ups,downs,num_comments,sanitized_title,image_file,chart_type,high_level_categories
COVID19 mean growth rate per Mexican state for the last 28 days [OC],toothlesshark123,2020-12-01 02:43:23,https://i.redd.it/dr25jnbwnh261.jpg,https://www.reddit.com/r/dataisbeautiful/comments/k4bspz/covid19_mean_growth_rate_per_mexican_state_for/,9,9,,1,COVID19 mean growth rate per Mexican state for the last 28 days OC,2020-12-0002.jpg,none,"covid-19, growth rate, mexico, health, pandemic"
[OC] Solving a maze using the A* pathfinding algorithm,Gullyn1,2020-12-01 11:53:07,https://v.redd.it/55imperpdk261,https://www.reddit.com/r/dataisbeautiful/comments/k4jgzg/oc_solving_a_maze_using_the_a_pathfinding/,626,626,,40,OC Solving a maze using the A pathfinding algorithm,2020-12-0008.png,none,"algorithms, pathfinding, maze, computer science"
[OC] How Dream (or Anyone) Could Cheat in Minecraft Speedruns Without Anyone Noticing,antirabbit,2020-12-23 16:17:09,https://maxcandocia.com/article/2020/Dec/19/dream-power/,https://www.reddit.com/r/dataisbeautiful/comments/kivxiv/oc_how_dream_or_anyone_could_cheat_in_minecraft/,14,14,,10,OC How Dream (or Anyone) Could Cheat in Minecraft Speedruns Without Anyone Noticing,2020-12-0517.jpg,none,"gaming, minecraft, cheating, speedruns"
"Visualization of the actual number of Americans jailed or imprisoned, about 2.3 million",Herrkarlson,2020-12-26 09:45:17,https://mkorostoff.github.io/incarceration-in-real-numbers/,https://www.reddit.com/r/dataisbeautiful/comments/kkg2dq/visualization_of_the_actual_number_of_americans/,63,63,,11,"Visualization of the actual number of Americans jailed or imprisoned, about 2.3 million",2020-12-0556.jpg,none,"incarceration, prison system, united states, population statistics"
Bitcoin just dominated Samsung and Visa in market cap taking gobal ranking #13 Berkshire Hathaway next,ArrayBoy,2020-12-26 16:00:16,https://companiesmarketcap.com/assets-by-market-cap/,https://www.reddit.com/r/dataisbeautiful/comments/kkkq5s/bitcoin_just_dominated_samsung_and_visa_in_market/,5,5,,9,Bitcoin just dominated Samsung and Visa in market cap taking gobal ranking #13 Berkshire Hathaway next,2020-12-0561.jpg,none,"cryptocurrency, finance, market cap, rankings"
"""Our Solar System Poster - Version B"" by National Aeronautics and Space Administration -- The ""graphic is intended to show the accurate scale of the planets, relative to each other and the Sun."" The planets from left to right: Mercury, Venus, Earth, Mars, Jupiter, Saturn, Uranus, Neptune.",trot-trot,2020-12-26 18:44:39,https://solarsystem.nasa.gov/resources/2284/our-solar-system-poster-version-b/,https://www.reddit.com/r/dataisbeautiful/comments/kknhxa/our_solar_system_poster_version_b_by_national/,59,59,,13,Our Solar System Poster - Version B by National Aeronautics and Space Administration -- The graphic is intended to show the accurate scale of the plan,2020-12-0564.jpg,none,"solar system, astronomy, planets, space, nasa"
"[OC] Amount of Each Mario Enemy During Playthrough, Visualized",tchp86,2020-12-27 14:11:50,https://v.redd.it/579h33uslq761,https://www.reddit.com/r/dataisbeautiful/comments/kl4ab7/oc_amount_of_each_mario_enemy_during_playthrough/,27473,27473,,644,"OC Amount of Each Mario Enemy During Playthrough, Visualized",2020-12-0574.png,none,"video games, super mario, enemies, playthrough"
How likely is it for players at the World Juniors to make the NHL?,DjKhalid786,2020-12-29 15:39:45,https://thewincolumn.ca/2020/12/29/how-likely-is-it-for-players-at-the-world-juniors-to-make-the-nhl/,https://www.reddit.com/r/dataisbeautiful/comments/kmgn5u/how_likely_is_it_for_players_at_the_world_juniors/,0,0,,1,How likely is it for players at the World Juniors to make the NHL,2020-12-0612.jpg,none,"sports, hockey, world juniors, nhl"
Nine Charts on US Wealth Inequality from 1963-2016,liefelijk,2020-12-29 20:06:22,https://apps.urban.org/features/wealth-inequality-charts/,https://www.reddit.com/r/dataisbeautiful/comments/kmlsca/nine_charts_on_us_wealth_inequality_from_19632016/,12,12,,7,Nine Charts on US Wealth Inequality from 1963-2016,2020-12-0619.jpg,none,none
Covid-19 Dashboard for Rural America - Daily Yonder,ConradKilroy,2020-12-31 08:39:06,https://dailyyonder.com/covid-19-dashboard-for-rural-america/,https://www.reddit.com/r/dataisbeautiful/comments/knmfel/covid19_dashboard_for_rural_america_daily_yonder/,0,0,,1,Covid-19 Dashboard for Rural America - Daily Yonder,2020-12-0649.jpg,none,"covid-19, rural america, health, pandemic"
"A deep-time clock based on the 12 years report, with a 2020 climate news roundup to help grasp how weird this year was",MustachioEquestrian,2020-12-31 17:17:29,http://www.klepserra.com,https://www.reddit.com/r/dataisbeautiful/comments/kntxx9/a_deeptime_clock_based_on_the_12_years_report/,5,5,,1,"A deep-time clock based on the 12 years report, with a 2020 climate news roundup to help grasp how weird this year was",2020-12-0664.jpg,none,"climate change, time, 2020, news, environment"
Most Fastballs in Each Zone Since 2008,updoee,2020-12-03 17:12:48,https://twitter.com/darenw/status/1334506034770178062?s=21,https://www.reddit.com/r/dataisbeautiful/comments/k61e5o/most_fastballs_in_each_zone_since_2008/,0,0,,2,Most Fastballs in Each Zone Since 2008,2020-12-0076.jpg,none,"baseball, sports, pitching, fastballs"
Comparison of on-air demographics of news organizations,No_Fuel_,2020-12-04 00:33:49,https://link.medium.com/u3a1xI2DVbb,https://www.reddit.com/r/dataisbeautiful/comments/k6a59d/comparison_of_onair_demographics_of_news/,5,5,,1,Comparison of on-air demographics of news organizations,2020-12-0091.jpg,none,"media, news organizations, demographics"
"New Zealand election 2020, party vs candidate vote split (Interactive graph in article)",newphonedammit,2020-12-04 00:44:23,https://i.stuff.co.nz/national/politics/300173960/election-2020-how-new-zealand-split-its-votes--and-caused-two-upset-wins,https://www.reddit.com/r/dataisbeautiful/comments/k6abn0/new_zealand_election_2020_party_vs_candidate_vote/,4,4,,1,"New Zealand election 2020, party vs candidate vote split (Interactive graph in article)",2020-12-0092.jpg,none,"elections, voting, new zealand"
Dark Winter 2020 - Millions of Americans Expect to Lose Their Homes as COVID Rages [Bloomberg News],ConradKilroy,2020-12-05 00:42:19,https://www.bloomberg.com/news/articles/2020-11-23/millions-of-americans-expect-to-lose-their-homes-as-covid-rages,https://www.reddit.com/r/dataisbeautiful/comments/k6xiit/dark_winter_2020_millions_of_americans_expect_to/,13,13,,7,Dark Winter 2020 - Millions of Americans Expect to Lose Their Homes as COVID Rages Bloomberg News,2020-12-0102.jpg,none,"housing, covid-19, economy, united states"
"All Ships on Earth (every cyan dot is a vessel) overlaid on a political, physical, and population map [OC]",Ebardie,2020-12-07 19:38:16,https://i.redd.it/t8oxdmz2it361.jpg,https://www.reddit.com/r/dataisbeautiful/comments/k8npvt/all_ships_on_earth_every_cyan_dot_is_a_vessel/,36,36,,6,"All Ships on Earth (every cyan dot is a vessel) overlaid on a political, physical, and population map OC",2020-12-0158.jpg,none,"shipping, maritime, global, vessels, map, population, political boundaries"
Price fluctuations of a chessboard on Amazon before and after The queen's gambit,davidoff999,2020-12-07 20:38:43,https://www.joinhoney.com/shop/amazon/p/1_44cb0eb81148ed230147dd048cd75822_44cb0eb81148ed230147dd048cd75822#price-history,https://www.reddit.com/r/dataisbeautiful/comments/k8oxvf/price_fluctuations_of_a_chessboard_on_amazon/,6,6,,2,Price fluctuations of a chessboard on Amazon before and after The queen's gambit,2020-12-0161.jpg,none,"chess, board games, shopping, pricing, entertainment"
"[OC] I ""re-discovered"" the solar analemma in a 3D globe simulation",OmarShehata,2020-12-08 06:05:33,https://v.redd.it/hlk3dcx4mw361,https://www.reddit.com/r/dataisbeautiful/comments/k8yuh9/oc_i_rediscovered_the_solar_analemma_in_a_3d/,42,42,,3,OC I re-discovered the solar analemma in a 3D globe simulation,2020-12-0179.png,none,"astronomy, solar system, simulation, analemma, geography"
Audio-Visual Report of 2020 California Wildfires Data,Katy_AI,2020-12-08 16:11:08,https://www.macheye.com/blog/2020-California-wildfires-in-6-audio-visuals/,https://www.reddit.com/r/dataisbeautiful/comments/k9705b/audiovisual_report_of_2020_california_wildfires/,3,3,,0,Audio-Visual Report of 2020 California Wildfires Data,2020-12-0188.jpg,none,"wildfires, california, 2020, environment, natural disasters"
Lived-area and lived-population density: geo-regions w/ 99.7% of population,CuttingWithScissors,2020-12-08 17:06:30,https://community.wolfram.com/groups/-/m/t/2123980,https://www.reddit.com/r/dataisbeautiful/comments/k9845p/livedarea_and_livedpopulation_density_georegions/,1,1,,0,Lived-area and lived-population density geo-regions w 99.7% of population,2020-12-0189.jpg,none,none
BBC Covonavirus Flowers (Better With Sound On),andrewcooke,2020-12-08 20:33:21,https://www.bbc.co.uk/news/resources/idt-7464500a-6368-4029-aa41-ab94e0ee09fb,https://www.reddit.com/r/dataisbeautiful/comments/k9cdq7/bbc_covonavirus_flowers_better_with_sound_on/,2,2,,1,BBC Covonavirus Flowers (Better With Sound On),2020-12-0199.jpg,none,none
AI Whitepaper: Data Science Trends You’ll Benefit From in 2021-2022,Resolve_Sudden,2020-12-10 14:29:11,https://litslink.com/blog/data-science-trends-2021-2022-whitepaper,https://www.reddit.com/r/dataisbeautiful/comments/kag72g/ai_whitepaper_data_science_trends_youll_benefit/,1,1,,0,AI Whitepaper Data Science Trends You’ll Benefit From in 2021-2022,2020-12-0230.jpg,none,"ai, data science, trends, technology"
Median Household Income by County: 2015-2019,OverflowDs,2020-12-10 15:00:13,https://www.census.gov/library/visualizations/interactive/acs-median-household-income-2015-2019.html,https://www.reddit.com/r/dataisbeautiful/comments/kagqmm/median_household_income_by_county_20152019/,7,7,,2,Median Household Income by County 2015-2019,2020-12-0232.jpg,none,none
How the novel coronavirus has evolved,lnfinity,2020-12-11 14:00:48,https://graphics.reuters.com/HEALTH-CORONAVIRUS/EVOLUTION/yxmpjqkdzvr/index.html,https://www.reddit.com/r/dataisbeautiful/comments/kb3arh/how_the_novel_coronavirus_has_evolved/,8,8,,1,How the novel coronavirus has evolved,2020-12-0246.jpg,none,"coronavirus, evolution, health, virology, biology"
Attaching meaning to digital data. Data annotation/labeling explained and shown,OnlyProggingForFun,2020-12-12 14:07:57,https://medium.com/what-is-artificial-intelligence/building-datasets-for-your-ai-acd468cffb7d,https://www.reddit.com/r/dataisbeautiful/comments/kbpnhj/attaching_meaning_to_digital_data_data/,4,4,,0,Attaching meaning to digital data. Data annotationlabeling explained and shown,2020-12-0266.jpg,none,"data annotation, digital data, technology, machine learning"
A look at the cumulative amount of microscopic pieces of plastic we consume over time.,itsaride,2020-12-12 20:48:47,https://twitter.com/Reuters/status/1337849709004615682,https://www.reddit.com/r/dataisbeautiful/comments/kbwnb2/a_look_at_the_cumulative_amount_of_microscopic/,22,22,,3,A look at the cumulative amount of microscopic pieces of plastic we consume over time.,2020-12-0276.jpg,none,"pollution, environment, consumption, plastics"
Percentage of People in Poverty by County: 2015-2019,OverflowDs,2020-12-14 16:04:11,https://www.census.gov/library/visualizations/interactive/acs-percentage-poverty-2015-2019.html,https://www.reddit.com/r/dataisbeautiful/comments/kd0duv/percentage_of_people_in_poverty_by_county_20152019/,5,5,,3,Percentage of People in Poverty by County 2015-2019,2020-12-0309.jpg,none,none
United States - Stream order visualization [OC],shadedrelief,2020-12-14 22:22:01,https://i.redd.it/3utikmq0a8561.jpg,https://www.reddit.com/r/dataisbeautiful/comments/kd82iy/united_states_stream_order_visualization_oc/,185,185,,22,United States - Stream order visualization OC,2020-12-0323.jpg,none,none
Beton dökerken miksere su katılması faciaya neden oluyor…,kunt312,2020-12-15 08:16:03,http://www.zararlarinelerdir.com/beton-dokerken-miksere-su-katilmasi-faciaya-neden-oluyor/,https://www.reddit.com/r/dataisbeautiful/comments/kdhslo/beton_dökerken_miksere_su_katılması_faciaya_neden/,0,0,,0,Beton dökerken miksere su katılması faciaya neden oluyor…,2020-12-0332.jpg,none,"construction, concrete, safety"
[OC] I made a short movie using GOES-17 data to look at some forest fires near my hometown (red dot),ReyKLark,2020-12-16 22:15:55,https://v.redd.it/ahwyeh3oim561,https://www.reddit.com/r/dataisbeautiful/comments/kejdb9/oc_i_made_a_short_movie_using_goes17_data_to_look/,24,24,,3,OC I made a short movie using GOES-17 data to look at some forest fires near my hometown (red dot),2020-12-0366.png,none,"forest fires, satellite data, goes-17, natural disasters, environment"
Where do you stand in the vaccine line?,Theman7959,2020-12-16 23:16:46,https://www.nytimes.com/interactive/2020/12/03/opinion/covid-19-vaccine-timeline.html,https://www.reddit.com/r/dataisbeautiful/comments/kekm6a/where_do_you_stand_in_the_vaccine_line/,0,0,,7,Where do you stand in the vaccine line,2020-12-0367.jpg,none,"vaccination, healthcare, prioritization, covid-19, pandemic, public health"
A visualization of how the deep dream machine learning program works. Blending hogwarts and starry night. [oc],linux-nerd,2020-12-17 01:26:37,https://v.redd.it/khgfd55lgn561,https://www.reddit.com/r/dataisbeautiful/comments/ken16k/a_visualization_of_how_the_deep_dream_machine/,883,883,,40,A visualization of how the deep dream machine learning program works. Blending hogwarts and starry night. oc,2020-12-0370.png,none,"machine learning, art, deep learning, neural networks, style transfer"
Here's How Much Money You Need to Earn in Each State to Afford a Home,chankalo,2020-12-17 18:23:04,https://twitter.com/bassaidinc/status/1339636818329956357,https://www.reddit.com/r/dataisbeautiful/comments/kf2yki/heres_how_much_money_you_need_to_earn_in_each/,0,0,,3,Here's How Much Money You Need to Earn in Each State to Afford a Home,2020-12-0384.jpg,none,none
COVID19 Interactive Data Visualization by Googlr,Gregan32,2020-12-17 23:06:25,https://news.google.com/covid19/map?hl=en-CA&gl=CA&ceid=CA%3Aen&fbclid=IwAR3wqrg5LmBqYt3ZoUuhCGHIbH9SKCCWmIHB7t1qMvVsjrSk5kxHYnT3hdg,https://www.reddit.com/r/dataisbeautiful/comments/kf8l6d/covid19_interactive_data_visualization_by_googlr/,1,1,,1,COVID19 Interactive Data Visualization by Googlr,2020-12-0392.jpg,none,none
"[OC] The Mandalorian Season 1 episodes displayed as disks, the first frame is the border of the disk, the ending credits at the center",Pataclop_fr,2020-12-18 10:54:01,https://i.redd.it/zsv6p2htex561.jpg,https://www.reddit.com/r/dataisbeautiful/comments/kfj16c/oc_the_mandalorian_season_1_episodes_displayed_as/,35063,35063,,534,"OC The Mandalorian Season 1 episodes displayed as disks, the first frame is the border of the disk, the ending credits at the center",2020-12-0401.jpg,none,"entertainment, television, science fiction, the mandalorian, visual art"
[OC] Reconstruction of brain's white matter connections with DTI using Diffusion-weighted magnetic resonance imaging,Filondepoulet,2020-12-19 05:14:43,https://i.redd.it/uyia2ix7u2661.png,https://www.reddit.com/r/dataisbeautiful/comments/kg1u86/oc_reconstruction_of_brains_white_matter/,173,173,,7,OC Reconstruction of brain's white matter connections with DTI using Diffusion-weighted magnetic resonance imaging,2020-12-0416.png,none,"neuroscience, brain, dti, mri, medical imaging"
[OC] Animation of Daily-Deaths Due to COVID-19 in Indonesia + Prediction of the Next 42 Days using the ARIMA model,hendra64,2020-12-20 12:41:06,https://v.redd.it/lr4k152j7c661,https://www.reddit.com/r/dataisbeautiful/comments/kgtdbe/oc_animation_of_dailydeaths_due_to_covid19_in/,5,5,,4,OC Animation of Daily-Deaths Due to COVID-19 in Indonesia + Prediction of the Next 42 Days using the ARIMA model,2020-12-0435.png,none,"covid-19, indonesia, predictions, health, data analysis"
