title,author,created_date,url,full_permalink,score,ups,downs,num_comments,sanitized_title,image_file,chart_type,high_level_categories
[OC] ..so I upscaled a transparent 2px²,Timmaaa_xD,2021-12-02 20:12:04,https://i.imgur.com/2jWGiDM.jpg,https://www.reddit.com/r/dataisbeautiful/comments/r7g514/oc_so_i_upscaled_a_transparent_2px²/,30,30,,22,OC ..so I upscaled a transparent 2px²,2021-12-0018.jpg,none,"pixel art, upscaling, digital graphics"
Weekly U.S. Influenza Surveillance Report,mynameismy111,2021-12-05 07:16:02,https://www.cdc.gov/flu/weekly/index.htm#PublicHealthLaboratories,https://www.reddit.com/r/dataisbeautiful/comments/r9a7fj/weekly_us_influenza_surveillance_report/,12,12,,0,Weekly U.S. Influenza Surveillance Report,2021-12-0042.jpg,none,"health, influenza, surveillance, report, u.s."
[OC] I've created the average CryptoPunk from the original 10k images (Source code in comments),CashewalGuy,2021-12-06 01:12:54,https://v.redd.it/zao2022tot381,https://www.reddit.com/r/dataisbeautiful/comments/r9uoeq/oc_ive_created_the_average_cryptopunk_from_the/,2199,2199,,219,OC I've created the average CryptoPunk from the original 10k images (Source code in comments),2021-12-0046.png,none,"art, digital art, cryptopunk, nft"
Visualizing Complexity: Modular Information Design Handbook,yaaydh,2021-12-06 08:52:22,https://www.kickstarter.com/projects/superdot-studio/visualizing-complexity-modular-information-design-handbook,https://www.reddit.com/r/dataisbeautiful/comments/ra2tq9/visualizing_complexity_modular_information_design/,13,13,,4,Visualizing Complexity Modular Information Design Handbook,2021-12-0048.jpg,none,"design, complexity, information design, handbook"
"Pre-pandemic numbers are finally returning! Hopefully, Omicron doesn't impact this (source: Bloomberg)",weareartickl,2021-12-06 10:46:14,https://www.aljazeera.com/economy/2021/12/3/canadas-job-market-blows-past-estimates-quadrupling-gains,https://www.reddit.com/r/dataisbeautiful/comments/ra4iz4/prepandemic_numbers_are_finally_returning/,4,4,,0,"Pre-pandemic numbers are finally returning! Hopefully, Omicron doesn't impact this (source Bloomberg)",2021-12-0050.jpg,none,none
"Chicago Crime, Murder &amp; Mayhem | Criminal Infographics | HeyJackass!",greyseal494,2021-12-07 17:56:24,https://heyjackass.com/,https://www.reddit.com/r/dataisbeautiful/comments/rb4pxo/chicago_crime_murder_amp_mayhem_criminal/,7,7,,3,"Chicago Crime, Murder &amp; Mayhem Criminal Infographics HeyJackass!",2021-12-0075.jpg,none,"crime, chicago, illustration, violence"
Rising Container Prices: Rates have jumped more than fourfold in two years,HenryCorp,2021-12-08 15:04:50,https://www.bloomberg.com/news/articles/2021-12-01/maersk-heading-for-record-profits-gives-80-million-to-employees,https://www.reddit.com/r/dataisbeautiful/comments/rbtagl/rising_container_prices_rates_have_jumped_more/,5,5,,0,Rising Container Prices Rates have jumped more than fourfold in two years,2021-12-0084.jpg,none,"shipping, containers, trade, economy, logistics"
Omicron variant and other major or previous variants of concern of SARS-CoV-2 depicted in a tree scaled radially by genetic distance,Stone_Bucket,2021-12-08 22:33:21,https://en.wikipedia.org/wiki/SARS-CoV-2_Omicron_variant#/media/File:Omicron_SARS-CoV-2_radial_distance_tree_2021-Dec-01.svg,https://www.reddit.com/r/dataisbeautiful/comments/rc2tcr/omicron_variant_and_other_major_or_previous/,123,123,,4,Omicron variant and other major or previous variants of concern of SARS-CoV-2 depicted in a tree scaled radially by genetic distance,2021-12-0089.jpg,none,none
NASA Visualization of 2021 Hurricane Season through September,DenofBlerds,2021-12-09 14:47:04,https://cybercoastal.com/nasa-visualization-of-2021-hurricane-season-through-september/,https://www.reddit.com/r/dataisbeautiful/comments/rcj62r/nasa_visualization_of_2021_hurricane_season/,2,2,,0,NASA Visualization of 2021 Hurricane Season through September,2021-12-0109.jpg,none,"nasa, hurricanes, weather, 2021, climate, natural disasters"
IPO’s Of Indian Stock Market (2010–2021) Data Visualization and Analysis In Python,call_me_ninza,2021-12-10 14:39:57,https://ninza7.medium.com/ipos-of-indian-stock-market-2010-2021-data-visualization-and-analysis-in-python-1a680f466a42,https://www.reddit.com/r/dataisbeautiful/comments/rda301/ipos_of_indian_stock_market_20102021_data/,0,0,,0,IPO’s Of Indian Stock Market (2010–2021) Data Visualization and Analysis In Python,2021-12-0129.jpg,none,"stock market, ipo, india, finance, data analysis, python"
Stephen Curry’s remarkable rise to three-point king,davidbauer,2021-12-10 15:04:39,https://www.washingtonpost.com/sports/interactive/2021/stephen-curry-three-point-record/,https://www.reddit.com/r/dataisbeautiful/comments/rdalry/stephen_currys_remarkable_rise_to_threepoint_king/,4,4,,3,Stephen Curry’s remarkable rise to three-point king,2021-12-0131.jpg,none,"basketball, sports, achievements, athletes"
[OC] Visual proof that the covid-19 vaccine works. Percentage of people fully vaccinated vs percentage of people in hospitals fully vaccinated.,PieChartPirate,2021-12-11 14:40:07,https://v.redd.it/3a9tmhg6dx481,https://www.reddit.com/r/dataisbeautiful/comments/re13xw/oc_visual_proof_that_the_covid19_vaccine_works/,3626,3626,,637,OC Visual proof that the covid-19 vaccine works. Percentage of people fully vaccinated vs percentage of people in hospitals fully vaccinated.,2021-12-0139.png,none,"health, covid-19, vaccination"
[OC] My team build a tool to predict the odds of a drug test,DaDaDaonald,2021-12-13 17:46:53,https://communitylawfirm.com/drug-test-prediction-calculator,https://www.reddit.com/r/dataisbeautiful/comments/rflgms/oc_my_team_build_a_tool_to_predict_the_odds_of_a/,0,0,,2,OC My team build a tool to predict the odds of a drug test,2021-12-0168.jpg,none,"science, research, laboratory, drug testing"
Canada Has The Biggest Gap Between Real Estate Prices and Incomes In The G7,KanataCitizen,2021-12-13 23:19:15,https://betterdwelling.com/canada-has-the-biggest-gap-between-real-estate-prices-and-incomes-in-the-g7/,https://www.reddit.com/r/dataisbeautiful/comments/rft5fb/canada_has_the_biggest_gap_between_real_estate/,84,84,,30,Canada Has The Biggest Gap Between Real Estate Prices and Incomes In The G7,2021-12-0173.jpg,none,"real estate, canada, economy"
Dutch Water Consumption During Formula 1 Finale - Royal HaskoningDHV Digital on LinkedIn,datamancer_de,2021-12-14 14:45:27,https://www.linkedin.com/posts/royal-haskoningdhv-digital_worldchampion-verstappen-maxverstappeneffect-activity-6876194002052411392-heHL,https://www.reddit.com/r/dataisbeautiful/comments/rg8z2p/dutch_water_consumption_during_formula_1_finale/,10,10,,1,Dutch Water Consumption During Formula 1 Finale - Royal HaskoningDHV Digital on LinkedIn,2021-12-0178.jpg,none,none
Madison Real Estate prices,aazo11,2021-12-14 20:00:16,https://madison.com/news/state-and-regional/real-estate-update-13-charts-that-show-the-state-of-the-housing-market-in-madison/article_4284fa7e-1c9e-5e28-a7b9-b7345f1c53a8.html,https://www.reddit.com/r/dataisbeautiful/comments/rgfv1m/madison_real_estate_prices/,7,7,,4,Madison Real Estate prices,2021-12-0184.jpg,none,"real estate, madison, housing market"
[OC] North America Topological Line Plot,Kuchenkiller,2021-12-16 22:06:01,https://github.com/kuchenkiller/TopologyLinePlotMap/blob/main/Topology/NAmericaHightProfile.pdf,https://www.reddit.com/r/dataisbeautiful/comments/ri1i3z/oc_north_america_topological_line_plot/,3,3,,4,OC North America Topological Line Plot,2021-12-0211.jpg,none,none
Mont Blanc: Highest Point in Western Europe [OC],Julian_H0ffmann,2021-12-21 14:03:47,https://i.redd.it/4pghshq5jw681.png,https://www.reddit.com/r/dataisbeautiful/comments/rlfciy/mont_blanc_highest_point_in_western_europe_oc/,47,47,,7,Mont Blanc Highest Point in Western Europe OC,2021-12-0270.png,none,"geography, mont blanc, mountains, western europe, france, italy"
Top Google Searches by State (US),bigdog_00,2021-12-22 22:00:20,https://thenewpaper.co/candy/88b930d222754429949caab519220d48,https://www.reddit.com/r/dataisbeautiful/comments/rmfx8b/top_google_searches_by_state_us/,2,2,,0,Top Google Searches by State (US),2021-12-0293.jpg,none,none
[OC] A live map of every active MTA subway car in NYC,stevewezzz,2021-12-22 22:17:36,https://i.redd.it/qjk20ss856781.jpg,https://www.reddit.com/r/dataisbeautiful/comments/rmgabz/oc_a_live_map_of_every_active_mta_subway_car_in/,5467,5467,,156,OC A live map of every active MTA subway car in NYC,2021-12-0294.jpg,none,"nyc, subway, transportation, map, technology"
2021: The year in charts from McKinsey,nopantstoday,2021-12-22 22:29:00,https://www.mckinsey.com/featured-insights/2021-year-in-review/2021-the-year-in-charts,https://www.reddit.com/r/dataisbeautiful/comments/rmgirf/2021_the_year_in_charts_from_mckinsey/,6,6,,1,2021 The year in charts from McKinsey,2021-12-0295.jpg,none,none
Optimal Shipping Routes to Avoid Zooplankton,margarita4uz,2021-12-22 22:48:21,https://storymaps.arcgis.com/stories/8272f2290af04c94b1eb0fba5fc65f09,https://www.reddit.com/r/dataisbeautiful/comments/rmgws7/optimal_shipping_routes_to_avoid_zooplankton/,14,14,,2,Optimal Shipping Routes to Avoid Zooplankton,2021-12-0296.jpg,none,none
"Hi, I'm Washington Post journalist Philip Bump. I use data and graphs to cover the news. Ask me anything!",washingtonpost,2021-12-23 16:03:47,https://www.reddit.com/r/dataisbeautiful/comments/rmysos/hi_im_washington_post_journalist_philip_bump_i/,https://www.reddit.com/r/dataisbeautiful/comments/rmysos/hi_im_washington_post_journalist_philip_bump_i/,78,78,,50,"Hi, I'm Washington Post journalist Philip Bump. I use data and graphs to cover the news. Ask me anything!",2021-12-0310.jpg,none,"journalism, data, news, washington post"
Judgment day: Sweden vindicated,greyseal494,2021-12-25 17:34:39,https://swprs.org/judgment-day-sweden-vindicated/,https://www.reddit.com/r/dataisbeautiful/comments/rodu0x/judgment_day_sweden_vindicated/,0,0,,20,Judgment day Sweden vindicated,2021-12-0328.jpg,none,none
[OC] Top 50 Cryptocurrencies by Market Cap,PieChartPirate,2021-12-27 12:26:21,https://v.redd.it/hfnv4lkaw2881,https://www.reddit.com/r/dataisbeautiful/comments/rpmgtp/oc_top_50_cryptocurrencies_by_market_cap/,296,296,,19,OC Top 50 Cryptocurrencies by Market Cap,2021-12-0346.png,none,"cryptocurrencies, market cap, finance"
Topography map of Germany. Colours correspond to the national flag [OC],symmy546,2021-12-28 22:54:04,https://i.redd.it/m3clvk765d881.png,https://www.reddit.com/r/dataisbeautiful/comments/rqs37u/topography_map_of_germany_colours_correspond_to/,3648,3648,,96,Topography map of Germany. Colours correspond to the national flag OC,2021-12-0376.png,none,"geography, topography, germany, maps"
All the European Union electricity sources in 2021.,Gadac,2021-12-30 10:53:19,https://energy-charts.info/charts/energy/chart.htm?l=en&c=EU&year=2021&interval=year&stacking=grouped&legendItems=0011111111101111111110,https://www.reddit.com/r/dataisbeautiful/comments/rrz30j/all_the_european_union_electricity_sources_in_2021/,13,13,,2,All the European Union electricity sources in 2021.,2021-12-0392.jpg,none,"energy, electricity, europe, european union, 2021"
Why You Need to Tell a Story With Your Data,radiant_mongoose_93,2021-12-30 14:46:02,https://medium.com/bamieh-tech/why-you-should-tell-a-story-with-your-data-a99bcb908262,https://www.reddit.com/r/dataisbeautiful/comments/rs3f39/why_you_need_to_tell_a_story_with_your_data/,32,32,,5,Why You Need to Tell a Story With Your Data,2021-12-0394.jpg,none,"storytelling, data, communication"
"[OC] This journey through ""one trillion views of Minecraft videos"" is an exploration of popular YouTube Minecraft creators, videos, and video formats over since its inception.",erpettie,2021-12-30 20:49:56,https://www.youtube.com/trends/articles/minecraft-trillion/,https://www.reddit.com/r/dataisbeautiful/comments/rsbth6/oc_this_journey_through_one_trillion_views_of/,21,21,,2,"OC This journey through one trillion views of Minecraft videos is an exploration of popular YouTube Minecraft creators, videos, and video formats over",2021-12-0403.jpg,none,"minecraft, youtube, creators, videos, gaming"
100 Beautiful and Informative Notebooks of 2021,tlarkworthy,2021-12-31 10:48:18,https://dev.to/tomlarkworthy/100-beautiful-and-informative-notebooks-of-2021-23lg,https://www.reddit.com/r/dataisbeautiful/comments/rsrcyf/100_beautiful_and_informative_notebooks_of_2021/,2,2,,0,100 Beautiful and Informative Notebooks of 2021,2021-12-0411.jpg,none,"data visualization, notebooks, technology, 2021"
Greenhouse gas emissions per kilogram of food product,hvfnstrmngthcstl,2021-12-31 22:53:12,https://ourworldindata.org/explorers/food-footprints?facet=none&country=Bananas~Beef+%28beef+herd%29~Beef+%28dairy+herd%29~Cheese~Eggs~Lamb+%26+Mutton~Milk~Maize~Nuts~Pig+Meat~Peas~Potatoes~Poultry+Meat~Rice~Tomatoes~Wheat+%26+Rye~Tofu+%28soybeans%29~Prawns+%28farmed%29~Apples~Barley~Beet+Sugar~Berries+%26+Grapes~Brassicas~Cane+Sugar~Cassava~Citrus+Fruit~Coffee~Dark+Chocolate~Fish+%28farmed%29~Groundnuts~Oatmeal~Onions+%26+Leeks~Other+Fruit~Other+Pulses~Other+Vegetables~Root+Vegetables~Soymilk~Wine&Environmental+impact=Carbon+footprint&Metric=Per+kilogram&By+stage+of+supply+chain=false,https://www.reddit.com/r/dataisbeautiful/comments/rt5ee5/greenhouse_gas_emissions_per_kilogram_of_food/,23,23,,11,Greenhouse gas emissions per kilogram of food product,2021-12-0422.jpg,none,"environment, food, data, emissions, climate change"
