title,author,created_date,url,full_permalink,score,ups,downs,num_comments,sanitized_title,image_file,chart_type,high_level_categories
"[OC] Look At Yourself, Data! You're Beautiful!",FillsYourNiche,2022-04-01 17:07:19,https://i.redd.it/zlp4ds4z8yq81.jpg,https://www.reddit.com/r/dataisbeautiful/comments/ttvvw4/oc_look_at_yourself_data_youre_beautiful/,55,55,,2,"OC Look At Yourself, Data! You're Beautiful!",2022-04-0002.jpg,none,"science fiction, television, characters"
How Sharing a Bed Changed My Sleep Data [OC],sdurx,2022-04-03 15:45:22,http://www.thedurkweb.com/how-sharing-a-bed-with-my-girlfriend-changed-my-sleep-2/,https://www.reddit.com/r/dataisbeautiful/comments/tvc7ak/how_sharing_a_bed_changed_my_sleep_data_oc/,26,26,,8,How Sharing a Bed Changed My Sleep Data OC,2022-04-0023.jpg,none,none
Fifty years of Scottish baby naming data,L_A_Kelly,2022-04-03 19:21:06,https://www.thecourier.co.uk/fp/courier-investigations/3135287/baby-names-scotland/,https://www.reddit.com/r/dataisbeautiful/comments/tvhbtx/fifty_years_of_scottish_baby_naming_data/,6,6,,0,Fifty years of Scottish baby naming data,2022-04-0028.jpg,none,"names, scotland, history, demographics"
Interactive globe: Where earth will become “uninhabitable” in 2100 - Funke Interaktiv [OC],Detektiv_Mittens,2022-04-04 14:36:04,https://v.redd.it/ev4b72dawir81,https://www.reddit.com/r/dataisbeautiful/comments/tw3k99/interactive_globe_where_earth_will_become/,8564,8564,,683,Interactive globe Where earth will become “uninhabitable” in 2100 - Funke Interaktiv OC,2022-04-0034.png,none,"climate change, environment, future, geography, global warming"
Birds impacted by 2022 Highly Pathogenic Avian Influenza--Top 12 states,HenryCorp,2022-04-05 08:11:59,https://www.mprnews.org/story/2022/04/04/avian-flu-continues-to-spread-to-more-minnesota-poultry-flocks,https://www.reddit.com/r/dataisbeautiful/comments/twpy7l/birds_impacted_by_2022_highly_pathogenic_avian/,4,4,,0,Birds impacted by 2022 Highly Pathogenic Avian Influenza--Top 12 states,2022-04-0045.jpg,none,none
Independent researcher taps into the Reonomy database to create an interactive map that ties almost 16K properties to a single entity that likely owns the most valuable private real estate portfolio in the US,Chino_Blanco,2022-04-05 17:44:16,https://www.truthandtransparency.org/news/2022/04/05/lds-church-has-most-valuable-private-real-estate-portfolio-in-the-us-evidence-suggests/,https://www.reddit.com/r/dataisbeautiful/comments/tx0lht/independent_researcher_taps_into_the_reonomy/,146,146,,17,Independent researcher taps into the Reonomy database to create an interactive map that ties almost 16K properties to a single entity that likely owns,2022-04-0056.jpg,none,"real estate, property, ownership, database, us"
[OC] Full r/place timelapse with changes highlighted,WoodpeckerBeautiful8,2022-04-06 14:45:28,https://v.redd.it/c75uuobm7xr81,https://www.reddit.com/r/dataisbeautiful/comments/txnsym/oc_full_rplace_timelapse_with_changes_highlighted/,1021,1021,,73,OC Full rplace timelapse with changes highlighted,2022-04-0071.png,none,"internet, collaboration, creativity, art, reddit"
Where Counties are Growing,jeffsmith202,2022-04-06 16:58:20,https://www.census.gov/library/visualizations/2022/comm/where-counties-are-growing.html,https://www.reddit.com/r/dataisbeautiful/comments/txqrdn/where_counties_are_growing/,9,9,,1,Where Counties are Growing,2022-04-0074.jpg,none,none
Where Did the Most People Work From Home During the Pandemic?,goudadaysir,2022-04-06 22:00:26,https://www.financialforce.com/library/where-did-most-people-work-from-home-during-pandemic/,https://www.reddit.com/r/dataisbeautiful/comments/txxh1e/where_did_the_most_people_work_from_home_during/,0,0,,1,Where Did the Most People Work From Home During the Pandemic,2022-04-0076.jpg,none,"remote work, pandemic, employment, trends"
Average Color of Each Pixel in r/place [OC],Rwbaker16,2022-04-07 08:08:19,https://i.redd.it/vmlfzmx4e2s81.png,https://www.reddit.com/r/dataisbeautiful/comments/ty86cw/average_color_of_each_pixel_in_rplace_oc/,1533,1533,,113,Average Color of Each Pixel in rplace OC,2022-04-0082.png,none,"art, internet culture, community"
"Attacking the Wheels vs Doors debate with machine learning. Through my job, I have access to a database with 100mil+ products, I’ve trained a machine learning model to predict how many wheels and doors are in all these products.",spuk2002,2022-04-07 12:10:30,https://www.soleadify.com/a-big-data-companys-approach-to-wheels-vs-doors/,https://www.reddit.com/r/dataisbeautiful/comments/tybo8x/attacking_the_wheels_vs_doors_debate_with_machine/,111,111,,37,"Attacking the Wheels vs Doors debate with machine learning. Through my job, I have access to a database with 100mil+ products, I’ve trained a machine",2022-04-0087.jpg,none,"machine learning, products, debate, prediction, wheels, doors"
Microsoft Duo batterygate? [OC],gateskeeperbill,2022-04-08 15:47:59,https://i.redd.it/k4av6fb8tbs81.jpg,https://www.reddit.com/r/dataisbeautiful/comments/tz6ht0/microsoft_duo_batterygate_oc/,0,0,,6,Microsoft Duo batterygate OC,2022-04-0107.jpg,none,"technology, battery, microsoft, device performance"
"Place map of the unused pixels (no user placed a pixel at these spots) Now, hopefully in a format that shows as an image, and not a video. [OC]",Fazaman,2022-04-08 22:29:05,https://i.imgur.com/eOemjUw.png,https://www.reddit.com/r/dataisbeautiful/comments/tzf2b6/place_map_of_the_unused_pixels_no_user_placed_a/,36,36,,3,"Place map of the unused pixels (no user placed a pixel at these spots) Now, hopefully in a format that shows as an image, and not a video. OC",2022-04-0114.png,none,none
r/place data visualization gone wrong [OC],Enough_Writing4415,2022-04-09 08:26:50,https://i.redd.it/7accl0tdrgs81.png,https://www.reddit.com/r/dataisbeautiful/comments/tzov1s/rplace_data_visualization_gone_wrong_oc/,0,0,,2,rplace data visualization gone wrong OC,2022-04-0120.png,none,"data visualization, r/place, art, graphics"
Graphing the last 8 Hours of mogus on r/place with timelapse [OC],CalebMarting,2022-04-10 15:24:31,https://v.redd.it/ylka94amyps81,https://www.reddit.com/r/dataisbeautiful/comments/u0jusa/graphing_the_last_8_hours_of_mogus_on_rplace_with/,6,6,,1,Graphing the last 8 Hours of mogus on rplace with timelapse OC,2022-04-0126.png,none,"r/place, reddit, internet culture, online communities, digital art"
Tobacco taxes,raphiredgi,2022-04-10 18:49:51,https://www.businessinsider.com/price-pack-of-cigarettes-around-the-world-2012-10?amp,https://www.reddit.com/r/dataisbeautiful/comments/u0o625/tobacco_taxes/,0,0,,3,Tobacco taxes,2022-04-0128.jpg,none,"tobacco, taxes, public health"
Happiness in the Rough,ohmylanta88,2022-04-10 23:48:37,https://docs.google.com/forms/d/e/1FAIpQLSeWGzDdTzwgIN4pCMXkNgIUI4AJU1KgFmiD2xDrppIwW1mZjA/viewform?usp=sf_link,https://www.reddit.com/r/dataisbeautiful/comments/u0ubzp/happiness_in_the_rough/,1,1,,0,Happiness in the Rough,2022-04-0131.jpg,none,"survey, happiness, wellbeing, identity"
Time lapse of earth at night shows density of electrified human populations by latitude. [OC],mattparrilla,2022-04-11 13:44:39,https://i.redd.it/ab6h52fflws81.jpg,https://www.reddit.com/r/dataisbeautiful/comments/u183wr/time_lapse_of_earth_at_night_shows_density_of/,2165,2165,,40,Time lapse of earth at night shows density of electrified human populations by latitude. OC,2022-04-0141.jpg,none,"earth, night, human populations, latitude, electrification"
Household Debt and Credit Report - FEDERAL RESERVE BANK of NEW YORK,hahaha01357,2022-04-11 15:14:40,https://www.newyorkfed.org/microeconomics/hhdc,https://www.reddit.com/r/dataisbeautiful/comments/u1a1z5/household_debt_and_credit_report_federal_reserve/,0,0,,1,Household Debt and Credit Report - FEDERAL RESERVE BANK of NEW YORK,2022-04-0144.jpg,none,"finance, economics, debt, credit, federal reserve, new york"
"[OC] The impact of bots on /r/place - users that posted at least every 15 minutes for over 16 hours accounted for 8,634,785 places. This shows the most placed colour by bots at each location.",danielgriffin13,2022-04-11 16:36:59,https://i.redd.it/nzkvevqnfxs81.png,https://www.reddit.com/r/dataisbeautiful/comments/u1btsb/oc_the_impact_of_bots_on_rplace_users_that_posted/,21707,21707,,1479,"OC The impact of bots on rplace - users that posted at least every 15 minutes for over 16 hours accounted for 8,634,785 places. This shows the most pl",2022-04-0146.png,none,"bots, reddit, /r/place, technology, user activity"
A detailed shaded relief map of Seattle rendered from Lidar data [OC],visualgeomatics,2022-04-12 12:45:53,https://i.redd.it/eoeqx0y8g3t81.jpg,https://www.reddit.com/r/dataisbeautiful/comments/u1y94f/a_detailed_shaded_relief_map_of_seattle_rendered/,22612,22612,,381,A detailed shaded relief map of Seattle rendered from Lidar data OC,2022-04-0156.jpg,none,"seattle, topography, geography, lidar, urban planning"
"[OC] Consecutive pixels by same user on /r/Place - A different, more conservative approach for studying the impact of bots and minimize false positives",TitanicZero,2022-04-12 19:37:57,https://v.redd.it/eed99ajph5t81,https://www.reddit.com/r/dataisbeautiful/comments/u27gkg/oc_consecutive_pixels_by_same_user_on_rplace_a/,5,5,,2,"OC Consecutive pixels by same user on rPlace - A different, more conservative approach for studying the impact of bots and minimize false positives",2022-04-0167.png,none,"reddit, bots, data analysis, visualization, internet culture"
[OC] How to play common chords on guitar,fretflip,2022-04-14 14:11:57,https://i.redd.it/1i6uc22g5it81.png,https://www.reddit.com/r/dataisbeautiful/comments/u3iggi/oc_how_to_play_common_chords_on_guitar/,13,13,,16,OC How to play common chords on guitar,2022-04-0194.png,none,"music, guitar, chords, tutorial"
How much oil does Saudi Arabia have and why is it diversifying?,Educational-Green-64,2022-04-16 02:10:59,https://insightsartist.com/much-oil-saudi-arabia-diversifying/,https://www.reddit.com/r/dataisbeautiful/comments/u4nl0w/how_much_oil_does_saudi_arabia_have_and_why_is_it/,3,3,,7,How much oil does Saudi Arabia have and why is it diversifying,2022-04-0215.jpg,none,"oil, energy, diversification, saudi arabia, united states, economy"
NBA shot leaders by distance to the basket,IshyMoose,2022-04-16 19:22:23,https://twitter.com/crumpledjumper/status/1515134509850669056?s=21&t=IrSJOGz78ZOlcdNUVLKvow,https://www.reddit.com/r/dataisbeautiful/comments/u553p5/nba_shot_leaders_by_distance_to_the_basket/,26,26,,2,NBA shot leaders by distance to the basket,2022-04-0220.jpg,none,"basketball, nba, sports, scoring, performance analysis"
Factbox: How much oil does the European Union import from Russia?,jeffsmith202,2022-04-17 02:17:36,https://www.reuters.com/world/europe/how-much-oil-does-european-union-import-russia-2022-04-06/,https://www.reddit.com/r/dataisbeautiful/comments/u5d4a9/factbox_how_much_oil_does_the_european_union/,27,27,,12,Factbox How much oil does the European Union import from Russia,2022-04-0221.jpg,none,"oil, energy, trade, europe, russia"
[OC] A Brief History of the Yield Curve (Interest Rates),Janman14,2022-04-18 13:17:57,https://v.redd.it/kf4sb1t0fau81,https://www.reddit.com/r/dataisbeautiful/comments/u6cyg3/oc_a_brief_history_of_the_yield_curve_interest/,1213,1213,,43,OC A Brief History of the Yield Curve (Interest Rates),2022-04-0231.png,none,none
NBA Scoring Leaders by Distance,spoonifur,2022-04-19 03:19:55,https://twitter.com/CrumpledJumper/status/1515134509850669056?t=ticTtQtwXBDDmDf-w8xMLw&s=19,https://www.reddit.com/r/dataisbeautiful/comments/u6vc3n/nba_scoring_leaders_by_distance/,10,10,,5,NBA Scoring Leaders by Distance,2022-04-0243.jpg,none,"nba, basketball, scoring, sports, performance analysis"
All of my gaming characters. [OC],PopuIus,2022-04-19 04:40:55,https://github.com/p145085/my_characters/blob/main/20sakerattg%C3%B6ra,https://www.reddit.com/r/dataisbeautiful/comments/u6wsoj/all_of_my_gaming_characters_oc/,0,0,,6,All of my gaming characters. OC,2022-04-0244.jpg,none,"gaming, characters, roleplaying"
The $800 Million Powerball Jackpot Is A Stat Nerd Dream Come True | FiveThirtyEight,yangxia__china,2022-04-21 08:45:14,https://fivethirtyeight.com/features/powerball-jackpot-800-million-odds/?ex_cid=538fb,https://www.reddit.com/r/dataisbeautiful/comments/u8iz03/the_800_million_powerball_jackpot_is_a_stat_nerd/,0,0,,0,The $800 Million Powerball Jackpot Is A Stat Nerd Dream Come True FiveThirtyEight,2022-04-0264.jpg,none,"lottery, gambling, economics, society, statistics"
WIDE Education Inequalities,Horacemen,2022-04-21 15:01:35,https://www.education-inequalities.org/indicators/eduout_prim#ageGroup=%22eduout_prim%22&countries=%5B%22BDI%22%2C%22BEN%22%2C%22BFA%22%2C%22CAF%22%2C%22CIV%22%2C%22CMR%22%2C%22COD%22%2C%22COG%22%2C%22COM%22%2C%22ETH%22%2C%22GAB%22%2C%22GHA%22%2C%22GIN%22%2C%22GMB%22%2C%22GNB%22%2C%22KEN%22%2C%22LBR%22%2C%22LSO%22%2C%22MDG%22%2C%22MLI%22%2C%22MOZ%22%2C%22MRT%22%2C%22MWI%22%2C%22NAM%22%2C%22NER%22%2C%22NGA%22%2C%22RWA%22%2C%22SEN%22%2C%22SLE%22%2C%22SOM%22%2C%22SSD%22%2C%22STP%22%2C%22SWZ%22%2C%22TCD%22%2C%22TGO%22%2C%22TZA%22%2C%22UGA%22%2C%22ZAF%22%2C%22ZMB%22%2C%22ZWE%22%5D,https://www.reddit.com/r/dataisbeautiful/comments/u8plsv/wide_education_inequalities/,1,1,,1,WIDE Education Inequalities,2022-04-0268.jpg,none,"education, inequalities, database"
The rapid growth in global wealth,mynameismy111,2022-04-25 18:40:57,https://www.mckinsey.com/industries/financial-services/our-insights/the-rise-and-rise-of-the-global-balance-sheet-how-productively-are-we-using-our-wealth,https://www.reddit.com/r/dataisbeautiful/comments/ubs590/the_rapid_growth_in_global_wealth/,2,2,,6,The rapid growth in global wealth,2022-04-0323.jpg,none,"wealth, global economy, growth, infrastructure, development"
"Joe Manchin’s Approach to Biden’s Presidency Is Paying Off in West Virginia: Over the past year, Manchin has seen the largest job approval rating improvement of any senator",DMan9797,2022-04-28 14:31:24,https://morningconsult.com/2022/04/25/joe-manchins-approach-paying-off/,https://www.reddit.com/r/dataisbeautiful/comments/udwcxu/joe_manchins_approach_to_bidens_presidency_is/,17,17,,42,"Joe Manchin’s Approach to Biden’s Presidency Is Paying Off in West Virginia Over the past year, Manchin has seen the largest job approval rating impro",2022-04-0351.jpg,none,"politics, approval ratings, west virginia, biden administration"
The atmosphere's CO₂ concentration represented with 1cm cubes 🔊 [OC],kevpluck,2022-04-28 18:37:15,https://v.redd.it/kj5nxpbgdbw81,https://www.reddit.com/r/dataisbeautiful/comments/ue1xbu/the_atmospheres_co₂_concentration_represented/,1195,1195,,70,The atmosphere's CO₂ concentration represented with 1cm cubes 🔊 OC,2022-04-0354.png,none,"environment, climate change, carbon dioxide, visualization"
"I created simulation to test out the math behind the Birthday Paradox. (In a group of 23, there is a 50% chance that 2 people will share the same birthday date) [OC]",Braaainssss,2022-04-29 11:16:24,https://v.redd.it/mib9d4zmagw81,https://www.reddit.com/r/dataisbeautiful/comments/uejlam/i_created_simulation_to_test_out_the_math_behind/,11962,11962,,528,"I created simulation to test out the math behind the Birthday Paradox. (In a group of 23, there is a 50% chance that 2 people will share the same birt",2022-04-0357.png,none,"probability, statistics, simulation, math, birthday paradox"
Understanding the materials in mobile phones - Fairphone,233C,2022-04-29 14:47:03,https://www.fairphone.com/en/project/understanding-materials-mobile-phones/,https://www.reddit.com/r/dataisbeautiful/comments/uenjf2/understanding_the_materials_in_mobile_phones/,7,7,,0,Understanding the materials in mobile phones - Fairphone,2022-04-0362.jpg,none,none
r/Place Canada Complete Time Lapse [OC],Chris_Cross_Crash,2022-04-30 14:28:40,https://v.redd.it/lwf3ix1edow81,https://www.reddit.com/r/dataisbeautiful/comments/ufc7xm/rplace_canada_complete_time_lapse_oc/,6912,6912,,266,rPlace Canada Complete Time Lapse OC,2022-04-0373.png,none,"canada, reddit, internet, culture"
"Russia has made $66 billion from fuel exports since it invaded Ukraine - and the EU is still its biggest buyer, study finds",dank-monk,2022-04-30 14:45:18,https://uk.news.yahoo.com/russia-made-66-billion-fuel-092924160.html?guce_referrer=aHR0cHM6Ly93d3cuZ29vZ2xlLmNvbS8&guce_referrer_sig=AQAAAEy-LCgiA6Ewr7Fcoi0JKdE1XIyYy9QQmAvU8zvupV4e-AMvASTipbz2Sym6unrf-pSVK49aW8PInobgwMzyCBsl_TFXqtaY6iX2V0D4MRyH-8JCPlVIIC3BPjqAV5EzI41rN02jBpa2PyFVfpPh7xcCimI2_DBDexYVm5eqNC3g,https://www.reddit.com/r/dataisbeautiful/comments/ufcj5s/russia_has_made_66_billion_from_fuel_exports/,152,152,,34,"Russia has made $66 billion from fuel exports since it invaded Ukraine - and the EU is still its biggest buyer, study finds",2022-04-0374.jpg,none,none
