title,author,created_date,url,full_permalink,score,ups,downs,num_comments,sanitized_title,image_file,chart_type,high_level_categories
What Spotify data show about the decline of English,tulx,2022-02-01 14:24:42,https://www.economist.com/interactives/graphic-detail/2022/01/29/what-spotify-data-show-about-the-decline-of-english,https://www.reddit.com/r/dataisbeautiful/comments/shw63b/what_spotify_data_show_about_the_decline_of/,15,15,,19,What Spotify data show about the decline of English,2022-02-0005.jpg,none,"music, language, spotify, trends"
US debt of $30 trillion visualized in physical cash.,Oto-bahn,2022-02-02 15:23:31,https://demonocracy.info/infographics/usa/us_debt/us_debt.html,https://www.reddit.com/r/dataisbeautiful/comments/sir9vl/us_debt_of_30_trillion_visualized_in_physical_cash/,39,39,,29,US debt of $30 trillion visualized in physical cash.,2022-02-0019.jpg,none,"us economy, debt, finance, visualization, currency"
About Three-in-Ten U.S. Adults Are Now Religiously Unaffiliated,PeasKhichra,2022-02-03 12:38:01,https://www.pewforum.org/2021/12/14/about-three-in-ten-u-s-adults-are-now-religiously-unaffiliated,https://www.reddit.com/r/dataisbeautiful/comments/sji5ff/about_threeinten_us_adults_are_now_religiously/,9467,9467,,843,About Three-in-Ten U.S. Adults Are Now Religiously Unaffiliated,2022-02-0032.jpg,none,"religion, demographics, society"
Extreme heat is now normal across half the ocean: Percentage of ocean above temperature record set 1870-2019,HenryCorp,2022-02-03 15:34:11,https://www.theguardian.com/environment/2022/feb/01/extreme-heat-oceans-passed-point-of-no-return-high-temperatures-wildlife-seas,https://www.reddit.com/r/dataisbeautiful/comments/sjm4je/extreme_heat_is_now_normal_across_half_the_ocean/,3,3,,3,Extreme heat is now normal across half the ocean Percentage of ocean above temperature record set 1870-2019,2022-02-0036.jpg,none,"climate change, environment, oceans, extreme heat"
FCC estimates about the number of Americans using fast internet is off by about 106 million people,Fantastic-Berry-737,2022-02-04 10:23:04,https://github.com/microsoft/USBroadbandUsagePercentages,https://www.reddit.com/r/dataisbeautiful/comments/ska1no/fcc_estimates_about_the_number_of_americans_using/,33,33,,7,FCC estimates about the number of Americans using fast internet is off by about 106 million people,2022-02-0052.jpg,none,"internet, data, technology, broadband, connectivity, fcc"
U.S. household net worth soars,mynameismy111,2022-02-04 20:53:20,https://www.axios.com/us-household-net-worth-gdp-df766383-ca7b-4e16-8097-3b252aec16ab.html,https://www.reddit.com/r/dataisbeautiful/comments/sko0im/us_household_net_worth_soars/,0,0,,9,U.S. household net worth soars,2022-02-0061.jpg,none,none
Minneapolis metro wastewater viral load is closely correlated with case counts two weeks afterward.,frowawayduh,2022-02-06 19:59:58,https://metrocouncil.org/Wastewater-Water/Services/Wastewater-Treatment/COVID19-Research.aspx,https://www.reddit.com/r/dataisbeautiful/comments/sm5x8o/minneapolis_metro_wastewater_viral_load_is/,22,22,,3,Minneapolis metro wastewater viral load is closely correlated with case counts two weeks afterward.,2022-02-0078.jpg,none,none
"Interactive World Population Chart 10,000BCE-present",iamagrrl,2022-02-06 21:26:51,https://ourworldindata.org/grapher/population,https://www.reddit.com/r/dataisbeautiful/comments/sm82k5/interactive_world_population_chart_10000bcepresent/,7,7,,3,"Interactive World Population Chart 10,000BCE-present",2022-02-0080.jpg,none,none
Excellent visualization of a 930mb North Atlantic low pressure system that will create 10m+ sea swells tomorrow. A 930mb central pressure is commonly seen in Cat. 4 hurricanes and is one of the lowest pressures ever seen in Atlantic storms (source: windy.com),oceanicplatform,2022-02-06 21:51:35,"https://www.windy.com/?59.378,-32.344,4,i:pressure",https://www.reddit.com/r/dataisbeautiful/comments/sm8o6x/excellent_visualization_of_a_930mb_north_atlantic/,32,32,,5,Excellent visualization of a 930mb North Atlantic low pressure system that will create 10m+ sea swells tomorrow. A 930mb central pressure is commonly,2022-02-0081.jpg,none,"weather, storms, north atlantic, hurricanes, sea swells"
A Look into the Data Behind the 2020-2021 Premier League Season,shaferskylar1,2022-02-07 03:07:41,https://github.com/shaferskylar99/premierleague2020-2021/blob/main/README.md,https://www.reddit.com/r/dataisbeautiful/comments/smflqn/a_look_into_the_data_behind_the_20202021_premier/,1,1,,1,A Look into the Data Behind the 2020-2021 Premier League Season,2022-02-0084.jpg,none,"sports, football, premier league, data analysis"
How to detect nationalism in winter-sport judges,statisticalanalysis_,2022-02-10 17:36:56,https://www.economist.com/graphic-detail/2022/02/12/how-to-detect-nationalism-in-winter-sport-judges,https://www.reddit.com/r/dataisbeautiful/comments/spc3kv/how_to_detect_nationalism_in_wintersport_judges/,0,0,,4,How to detect nationalism in winter-sport judges,2022-02-0146.jpg,none,"sports, winter sports, nationalism, judging"
Circumcision rate before and after policy change to only fund medically necessary circumcision.,LucidFir,2022-02-11 20:07:02,https://www.docdroid.net/hVGT66I/foia-report-on-circumcision-ryan-jones-pdf#page=4,https://www.reddit.com/r/dataisbeautiful/comments/sq8aya/circumcision_rate_before_and_after_policy_change/,30,30,,21,Circumcision rate before and after policy change to only fund medically necessary circumcision.,2022-02-0164.jpg,none,"circumcision, healthcare policy, medical necessity, funding"
UK COVID-19 160k deaths 13/2/2022 [OC],kevpluck,2022-02-13 12:32:10,https://i.redd.it/r180gw62hlh81.png,https://www.reddit.com/r/dataisbeautiful/comments/srho36/uk_covid19_160k_deaths_1322022_oc/,0,0,,4,UK COVID-19 160k deaths 1322022 OC,2022-02-0179.png,none,"covid-19, uk, deaths, health, pandemic, statistics"
Temporal niche partitioning as a novel mechanism promoting co-existence of sympatric predators in marine systems | Proceedings of the Royal Society B: Biological Sciences,T8erTaught,2022-02-13 18:05:23,https://royalsocietypublishing.org/doi/10.1098/rspb.2021.0816#.YglHXStx3lw.reddit,https://www.reddit.com/r/dataisbeautiful/comments/srosk4/temporal_niche_partitioning_as_a_novel_mechanism/,4,4,,5,Temporal niche partitioning as a novel mechanism promoting co-existence of sympatric predators in marine systems Proceedings of the Royal Society B Bi,2022-02-0188.jpg,none,"marine biology, ecology, predators, co-existence"
Beijing Olympics Medals,ChickenTeriyakiBoy1,2022-02-13 21:35:00,https://www.bloomberg.com/graphics/beijing-2022-winter-olympics-medal-count/?srnd=premium,https://www.reddit.com/r/dataisbeautiful/comments/srtnbw/beijing_olympics_medals/,0,0,,2,Beijing Olympics Medals,2022-02-0193.jpg,none,"olympics, sports, beijing, medals, winter sports"
"NFL race breakdown, as a reply to questions on the chart showing race % of US population vs race representation in Super Bowl commercials.",somredditime,2022-02-14 14:38:39,https://finance.yahoo.com/news/nfl-racial-divide-one-chart-154059660.html,https://www.reddit.com/r/dataisbeautiful/comments/ssc3eh/nfl_race_breakdown_as_a_reply_to_questions_on_the/,5,5,,7,"NFL race breakdown, as a reply to questions on the chart showing race % of US population vs race representation in Super Bowl commercials.",2022-02-0207.jpg,none,none
"Air traffic over France, 24 hours in 50 seconds. The action starts at 6 am. [OC]",estadisticas,2022-02-14 16:37:27,https://v.redd.it/ptz9xmemtth81,https://www.reddit.com/r/dataisbeautiful/comments/ssev28/air_traffic_over_france_24_hours_in_50_seconds/,1883,1883,,81,"Air traffic over France, 24 hours in 50 seconds. The action starts at 6 am. OC",2022-02-0211.png,none,"aviation, france, air traffic, transportation, geography"
Analysing the volcanic lightning from the Tonga eruption,visual112233,2022-02-14 17:44:55,https://graphics.reuters.com/TONGA-VOLCANO/LIGHTNING/zgpomjdbypd/index.html,https://www.reddit.com/r/dataisbeautiful/comments/ssgiad/analysing_the_volcanic_lightning_from_the_tonga/,15,15,,1,Analysing the volcanic lightning from the Tonga eruption,2022-02-0215.jpg,none,"tonga, volcanic eruption, lightning, natural disasters, environment"
"Air traffic near Ukraine, February 1, 2022. [OC]",estadisticas,2022-02-14 19:27:13,https://v.redd.it/19qp0a6xnuh81,https://www.reddit.com/r/dataisbeautiful/comments/ssiznq/air_traffic_near_ukraine_february_1_2022_oc/,320,320,,25,"Air traffic near Ukraine, February 1, 2022. OC",2022-02-0216.png,none,"aviation, ukraine, geography"
Scene Text Detection And Recognition Using EAST And Tesseract,mlpoint,2022-02-17 11:19:26,https://towardsdatascience.com/scene-text-detection-and-recognition-using-east-and-tesseract-6f07c249f5de,https://www.reddit.com/r/dataisbeautiful/comments/sumhp5/scene_text_detection_and_recognition_using_east/,2,2,,0,Scene Text Detection And Recognition Using EAST And Tesseract,2022-02-0253.jpg,none,"text detection, ocr, machine learning, deep learning, icdar, east, tesseract"
Visualizing gender pay gap in Australia,Educational-Green-64,2022-02-19 00:00:00,https://insightsartist.com/gender-pay-gap-australia/,https://www.reddit.com/r/dataisbeautiful/comments/svw7u7/visualizing_gender_pay_gap_in_australia/,0,0,,13,Visualizing gender pay gap in Australia,2022-02-0278.jpg,none,"gender, pay gap, australia, income inequality"
Dollar Street - photos as data to kill country stereotypes,monkker,2022-02-20 05:53:55,https://www.gapminder.org/dollar-street?min=203&topic=homes,https://www.reddit.com/r/dataisbeautiful/comments/swu6vn/dollar_street_photos_as_data_to_kill_country/,20,20,,6,Dollar Street - photos as data to kill country stereotypes,2022-02-0293.jpg,none,"economics, culture, stereotypes, income comparison, global perspective"
Change in search interest for specific product/services during the pandemic,No_Television_6681,2022-02-20 21:03:04,http://thenewnormal.is/,https://www.reddit.com/r/dataisbeautiful/comments/sxbc32/change_in_search_interest_for_specific/,8,8,,0,Change in search interest for specific productservices during the pandemic,2022-02-0300.jpg,none,"pandemic, consumer behavior, trends, covid-19, products, services"
[OC] Visualizing the Bitcoin mempool.,Jok570,2022-02-21 23:33:42,https://v.redd.it/8h68ab06u9j81,https://www.reddit.com/r/dataisbeautiful/comments/sy82j7/oc_visualizing_the_bitcoin_mempool/,46,46,,11,OC Visualizing the Bitcoin mempool.,2022-02-0313.png,none,"bitcoin, transactions, blockchain, cryptocurrency"
I made a crowdsourced site to help you find the best beaches in the world - Beach Nearby,guivr,2022-02-22 10:07:38,https://beachnearby.com/?ref=reddit,https://www.reddit.com/r/dataisbeautiful/comments/syk0ia/i_made_a_crowdsourced_site_to_help_you_find_the/,10,10,,7,I made a crowdsourced site to help you find the best beaches in the world - Beach Nearby,2022-02-0316.jpg,none,"travel, beaches, tourism, crowdsourcing"
Changing Radiation Levels at Chernobyl. Click circles for time graphs.,cryptoengineer,2022-02-25 04:46:21,https://www.saveecobot.com/en/radiation-maps#12/51.3883/30.0593/gamma/comp+cams+fire,https://www.reddit.com/r/dataisbeautiful/comments/t0v70l/changing_radiation_levels_at_chernobyl_click/,296,296,,39,Changing Radiation Levels at Chernobyl. Click circles for time graphs.,2022-02-0353.jpg,none,"radiation, ukraine, monitoring"
"Half of Russians say it would be right to use military to keep Ukraine out of NATO, CNN poll finds",Lilyo,2022-02-25 06:54:59,https://www.cnn.com/interactive/2022/02/europe/russia-ukraine-crisis-poll-intl/index.html,https://www.reddit.com/r/dataisbeautiful/comments/t0xiz5/half_of_russians_say_it_would_be_right_to_use/,53,53,,56,"Half of Russians say it would be right to use military to keep Ukraine out of NATO, CNN poll finds",2022-02-0355.jpg,none,"russia, ukraine, nato, military, politics"
Not sure why this interactive map of events in and around Ukraine isn't getting more exposure (Not OC) seems like they are careful not to show Ukrainian movements as well. Made with maphub,thatmaintenanceguy,2022-02-26 00:11:05,https://maphub.net/Cen4infoRes,https://www.reddit.com/r/dataisbeautiful/comments/t1ineh/not_sure_why_this_interactive_map_of_events_in/,73,73,,9,Not sure why this interactive map of events in and around Ukraine isn't getting more exposure (Not OC) seems like they are careful not to show Ukraini,2022-02-0366.jpg,none,none
[OC] 5 Stocks That Exploded Before The Weekend,IdeazDeveloper,2022-02-26 08:33:10,https://v.redd.it/p1l2r6v425k81,https://www.reddit.com/r/dataisbeautiful/comments/t1s86c/oc_5_stocks_that_exploded_before_the_weekend/,109,109,,18,OC 5 Stocks That Exploded Before The Weekend,2022-02-0369.png,none,"stocks, finance, business, trends"
Shaded relief map of Ukraine [OC],JoeWDavies,2022-02-26 11:40:22,https://i.redd.it/gn69wkolz5k81.png,https://www.reddit.com/r/dataisbeautiful/comments/t1v6zh/shaded_relief_map_of_ukraine_oc/,24949,24949,,243,Shaded relief map of Ukraine OC,2022-02-0373.png,none,"ukraine, geography, topography"
