title,author,created_date,url,full_permalink,score,ups,downs,num_comments,sanitized_title,image_file,chart_type,high_level_categories
[OC] No other country comes close to spending as much on insulin as the U.S.,gridnews,2023-03-02 18:12:09,https://www.grid.news/story/science/2023/03/02/how-much-insulin-costs-around-the-world-vs-the-us/,https://www.reddit.com/r/dataisbeautiful/comments/11g9lso/oc_no_other_country_comes_close_to_spending_as/,1,1,,1,OC No other country comes close to spending as much on insulin as the U.S.,2023-03-0035.jpg,none,"healthcare, insulin, spending, united states, economy"
Plotted “Seconds to Midnight” Since in the inception of the Doomsday Clock [Wikipedia],eniteris,2023-03-03 14:53:03,https://en.wikipedia.org/wiki/Doomsday_Clock#/media/File:Doomsday_Clock_graph.svg,https://www.reddit.com/r/dataisbeautiful/comments/11h2owg/plotted_seconds_to_midnight_since_in_the/,0,0,,2,Plotted “Seconds to Midnight” Since in the inception of the Doomsday Clock Wikipedia,2023-03-0047.jpg,none,"doomsday clock, world events, nuclear threat, global risk"
[OC] Richest NFL Players: the richest american footballers with the highest net worth,9eo9raph,2023-03-03 18:41:32,https://v.redd.it/z4b9osxhjkla1,https://www.reddit.com/r/dataisbeautiful/comments/11hb167/oc_richest_nfl_players_the_richest_american/,17,17,,18,OC Richest NFL Players the richest american footballers with the highest net worth,2023-03-0049.png,none,"american football, wealth, sports, nfl"
Real Freddo price changes versus expected changes in line with inflation - Full Fact,ShreckAndDonkey123,2023-03-04 11:35:24,https://fullfact.org/online/freddos-vs-inflation/,https://www.reddit.com/r/dataisbeautiful/comments/11hx7kq/real_freddo_price_changes_versus_expected_changes/,0,0,,0,Real Freddo price changes versus expected changes in line with inflation - Full Fact,2023-03-0058.jpg,none,none
The baby of a friend had a heart rate of 162 at the peak and it dropped to 108 in deep sleep. Could easily follow sleep cycles but insane to see how high heart rate and breath rate are for a baby. [OC],MichieldeKoning,2023-03-06 09:57:58,https://v.redd.it/x9goc1z6d3ma1,https://www.reddit.com/r/dataisbeautiful/comments/11jujty/the_baby_of_a_friend_had_a_heart_rate_of_162_at/,0,0,,9,The baby of a friend had a heart rate of 162 at the peak and it dropped to 108 in deep sleep. Could easily follow sleep cycles but insane to see how h,2023-03-0076.png,none,"heart rate, sleep, baby, health, data monitoring"
GPS tracking on six wolf packs shows how much they avoid each other's territory.,jay17d,2023-03-06 21:05:44,https://twitter.com/fasc1nate/status/1632408487895482369?s=46,https://www.reddit.com/r/dataisbeautiful/comments/11kdznm/gps_tracking_on_six_wolf_packs_shows_how_much/,12,12,,2,GPS tracking on six wolf packs shows how much they avoid each other's territory.,2023-03-0085.jpg,none,"wildlife, gps tracking, territories, animal behavior, ecology"
Exercise in Europe: Which countries are the most and least active?,Tango-Smith,2023-03-07 07:42:56,https://www.euronews.com/next/2023/03/05/exercise-in-europe-which-countries-do-the-most-and-least-physical-activity,https://www.reddit.com/r/dataisbeautiful/comments/11ksubw/exercise_in_europe_which_countries_are_the_most/,13,13,,3,Exercise in Europe Which countries are the most and least active,2023-03-0090.jpg,none,"exercise, fitness, europe, activity levels"
[OC] Using dB dynamics from audio source to create this particle oscilloscope - [More info in comments],Chuka444,2023-03-07 16:21:31,https://v.redd.it/ruut418mecma1,https://www.reddit.com/r/dataisbeautiful/comments/11l3ozw/oc_using_db_dynamics_from_audio_source_to_create/,11,11,,2,OC Using dB dynamics from audio source to create this particle oscilloscope - More info in comments,2023-03-0100.png,none,"audio, dynamics, visualization, particles, experimental"
Technology over the long run,kishoredbn,2023-03-07 19:26:49,https://ourworldindata.org/technology-long-run,https://www.reddit.com/r/dataisbeautiful/comments/11l8n9z/technology_over_the_long_run/,0,0,,1,Technology over the long run,2023-03-0105.jpg,none,"technology, history"
FDIC insurance fund visualized in physical $100 bills,Oto-bahn,2023-03-11 02:11:56,https://demonocracy.info/infographics/usa/fdic/fdic.html,https://www.reddit.com/r/dataisbeautiful/comments/11o8068/fdic_insurance_fund_visualized_in_physical_100/,63,63,,3,FDIC insurance fund visualized in physical $100 bills,2023-03-0154.jpg,none,"finance, economy, money, visualization, fdic"
[OC] Quick python script to create the ever-popular IMDB episode ratings heatmaps - interactive in Google Colab,TF_Biochemist,2023-03-12 13:36:09,https://gist.github.com/Paradoxdruid/1d761563f7ac34db4cd99f6a04a7985a,https://www.reddit.com/r/dataisbeautiful/comments/11pepmn/oc_quick_python_script_to_create_the_everpopular/,20,20,,3,OC Quick python script to create the ever-popular IMDB episode ratings heatmaps - interactive in Google Colab,2023-03-0169.jpg,none,none
[OC] Heatmap of my all-purpose school notebook,MrGuccu,2023-03-13 00:13:02,https://i.redd.it/bd5u6fk7fena1.png,https://www.reddit.com/r/dataisbeautiful/comments/11puicr/oc_heatmap_of_my_allpurpose_school_notebook/,119,119,,10,OC Heatmap of my all-purpose school notebook,2023-03-0175.png,none,none
Carte des Vins de France [OC],Julian_H0ffmann,2023-03-14 10:21:58,https://i.redd.it/gkr38owyjona1.png,https://www.reddit.com/r/dataisbeautiful/comments/11r2goe/carte_des_vins_de_france_oc/,54,54,,4,Carte des Vins de France OC,2023-03-0198.png,none,"wine, france, regions, geography"
2023 Digits of π [OC],yaph,2023-03-14 13:19:44,https://i.redd.it/pmvfpl8ngpna1.png,https://www.reddit.com/r/dataisbeautiful/comments/11r5wtq/2023_digits_of_π_oc/,229,229,,32,2023 Digits of π OC,2023-03-0202.png,none,"mathematics, numbers, data visualizations, pi"
GPT-4 can pass the bar exam in the top 10th percentile among many other improvements.,LanchestersLaw,2023-03-15 06:56:53,https://openai.com/research/gpt-4,https://www.reddit.com/r/dataisbeautiful/comments/11roph1/gpt4_can_pass_the_bar_exam_in_the_top_10th/,2015,2015,,364,GPT-4 can pass the bar exam in the top 10th percentile among many other improvements.,2023-03-0211.jpg,none,"ai, education, exams, performance"
"[OC] The number of pedestrian deaths is on the rise, but not everyone is equally affected",gridnews,2023-03-15 14:18:09,https://www.grid.news/story/politics/2023/03/14/the-number-of-pedestrian-deaths-is-on-the-rise-but-not-everyone-is-equally-affected/,https://www.reddit.com/r/dataisbeautiful/comments/11rxr33/oc_the_number_of_pedestrian_deaths_is_on_the_rise/,1,1,,1,"OC The number of pedestrian deaths is on the rise, but not everyone is equally affected",2023-03-0219.jpg,none,"pedestrian safety, transportation, urban living"
Are people more likely to be lonely in so-called ‘individualistic’ societies?,CatOnSpace,2023-03-16 12:27:43,https://ourworldindata.org/grapher/self-reported-loneliness-older-adults,https://www.reddit.com/r/dataisbeautiful/comments/11sspui/are_people_more_likely_to_be_lonely_in_socalled/,4,4,,1,Are people more likely to be lonely in so-called ‘individualistic’ societies,2023-03-0242.jpg,none,"loneliness, society, social connections, culture"
"UK Government Bans TikTok Over Security Concerns, Joins List of Countries Taking Action",Express_Turn_5489,2023-03-16 15:25:49,https://www.kumaonjagran.com/uk-government-bans-tiktok-over-security-concerns-joins-list-of-countries-taking-action,https://www.reddit.com/r/dataisbeautiful/comments/11sx7pl/uk_government_bans_tiktok_over_security_concerns/,1,1,,1,"UK Government Bans TikTok Over Security Concerns, Joins List of Countries Taking Action",2023-03-0249.jpg,none,"technology, security, government policy"
[OC] How long is too long to leave up holiday decorations? What Americans really think about those St. Patrick’s skeletons.,gridnews,2023-03-17 14:04:12,https://www.grid.news/story/politics/2023/03/17/how-long-is-too-long-to-leave-up-holiday-decorations-what-americans-really-think-about-those-st-patricks-skeletons/,https://www.reddit.com/r/dataisbeautiful/comments/11ts0u5/oc_how_long_is_too_long_to_leave_up_holiday/,7,7,,3,OC How long is too long to leave up holiday decorations What Americans really think about those St. Patrick’s skeletons.,2023-03-0260.jpg,none,"holidays, decorations, culture, st. patrick's day"
What U.S. Cities and States Spend the Most and Least on Wedding Dresses?,Gard3nNerd,2023-03-17 17:45:55,https://www.lulus.com/blog/weddings/what-us-cities-states-spend-the-most-on-weddings/,https://www.reddit.com/r/dataisbeautiful/comments/11ty7ow/what_us_cities_and_states_spend_the_most_and/,0,0,,0,What U.S. Cities and States Spend the Most and Least on Wedding Dresses,2023-03-0264.jpg,none,"weddings, spending, u.s. cities, states, fashion"
Why California is still in drought despite heavy rain and snow,bogdanelcs,2023-03-23 10:14:49,https://www.reuters.com/graphics/CLIMATE-CHANGE/CALIFORNIA-DROUGHT/byvrlqxqnve/index.html,https://www.reddit.com/r/dataisbeautiful/comments/11zfuod/why_california_is_still_in_drought_despite_heavy/,178,178,,68,Why California is still in drought despite heavy rain and snow,2023-03-0318.jpg,none,"drought, california, climate, environment"
"[OC] Ukraine, One Year at War: An interactive timeline of the conflict",gridnews,2023-03-24 17:10:18,https://www.grid.news/story/global/2023/02/22/interactive-ukraine-one-year-at-war-a-timeline-of-the-brutal-conflict/,https://www.reddit.com/r/dataisbeautiful/comments/120qwf8/oc_ukraine_one_year_at_war_an_interactive/,3,3,,1,"OC Ukraine, One Year at War An interactive timeline of the conflict",2023-03-0334.jpg,none,"ukraine, war, conflict, timeline"
"So this might be a bit different than the usual post, but at its heart it's definitely data visualization. For the past 86 days I've been animating a city based on social media follower count. Here's a time-lapse [OC]",DeliciousExam8551,2023-03-25 17:57:18,https://v.redd.it/3hklawt5axpa1,https://www.reddit.com/r/dataisbeautiful/comments/121tody/so_this_might_be_a_bit_different_than_the_usual/,2055,2055,,80,"So this might be a bit different than the usual post, but at its heart it's definitely data visualization. For the past 86 days I've been animating a",2023-03-0338.png,none,"social media, animation, city, trends"
"From millionaires to Muslims, small subgroups of the population seem much larger to many Americans",jrdjared,2023-03-26 21:24:58,https://today.yougov.com/topics/politics/articles-reports/2022/03/15/americans-misestimate-small-subgroups-population,https://www.reddit.com/r/dataisbeautiful/comments/1230738/from_millionaires_to_muslims_small_subgroups_of/,228,228,,75,"From millionaires to Muslims, small subgroups of the population seem much larger to many Americans",2023-03-0350.jpg,none,"demographics, perception, society, subgroups, diversity"
"Americans Pull Back From Values That Once Defined U.S., WSJ-NORC Poll Finds",HarpuasGhost,2023-03-27 15:04:12,https://www.wsj.com/articles/americans-pull-back-from-values-that-once-defined-u-s-wsj-norc-poll-finds-df8534cd,https://www.reddit.com/r/dataisbeautiful/comments/123pkp6/americans_pull_back_from_values_that_once_defined/,375,375,,213,"Americans Pull Back From Values That Once Defined U.S., WSJ-NORC Poll Finds",2023-03-0366.jpg,none,none
Low-wage workers have seen historically fast real wage growth in the pandemic business cycle: Policy investments translate into better opportunities for the lowest-paid workers,sillychillly,2023-03-27 18:59:05,https://www.epi.org/publication/swa-wages-2022/?utm_source=sillychillly,https://www.reddit.com/r/dataisbeautiful/comments/123wngh/lowwage_workers_have_seen_historically_fast_real/,79,79,,30,Low-wage workers have seen historically fast real wage growth in the pandemic business cycle Policy investments translate into better opportunities fo,2023-03-0374.jpg,none,"labor, wages, employment, business, economy"
Incarceration rate visualized - U.S. v. The World,Cando232,2023-03-28 01:13:55,https://mkorostoff.github.io/incarceration-in-real-numbers/,https://www.reddit.com/r/dataisbeautiful/comments/1247svj/incarceration_rate_visualized_us_v_the_world/,7,7,,5,Incarceration rate visualized - U.S. v. The World,2023-03-0378.jpg,none,"incarceration, crime, u.s., world, statistics"
"[OC] Visualization of livestock being slaughtered in the US. (2020 - Annual average) I first tried visualizing this with graphs and bars, but for me Minecraft showed the scale a lot better.",datekram,2023-03-28 10:32:13,https://v.redd.it/wm995pmbjgqa1,https://www.reddit.com/r/dataisbeautiful/comments/124keay/oc_visualization_of_livestock_being_slaughtered/,24176,24176,,2365,"OC Visualization of livestock being slaughtered in the US. (2020 - Annual average) I first tried visualizing this with graphs and bars, but for me Min",2023-03-0383.png,none,"livestock, agriculture, united states, minecraft, visualization"
Deep dive by The Courier and P&amp;J data journalists into Scottish baby names,glasgowwelder,2023-03-30 22:13:51,https://www.thecourier.co.uk/fp/news/scotland/4245112/scottish-baby-names-2022/,https://www.reddit.com/r/dataisbeautiful/comments/12710c2/deep_dive_by_the_courier_and_pj_data_journalists/,1,1,,0,Deep dive by The Courier and P&amp;J data journalists into Scottish baby names,2023-03-0404.jpg,none,"baby names, scotland, 2022, trends"
"Percent Change in County Population: July 1, 2021, to July 1, 2022",deftware,2023-03-31 14:34:37,https://www.census.gov/library/visualizations/2023/comm/percent-change-in-county-population.html,https://www.reddit.com/r/dataisbeautiful/comments/127neve/percent_change_in_county_population_july_1_2021/,13,13,,0,"Percent Change in County Population July 1, 2021, to July 1, 2022",2023-03-0408.jpg,none,none
