title,author,created_date,url,full_permalink,score,ups,downs,num_comments,sanitized_title,image_file,chart_type,high_level_categories
First YouGov MRP of 2024 general election shows Labour on track to beat 1997 landslide,Dry-Frosting1779,2024-06-03,https://yougov.co.uk/politics/articles/49606-first-yougov-mrp-of-2024-general-election-shows-labour-on-track-to-beat-1997-landslide,https://www.reddit.com/r/dataisbeautiful/comments/1d7f7vl/first_yougov_mrp_of_2024_general_election_shows/,13,13,0,0,First YouGov MRP of 2024 general election shows Labour on track to beat 1997 landslide,2024-06-0018.jpg,none,none
"The number of ai internet addresses registered in Anguilla has soared since the launch of ChatGPT, generating a windfall",eortizospina,2024-06-04,https://www.imf.org/en/News/Articles/2024/05/15/cf-an-ai-powered-boost-to-anguillas-revenues,https://www.reddit.com/r/dataisbeautiful/comments/1d7q7ax/the_number_of_ai_internet_addresses_registered_in/,27,27,0,2,"The number of ai internet addresses registered in Anguilla has soared since the launch of ChatGPT, generating a windfall",2024-06-0023.jpg,none,"internet, ai, technology, anguilla, economics"
Data on Demand: New Tool for Wiki-Based Data Exploration,LorinaBalan,2024-06-04,https://xwiki.com/en/Blog/Analytics-Application-Pro/,https://www.reddit.com/r/dataisbeautiful/comments/1d7r5i7/data_on_demand_new_tool_for_wikibased_data/,0,0,0,0,Data on Demand New Tool for Wiki-Based Data Exploration,2024-06-0024.jpg,none,"data exploration, analytics, tools, applications"
"Net migration to the UK  June 4, 2024 Update - Migration Observatory",TimeTravelingTeapot,2024-06-04,https://migrationobservatory.ox.ac.uk/resources/briefings/long-term-international-migration-flows-to-and-from-the-uk/,https://www.reddit.com/r/dataisbeautiful/comments/1d88ni0/net_migration_to_the_uk_june_4_2024_update/,2,2,0,0,"Net migration to the UK June 4, 2024 Update - Migration Observatory",2024-06-0031.jpg,none,"migration, uk, net migration, update, migration observatory"
[OC] Data visualization and sonification of geographic data,Any_Perspective_291,2024-06-05,https://i.redd.it/93ezyfsnap4d1.png,https://www.reddit.com/r/dataisbeautiful/comments/1d8jlag/oc_data_visualization_and_sonification_of/,0,0,0,1,OC Data visualization and sonification of geographic data,2024-06-0037.png,none,"geography, data visualization, sonification, mapping"
9 charts that show US factory farming is even bigger than you realize,lnfinity,2024-06-06,https://www.vox.com/future-perfect/24079424/factory-farming-facts-meat-usda-agriculture-census,https://www.reddit.com/r/dataisbeautiful/comments/1d9i0kq/9_charts_that_show_us_factory_farming_is_even/,216,216,0,43,9 charts that show US factory farming is even bigger than you realize,2024-06-0055.jpg,none,"agriculture, livestock, factory farming, usa"
"DataVisualisation AMA with RJ Andrews Friday June 7th 8am Pacific, 11am EST, 4pm London",cavedave,2024-06-06,https://www.reddit.com/r/dataisbeautiful/comments/1d9liy1/datavisualisation_ama_with_rj_andrews_friday_june/,https://www.reddit.com/r/dataisbeautiful/comments/1d9liy1/datavisualisation_ama_with_rj_andrews_friday_june/,5,5,0,1,"DataVisualisation AMA with RJ Andrews Friday June 7th 8am Pacific, 11am EST, 4pm London",2024-06-0058.jpg,none,"data visualization, ama, rj andrews, event"
[AMA] I am RJ Andrews of infowetrust and VisionaryPress and I am obsessed with data graphics. Ask Me Anything!,cavedave,2024-06-07,https://www.reddit.com/r/dataisbeautiful/comments/1dad798/ama_i_am_rj_andrews_of_infowetrust_and/,https://www.reddit.com/r/dataisbeautiful/comments/1dad798/ama_i_am_rj_andrews_of_infowetrust_and/,7,7,0,9,AMA I am RJ Andrews of infowetrust and VisionaryPress and I am obsessed with data graphics. Ask Me Anything!,2024-06-0072.jpg,none,"data visualization, graphics, information, ama"
How Common Is An EV Battery Replacement?,rik-huijzer,2024-06-10,https://www.recurrentauto.com/research/tesla-battery-replacement-costs,https://www.reddit.com/r/dataisbeautiful/comments/1dcoc8m/how_common_is_an_ev_battery_replacement/,0,0,0,36,How Common Is An EV Battery Replacement,2024-06-0098.jpg,none,none
"Data sets, pie charts and graphs visualizing statistics on the American prison system. ",Simpletruth2022,2024-06-13,https://www.prisonpolicy.org/profiles/US.html,https://www.reddit.com/r/dataisbeautiful/comments/1df887q/data_sets_pie_charts_and_graphs_visualizing/,14,14,0,7,"Data sets, pie charts and graphs visualizing statistics on the American prison system.",2024-06-0140.jpg,none,none
"Understand the Evolution of Data Integration, from ETL to ELT to ELTP.
",Bubbly_Bed_4478,2024-06-17,https://devblogit.com/etl-vs-elt-vs-eltp-understanding-the-evolution-of-data-integration/,https://www.reddit.com/r/dataisbeautiful/comments/1diejpz/understand_the_evolution_of_data_integration_from/,2,2,0,0,"Understand the Evolution of Data Integration, from ETL to ELT to ELTP.",2024-06-0178.jpg,none,"data integration, etl, elt, eltp, technology, information systems"
"Ownership of US corporate stock, 1965-2019",DoritosDewItRight,2024-06-17,https://www.taxpolicycenter.org/taxvox/who-owns-us-stock-foreigners-and-rich-americans,https://www.reddit.com/r/dataisbeautiful/comments/1dieqod/ownership_of_us_corporate_stock_19652019/,9,9,0,2,"Ownership of US corporate stock, 1965-2019",2024-06-0179.jpg,none,"economics, finance, stock market, currency exchange"
America in Facts 2024: A Data-Driven Report for Congress,Simpletruth2022,2024-06-18,https://usafacts.org/reports/annual-report/?utm_source=Klaviyo&utm_medium=email&utm_campaign=6_17_24_America%20in%20Facts&_kx=UG7pceuLYApLL015v1wQfGEFUDOBtHmbmwQb1g4Y20M.SH8aQb,https://www.reddit.com/r/dataisbeautiful/comments/1dijyun/america_in_facts_2024_a_datadriven_report_for/,12,12,0,3,America in Facts 2024 A Data-Driven Report for Congress,2024-06-0180.jpg,none,"politics, congress, data, america, report"
Want Help!! Please fill the below survey (Thank you),KKiscool_YT,2024-06-23,https://forms.gle/QrM8iXnoKT1j1vPV9,https://www.reddit.com/r/dataisbeautiful/comments/1dmkz6o/want_help_please_fill_the_below_survey_thank_you/,0,0,0,2,Want Help!! Please fill the below survey (Thank you),2024-06-0217.jpg,none,"surveys, cybersecurity, age groups, familiarity"
60+ Jupyter notebook examples for interactive 3D mapping with Leafmap and MapLibre,giswqs,2024-06-24,https://www.reddit.com/r/geospatial/comments/1dnhfyn/60_jupyter_notebook_examples_for_interactive_3d/,https://www.reddit.com/r/dataisbeautiful/comments/1dnhtv8/60_jupyter_notebook_examples_for_interactive_3d/,8,8,0,0,60+ Jupyter notebook examples for interactive 3D mapping with Leafmap and MapLibre,2024-06-0238.jpg,none,"geospatial analysis, interactive mapping, jupyter, python, leafmap, maplibre"
Relief & Rivers of the Iberian Peninsula 🇵🇹🇪🇸,lbarqueira,2024-06-30,https://twitter.com/StatsOfPortugal/status/1806865578268737835,https://www.reddit.com/r/dataisbeautiful/comments/1ds24kv/relief_rivers_of_the_iberian_peninsula/,21,21,0,2,Relief & Rivers of the Iberian Peninsula 🇵🇹🇪🇸,2024-06-0283.jpg,none,"geography, topography, rivers, iberian peninsula, spain, portugal"
