title,author,created_date,url,full_permalink,score,ups,downs,num_comments,sanitized_title,image_file,chart_type,high_level_categories
Average audience size for cable TV news in the US,AvocadoBest1176,2024-08-01,https://www.pewresearch.org/journalism/fact-sheet/cable-news/,https://www.reddit.com/r/dataisbeautiful/comments/1eh9vcf/average_audience_size_for_cable_tv_news_in_the_us/,8,8,0,10,Average audience size for cable TV news in the US,2024-08-0003.jpg,none,"cable news, television, media, audience, united states"
Usage of Air Conditioner’s causes 3% of the greenhouse gas emissions. ,dineshmadhava,2024-08-05,https://www.iea.org/reports/the-future-of-cooling,https://www.reddit.com/r/dataisbeautiful/comments/1ekz34w/usage_of_air_conditioners_causes_3_of_the/,0,0,0,47,Usage of Air Conditioner’s causes 3% of the greenhouse gas emissions.,2024-08-0039.jpg,none,"energy, emissions, environment, climate change"
Cost of the last American election,maguirre165,2024-08-07,https://www.opensecrets.org/elections-overview/cost-of-election,https://www.reddit.com/r/dataisbeautiful/comments/1emt5zt/cost_of_the_last_american_election/,5,5,0,2,Cost of the last American election,2024-08-0063.jpg,none,none
Interactive Map: Where Are Self-Driving Car Accidents Happening?,kombuchakween88,2024-08-14,https://www.craftlawfirm.com/autonomous-vehicle-accidents-2019-2024-crash-data/#accidents-by-state,https://www.reddit.com/r/dataisbeautiful/comments/1es3qb5/interactive_map_where_are_selfdriving_car/,0,0,0,11,Interactive Map Where Are Self-Driving Car Accidents Happening,2024-08-0132.jpg,none,"autonomous vehicles, accidents, technology, transportation"
Neurologic adrenaline hub the locus coeruelus in rats [OC],femmeRatale,2024-08-15,https://i.redd.it/ozfc4ptrnvid1.jpeg,https://www.reddit.com/r/dataisbeautiful/comments/1et3sth/neurologic_adrenaline_hub_the_locus_coeruelus_in/,2,2,0,2,Neurologic adrenaline hub the locus coeruelus in rats OC,2024-08-0151.jpeg,none,"neuroscience, rodents, adrenaline, locus coeruleus, nervous system"
"Analysis of revenue and expenditure for Roblox, the most popular game in the world",FollowingFeisty5321,2024-08-19,https://www.matthewball.co/all/roblox2024,https://www.reddit.com/r/dataisbeautiful/comments/1evu3mf/analysis_of_revenue_and_expenditure_for_roblox/,5,5,0,0,"Analysis of revenue and expenditure for Roblox, the most popular game in the world",2024-08-0176.jpg,none,"gaming, architecture, roblox"
Source for ethical guidelines for data representation? ,HopRockets,2024-08-20,https://viborc.com/ethics-and-ethical-data-visualization-a-complete-guide/,https://www.reddit.com/r/dataisbeautiful/comments/1ex8p0y/source_for_ethical_guidelines_for_data/,3,3,0,5,Source for ethical guidelines for data representation,2024-08-0190.jpg,none,"ethics, guidelines, data representation"
[OC] Terrain map of Africa ,hemedlungo_725,2024-08-21,https://i.redd.it/43o7fze0g1kd1.jpeg,https://www.reddit.com/r/dataisbeautiful/comments/1ext11h/oc_terrain_map_of_africa/,190,190,0,10,OC Terrain map of Africa,2024-08-0201.jpeg,none,"africa, terrain, geography, topography, continents"
Bill Clinton and the wide gap in job gains by presidential party,BigPlantsGuy,2024-08-22,https://www.washingtonpost.com/politics/2024/08/22/clinton-dnc-jobs-created-since-cold-war/,https://www.reddit.com/r/dataisbeautiful/comments/1eyj5js/bill_clinton_and_the_wide_gap_in_job_gains_by/,236,236,0,154,Bill Clinton and the wide gap in job gains by presidential party,2024-08-0210.jpg,none,none
Number of predicted solar panel installations vs actual installations. ,Bitter-Gur-4613,2024-08-26,https://www.economist.com/interactive/essay/2024/06/20/solar-power-is-going-to-be-huge,https://www.reddit.com/r/dataisbeautiful/comments/1f1p8ds/number_of_predicted_solar_panel_installations_vs/,110,110,0,28,Number of predicted solar panel installations vs actual installations.,2024-08-0242.jpg,none,"solar energy, installations, predictions, analysis"
2023 Police Violence Report,pwillia7,2024-08-30,https://policeviolencereport.org/,https://www.reddit.com/r/dataisbeautiful/comments/1f4xzqd/2023_police_violence_report/,14,14,0,19,2023 Police Violence Report,2024-08-0291.jpg,none,"police, violence, 2023, report, social issues"
