title,author,created_date,url,full_permalink,score,ups,downs,num_comments,sanitized_title,image_file,chart_type,high_level_categories
Tree of Life (Interactive),d-ee-ecent,2024-02-01,https://evogeneao.com/en/explore/tree-of-life-explorer,https://www.reddit.com/r/dataisbeautiful/comments/1ag91az/tree_of_life_interactive/,1,1,0,0,Tree of Life (Interactive),2024-02-0003.jpg,none,none
Quick and Short Survey for school - Please fill out this survey for my AP Gov project,Few-Independent-4706,2024-02-05,https://forms.gle/ZytJhFsJtTrGUwt17,https://www.reddit.com/r/dataisbeautiful/comments/1ajapbp/quick_and_short_survey_for_school_please_fill_out/,1,1,0,3,Quick and Short Survey for school - Please fill out this survey for my AP Gov project,2024-02-0042.jpg,none,"survey, school, government, climate change, public opinion, demographics"
[OC] Data is beautiful. I am interested in visualizing and articulating to non-technical people how data moves from their phone to a web server database.,surfmoss,2024-02-05,https://www.instagram.com/reel/CyMR6d7OteI/?igsh=MTk1cnVoeDhjZjE1Mg==,https://www.reddit.com/r/dataisbeautiful/comments/1ajibuv/oc_data_is_beautiful_i_am_interested_in/,1,1,0,12,OC Data is beautiful. I am interested in visualizing and articulating to non-technical people how data moves from their phone to a web server database,2024-02-0047.jpg,none,none
NOAA's Global CO2 Trend,PHealthy,2024-02-08,https://gml.noaa.gov/ccgg/trends/gl_trend.html,https://www.reddit.com/r/dataisbeautiful/comments/1alvj77/noaas_global_co2_trend/,14,14,0,4,NOAA's Global CO2 Trend,2024-02-0076.jpg,none,none
Lighthouses of 🇵🇹Portugal,lbarqueira,2024-02-08,https://x.com/StatsOfPortugal/status/1755711826745057619?s=20,https://www.reddit.com/r/dataisbeautiful/comments/1am82cb/lighthouses_of_portugal/,4,4,0,1,Lighthouses of 🇵🇹Portugal,2024-02-0088.jpg,none,"lighthouses, portugal, navigation, maritime, geography"
Settepercento | Tesla Cybertruck and the future of road casualties - A Data Driven Essay about the safety standards of Tesla's Electric Pickup Truck,Stomach70,2024-02-12,https://www.settepercento.com/eng/tesla-cybertruck-and-the-future-of-road-casualties,https://www.reddit.com/r/dataisbeautiful/comments/1apfcup/settepercento_tesla_cybertruck_and_the_future_of/,3,3,0,0,Settepercento Tesla Cybertruck and the future of road casualties - A Data Driven Essay about the safety standards of Tesla's Electric Pickup Truck,2024-02-0124.jpg,none,"tesla, cybertruck, road safety, electric vehicles, future, accidents"
"The state of relationships, marriages, and living alone in the US",Simpletruth2022,2024-02-13,https://usafacts.org/articles/state-relationships-marriages-and-living-alone-us/?utm_source=Mailchimp&utm_medium=email&utm_content=feb_12,https://www.reddit.com/r/dataisbeautiful/comments/1apuouv/the_state_of_relationships_marriages_and_living/,408,408,0,120,"The state of relationships, marriages, and living alone in the US",2024-02-0131.jpg,none,"relationships, marriage, living alone, demographics, us"
"Quick Count Result of Indonesia's February 14, 2024 Presidential Election Based on Demographics",GlobeLearner,2024-02-16,https://www.kompas.id/baca/riset/2024/02/15/prabowo-gibran-unggul-di-semua-gugus-pulau,https://www.reddit.com/r/dataisbeautiful/comments/1asaulv/quick_count_result_of_indonesias_february_14_2024/,1,1,0,1,"Quick Count Result of Indonesia's February 14, 2024 Presidential Election Based on Demographics",2024-02-0167.jpg,none,"elections, politics, demographics, indonesia"
I analyzed 5M freelancing jobs to see what jobs are being replaced by AI,Flat_Palpitation_158,2024-02-16,https://bloomberry.com/i-analyzed-5m-freelancing-jobs-to-see-what-jobs-are-being-replaced-by-ai/,https://www.reddit.com/r/dataisbeautiful/comments/1asl1k3/i_analyzed_5m_freelancing_jobs_to_see_what_jobs/,219,219,0,34,I analyzed 5M freelancing jobs to see what jobs are being replaced by AI,2024-02-0173.jpg,none,none
Top 10 data visualization tools recommendation,Arugula3738,2024-02-16,https://drlambda.ai/shared/top-10-data-visualization-tools-recommendat-MTdYLi%20Just%20found%20the%20recommendation%20here,https://www.reddit.com/r/dataisbeautiful/comments/1aso4ry/top_10_data_visualization_tools_recommendation/,1,1,0,3,Top 10 data visualization tools recommendation,2024-02-0174.jpg,none,none
Microservices vs. Monolithic Approaches in Data,alhaythum,2024-02-20,https://towardsdatascience.com/microservices-vs-monolithic-approaches-in-data-8d9d9a064d06,https://www.reddit.com/r/dataisbeautiful/comments/1avjs7s/microservices_vs_monolithic_approaches_in_data/,1,1,0,0,Microservices vs. Monolithic Approaches in Data,2024-02-0208.jpg,none,none
Antibiotic MIC,Astroficboy,2024-02-20,https://github.com/bsc-iitm/Data-Visualization-Design-CS4001/issues/24#issuecomment-1950959119,https://www.reddit.com/r/dataisbeautiful/comments/1avotso/antibiotic_mic/,1,1,0,0,Antibiotic MIC,2024-02-0211.jpg,none,none
Community Resilience Estimates Show That 23.4% of People in Counties With High Income Inequality Are Socially Vulnerable to Disasters,OverflowDs,2024-02-21,https://www.census.gov/library/stories/2024/02/cre-for-equity.html,https://www.reddit.com/r/dataisbeautiful/comments/1awe67a/community_resilience_estimates_show_that_234_of/,11,11,0,0,Community Resilience Estimates Show That 23.4% of People in Counties With High Income Inequality Are Socially Vulnerable to Disasters,2024-02-0219.jpg,none,"disasters, social vulnerability, income inequality, community resilience"
Food insecurity is impacting one out of eight American adults,Simpletruth2022,2024-02-21,https://usafacts.org/articles/food-insecurity-in-the-us/?%3Futm_source=Mailchimp&utm_medium=email&utm_content=feb_20,https://www.reddit.com/r/dataisbeautiful/comments/1awegfq/food_insecurity_is_impacting_one_out_of_eight/,219,219,0,54,Food insecurity is impacting one out of eight American adults,2024-02-0220.jpg,none,"food insecurity, health, american adults"
[OC] The Economics of Football: Top 20 Clubs with the Highest Net Spend Since 2000 - Football Unspoken,Cunnch,2024-02-21,https://footballunspoken.com/football-news/soccer-net-spend/,https://www.reddit.com/r/dataisbeautiful/comments/1awgsvw/oc_the_economics_of_football_top_20_clubs_with/,1,1,0,0,OC The Economics of Football Top 20 Clubs with the Highest Net Spend Since 2000 - Football Unspoken,2024-02-0223.jpg,none,"sports, economics, football, finances, clubs"
"Visual analysis: Ukraine’s war of survival enters third year • How Russia’s full-scale invasion is bearing on each nation’s military, economy and politics",Naurgul,2024-02-24,https://www.ft.com/content/39656a7f-fcf8-4ceb-b162-041863dc7a55,https://www.reddit.com/r/dataisbeautiful/comments/1aywaeg/visual_analysis_ukraines_war_of_survival_enters/,1,1,0,11,"Visual analysis Ukraine’s war of survival enters third year • How Russia’s full-scale invasion is bearing on each nation’s military, economy and polit",2024-02-0253.jpg,none,"ukraine, russia, war, military, economy, politics"
Best 5 BI Tools Widely Applicable for Data Visualization,michaellyamm,2024-02-27,https://www.dasca.org/world-of-big-data/article/best-5-bi-tools-widely-applicable-for-data-visualization,https://www.reddit.com/r/dataisbeautiful/comments/1b1chuh/best_5_bi_tools_widely_applicable_for_data/,1,1,0,1,Best 5 BI Tools Widely Applicable for Data Visualization,2024-02-0270.jpg,none,"data visualization, bi tools, technology"
CRE for Equity Profiles,OverflowDs,2024-02-27,https://www.census.gov/library/visualizations/interactive/community-resilience-estimates-for-equity.html,https://www.reddit.com/r/dataisbeautiful/comments/1b1dsdy/cre_for_equity_profiles/,6,6,0,0,CRE for Equity Profiles,2024-02-0271.jpg,none,"demographics, equity, profiles, data, united states census"
"Visualizing the 20 Fundamental Human Emotions - Semantic Space Theory Maps The Complex Landscape Beyond ""Happy"" and ""Sad""",Screedraptor,2024-02-28,https://www.hume.ai/blog/what-is-semantic-space-theory,https://www.reddit.com/r/dataisbeautiful/comments/1b2704o/visualizing_the_20_fundamental_human_emotions/,12,12,0,2,Visualizing the 20 Fundamental Human Emotions - Semantic Space Theory Maps The Complex Landscape Beyond Happy and Sad,2024-02-0281.jpg,none,none
Average ocean temp at record high since last March ,redwood520,2024-02-29,https://www.lemonde.fr/en/environment/article/2024/02/01/ocean-temperatures-reach-impressive-and-worrying-record-levels_6485327_114.html,https://www.reddit.com/r/dataisbeautiful/comments/1b3bfib/average_ocean_temp_at_record_high_since_last_march/,97,97,0,9,Average ocean temp at record high since last March,2024-02-0302.jpg,none,"climate, ocean temperature, environment, weather"
Think Python Comprehensive Overview/Book recommendation,Arugula3738,2024-02-29,https://dev.drlambda.ai/shared/think-python-a-comprehensive-overview-hfZhqE,https://www.reddit.com/r/dataisbeautiful/comments/1b3gxhg/think_python_comprehensive_overviewbook/,1,1,0,0,Think Python Comprehensive OverviewBook recommendation,2024-02-0303.jpg,none,"python, programming, books, education"
