title,author,created_date,url,full_permalink,score,ups,downs,num_comments,sanitized_title,image_file
The development of the St. Petersburg underground,kellykellykellyyyy,2013-05-13 17:43:55,http://russiansphinx.blogspot.ca/2013/03/the-development-of-st-petersburg.html,https://www.reddit.com/r/dataisbeautiful/comments/1e98oj/the_development_of_the_st_petersburg_underground/,2,2,0,1,The development of the St. Petersburg underground,2013-05-0074.jpg
"Annual returns of stocks, bonds and treasury bills since 1928",Beaglesworth,2013-05-13 19:30:39,http://visualizingeconomics.com/blog/2013/5/9/stocks-bonds-and-bills-retunrs,https://www.reddit.com/r/dataisbeautiful/comments/1e9hd4/annual_returns_of_stocks_bonds_and_treasury_bills/,2,2,0,0,"Annual returns of stocks, bonds and treasury bills since 1928",2013-05-0075.jpg
Music sales in the past 40 years,joey1405,2013-05-13 20:05:07,http://money.cnn.com/interactive/technology/itunes-music-decline/?iid=EL,https://www.reddit.com/r/dataisbeautiful/comments/1e9kbb/music_sales_in_the_past_40_years/,13,13,0,9,Music sales in the past 40 years,2013-05-0076.jpg
Money on the Bench - visualizing amount paid to injured MLB players,nthitz,2013-05-14 01:26:52,http://www.nytimes.com/interactive/2013/05/13/sports/baseball/money-on-the-bench.html?_r=0,https://www.reddit.com/r/dataisbeautiful/comments/1eaa5o/money_on_the_bench_visualizing_amount_paid_to/,7,7,0,5,Money on the Bench - visualizing amount paid to injured MLB players,2013-05-0077.jpg
Where the jobs are for young college grads? College-educated 20- to 30-year-olds hit metro areas in big numbers from 2006 to 2011. About 80% had jobs. Here are totals for 2011 and the percentage change from 2006,healthanalyst,2013-05-14 02:49:34,http://www.usatoday.com/story/news/nation/2013/05/11/college-grad-jobs-major-metros/2149915/,https://www.reddit.com/r/dataisbeautiful/comments/1eagms/where_the_jobs_are_for_young_college_grads/,0,0,0,1,Where the jobs are for young college grads College-educated 20- to 30-year-olds hit metro areas in big numbers from 2006 to 2011. About 80% had jobs.,2013-05-0078.jpg
What Time Did You Go To Bed Last Night? My daughters homework project. Lets give her some more data points to work with. Sorry about the time stamp.,Piscator629,2013-05-15 02:43:25,http://i.imgur.com/hzI9iFg.jpg,https://www.reddit.com/r/dataisbeautiful/comments/1ecxrl/what_time_did_you_go_to_bed_last_night_my/,0,0,0,7,What Time Did You Go To Bed Last Night My daughters homework project. Lets give her some more data points to work with. Sorry about the time stamp.,2013-05-0079.png
An interactive visualization of which episodes recurring jokes in Arrested Development show up in,alilja,2013-05-15 04:43:56,http://recurringdevelopments.com,https://www.reddit.com/r/dataisbeautiful/comments/1ed5o6/an_interactive_visualization_of_which_episodes/,57,57,0,2,An interactive visualization of which episodes recurring jokes in Arrested Development show up in,2013-05-0080.jpg
An interactive visualisation of running jokes in Arrested Development,tecumsehvalley,2013-05-15 14:16:17,http://recurringdevelopments.com/,https://www.reddit.com/r/dataisbeautiful/comments/1edswu/an_interactive_visualisation_of_running_jokes_in/,1,1,0,1,An interactive visualisation of running jokes in Arrested Development,2013-05-0081.jpg
Paths through cities,julian88888888,2013-05-15 19:37:37,http://www.flickr.com/photos/walkingsf/sets/72157629014750905/detail/,https://www.reddit.com/r/dataisbeautiful/comments/1eehd4/paths_through_cities/,406,406,0,25,Paths through cities,2013-05-0082.jpg
The evolution of the Firefox's code base.,Semaphor,2013-05-15 20:17:48,http://almossawi.com/firefox/,https://www.reddit.com/r/dataisbeautiful/comments/1eekm4/the_evolution_of_the_firefoxs_code_base/,13,13,0,4,The evolution of the Firefox's code base.,2013-05-0083.jpg
Top 15% of Twitter Users Make 85% of All Tweets? Outrageous!,Frankwall,2013-05-16 06:56:23,http://www.statista.com/topics/737/twitter/chart/1098/distribution-of-of-tweets-among-twitter-users/,https://www.reddit.com/r/dataisbeautiful/comments/1efs5x/top_15_of_twitter_users_make_85_of_all_tweets/,46,46,0,10,Top 15% of Twitter Users Make 85% of All Tweets Outrageous!,2013-05-0084.jpg
Gatsby Cannes buzz on twitter analyzed (french article).,seadeaf,2013-05-16 16:45:20,"http://www.telerama.fr/festival-de-cannes/2013/autopsie-d-un-buzz-gatsby-peut-remercier-cannes,97519.php?fb_action_ids=10152871201775604&fb_action_types=og.recommends&fb_source=other_multiline&action_object_map=%7B%2210152871201775604%22%3A447955311961679%7D&action_type_map=%7B%2210152871201775604%22%3A%22og.recommends%22%7D&action_ref_map=%5B%5D",https://www.reddit.com/r/dataisbeautiful/comments/1egju0/gatsby_cannes_buzz_on_twitter_analyzed_french/,16,16,0,0,Gatsby Cannes buzz on twitter analyzed (french article).,2013-05-0085.jpg
The Ultimate Spaceship Face-off: A highly speculative search for the fastest ship in science fiction.,jeweloree,2013-05-16 17:30:10,http://www.slate.com/articles/arts/map_of_the_week/2013/05/star_trek_enterprise_vs_star_wars_millennium_falcon_which_ship_is_fastest.html,https://www.reddit.com/r/dataisbeautiful/comments/1egn6i/the_ultimate_spaceship_faceoff_a_highly/,112,112,0,38,The Ultimate Spaceship Face-off A highly speculative search for the fastest ship in science fiction.,2013-05-0086.jpg
Drug marketers use network diagrams to target influential doctors,Beaglesworth,2013-05-17 12:08:10,http://www.nytimes.com/interactive/2013/05/16/business/PHARMA.html?_r=0,https://www.reddit.com/r/dataisbeautiful/comments/1eih20/drug_marketers_use_network_diagrams_to_target/,30,30,0,0,Drug marketers use network diagrams to target influential doctors,2013-05-0087.jpg
Changes in global life expectancy over the past 20 years,Beaglesworth,2013-05-17 20:32:31,http://blog.thomsonreuters.com/index.php/global-life-expectancy-graphic-of-the-day/,https://www.reddit.com/r/dataisbeautiful/comments/1ejf4y/changes_in_global_life_expectancy_over_the_past/,27,27,0,0,Changes in global life expectancy over the past 20 years,2013-05-0088.jpg
Perpetual Ocean: two years worth of surface currents from the ECCO2 model of global ocean and sea-ice,buildmonkey,2013-05-17 20:51:42,http://www.youtube.com/watch?gl=GB&client=mv-google&hl=en-GB&v=xusdWPuWAoU&nomobile=1,https://www.reddit.com/r/dataisbeautiful/comments/1ejghs/perpetual_ocean_two_years_worth_of_surface/,128,128,0,19,Perpetual Ocean two years worth of surface currents from the ECCO2 model of global ocean and sea-ice,2013-05-0089.jpg
"Different take on running jokes in Arrested Development, this one from NPR [xpost from r/arresteddevelopment]",Beaglesworth,2013-05-17 22:12:40,http://apps.npr.org/arrested-development/,https://www.reddit.com/r/dataisbeautiful/comments/1ejm77/different_take_on_running_jokes_in_arrested/,299,299,0,19,"Different take on running jokes in Arrested Development, this one from NPR xpost from rarresteddevelopment",2013-05-0090.jpg
"Season Of GPS Tracking Data. Around 2200km (1370mi) of chairlifts, hikes and runs. [OC]",Digitalanthill,2013-05-18 12:21:46,http://i.imgur.com/ahGrpNH.jpg,https://www.reddit.com/r/dataisbeautiful/comments/1eknmm/season_of_gps_tracking_data_around_2200km_1370mi/,700,700,0,23,"Season Of GPS Tracking Data. Around 2200km (1370mi) of chairlifts, hikes and runs. OC",2013-05-0091.jpg
Graphing Parking: blog series that visualizes parking requirements for different land uses around the country,Pixelated_Penguin,2013-05-18 18:15:08,http://graphingparking.wordpress.com/,https://www.reddit.com/r/dataisbeautiful/comments/1el5l9/graphing_parking_blog_series_that_visualizes/,11,11,0,2,Graphing Parking blog series that visualizes parking requirements for different land uses around the country,2013-05-0092.jpg
Interactive graph of the popularity of baby names from the 1880s to the present. Type in the first few letters of a name to see similar names and stats.,MonkfishPrincess,2013-05-19 16:59:41,http://www.babynamewizard.com/voyager#prefix=lav&ms=false&exact=false,https://www.reddit.com/r/dataisbeautiful/comments/1emzav/interactive_graph_of_the_popularity_of_baby_names/,28,28,0,10,Interactive graph of the popularity of baby names from the 1880s to the present. Type in the first few letters of a name to see similar names and stat,2013-05-0093.jpg
"The worlds best countries, apparently.",Kazaril,2013-05-20 06:53:51,http://www.thedailybeast.com/newsweek/2010/08/15/interactive-infographic-of-the-worlds-best-countries.html,https://www.reddit.com/r/dataisbeautiful/comments/1eojar/the_worlds_best_countries_apparently/,0,0,0,0,"The worlds best countries, apparently.",2013-05-0094.jpg
IMDB User Ratings of 32 TV Shows,DaleSwanson,2013-05-20 10:36:08,http://imgur.com/a/gO68p,https://www.reddit.com/r/dataisbeautiful/comments/1eoq9o/imdb_user_ratings_of_32_tv_shows/,55,55,0,25,IMDB User Ratings of 32 TV Shows,2013-05-0095.jpg
Neil Armstrong's heart rate during Apollo 11,segers909,2013-05-20 12:27:42,http://i.imgur.com/U71EmmG.jpg,https://www.reddit.com/r/dataisbeautiful/comments/1eougx/neil_armstrongs_heart_rate_during_apollo_11/,2602,2602,0,211,Neil Armstrong's heart rate during Apollo 11,2013-05-0096.jpg
Renewable Energy Production by State,Echoey,2013-05-20 13:18:48,http://www.slate.com/articles/health_and_science/climate_desk/2013/05/renewable_energy_map_wind_solar_hydroelectric_power_use_by_state.html,https://www.reddit.com/r/dataisbeautiful/comments/1eowyv/renewable_energy_production_by_state/,9,9,0,2,Renewable Energy Production by State,2013-05-0097.jpg
"In light of all the recent gay marriage legislation, [OC]",Decapod73,2013-05-20 13:41:08,http://i.imgur.com/mYVhk9i.png,https://www.reddit.com/r/dataisbeautiful/comments/1eoy5y/in_light_of_all_the_recent_gay_marriage/,52,52,0,4,"In light of all the recent gay marriage legislation, OC",2013-05-0098.png
"We the data - For the people, by the people.",ani625,2013-05-20 13:59:43,http://wethedata.org/about/how-was-this-done/,https://www.reddit.com/r/dataisbeautiful/comments/1eozaq/we_the_data_for_the_people_by_the_people/,0,0,0,5,"We the data - For the people, by the people.",2013-05-0099.jpg
Visualization of the Persecution of the Bahá'í community in Iran,gagnonje5000,2013-05-20 19:35:17,http://threatwiki.thesentinelproject.org/iranvisualization,https://www.reddit.com/r/dataisbeautiful/comments/1epo85/visualization_of_the_persecution_of_the_baháí/,8,8,0,1,Visualization of the Persecution of the Bahá'í community in Iran,2013-05-0100.jpg
"Ranking Linux distributions, and the decline of the traditional distros",dberkholz,2013-05-20 20:50:39,http://redmonk.com/dberkholz/2013/05/20/ranking-linux-distributions-and-the-decline-of-the-traditional-distros/,https://www.reddit.com/r/dataisbeautiful/comments/1epuk1/ranking_linux_distributions_and_the_decline_of/,15,15,0,1,"Ranking Linux distributions, and the decline of the traditional distros",2013-05-0101.jpg
7 years of code revision in the FEniCS project. [3:35],jaedalus,2013-05-21 01:14:36,https://www.youtube.com/watch?v=0E6DGUbRrO4,https://www.reddit.com/r/dataisbeautiful/comments/1eqfub/7_years_of_code_revision_in_the_fenics_project_335/,9,9,0,0,7 years of code revision in the FEniCS project. 335,2013-05-0102.jpg
Google Play Set to Overtake Apple's App Store?,Frankwall,2013-05-21 06:55:23,http://www.statista.com/topics/1002/mobile-app-usage/chart/1109/google-play-looks-set-to-overtake-apple-s-app-store/,https://www.reddit.com/r/dataisbeautiful/comments/1er1vd/google_play_set_to_overtake_apples_app_store/,13,13,0,1,Google Play Set to Overtake Apple's App Store,2013-05-0103.jpg
Annual Fatalities from Disasters in the US,m00f,2013-05-21 14:54:31,http://i.imgur.com/UtGvf7P.png,https://www.reddit.com/r/dataisbeautiful/comments/1erljv/annual_fatalities_from_disasters_in_the_us/,1129,1129,0,156,Annual Fatalities from Disasters in the US,2013-05-0104.png
All Killer Tornadoes Since 1950,paramnesiac,2013-05-22 02:53:56,http://www.slate.com/articles/news_and_politics/map_of_the_week/2013/05/map_charts_killer_tornadoes_in_u_s_since_1950.html?fb_ref=sm_fb_share_toolbar,https://www.reddit.com/r/dataisbeautiful/comments/1et66c/all_killer_tornadoes_since_1950/,47,47,0,4,All Killer Tornadoes Since 1950,2013-05-0105.jpg
Assessing the Damage Along the Tornado’s Path in Oklahoma,healthanalyst,2013-05-22 16:13:49,http://www.nytimes.com/interactive/2013/05/20/us/oklahoma-tornado-map.html,https://www.reddit.com/r/dataisbeautiful/comments/1eualj/assessing_the_damage_along_the_tornados_path_in/,74,74,0,2,Assessing the Damage Along the Tornado’s Path in Oklahoma,2013-05-0106.jpg
American corporate profits and income tax,wallysmith127,2013-05-22 18:27:53,http://media.economist.com/sites/default/files/imagecache/full-width/images/2013/05/blogs/graphic-detail/20130525_gdc686.png,https://www.reddit.com/r/dataisbeautiful/comments/1eulcm/american_corporate_profits_and_income_tax/,658,658,0,73,American corporate profits and income tax,2013-05-0107.png
Billion Dollar-o-Gram 2013,Bemuzed,2013-05-22 18:42:10,http://www.informationisbeautiful.net/visualizations/billion-dollar-o-gram-2013/,https://www.reddit.com/r/dataisbeautiful/comments/1eumjc/billion_dollarogram_2013/,28,28,0,3,Billion Dollar-o-Gram 2013,2013-05-0108.jpg
Satellite map showing Oklahoma tornado damage with path of tornado overlaid.,error9900,2013-05-23 15:05:53,http://apps.npr.org/moore-oklahoma-tornado-damage/,https://www.reddit.com/r/dataisbeautiful/comments/1ewn4l/satellite_map_showing_oklahoma_tornado_damage/,296,296,0,34,Satellite map showing Oklahoma tornado damage with path of tornado overlaid.,2013-05-0109.jpg
Vegetation in function of precipitation and temperature (IPCC 1996),233C,2013-05-23 18:12:06,http://i.imgur.com/GN14L90.png,https://www.reddit.com/r/dataisbeautiful/comments/1ex1ba/vegetation_in_function_of_precipitation_and/,744,744,0,62,Vegetation in function of precipitation and temperature (IPCC 1996),2013-05-0110.png
"Interesting homicide map of Baltimore, MD, sortable by age, gender, race, and cause of death.",Warlizard,2013-05-23 18:27:39,http://data.baltimoresun.com/homicides/,https://www.reddit.com/r/dataisbeautiful/comments/1ex2kp/interesting_homicide_map_of_baltimore_md_sortable/,6,6,0,1,"Interesting homicide map of Baltimore, MD, sortable by age, gender, race, and cause of death.",2013-05-0111.jpg
Twisting & Turning on Tornado Data: Beth Schultz discusses several dataviz images and how they capture the Oklahoma city tornado data (or fail to).,nothingtolookat,2013-05-23 19:02:52,http://www.allanalytics.com/author.asp?section_id=1411&doc_id=263679&cid=amp_twt_es,https://www.reddit.com/r/dataisbeautiful/comments/1ex5cm/twisting_turning_on_tornado_data_beth_schultz/,1,1,0,0,Twisting & Turning on Tornado Data Beth Schultz discusses several dataviz images and how they capture the Oklahoma city tornado data (or fail to).,2013-05-0112.jpg
"Interactive aerial views of Moore, OK before/after Monday's EF-5 tornado",skewTlogP,2013-05-23 21:11:24,http://tmappsevents.esri.com/website/swipe_moore/,https://www.reddit.com/r/dataisbeautiful/comments/1exfyv/interactive_aerial_views_of_moore_ok_beforeafter/,14,14,0,0,"Interactive aerial views of Moore, OK beforeafter Monday's EF-5 tornado",2013-05-0113.jpg
"Energy balance of the UK's electricity: sources, losses and end-use (Sankey Diagram)",Trimethopimp,2013-05-24 01:00:38,http://i.imgur.com/HIreWkD.png,https://www.reddit.com/r/dataisbeautiful/comments/1exx0l/energy_balance_of_the_uks_electricity_sources/,27,27,0,9,"Energy balance of the UK's electricity sources, losses and end-use (Sankey Diagram)",2013-05-0114.png
Difference between actual and proportional party seat result by state for 2012 US House elections [OC],saute,2013-05-24 17:55:32,http://i.imgur.com/a3w7QPr.png,https://www.reddit.com/r/dataisbeautiful/comments/1ezf4h/difference_between_actual_and_proportional_party/,443,443,0,142,Difference between actual and proportional party seat result by state for 2012 US House elections OC,2013-05-0115.png
Comparison of drone strikes between Presidents Bush and Obama (as published by BBC News),DoorGuote,2013-05-24 18:42:33,http://imgur.com/d8i3V3N,https://www.reddit.com/r/dataisbeautiful/comments/1ezikm/comparison_of_drone_strikes_between_presidents/,47,47,0,20,Comparison of drone strikes between Presidents Bush and Obama (as published by BBC News),2013-05-0116.jpg
Today's Front Pages,ioinc,2013-05-24 21:28:14,http://www.newseum.org/todaysfrontpages/flash/,https://www.reddit.com/r/dataisbeautiful/comments/1ezuk0/todays_front_pages/,5,5,0,0,Today's Front Pages,2013-05-0117.jpg
"Mapping Dylan: Every street, town, and city that Bob Dylan has ever sung about",diogeneselpirata,2013-05-24 22:17:43,http://www.slate.com/articles/arts/map_of_the_week/2013/05/bob_dylan_map_every_place_mentioned_in_a_bob_dylan_song.html,https://www.reddit.com/r/dataisbeautiful/comments/1ezxw1/mapping_dylan_every_street_town_and_city_that_bob/,37,37,0,1,"Mapping Dylan Every street, town, and city that Bob Dylan has ever sung about",2013-05-0118.jpg
"Where the content of the news stories took place in 2,900 links to /r/worldnews between February and June 2012. [OC]",RhinestoneTaco,2013-05-24 22:17:55,http://i.imgur.com/Ua7WSfN.png,https://www.reddit.com/r/dataisbeautiful/comments/1ezxwk/where_the_content_of_the_news_stories_took_place/,687,687,0,67,"Where the content of the news stories took place in 2,900 links to rworldnews between February and June 2012. OC",2013-05-0119.png
Bridge Collapses And Structurally Deficient Bridges Across The Country (INFOGRAPHIC),srtad,2013-05-25 00:35:38,http://www.huffingtonpost.com/2013/05/24/bridge-collapses-structurally-deficient-_n_3333649.html,https://www.reddit.com/r/dataisbeautiful/comments/1f06fx/bridge_collapses_and_structurally_deficient/,13,13,0,1,Bridge Collapses And Structurally Deficient Bridges Across The Country (INFOGRAPHIC),2013-05-0120.jpg
"Off the Charts: Under Obama, Stocks Do Better",Beaglesworth,2013-05-25 02:16:17,http://www.nytimes.com/interactive/2013/05/24/business/Under-Obama-Stocks-Do-Better.html?ref=economy,https://www.reddit.com/r/dataisbeautiful/comments/1f0cad/off_the_charts_under_obama_stocks_do_better/,14,14,0,7,"Off the Charts Under Obama, Stocks Do Better",2013-05-0121.jpg
Recorded Meteor Sightings By Continent [OC],KatzMan88,2013-05-25 05:32:30,http://i.imgur.com/zQiE3KU.jpg,https://www.reddit.com/r/dataisbeautiful/comments/1f0mad/recorded_meteor_sightings_by_continent_oc/,2,2,0,6,Recorded Meteor Sightings By Continent OC,2013-05-0122.jpg
Graphical list of classical music composers by era,eleemosynary,2013-05-25 07:15:20,http://en.wikipedia.org/wiki/Graphical_timeline_for_classical_composers,https://www.reddit.com/r/dataisbeautiful/comments/1f0q48/graphical_list_of_classical_music_composers_by_era/,83,83,0,2,Graphical list of classical music composers by era,2013-05-0123.jpg
Tax Rates across U.S. Companies visualized by Mike Bostock et al. at the New York Times,healthanalyst,2013-05-25 23:08:36,http://www.nytimes.com/interactive/2013/05/25/sunday-review/corporate-taxes.html,https://www.reddit.com/r/dataisbeautiful/comments/1f1xno/tax_rates_across_us_companies_visualized_by_mike/,159,159,0,25,Tax Rates across U.S. Companies visualized by Mike Bostock et al. at the New York Times,2013-05-0124.jpg
Interactive patterns in placenames of France and the British Isles (LL- / W- / -AC) (other countries available) [OC],seszett,2013-05-26 18:29:34,http://ssz.fr/places/?frukie#^ll/^w/ac$,https://www.reddit.com/r/dataisbeautiful/comments/1f3c3u/interactive_patterns_in_placenames_of_france_and/,30,30,0,6,Interactive patterns in placenames of France and the British Isles (LL- W- -AC) (other countries available) OC,2013-05-0125.jpg
"This seems kind of like a joke, but: A visualization of the world's population",AyeAyeLtd,2013-05-27 00:24:02,http://www.datapointed.net/visualizations/population/world/seven-billion-plus/,https://www.reddit.com/r/dataisbeautiful/comments/1f3xwo/this_seems_kind_of_like_a_joke_but_a/,765,765,0,118,"This seems kind of like a joke, but A visualization of the world's population",2013-05-0126.jpg
Discovery of asteroids 1980-2012. Data supplied by Lowell Observatory and Minor Planet Center.,bendvis,2013-05-27 02:12:44,http://youtu.be/xJsUDcSc6hE,https://www.reddit.com/r/dataisbeautiful/comments/1f44di/discovery_of_asteroids_19802012_data_supplied_by/,10,10,0,0,Discovery of asteroids 1980-2012. Data supplied by Lowell Observatory and Minor Planet Center.,2013-05-0127.jpg
Rate of adoption for various technologies (From 2/10/98 NYT - could use an update),zuilserip,2013-05-27 03:43:06,http://i.imgur.com/nAdj2qZ.png,https://www.reddit.com/r/dataisbeautiful/comments/1f49sw/rate_of_adoption_for_various_technologies_from/,31,31,0,5,Rate of adoption for various technologies (From 21098 NYT - could use an update),2013-05-0128.png
Five years of every NBA shot attempt visualized,shit-bird,2013-05-27 07:28:38,http://img.gawkerassets.com/img/17g7f0pf5xxaapng/k-bigpic.png,https://www.reddit.com/r/dataisbeautiful/comments/1f4l1q/five_years_of_every_nba_shot_attempt_visualized/,2335,2335,0,115,Five years of every NBA shot attempt visualized,2013-05-0129.png
Half of the World's Online Population Uses Facebook,Frankwall,2013-05-27 08:11:50,http://www.statista.com/topics/1164/social-networks/chart/1103/top-10-social-networks-in-q1-2013/,https://www.reddit.com/r/dataisbeautiful/comments/1f4mgn/half_of_the_worlds_online_population_uses_facebook/,14,14,0,4,Half of the World's Online Population Uses Facebook,2013-05-0130.jpg
Volatility at World's End: Two Decades of Movement in Markets. Implied vs. Realized volatility over time.,cornwallis098,2013-05-27 14:53:48,http://www.youtube.com/watch?feature=player_embedded&v=xlKWdd_DhW0,https://www.reddit.com/r/dataisbeautiful/comments/1f50q0/volatility_at_worlds_end_two_decades_of_movement/,7,7,0,1,Volatility at World's End Two Decades of Movement in Markets. Implied vs. Realized volatility over time.,2013-05-0131.jpg
36 Maps That Explain The World,musictomyomelette,2013-05-27 16:17:45,http://www.businessinsider.com/maps-that-explain-the-world-2013-2?op=1,https://www.reddit.com/r/dataisbeautiful/comments/1f55uq/36_maps_that_explain_the_world/,45,45,0,8,36 Maps That Explain The World,2013-05-0132.jpg
Global flight paths visualised,ovenproofjet,2013-05-28 07:51:38,http://www.bbc.co.uk/news/in-pictures-22657086,https://www.reddit.com/r/dataisbeautiful/comments/1f6sg7/global_flight_paths_visualised/,383,383,0,49,Global flight paths visualised,2013-05-0133.jpg
Blacksburg seismograph picks up Virginia Tech football game [x-post r/geology],Cayos,2013-05-28 22:56:15,http://imgur.com/6YuFYhM,https://www.reddit.com/r/dataisbeautiful/comments/1f8b9e/blacksburg_seismograph_picks_up_virginia_tech/,1055,1055,0,51,Blacksburg seismograph picks up Virginia Tech football game x-post rgeology,2013-05-0134.jpg
The Effective Tax Rate of Companies in the S&P 500 over a 6-year Period,austinwarren,2013-05-29 00:03:09,http://www.nytimes.com/interactive/2013/05/25/sunday-review/corporate-taxes.html?_r=0,https://www.reddit.com/r/dataisbeautiful/comments/1f8gdx/the_effective_tax_rate_of_companies_in_the_sp_500/,5,5,0,0,The Effective Tax Rate of Companies in the S&P 500 over a 6-year Period,2013-05-0135.jpg
The Stunning Fall Of Generation X (x-post from /r/GenX),eleemosynary,2013-05-29 02:37:29,http://www.businessinsider.com/generation-x-least-prepared-for-retirement-charts-2013-5?op=1,https://www.reddit.com/r/dataisbeautiful/comments/1f8sid/the_stunning_fall_of_generation_x_xpost_from_rgenx/,8,8,0,1,The Stunning Fall Of Generation X (x-post from rGenX),2013-05-0136.jpg
Google Handles 115 Billion Searches a Month,Frankwall,2013-05-29 07:22:27,http://www.statista.com/topics/1001/google/chart/898/number-of-searches-handled-by-search-engines-worldwide/,https://www.reddit.com/r/dataisbeautiful/comments/1f98n5/google_handles_115_billion_searches_a_month/,8,8,0,2,Google Handles 115 Billion Searches a Month,2013-05-0137.jpg
Mind-Blowing Visualization Of 'The Rite Of Spring',eleemosynary,2013-05-29 12:31:17,http://www.youtube.com/watch?feature=player_embedded&v=02tkp6eeh40,https://www.reddit.com/r/dataisbeautiful/comments/1f9j9u/mindblowing_visualization_of_the_rite_of_spring/,55,55,0,6,Mind-Blowing Visualization Of 'The Rite Of Spring',2013-05-0138.jpg
Interactive: The State of U.S. Immigration,Beaglesworth,2013-05-30 15:31:00,http://www.washingtonpost.com/wp-srv/special/national/the-state-of-immigration/,https://www.reddit.com/r/dataisbeautiful/comments/1fcacz/interactive_the_state_of_us_immigration/,83,83,0,25,Interactive The State of U.S. Immigration,2013-05-0139.jpg
Distribution of US House Districts by 2012 Presidential Vote,PinkSlimeIsPeople,2013-05-30 19:22:22,http://i.imgur.com/XA9odpl.png,https://www.reddit.com/r/dataisbeautiful/comments/1fcsge/distribution_of_us_house_districts_by_2012/,11,11,0,3,Distribution of US House Districts by 2012 Presidential Vote,2013-05-0140.png
Apple's Astonishing Profit in Context,Frankwall,2013-05-31 06:52:58,http://www.statista.com/topics/847/apple/chart/735/apple-s-astonishing-profit-in-context/,https://www.reddit.com/r/dataisbeautiful/comments/1fe3ib/apples_astonishing_profit_in_context/,26,26,0,4,Apple's Astonishing Profit in Context,2013-05-0141.jpg
The geography of Tweets - geotagged tweets visualized,chrisarchitect,2013-05-31 16:30:21,https://blog.twitter.com/2013/geography-tweets-3,https://www.reddit.com/r/dataisbeautiful/comments/1fety1/the_geography_of_tweets_geotagged_tweets/,22,22,0,1,The geography of Tweets - geotagged tweets visualized,2013-05-0142.jpg
Leading causes of death in the US,WallyMetropolis,2013-05-31 16:55:50,http://www.smbc-comics.com/index.php?db=comics&id=2994#comic,https://www.reddit.com/r/dataisbeautiful/comments/1fevw2/leading_causes_of_death_in_the_us/,0,0,0,0,Leading causes of death in the US,2013-05-0143.jpg
