title,author,created_date,url,full_permalink,score,ups,downs,num_comments,sanitized_title,image_file
Blonde Map of Europe,pressed,2013-05-01 12:24:43,http://i.imgur.com/YO1aSSj.jpg,https://www.reddit.com/r/dataisbeautiful/comments/1dh6kt/blonde_map_of_europe/,1554,1554,0,140,Blonde Map of Europe,2013-05-0000.jpg
Council on Foreign Relations' Invisible Armies Insurgency Tracker,davidystephenson,2013-05-01 14:14:39,http://www.cfr.org/wars-and-warfare/invisible-armies-insurgency-tracker/p29917?cid=emc-situation_report_pitch-insurgency_tracker-043013,https://www.reddit.com/r/dataisbeautiful/comments/1dhcji/council_on_foreign_relations_invisible_armies/,10,10,0,0,Council on Foreign Relations' Invisible Armies Insurgency Tracker,2013-05-0001.jpg
Large collection of beautiful visualised data,martinmcflyjr,2013-05-01 14:38:38,http://www.stamen.com/,https://www.reddit.com/r/dataisbeautiful/comments/1dhe34/large_collection_of_beautiful_visualised_data/,25,25,0,0,Large collection of beautiful visualised data,2013-05-0002.jpg
The Keeling Curve,You_meddling_kids,2013-05-01 21:50:43,http://keelingcurve.ucsd.edu/,https://www.reddit.com/r/dataisbeautiful/comments/1dicma/the_keeling_curve/,16,16,0,2,The Keeling Curve,2013-05-0003.jpg
Where have we been in space,Big_Oak,2013-05-01 21:57:01,http://www.bbc.co.uk/bbc.com/future/img/spacial_awareness.jpg,https://www.reddit.com/r/dataisbeautiful/comments/1did3t/where_have_we_been_in_space/,32,32,0,7,Where have we been in space,2013-05-0004.jpg
"Different Ulam Spiral: all numbers from 1 to 100000; the more divisors a number has, the larger is the dot.",-rix,2013-05-02 10:04:28,http://upload.wikimedia.org/wikipedia/commons/b/b0/Ulam_Spiral_Divisors_100000.png,https://www.reddit.com/r/dataisbeautiful/comments/1djjzv/different_ulam_spiral_all_numbers_from_1_to/,1593,1593,0,99,"Different Ulam Spiral all numbers from 1 to 100000; the more divisors a number has, the larger is the dot.",2013-05-0005.png
Graph showing most popular browsers. (Xpost from /r/mildlyinteresting),ATyp3,2013-05-02 10:08:09,http://i.imgur.com/HQBgqnj.png,https://www.reddit.com/r/dataisbeautiful/comments/1djk3f/graph_showing_most_popular_browsers_xpost_from/,14,14,0,9,Graph showing most popular browsers. (Xpost from rmildlyinteresting),2013-05-0006.png
Regression discontinuity of the Reinhart and Rogoff data. Nothing changes at the 90% threshold. x-post from /r/economics,RyanSmith,2013-05-02 15:23:12,http://imgur.com/6cQ20Nq,https://www.reddit.com/r/dataisbeautiful/comments/1djzon/regression_discontinuity_of_the_reinhart_and/,82,82,0,9,Regression discontinuity of the Reinhart and Rogoff data. Nothing changes at the 90% threshold. x-post from reconomics,2013-05-0007.jpg
"Too often, people make simple charts hard to read by using software defaults and not thinking about reader needs. Here's one simple fix that can better represent the data and make it easier to read.",nothingtolookat,2013-05-02 18:19:02,http://www.allanalytics.com/author.asp?section_id=3072&doc_id=262539&,https://www.reddit.com/r/dataisbeautiful/comments/1dkd76/too_often_people_make_simple_charts_hard_to_read/,14,14,0,0,"Too often, people make simple charts hard to read by using software defaults and not thinking about reader needs. Here's one simple fix that can bette",2013-05-0008.jpg
Global tidal fluctuations,large-farva,2013-05-02 23:13:46,http://upload.wikimedia.org/wikipedia/commons/5/5e/M2_tidal_constituent.jpg,https://www.reddit.com/r/dataisbeautiful/comments/1dl0z4/global_tidal_fluctuations/,61,61,0,2,Global tidal fluctuations,2013-05-0009.jpg
"Signal analysis with SETI@Home, looking for a message from ET",jaedalus,2013-05-02 23:20:13,http://upload.wikimedia.org/wikipedia/commons/f/ff/Setiathomeversion3point07.JPG,https://www.reddit.com/r/dataisbeautiful/comments/1dl1gf/signal_analysis_with_setihome_looking_for_a/,11,11,0,4,"Signal analysis with SETI@Home, looking for a message from ET",2013-05-0010.jpg
The world in the last 200 years,Paracelse,2013-05-02 23:45:27,http://www.youtube.com/watch?v=e8OEuj6-pVg,https://www.reddit.com/r/dataisbeautiful/comments/1dl3bt/the_world_in_the_last_200_years/,14,14,0,3,The world in the last 200 years,2013-05-0011.jpg
"If you are 25 years old, this is how many weeks you have left to live on average (x-post from /r/morbidreality)",bugxbuster,2013-05-03 04:32:02,http://i.imgur.com/MA3YeuX.jpg,https://www.reddit.com/r/dataisbeautiful/comments/1dlnmo/if_you_are_25_years_old_this_is_how_many_weeks/,818,818,0,179,"If you are 25 years old, this is how many weeks you have left to live on average (x-post from rmorbidreality)",2013-05-0012.jpg
Property values in DC ca. 1880 (from /r/washingtondc),novalsi,2013-05-03 06:00:17,http://i.imgur.com/F9Rb0mu.jpg,https://www.reddit.com/r/dataisbeautiful/comments/1dlshs/property_values_in_dc_ca_1880_from_rwashingtondc/,184,184,0,10,Property values in DC ca. 1880 (from rwashingtondc),2013-05-0013.jpg
Animated global income distribution projections to 2030,Beaglesworth,2013-05-03 15:04:18,http://www.brookings.edu/research/interactives/2013/ending-extreme-poverty#poverty_line,https://www.reddit.com/r/dataisbeautiful/comments/1dmeih/animated_global_income_distribution_projections/,128,128,0,12,Animated global income distribution projections to 2030,2013-05-0014.jpg
2012 Post-Convention Public Presidential Campaign Visits,saute,2013-05-03 16:12:18,http://maps.google.com/maps/ms?msid=203902443974975889724.0004db311792dcb29efc8&msa=0,https://www.reddit.com/r/dataisbeautiful/comments/1dmjbx/2012_postconvention_public_presidential_campaign/,16,16,0,5,2012 Post-Convention Public Presidential Campaign Visits,2013-05-0015.jpg
Video of all Earthquakes from 01/01/2010 to 05/01/2013 in Japan,BullBoxerBAB,2013-05-03 22:05:57,http://www.youtube.com/watch?v=UOo7EnBYxps,https://www.reddit.com/r/dataisbeautiful/comments/1dn9au/video_of_all_earthquakes_from_01012010_to/,33,33,0,12,Video of all Earthquakes from 01012010 to 05012013 in Japan,2013-05-0016.jpg
Waste water disposal wells (mostly from fracking) in Texas,NonNonHeinous,2013-05-04 17:31:17,http://www.texastribune.org/series/water-for-fracking/map/,https://www.reddit.com/r/dataisbeautiful/comments/1doqft/waste_water_disposal_wells_mostly_from_fracking/,152,152,0,18,Waste water disposal wells (mostly from fracking) in Texas,2013-05-0017.jpg
Stress Analysis data shown on a 3d printed model (x-post /r/3dprinting),peeloo,2013-05-05 11:36:05,http://i.imgur.com/HcAN0lO.jpg,https://www.reddit.com/r/dataisbeautiful/comments/1dq77r/stress_analysis_data_shown_on_a_3d_printed_model/,1429,1429,0,43,Stress Analysis data shown on a 3d printed model (x-post r3dprinting),2013-05-0018.jpg
"U.S. Total Money Income Distribution by Age, 2012",koggit,2013-05-05 18:58:14,http://2.bp.blogspot.com/-WkitcrQjzEE/UPfzDvEC-KI/AAAAAAAAHW4/jyvJ9JQQCkA/s1600/us-total-money-income-distribution-by-age-2012.png,https://www.reddit.com/r/dataisbeautiful/comments/1dqsxn/us_total_money_income_distribution_by_age_2012/,81,81,0,11,"U.S. Total Money Income Distribution by Age, 2012",2013-05-0019.png
How iTunes Smashed Physical Music Distribution,Frankwall,2013-05-06 09:46:34,http://www.statista.com/topics/1386/digital-music/chart/1075/the-digital-music-revolution/,https://www.reddit.com/r/dataisbeautiful/comments/1ds8q5/how_itunes_smashed_physical_music_distribution/,305,305,0,70,How iTunes Smashed Physical Music Distribution,2013-05-0020.jpg
Number of films shot in each state [OC],Zacoppotamus,2013-05-06 12:10:06,https://github.com/zacoppotamus/MovieVisualization,https://www.reddit.com/r/dataisbeautiful/comments/1dsdgl/number_of_films_shot_in_each_state_oc/,64,64,0,16,Number of films shot in each state OC,2013-05-0021.jpg
Food Stamps Recipients by County (interactive map),terrortot,2013-05-06 14:12:42,http://www.slate.com/articles/news_and_politics/map_of_the_week/2013/04/food_stamp_recipients_by_county_an_interactive_tool_showing_local_snap_data.html,https://www.reddit.com/r/dataisbeautiful/comments/1dsjlv/food_stamps_recipients_by_county_interactive_map/,21,21,0,2,Food Stamps Recipients by County (interactive map),2013-05-0022.jpg
Street quality in Los Angeles,oildig,2013-05-06 14:51:08,http://graphics.latimes.com/la-streets-map/#11/34.0473/-118.5754,https://www.reddit.com/r/dataisbeautiful/comments/1dsm1d/street_quality_in_los_angeles/,64,64,0,13,Street quality in Los Angeles,2013-05-0023.jpg
"One million (x,y) pairs representing a random walk starting at (0,0) in a two-dimensional plane [OC]",lazzeri,2013-05-06 16:10:43,http://i.imgur.com/IPzYbR9.png,https://www.reddit.com/r/dataisbeautiful/comments/1dsrmf/one_million_xy_pairs_representing_a_random_walk/,656,656,0,175,"One million (x,y) pairs representing a random walk starting at (0,0) in a two-dimensional plane OC",2013-05-0024.png
Made a heatmap to view 4y of GPS running data [oc] (x-post from /r/running),thebenwatts,2013-05-06 16:45:26,http://a.tiles.mapbox.com/v3/benwatts.map-yl66ucju/page.html,https://www.reddit.com/r/dataisbeautiful/comments/1dsu8v/made_a_heatmap_to_view_4y_of_gps_running_data_oc/,70,70,0,3,Made a heatmap to view 4y of GPS running data oc (x-post from rrunning),2013-05-0025.jpg
United States Debt as a percentage of GDP,JMB1656,2013-05-06 17:58:53,http://imgur.com/nsEhiPi,https://www.reddit.com/r/dataisbeautiful/comments/1dszrh/united_states_debt_as_a_percentage_of_gdp/,217,217,0,26,United States Debt as a percentage of GDP,2013-05-0026.jpg
French-German Bond Prices and their relationship with key events since 1983,04815162342,2013-05-06 20:11:25,http://imgur.com/lRNNeq6,https://www.reddit.com/r/dataisbeautiful/comments/1dta4q/frenchgerman_bond_prices_and_their_relationship/,6,6,0,1,French-German Bond Prices and their relationship with key events since 1983,2013-05-0027.jpg
Random walk I made with non-uniform distribution. 2000 walkers for 10000 steps.,superlaser1,2013-05-06 22:16:24,http://imgur.com/a/cpYZp,https://www.reddit.com/r/dataisbeautiful/comments/1dtksl/random_walk_i_made_with_nonuniform_distribution/,5,5,0,5,Random walk I made with non-uniform distribution. 2000 walkers for 10000 steps.,2013-05-0028.jpg
Most CL wins per country and per city (xpost from r/soccer),35nnnn,2013-05-07 01:02:22,http://i.imgur.com/yxazMKu.jpg,https://www.reddit.com/r/dataisbeautiful/comments/1dty04/most_cl_wins_per_country_and_per_city_xpost_from/,19,19,0,6,Most CL wins per country and per city (xpost from rsoccer),2013-05-0029.png
Congratulations New Zealand - You got screwed,funkdified,2013-05-07 06:04:01,http://i.imgur.com/NTPLIq7.png?1,https://www.reddit.com/r/dataisbeautiful/comments/1duiy4/congratulations_new_zealand_you_got_screwed/,34,34,0,6,Congratulations New Zealand - You got screwed,2013-05-0030.png
3D visualization of our 100 000 closest stars.,lazyink,2013-05-07 14:37:07,http://workshop.chromeexperiments.com/stars/??fsrc=scn/=tw/dc,https://www.reddit.com/r/dataisbeautiful/comments/1dv36k/3d_visualization_of_our_100_000_closest_stars/,915,915,0,97,3D visualization of our 100 000 closest stars.,2013-05-0031.jpg
How to go viral: Gangnam Style and The Harlem Shake Twitter influences compared. Pretty.,Pupmup,2013-05-07 17:25:38,http://www.guardian.co.uk/news/datablog/interactive/2013/may/07/how-to-go-viral-gangnam-style-harlem-shake?utm_source=twitterfeed&utm_medium=twitter,https://www.reddit.com/r/dataisbeautiful/comments/1dvftl/how_to_go_viral_gangnam_style_and_the_harlem/,7,7,0,0,How to go viral Gangnam Style and The Harlem Shake Twitter influences compared. Pretty.,2013-05-0032.jpg
Number of Supertall (300m+) Buildings Completed Each Year Since 1995,Tokyocheesesteak,2013-05-07 19:42:34,http://ctbuh.org/Portals/0/Tallest/2020/2011/Graph_AnnualCompletion_Totals_(c)CTBUH_.jpg,https://www.reddit.com/r/dataisbeautiful/comments/1dvqv7/number_of_supertall_300m_buildings_completed_each/,24,24,0,7,Number of Supertall (300m+) Buildings Completed Each Year Since 1995,2013-05-0033.jpg
The meaning of colors in different cultures,JestaKilla,2013-05-08 06:16:59,http://www.informationisbeautiful.net/visualizations/colours-in-cultures/,https://www.reddit.com/r/dataisbeautiful/comments/1dx1wx/the_meaning_of_colors_in_different_cultures/,19,19,0,2,The meaning of colors in different cultures,2013-05-0034.jpg
The Windows 8 Disaster,Frankwall,2013-05-08 09:24:14,http://www.statista.com/topics/823/microsoft/chart/1084/the-windows-8-disaster/,https://www.reddit.com/r/dataisbeautiful/comments/1dx8bu/the_windows_8_disaster/,0,0,0,0,The Windows 8 Disaster,2013-05-0035.jpg
US fat consumption 1909-2010,abovethegrass,2013-05-08 10:01:35,http://supplementsos.com/wp-content/uploads/2013/04/availability-added-fats.png,https://www.reddit.com/r/dataisbeautiful/comments/1dx9g3/us_fat_consumption_19092010/,513,513,0,148,US fat consumption 1909-2010,2013-05-0036.png
"Interactive scatterplot: At top colleges, an admissions gap for minorities",Beaglesworth,2013-05-08 12:04:21,http://www.nytimes.com/interactive/2013/05/07/education/college-admissions-gap.html?_r=0,https://www.reddit.com/r/dataisbeautiful/comments/1dxdrd/interactive_scatterplot_at_top_colleges_an/,6,6,0,0,"Interactive scatterplot At top colleges, an admissions gap for minorities",2013-05-0037.jpg
"What different sorting algorithms sound like [video, 1:30]",eucalyptustree,2013-05-08 12:37:30,http://www.youtube.com/watch?v=t8g-iYGHpEA,https://www.reddit.com/r/dataisbeautiful/comments/1dxf8s/what_different_sorting_algorithms_sound_like/,39,39,0,2,"What different sorting algorithms sound like video, 130",2013-05-0038.jpg
Length of the average dissertation,mypanda,2013-05-08 16:32:46,http://flowingdata.com/2013/05/08/length-of-the-average-dissertation/,https://www.reddit.com/r/dataisbeautiful/comments/1dxuas/length_of_the_average_dissertation/,48,48,0,14,Length of the average dissertation,2013-05-0039.jpg
"An Arms Pipeline to the Syrian Rebels visualized by By Sergio Pecanha, New York Times",healthanalyst,2013-05-08 18:20:58,http://www.nytimes.com/interactive/2013/03/25/world/middleeast/an-arms-pipeline-to-the-syrian-rebels.html,https://www.reddit.com/r/dataisbeautiful/comments/1dy2i5/an_arms_pipeline_to_the_syrian_rebels_visualized/,3,3,0,0,"An Arms Pipeline to the Syrian Rebels visualized by By Sergio Pecanha, New York Times",2013-05-0040.jpg
Boston Among the Most Segregated City in America,Nahtanos,2013-05-08 21:03:31,http://blackstonian.com/info/2013/05/business-insider-names-boston-among-the-most-segregated-cities-in-america/,https://www.reddit.com/r/dataisbeautiful/comments/1dyfz5/boston_among_the_most_segregated_city_in_america/,5,5,0,1,Boston Among the Most Segregated City in America,2013-05-0041.jpg
See how screwed you are if a nuclear bomb hits your city!,nomcow,2013-05-08 22:14:35,http://nuclearsecrecy.com/nukemap,https://www.reddit.com/r/dataisbeautiful/comments/1dylvb/see_how_screwed_you_are_if_a_nuclear_bomb_hits/,867,867,0,139,See how screwed you are if a nuclear bomb hits your city!,2013-05-0042.jpg
TV Show Rankings Over Time,TannerLD,2013-05-08 23:27:38,http://glimmer.rstudio.com/pssguy/TVShowRatings/,https://www.reddit.com/r/dataisbeautiful/comments/1dyrfr/tv_show_rankings_over_time/,4,4,0,0,TV Show Rankings Over Time,2013-05-0043.jpg
square meter price for Paris apartment for each subway station,233C,2013-05-09 11:38:26,http://www.meilleursagents.com/prix-immobilier/metro-paris/,https://www.reddit.com/r/dataisbeautiful/comments/1dzue2/square_meter_price_for_paris_apartment_for_each/,23,23,0,2,square meter price for Paris apartment for each subway station,2013-05-0044.jpg
The fall of AOL dial up and the rise of Netflix streaming video,newDieTacos,2013-05-09 13:22:04,http://www.splatf.com/2013/05/aol-netflix-chart/,https://www.reddit.com/r/dataisbeautiful/comments/1dzz4o/the_fall_of_aol_dial_up_and_the_rise_of_netflix/,69,69,0,5,The fall of AOL dial up and the rise of Netflix streaming video,2013-05-0045.jpg
A Time-Lapse Map of Every Nuclear Explosion Since 1945 - by Isao Hashimoto,righteousmoss,2013-05-09 13:46:23,http://www.youtube.com/watch?v=LLCF7vPanrY,https://www.reddit.com/r/dataisbeautiful/comments/1e00ko/a_timelapse_map_of_every_nuclear_explosion_since/,202,202,0,59,A Time-Lapse Map of Every Nuclear Explosion Since 1945 - by Isao Hashimoto,2013-05-0046.jpg
Interactive that ranks NHL team statistics alongside Stanley Cup success [OC] (x-post from hockey),cherdarchuk,2013-05-09 14:01:59,http://hockeyimpact.darkhorseanalytics.com,https://www.reddit.com/r/dataisbeautiful/comments/1e01kk/interactive_that_ranks_nhl_team_statistics/,287,287,0,19,Interactive that ranks NHL team statistics alongside Stanley Cup success OC (x-post from hockey),2013-05-0047.jpg
Google Flu Trends | United States,julian88888888,2013-05-09 14:20:28,http://www.google.org/flutrends/us/#US,https://www.reddit.com/r/dataisbeautiful/comments/1e02ru/google_flu_trends_united_states/,3,3,0,1,Google Flu Trends United States,2013-05-0048.jpg
"A Century of Cicadas: 137 Years, 23 Broods",Beaglesworth,2013-05-09 14:58:45,http://www.nytimes.com/interactive/science/a-century-of-cicadas.html,https://www.reddit.com/r/dataisbeautiful/comments/1e05d2/a_century_of_cicadas_137_years_23_broods/,70,70,0,3,"A Century of Cicadas 137 Years, 23 Broods",2013-05-0049.jpg
Interactive Dashboard of Craigslist posts scalping Sasquatch! Music Festival Tickets [OC],jeweloree,2013-05-09 16:35:49,http://public.tableausoftware.com/views/SasquatchAftermarket/Tickets?:embed=y&:display_count=no,https://www.reddit.com/r/dataisbeautiful/comments/1e0clt/interactive_dashboard_of_craigslist_posts/,6,6,0,1,Interactive Dashboard of Craigslist posts scalping Sasquatch! Music Festival Tickets OC,2013-05-0050.jpg
The Art of Data Visualization | PBS [7:45],Zephyr42,2013-05-09 17:50:52,http://youtu.be/AdSZJzb-aX8,https://www.reddit.com/r/dataisbeautiful/comments/1e0ig2/the_art_of_data_visualization_pbs_745/,8,8,0,0,The Art of Data Visualization PBS 745,2013-05-0051.jpg
Was Theo Walcott’s performance for Arsenal driven by motivation for a new contract?,Ananke123,2013-05-09 18:46:39,http://vizwiz.blogspot.co.uk/2013/05/was-theo-walcotts-performance-for.html,https://www.reddit.com/r/dataisbeautiful/comments/1e0mxh/was_theo_walcotts_performance_for_arsenal_driven/,7,7,0,0,Was Theo Walcott’s performance for Arsenal driven by motivation for a new contract,2013-05-0052.jpg
World Oil Reserves in 2004 [960x720] [x-post from /r/mapporn],frorge,2013-05-09 18:49:43,http://blogs.law.harvard.edu/mesh/files/2007/12/oilmap.jpg,https://www.reddit.com/r/dataisbeautiful/comments/1e0n69/world_oil_reserves_in_2004_960x720_xpost_from/,79,79,0,10,World Oil Reserves in 2004 960x720 x-post from rmapporn,2013-05-0053.jpg
Current Worldwide Annual Meat Consumption per capita,tandori,2013-05-09 21:54:51,http://i.imgur.com/ruBB2OH.png,https://www.reddit.com/r/dataisbeautiful/comments/1e11un/current_worldwide_annual_meat_consumption_per/,63,63,0,22,Current Worldwide Annual Meat Consumption per capita,2013-05-0054.png
"Geographic distribution of the mortgage interest deduction, by state and zip code",Beaglesworth,2013-05-10 00:51:48,http://www.pewstates.org/research/data-visualizations/the-geographic-distribution-of-the-mortgage-interest-deduction-85899469379,https://www.reddit.com/r/dataisbeautiful/comments/1e1f4e/geographic_distribution_of_the_mortgage_interest/,3,3,0,0,"Geographic distribution of the mortgage interest deduction, by state and zip code",2013-05-0055.jpg
Walls of the World.,mayoneggz,2013-05-10 01:38:36,http://www.apeconmyth.com/wp-content/uploads/2012/02/WalledWorld-large.jpg,https://www.reddit.com/r/dataisbeautiful/comments/1e1ile/walls_of_the_world/,702,702,0,206,Walls of the World.,2013-05-0056.jpg
Precipitation Heatmap (Ohio) [OC],shivasprogeny,2013-05-10 12:21:55,http://imgur.com/JE1Pr6a,https://www.reddit.com/r/dataisbeautiful/comments/1e2c4i/precipitation_heatmap_ohio_oc/,0,0,0,7,Precipitation Heatmap (Ohio) OC,2013-05-0057.jpg
Counterfeit vs. Genuine iPhone charger voltage output (full article in comments),large-farva,2013-05-10 12:53:05,http://imgur.com/a/4i8Ti#0,https://www.reddit.com/r/dataisbeautiful/comments/1e2djb/counterfeit_vs_genuine_iphone_charger_voltage/,111,111,0,16,Counterfeit vs. Genuine iPhone charger voltage output (full article in comments),2013-05-0058.jpg
the rise of migrants' remittances,gen0h,2013-05-10 15:03:10,http://www.tageswoche.ch/+besxb,https://www.reddit.com/r/dataisbeautiful/comments/1e2lac/the_rise_of_migrants_remittances/,3,3,0,0,the rise of migrants' remittances,2013-05-0059.jpg
"Glowing tweet density maps of San Fran, New York, London and More",Beaglesworth,2013-05-10 16:16:25,http://www.datapointed.net/2013/05/tweet-knn-density-experiments/,https://www.reddit.com/r/dataisbeautiful/comments/1e2qdt/glowing_tweet_density_maps_of_san_fran_new_york/,9,9,0,0,"Glowing tweet density maps of San Fran, New York, London and More",2013-05-0060.jpg
"Study groups and friendships at a small liberal arts college, by major [OC]",shiny_thing,2013-05-10 16:39:59,http://i.imgur.com/sSF8TjV.png,https://www.reddit.com/r/dataisbeautiful/comments/1e2s2l/study_groups_and_friendships_at_a_small_liberal/,36,36,0,10,"Study groups and friendships at a small liberal arts college, by major OC",2013-05-0061.png
Keeling Curve - graph shows how much CO2 human activities have released into the atmosphere,murk_merchant,2013-05-10 18:11:14,http://www.guardian.co.uk/environment/interactive/2013/may/10/climate-warming-gas-carbon-dioxide-levels-interactive,https://www.reddit.com/r/dataisbeautiful/comments/1e2yqw/keeling_curve_graph_shows_how_much_co2_human/,0,0,0,0,Keeling Curve - graph shows how much CO2 human activities have released into the atmosphere,2013-05-0062.jpg
Mapping hate speech: homophobia and racism on twitter,jamestown112,2013-05-10 18:32:52,http://www.guardian.co.uk/news/datablog/interactive/2013/may/10/twitter-geography-hate-racism-homophobia,https://www.reddit.com/r/dataisbeautiful/comments/1e30e7/mapping_hate_speech_homophobia_and_racism_on/,27,27,0,11,Mapping hate speech homophobia and racism on twitter,2013-05-0063.jpg
Flavour network,nxpnsv,2013-05-10 20:31:02,http://www.flavourjournal.com/content/2/1/4/figure/F1?highres=y,https://www.reddit.com/r/dataisbeautiful/comments/1e3991/flavour_network/,17,17,0,1,Flavour network,2013-05-0064.jpg
[OC] Just Cause 2 - Player Death by impact - Point Cloud Visualisation,jimthree,2013-05-10 21:18:54,http://youtu.be/hEoxaGkNcrg,https://www.reddit.com/r/dataisbeautiful/comments/1e3csz/oc_just_cause_2_player_death_by_impact_point/,21,21,0,6,OC Just Cause 2 - Player Death by impact - Point Cloud Visualisation,2013-05-0065.jpg
Days since last tornado warning by NWS (x-post r/weather),Domino_Raindrop,2013-05-10 23:34:43,http://mesonet.agron.iastate.edu/onsite/features/2013/05/130510.png,https://www.reddit.com/r/dataisbeautiful/comments/1e3m86/days_since_last_tornado_warning_by_nws_xpost/,42,42,0,12,Days since last tornado warning by NWS (x-post rweather),2013-05-0066.png
"NBA 4-Time MVPs viz takes a look at the five 4-time winners of the NBA MVP award: Bill Russell, Wilt Chamberlain, Kareem Abdul-Jabbar, Michael Jordan, and, the newest member of the club, Lebron James. By Adam E McCann at Dueling Data",healthanalyst,2013-05-11 12:33:18,http://duelingdata.blogspot.com/2013/05/nba-4-time-mvps.html,https://www.reddit.com/r/dataisbeautiful/comments/1e4j3i/nba_4time_mvps_viz_takes_a_look_at_the_five_4time/,7,7,0,0,"NBA 4-Time MVPs viz takes a look at the five 4-time winners of the NBA MVP award Bill Russell, Wilt Chamberlain, Kareem Abdul-Jabbar, Michael Jordan,",2013-05-0067.jpg
Map of California Population Density using D3 by Mike Mostock (+How-to do it & code),healthanalyst,2013-05-12 13:04:03,http://bl.ocks.org/mbostock/5562380,https://www.reddit.com/r/dataisbeautiful/comments/1e6j4g/map_of_california_population_density_using_d3_by/,8,8,0,0,Map of California Population Density using D3 by Mike Mostock (+How-to do it & code),2013-05-0068.jpg
The Hopometer - Visualising beer strength and bitterness,Ananke123,2013-05-12 16:04:04,http://paintbynumbersblog.blogspot.co.uk/2013/05/the-hopometer-visualising-beer-strength.html,https://www.reddit.com/r/dataisbeautiful/comments/1e6ruz/the_hopometer_visualising_beer_strength_and/,9,9,0,2,The Hopometer - Visualising beer strength and bitterness,2013-05-0069.jpg
"Graphical representation of variance of 8 pancake recipes, from ""Cooking for Geeks"" by Jeff Potter",mattsoave,2013-05-12 18:48:47,http://imgur.com/kYLAYTB,https://www.reddit.com/r/dataisbeautiful/comments/1e72fj/graphical_representation_of_variance_of_8_pancake/,65,65,0,9,"Graphical representation of variance of 8 pancake recipes, from Cooking for Geeks by Jeff Potter",2013-05-0070.jpg
Google+ is Massively Popular in Developing Nations,Frankwall,2013-05-13 09:39:09,http://www.statista.com/markets/21/topic/194/social-media/chart/648/google-plus-penetration-in-selected-countries-in-q2-2012/,https://www.reddit.com/r/dataisbeautiful/comments/1e8ige/google_is_massively_popular_in_developing_nations/,622,622,0,70,Google+ is Massively Popular in Developing Nations,2013-05-0071.jpg
Dialect Map Of U.S. Shows How Americans Speak By Region,average_gilbert,2013-05-13 14:56:14,http://www.huffingtonpost.com/2013/05/09/dialect-map-of-the-us-region-aschmann_n_3245496.html?utm_hp_ref=fb&ir=Books&src=sp&comm_ref=false,https://www.reddit.com/r/dataisbeautiful/comments/1e8w7i/dialect_map_of_us_shows_how_americans_speak_by/,11,11,0,6,Dialect Map Of U.S. Shows How Americans Speak By Region,2013-05-0072.jpg
Clustering analysis of scientific paper citations shows formation and establishment of neuroscience as a new field over the last decade.,LesTP,2013-05-13 15:32:42,http://imgur.com/Q5IMyBt,https://www.reddit.com/r/dataisbeautiful/comments/1e8yoi/clustering_analysis_of_scientific_paper_citations/,615,615,0,36,Clustering analysis of scientific paper citations shows formation and establishment of neuroscience as a new field over the last decade.,2013-05-0073.jpg
