title,author,created_date,url,full_permalink,score,ups,downs,num_comments,sanitized_title,image_file
"YouTube Views for Pharrell's 24-Hour ""Happy"" Videos [OC]",drc500free,2014-02-01,http://imgur.com/x88siAx,https://www.reddit.com/r/dataisbeautiful/comments/1wq6fn/youtube_views_for_pharrells_24hour_happy_videos_oc/,100,100,0,14,YouTube Views for Pharrell's 24-Hour Happy Videos OC,2014-02-0000.jpg
Practice makes perfect! [Colorectal cancer: UK surgeons 90 day mortality vs procedures completed],EastoftheRiverNile,2014-02-01,http://imgur.com/egyPYiS,https://www.reddit.com/r/dataisbeautiful/comments/1wqh28/practice_makes_perfect_colorectal_cancer_uk/,195,195,0,18,Practice makes perfect! Colorectal cancer UK surgeons 90 day mortality vs procedures completed,2014-02-0001.jpg
The Gender Disparity in Median Weekly Earnings [OC],Sen_Mendoza,2014-02-01,http://i.imgur.com/OM2EfyS.png,https://www.reddit.com/r/dataisbeautiful/comments/1wrts5/the_gender_disparity_in_median_weekly_earnings_oc/,2,2,0,9,The Gender Disparity in Median Weekly Earnings OC,2014-02-0002.png
Subreddit Gender Ratios [OC],bburky,2014-02-02,http://imgur.com/a/ICk20,https://www.reddit.com/r/dataisbeautiful/comments/1wtnkd/subreddit_gender_ratios_oc/,2564,2564,0,361,Subreddit Gender Ratios OC,2014-02-0003.jpg
Groundhog Day Statistics [OC],bradfo83,2014-02-02,http://i.imgur.com/uxXQm6I.png,https://www.reddit.com/r/dataisbeautiful/comments/1wu3q9/groundhog_day_statistics_oc/,9,9,0,4,Groundhog Day Statistics OC,2014-02-0004.png
TV Anime Adaption Source 2000-2013 (X-post from /r/anime),homu,2014-02-02,http://imgur.com/a/6YRX1,https://www.reddit.com/r/dataisbeautiful/comments/1wujlx/tv_anime_adaption_source_20002013_xpost_from/,7,7,0,3,TV Anime Adaption Source 2000-2013 (X-post from ranime),2014-02-0005.jpg
The Top Sandwich Ingredients on /r/eatsandwiches [OC],ge4096,2014-02-02,http://i.imgur.com/VOKvJED.png,https://www.reddit.com/r/dataisbeautiful/comments/1wujvi/the_top_sandwich_ingredients_on_reatsandwiches_oc/,295,295,0,34,The Top Sandwich Ingredients on reatsandwiches OC,2014-02-0006.png
How often the Oscars correlate with other movie awards [OC],cnbeau,2014-02-03,http://oscar-correlates.chrisbeaumont.org/,https://www.reddit.com/r/dataisbeautiful/comments/1ww9dd/how_often_the_oscars_correlate_with_other_movie/,13,13,0,2,How often the Oscars correlate with other movie awards OC,2014-02-0007.jpg
Earned Income Tax Credit map by county,dont_ban_me_please,2014-02-03,http://www.brookings.edu/research/interactives/2014/county-eitc-map,https://www.reddit.com/r/dataisbeautiful/comments/1wwd3t/earned_income_tax_credit_map_by_county/,35,35,0,1,Earned Income Tax Credit map by county,2014-02-0008.jpg
"Calculating pi, Leibniz Method vs. Monte Carlo Method [created by /u/iorgfeflkd]",lntrinsic,2014-02-03,http://i.imgur.com/UKdj9ZI.jpg,https://www.reddit.com/r/dataisbeautiful/comments/1wwfm6/calculating_pi_leibniz_method_vs_monte_carlo/,943,943,0,74,"Calculating pi, Leibniz Method vs. Monte Carlo Method created by uiorgfeflkd",2014-02-0009.png
Simulated Evolution of Chickens That Play Chicken. [OC],jsmooth7,2014-02-03,http://imgur.com/a/rE3Y9,https://www.reddit.com/r/dataisbeautiful/comments/1wwjbx/simulated_evolution_of_chickens_that_play_chicken/,71,71,0,22,Simulated Evolution of Chickens That Play Chicken. OC,2014-02-0010.jpg
Pushing back the boundary: Counties of the United States with the highest concentration of Mexicans,fstorino,2014-02-03,http://i.imgur.com/FKuooZJ.jpg,https://www.reddit.com/r/dataisbeautiful/comments/1wwmif/pushing_back_the_boundary_counties_of_the_united/,229,229,0,44,Pushing back the boundary Counties of the United States with the highest concentration of Mexicans,2014-02-0011.png
Visualizations of popular music metadata from past decades,subintoomba,2014-02-03,http://www.thebillboardexperiment.com/overall.php,https://www.reddit.com/r/dataisbeautiful/comments/1wws2c/visualizations_of_popular_music_metadata_from/,7,7,0,0,Visualizations of popular music metadata from past decades,2014-02-0012.jpg
"Race and ethnicity in Baltimore, Maryland",lawndoe,2014-02-03,https://upload.wikimedia.org/wikipedia/commons/b/b4/Race_and_ethnicity_Baltimore.png,https://www.reddit.com/r/dataisbeautiful/comments/1www56/race_and_ethnicity_in_baltimore_maryland/,0,0,0,3,"Race and ethnicity in Baltimore, Maryland",2014-02-0013.png
Superbowl 48 team preference based on Facebook data,swardson,2014-02-03,http://seattletimes.wpengine.netdna-cdn.com/seahawks/files/2014/02/supermap1.jpg,https://www.reddit.com/r/dataisbeautiful/comments/1wxoki/superbowl_48_team_preference_based_on_facebook/,41,41,0,11,Superbowl 48 team preference based on Facebook data,2014-02-0014.jpg
Heroin availability in the US (2007-2013),oildig,2014-02-03,http://www.trbimg.com/img-52f01b11/turbine/la-heroin-dea-map-20140203-g/1774/630x1774,https://www.reddit.com/r/dataisbeautiful/comments/1wxq1y/heroin_availability_in_the_us_20072013/,9,9,0,8,Heroin availability in the US (2007-2013),2014-02-0015.jpg
"Detailed Temperature comparison of all past Winter Olympic host cities. You knew Sochi was the Hottest, but can you guess which was the coldest? [OC]",MrPennywhistle,2014-02-03,http://imgur.com/6trNrV8,https://www.reddit.com/r/dataisbeautiful/comments/1wxrvm/detailed_temperature_comparison_of_all_past/,11,11,0,6,"Detailed Temperature comparison of all past Winter Olympic host cities. You knew Sochi was the Hottest, but can you guess which was the coldest OC",2014-02-0016.jpg
"Follow-up to my last post, with the most popular breads and cheeses from /r/eatsandwiches [OC]",ge4096,2014-02-03,http://imgur.com/a/qSrnN,https://www.reddit.com/r/dataisbeautiful/comments/1wxtw6/followup_to_my_last_post_with_the_most_popular/,114,114,0,11,"Follow-up to my last post, with the most popular breads and cheeses from reatsandwiches OC",2014-02-0017.jpg
How Twitter Talked About the Super Bowl,carsonbiz,2014-02-03,http://techland.time.com/2014/02/03/twitter-super-bowl-visualization/,https://www.reddit.com/r/dataisbeautiful/comments/1wy0l7/how_twitter_talked_about_the_super_bowl/,7,7,0,4,How Twitter Talked About the Super Bowl,2014-02-0018.jpg
HIV Transmission by Sex and HIV Prevalence by Age and Race/Ethnicity [OC],Vizual-Statistix,2014-02-03,http://vizual-statistix.tumblr.com/post/75543016087/the-cdc-publishes-hiv-surveillance-reports-that,https://www.reddit.com/r/dataisbeautiful/comments/1wy5pr/hiv_transmission_by_sex_and_hiv_prevalence_by_age/,14,14,0,3,HIV Transmission by Sex and HIV Prevalence by Age and RaceEthnicity OC,2014-02-0019.jpg
"Most Popular Marvel Comics Characters, by # of solo comic book appearances [OC]",minimaxir,2014-02-04,http://i.imgur.com/KVAT3Xn.png,https://www.reddit.com/r/dataisbeautiful/comments/1wznde/most_popular_marvel_comics_characters_by_of_solo/,51,51,0,6,"Most Popular Marvel Comics Characters, by # of solo comic book appearances OC",2014-02-0020.png
An artificial neural network in my coffeemaker watched me for two weeks and this is what it learned [OC],jetRink,2014-02-04,http://i.imgur.com/pZsCibb.png,https://www.reddit.com/r/dataisbeautiful/comments/1wzruo/an_artificial_neural_network_in_my_coffeemaker/,2487,2487,0,178,An artificial neural network in my coffeemaker watched me for two weeks and this is what it learned OC,2014-02-0021.png
How do today's top young chess players compare to Magnus Carlsen when he was their age? [X-post from r/chess] [OC],remembersometimes,2014-02-04,http://i.imgur.com/eqZqSOh.png,https://www.reddit.com/r/dataisbeautiful/comments/1wzxg7/how_do_todays_top_young_chess_players_compare_to/,30,30,0,1,How do today's top young chess players compare to Magnus Carlsen when he was their age X-post from rchess OC,2014-02-0022.png
Multi-Platform Use of Social Media in 2013 [OC],Vizual-Statistix,2014-02-04,http://vizual-statistix.tumblr.com/post/75609223765/in-honor-of-facebooks-10th-birthday-ive-made-a,https://www.reddit.com/r/dataisbeautiful/comments/1x0ed5/multiplatform_use_of_social_media_in_2013_oc/,61,61,0,5,Multi-Platform Use of Social Media in 2013 OC,2014-02-0023.jpg
The top 10 largest margins of victory in Super Bowl history [OC],placebo_overdose,2014-02-04,http://i.imgur.com/OSFmXpA.png,https://www.reddit.com/r/dataisbeautiful/comments/1x0vaz/the_top_10_largest_margins_of_victory_in_super/,63,63,0,18,The top 10 largest margins of victory in Super Bowl history OC,2014-02-0024.png
Women's rights country by country - interactive,fstorino,2014-02-04,http://www.theguardian.com/global-development/ng-interactive/2014/feb/04/womens-rights-country-by-country-interactive,https://www.reddit.com/r/dataisbeautiful/comments/1x13c9/womens_rights_country_by_country_interactive/,3,3,0,0,Women's rights country by country - interactive,2014-02-0025.jpg
France mapped from 2000 to 2012 with 12 major financial indicators [OC] (X-post from /r/france),massus,2014-02-04,http://www.nosfinanceslocales.fr,https://www.reddit.com/r/dataisbeautiful/comments/1x16tz/france_mapped_from_2000_to_2012_with_12_major/,3,3,0,0,France mapped from 2000 to 2012 with 12 major financial indicators OC (X-post from rfrance),2014-02-0026.jpg
Visualisation of Boris Bikes in London on a tube strike,jibbist,2014-02-05,http://vimeo.com/19982736,https://www.reddit.com/r/dataisbeautiful/comments/1x2ock/visualisation_of_boris_bikes_in_london_on_a_tube/,9,9,0,0,Visualisation of Boris Bikes in London on a tube strike,2014-02-0027.jpg
Abortions and births in America,fstorino,2014-02-05,http://cdn.static-economist.com/sites/default/files/imagecache/econmobile_optimize/images/2014/02/blogs/graphic-detail/20140208_gdc284.png,https://www.reddit.com/r/dataisbeautiful/comments/1x2owt/abortions_and_births_in_america/,0,0,0,11,Abortions and births in America,2014-02-0028.png
Cigarette Excise Tax By US State [OC],tresliso,2014-02-05,http://www.ibtimes.com/price-cigarettes-how-much-does-pack-cost-each-us-state-map-1553445,https://www.reddit.com/r/dataisbeautiful/comments/1x3k43/cigarette_excise_tax_by_us_state_oc/,14,14,0,2,Cigarette Excise Tax By US State OC,2014-02-0029.jpg
[X-post r/cfb] Breakdown of 2014 college football recruiting by conference.,AJablonski,2014-02-05,http://texags.com/Stories/12874,https://www.reddit.com/r/dataisbeautiful/comments/1x4xk8/xpost_rcfb_breakdown_of_2014_college_football/,5,5,0,0,X-post rcfb Breakdown of 2014 college football recruiting by conference.,2014-02-0030.jpg
Amount of manslaughter in the US over a period of 2600 weeks,PM_ME_UR_BUTT_GIRL,2014-02-06,http://imgur.com/2SyottE,https://www.reddit.com/r/dataisbeautiful/comments/1x5ws8/amount_of_manslaughter_in_the_us_over_a_period_of/,0,0,0,6,Amount of manslaughter in the US over a period of 2600 weeks,2014-02-0031.jpg
An illustration of genetic trends for fast twitch vs slow twitch muscle fibers [OC],Buckfost,2014-02-06,http://imgur.com/a/hsIRa#0,https://www.reddit.com/r/dataisbeautiful/comments/1x6df4/an_illustration_of_genetic_trends_for_fast_twitch/,8,8,0,6,An illustration of genetic trends for fast twitch vs slow twitch muscle fibers OC,2014-02-0032.jpg
Mapping the similarities of flavor compounds between different foods,mikepetroff,2014-02-06,http://www.scientificamerican.com/article/flavor-connection-taste-map-interactive/,https://www.reddit.com/r/dataisbeautiful/comments/1x6hfq/mapping_the_similarities_of_flavor_compounds/,54,54,0,2,Mapping the similarities of flavor compounds between different foods,2014-02-0033.jpg
Latitude and altitude of winter olympic games since 1960,Beaglesworth,2014-02-06,http://www.washingtonpost.com/wp-srv/special/sports/2014-olympics/host-cities/,https://www.reddit.com/r/dataisbeautiful/comments/1x7087/latitude_and_altitude_of_winter_olympic_games/,270,270,0,15,Latitude and altitude of winter olympic games since 1960,2014-02-0034.jpg
The Chasm in the Center of Congress,nowhathappenedwas,2014-02-06,http://www.nationaljournal.com/2013-vote-ratings/the-chasm-in-the-center-of-congress-20140206,https://www.reddit.com/r/dataisbeautiful/comments/1x7adp/the_chasm_in_the_center_of_congress/,6,6,0,2,The Chasm in the Center of Congress,2014-02-0035.jpg
"Mapping Religion In The US: Catholics, Protestants, Mormons, Jews And The Non-Religious [OC]",tresliso,2014-02-06,http://www.ibtimes.com/religion-united-states-catholics-protestants-mormons-jews-non-religious-mapped-maps-1553777,https://www.reddit.com/r/dataisbeautiful/comments/1x7dpz/mapping_religion_in_the_us_catholics_protestants/,13,13,0,0,"Mapping Religion In The US Catholics, Protestants, Mormons, Jews And The Non-Religious OC",2014-02-0036.jpg
Canadian income by postal code: Mapping Canada’s richest and poorest neighbourhoods,anthony81212,2014-02-06,http://globalnews.ca/news/370804/income-by-postal-code/,https://www.reddit.com/r/dataisbeautiful/comments/1x7jcg/canadian_income_by_postal_code_mapping_canadas/,42,42,0,0,Canadian income by postal code Mapping Canada’s richest and poorest neighbourhoods,2014-02-0037.jpg
"I present my Body Weight and Caloric Intake over the past 200 days. I'm ""bulking"" now.",yhatter,2014-02-06,http://i.imgur.com/Ijul1cr.png,https://www.reddit.com/r/dataisbeautiful/comments/1x85aj/i_present_my_body_weight_and_caloric_intake_over/,4,4,0,3,I present my Body Weight and Caloric Intake over the past 200 days. I'm bulking now.,2014-02-0038.png
Carlos Paris maps prime numbers: It's incredible,user992992,2014-02-06,https://www.youtube.com/watch?v=UYkLz8BIS8k&t=2m47s,https://www.reddit.com/r/dataisbeautiful/comments/1x8hbb/carlos_paris_maps_prime_numbers_its_incredible/,19,19,0,1,Carlos Paris maps prime numbers It's incredible,2014-02-0039.jpg
Total Olympic gold medals by state,rhiever,2014-02-06,http://i.imgur.com/Yq0QalD.jpg,https://www.reddit.com/r/dataisbeautiful/comments/1x8ivn/total_olympic_gold_medals_by_state/,1212,1212,0,268,Total Olympic gold medals by state,2014-02-0040.jpg
Graphs showing the growth of baseball subs over the last year. [OC],Joshduman,2014-02-06,http://imgur.com/a/4AX5F,https://www.reddit.com/r/dataisbeautiful/comments/1x8khn/graphs_showing_the_growth_of_baseball_subs_over/,4,4,0,4,Graphs showing the growth of baseball subs over the last year. OC,2014-02-0041.jpg
How many hours of minimum wage work it takes to earn a beer,r3b3cc4,2014-02-07,http://qz.com/174700/how-many-hours-of-minimum-wage-work-it-takes-to-earn-a-beer/,https://www.reddit.com/r/dataisbeautiful/comments/1x9lsx/how_many_hours_of_minimum_wage_work_it_takes_to/,108,108,0,15,How many hours of minimum wage work it takes to earn a beer,2014-02-0042.jpg
"[critique] Words Used in President's State of the Nation Address, Philippines",jumbodumbothoughts,2014-02-07,http://imgur.com/eLjySrN,https://www.reddit.com/r/dataisbeautiful/comments/1x9rjs/critique_words_used_in_presidents_state_of_the/,104,104,0,16,"critique Words Used in President's State of the Nation Address, Philippines",2014-02-0043.jpg
Another cigarette map: Cost of pack of Marlboros in 123 countries (crowd-sourced data) [OC],tresliso,2014-02-07,http://www.ibtimes.com/price-cigarettes-how-much-does-pack-marlboros-cost-every-country-map-1553992,https://www.reddit.com/r/dataisbeautiful/comments/1xa6w7/another_cigarette_map_cost_of_pack_of_marlboros/,119,119,0,25,Another cigarette map Cost of pack of Marlboros in 123 countries (crowd-sourced data) OC,2014-02-0044.jpg
Olympic gold medals per million inhabitants (US states) [OC],Enxerido,2014-02-07,http://imgur.com/a/YbowH,https://www.reddit.com/r/dataisbeautiful/comments/1xaehi/olympic_gold_medals_per_million_inhabitants_us/,783,783,0,102,Olympic gold medals per million inhabitants (US states) OC,2014-02-0045.jpg
Inter-city migration patterns of major Canadian cities [OC],migdata,2014-02-07,http://i.imgur.com/T1w6VFb.png,https://www.reddit.com/r/dataisbeautiful/comments/1xas44/intercity_migration_patterns_of_major_canadian/,15,15,0,1,Inter-city migration patterns of major Canadian cities OC,2014-02-0046.png
Tweets over past 24 hours mentioning the Olympics in eight different languages. Ranked by Tweets per million population.,mikepetroff,2014-02-07,http://datawrapper.de/chart/YI8Ha/,https://www.reddit.com/r/dataisbeautiful/comments/1xb4f9/tweets_over_past_24_hours_mentioning_the_olympics/,2,2,0,0,Tweets over past 24 hours mentioning the Olympics in eight different languages. Ranked by Tweets per million population.,2014-02-0047.jpg
Health Care Spending,datasensei,2014-02-08,http://www.nejm.org/action/showMediaPlayer?doi=10.1056%2FNEJMp1310228&aid=NEJMp1310228_attach_1&area=&&,https://www.reddit.com/r/dataisbeautiful/comments/1xcf5d/health_care_spending/,23,23,0,2,Health Care Spending,2014-02-0048.jpg
"56 years of tornado tracks, by Fujita scale",lntrinsic,2014-02-08,http://i.imgur.com/crMhx5Z.png,https://www.reddit.com/r/dataisbeautiful/comments/1xczc4/56_years_of_tornado_tracks_by_fujita_scale/,2461,2461,0,297,"56 years of tornado tracks, by Fujita scale",2014-02-0049.jpg
What it looks like when reddit mods alienate all the active users,Buckfost,2014-02-08,http://i.imgur.com/5H1RFw5.png,https://www.reddit.com/r/dataisbeautiful/comments/1xd89b/what_it_looks_like_when_reddit_mods_alienate_all/,0,0,0,16,What it looks like when reddit mods alienate all the active users,2014-02-0050.png
"""Wanna Be Ambassador to Argentina? It'll cost you $500,000."" A map of Barack Obama's ambassador nominees categorized as career diplomats (36), political allies (21), or campaign donation ""bundlers"" (23), and how much money they raised",Epistaxis,2014-02-08,http://www.slate.com/articles/news_and_politics/politics/2014/02/map_of_ambassador_posts_given_to_obama_s_top_fundraisers_noah_bryson_mamet.html,https://www.reddit.com/r/dataisbeautiful/comments/1xdyfh/wanna_be_ambassador_to_argentina_itll_cost_you/,15,15,0,5,"Wanna Be Ambassador to Argentina It'll cost you $500,000. A map of Barack Obama's ambassador nominees categorized as career diplomats (36), political",2014-02-0051.jpg
Zoomable viz of animal taxonomy [OC],spingping,2014-02-08,http://taxvizjs.herokuapp.com,https://www.reddit.com/r/dataisbeautiful/comments/1xe46h/zoomable_viz_of_animal_taxonomy_oc/,2,2,0,0,Zoomable viz of animal taxonomy OC,2014-02-0052.jpg
The word length of all state constitutions over their date of ratification.,pabloe168,2014-02-08,http://www.laits.utexas.edu/txp_media/html/cons/features/0302_01/sizematters.html,https://www.reddit.com/r/dataisbeautiful/comments/1xehnk/the_word_length_of_all_state_constitutions_over/,3,3,0,8,The word length of all state constitutions over their date of ratification.,2014-02-0053.jpg
Word cloud of the Thomas Common translation of Nietszche's 'Thus Spoke Zarathustra' [OC],shinthemighty,2014-02-08,http://imgur.com/1SjtO2r,https://www.reddit.com/r/dataisbeautiful/comments/1xei3x/word_cloud_of_the_thomas_common_translation_of/,0,0,0,4,Word cloud of the Thomas Common translation of Nietszche's 'Thus Spoke Zarathustra' OC,2014-02-0054.jpg
Air Travel: Real Cost per Mile (2010 Dollars),tim1357,2014-02-09,http://1.bp.blogspot.com/-KgGAcUOBr9Q/To3AIP5KvjI/AAAAAAAAPzk/jDZuoZZ__-c/s1600/airpermile.jpg,https://www.reddit.com/r/dataisbeautiful/comments/1xg55j/air_travel_real_cost_per_mile_2010_dollars/,34,34,0,7,Air Travel Real Cost per Mile (2010 Dollars),2014-02-0055.jpg
Just scroll from the Northeast to the Southeast and see why this is fascinating,SexyTimeDoe,2014-02-10,http://espn.go.com/espn/fp/flashPollResultsState?sportIndex=frontpage&pollId=4181371,https://www.reddit.com/r/dataisbeautiful/comments/1xi2cu/just_scroll_from_the_northeast_to_the_southeast/,0,0,0,3,Just scroll from the Northeast to the Southeast and see why this is fascinating,2014-02-0056.jpg
[critique] Alluvial visualization of the value chain (investors - industry - customers) of the Philippine IT-BPO industry [OC],jumbodumbothoughts,2014-02-10,http://imgur.com/NS41zH8,https://www.reddit.com/r/dataisbeautiful/comments/1xidfr/critique_alluvial_visualization_of_the_value/,141,141,0,14,critique Alluvial visualization of the value chain (investors - industry - customers) of the Philippine IT-BPO industry OC,2014-02-0057.jpg
"Even with fees, the average US domestic flight is cheaper than it ever has been",rhiever,2014-02-10,http://4.bp.blogspot.com/-TqqX4JDS1xM/To2jIzCWooI/AAAAAAAAPzg/LCALwMbKBCY/s1600/airfares.jpg,https://www.reddit.com/r/dataisbeautiful/comments/1xixun/even_with_fees_the_average_us_domestic_flight_is/,1360,1360,0,349,"Even with fees, the average US domestic flight is cheaper than it ever has been",2014-02-0058.jpg
The Nations CO2 Emissions [OS],yaph,2014-02-10,http://tuteja.info/co2-emissions/,https://www.reddit.com/r/dataisbeautiful/comments/1xj3c5/the_nations_co2_emissions_os/,2,2,0,2,The Nations CO2 Emissions OS,2014-02-0059.jpg
Freezing points of various alcoholic beverages [OC],bubnicbf,2014-02-10,http://imgur.com/1jPpXLt,https://www.reddit.com/r/dataisbeautiful/comments/1xj8zd/freezing_points_of_various_alcoholic_beverages_oc/,14,14,0,6,Freezing points of various alcoholic beverages OC,2014-02-0060.jpg
Celebratory gunfire data,crayish,2014-02-10,http://imgur.com/FdgLeY4,https://www.reddit.com/r/dataisbeautiful/comments/1xjdjj/celebratory_gunfire_data/,12,12,0,2,Celebratory gunfire data,2014-02-0061.jpg
Word Stat Comparison of 20 Well-Known Novels [OC],Vizual-Statistix,2014-02-10,http://vizual-statistix.tumblr.com/post/76242350631/were-told-not-to-judge-a-book-by-its-cover-but,https://www.reddit.com/r/dataisbeautiful/comments/1xjj6n/word_stat_comparison_of_20_wellknown_novels_oc/,18,18,0,4,Word Stat Comparison of 20 Well-Known Novels OC,2014-02-0062.jpg
"Cell phone data usage, past 18 months. Finally started taking advantage of my unlimited data [OC]",binghamton24,2014-02-10,http://imgur.com/IybqhI2,https://www.reddit.com/r/dataisbeautiful/comments/1xkkxu/cell_phone_data_usage_past_18_months_finally/,12,12,0,3,"Cell phone data usage, past 18 months. Finally started taking advantage of my unlimited data OC",2014-02-0063.jpg
[OC] Bill Gates AMA metadata visualization,ElectroKarmaGram,2014-02-10,http://i.imgur.com/ubsjj2T.png,https://www.reddit.com/r/dataisbeautiful/comments/1xkyd7/oc_bill_gates_ama_metadata_visualization/,16,16,0,9,OC Bill Gates AMA metadata visualization,2014-02-0064.png
The Antipoverty Effect of Government Spending [OC],confluencer,2014-02-11,http://imgur.com/qSlbR8F,https://www.reddit.com/r/dataisbeautiful/comments/1xlk9h/the_antipoverty_effect_of_government_spending_oc/,121,121,0,20,The Antipoverty Effect of Government Spending OC,2014-02-0065.jpg
The Chocolate Bar Chart,r3b3cc4,2014-02-11,http://qzprod.files.wordpress.com/2014/02/chocolate-bar-chart-full.png?w=1024&h=2054,https://www.reddit.com/r/dataisbeautiful/comments/1xlv03/the_chocolate_bar_chart/,1567,1567,0,226,The Chocolate Bar Chart,2014-02-0066.png
Bill Nye vs. Ken Ham: Are evolution and religion at odds? From Pew Research Center,thabe331,2014-02-11,http://www.pewresearch.org/fact-tank/2014/02/03/bill-nye-vs-ken-ham-are-evolution-and-religion-at-odds/,https://www.reddit.com/r/dataisbeautiful/comments/1xm67s/bill_nye_vs_ken_ham_are_evolution_and_religion_at/,7,7,0,0,Bill Nye vs. Ken Ham Are evolution and religion at odds From Pew Research Center,2014-02-0067.jpg
Number of people renouncing US citizenship per year: 1998-2013,I_UPVOTE_PUN_THREADS,2014-02-11,http://i.imgur.com/xSX7A4R.png,https://www.reddit.com/r/dataisbeautiful/comments/1xmezp/number_of_people_renouncing_us_citizenship_per/,265,265,0,47,Number of people renouncing US citizenship per year 1998-2013,2014-02-0068.png
Cars have been getting bigger AND more fuel efficient for the past 30 years,Mock_Twain,2014-02-11,http://www.ifweassume.com/2013/01/visualizing-evolution-of-cars.html#,https://www.reddit.com/r/dataisbeautiful/comments/1xmmdb/cars_have_been_getting_bigger_and_more_fuel/,54,54,0,6,Cars have been getting bigger AND more fuel efficient for the past 30 years,2014-02-0069.jpg
Win % and total wins for each team so far this NBA season [OC] [x-post from r/nba],bin161,2014-02-11,http://imgur.com/a/m3ObB,https://www.reddit.com/r/dataisbeautiful/comments/1xmx2i/win_and_total_wins_for_each_team_so_far_this_nba/,28,28,0,7,Win % and total wins for each team so far this NBA season OC x-post from rnba,2014-02-0070.jpg
How many 'a's in Khaaaaaan. (Number of google hits plotted against number of 'a's) [x-post],andrewholding,2014-02-11,http://www.reddit.com/r/startrek/comments/1xmf0j/how_many_as_in_khaaaaaan_number_of_google_hits/,https://www.reddit.com/r/dataisbeautiful/comments/1xn9fx/how_many_as_in_khaaaaaan_number_of_google_hits/,31,31,0,0,How many 'a's in Khaaaaaan. (Number of google hits plotted against number of 'a's) x-post,2014-02-0071.jpg
Wages vs. Welfare benefits + Wages,Dathadorne,2014-02-11,http://www.zerohedge.com/sites/default/files/images/user5/imageroot/2012/11-2/welfare%20cliff.jpg,https://www.reddit.com/r/dataisbeautiful/comments/1xnnge/wages_vs_welfare_benefits_wages/,53,53,0,38,Wages vs. Welfare benefits + Wages,2014-02-0072.jpg
Apple Quarterly Data (2000-Current) [OC],danforhan,2014-02-11,http://imgur.com/a/yDjxx,https://www.reddit.com/r/dataisbeautiful/comments/1xnxig/apple_quarterly_data_2000current_oc/,3,3,0,11,Apple Quarterly Data (2000-Current) OC,2014-02-0073.jpg
"My charts depicting Stephen Curry, Klay Thompson, and Damian Lillard's attempts to break the 3PM record [x-post from r/nba] [OC]",scraider3,2014-02-12,http://imgur.com/a/xUhvR,https://www.reddit.com/r/dataisbeautiful/comments/1xoxoq/my_charts_depicting_stephen_curry_klay_thompson/,11,11,0,3,"My charts depicting Stephen Curry, Klay Thompson, and Damian Lillard's attempts to break the 3PM record x-post from rnba OC",2014-02-0074.jpg
Participants in Winter Olympics sports over time,retrac1324,2014-02-12,http://www.washingtonpost.com/wp-srv/special/sports/2014-olympics/history/,https://www.reddit.com/r/dataisbeautiful/comments/1xoz95/participants_in_winter_olympics_sports_over_time/,1,1,0,0,Participants in Winter Olympics sports over time,2014-02-0075.jpg
