title,author,created_date,url,full_permalink,score,ups,downs,num_comments,sanitized_title,image_file
"The most commonly used words (and words that frequently appear with them) in East Coast, West Coast, Southern and Midwest hip hop. (x-post /r/hiphopheads)",phillyfanjd,2014-02-25,http://hiphop.laserdeathstehr.com/,https://www.reddit.com/r/dataisbeautiful/comments/1ywfdb/the_most_commonly_used_words_and_words_that/,51,51,0,10,"The most commonly used words (and words that frequently appear with them) in East Coast, West Coast, Southern and Midwest hip hop. (x-post rhiphophead",2014-02-0151.jpg
Why we walk in cities: a map of how far one mile can take a pedestrian in an American city vs. an American suburb,old_gold_mountain,2014-02-25,http://i.imgur.com/O609WgA.png,https://www.reddit.com/r/dataisbeautiful/comments/1ywx3l/why_we_walk_in_cities_a_map_of_how_far_one_mile/,4668,4668,0,987,Why we walk in cities a map of how far one mile can take a pedestrian in an American city vs. an American suburb,2014-02-0152.png
Share of the labor force devoted to security services,Aschebescher,2014-02-25,http://graphics8.nytimes.com/images/2014/02/17/opinion/17greatdivide-img/17greatdivide-img-tmagArticle-v3.png,https://www.reddit.com/r/dataisbeautiful/comments/1yxrf9/share_of_the_labor_force_devoted_to_security/,18,18,0,3,Share of the labor force devoted to security services,2014-02-0153.png
"Word Cloud of over 10,000 facebook messages sent between two high school seniors",roflmaololol,2014-02-25,http://i.imgur.com/9P4P8BG.png?1,https://www.reddit.com/r/dataisbeautiful/comments/1yy9dv/word_cloud_of_over_10000_facebook_messages_sent/,32,32,0,14,"Word Cloud of over 10,000 facebook messages sent between two high school seniors",2014-02-0154.png
"Chicago, as the USA's Murder Capital",jpovjr,2014-02-26,http://www.dnainfo.com/chicago/2014-chicago-murders/explore-data,https://www.reddit.com/r/dataisbeautiful/comments/1yypuc/chicago_as_the_usas_murder_capital/,5,5,0,0,"Chicago, as the USA's Murder Capital",2014-02-0155.jpg
Interactive: 100 years of drought in Australia - ABC News (Australian Broadcasting Corporation),nbktdis,2014-02-26,http://www.abc.net.au/news/2014-02-26/100-years-of-drought/5282030,https://www.reddit.com/r/dataisbeautiful/comments/1yz60z/interactive_100_years_of_drought_in_australia_abc/,4,4,0,1,Interactive 100 years of drought in Australia - ABC News (Australian Broadcasting Corporation),2014-02-0156.jpg
Government Expenditure as a Percentage of GDP (2014 Index of Economic Freedom) [OC],confluencer,2014-02-26,http://imgur.com/L7drN3F,https://www.reddit.com/r/dataisbeautiful/comments/1yz8wy/government_expenditure_as_a_percentage_of_gdp/,0,0,0,2,Government Expenditure as a Percentage of GDP (2014 Index of Economic Freedom) OC,2014-02-0157.jpg
The effect of Income and Education on the diet of UK residents (source and methodology in comments),danielpass,2014-02-26,http://imgur.com/eBXtDBa,https://www.reddit.com/r/dataisbeautiful/comments/1yzb3p/the_effect_of_income_and_education_on_the_diet_of/,24,24,0,5,The effect of Income and Education on the diet of UK residents (source and methodology in comments),2014-02-0158.jpg
"Visualizing 15 Years Of Acquisitions By Apple, Google, Yahoo, Amazon, And Facebook",Stiffo90,2014-02-26,http://techcrunch.com/2014/02/25/the-age-of-acquisitions/,https://www.reddit.com/r/dataisbeautiful/comments/1yzzmd/visualizing_15_years_of_acquisitions_by_apple/,32,32,0,3,"Visualizing 15 Years Of Acquisitions By Apple, Google, Yahoo, Amazon, And Facebook",2014-02-0159.jpg
How the price of pizza changes with size (interactive),youthbrigade,2014-02-26,http://www.npr.org/blogs/money/2014/02/26/282132576/74-476-reasons-you-should-always-get-the-bigger-pizza,https://www.reddit.com/r/dataisbeautiful/comments/1z004t/how_the_price_of_pizza_changes_with_size/,1112,1112,0,190,How the price of pizza changes with size (interactive),2014-02-0160.jpg
Survival rate of children and adolescents with cancer in the United States over time,jonjiv,2014-02-26,http://i.imgur.com/DbPZvw2.png,https://www.reddit.com/r/dataisbeautiful/comments/1z024k/survival_rate_of_children_and_adolescents_with/,136,136,0,14,Survival rate of children and adolescents with cancer in the United States over time,2014-02-0161.png
Visualization of the acquisitions and alliances within the organic food industry. Video in comments.,getsome73,2014-02-26,http://imgur.com/MtARx2M,https://www.reddit.com/r/dataisbeautiful/comments/1z03sg/visualization_of_the_acquisitions_and_alliances/,4,4,0,1,Visualization of the acquisitions and alliances within the organic food industry. Video in comments.,2014-02-0162.jpg
Martin Krzywwinski's Circles of Life - Whole Genome Sequence Comparison Across Species,theknbe,2014-02-26,http://i.kinja-img.com/gawker-media/image/upload/19geojn3r4a7apng.png,https://www.reddit.com/r/dataisbeautiful/comments/1z0hq4/martin_krzywwinskis_circles_of_life_whole_genome/,20,20,0,1,Martin Krzywwinski's Circles of Life - Whole Genome Sequence Comparison Across Species,2014-02-0163.png
Popularity of various websites: full site versus app (details in comments) [OC],adequate_potato,2014-02-26,http://i.imgur.com/5sxrWk9.png,https://www.reddit.com/r/dataisbeautiful/comments/1z1m7z/popularity_of_various_websites_full_site_versus/,6,6,0,2,Popularity of various websites full site versus app (details in comments) OC,2014-02-0164.png
How education level has affected annual salary in different generations,nyshtick,2014-02-28,http://www.pewsocialtrends.org/files/2014/02/SDT-higher-education-02-11-2014-0-03.png,https://www.reddit.com/r/dataisbeautiful/comments/1z6wep/how_education_level_has_affected_annual_salary_in/,231,231,0,71,How education level has affected annual salary in different generations,2014-02-0165.png
Interactive Scatter Plot of UNC Basketball Majors by Class [OC - Related to Data Work Done As Part of This Week's Feature Story in BusinessWeek Magazine on UNC Men's Basketball Program],abresler,2014-02-28,http://aragorn.org/projects/bloomberg/tarheel/explorer/mens_basketball_majors_since_1990/final/v3/,https://www.reddit.com/r/dataisbeautiful/comments/1z711q/interactive_scatter_plot_of_unc_basketball_majors/,18,18,0,0,Interactive Scatter Plot of UNC Basketball Majors by Class OC - Related to Data Work Done As Part of This Week's Feature Story in BusinessWeek Magazin,2014-02-0166.jpg
When Protests and Violence Are Important to the U.S. Media: Colombia v Venezeula,iliketokilldeer,2014-02-28,http://www.cepr.net/index.php/blogs/the-americas-blog/when-protests-and-violence-are-important-to-the-us-media,https://www.reddit.com/r/dataisbeautiful/comments/1z77s2/when_protests_and_violence_are_important_to_the/,49,49,0,3,When Protests and Violence Are Important to the U.S. Media Colombia v Venezeula,2014-02-0167.jpg
"My Facebook messaging history by person and time, annotated (code in comments) [OC]",tehdog,2014-02-28,http://i.imgur.com/85BIURr.png,https://www.reddit.com/r/dataisbeautiful/comments/1z7apn/my_facebook_messaging_history_by_person_and_time/,1142,1142,0,197,"My Facebook messaging history by person and time, annotated (code in comments) OC",2014-02-0168.png
Youth unemployment in europe [OC],visualmetaphors,2014-02-28,http://imgur.com/Pnj0Vv0,https://www.reddit.com/r/dataisbeautiful/comments/1z7e51/youth_unemployment_in_europe_oc/,719,719,0,102,Youth unemployment in europe OC,2014-02-0169.jpg
Bitcoin rallies compared - April 2013 vs November 2013 [OC],Polycephal_Lee,2014-02-28,http://imgur.com/a/gzEFa,https://www.reddit.com/r/dataisbeautiful/comments/1z7eis/bitcoin_rallies_compared_april_2013_vs_november/,25,25,0,11,Bitcoin rallies compared - April 2013 vs November 2013 OC,2014-02-0170.jpg
Top Oscar Best Actress Nominees and Winners - Academy Awards Is Sunday [OC],warpdesign,2014-02-28,http://i.imgur.com/th4yXwI.png,https://www.reddit.com/r/dataisbeautiful/comments/1z7t3c/top_oscar_best_actress_nominees_and_winners/,5,5,0,0,Top Oscar Best Actress Nominees and Winners - Academy Awards Is Sunday OC,2014-02-0171.png
Youth unemployment in europe [remix][OC],BillyBuckets,2014-02-28,http://i.imgur.com/w72cVR0.png,https://www.reddit.com/r/dataisbeautiful/comments/1z84lq/youth_unemployment_in_europe_remixoc/,25,25,0,6,Youth unemployment in europe remixOC,2014-02-0172.png
“It’s Beautiful”: the many languages of Coca-Cola’s America in one colorful chart (and why it it won’t work to “represent” the US in one chart — or one video.) [OC],tomboyjourno,2014-02-28,https://medium.com/on-data-and-language/ca541f9d2fb4,https://www.reddit.com/r/dataisbeautiful/comments/1z85s4/its_beautiful_the_many_languages_of_cocacolas/,1,1,0,0,“It’s Beautiful” the many languages of Coca-Cola’s America in one colorful chart (and why it it won’t work to “represent” the US in one chart — or one,2014-02-0173.jpg
Letter frequency for various texts [OC],thetoethumb,2014-02-28,http://i.imgur.com/3RffxVl.png,https://www.reddit.com/r/dataisbeautiful/comments/1z8h56/letter_frequency_for_various_texts_oc/,0,0,0,10,Letter frequency for various texts OC,2014-02-0174.png
The Price Of A Pizza In 237 U.S. Neighborhoods,TheHoffe,2014-02-28,http://www.npr.org/blogs/money/2014/02/21/280745564/the-price-of-a-pizza-in-237-u-s-neighborhoods,https://www.reddit.com/r/dataisbeautiful/comments/1z8haa/the_price_of_a_pizza_in_237_us_neighborhoods/,11,11,0,0,The Price Of A Pizza In 237 U.S. Neighborhoods,2014-02-0175.jpg
