title,author,created_date,url,full_permalink,score,ups,downs,num_comments,sanitized_title,image_file
2014 World Press Freedom Index,screaming_librarian,2014-02-12,http://i.imgur.com/XBHw44s.png,https://www.reddit.com/r/dataisbeautiful/comments/1xpf40/2014_world_press_freedom_index/,2695,2695,0,564,2014 World Press Freedom Index,2014-02-0076.png
US Bus and Amtrak routes,cartoon_gun,2014-02-12,http://i.imgur.com/XyJrz1z.png,https://www.reddit.com/r/dataisbeautiful/comments/1xpo5k/us_bus_and_amtrak_routes/,25,25,0,2,US Bus and Amtrak routes,2014-02-0077.png
Places in the US with the most pleasant days per year,cartoon_gun,2014-02-12,http://i.imgur.com/lWhyuXg.png,https://www.reddit.com/r/dataisbeautiful/comments/1xpulx/places_in_the_us_with_the_most_pleasant_days_per/,18,18,0,10,Places in the US with the most pleasant days per year,2014-02-0078.png
Geographic Concentration of Collegiate Players by Conference,cartoon_gun,2014-02-12,http://i.imgur.com/LQnvJ0W.png,https://www.reddit.com/r/dataisbeautiful/comments/1xpvap/geographic_concentration_of_collegiate_players_by/,6,6,0,4,Geographic Concentration of Collegiate Players by Conference,2014-02-0079.png
My husband made this graph for the Tommy Westphall universe timeline theory.,hipeechic,2014-02-12,http://imgur.com/RBt8RsT,https://www.reddit.com/r/dataisbeautiful/comments/1xq3m6/my_husband_made_this_graph_for_the_tommy/,11,11,0,17,My husband made this graph for the Tommy Westphall universe timeline theory.,2014-02-0080.jpg
Online Dating Profile Word Clouds [OC],dataetc,2014-02-12,http://dataetc.wordpress.com/2014/02/11/online-dating-profile-word-clouds/,https://www.reddit.com/r/dataisbeautiful/comments/1xqfsi/online_dating_profile_word_clouds_oc/,13,13,0,3,Online Dating Profile Word Clouds OC,2014-02-0081.jpg
Online Gaming Aliases: Letter Frequencies and Name Length [OC],Vizual-Statistix,2014-02-12,http://vizual-statistix.tumblr.com/post/76435274350/picking-the-perfect-gaming-alias-is-no-easy-task,https://www.reddit.com/r/dataisbeautiful/comments/1xqozj/online_gaming_aliases_letter_frequencies_and_name/,23,23,0,5,Online Gaming Aliases Letter Frequencies and Name Length OC,2014-02-0082.jpg
Olympic Events - How Close They Came to Winning,SteakandApples,2014-02-12,http://www.nytimes.com/interactive/2014/02/09/sports/olympics/finish-line.html,https://www.reddit.com/r/dataisbeautiful/comments/1xquui/olympic_events_how_close_they_came_to_winning/,22,22,0,6,Olympic Events - How Close They Came to Winning,2014-02-0083.jpg
A Valentine's Day Dashboard <3,14domino,2014-02-12,https://www.leftronic.com/p/trendboards/valentines-day-trendboard/,https://www.reddit.com/r/dataisbeautiful/comments/1xrp9q/a_valentines_day_dashboard_3/,1,1,0,0,A Valentine's Day Dashboard 3,2014-02-0084.jpg
What your candy says about your politics,BubbaMetzia,2014-02-12,http://www.washingtonpost.com/blogs/govbeat/files/2014/02/candy2.png,https://www.reddit.com/r/dataisbeautiful/comments/1xruce/what_your_candy_says_about_your_politics/,49,49,0,23,What your candy says about your politics,2014-02-0085.jpg
Over 450k forum posts plotted by day and time [OC],Mattho,2014-02-13,http://i.imgur.com/w1XklGj.png,https://www.reddit.com/r/dataisbeautiful/comments/1xta5l/over_450k_forum_posts_plotted_by_day_and_time_oc/,331,331,0,30,Over 450k forum posts plotted by day and time OC,2014-02-0086.png
Cable Market share in the USA before and after Comcast buyout of Time Warner Cable [OC],imkharn,2014-02-13,http://i.imgur.com/CP8MrZt.png,https://www.reddit.com/r/dataisbeautiful/comments/1xtceo/cable_market_share_in_the_usa_before_and_after/,624,624,0,347,Cable Market share in the USA before and after Comcast buyout of Time Warner Cable OC,2014-02-0087.png
The Hertzsprung-Russell Graph of star luminosity against color.,weirds,2014-02-13,http://imgur.com/6rWke75,https://www.reddit.com/r/dataisbeautiful/comments/1xvcmx/the_hertzsprungrussell_graph_of_star_luminosity/,1001,1001,0,91,The Hertzsprung-Russell Graph of star luminosity against color.,2014-02-0088.jpg
Interactive Data Visualization: What Outdoor Activity is most popular with 18-24 yr olds?,5h15h,2014-02-14,http://blogs.msdn.com/b/shishirs/archive/2014/02/13/analyzing-search-trends-using-powerbi.aspx,https://www.reddit.com/r/dataisbeautiful/comments/1xvgvk/interactive_data_visualization_what_outdoor/,4,4,0,0,Interactive Data Visualization What Outdoor Activity is most popular with 18-24 yr olds,2014-02-0089.jpg
Percentage of GitHub commit messages with angry words in them (sorted by programming language),Stiffo90,2014-02-14,http://geeksta.net/img/emotions-github-commit-messages/commit-messages-anger-percentage.png,https://www.reddit.com/r/dataisbeautiful/comments/1xvyt1/percentage_of_github_commit_messages_with_angry/,208,208,0,34,Percentage of GitHub commit messages with angry words in them (sorted by programming language),2014-02-0090.png
Did San Francisco's smart parking meter pricing lead to a reduction in parking tickets? [OC],proxyformyrealname,2014-02-14,http://i.imgur.com/H811i2e.png,https://www.reddit.com/r/dataisbeautiful/comments/1xw969/did_san_franciscos_smart_parking_meter_pricing/,27,27,0,5,Did San Francisco's smart parking meter pricing lead to a reduction in parking tickets OC,2014-02-0091.png
London Property price from 1995-2013 Median price inflation adjusted,270282,2014-02-14,http://www.theguardian.com/news/datablog/interactive/2014/feb/14/house-prices-london-changed-over-past-ten-years-interactive,https://www.reddit.com/r/dataisbeautiful/comments/1xwew5/london_property_price_from_19952013_median_price/,3,3,0,0,London Property price from 1995-2013 Median price inflation adjusted,2014-02-0092.jpg
Airfare Hacking: Price of flights from San Francisco to Boston - Hidden City Ticketing vs Conventional Fares [OC],dawenster,2014-02-14,http://www.flyshortcut.com/img/summary-sf-boston-presentation.png,https://www.reddit.com/r/dataisbeautiful/comments/1xwllt/airfare_hacking_price_of_flights_from_san/,27,27,0,16,Airfare Hacking Price of flights from San Francisco to Boston - Hidden City Ticketing vs Conventional Fares OC,2014-02-0093.png
My Boyfriend/Girlfriend/Husband/Wife Wants [OC],matthewsim,2014-02-14,http://imgur.com/gallery/9yKDLbL,https://www.reddit.com/r/dataisbeautiful/comments/1xwrkn/my_boyfriendgirlfriendhusbandwife_wants_oc/,0,0,0,2,My BoyfriendGirlfriendHusbandWife Wants OC,2014-02-0094.jpg
Artificial life simulation visualizing the coevolution of host (blue) and parasite (red) organisms,rhiever,2014-02-14,http://www.youtube.com/watch?v=ripHOtOG4TE,https://www.reddit.com/r/dataisbeautiful/comments/1xwugw/artificial_life_simulation_visualizing_the/,14,14,0,4,Artificial life simulation visualizing the coevolution of host (blue) and parasite (red) organisms,2014-02-0095.jpg
Death and Disease from Power Plants across the US,kgmpers2,2014-02-14,http://www.catf.us/fossil/problems/power_plants/,https://www.reddit.com/r/dataisbeautiful/comments/1xwusy/death_and_disease_from_power_plants_across_the_us/,4,4,0,2,Death and Disease from Power Plants across the US,2014-02-0096.jpg
How divorce and marriage compare internationally,fstorino,2014-02-14,http://cdn.static-economist.com/sites/default/files/imagecache/original-size/images/2014/02/blogs/graphic-detail/20140215_gdc352.png,https://www.reddit.com/r/dataisbeautiful/comments/1xwvmr/how_divorce_and_marriage_compare_internationally/,36,36,0,13,How divorce and marriage compare internationally,2014-02-0097.png
Planned Parenthood vs. Crisis Pregnancy Centers: Comparing the Geographic Distributions [OC],Vizual-Statistix,2014-02-14,http://vizual-statistix.tumblr.com/post/76646087166/in-this-series-of-maps-ive-compared-the,https://www.reddit.com/r/dataisbeautiful/comments/1xwxyy/planned_parenthood_vs_crisis_pregnancy_centers/,86,86,0,16,Planned Parenthood vs. Crisis Pregnancy Centers Comparing the Geographic Distributions OC,2014-02-0098.jpg
The most cycle friendly European countries,Ananke123,2014-02-14,http://russiansphinx.blogspot.com/2013/10/the-most-cycle-friendly-european.html,https://www.reddit.com/r/dataisbeautiful/comments/1xx170/the_most_cycle_friendly_european_countries/,27,27,0,3,The most cycle friendly European countries,2014-02-0099.jpg
"It's Great To Be A Woman In California, Unless You're Hispanic",fstorino,2014-02-14,http://www.npr.org/blogs/money/2014/02/13/275280854/its-great-to-be-a-woman-in-california-unless-youre-hispanic,https://www.reddit.com/r/dataisbeautiful/comments/1xy0en/its_great_to_be_a_woman_in_california_unless/,0,0,0,3,"It's Great To Be A Woman In California, Unless You're Hispanic",2014-02-0100.jpg
2013 Weekly Fantasy Football Points Distribution by Position,Phargo,2014-02-14,http://i.imgur.com/bqEEdAT.png,https://www.reddit.com/r/dataisbeautiful/comments/1xy7wb/2013_weekly_fantasy_football_points_distribution/,13,13,0,4,2013 Weekly Fantasy Football Points Distribution by Position,2014-02-0101.png
[OC] Was told you guys might enjoy this. TF2 Data Visualization. [x-post from /r/tf2],SwagminsterAbbey,2014-02-15,http://i.imgur.com/R8IbbXl.png,https://www.reddit.com/r/dataisbeautiful/comments/1xzmws/oc_was_told_you_guys_might_enjoy_this_tf2_data/,319,319,0,46,OC Was told you guys might enjoy this. TF2 Data Visualization. x-post from rtf2,2014-02-0102.png
"Not sure how accurate xkcd is here, but it's interesting",JtiksPies,2014-02-15,http://xkcd.com/715/,https://www.reddit.com/r/dataisbeautiful/comments/1xzwrh/not_sure_how_accurate_xkcd_is_here_but_its/,121,121,0,10,"Not sure how accurate xkcd is here, but it's interesting",2014-02-0103.jpg
My first 269 days of learning Japanese [OC] (x-post r/LearnJapanese),IllDepence,2014-02-15,http://imgur.com/a/g4tjX,https://www.reddit.com/r/dataisbeautiful/comments/1xzxx1/my_first_269_days_of_learning_japanese_oc_xpost/,1495,1495,0,95,My first 269 days of learning Japanese OC (x-post rLearnJapanese),2014-02-0104.jpg
This site shows the movements of tiger sharks fitted with satellite tags near Hawaii,towehaal,2014-02-15,http://oos.soest.hawaii.edu/pacioos/projects/sharks/,https://www.reddit.com/r/dataisbeautiful/comments/1xzyhg/this_site_shows_the_movements_of_tiger_sharks/,27,27,0,0,This site shows the movements of tiger sharks fitted with satellite tags near Hawaii,2014-02-0105.jpg
Relative size of states distort data in choropleth maps (using a choropleth map). [OC],billautomata,2014-02-15,http://imgur.com/Rhy2taK,https://www.reddit.com/r/dataisbeautiful/comments/1y00ho/relative_size_of_states_distort_data_in/,41,41,0,18,Relative size of states distort data in choropleth maps (using a choropleth map). OC,2014-02-0106.jpg
[OC] I've collected battery data every 1-min of computer usage for the past 1.5 years. My 2013 laptop is holding up better than the 2012. Bonus: I'm sleeping a bit more as well!,Mock_Twain,2014-02-15,http://www.ifweassume.com/2014/02/battery-life-6mo-checkup.html,https://www.reddit.com/r/dataisbeautiful/comments/1y0g41/oc_ive_collected_battery_data_every_1min_of/,12,12,0,1,OC I've collected battery data every 1-min of computer usage for the past 1.5 years. My 2013 laptop is holding up better than the 2012. Bonus I'm slee,2014-02-0107.jpg
[OC] History of average movie length by genre,sdfdsv,2014-02-16,http://i.imgur.com/cbhyjFF.png,https://www.reddit.com/r/dataisbeautiful/comments/1y1lfs/oc_history_of_average_movie_length_by_genre/,161,161,0,22,OC History of average movie length by genre,2014-02-0108.png
"Gif of US age distribution, 5 year increments",tatonnement,2014-02-16,http://www.calculatedriskblog.com/2014/02/by-request-repeat-us-population-by-age.html,https://www.reddit.com/r/dataisbeautiful/comments/1y2pci/gif_of_us_age_distribution_5_year_increments/,109,109,0,8,"Gif of US age distribution, 5 year increments",2014-02-0109.jpg
Detroit's 8 Mile Road,grepawk,2014-02-17,http://i.imgur.com/3YqkPxf.png,https://www.reddit.com/r/dataisbeautiful/comments/1y4m9e/detroits_8_mile_road/,30,30,0,11,Detroit's 8 Mile Road,2014-02-0110.png
Non-guilty findings more common if a white person is accused of killing a black person,dvwz,2014-02-17,http://thesocietypages.org/socimages/files/2014/02/12.png,https://www.reddit.com/r/dataisbeautiful/comments/1y4n5d/nonguilty_findings_more_common_if_a_white_person/,11,11,0,16,Non-guilty findings more common if a white person is accused of killing a black person,2014-02-0111.png
How Many People Aren’t Vaccinating Their Kids in Your State? (Source:Center for Disease Control; via:MotherJones),aviroy,2014-02-17,http://www.motherjones.com/files/vaccine_rateBystate-UPD-01.png,https://www.reddit.com/r/dataisbeautiful/comments/1y54fn/how_many_people_arent_vaccinating_their_kids_in/,24,24,0,24,How Many People Aren’t Vaccinating Their Kids in Your State (SourceCenter for Disease Control; viaMotherJones),2014-02-0112.png
Smartphone Screen Size and Thickness since 2007 [OC],corpsdawg,2014-02-17,http://imgur.com/a/5ArUh,https://www.reddit.com/r/dataisbeautiful/comments/1y5ju9/smartphone_screen_size_and_thickness_since_2007_oc/,66,66,0,11,Smartphone Screen Size and Thickness since 2007 OC,2014-02-0113.jpg
2014 Oscars Preview & Analysis,udfalkso,2014-02-17,http://iknow.io/labs/oscars/overview/,https://www.reddit.com/r/dataisbeautiful/comments/1y5vxx/2014_oscars_preview_analysis/,1,1,0,0,2014 Oscars Preview & Analysis,2014-02-0114.jpg
Comcast-Time Warner by population (before and after buyout),ignost,2014-02-17,http://cabletv.com/blog/comcast-time-warner-buyout-data/,https://www.reddit.com/r/dataisbeautiful/comments/1y5y4l/comcasttime_warner_by_population_before_and_after/,18,18,0,2,Comcast-Time Warner by population (before and after buyout),2014-02-0115.jpg
"Series of charts on imprisoned journalists: by year, by medium, by country, by charges filed [OC]",tresliso,2014-02-17,http://www.ibtimes.com/turkey-iran-china-leading-jailers-journalists-charts-1556123,https://www.reddit.com/r/dataisbeautiful/comments/1y64wy/series_of_charts_on_imprisoned_journalists_by/,14,14,0,1,"Series of charts on imprisoned journalists by year, by medium, by country, by charges filed OC",2014-02-0116.jpg
"[OC] Average IMDB ratings for ""The Good Wife"" - yes, getting to the fifth season is worth it",rjtavares,2014-02-17,http://i.imgur.com/OPitBOP.png,https://www.reddit.com/r/dataisbeautiful/comments/1y6ov2/oc_average_imdb_ratings_for_the_good_wife_yes/,4,4,0,2,"OC Average IMDB ratings for The Good Wife - yes, getting to the fifth season is worth it",2014-02-0117.png
"Arctic ice visualized by age, 1987-2013 [crosspost from /r/videos]",arnar,2014-02-17,http://www.liveleak.com/view?i=927_1392666967,https://www.reddit.com/r/dataisbeautiful/comments/1y6qtc/arctic_ice_visualized_by_age_19872013_crosspost/,29,29,0,9,"Arctic ice visualized by age, 1987-2013 crosspost from rvideos",2014-02-0118.jpg
How often specific words appear in lyrics from 1960 to now based on analysis of every song on the Billbord hot 100 in that time period,tresliso,2014-02-17,http://www.ibtimes.com/lyrics-now-then-history-music-charts-1556137,https://www.reddit.com/r/dataisbeautiful/comments/1y75i0/how_often_specific_words_appear_in_lyrics_from/,1086,1086,0,132,How often specific words appear in lyrics from 1960 to now based on analysis of every song on the Billbord hot 100 in that time period,2014-02-0119.jpg
How did they create the multi-dimensional visualizations in this TED talk? (3:45 onwards),buzzyness,2014-02-18,http://www.youtube.com/watch?v=kv_uyUTx5Po,https://www.reddit.com/r/dataisbeautiful/comments/1y8uih/how_did_they_create_the_multidimensional/,23,23,0,7,How did they create the multi-dimensional visualizations in this TED talk (345 onwards),2014-02-0120.jpg
2013 National customer service survey results for communication services,screaming_librarian,2014-02-18,http://i.imgur.com/PD84ggn.png,https://www.reddit.com/r/dataisbeautiful/comments/1y9gym/2013_national_customer_service_survey_results_for/,8,8,0,2,2013 National customer service survey results for communication services,2014-02-0121.png
Soft drink consumption over time - An example of why you should pay attention to axis values when reading a chart,NonNonHeinous,2014-02-18,http://i.imgur.com/Rp49YGp.png,https://www.reddit.com/r/dataisbeautiful/comments/1yafgv/soft_drink_consumption_over_time_an_example_of/,0,0,0,5,Soft drink consumption over time - An example of why you should pay attention to axis values when reading a chart,2014-02-0122.png
Speeds of Olympic events,mewfahsah,2014-02-18,http://imgur.com/g3g8iBO,https://www.reddit.com/r/dataisbeautiful/comments/1yasr4/speeds_of_olympic_events/,37,37,0,9,Speeds of Olympic events,2014-02-0123.jpg
Investigating the style of self-portraits (selfies) in five cities across the world [Original Source],yaph,2014-02-19,http://selfiecity.net/,https://www.reddit.com/r/dataisbeautiful/comments/1yceis/investigating_the_style_of_selfportraits_selfies/,9,9,0,2,Investigating the style of self-portraits (selfies) in five cities across the world Original Source,2014-02-0124.jpg
Top 15 quarterbacks in career passing TDs,cartoon_gun,2014-02-19,http://i.imgur.com/iDanRPl.png,https://www.reddit.com/r/dataisbeautiful/comments/1ycjmu/top_15_quarterbacks_in_career_passing_tds/,20,20,0,5,Top 15 quarterbacks in career passing TDs,2014-02-0125.png
"Beer Excise Tax Rates by State, 2014",mstater,2014-02-19,http://taxfoundation.org/sites/taxfoundation.org/files/docs/Beer-Excise-Tax-Rates-2014-%28large%29%20%282%29.png,https://www.reddit.com/r/dataisbeautiful/comments/1ydpk9/beer_excise_tax_rates_by_state_2014/,44,44,0,20,"Beer Excise Tax Rates by State, 2014",2014-02-0126.png
Fluctuations in US ticket prices by days to departure (comparison by region),EternalRecurrence,2014-02-19,http://qzprod.files.wordpress.com/2014/02/us-international-airfares-africa-europe-asia-south-america_chartbuilder.png?w=1024&h=613,https://www.reddit.com/r/dataisbeautiful/comments/1yeaxo/fluctuations_in_us_ticket_prices_by_days_to/,792,792,0,80,Fluctuations in US ticket prices by days to departure (comparison by region),2014-02-0127.png
"Food, income and education: who eats more of what?",eanayo,2014-02-20,http://www.cedar.iph.cam.ac.uk/resources/evidence/food-income-education-graphic/,https://www.reddit.com/r/dataisbeautiful/comments/1yfozh/food_income_and_education_who_eats_more_of_what/,138,138,0,23,"Food, income and education who eats more of what",2014-02-0128.jpg
Previous Olympic data trends,simpsoke,2014-02-20,https://datahero.com/blog/2014/02/20/olympic-data/,https://www.reddit.com/r/dataisbeautiful/comments/1yggpy/previous_olympic_data_trends/,2,2,0,0,Previous Olympic data trends,2014-02-0129.jpg
Fatalities per billion kilometers driven from 1970 to 2005,TheMrFunday,2014-02-20,http://i.imgur.com/WUTmfF7.png,https://www.reddit.com/r/dataisbeautiful/comments/1ygje1/fatalities_per_billion_kilometers_driven_from/,148,148,0,24,Fatalities per billion kilometers driven from 1970 to 2005,2014-02-0130.png
Lets visualize Beer because it’s 5 pm somewhere,5h15h,2014-02-20,http://blogs.msdn.com/b/shishirs/archive/2014/02/19/lets-visualize-beer-because-it-s-5-pm-somewhere.aspx,https://www.reddit.com/r/dataisbeautiful/comments/1ygmke/lets_visualize_beer_because_its_5_pm_somewhere/,0,0,0,1,Lets visualize Beer because it’s 5 pm somewhere,2014-02-0131.jpg
How Many Streams/Sales Musicians Need in Order to Make Minimum Wage,fatmaynard,2014-02-20,http://i.imgur.com/4ZfkH1M.png,https://www.reddit.com/r/dataisbeautiful/comments/1yha5e/how_many_streamssales_musicians_need_in_order_to/,74,74,0,12,How Many StreamsSales Musicians Need in Order to Make Minimum Wage,2014-02-0132.png
"Remittances: How much money the US's immigrant workforce send home, and to which countries (and vice versa), mapped. Based on World Bank data [OC]",tresliso,2014-02-21,http://www.ibtimes.com/where-does-united-states-immigrant-workforce-come-how-much-money-are-they-sending-home-charts,https://www.reddit.com/r/dataisbeautiful/comments/1yjg7n/remittances_how_much_money_the_uss_immigrant/,9,9,0,5,"Remittances How much money the US's immigrant workforce send home, and to which countries (and vice versa), mapped. Based on World Bank data OC",2014-02-0133.jpg
How much is time wrong around the world?,nthitz,2014-02-21,http://imgur.com/qZaXinl.png,https://www.reddit.com/r/dataisbeautiful/comments/1yjwlw/how_much_is_time_wrong_around_the_world/,253,253,0,38,How much is time wrong around the world,2014-02-0134.jpg
"Breakdown of Titanic Survivors and Victims by Gender, Class and Age",DoneHam56,2014-02-21,http://upload.wikimedia.org/wikipedia/commons/thumb/e/e9/Titanic_Survival_Stats.svg/1000px-Titanic_Survival_Stats.svg.png,https://www.reddit.com/r/dataisbeautiful/comments/1ykab2/breakdown_of_titanic_survivors_and_victims_by/,117,117,0,16,"Breakdown of Titanic Survivors and Victims by Gender, Class and Age",2014-02-0135.png
"Google Trends: ""Threema"" - Interest in end-to-end encryption messaging app after Facebook acquires WhatsApp",Vik1ng,2014-02-21,http://i.imgur.com/EnoXZaX.png,https://www.reddit.com/r/dataisbeautiful/comments/1ykh15/google_trends_threema_interest_in_endtoend/,29,29,0,3,Google Trends Threema - Interest in end-to-end encryption messaging app after Facebook acquires WhatsApp,2014-02-0136.png
"Old Ice Becoming Rare in Arctic, 1987-2013 [x-post from /r/ClimatePics]",fungussa,2014-02-22,http://www.youtube.com/watch?v=H-BbPBg3vj8,https://www.reddit.com/r/dataisbeautiful/comments/1ymmxc/old_ice_becoming_rare_in_arctic_19872013_xpost/,43,43,0,11,"Old Ice Becoming Rare in Arctic, 1987-2013 x-post from rClimatePics",2014-02-0137.jpg
Where children go hungry in the world,point1,2014-02-22,http://persquaremile.com/2014/02/21/children-hungry-world/?_ga=1.62970543.1811893271.1390674798,https://www.reddit.com/r/dataisbeautiful/comments/1ynhmg/where_children_go_hungry_in_the_world/,21,21,0,7,Where children go hungry in the world,2014-02-0138.jpg
Hexical: An Alternate Political History [OC],giantspeck,2014-02-22,http://imgur.com/a/vrrvz#0,https://www.reddit.com/r/dataisbeautiful/comments/1ynlvv/hexical_an_alternate_political_history_oc/,26,26,0,8,Hexical An Alternate Political History OC,2014-02-0139.jpg
"Scientist+Engineer density plotted against financial costs of R&D, per-country",swiftfootedmonkey,2014-02-22,http://qz.com/179464/china-is-spending-a-fortune-on-science-and-is-getting-robbed-blind-by-corrupt-scientists/,https://www.reddit.com/r/dataisbeautiful/comments/1yohmu/scientistengineer_density_plotted_against/,0,0,0,0,"Scientist+Engineer density plotted against financial costs of R&D, per-country",2014-02-0140.jpg
Summer Olympics + porn,kekekekekekekekek,2014-02-23,http://i.imgur.com/GS972zJ.png,https://www.reddit.com/r/dataisbeautiful/comments/1youxz/summer_olympics_porn/,0,0,0,2,Summer Olympics + porn,2014-02-0141.png
Best Time to Buy an International Flight to Each Continent from the U.S.,soil_nerd,2014-02-23,http://i.imgur.com/Q3SQ6GC.png,https://www.reddit.com/r/dataisbeautiful/comments/1yq659/best_time_to_buy_an_international_flight_to_each/,153,153,0,14,Best Time to Buy an International Flight to Each Continent from the U.S.,2014-02-0142.png
Netflix bandwidth comparison for Internet service providers,-Gavin-,2014-02-23,http://i.imgur.com/PUvAYj1.png,https://www.reddit.com/r/dataisbeautiful/comments/1yq8zq/netflix_bandwidth_comparison_for_internet_service/,3155,3155,0,460,Netflix bandwidth comparison for Internet service providers,2014-02-0143.png
How much the world’s armies embrace gays,fstorino,2014-02-24,http://cdn.static-economist.com/sites/default/files/imagecache/original-size/images/2014/02/blogs/graphic-detail/20140222_gdc388.png,https://www.reddit.com/r/dataisbeautiful/comments/1ysrtk/how_much_the_worlds_armies_embrace_gays/,22,22,0,18,How much the world’s armies embrace gays,2014-02-0144.png
Traffic on /r/TwitchPlaysPokemon,NonNonHeinous,2014-02-24,http://i.imgur.com/AVm892D.png,https://www.reddit.com/r/dataisbeautiful/comments/1ysvs3/traffic_on_rtwitchplayspokemon/,0,0,0,1,Traffic on rTwitchPlaysPokemon,2014-02-0145.png
Well-Being Index from 2012 to 2013 of the States,KoreanKansan,2014-02-24,http://info.healthways.com/wbi2013,https://www.reddit.com/r/dataisbeautiful/comments/1ytozo/wellbeing_index_from_2012_to_2013_of_the_states/,23,23,0,6,Well-Being Index from 2012 to 2013 of the States,2014-02-0146.jpg
A tide that's not lifting all boats: Median household income in the Unites States in 1984-1986 vs. 2010-2012 [OC],almodozo,2014-02-24,http://observationalism.com/wp-content/uploads/2014/02/median_household_income_by_state_then_and_now.png,https://www.reddit.com/r/dataisbeautiful/comments/1yuca7/a_tide_thats_not_lifting_all_boats_median/,30,30,0,29,A tide that's not lifting all boats Median household income in the Unites States in 1984-1986 vs. 2010-2012 OC,2014-02-0147.png
A couple of visualizations from Chicago's Divvy Bike Program [OC],klimburg,2014-02-24,http://imgur.com/a/PHKFI,https://www.reddit.com/r/dataisbeautiful/comments/1yuh3j/a_couple_of_visualizations_from_chicagos_divvy/,19,19,0,6,A couple of visualizations from Chicago's Divvy Bike Program OC,2014-02-0148.jpg
Medals won at the Olympics: Summer vs. Winter,fstorino,2014-02-25,http://cdn.static-economist.com/sites/default/files/imagecache/original-size/images/2014/02/blogs/graphic-detail/20140301_gdc408.png,https://www.reddit.com/r/dataisbeautiful/comments/1yvx3l/medals_won_at_the_olympics_summer_vs_winter/,143,143,0,24,Medals won at the Olympics Summer vs. Winter,2014-02-0149.png
Cycling in the EU,sjgw137,2014-02-25,http://road.cc/content/news/111825-official-uk-has-joint-3rd-lowest-levels-daily-cycling-eu,https://www.reddit.com/r/dataisbeautiful/comments/1yw9i2/cycling_in_the_eu/,12,12,0,4,Cycling in the EU,2014-02-0150.jpg
