title,author,created_date,url,full_permalink,score,ups,downs,num_comments,sanitized_title,image_file
Student homelessness in Washington State [OC],MSPowerMap,2015-05-19,https://www.youtube.com/watch?v=0cUXqKNkFYY,https://www.reddit.com/r/dataisbeautiful/comments/36jskg/student_homelessness_in_washington_state_oc/,5,5,0,2,Student homelessness in Washington State OC,2015-05-0284.jpg
"Amazon, Starbucks, and Wells Fargo more popular among better performing investors. AT&T, Bank of America in the reverse. [OC]",openfolio_dave,2015-05-19,http://imgur.com/a/nGkzv,https://www.reddit.com/r/dataisbeautiful/comments/36jx0p/amazon_starbucks_and_wells_fargo_more_popular/,5,5,0,1,"Amazon, Starbucks, and Wells Fargo more popular among better performing investors. AT&T, Bank of America in the reverse. OC",2015-05-0285.jpg
The ideology of Bernie Sanders.,KonradTrout,2015-05-19,https://www.govtrack.us/congress/members/bernard_sanders/400357#sponsorship_analysis_chart,https://www.reddit.com/r/dataisbeautiful/comments/36kfdo/the_ideology_of_bernie_sanders/,6,6,0,3,The ideology of Bernie Sanders.,2015-05-0286.jpg
"Sources of Government Revenue across the OECD, 2015 | Tax Foundation",jimrosenz,2015-05-20,http://taxfoundation.org/article/sources-government-revenue-across-oecd-2015,https://www.reddit.com/r/dataisbeautiful/comments/36ljxy/sources_of_government_revenue_across_the_oecd/,5,5,0,1,"Sources of Government Revenue across the OECD, 2015 Tax Foundation",2015-05-0287.jpg
I made a tool to visualize your eBay search results as scatterplot [OC],patman314159,2015-05-20,http://eobs.esy.es,https://www.reddit.com/r/dataisbeautiful/comments/36lvjy/i_made_a_tool_to_visualize_your_ebay_search/,5,5,0,3,I made a tool to visualize your eBay search results as scatterplot OC,2015-05-0288.jpg
"In These 21 Countries, a 40-Hour Work Week Still Keeps Families in Poverty - Bloomberg Business",jimrosenz,2015-05-20,http://www.bloomberg.com/news/articles/2015-05-06/in-these-21-countries-a-40-hour-work-week-still-keeps-families-in-poverty,https://www.reddit.com/r/dataisbeautiful/comments/36lxnb/in_these_21_countries_a_40hour_work_week_still/,63,63,0,15,"In These 21 Countries, a 40-Hour Work Week Still Keeps Families in Poverty - Bloomberg Business",2015-05-0289.jpg
"[OC] US and Canadian real GDP per capita as a percentage of British GDP per capita, 1800–2010",jimrosenz,2015-05-20,http://utopiayouarestandinginit.com/2015/05/19/us-and-canadian-real-gdp-per-capita-as-percentage-of-british-gdp-per-capita-18002010/,https://www.reddit.com/r/dataisbeautiful/comments/36mb44/oc_us_and_canadian_real_gdp_per_capita_as_a/,3,3,0,5,"OC US and Canadian real GDP per capita as a percentage of British GDP per capita, 1800–2010",2015-05-0290.jpg
State Food Stamps Participants Per Capita [OC],vaccster,2015-05-20,http://i.imgur.com/P1UHa5P.png,https://www.reddit.com/r/dataisbeautiful/comments/36mf9y/state_food_stamps_participants_per_capita_oc/,10,10,0,5,State Food Stamps Participants Per Capita OC,2015-05-0291.png
"Italy is the most tagged country on Instagram, followed by Brazil and Japan.",borsamat,2015-05-20,http://www.misurarelacomunicazione.it/2015/05/20/litalia-paese-taggato-instagram/,https://www.reddit.com/r/dataisbeautiful/comments/36mfgl/italy_is_the_most_tagged_country_on_instagram/,12,12,0,15,"Italy is the most tagged country on Instagram, followed by Brazil and Japan.",2015-05-0292.jpg
Game of Thrones Viewers - Reaching it's Peak? [OC],lolatu2,2015-05-20,https://slemma.com/share/926e5fb57dcb00c74cb711d8413907855ca09664,https://www.reddit.com/r/dataisbeautiful/comments/36mpau/game_of_thrones_viewers_reaching_its_peak_oc/,1,1,0,4,Game of Thrones Viewers - Reaching it's Peak OC,2015-05-0293.jpg
Disciplines of /r/science users with approved flairs [OC],shlam16,2015-05-20,http://i.imgur.com/W0hGTZs.png,https://www.reddit.com/r/dataisbeautiful/comments/36mpm6/disciplines_of_rscience_users_with_approved/,131,131,0,63,Disciplines of rscience users with approved flairs OC,2015-05-0294.png
Mapping Migration in the United States: Where people who lived in each state in 2012 were born,Shovelbum26,2015-05-20,http://www.nytimes.com/2014/08/16/upshot/mapping-migration-in-the-united-states-since-1900.html?WT.mc_id=2015-MAY-FACEBOOK-GYLAL_ENGAGEMENT_AUD_DEV-0505-0531&WT.mc_ev=click&ad-keywords=MAYAUDDEVFB&_r=0&abt=0002&abg=0,https://www.reddit.com/r/dataisbeautiful/comments/36mv27/mapping_migration_in_the_united_states_where/,2,2,0,3,Mapping Migration in the United States Where people who lived in each state in 2012 were born,2015-05-0295.jpg
Running the Numbers on the NFL Draft,JamesKotecki,2015-05-20,http://blog.automatedinsights.com/post/119383877467/running-the-numbers-on-the-nfl-draft,https://www.reddit.com/r/dataisbeautiful/comments/36mxqy/running_the_numbers_on_the_nfl_draft/,5,5,0,0,Running the Numbers on the NFL Draft,2015-05-0296.jpg
Commuting to work in the 30 largest US cities and analyzing which methods are used and how often [OC],datarattata,2015-05-20,https://www.businessvibes.com/blog/How-People-Commute-Work-30-Largest-Cities-United-States,https://www.reddit.com/r/dataisbeautiful/comments/36nb1r/commuting_to_work_in_the_30_largest_us_cities_and/,6,6,0,1,Commuting to work in the 30 largest US cities and analyzing which methods are used and how often OC,2015-05-0297.jpg
State-by-State Rates of Cremation over Time,qui_tam_gogh,2015-05-20,http://www.slate.com/articles/business/moneybox/2015/05/cremation_rates_in_the_u_s_a_state_by_state_map.html,https://www.reddit.com/r/dataisbeautiful/comments/36ny8r/statebystate_rates_of_cremation_over_time/,6,6,0,3,State-by-State Rates of Cremation over Time,2015-05-0298.jpg
Greatful Dead final shows ticket sale prices,Captnhappy,2015-05-20,http://www.thebarnpresents.com/grateful-dead-50-chicago-ticket-price-analysis-volume-one-25589.html,https://www.reddit.com/r/dataisbeautiful/comments/36o22t/greatful_dead_final_shows_ticket_sale_prices/,0,0,0,0,Greatful Dead final shows ticket sale prices,2015-05-0299.jpg
World Map of Main Battle Tank Usage [OC] (Blank map and info taken from Wikipedia),ADMONlTOR,2015-05-20,http://i.imgur.com/12RrccD.png,https://www.reddit.com/r/dataisbeautiful/comments/36o37p/world_map_of_main_battle_tank_usage_oc_blank_map/,2,2,0,5,World Map of Main Battle Tank Usage OC (Blank map and info taken from Wikipedia),2015-05-0300.png
5 facts about the minimum wage | Pew Research Center,jimrosenz,2015-05-20,http://www.pewresearch.org/fact-tank/2015/05/20/5-facts-about-the-minimum-wage/,https://www.reddit.com/r/dataisbeautiful/comments/36oak1/5_facts_about_the_minimum_wage_pew_research_center/,13,13,0,3,5 facts about the minimum wage Pew Research Center,2015-05-0301.jpg
The Network of Mexican Cartels and US Gangs,omichel,2015-05-20,http://dadaviz.com/i/4112,https://www.reddit.com/r/dataisbeautiful/comments/36olha/the_network_of_mexican_cartels_and_us_gangs/,0,0,0,1,The Network of Mexican Cartels and US Gangs,2015-05-0302.jpg
The data behind the confirmation of the Higgs Boson,PM_YOUR_FAVORTE_SONG,2015-05-20,http://www.atlas.ch/photos/atlas_photos/selected-photos/plots/4l-FixedScale-NoMuProf2.gif,https://www.reddit.com/r/dataisbeautiful/comments/36onv0/the_data_behind_the_confirmation_of_the_higgs/,11,11,0,2,The data behind the confirmation of the Higgs Boson,2015-05-0303.jpg
"ENERGY IN THE U.S. -- Sources of energy production, use and waste in 2014",obriennolan,2015-05-20,https://www.flickr.com/photos/llnl/17712919678/in/dateposted-public/,https://www.reddit.com/r/dataisbeautiful/comments/36ou2x/energy_in_the_us_sources_of_energy_production_use/,15,15,0,7,"ENERGY IN THE U.S. -- Sources of energy production, use and waste in 2014",2015-05-0304.jpg
"Mapping inequalities in Baltimore's neighborhoods - interactive map showing unemployment, income, life expectancy, and homicide rate",twenafeesh,2015-05-20,http://www.baltimoresun.com/bal-graphic-mapping-inequalities-in-baltimores-neighborhoods-20150504-htmlstory.html,https://www.reddit.com/r/dataisbeautiful/comments/36ov8b/mapping_inequalities_in_baltimores_neighborhoods/,1,1,0,0,"Mapping inequalities in Baltimore's neighborhoods - interactive map showing unemployment, income, life expectancy, and homicide rate",2015-05-0305.jpg
Department Of Defense employees spend over $1 million on strippers and casinos [OC],CJMinard,2015-05-21,http://dadaviz.com/i/4125,https://www.reddit.com/r/dataisbeautiful/comments/36qx8z/department_of_defense_employees_spend_over_1/,3748,3748,0,950,Department Of Defense employees spend over $1 million on strippers and casinos OC,2015-05-0306.jpg
The Divorce Rate is Falling Among More Recently Married Couples,UnknownBinary,2015-05-21,http://www.nytimes.com/2014/12/02/upshot/the-divorce-surge-is-over-but-the-myth-lives-on.html?WT.mc_id=2015-MAY-KWP-AUD_DEV-0501-0531&WT.mc_ev=click&ad-keywords=MAYAUDDEVFB&kwp_0=15059&kwp_4=112367&kwp_1=145619&_r=0&abt=0002&abg=0,https://www.reddit.com/r/dataisbeautiful/comments/36r0fc/the_divorce_rate_is_falling_among_more_recently/,4,4,0,2,The Divorce Rate is Falling Among More Recently Married Couples,2015-05-0307.jpg
"Alcohol/Tobacco Consumption - the French drink more than the Irish, Americans drink more than Italians [OC]",lolatu2,2015-05-21,https://slemma.com/share/255d36f4faf3ab4198cd3e88bddba693734dce5c,https://www.reddit.com/r/dataisbeautiful/comments/36r1ns/alcoholtobacco_consumption_the_french_drink_more/,11,11,0,5,"AlcoholTobacco Consumption - the French drink more than the Irish, Americans drink more than Italians OC",2015-05-0308.jpg
"[OC] French and German real GDP per capita as a percentage of British GDP per capita, 1820–2010",jimrosenz,2015-05-21,http://utopiayouarestandinginit.com/2015/05/21/french-and-german-real-gdp-per-capita-as-a-percentage-of-british-gdp-per-capita-18202010/,https://www.reddit.com/r/dataisbeautiful/comments/36r1xv/oc_french_and_german_real_gdp_per_capita_as_a/,3,3,0,2,"OC French and German real GDP per capita as a percentage of British GDP per capita, 1820–2010",2015-05-0309.jpg
US Population Shifts by County - Where the Grass is Greener [OC],jzambrose,2015-05-21,http://www.ambrosestrategy.com/news/where-the-grass-is-greener,https://www.reddit.com/r/dataisbeautiful/comments/36r97r/us_population_shifts_by_county_where_the_grass_is/,12,12,0,4,US Population Shifts by County - Where the Grass is Greener OC,2015-05-0310.jpg
Beautiful Viz by US Census - Ten U.S. Cities Now Have 1 Million People or More; California and Texas Each Have Three of These Places,sarahbotts,2015-05-21,http://www.census.gov/newsroom/press-releases/2015/cb15-89.html,https://www.reddit.com/r/dataisbeautiful/comments/36ralh/beautiful_viz_by_us_census_ten_us_cities_now_have/,0,0,0,0,Beautiful Viz by US Census - Ten U.S. Cities Now Have 1 Million People or More; California and Texas Each Have Three of These Places,2015-05-0311.jpg
The states where parents spend the most on child care,wclax04,2015-05-21,http://www.washingtonpost.com/blogs/wonkblog/wp/2015/05/20/the-states-with-the-most-and-least-expensive-child-care/,https://www.reddit.com/r/dataisbeautiful/comments/36rbm6/the_states_where_parents_spend_the_most_on_child/,3,3,0,0,The states where parents spend the most on child care,2015-05-0312.jpg
"World Gas Prices: Citizens in Venezuela pay $0.06/gallon (0.01€/liter or 0.05€/gallon), Saudi Arabia $0.61/gallon (0.14€/liter or 0.53€/gallon), California $3.80/gallon (0.88€/liter or 3.32€/gallon), UK $6.93/gallon (1.60€/liter or 6.06€/gallon), Norway $8.15/gallon (1.89€/liter or 7.16€/gallon)",ringingbells,2015-05-21,http://www.globalpetrolprices.com/gasoline_prices/,https://www.reddit.com/r/dataisbeautiful/comments/36rfzl/world_gas_prices_citizens_in_venezuela_pay/,10,10,0,10,"World Gas Prices Citizens in Venezuela pay $0.06gallon (0.01€liter or 0.05€gallon), Saudi Arabia $0.61gallon (0.14€liter or 0.53€gallon), California $",2015-05-0313.jpg
Analysis of Reddit's sixty second countdown button,kanhy,2015-05-21,http://community.wolfram.com/groups/-/m/t/500948,https://www.reddit.com/r/dataisbeautiful/comments/36saih/analysis_of_reddits_sixty_second_countdown_button/,10,10,0,3,Analysis of Reddit's sixty second countdown button,2015-05-0314.jpg
"The population growth of every Texas city and town, plus the top cities in the nation [OC]",joliesky,2015-05-21,http://www.texastribune.org/2015/05/21/interactive-texas-population-growth-2010-2014/,https://www.reddit.com/r/dataisbeautiful/comments/36sfn3/the_population_growth_of_every_texas_city_and/,1,1,0,2,"The population growth of every Texas city and town, plus the top cities in the nation OC",2015-05-0315.jpg
Mapped: Where is same sex marriage legal in the world?,muyuu,2015-05-21,http://www.telegraph.co.uk/news/worldnews/europe/ireland/11621812/Mapped-Where-is-same-sex-marriage-legal-in-the-world.html,https://www.reddit.com/r/dataisbeautiful/comments/36sp8o/mapped_where_is_same_sex_marriage_legal_in_the/,26,26,0,21,Mapped Where is same sex marriage legal in the world,2015-05-0316.jpg
Eurovision Song Contest 1975-2014: more points for countries close to each other [OC],Steeph,2015-05-21,http://sargasso.nl/eurovision-song-contest-1975-2014-more-points-for-countries-close-to-each-other/,https://www.reddit.com/r/dataisbeautiful/comments/36sq7d/eurovision_song_contest_19752014_more_points_for/,4,4,0,1,Eurovision Song Contest 1975-2014 more points for countries close to each other OC,2015-05-0317.jpg
Chromebooks Sales still have a lot of Potential [OC],yaph,2015-05-21,http://www.linux-netbook.com/chromebook-sales-potential/,https://www.reddit.com/r/dataisbeautiful/comments/36t16y/chromebooks_sales_still_have_a_lot_of_potential_oc/,3,3,0,1,Chromebooks Sales still have a lot of Potential OC,2015-05-0318.jpg
The Complete History Of The NBA,DC_CAB,2015-05-21,http://fivethirtyeight.com/interactives/the-complete-history-of-every-nba-team-by-elo/#hawks,https://www.reddit.com/r/dataisbeautiful/comments/36t1tn/the_complete_history_of_the_nba/,13,13,0,0,The Complete History Of The NBA,2015-05-0319.jpg
TRAVIC - Transit Visualization Client,papereraser,2015-05-21,http://tracker.geops.ch/?z=13&s=30&x=-8234291.1813&y=4971867.4328&l=transport,https://www.reddit.com/r/dataisbeautiful/comments/36tl29/travic_transit_visualization_client/,5,5,0,0,TRAVIC - Transit Visualization Client,2015-05-0320.jpg
How Suburban Are Big American Cities?,CJMinard,2015-05-22,http://fivethirtyeight.com/features/how-suburban-are-big-american-cities/,https://www.reddit.com/r/dataisbeautiful/comments/36uhzz/how_suburban_are_big_american_cities/,22,22,0,3,How Suburban Are Big American Cities,2015-05-0321.jpg
Gay Happiness Index,MrBeanie88,2015-05-22,http://www.planetromeo.com/lgbt/gay-happiness-index/,https://www.reddit.com/r/dataisbeautiful/comments/36uyw1/gay_happiness_index/,0,0,0,0,Gay Happiness Index,2015-05-0322.jpg
Facebook Birthday Messages Pt2 The Kanye Ratio [OC],bumsahoy,2015-05-22,http://nosurprisethere.com/facebook-birthday-messages-pt-2-the-kanye-ratio/,https://www.reddit.com/r/dataisbeautiful/comments/36vbbd/facebook_birthday_messages_pt2_the_kanye_ratio_oc/,1,1,0,1,Facebook Birthday Messages Pt2 The Kanye Ratio OC,2015-05-0323.jpg
These states rob from the poor and give to the rich,Jgrovum,2015-05-22,http://www.washingtonpost.com/blogs/wonkblog/wp/2015/05/22/these-states-rob-from-the-poor-and-give-to-the-rich/?utm_medium=twitter&utm_source=twitterfeed,https://www.reddit.com/r/dataisbeautiful/comments/36vf2r/these_states_rob_from_the_poor_and_give_to_the/,315,315,0,315,These states rob from the poor and give to the rich,2015-05-0324.jpg
Public use bike share stations & private bike ridership patterns in Philadelphia [OC],proxyformyrealname,2015-05-22,http://i.imgur.com/HdIgRSq.jpg,https://www.reddit.com/r/dataisbeautiful/comments/36vlf7/public_use_bike_share_stations_private_bike/,334,334,0,19,Public use bike share stations & private bike ridership patterns in Philadelphia OC,2015-05-0325.jpg
"[OC] The employment rates of sole parents with toddlers, OECD, 2011",jimrosenz,2015-05-22,http://utopiayouarestandinginit.com/2015/05/22/the-employment-rates-of-sole-parents-with-toddlers-oecd-2011/,https://www.reddit.com/r/dataisbeautiful/comments/36vmzd/oc_the_employment_rates_of_sole_parents_with/,9,9,0,2,"OC The employment rates of sole parents with toddlers, OECD, 2011",2015-05-0326.jpg
"Historical results of the municipal elections in the State of Sonora, Mexico [OC]",dogo13,2015-05-22,http://www.luisarmandomoreno.mx/las-elecciones-municipales-en-sonora/,https://www.reddit.com/r/dataisbeautiful/comments/36w8bv/historical_results_of_the_municipal_elections_in/,6,6,0,1,"Historical results of the municipal elections in the State of Sonora, Mexico OC",2015-05-0327.jpg
The occupations and descriptions of the characters of The New Yorker cartoons in 2014 [OC],mark_bellhorn,2015-05-22,http://imgur.com/a/WMIiJ,https://www.reddit.com/r/dataisbeautiful/comments/36wbcu/the_occupations_and_descriptions_of_the/,3,3,0,2,The occupations and descriptions of the characters of The New Yorker cartoons in 2014 OC,2015-05-0328.jpg
US Food Retail vs Farm Prices - what's up with bread/flour? [OC],lolatu2,2015-05-22,https://slemma.com/share/d162f5464199c4f3d3db4af4ecb2631df5029032,https://www.reddit.com/r/dataisbeautiful/comments/36wlcf/us_food_retail_vs_farm_prices_whats_up_with/,9,9,0,3,US Food Retail vs Farm Prices - what's up with breadflour OC,2015-05-0329.jpg
An Outbreak unlike Any Other: Perspective on the 2014-2015 Avian Influenza,RandomFlotsam,2015-05-22,http://farmdocdaily.illinois.edu/2015/05/perspective-on-2014-2015-avian-influenza.html,https://www.reddit.com/r/dataisbeautiful/comments/36wtyr/an_outbreak_unlike_any_other_perspective_on_the/,3,3,0,0,An Outbreak unlike Any Other Perspective on the 2014-2015 Avian Influenza,2015-05-0330.jpg
"[OC] I graphed some metadata of texting, too.",rao-blackwell-ized,2015-05-22,http://imgur.com/a/ZLEnN,https://www.reddit.com/r/dataisbeautiful/comments/36xnmv/oc_i_graphed_some_metadata_of_texting_too/,8,8,0,3,"OC I graphed some metadata of texting, too.",2015-05-0331.jpg
Bailout Barometer: How Large Is the Federal Financial Safety Net? - Federal Reserve Bank of Richmond,jimrosenz,2015-05-22,http://www.richmondfed.org/publications/research/special_reports/safety_net/,https://www.reddit.com/r/dataisbeautiful/comments/36xor5/bailout_barometer_how_large_is_the_federal/,4,4,0,0,Bailout Barometer How Large Is the Federal Financial Safety Net - Federal Reserve Bank of Richmond,2015-05-0332.jpg
Nobel prize per million by ethnicity/country [OC],troll_khan,2015-05-22,http://i.imgur.com/9qVfKCt.png,https://www.reddit.com/r/dataisbeautiful/comments/36xyp3/nobel_prize_per_million_by_ethnicitycountry_oc/,0,0,0,9,Nobel prize per million by ethnicitycountry OC,2015-05-0333.png
UK General Election Results in Minecraft [OC],jamieboy9billion,2015-05-23,http://imgur.com/gallery/RZn4k7W,https://www.reddit.com/r/dataisbeautiful/comments/36ywyg/uk_general_election_results_in_minecraft_oc/,8,8,0,4,UK General Election Results in Minecraft OC,2015-05-0334.jpg
How The Gender Pay Gap Has Changed (And How It Hasn't) : Planet Money : NPR,jimrosenz,2015-05-23,http://www.npr.org/sections/money/2014/12/15/370357880/how-the-gender-pay-gap-has-changed-and-how-it-hasnt,https://www.reddit.com/r/dataisbeautiful/comments/36za87/how_the_gender_pay_gap_has_changed_and_how_it/,0,0,0,2,How The Gender Pay Gap Has Changed (And How It Hasn't) Planet Money NPR,2015-05-0335.jpg
"[OC] The employment rates of sole parents with school age children, OECD, 2011",jimrosenz,2015-05-23,http://utopiayouarestandinginit.com/2015/05/23/the-employment-rates-of-sole-parents-with-school-age-children-oecd-2011/,https://www.reddit.com/r/dataisbeautiful/comments/36zbup/oc_the_employment_rates_of_sole_parents_with/,0,0,0,5,"OC The employment rates of sole parents with school age children, OECD, 2011",2015-05-0336.jpg
How can I visualize movie/book plot and character interactions?,ksbzw,2015-05-23,http://www.reddit.com/r/dataisbeautiful/comments/36zj41/how_can_i_visualize_moviebook_plot_and_character/,https://www.reddit.com/r/dataisbeautiful/comments/36zj41/how_can_i_visualize_moviebook_plot_and_character/,1,1,0,2,How can I visualize moviebook plot and character interactions,2015-05-0337.jpg
Gay Marriage Laws Around the World [OC],lolatu2,2015-05-23,https://slemma.com/share/258ebf2dce85dc33f81b4a60e30c82131acc43d7,https://www.reddit.com/r/dataisbeautiful/comments/36zpg3/gay_marriage_laws_around_the_world_oc/,6,6,0,10,Gay Marriage Laws Around the World OC,2015-05-0338.jpg
Time history of atmospheric CO2 (2011 update),I_ate_your_dog,2015-05-23,https://www.youtube.com/watch?v=bbgUE04Y-Xg&sns=fb,https://www.reddit.com/r/dataisbeautiful/comments/36zsjs/time_history_of_atmospheric_co2_2011_update/,2,2,0,1,Time history of atmospheric CO2 (2011 update),2015-05-0339.jpg
Countries/States where same-sex couples can marry (Ireland should be added to the map),CJMinard,2015-05-23,http://www.theguardian.com/news/datablog/2015/may/22/irish-same-sex-marriage-referendum-world-laws,https://www.reddit.com/r/dataisbeautiful/comments/3704xb/countriesstates_where_samesex_couples_can_marry/,0,0,0,1,CountriesStates where same-sex couples can marry (Ireland should be added to the map),2015-05-0340.jpg
Child Care and Education now Account for 18% of the Total Cost of Raising a Child - it was 2% in 1960 [OC],thatdatadude,2015-05-23,https://www.thatdatadude.com/the-changing-cost-of-education-when-raising-a-child/,https://www.reddit.com/r/dataisbeautiful/comments/370b8j/child_care_and_education_now_account_for_18_of/,1733,1733,0,222,Child Care and Education now Account for 18% of the Total Cost of Raising a Child - it was 2% in 1960 OC,2015-05-0341.jpg
How can I make this visualization more clear?,pepitogrillado,2015-05-23,http://www.reddit.com/r/dataisbeautiful/comments/370c18/how_can_i_make_this_visualization_more_clear/,https://www.reddit.com/r/dataisbeautiful/comments/370c18/how_can_i_make_this_visualization_more_clear/,16,16,0,11,How can I make this visualization more clear,2015-05-0342.jpg
Cashless society N=1 [OC],manyrootsofallevil,2015-05-24,http://manyrootsofallevilrants.blogspot.co.uk/2015/05/cashless-society-n1.html,https://www.reddit.com/r/dataisbeautiful/comments/372s8p/cashless_society_n1_oc/,0,0,0,2,Cashless society N=1 OC,2015-05-0343.jpg
The $5.3 Trillion Energy Subsidy Problem,jimrosenz,2015-05-24,http://blog-imfdirect.imf.org/2015/05/18/act-local-solve-global-the-5-3-trillion-energy-subsidy-problem/,https://www.reddit.com/r/dataisbeautiful/comments/372ud7/the_53_trillion_energy_subsidy_problem/,1,1,0,1,The $5.3 Trillion Energy Subsidy Problem,2015-05-0344.jpg
"[OC] Minimum wage relative to average wage of full-time worker, UK, USA, Canada, New Zealand and Australia, 1960–2012",jimrosenz,2015-05-24,http://utopiayouarestandinginit.com/2015/05/24/minimum-wage-relative-to-median-wage-of-full-time-worker-uk-usa-canada-new-zealand-and-australia-19602012/,https://www.reddit.com/r/dataisbeautiful/comments/372zph/oc_minimum_wage_relative_to_average_wage_of/,0,0,0,4,"OC Minimum wage relative to average wage of full-time worker, UK, USA, Canada, New Zealand and Australia, 1960–2012",2015-05-0345.jpg
Countries that are candidates for EU membership,wakawakadoodoo,2015-05-24,http://www.rferl.org/contentinfographics/eu-candidates-other-partners/27026730.html,https://www.reddit.com/r/dataisbeautiful/comments/373bas/countries_that_are_candidates_for_eu_membership/,1150,1150,0,766,Countries that are candidates for EU membership,2015-05-0346.jpg
How different parts of Ireland voted in the Marriage Referendum,TinyDonkey4,2015-05-24,http://irishpoliticalmaps.blogspot.ie/2015/05/referendum-2015-marriage-equality.html,https://www.reddit.com/r/dataisbeautiful/comments/373o09/how_different_parts_of_ireland_voted_in_the/,576,576,0,136,How different parts of Ireland voted in the Marriage Referendum,2015-05-0347.jpg
Negative Views of New Congress Cross Party Lines,CJMinard,2015-05-24,http://www.people-press.org/2015/05/21/negative-views-of-new-congress-cross-party-lines/,https://www.reddit.com/r/dataisbeautiful/comments/373psl/negative_views_of_new_congress_cross_party_lines/,7,7,0,1,Negative Views of New Congress Cross Party Lines,2015-05-0348.jpg
Amount of alcohol consumed per capita by country in Europe (map),CJMinard,2015-05-24,http://jakubmarian.com/amount-of-alcohol-consumed-per-capita-by-country-in-europe-map/,https://www.reddit.com/r/dataisbeautiful/comments/373q0w/amount_of_alcohol_consumed_per_capita_by_country/,6,6,0,5,Amount of alcohol consumed per capita by country in Europe (map),2015-05-0349.jpg
A year of music listening history as a wave graph [OC],Taurheim,2015-05-24,http://i.imgur.com/pzfcYnh.jpg,https://www.reddit.com/r/dataisbeautiful/comments/374aov/a_year_of_music_listening_history_as_a_wave_graph/,518,518,0,106,A year of music listening history as a wave graph OC,2015-05-0350.jpg
How Rich Will China Become? | Federal Reserve Bank of Minneapolis,jimrosenz,2015-05-24,https://www.minneapolisfed.org/research/economic-policy-papers/how-rich-will-china-become,https://www.reddit.com/r/dataisbeautiful/comments/374sjy/how_rich_will_china_become_federal_reserve_bank/,24,24,0,0,How Rich Will China Become Federal Reserve Bank of Minneapolis,2015-05-0351.jpg
Evidence for extra health benefits of certain foods,CesarSamuel,2015-05-25,http://www.informationisbeautiful.net/visualizations/snake-oil-superfoods/,https://www.reddit.com/r/dataisbeautiful/comments/375zsi/evidence_for_extra_health_benefits_of_certain/,572,572,0,90,Evidence for extra health benefits of certain foods,2015-05-0352.jpg
Spanish municipal and regional elections [SP],illanm,2015-05-25,http://elpais.com/especiales/2015/elecciones-autonomicas-municipales/graficos/municipios/,https://www.reddit.com/r/dataisbeautiful/comments/37706t/spanish_municipal_and_regional_elections_sp/,13,13,0,0,Spanish municipal and regional elections SP,2015-05-0353.jpg
