title,author,created_date,url,full_permalink,score,ups,downs,num_comments,sanitized_title,image_file
Oklahoma drought monitor visualization 2010-present courtesy USDA and Oklahoma Mesonet,hipsterdoofus,2015-05-14,https://www.youtube.com/watch?v=1u39DctaVTg,https://www.reddit.com/r/dataisbeautiful/comments/35yc1o/oklahoma_drought_monitor_visualization/,1,1,0,0,Oklahoma drought monitor visualization 2010-present courtesy USDA and Oklahoma Mesonet,2015-05-0213.jpg
Cities Mapped by Bike Usage [OC],jsEmu,2015-05-14,http://www.emu-analytics.com/blog/post.php?s=2015-05-14-a-trail-of-two-cities,https://www.reddit.com/r/dataisbeautiful/comments/35yco9/cities_mapped_by_bike_usage_oc/,5,5,0,2,Cities Mapped by Bike Usage OC,2015-05-0214.jpg
"California, water you doing? Simple visualization of where California's annual 80 million acre-feet of water ends up",mydoingthisright,2015-05-14,http://slatestarcodex.com/2015/05/11/california-water-you-doing/,https://www.reddit.com/r/dataisbeautiful/comments/35yn1c/california_water_you_doing_simple_visualization/,32,32,0,10,"California, water you doing Simple visualization of where California's annual 80 million acre-feet of water ends up",2015-05-0215.jpg
The Safest and Deadliest Ways to Travel,notscj,2015-05-14,http://www.washingtonpost.com/blogs/wonkblog/wp/2015/05/14/the-safest-and-deadliest-ways-to-travel/,https://www.reddit.com/r/dataisbeautiful/comments/35ywzd/the_safest_and_deadliest_ways_to_travel/,16,16,0,5,The Safest and Deadliest Ways to Travel,2015-05-0216.jpg
Path to the Draft: From Rivals 100 to College to NFL [OC],sirvizalot,2015-05-14,http://imgur.com/eZy6QCQ,https://www.reddit.com/r/dataisbeautiful/comments/35yzsd/path_to_the_draft_from_rivals_100_to_college_to/,4,4,0,3,Path to the Draft From Rivals 100 to College to NFL OC,2015-05-0217.jpg
"The Rise of Men Who Don’t Work, and What They Do Instead",PM_me_munsterlanders,2015-05-14,http://www.nytimes.com/2014/12/12/upshot/the-rise-of-men-who-dont-work-and-what-they-do-instead.html?WT.mc_id=2015-MAY-WCASeq-UPSHOT&WT.mc_ev=click&ad-keywords=WCARETARG,https://www.reddit.com/r/dataisbeautiful/comments/35zktm/the_rise_of_men_who_dont_work_and_what_they_do/,15,15,0,8,"The Rise of Men Who Don’t Work, and What They Do Instead",2015-05-0218.jpg
Map of America's most popular sandwich joint,bootyholefresh,2015-05-14,https://flowingdata.com/2015/05/13/where-subway-dominates-its-sandwich-place-competition-basically-everywhere/,https://www.reddit.com/r/dataisbeautiful/comments/360334/map_of_americas_most_popular_sandwich_joint/,5,5,0,1,Map of America's most popular sandwich joint,2015-05-0219.jpg
Musical Map of New York City Neighborhoods,mcneilm3,2015-05-15,http://graphics.wsj.com/nyc-jukebox-map/,https://www.reddit.com/r/dataisbeautiful/comments/360sxf/musical_map_of_new_york_city_neighborhoods/,5,5,0,1,Musical Map of New York City Neighborhoods,2015-05-0220.jpg
Humanitarian crisis mapping: Recent OpenStreetMap edits after several earthquakes struck Nepal,Vik1ng,2015-05-15,http://www.itoworld.com/map/130?lon=85.33210&lat=27.70749&zoom=12&fullscreen=true,https://www.reddit.com/r/dataisbeautiful/comments/361wyo/humanitarian_crisis_mapping_recent_openstreetmap/,1,1,0,1,Humanitarian crisis mapping Recent OpenStreetMap edits after several earthquakes struck Nepal,2015-05-0221.jpg
How Your Hometown Affects Your Chances of Marriage,taxdata,2015-05-15,http://www.nytimes.com/interactive/2015/05/15/upshot/the-places-that-discourage-marriage-most.html?abt=0002&abg=1&smid=tw-upshotnyt&_r=0,https://www.reddit.com/r/dataisbeautiful/comments/3620be/how_your_hometown_affects_your_chances_of_marriage/,8,8,0,5,How Your Hometown Affects Your Chances of Marriage,2015-05-0222.jpg
Winds of Tropical Storm Ana as Seen by NASA's RapidScat [OC],Geographist,2015-05-15,http://earthobservatory.nasa.gov/IOTD/view.php?id=85864,https://www.reddit.com/r/dataisbeautiful/comments/36249m/winds_of_tropical_storm_ana_as_seen_by_nasas/,5,5,0,1,Winds of Tropical Storm Ana as Seen by NASA's RapidScat OC,2015-05-0223.jpg
The Biggest U.S. Police Departments Are Getting Smaller,CJMinard,2015-05-15,http://fivethirtyeight.com/datalab/the-biggest-us-police-departments-are-getting-smaller/,https://www.reddit.com/r/dataisbeautiful/comments/3626es/the_biggest_us_police_departments_are_getting/,0,0,0,0,The Biggest U.S. Police Departments Are Getting Smaller,2015-05-0224.jpg
Amtrak's safety record compared to every other commuter rail in U.S. [OC],arm5077,2015-05-15,http://www.nationaljournal.com/domesticpolicy/amtrak-safety-rates-commuter-rail-20150515,https://www.reddit.com/r/dataisbeautiful/comments/3628ll/amtraks_safety_record_compared_to_every_other/,0,0,0,7,Amtrak's safety record compared to every other commuter rail in U.S. OC,2015-05-0225.jpg
US Historical County/State Boundaries from 1629 - 2000,pseudoheld,2015-05-15,https://www.youtube.com/watch?v=QEdDU3ho1oE,https://www.reddit.com/r/dataisbeautiful/comments/362cxh/us_historical_countystate_boundaries_from_1629/,0,0,0,0,US Historical CountyState Boundaries from 1629 - 2000,2015-05-0226.jpg
[OC] The landscape of rural healthcare: Peace River,RPAP_AB,2015-05-15,http://www.rpap.ab.ca/blog/2015/may/15/the-landscape-of-rural-healthcare-peace-river.aspx,https://www.reddit.com/r/dataisbeautiful/comments/362k82/oc_the_landscape_of_rural_healthcare_peace_river/,0,0,0,2,OC The landscape of rural healthcare Peace River,2015-05-0227.jpg
Game of Thrones: How episodes correspond to chapters (link to dynamic version inside!) [x-post /r/asoiaf] [OC],Joeltronics,2015-05-15,http://i.imgur.com/Pp8P3iq.png,https://www.reddit.com/r/dataisbeautiful/comments/362o7y/game_of_thrones_how_episodes_correspond_to/,89,89,0,12,Game of Thrones How episodes correspond to chapters (link to dynamic version inside!) x-post rasoiaf OC,2015-05-0228.png
"See São Paulo public transportation in real time. Trains, buses, and subway.",ceciliadolago,2015-05-15,http://tracker.geops.ch/?z=15&s=1&x=-5191779.7366&y=-2702984.1534&l=transport,https://www.reddit.com/r/dataisbeautiful/comments/362ruy/see_são_paulo_public_transportation_in_real_time/,5,5,0,2,"See São Paulo public transportation in real time. Trains, buses, and subway.",2015-05-0229.jpg
The Racial Dot Map: One Dot Per Person for the Entire U.S.,thepasttenseofdraw,2015-05-15,http://demographics.coopercenter.org/DotMap/index.html,https://www.reddit.com/r/dataisbeautiful/comments/3636go/the_racial_dot_map_one_dot_per_person_for_the/,103,103,0,18,The Racial Dot Map One Dot Per Person for the Entire U.S.,2015-05-0230.jpg
Interactive map of the most played jukebox songs and artists in each area of New York City,PM_ME_FOODPORN_PLZ,2015-05-15,http://blogs.wsj.com/metropolis/2015/05/14/new-york-citys-jukebox-heroes-a-musical-map/,https://www.reddit.com/r/dataisbeautiful/comments/363kod/interactive_map_of_the_most_played_jukebox_songs/,0,0,0,0,Interactive map of the most played jukebox songs and artists in each area of New York City,2015-05-0231.jpg
"(OC) Is the Mother Country catching up with Down Under? Real GDP per working age New Zealander, British and Australian, detrended, 1956 –2013",jimrosenz,2015-05-15,http://utopiayouarestandinginit.com/2015/05/15/is-the-mother-country-catching-up-with-down-under-real-gdp-per-working-age-new-zealander-british-and-australian-detrended-1956-or-2013/,https://www.reddit.com/r/dataisbeautiful/comments/364j74/oc_is_the_mother_country_catching_up_with_down/,1,1,0,2,"(OC) Is the Mother Country catching up with Down Under Real GDP per working age New Zealander, British and Australian, detrended, 1956 –2013",2015-05-0232.jpg
Graphing the metadata of messages from a long distance relationship [OC],Prometheus09,2015-05-16,http://imgur.com/a/QcBb1,https://www.reddit.com/r/dataisbeautiful/comments/365svc/graphing_the_metadata_of_messages_from_a_long/,3276,3276,0,444,Graphing the metadata of messages from a long distance relationship OC,2015-05-0233.jpg
(OC) How much do the top income earners actually earn in NZ?,jimrosenz,2015-05-16,http://utopiayouarestandinginit.com/2014/12/16/how-much-do-the-top-income-earners-actually-earn-in-nz/,https://www.reddit.com/r/dataisbeautiful/comments/365x14/oc_how_much_do_the_top_income_earners_actually/,2,2,0,2,(OC) How much do the top income earners actually earn in NZ,2015-05-0234.jpg
Why Do Americans Oppose Gay Marriage? Because The Bible Says So,CJMinard,2015-05-16,http://dadaviz.com/i/4087,https://www.reddit.com/r/dataisbeautiful/comments/365zm4/why_do_americans_oppose_gay_marriage_because_the/,2,2,0,22,Why Do Americans Oppose Gay Marriage Because The Bible Says So,2015-05-0235.jpg
Animated Public Transport Maps,sirrobotalot,2015-05-16,http://tracker.geops.ch/?z=14&s=1&x=-8235743.4976&y=4971840.9526&l=transport,https://www.reddit.com/r/dataisbeautiful/comments/366gz0/animated_public_transport_maps/,9,9,0,3,Animated Public Transport Maps,2015-05-0236.jpg
"Distribution of Birth Month of young elite hockey players, x/post r/hockey",wtrsquared,2015-05-16,http://www.whatsthersquared.com/2015/05/nhls-january-birthday-pattern-begins-in.html,https://www.reddit.com/r/dataisbeautiful/comments/366imx/distribution_of_birth_month_of_young_elite_hockey/,2,2,0,3,"Distribution of Birth Month of young elite hockey players, xpost rhockey",2015-05-0237.jpg
[OC] A few comparison graphs of 30 big EDM Record Labels,justacatholic,2015-05-16,http://imgur.com/a/TR46b,https://www.reddit.com/r/dataisbeautiful/comments/366rhv/oc_a_few_comparison_graphs_of_30_big_edm_record/,7,7,0,2,OC A few comparison graphs of 30 big EDM Record Labels,2015-05-0238.jpg
The diversity of Berlin’s neighbourhoods: Migrants make the course of the Wall visible,AlexS101,2015-05-16,http://interaktiv.morgenpost.de/migranten-in-berlin/#11/52.5000/13.3200,https://www.reddit.com/r/dataisbeautiful/comments/367837/the_diversity_of_berlins_neighbourhoods_migrants/,15,15,0,0,The diversity of Berlin’s neighbourhoods Migrants make the course of the Wall visible,2015-05-0239.jpg
What Kind of People do Data Visualization? [OC],billshander,2015-05-16,http://beehivemedia.com/?think-post-what-kind-of-people-do-data-visualization,https://www.reddit.com/r/dataisbeautiful/comments/367ru0/what_kind_of_people_do_data_visualization_oc/,0,0,0,2,What Kind of People do Data Visualization OC,2015-05-0240.jpg
Graph of Beep Intervals of the Annoy-A-Tron v1.0 [OC],Rabbi8meat,2015-05-16,http://imgur.com/HtjakgW.jpg,https://www.reddit.com/r/dataisbeautiful/comments/367zeg/graph_of_beep_intervals_of_the_annoyatron_v10_oc/,4,4,0,5,Graph of Beep Intervals of the Annoy-A-Tron v1.0 OC,2015-05-0241.jpg
"The world’s languages, in 7 maps and charts",maxwellhill,2015-05-17,http://www.washingtonpost.com/blogs/worldviews/wp/2015/04/23/the-worlds-languages-in-7-maps-and-charts/?tid=pm_world_pop_b,https://www.reddit.com/r/dataisbeautiful/comments/368kq5/the_worlds_languages_in_7_maps_and_charts/,58,58,0,27,"The world’s languages, in 7 maps and charts",2015-05-0242.jpg
100 Happy days? How about 1000 up and down days. My subjective happiness out of ten for the last 3 years [OC],A_Cute_Infarction,2015-05-17,https://imgur.com/gallery/hxWkkmG,https://www.reddit.com/r/dataisbeautiful/comments/3691sy/100_happy_days_how_about_1000_up_and_down_days_my/,2655,2655,0,335,100 Happy days How about 1000 up and down days. My subjective happiness out of ten for the last 3 years OC,2015-05-0243.jpg
A map of the most and least emotional countries. The Ex-Soviet states almost exclusively occupy the least emotional group.,PurelyMedicated,2015-05-17,http://www.washingtonpost.com/blogs/worldviews/wp/2012/11/28/a-color-coded-map-of-the-worlds-most-and-least-emotional-countries/,https://www.reddit.com/r/dataisbeautiful/comments/3697mg/a_map_of_the_most_and_least_emotional_countries/,31,31,0,10,A map of the most and least emotional countries. The Ex-Soviet states almost exclusively occupy the least emotional group.,2015-05-0244.jpg
Recurring characters in film and the words used to describe them,rhiever,2015-05-17,http://stereotropes.bocoup.com/gender?r=1,https://www.reddit.com/r/dataisbeautiful/comments/369bdr/recurring_characters_in_film_and_the_words_used/,2,2,0,1,Recurring characters in film and the words used to describe them,2015-05-0245.jpg
"[OC] When did Down Under overtake the Mother Country? Real GDP Britain, Australia and New Zealand 1820–2010",jimrosenz,2015-05-17,http://utopiayouarestandinginit.com/2015/05/17/when-did-down-under-overtake-the-mother-country-real-gdp-britain-australia-and-new-zealand-18202010/,https://www.reddit.com/r/dataisbeautiful/comments/369e82/oc_when_did_down_under_overtake_the_mother/,3,3,0,2,"OC When did Down Under overtake the Mother Country Real GDP Britain, Australia and New Zealand 1820–2010",2015-05-0246.jpg
Dzhokhar Tsarnaev isn't likely to be executed anytime soon -- if ever.,rhiever,2015-05-17,http://fivethirtyeight.com/datalab/dzhokhar-tsarnaev-likely-wont-face-execution-for-a-very-long-time/,https://www.reddit.com/r/dataisbeautiful/comments/369fbz/dzhokhar_tsarnaev_isnt_likely_to_be_executed/,0,0,0,1,Dzhokhar Tsarnaev isn't likely to be executed anytime soon -- if ever.,2015-05-0247.jpg
China coal use falls,MrBeanie88,2015-05-17,http://energydesk.greenpeace.org/2015/05/14/china-coal-consumption-drops-further-carbon-emissions-set-to-fall-by-equivalent-of-uk-total-in-one-year/,https://www.reddit.com/r/dataisbeautiful/comments/369gl7/china_coal_use_falls/,4,4,0,0,China coal use falls,2015-05-0248.jpg
TIFU by looking at what posts succeed in the TIFU subreddit [OC],REDDIT_DATAVIZ,2015-05-17,http://i.imgur.com/R5vYSYQ.png,https://www.reddit.com/r/dataisbeautiful/comments/369u8v/tifu_by_looking_at_what_posts_succeed_in_the_tifu/,255,255,0,27,TIFU by looking at what posts succeed in the TIFU subreddit OC,2015-05-0249.png
Over Three Years of My Mood Scores Visualized as a Gaussian Mixture Model [OC],SupportVectorMachine,2015-05-17,http://i.imgur.com/S76nEbI.png,https://www.reddit.com/r/dataisbeautiful/comments/36ajlh/over_three_years_of_my_mood_scores_visualized_as/,14,14,0,1,Over Three Years of My Mood Scores Visualized as a Gaussian Mixture Model OC,2015-05-0250.png
15 Years of US Drought Data in One Pretty Chart,001010110010,2015-05-17,http://thebigdrought.com/2015/05/17/15-years-of-us-drought-data-in-one-pretty-chart/,https://www.reddit.com/r/dataisbeautiful/comments/36ba32/15_years_of_us_drought_data_in_one_pretty_chart/,2,2,0,0,15 Years of US Drought Data in One Pretty Chart,2015-05-0251.jpg
The Price of Weed by State [x-post /r/economics],dhinckley,2015-05-17,http://www.forbes.com/sites/frankbi/2015/05/12/the-most-and-least-expensive-states-to-buy-marijuana/,https://www.reddit.com/r/dataisbeautiful/comments/36bjnl/the_price_of_weed_by_state_xpost_reconomics/,465,465,0,132,The Price of Weed by State x-post reconomics,2015-05-0252.jpg
Number of posts by hour on r/SuicideWatch [OC],Shariq1989,2015-05-18,http://i.imgur.com/qFRHhol.png?1,https://www.reddit.com/r/dataisbeautiful/comments/36c0ff/number_of_posts_by_hour_on_rsuicidewatch_oc/,8,8,0,3,Number of posts by hour on rSuicideWatch OC,2015-05-0253.png
2015 UK General Election Results,LetMeEnhanceThatFY,2015-05-18,http://geo.digiminster.com/election/2015-05-07/Results,https://www.reddit.com/r/dataisbeautiful/comments/36ctsq/2015_uk_general_election_results/,3,3,0,1,2015 UK General Election Results,2015-05-0254.jpg
John Kerry is roughly 25 times richer than Barack Obama,denischernyshev,2015-05-18,http://knoema.com/pufsnsc/net-worth-of-the-u-s-politicians,https://www.reddit.com/r/dataisbeautiful/comments/36cuh2/john_kerry_is_roughly_25_times_richer_than_barack/,9,9,0,5,John Kerry is roughly 25 times richer than Barack Obama,2015-05-0255.jpg
Realtime tracking of public transport blows your mind,boisjacques,2015-05-18,http://tracker.geops.ch/?z=11&s=1&x=1493342.9162&y=6895544.4260&l=transport,https://www.reddit.com/r/dataisbeautiful/comments/36cvqq/realtime_tracking_of_public_transport_blows_your/,34,34,0,6,Realtime tracking of public transport blows your mind,2015-05-0256.jpg
"When are babies born: morning, noon, or night? [OC]",MrBeanie88,2015-05-18,http://dadaviz.com/i/4090,https://www.reddit.com/r/dataisbeautiful/comments/36d0ov/when_are_babies_born_morning_noon_or_night_oc/,8,8,0,5,"When are babies born morning, noon, or night OC",2015-05-0257.jpg
Map of federally registered weapons [OC],hlake,2015-05-18,http://metrocosm.com/map-of-federally-regulated-weapons/,https://www.reddit.com/r/dataisbeautiful/comments/36d1uq/map_of_federally_registered_weapons_oc/,7,7,0,14,Map of federally registered weapons OC,2015-05-0258.jpg
"Word Cloud of ~100,000 messages from a long distance relationship [OC]",Prometheus09,2015-05-18,http://imgur.com/a/szHP0,https://www.reddit.com/r/dataisbeautiful/comments/36d3dd/word_cloud_of_100000_messages_from_a_long/,3875,3875,0,595,"Word Cloud of ~100,000 messages from a long distance relationship OC",2015-05-0259.jpg
Obama now wants to limit police military gear. But states already have billions in equipment on the streets. (State by state MAP) [OC],Jgrovum,2015-05-18,http://www.pewtrusts.org/en/research-and-analysis/blogs/stateline/2015/3/24/can-states-slow-the-flow-of-military-equipment-to-police,https://www.reddit.com/r/dataisbeautiful/comments/36d3jc/obama_now_wants_to_limit_police_military_gear_but/,4,4,0,5,Obama now wants to limit police military gear. But states already have billions in equipment on the streets. (State by state MAP) OC,2015-05-0260.jpg
"[OC] Colonial upstarts! British, American and Canadian real GDP per capita, 1775–2010",jimrosenz,2015-05-18,http://utopiayouarestandinginit.com/2015/05/18/colonial-upstarts-british-american-and-canadian-real-gdp-per-capita-17752010/,https://www.reddit.com/r/dataisbeautiful/comments/36d47u/oc_colonial_upstarts_british_american_and/,7,7,0,3,"OC Colonial upstarts! British, American and Canadian real GDP per capita, 1775–2010",2015-05-0261.jpg
Who Wins the Stanley Cup of Playoff Beards?,Jgrovum,2015-05-18,http://www.wsj.com/articles/who-wins-the-stanley-cup-of-playoff-beards-1431899011,https://www.reddit.com/r/dataisbeautiful/comments/36db37/who_wins_the_stanley_cup_of_playoff_beards/,0,0,0,0,Who Wins the Stanley Cup of Playoff Beards,2015-05-0262.jpg
Net Generation by Energy Source [OC],SbGeology,2015-05-18,https://imgur.com/a/90rtc,https://www.reddit.com/r/dataisbeautiful/comments/36dkcs/net_generation_by_energy_source_oc/,4,4,0,2,Net Generation by Energy Source OC,2015-05-0263.jpg
Simulation for time it takes for 2 people to find eachother [OC],foodRus,2015-05-18,http://imgur.com/a/CRlLP,https://www.reddit.com/r/dataisbeautiful/comments/36e1vh/simulation_for_time_it_takes_for_2_people_to_find/,9,9,0,7,Simulation for time it takes for 2 people to find eachother OC,2015-05-0264.jpg
A map of the status of rights for transgender people in Europe,chaucer345,2015-05-18,http://tgeu.org/trans-rights-europe-map-2015/,https://www.reddit.com/r/dataisbeautiful/comments/36eero/a_map_of_the_status_of_rights_for_transgender/,1,1,0,0,A map of the status of rights for transgender people in Europe,2015-05-0265.jpg
Here's a cool visualization I found on day length as a function of latitude and time of year (from Wikipedia article on Day Length),NielsBohron,2015-05-18,http://en.wikipedia.org/wiki/Day_length,https://www.reddit.com/r/dataisbeautiful/comments/36ei6w/heres_a_cool_visualization_i_found_on_day_length/,4,4,0,1,Here's a cool visualization I found on day length as a function of latitude and time of year (from Wikipedia article on Day Length),2015-05-0266.jpg
"Geotagged tweets showing 'sunrise' in different languages, April 6 2014",acoustic_phil,2015-05-18,http://cartodb.s3.amazonaws.com/static_vizz/sunrise.html?title=true&description=true,https://www.reddit.com/r/dataisbeautiful/comments/36ewkr/geotagged_tweets_showing_sunrise_in_different/,5,5,0,2,"Geotagged tweets showing 'sunrise' in different languages, April 6 2014",2015-05-0267.jpg
No. 1 singles lyrics - Intellectual level over the last decade,Slyrix,2015-05-18,http://consequenceofsound.net/2015/05/the-lyrics-of-recent-no-1-singles-average-at-a-third-grade-reading-level/,https://www.reddit.com/r/dataisbeautiful/comments/36f146/no_1_singles_lyrics_intellectual_level_over_the/,7,7,0,0,No. 1 singles lyrics - Intellectual level over the last decade,2015-05-0268.jpg
Marvel Super Hero Movies Box Office Stats [OC],SOLUNAR,2015-05-18,http://i.imgur.com/q05qMdx.png,https://www.reddit.com/r/dataisbeautiful/comments/36f2sy/marvel_super_hero_movies_box_office_stats_oc/,7,7,0,2,Marvel Super Hero Movies Box Office Stats OC,2015-05-0269.png
Best investors were massively overweight Tech last year [OC],openfolio_dave,2015-05-18,http://imgur.com/a/A2P4N,https://www.reddit.com/r/dataisbeautiful/comments/36ff9x/best_investors_were_massively_overweight_tech/,3,3,0,2,Best investors were massively overweight Tech last year OC,2015-05-0270.jpg
"How Machines Destroy (And Create!) Jobs, In 4 Graphs : Planet Money : NPR",jimrosenz,2015-05-18,http://www.npr.org/sections/money/2015/05/07/404991483/how-machines-destroy-and-create-jobs-in-4-graphs?live=1,https://www.reddit.com/r/dataisbeautiful/comments/36fig6/how_machines_destroy_and_create_jobs_in_4_graphs/,47,47,0,6,"How Machines Destroy (And Create!) Jobs, In 4 Graphs Planet Money NPR",2015-05-0271.jpg
Relation between the 2016 Presidential Candidates and the people behind the campaigns,thesluggards,2015-05-18,http://www.nytimes.com/interactive/2015/05/17/us/elections/2016-presidential-campaigns-staff-connections-clinton-bush-cruz-paul-rubio-walker.html?_r=0,https://www.reddit.com/r/dataisbeautiful/comments/36g0r5/relation_between_the_2016_presidential_candidates/,5,5,0,2,Relation between the 2016 Presidential Candidates and the people behind the campaigns,2015-05-0272.jpg
Various Religion's Support for Evolution and Environmental Regulation,GQwerty07,2015-05-19,http://ncse.com/blog/2015/05/evolution-environment-religion-0016359,https://www.reddit.com/r/dataisbeautiful/comments/36g9yc/various_religions_support_for_evolution_and/,27,27,0,2,Various Religion's Support for Evolution and Environmental Regulation,2015-05-0273.jpg
[OC] What do the top income earners in Australia earn on average?,jimrosenz,2015-05-19,http://utopiayouarestandinginit.com/2014/12/16/what-do-the-top-income-earners-in-australia-earn-on-average/,https://www.reddit.com/r/dataisbeautiful/comments/36hhdj/oc_what_do_the_top_income_earners_in_australia/,3,3,0,2,OC What do the top income earners in Australia earn on average,2015-05-0274.jpg
"Bus riding, the best-kept secret of NYC transit",julian88888888,2015-05-19,http://visualizing.nyc/bus-riding-the-best-kept-secret-of-nyc-transit/,https://www.reddit.com/r/dataisbeautiful/comments/36hvbg/bus_riding_the_bestkept_secret_of_nyc_transit/,1451,1451,0,207,"Bus riding, the best-kept secret of NYC transit",2015-05-0275.jpg
How much I have spent at McDonald's over the past 7 years [OC],thunder_cougar,2015-05-19,http://imgur.com/a/CH0TZ,https://www.reddit.com/r/dataisbeautiful/comments/36i3oe/how_much_i_have_spent_at_mcdonalds_over_the_past/,0,0,0,4,How much I have spent at McDonald's over the past 7 years OC,2015-05-0276.jpg
Tracking economic development with open data and predictive algorithms,MajorDeeganz,2015-05-19,http://blog.algorithmia.com/post/119318050069/tracking-economic-development-with-open-data-and,https://www.reddit.com/r/dataisbeautiful/comments/36iaw5/tracking_economic_development_with_open_data_and/,9,9,0,2,Tracking economic development with open data and predictive algorithms,2015-05-0277.jpg
Congrats Maricopa County - you have the most golf courses [OC],Vizual-Statistix,2015-05-19,http://vizual-statistix.tumblr.com/post/119370432846/ill-be-visiting-phoenix-soon-with-some-friends,https://www.reddit.com/r/dataisbeautiful/comments/36iftz/congrats_maricopa_county_you_have_the_most_golf/,18,18,0,11,Congrats Maricopa County - you have the most golf courses OC,2015-05-0278.jpg
Map of Chicago's shooting victims,eefrsas,2015-05-19,http://crime.chicagotribune.com/chicago/shootings,https://www.reddit.com/r/dataisbeautiful/comments/36j71q/map_of_chicagos_shooting_victims/,10,10,0,4,Map of Chicago's shooting victims,2015-05-0279.jpg
The case for drinking whole milk,rhiever,2015-05-19,http://qz.com/405498/the-case-for-drinking-whole-milk/,https://www.reddit.com/r/dataisbeautiful/comments/36j9ap/the_case_for_drinking_whole_milk/,2,2,0,3,The case for drinking whole milk,2015-05-0280.jpg
"@POTUS Obama picked up followers at a rate of 3,314/min. [OC]",fhbi,2015-05-19,http://www.forbes.com/sites/frankbi/2015/05/19/how-fast-did-barack-obama-pick-up-twitter-followers-at-a-rate-of-3314-per-minute-fast/,https://www.reddit.com/r/dataisbeautiful/comments/36jirg/potus_obama_picked_up_followers_at_a_rate_of/,4,4,0,2,"@POTUS Obama picked up followers at a rate of 3,314min. OC",2015-05-0281.jpg
Mean physical activity during the day [OC],TickleThePanda,2015-05-19,http://www.reddit.com/r/dataisbeautiful/comments/36jn9o/mean_physical_activity_during_the_day_oc/,https://www.reddit.com/r/dataisbeautiful/comments/36jn9o/mean_physical_activity_during_the_day_oc/,4,4,0,0,Mean physical activity during the day OC,2015-05-0282.jpg
[Request] Can someone make a map of these Senators' stance on surveillance and maybe correlate liberal vs conservative states?,Michael_ShoeMaker,2015-05-19,http://www.reddit.com/r/dataisbeautiful/comments/36jrso/request_can_someone_make_a_map_of_these_senators/,https://www.reddit.com/r/dataisbeautiful/comments/36jrso/request_can_someone_make_a_map_of_these_senators/,1,1,0,0,Request Can someone make a map of these Senators' stance on surveillance and maybe correlate liberal vs conservative states,2015-05-0283.jpg
