title,author,created_date,url,full_permalink,score,ups,downs,num_comments,sanitized_title,image_file
"Fascinating map, with an interesting error.",Justzisguyyouknow42,2015-05-10,http://dadaviz.com/i/4015,https://www.reddit.com/r/dataisbeautiful/comments/35hefm/fascinating_map_with_an_interesting_error/,0,0,0,20,"Fascinating map, with an interesting error.",2015-05-0141.jpg
We Blew It: A Time Line of Human Impact on the Planet,bearwave,2015-05-10,http://www.vice.com/read/we-blew-it-0000643-v22n5,https://www.reddit.com/r/dataisbeautiful/comments/35hh1v/we_blew_it_a_time_line_of_human_impact_on_the/,6,6,0,51,We Blew It A Time Line of Human Impact on the Planet,2015-05-0142.jpg
NEJM - Comparing healthcare systems around the world.,paragonic,2015-05-10,http://www.nejm.org/action/showMediaPlayer?doi=10.1056%2FNEJMp1413937&aid=NEJMp1413937_attach_1&area=,https://www.reddit.com/r/dataisbeautiful/comments/35i12l/nejm_comparing_healthcare_systems_around_the_world/,1,1,0,1,NEJM - Comparing healthcare systems around the world.,2015-05-0143.jpg
"Which Flight Will Get You There Fastest? FiveThirtyEight analyzed 6 million flights to figure out which airports, airlines and routes are most likely to get you there on time and which ones will leave you waiting.",rhiever,2015-05-10,http://fivethirtyeight.com/interactives/flights/?r=1,https://www.reddit.com/r/dataisbeautiful/comments/35i5b1/which_flight_will_get_you_there_fastest/,697,697,0,53,"Which Flight Will Get You There Fastest FiveThirtyEight analyzed 6 million flights to figure out which airports, airlines and routes are most likely t",2015-05-0144.jpg
"Good News For California, SWE Increasing In CO",profcyclist,2015-05-10,http://opensnow.com/dailysnow/colorado,https://www.reddit.com/r/dataisbeautiful/comments/35j53k/good_news_for_california_swe_increasing_in_co/,1,1,0,2,"Good News For California, SWE Increasing In CO",2015-05-0145.jpg
5 facts about the minimum wage,jimrosenz,2015-05-10,http://www.pewresearch.org/fact-tank/2013/12/04/5-facts-about-the-minimum-wage/,https://www.reddit.com/r/dataisbeautiful/comments/35je7w/5_facts_about_the_minimum_wage/,23,23,0,4,5 facts about the minimum wage,2015-05-0146.jpg
"(OC) A volatile depressed neighbour? Real American and Canadian GDP growth detrended, 1955-2013 – updated",jimrosenz,2015-05-10,http://utopiayouarestandinginit.com/2015/05/11/a-volatile-depressed-neighbour-real-american-and-canadian-gdp-growth-detrended-19552013/,https://www.reddit.com/r/dataisbeautiful/comments/35jfpg/oc_a_volatile_depressed_neighbour_real_american/,0,0,0,2,"(OC) A volatile depressed neighbour Real American and Canadian GDP growth detrended, 1955-2013 – updated",2015-05-0147.jpg
How Non-employed Americans Spend Their Weekdays: Men vs. Women,cmmargulis,2015-05-10,http://www.nytimes.com/interactive/2015/01/06/upshot/how-nonemployed-americans-spend-their-weekdays-men-vs-women.html?WT.mc_id=2015-MAY-WCASeq-UPSHOT&WT.mc_ev=click&ad-keywords=WCARETARG&_r=0,https://www.reddit.com/r/dataisbeautiful/comments/35jpz2/how_nonemployed_americans_spend_their_weekdays/,5,5,0,17,How Non-employed Americans Spend Their Weekdays Men vs. Women,2015-05-0148.jpg
Travel & Tourism Competitiveness Index 2015,MrBeanie88,2015-05-11,http://reports.weforum.org/travel-and-tourism-competitiveness-report-2015/report-highlights/,https://www.reddit.com/r/dataisbeautiful/comments/35kllz/travel_tourism_competitiveness_index_2015/,4,4,0,1,Travel & Tourism Competitiveness Index 2015,2015-05-0149.jpg
Countries by Share of National Wealth Over Time (2000-2014) [OC],Asparagus64,2015-05-11,http://imgur.com/wGlWirK,https://www.reddit.com/r/dataisbeautiful/comments/35kvs3/countries_by_share_of_national_wealth_over_time/,1561,1561,0,251,Countries by Share of National Wealth Over Time (2000-2014) OC,2015-05-0150.jpg
Countries by Net (assets minus liabilities) Wealth per Adult [OC],Asparagus64,2015-05-11,http://imgur.com/RQce9im,https://www.reddit.com/r/dataisbeautiful/comments/35l850/countries_by_net_assets_minus_liabilities_wealth/,34,34,0,20,Countries by Net (assets minus liabilities) Wealth per Adult OC,2015-05-0151.jpg
Heatmap of all car crashes in America (2012) [OC],CJMinard,2015-05-11,http://dadaviz.com/i/4049,https://www.reddit.com/r/dataisbeautiful/comments/35lb3x/heatmap_of_all_car_crashes_in_america_2012_oc/,14,14,0,8,Heatmap of all car crashes in America (2012) OC,2015-05-0152.jpg
The most important crop for every country [OC],toolroomknights,2015-05-11,https://www.businessvibes.com/blog/Most-Important-Crop-Every-Country,https://www.reddit.com/r/dataisbeautiful/comments/35li7m/the_most_important_crop_for_every_country_oc/,17,17,0,14,The most important crop for every country OC,2015-05-0153.jpg
"Instagram, Drugs, Rock-n-Roll -- Visualized",TDaltonC,2015-05-11,http://drugabuse.com/featured/instagram-drugs-and-rock-n-roll/,https://www.reddit.com/r/dataisbeautiful/comments/35m2xj/instagram_drugs_rocknroll_visualized/,9,9,0,0,"Instagram, Drugs, Rock-n-Roll -- Visualized",2015-05-0154.jpg
I plotted my heart rate while attending last night's game 6 Rangers @ Capitals game [OC],Marcelo002,2015-05-11,http://imgur.com/PtPQ9mn,https://www.reddit.com/r/dataisbeautiful/comments/35m6ci/i_plotted_my_heart_rate_while_attending_last/,2419,2419,0,106,I plotted my heart rate while attending last night's game 6 Rangers @ Capitals game OC,2015-05-0155.jpg
Iraq and Afghanistan Casualties from Tennessee [OC],UsedandAbused87,2015-05-11,http://i.imgur.com/YrLLXyG.png,https://www.reddit.com/r/dataisbeautiful/comments/35mliu/iraq_and_afghanistan_casualties_from_tennessee_oc/,7,7,0,8,Iraq and Afghanistan Casualties from Tennessee OC,2015-05-0156.png
Monthly Wage Distribution of Brazil,jaydub,2015-05-11,http://en.dataviva.info/apps/builder/bar/rais/all/all/all/bra/?controls=true&year=2013,https://www.reddit.com/r/dataisbeautiful/comments/35mr85/monthly_wage_distribution_of_brazil/,3,3,0,0,Monthly Wage Distribution of Brazil,2015-05-0157.jpg
UK general election: what happened in the Liberal Democrat seats [OC],theinspectorst,2015-05-11,http://i.imgur.com/Tq3pufa.jpg,https://www.reddit.com/r/dataisbeautiful/comments/35n2za/uk_general_election_what_happened_in_the_liberal/,39,39,0,6,UK general election what happened in the Liberal Democrat seats OC,2015-05-0158.jpg
What do Americans think about free trade? Not much. - The Washington Post,jimrosenz,2015-05-11,http://www.washingtonpost.com/blogs/monkey-cage/wp/2015/05/11/what-do-americans-think-about-free-trade-not-much/,https://www.reddit.com/r/dataisbeautiful/comments/35n9p9/what_do_americans_think_about_free_trade_not_much/,24,24,0,5,What do Americans think about free trade Not much. - The Washington Post,2015-05-0159.jpg
The Patriots became nearly fumble-proof after a 2006 rule change backed by Tom Brady.,k_method,2015-05-12,http://www.slate.com/articles/sports/sports_nut/2015/01/stats_show_the_new_england_patriots_became_nearly_fumble_proof_after_a_2006.html,https://www.reddit.com/r/dataisbeautiful/comments/35oap5/the_patriots_became_nearly_fumbleproof_after_a/,86,86,0,49,The Patriots became nearly fumble-proof after a 2006 rule change backed by Tom Brady.,2015-05-0160.jpg
Current Earthquake stats and figures,CaptainOnBoard,2015-05-12,http://earthquaketrack.com/p/india/recent,https://www.reddit.com/r/dataisbeautiful/comments/35oyti/current_earthquake_stats_and_figures/,25,25,0,1,Current Earthquake stats and figures,2015-05-0161.jpg
Why Some Tories are Shy... [OC],prof_eggburger,2015-05-12,http://imgur.com/HjGj6Po,https://www.reddit.com/r/dataisbeautiful/comments/35p199/why_some_tories_are_shy_oc/,2,2,0,1,Why Some Tories are Shy... OC,2015-05-0162.jpg
"Results of Java programming exam. TU Lodz, Poland [OC]",Zuggtmoy,2015-05-12,"http://imgur.com/7kHTM8o,PpjT9Vr,7I9gcEJ",https://www.reddit.com/r/dataisbeautiful/comments/35p4pr/results_of_java_programming_exam_tu_lodz_poland_oc/,1,1,0,14,"Results of Java programming exam. TU Lodz, Poland OC",2015-05-0163.jpg
"/r/DataIsBeautiful hit 3 million subscribers this week. If /r/DataIsBeautiful were a city, it would be the 3rd-largest city in the U.S. by population. Keep up the great work everyone! [OC]",rhiever,2015-05-12,http://i.imgur.com/N1rDU6K.png,https://www.reddit.com/r/dataisbeautiful/comments/35pq64/rdataisbeautiful_hit_3_million_subscribers_this/,2858,2858,0,281,"rDataIsBeautiful hit 3 million subscribers this week. If rDataIsBeautiful were a city, it would be the 3rd-largest city in the U.S. by population. Kee",2015-05-0164.png
America’s Changing Religious Landscape,theghostecho,2015-05-12,http://www.pewforum.org/2015/05/12/americas-changing-religious-landscape/,https://www.reddit.com/r/dataisbeautiful/comments/35pu00/americas_changing_religious_landscape/,22,22,0,0,America’s Changing Religious Landscape,2015-05-0165.jpg
GDP of Major Economies Through Time [OC],Asparagus64,2015-05-12,http://imgur.com/a/Pwzlv,https://www.reddit.com/r/dataisbeautiful/comments/35pvdn/gdp_of_major_economies_through_time_oc/,124,124,0,43,GDP of Major Economies Through Time OC,2015-05-0166.jpg
"""Endangered Safari"" is an interactive packed w/ threatened species data & inspired by living in Kenya (scroll down for the data viz) [OC]",straforel,2015-05-12,http://www.infowetrust.com/endangeredsafari/,https://www.reddit.com/r/dataisbeautiful/comments/35pwtm/endangered_safari_is_an_interactive_packed_w/,10,10,0,1,Endangered Safari is an interactive packed w threatened species data & inspired by living in Kenya (scroll down for the data viz) OC,2015-05-0167.jpg
Stephen Curry dosnt need Rest! Performs better when resting 0 days. [OC],SOLUNAR,2015-05-12,http://i.imgur.com/M4SCUCc.png,https://www.reddit.com/r/dataisbeautiful/comments/35pxfc/stephen_curry_dosnt_need_rest_performs_better/,4,4,0,2,Stephen Curry dosnt need Rest! Performs better when resting 0 days. OC,2015-05-0168.png
"Mapping Rent Burden, Unemployment, Income, Commute, Homeownership in Boston [OC]",djhrtmn,2015-05-12,http://hartman.dj/boston/,https://www.reddit.com/r/dataisbeautiful/comments/35q17r/mapping_rent_burden_unemployment_income_commute/,3,3,0,1,"Mapping Rent Burden, Unemployment, Income, Commute, Homeownership in Boston OC",2015-05-0169.jpg
Chess Piece Locations [OC],_tungs_,2015-05-12,http://imgur.com/S58ap4b,https://www.reddit.com/r/dataisbeautiful/comments/35q1zq/chess_piece_locations_oc/,1906,1906,0,84,Chess Piece Locations OC,2015-05-0170.jpg
Price Discretization of items in EVE Online [OC] (crosspost r/eve),eregorn8,2015-05-12,http://i.imgur.com/53fesy6.png,https://www.reddit.com/r/dataisbeautiful/comments/35q64x/price_discretization_of_items_in_eve_online_oc/,7,7,0,3,Price Discretization of items in EVE Online OC (crosspost reve),2015-05-0171.png
"TIL Americans in the 43 states where lotteries are legal spent $70 billion on lotto games in 2014 - more than Americans in all 50 states spent on sports tickets, books, video games, movie tickets, and recorded music sales combined.",peacesreese,2015-05-12,http://finance.yahoo.com/news/lotteries-americas-70-billion-shame-154732616.html,https://www.reddit.com/r/dataisbeautiful/comments/35qhfx/til_americans_in_the_43_states_where_lotteries/,46,46,0,15,TIL Americans in the 43 states where lotteries are legal spent $70 billion on lotto games in 2014 - more than Americans in all 50 states spent on spor,2015-05-0172.jpg
Pretty awesome visualization of some data collected from EVE Online,0d3vine,2015-05-12,https://www.youtube.com/watch?v=EGuDUbZIo_o,https://www.reddit.com/r/dataisbeautiful/comments/35qjhf/pretty_awesome_visualization_of_some_data/,10,10,0,0,Pretty awesome visualization of some data collected from EVE Online,2015-05-0173.jpg
40 years of a changing American diet (1972-2012),EnderBoy,2015-05-12,http://www.vox.com/2015/5/11/8529217/40-years-of-a-changing-american-diet-in-one-massive-chart,https://www.reddit.com/r/dataisbeautiful/comments/35qjho/40_years_of_a_changing_american_diet_19722012/,12,12,0,2,40 years of a changing American diet (1972-2012),2015-05-0174.jpg
[OC] Seinfeld Really did go out on top,iheartpeanus,2015-05-12,http://i.imgur.com/oJ1rrKU.jpg,https://www.reddit.com/r/dataisbeautiful/comments/35qxzc/oc_seinfeld_really_did_go_out_on_top/,36,36,0,6,OC Seinfeld Really did go out on top,2015-05-0175.jpg
"Hey /r/dataisbeautiful, last year you made my little correlation project popular. So popular that it became a book! Introducing Spurious Correlations, the ridiculous book of charts. [OC]",TylerVigen,2015-05-12,http://imgur.com/a/WAlgQ,https://www.reddit.com/r/dataisbeautiful/comments/35qzhv/hey_rdataisbeautiful_last_year_you_made_my_little/,602,602,0,26,"Hey rdataisbeautiful, last year you made my little correlation project popular. So popular that it became a book! Introducing Spurious Correlations, t",2015-05-0176.jpg
Where weed is most and least expensive,fhbi,2015-05-12,http://www.forbes.com/sites/frankbi/2015/05/12/the-most-and-least-expensive-states-to-buy-marijuana/,https://www.reddit.com/r/dataisbeautiful/comments/35rbiz/where_weed_is_most_and_least_expensive/,5,5,0,8,Where weed is most and least expensive,2015-05-0177.jpg
"(OC) Annual hours worked per working age American, German and French, 1950–2013",jimrosenz,2015-05-12,http://utopiayouarestandinginit.com/2015/05/12/annual-hours-worked-per-working-age-american-german-and-french-19502013/,https://www.reddit.com/r/dataisbeautiful/comments/35rqap/oc_annual_hours_worked_per_working_age_american/,9,9,0,2,"(OC) Annual hours worked per working age American, German and French, 1950–2013",2015-05-0178.jpg
"Comparing Pacquiao's Last 4 Fights, including Mayweather [OC]",SOLUNAR,2015-05-12,http://i.imgur.com/Pn3UGUq.png,https://www.reddit.com/r/dataisbeautiful/comments/35rvmm/comparing_pacquiaos_last_4_fights_including/,20,20,0,2,"Comparing Pacquiao's Last 4 Fights, including Mayweather OC",2015-05-0179.png
Cost Comparison: California High Speed Rail and Southwest Airlines [OC],sympletic,2015-05-12,http://sympletic.com/cost-comparison-california-high-speed-rail-southwest-airlines/,https://www.reddit.com/r/dataisbeautiful/comments/35s7hb/cost_comparison_california_high_speed_rail_and/,0,0,0,4,Cost Comparison California High Speed Rail and Southwest Airlines OC,2015-05-0180.jpg
French opinion poll: which nation contributed most to the defeat of Germany in 1945? (1945-2015),manpace,2015-05-13,http://www.les-crises.fr/la-fabrique-du-cretin-defaite-nazis/#!prettyPhoto,https://www.reddit.com/r/dataisbeautiful/comments/35sg9b/french_opinion_poll_which_nation_contributed_most/,43,43,0,47,French opinion poll which nation contributed most to the defeat of Germany in 1945 (1945-2015),2015-05-0181.jpg
"Pell Grants, grad rates, and SAT scores [OC]",jkeltz,2015-05-13,https://public.tableau.com/shared/B5QGTP4J2?:display_count=yes&:showVizHome=no#5,https://www.reddit.com/r/dataisbeautiful/comments/35shqz/pell_grants_grad_rates_and_sat_scores_oc/,10,10,0,7,"Pell Grants, grad rates, and SAT scores OC",2015-05-0182.jpg
GDP per Capita of Major Economies Since 1960 [OC],Asparagus64,2015-05-13,http://imgur.com/OQyRhCn,https://www.reddit.com/r/dataisbeautiful/comments/35smxh/gdp_per_capita_of_major_economies_since_1960_oc/,4,4,0,4,GDP per Capita of Major Economies Since 1960 OC,2015-05-0183.jpg
Global CO2 Emissions Over the Course of a Year,1sagas1,2015-05-13,https://www.youtube.com/watch?v=x1SgmFa0r04,https://www.reddit.com/r/dataisbeautiful/comments/35su6k/global_co2_emissions_over_the_course_of_a_year/,25,25,0,2,Global CO2 Emissions Over the Course of a Year,2015-05-0184.jpg
The Most Popular Keys of All Music on Spotify,MashMeister,2015-05-13,https://insights.spotify.com/us/2015/05/06/most-popular-keys-on-spotify/,https://www.reddit.com/r/dataisbeautiful/comments/35swpb/the_most_popular_keys_of_all_music_on_spotify/,7,7,0,3,The Most Popular Keys of All Music on Spotify,2015-05-0185.jpg
Heat-map of NBA Basketball Shots When Attempting the Two For One Attempt (Shot clock vs Game Clock) [OC],data4lyfe,2015-05-13,https://racketracer.files.wordpress.com/2015/05/shot-distribution-matrix.png,https://www.reddit.com/r/dataisbeautiful/comments/35sx1q/heatmap_of_nba_basketball_shots_when_attempting/,0,0,0,1,Heat-map of NBA Basketball Shots When Attempting the Two For One Attempt (Shot clock vs Game Clock) OC,2015-05-0186.png
In a land of dollars: Deep poverty and its consequences | Brookings Institution,jimrosenz,2015-05-13,http://www.brookings.edu/blogs/social-mobility-memos/posts/2015/05/07-deep-poverty-income-spending-reeves?cid=00900015020089101US0001-05101,https://www.reddit.com/r/dataisbeautiful/comments/35t0cj/in_a_land_of_dollars_deep_poverty_and_its/,3,3,0,0,In a land of dollars Deep poverty and its consequences Brookings Institution,2015-05-0187.jpg
Google User Data Requests by Country [OC],lolatu2,2015-05-13,https://slemma.com/share/46d413d2c36926ea10f66257c0f3a6602cd29b05,https://www.reddit.com/r/dataisbeautiful/comments/35tldp/google_user_data_requests_by_country_oc/,0,0,0,1,Google User Data Requests by Country OC,2015-05-0188.jpg
Cool interactive charts about the most dangerous jobs,Samazing42,2015-05-13,http://www.bloomberg.com/graphics/2015-dangerous-jobs/,https://www.reddit.com/r/dataisbeautiful/comments/35tpyj/cool_interactive_charts_about_the_most_dangerous/,1,1,0,0,Cool interactive charts about the most dangerous jobs,2015-05-0189.jpg
Student loans have eclipsed both auto loans and credit cards [OC],MrBeanie88,2015-05-13,http://dadaviz.com/i/4070,https://www.reddit.com/r/dataisbeautiful/comments/35trh4/student_loans_have_eclipsed_both_auto_loans_and/,0,0,0,3,Student loans have eclipsed both auto loans and credit cards OC,2015-05-0190.jpg
Finding Topics in Harry Potter using K-Means Clustering,sko2sko,2015-05-13,http://dogdogfish.com/2015/05/11/finding-topics-in-harry-potter-using-k-means-clustering/,https://www.reddit.com/r/dataisbeautiful/comments/35trry/finding_topics_in_harry_potter_using_kmeans/,3,3,0,0,Finding Topics in Harry Potter using K-Means Clustering,2015-05-0191.jpg
Which states have created the most jobs since their low point of the Great Recession? Analysis and Map [OC],Jgrovum,2015-05-13,http://www.pewtrusts.org/en/research-and-analysis/blogs/stateline/2015/5/13/which-states-have-the-most-job-growth-since-the-recession,https://www.reddit.com/r/dataisbeautiful/comments/35tvxk/which_states_have_created_the_most_jobs_since/,2,2,0,1,Which states have created the most jobs since their low point of the Great Recession Analysis and Map OC,2015-05-0192.jpg
"Where Subway Dominates Its Sandwich Place Competition, Basically Everywhere [OC]",flowingD,2015-05-13,http://flowingdata.com/2015/05/13/where-subway-dominates-its-sandwich-place-competition-basically-everywhere/,https://www.reddit.com/r/dataisbeautiful/comments/35u3cr/where_subway_dominates_its_sandwich_place/,9,9,0,10,"Where Subway Dominates Its Sandwich Place Competition, Basically Everywhere OC",2015-05-0193.jpg
Mortgage Complaints to the CFPB are Declining but Debt Collection and Credit Reporting are on the Rise,thatdatadude,2015-05-13,https://www.thatdatadude.com/mortgage-complaints-to-the-cfpb-are-declining-but-debt-collection-and-credit-reporting-are-on-the-rise/,https://www.reddit.com/r/dataisbeautiful/comments/35u9ch/mortgage_complaints_to_the_cfpb_are_declining_but/,1,1,0,3,Mortgage Complaints to the CFPB are Declining but Debt Collection and Credit Reporting are on the Rise,2015-05-0194.jpg
40 years worth of data examining the changes in the American diet,Imm0lated,2015-05-13,http://www.vox.com/2015/5/11/8529217/40-years-of-a-changing-american-diet-in-one-massive-chart,https://www.reddit.com/r/dataisbeautiful/comments/35ugkk/40_years_worth_of_data_examining_the_changes_in/,7,7,0,0,40 years worth of data examining the changes in the American diet,2015-05-0195.jpg
The national median rent visualized across 8 different cities,thecreativeblog,2015-05-13,http://www.debtconsolidation.com/cost-of-renting-in-the-city.html,https://www.reddit.com/r/dataisbeautiful/comments/35ut4u/the_national_median_rent_visualized_across_8/,5,5,0,6,The national median rent visualized across 8 different cities,2015-05-0196.jpg
"Exploring Manhattan's residential, office, retail and garage space [VIDEO]",MrBeanie88,2015-05-13,https://youtu.be/_NPpISageUU?t=49s,https://www.reddit.com/r/dataisbeautiful/comments/35uwln/exploring_manhattans_residential_office_retail/,3,3,0,2,"Exploring Manhattan's residential, office, retail and garage space VIDEO",2015-05-0197.jpg
My utilities usage over the last 44 months [OC],trbt555,2015-05-13,http://i385.photobucket.com/albums/oo291/pimp_daddy_photo/consolidated.jpg~original,https://www.reddit.com/r/dataisbeautiful/comments/35v4ue/my_utilities_usage_over_the_last_44_months_oc/,24,24,0,5,My utilities usage over the last 44 months OC,2015-05-0198.jpg
Canada's Stanley Cup drought reaches 22 years,mdross1,2015-05-13,http://www.cbc.ca/sports/multimedia/canada-s-stanley-cup-drought-reaches-22-years-1.3072760,https://www.reddit.com/r/dataisbeautiful/comments/35v6gv/canadas_stanley_cup_drought_reaches_22_years/,2,2,0,1,Canada's Stanley Cup drought reaches 22 years,2015-05-0199.jpg
Average Cloudiness of Earth,lnfinity,2015-05-13,http://www.slate.com/blogs/bad_astronomy/2015/05/09/cloudy_earth_map_of_cloud_coverage.html,https://www.reddit.com/r/dataisbeautiful/comments/35v7tu/average_cloudiness_of_earth/,3,3,0,4,Average Cloudiness of Earth,2015-05-0200.jpg
America Redrawn by State Population [OC],Bearcla3,2015-05-13,http://i.imgur.com/K4PUVfg.jpg,https://www.reddit.com/r/dataisbeautiful/comments/35v982/america_redrawn_by_state_population_oc/,2632,2632,0,465,America Redrawn by State Population OC,2015-05-0201.png
How children in various careers compare to their parents' income,ZombieAlpacaLips,2015-05-13,http://www.npr.org/sections/money/2014/03/18/289013884/who-had-richer-parents-doctors-or-arists,https://www.reddit.com/r/dataisbeautiful/comments/35vi0e/how_children_in_various_careers_compare_to_their/,1,1,0,0,How children in various careers compare to their parents' income,2015-05-0202.jpg
7 Charts Show the Socialist Hellscape America Would Be Under Bernie Sanders,chapeaumoustache,2015-05-13,http://www.commondreams.org/views/2015/05/12/7-charts-show-socialist-hellscape-america-would-be-under-bernie-sanders,https://www.reddit.com/r/dataisbeautiful/comments/35vjrf/7_charts_show_the_socialist_hellscape_america/,0,0,0,28,7 Charts Show the Socialist Hellscape America Would Be Under Bernie Sanders,2015-05-0203.jpg
/r/thebutton All clicks by day and its distribution 4-03-15 to 5-05-15,alzirrizla,2015-05-13,https://github.com/resendedaniel/math/tree/master/14-thebutton,https://www.reddit.com/r/dataisbeautiful/comments/35w074/rthebutton_all_clicks_by_day_and_its_distribution/,5,5,0,1,rthebutton All clicks by day and its distribution 4-03-15 to 5-05-15,2015-05-0204.jpg
(OC) Why is a gender gap so large and the glass ceiling so thick in Sweden?,jimrosenz,2015-05-13,http://utopiayouarestandinginit.com/2015/05/14/infotopia-or-information-cocoons/,https://www.reddit.com/r/dataisbeautiful/comments/35w2j4/oc_why_is_a_gender_gap_so_large_and_the_glass/,3,3,0,6,(OC) Why is a gender gap so large and the glass ceiling so thick in Sweden,2015-05-0205.jpg
"For the first time in five years, the euro zone’s largest economies are all growing - Quartz",jimrosenz,2015-05-13,http://qz.com/403923/for-the-first-time-in-five-years-the-euro-zones-largest-economies-are-all-growing-at-the-same-time/,https://www.reddit.com/r/dataisbeautiful/comments/35wkte/for_the_first_time_in_five_years_the_euro_zones/,5,5,0,2,"For the first time in five years, the euro zone’s largest economies are all growing - Quartz",2015-05-0206.jpg
MBTI types of reddit teenagers [OC],simontheflutist,2015-05-14,http://inspecialibus.tumblr.com/post/117229739190,https://www.reddit.com/r/dataisbeautiful/comments/35wn3h/mbti_types_of_reddit_teenagers_oc/,1,1,0,4,MBTI types of reddit teenagers OC,2015-05-0207.jpg
Hockey rinks per province in Canada,howtohockeydotcom,2015-05-14,http://www.sportsnet.ca/hockey/nhl/study-canadian-hockey-worth-11b-annually/,https://www.reddit.com/r/dataisbeautiful/comments/35xj6d/hockey_rinks_per_province_in_canada/,5,5,0,2,Hockey rinks per province in Canada,2015-05-0208.jpg
Where pictures are taken in London by tourists (red) vs. by locals (blue),davey_b,2015-05-14,https://www.flickr.com/photos/walkingsf/4671589629/,https://www.reddit.com/r/dataisbeautiful/comments/35xj9l/where_pictures_are_taken_in_london_by_tourists/,3216,3216,0,163,Where pictures are taken in London by tourists (red) vs. by locals (blue),2015-05-0209.jpg
"Once near equals, China and India have radically diverged in the past two decades – Quartz",jimrosenz,2015-05-14,http://qz.com/404758/once-near-equals-china-and-india-have-radically-diverged-in-the-past-two-decades/,https://www.reddit.com/r/dataisbeautiful/comments/35xl5u/once_near_equals_china_and_india_have_radically/,69,69,0,15,"Once near equals, China and India have radically diverged in the past two decades – Quartz",2015-05-0210.jpg
A Week of Mining Seattle's Craigslist Apartment Pricing,jamandahalf,2015-05-14,https://racketracer.wordpress.com/2014/12/23/a-week-of-seattles-craigslist-apartment-pricing/,https://www.reddit.com/r/dataisbeautiful/comments/35xmgl/a_week_of_mining_seattles_craigslist_apartment/,92,92,0,17,A Week of Mining Seattle's Craigslist Apartment Pricing,2015-05-0211.jpg
"Italians Used To Outdrink Americans, Not Anymore [OC]",CJMinard,2015-05-14,http://dadaviz.com/i/4080,https://www.reddit.com/r/dataisbeautiful/comments/35xszq/italians_used_to_outdrink_americans_not_anymore_oc/,13,13,0,17,"Italians Used To Outdrink Americans, Not Anymore OC",2015-05-0212.jpg
