title,author,created_date,url,full_permalink,score,ups,downs,num_comments,sanitized_title,image_file
Round 1 of the NFL Draft Belongs to the Washington Huskies and Wide Receivers [OC],thatdatadude,2015-05-01,https://www.thatdatadude.com/round-1-of-the-nfl-draft-belongs-to-washington-huskies-wide-receivers/,https://www.reddit.com/r/dataisbeautiful/comments/34hhmt/round_1_of_the_nfl_draft_belongs_to_the/,5,5,0,1,Round 1 of the NFL Draft Belongs to the Washington Huskies and Wide Receivers OC,2015-05-0000.jpg
FIFA World Ranking [OC],macbryla,2015-05-01,http://eyeseedata.com/fifa-world-ranking/,https://www.reddit.com/r/dataisbeautiful/comments/34hqj0/fifa_world_ranking_oc/,8,8,0,0,FIFA World Ranking OC,2015-05-0001.jpg
From drizzle to cyclones: visualising rain and wind with particle animation,capybara75,2015-05-01,http://www.theguardian.com/news/datablog/ng-interactive/2015/may/01/nsw-and-queensland-storms-in-context-australian-weather-events-visualised,https://www.reddit.com/r/dataisbeautiful/comments/34hv26/from_drizzle_to_cyclones_visualising_rain_and/,1,1,0,0,From drizzle to cyclones visualising rain and wind with particle animation,2015-05-0002.jpg
Here's where to find the world's cheapest gas,Jimoh8002,2015-05-01,http://money.cnn.com/interactive/economy/find-the-worlds-cheapest-gas/?sr=twmoney043015gascheap0330interactive,https://www.reddit.com/r/dataisbeautiful/comments/34hynj/heres_where_to_find_the_worlds_cheapest_gas/,21,21,0,9,Here's where to find the world's cheapest gas,2015-05-0003.jpg
Use of 'penis' vs 'vagina' on popular news sites sorted by ratio,lawrencekhoo,2015-05-01,https://medium.com/message/the-words-the-media-industry-prefers-5d33e5b021e0,https://www.reddit.com/r/dataisbeautiful/comments/34hzh1/use_of_penis_vs_vagina_on_popular_news_sites/,11,11,0,8,Use of 'penis' vs 'vagina' on popular news sites sorted by ratio,2015-05-0004.jpg
(OC) The great depressions in New Zealand (1974 – 1992) and Switzerland (1973 – 1996),jimrosenz,2015-05-01,http://utopiayouarestandinginit.com/2015/05/01/the-great-depressions-in-new-zealand-1974-1992-and-switzerland-1973-1996/,https://www.reddit.com/r/dataisbeautiful/comments/34i494/oc_the_great_depressions_in_new_zealand_1974_1992/,7,7,0,1,(OC) The great depressions in New Zealand (1974 – 1992) and Switzerland (1973 – 1996),2015-05-0005.jpg
"Led Zeppelin's ""Heartbreaker"" guitar solo: a fretboard heatmap. Comments for more plus code and data [OC]",zephyr1999,2015-05-01,http://i.imgur.com/dCH1FDZ.jpg,https://www.reddit.com/r/dataisbeautiful/comments/34irwb/led_zeppelins_heartbreaker_guitar_solo_a/,511,511,0,43,Led Zeppelin's Heartbreaker guitar solo a fretboard heatmap. Comments for more plus code and data OC,2015-05-0006.jpg
"Mayday, Fat Cats, and Big Kahunas...",captaincampfire,2015-05-01,http://www.payscale.com/data-packages/ceo-income-2013,https://www.reddit.com/r/dataisbeautiful/comments/34iygw/mayday_fat_cats_and_big_kahunas/,1,1,0,1,"Mayday, Fat Cats, and Big Kahunas...",2015-05-0007.jpg
There are more museums in the U.S. than there are Starbucks and McDonalds – combined,powderblock,2015-05-01,http://www.washingtonpost.com/blogs/wonkblog/wp/2014/06/13/there-are-more-museums-in-the-us-than-there-are-starbucks-and-mcdonalds-combined/?postshare=6701427115597772The,https://www.reddit.com/r/dataisbeautiful/comments/34j0fv/there_are_more_museums_in_the_us_than_there_are/,6,6,0,0,There are more museums in the U.S. than there are Starbucks and McDonalds – combined,2015-05-0008.jpg
Ground motion of the eastern US as a result of the 7.9M quake in Nepal,c_def,2015-05-01,https://www.youtube.com/watch?v=5xc-rNOISQE,https://www.reddit.com/r/dataisbeautiful/comments/34j466/ground_motion_of_the_eastern_us_as_a_result_of/,2137,2137,0,197,Ground motion of the eastern US as a result of the 7.9M quake in Nepal,2015-05-0009.jpg
Distribution of Party Donations > 50.000 Euro in Germany by Sector (2002-2014) [OC],-Rene,2015-05-01,http://i.imgur.com/LU3mEud.png,https://www.reddit.com/r/dataisbeautiful/comments/34j4ow/distribution_of_party_donations_50000_euro_in/,2,2,0,1,Distribution of Party Donations 50.000 Euro in Germany by Sector (2002-2014) OC,2015-05-0010.png
The Most Diverse Cities Are Often The Most Segregated,sympletic,2015-05-01,http://fivethirtyeight.com/features/the-most-diverse-cities-are-often-the-most-segregated/,https://www.reddit.com/r/dataisbeautiful/comments/34jbdg/the_most_diverse_cities_are_often_the_most/,30,30,0,12,The Most Diverse Cities Are Often The Most Segregated,2015-05-0011.jpg
One year of accidents: map of all vehicular collisions in Manhattan in 2014 [OC],army_ant,2015-05-01,http://graphzoo.tumblr.com/post/117799204477/maps-of-all-vehicular-collisions-in-manhattan-in,https://www.reddit.com/r/dataisbeautiful/comments/34jrsm/one_year_of_accidents_map_of_all_vehicular/,268,268,0,48,One year of accidents map of all vehicular collisions in Manhattan in 2014 OC,2015-05-0012.jpg
"Where the drugs are coming from that are sold on Evolution, a dark web site.",hcbaron,2015-05-01,http://www.vocativ.com/underworld/drugs/german-police-just-seized-millions-in-dark-net-drugs/,https://www.reddit.com/r/dataisbeautiful/comments/34kjg6/where_the_drugs_are_coming_from_that_are_sold_on/,37,37,0,13,"Where the drugs are coming from that are sold on Evolution, a dark web site.",2015-05-0013.jpg
Who Are The Officially Poor (1987-2013)? | Demos,jimrosenz,2015-05-01,http://www.demos.org/blog/4/30/15/who-are-officially-poor-1987-2013,https://www.reddit.com/r/dataisbeautiful/comments/34klgv/who_are_the_officially_poor_19872013_demos/,4,4,0,0,Who Are The Officially Poor (1987-2013) Demos,2015-05-0014.jpg
The Guardian's opinion polls of British public on political parties (chart in sheet 3),chubble10,2015-05-01,http://spreadsheets.google.com/ccc?key=phNtm3LmDZEO8F79tf8B0fg,https://www.reddit.com/r/dataisbeautiful/comments/34kqx5/the_guardians_opinion_polls_of_british_public_on/,2,2,0,1,The Guardian's opinion polls of British public on political parties (chart in sheet 3),2015-05-0015.jpg
"(OC) New Zealand and US real housing prices, 1975 – 2014",jimrosenz,2015-05-01,http://utopiayouarestandinginit.com/2015/05/01/new-zealand-and-us-real-housing-prices-1975-2014/,https://www.reddit.com/r/dataisbeautiful/comments/34l0um/oc_new_zealand_and_us_real_housing_prices_1975/,2,2,0,3,"(OC) New Zealand and US real housing prices, 1975 – 2014",2015-05-0016.jpg
Manhattan's hourly vehicular collision rate (Jan-Dec 2014) [OC],army_ant,2015-05-01,http://graphzoo.tumblr.com/post/117652498867/number-of-vehicular-collisions-per-hour-in,https://www.reddit.com/r/dataisbeautiful/comments/34l1uq/manhattans_hourly_vehicular_collision_rate_jandec/,5,5,0,6,Manhattan's hourly vehicular collision rate (Jan-Dec 2014) OC,2015-05-0017.jpg
The Three Types of Adam Sandler Movies,Psycho_Linguist,2015-05-02,http://fivethirtyeight.com/datalab/the-three-types-of-adam-sandler-movies/,https://www.reddit.com/r/dataisbeautiful/comments/34l7s7/the_three_types_of_adam_sandler_movies/,19,19,0,4,The Three Types of Adam Sandler Movies,2015-05-0018.jpg
Baltimore’s Demographic Divide - WSJ,heavy_petting,2015-05-02,http://graphics.wsj.com/baltimore-demographics/,https://www.reddit.com/r/dataisbeautiful/comments/34lixh/baltimores_demographic_divide_wsj/,4,4,0,1,Baltimore’s Demographic Divide - WSJ,2015-05-0019.jpg
FIFA World Cup History [OC],macbryla,2015-05-02,http://eyeseedata.com/fifa-world-cup-history/,https://www.reddit.com/r/dataisbeautiful/comments/34lrz0/fifa_world_cup_history_oc/,5,5,0,2,FIFA World Cup History OC,2015-05-0020.jpg
"Sources of Government Revenue across the OECD, 2015 | Tax Foundation",jimrosenz,2015-05-02,http://taxfoundation.org/article/sources-government-revenue-across-oecd-2015?utm_content=buffer2832a&utm_medium=social&utm_source=facebook.com&utm_campaign=buffer,https://www.reddit.com/r/dataisbeautiful/comments/34lwmw/sources_of_government_revenue_across_the_oecd/,5,5,0,3,"Sources of Government Revenue across the OECD, 2015 Tax Foundation",2015-05-0021.jpg
The Poverty Capitalism Creates | Demos,jimrosenz,2015-05-02,http://www.demos.org/blog/5/1/15/poverty-capitalism-creates,https://www.reddit.com/r/dataisbeautiful/comments/34m8or/the_poverty_capitalism_creates_demos/,0,0,0,2,The Poverty Capitalism Creates Demos,2015-05-0022.jpg
The chart that shows just how white America’s mainstream media is - Quartz,jimrosenz,2015-05-02,http://qz.com/395032/the-chart-that-shows-just-how-white-americas-mainstream-media-is/,https://www.reddit.com/r/dataisbeautiful/comments/34miim/the_chart_that_shows_just_how_white_americas/,0,0,0,3,The chart that shows just how white America’s mainstream media is - Quartz,2015-05-0023.jpg
Drunk Driving Penalties vs. Texting While Driving Penalties,dhinckley,2015-05-02,http://www.houstondwiattorney.net/houston-dwi-information/drunk-driving-vs-texting-while-driving-does-the-penalty-match-the-crime/,https://www.reddit.com/r/dataisbeautiful/comments/34mzng/drunk_driving_penalties_vs_texting_while_driving/,17,17,0,7,Drunk Driving Penalties vs. Texting While Driving Penalties,2015-05-0024.jpg
[OC]Acceleration Experienced on the Ride Mission:Space at Epcot,ajanitsunami,2015-05-02,http://i.imgur.com/SbQYS6g.png,https://www.reddit.com/r/dataisbeautiful/comments/34ncvd/ocacceleration_experienced_on_the_ride/,22,22,0,10,OCAcceleration Experienced on the Ride MissionSpace at Epcot,2015-05-0025.png
"(OC) Swedosclerosis and the British disease compared, 1950–2013",jimrosenz,2015-05-02,http://utopiayouarestandinginit.com/2015/05/03/swedosclerosis-and-the-british-disease-compared-19502013/,https://www.reddit.com/r/dataisbeautiful/comments/34o55h/oc_swedosclerosis_and_the_british_disease/,4,4,0,1,"(OC) Swedosclerosis and the British disease compared, 1950–2013",2015-05-0026.jpg
Gallup Review: Black and White Attitudes Toward Police,jimrosenz,2015-05-02,http://www.gallup.com/poll/175088/gallup-review-black-white-attitudes-toward-police.aspx,https://www.reddit.com/r/dataisbeautiful/comments/34of9p/gallup_review_black_and_white_attitudes_toward/,4,4,0,0,Gallup Review Black and White Attitudes Toward Police,2015-05-0027.jpg
Is a Tesla good for the environment? [OC],makken,2015-05-02,http://i.imgur.com/dKPbynZ.png,https://www.reddit.com/r/dataisbeautiful/comments/34ojvp/is_a_tesla_good_for_the_environment_oc/,15,15,0,39,Is a Tesla good for the environment OC,2015-05-0028.png
Is America Dreaming?: Understanding Social Mobility - LEGO based Visualization [Video],yaph,2015-05-03,https://www.youtube.com/watch?v=t2XFh_tD2RA,https://www.reddit.com/r/dataisbeautiful/comments/34pld4/is_america_dreaming_understanding_social_mobility/,194,194,0,70,Is America Dreaming Understanding Social Mobility - LEGO based Visualization Video,2015-05-0029.jpg
How The United States Became United [OC],CJMinard,2015-05-03,http://dadaviz.com/i/3927,https://www.reddit.com/r/dataisbeautiful/comments/34pq8f/how_the_united_states_became_united_oc/,63,63,0,12,How The United States Became United OC,2015-05-0030.jpg
Cohort Analysis with Heatmap,analyzecore,2015-05-03,http://analyzecore.com/2015/05/03/cohort-analysis-with-heatmap/,https://www.reddit.com/r/dataisbeautiful/comments/34q1p2/cohort_analysis_with_heatmap/,3,3,0,1,Cohort Analysis with Heatmap,2015-05-0031.jpg
Cohort Analysis and LifeCycle Grids mixed segmentation with R,analyzecore,2015-05-03,http://analyzecore.com/2015/04/01/cohort-analysis-and-lifecycle-grids-mixed-segmentation-with-r/,https://www.reddit.com/r/dataisbeautiful/comments/34q2w0/cohort_analysis_and_lifecycle_grids_mixed/,3,3,0,0,Cohort Analysis and LifeCycle Grids mixed segmentation with R,2015-05-0032.jpg
Sequence of shopping carts in-depth analysis with R,analyzecore,2015-05-03,http://analyzecore.com/2014/12/04/sequence-carts-in-depth-analysis-with-r/,https://www.reddit.com/r/dataisbeautiful/comments/34q4ko/sequence_of_shopping_carts_indepth_analysis_with_r/,2,2,0,1,Sequence of shopping carts in-depth analysis with R,2015-05-0033.jpg
The first results from psychology’s largest reproducibility test show that only 39 of 100 major published psychology studies could be reproduced,rhiever,2015-05-03,http://www.nature.com/news/first-results-from-psychology-s-largest-reproducibility-test-1.17433,https://www.reddit.com/r/dataisbeautiful/comments/34qc2b/the_first_results_from_psychologys_largest/,10,10,0,3,The first results from psychology’s largest reproducibility test show that only 39 of 100 major published psychology studies could be reproduced,2015-05-0034.jpg
This Is How Much Tech Giants Spent On Lobbying Washington,BinaryFormatter,2015-05-03,http://dadaviz.com/i/3958,https://www.reddit.com/r/dataisbeautiful/comments/34qfc0/this_is_how_much_tech_giants_spent_on_lobbying/,1,1,0,1,This Is How Much Tech Giants Spent On Lobbying Washington,2015-05-0035.jpg
Personal monthly spending at college bar vs. months until graduation [OC],Positive_Connotation,2015-05-03,https://mattsstatsblog.files.wordpress.com/2015/05/moonspending-msb.png,https://www.reddit.com/r/dataisbeautiful/comments/34qkug/personal_monthly_spending_at_college_bar_vs/,25,25,0,12,Personal monthly spending at college bar vs. months until graduation OC,2015-05-0036.jpg
The boost on my YouTube video view count after Jeremy from Cinema Sins replies to my comment during his AMA is like a rocket taking off [OC],dylc,2015-05-03,http://i.imgur.com/NxqcWoq.jpg,https://www.reddit.com/r/dataisbeautiful/comments/34qntq/the_boost_on_my_youtube_video_view_count_after/,6,6,0,2,The boost on my YouTube video view count after Jeremy from Cinema Sins replies to my comment during his AMA is like a rocket taking off OC,2015-05-0037.jpg
Wordclouds of the Most Frequently Used Words in Reddit Submissions During 2008 [OC],minimaxir,2015-05-03,http://i.imgur.com/tR1n7Gk.jpg,https://www.reddit.com/r/dataisbeautiful/comments/34rckw/wordclouds_of_the_most_frequently_used_words_in/,137,137,0,10,Wordclouds of the Most Frequently Used Words in Reddit Submissions During 2008 OC,2015-05-0038.jpg
"Another Hertzsprung-Russel Graph, Only With 200,000 Stars [OC]",avLugia,2015-05-03,http://imgur.com/shFBoE4,https://www.reddit.com/r/dataisbeautiful/comments/34rm12/another_hertzsprungrussel_graph_only_with_200000/,25,25,0,5,"Another Hertzsprung-Russel Graph, Only With 200,000 Stars OC",2015-05-0039.jpg
Visual Representation per country of the difference between the Minimum Wage and the Head Of State Wage.,patadeperro,2015-05-03,http://comotrabajarencanada.blogspot.ca/2015/05/regulated-careers-in-canada-salaries.html,https://www.reddit.com/r/dataisbeautiful/comments/34rwhv/visual_representation_per_country_of_the/,1,1,0,0,Visual Representation per country of the difference between the Minimum Wage and the Head Of State Wage.,2015-05-0040.jpg
Australia's fattest and fittest areas revealed,stephen789,2015-05-03,http://www.smh.com.au/national/health/australias-fattest-and-fittest-areas-revealed-20150503-1myxdf.html,https://www.reddit.com/r/dataisbeautiful/comments/34s70i/australias_fattest_and_fittest_areas_revealed/,6,6,0,2,Australia's fattest and fittest areas revealed,2015-05-0041.jpg
Software Engineering vs. Product Manager Salaries,carljoseph,2015-05-04,https://medium.com/@prlambert/software-engineering-vs-product-manager-salaries-9564cd7e665f,https://www.reddit.com/r/dataisbeautiful/comments/34sath/software_engineering_vs_product_manager_salaries/,4,4,0,1,Software Engineering vs. Product Manager Salaries,2015-05-0042.jpg
2015 World Press Freedom Index,__Joker,2015-05-04,http://index.rsf.org/#!/,https://www.reddit.com/r/dataisbeautiful/comments/34sdav/2015_world_press_freedom_index/,17,17,0,5,2015 World Press Freedom Index,2015-05-0043.jpg
A 26-year-old MIT graduate is turning heads over his theory that income inequality is actually…,CJMinard,2015-05-04,https://medium.com/the-ferenstein-wire/a-26-year-old-mit-graduate-is-turning-heads-over-his-theory-that-income-inequality-is-actually-2a3b423e0c,https://www.reddit.com/r/dataisbeautiful/comments/34sonx/a_26yearold_mit_graduate_is_turning_heads_over/,4,4,0,16,A 26-year-old MIT graduate is turning heads over his theory that income inequality is actually…,2015-05-0044.jpg
A Different Look at Generations and Partisanship,CJMinard,2015-05-04,http://www.people-press.org/2015/04/30/a-different-look-at-generations-and-partisanship/,https://www.reddit.com/r/dataisbeautiful/comments/34srpz/a_different_look_at_generations_and_partisanship/,0,0,0,0,A Different Look at Generations and Partisanship,2015-05-0045.jpg
Skill vs Reputation of 3.5 million StackOverflow users [OC],aioobe,2015-05-04,http://stackrating.com/rep-vs-rating.png,https://www.reddit.com/r/dataisbeautiful/comments/34su8u/skill_vs_reputation_of_35_million_stackoverflow/,24,24,0,15,Skill vs Reputation of 3.5 million StackOverflow users OC,2015-05-0046.png
Earthquakes in Indonesia - April [OC],Sjizo,2015-05-04,http://i.imgur.com/1OTltFm.png,https://www.reddit.com/r/dataisbeautiful/comments/34sv4n/earthquakes_in_indonesia_april_oc/,0,0,0,1,Earthquakes in Indonesia - April OC,2015-05-0047.png
How paradise became the fattest place in the world,MrBeanie88,2015-05-04,http://edition.cnn.com/2015/05/01/health/pacific-islands-obesity/index.html,https://www.reddit.com/r/dataisbeautiful/comments/34sz6j/how_paradise_became_the_fattest_place_in_the_world/,0,0,0,0,How paradise became the fattest place in the world,2015-05-0048.jpg
80% Of Twitter’s Users Are Mobile,MrBeanie88,2015-05-04,http://www.statista.com/chart/1520/number-of-monthly-active-twitter-users/,https://www.reddit.com/r/dataisbeautiful/comments/34t30z/80_of_twitters_users_are_mobile/,6,6,0,3,80% Of Twitter’s Users Are Mobile,2015-05-0049.jpg
A (very large) map of 40k youtube channels [OC],datamuffin,2015-05-04,http://thepoliticsofsystems.net/permafiles/youtube_full.jpg,https://www.reddit.com/r/dataisbeautiful/comments/34t6wa/a_very_large_map_of_40k_youtube_channels_oc/,0,0,0,1,A (very large) map of 40k youtube channels OC,2015-05-0050.jpg
Only 22 countries have never been invaded by Britain,CJMinard,2015-05-04,http://www.statista.com/chart/3441/countries-never-invaded-by-britain/,https://www.reddit.com/r/dataisbeautiful/comments/34te7m/only_22_countries_have_never_been_invaded_by/,3813,3813,0,1641,Only 22 countries have never been invaded by Britain,2015-05-0051.jpg
Manufacturing Employment in Historical Perspective: The 27% Manufacturing Labor Force of the Great Society Would Be Gone No Matter What,jimrosenz,2015-05-04,http://equitablegrowth.org/2015/04/30/manufacturing-employment-historical-perspective-27-manufacturing-labor-force-great-society-gone-no-matter/,https://www.reddit.com/r/dataisbeautiful/comments/34teim/manufacturing_employment_in_historical/,1,1,0,1,Manufacturing Employment in Historical Perspective The 27% Manufacturing Labor Force of the Great Society Would Be Gone No Matter What,2015-05-0052.jpg
"(OC) Post-war reconstruction then Eurosclerosis – Germany, Italy and France 1950-2013",jimrosenz,2015-05-04,http://utopiayouarestandinginit.com/2015/05/04/post-war-reconstruction-then-eurosclerosis-germany-italy-and-france-1950-2013/,https://www.reddit.com/r/dataisbeautiful/comments/34th7n/oc_postwar_reconstruction_then_eurosclerosis/,1,1,0,2,"(OC) Post-war reconstruction then Eurosclerosis – Germany, Italy and France 1950-2013",2015-05-0053.jpg
I got How-Old.net to analyse 20 recent photos of me.. the results are (not) surprising. [OC],E_M_G,2015-05-04,http://i.imgur.com/pcPeh2Y.png,https://www.reddit.com/r/dataisbeautiful/comments/34tl9c/i_got_howoldnet_to_analyse_20_recent_photos_of_me/,0,0,0,6,I got How-Old.net to analyse 20 recent photos of me.. the results are (not) surprising. OC,2015-05-0054.png
How People Get to Work with a Breakout by Age [OC],sympletic,2015-05-04,http://sympletic.com/people-get-work-breakout-age/,https://www.reddit.com/r/dataisbeautiful/comments/34tle8/how_people_get_to_work_with_a_breakout_by_age_oc/,4,4,0,5,How People Get to Work with a Breakout by Age OC,2015-05-0055.jpg
An Atlas of Upward Mobility Shows Paths Out of Poverty,Jgrovum,2015-05-04,http://www.nytimes.com/interactive/2015/05/03/upshot/the-best-and-worst-places-to-grow-up-how-your-area-compares.html?hp&action=click&pgtype=Homepage&module=photo-spot-region&region=top-news&WT.nav=top-news,https://www.reddit.com/r/dataisbeautiful/comments/34toct/an_atlas_of_upward_mobility_shows_paths_out_of/,0,0,0,2,An Atlas of Upward Mobility Shows Paths Out of Poverty,2015-05-0056.jpg
New 3D chart rendering system I'm working on [OC],olegkikin,2015-05-04,http://i.imgur.com/UGwurJZ.jpg,https://www.reddit.com/r/dataisbeautiful/comments/34v3hm/new_3d_chart_rendering_system_im_working_on_oc/,210,210,0,35,New 3D chart rendering system I'm working on OC,2015-05-0057.jpg
[X-Post] Statistics of Star Trek - Addendum: DS9 [OC],araesmojo,2015-05-04,http://imgur.com/a/iYYwF,https://www.reddit.com/r/dataisbeautiful/comments/34vbl7/xpost_statistics_of_star_trek_addendum_ds9_oc/,11,11,0,2,X-Post Statistics of Star Trek - Addendum DS9 OC,2015-05-0058.jpg
David Brooks Makes Basic Poverty Mistakes | Demos,jimrosenz,2015-05-04,http://www.demos.org/blog/5/4/15/david-brooks-makes-basic-poverty-mistakes,https://www.reddit.com/r/dataisbeautiful/comments/34vfyf/david_brooks_makes_basic_poverty_mistakes_demos/,3,3,0,0,David Brooks Makes Basic Poverty Mistakes Demos,2015-05-0059.jpg
Redesign: This chart from the Washington Post is a classic example of why all bar charts need to start at zero [OC],mendoza_line,2015-05-04,http://themendozaline.org/post/118146423986/zero-tolerance-why-all-bar-charts-should-have-a,https://www.reddit.com/r/dataisbeautiful/comments/34vto4/redesign_this_chart_from_the_washington_post_is_a/,26,26,0,15,Redesign This chart from the Washington Post is a classic example of why all bar charts need to start at zero OC,2015-05-0060.jpg
Roger Pielke Jr.'s Blog: Earthquakes: Death Rates and Frequency of Big Events,jimrosenz,2015-05-05,http://rogerpielkejr.blogspot.co.nz/2015/04/earthquakes-death-rates-and-frequency.html,https://www.reddit.com/r/dataisbeautiful/comments/34wqb1/roger_pielke_jrs_blog_earthquakes_death_rates_and/,0,0,0,0,Roger Pielke Jr.'s Blog Earthquakes Death Rates and Frequency of Big Events,2015-05-0061.jpg
A simple guide to the real differences between the Democratic candidates for president,CJMinard,2015-05-05,http://www.washingtonpost.com/blogs/wonkblog/wp/2015/05/04/these-are-the-real-differences-between-the-democratic-candidates/,https://www.reddit.com/r/dataisbeautiful/comments/34wscp/a_simple_guide_to_the_real_differences_between/,3,3,0,4,A simple guide to the real differences between the Democratic candidates for president,2015-05-0062.jpg
2016 National Democratic Primary - Polls - HuffPost Pollster,theghostecho,2015-05-05,http://elections.huffingtonpost.com/pollster/2016-national-democratic-primary,https://www.reddit.com/r/dataisbeautiful/comments/34wt12/2016_national_democratic_primary_polls_huffpost/,4,4,0,2,2016 National Democratic Primary - Polls - HuffPost Pollster,2015-05-0063.jpg
Americans overwhelmingly support Muhammad cartoonists’ right to offend,CJMinard,2015-05-05,http://www.washingtonpost.com/blogs/wonkblog/wp/2015/05/04/americans-overwhelmingly-support-muhammad-cartoonists-right-to-offend/,https://www.reddit.com/r/dataisbeautiful/comments/34wut9/americans_overwhelmingly_support_muhammad/,3450,3450,0,3104,Americans overwhelmingly support Muhammad cartoonists’ right to offend,2015-05-0064.jpg
Fracking Across the United States,rotaercz,2015-05-05,http://earthjustice.org/features/campaigns/fracking-across-the-united-states,https://www.reddit.com/r/dataisbeautiful/comments/34wv71/fracking_across_the_united_states/,1,1,0,1,Fracking Across the United States,2015-05-0065.jpg
Chart Book: Social Security Disability Insurance | Center on Budget and Policy Priorities,jimrosenz,2015-05-05,http://www.cbpp.org/research/chart-book-social-security-disability-insurance,https://www.reddit.com/r/dataisbeautiful/comments/34ww08/chart_book_social_security_disability_insurance/,1,1,0,0,Chart Book Social Security Disability Insurance Center on Budget and Policy Priorities,2015-05-0066.jpg
How the European Highway and Norways National Highway brings the road network together [OC],ostedog,2015-05-05,http://i.imgur.com/k5PI8hS.png,https://www.reddit.com/r/dataisbeautiful/comments/34xqjn/how_the_european_highway_and_norways_national/,12,12,0,6,How the European Highway and Norways National Highway brings the road network together OC,2015-05-0067.png
This interactive data map shows the best and worst places (US) to grow up when it comes to upward mobility,catfun4ever,2015-05-05,http://www.nytimes.com/interactive/2015/05/03/upshot/the-best-and-worst-places-to-grow-up-how-your-area-compares.html?abt=0002&abg=0,https://www.reddit.com/r/dataisbeautiful/comments/34xwal/this_interactive_data_map_shows_the_best_and/,30,30,0,2,This interactive data map shows the best and worst places (US) to grow up when it comes to upward mobility,2015-05-0068.jpg
Baltimore Riots: A Near Miss at My Buddies Condo and a Few Other Observations [OC],isaacfab,2015-05-05,http://www.isaacfaber.com/thoughts/2015/5/4/baltimore-riots-how-close-my-buddies-condo-got-and-a-few-other-things,https://www.reddit.com/r/dataisbeautiful/comments/34xwzv/baltimore_riots_a_near_miss_at_my_buddies_condo/,4,4,0,1,Baltimore Riots A Near Miss at My Buddies Condo and a Few Other Observations OC,2015-05-0069.jpg
Twitter data show that a few powerful users can control the conversation [OC],psychokinetic12,2015-05-05,http://qz.com/396107/twitter-data-show-that-a-few-powerful-users-can-control-the-conversation,https://www.reddit.com/r/dataisbeautiful/comments/34y5ba/twitter_data_show_that_a_few_powerful_users_can/,8,8,0,3,Twitter data show that a few powerful users can control the conversation OC,2015-05-0070.jpg
