title,author,created_date,url,full_permalink,score,ups,downs,num_comments,sanitized_title,image_file
The price per square foot of houses in America has barely changed in the last 40 years when inflation is taken into account,FuckoffDemetri,2017-01-01 00:25:57,http://www.aei.org/publication/todays-new-homes-are-1000-square-feet-larger-than-in-1973-and-the-living-space-per-person-has-doubled-over-last-40-years/,https://www.reddit.com/r/dataisbeautiful/comments/5lckxw/the_price_per_square_foot_of_houses_in_america/,24,24,,11,The price per square foot of houses in America has barely changed in the last 40 years when inflation is taken into account,2017-01-0000.jpg
Motivation of YouTube Viewers in Learning Piano [OC],Mapquestify,2017-01-01 00:50:45,https://mantenanotes.com/2017/01/01/motivation-of-youtube-viewers-in-learning-piano/,https://www.reddit.com/r/dataisbeautiful/comments/5lcoxk/motivation_of_youtube_viewers_in_learning_piano_oc/,9,9,,1,Motivation of YouTube Viewers in Learning Piano OC,2017-01-0001.jpg
How I failed to reach my 2016 running goal. Promised to post my data of 2016 New Year Resolution to run a mile for every day of the year. (with 'run' defined loosely) [OC].,J-Pwn,2017-01-01 02:33:22,http://imgur.com/a/Tt9Va,https://www.reddit.com/r/dataisbeautiful/comments/5ld44d/how_i_failed_to_reach_my_2016_running_goal/,42,42,,10,How I failed to reach my 2016 running goal. Promised to post my data of 2016 New Year Resolution to run a mile for every day of the year. (with 'run',2017-01-0002.jpg
Goldbach Comet (Scatter Plot) with Density Based Coloring [OC],voltrevo,2017-01-01 10:32:24,https://medium.com/@andrewmorris_51647/goldbach-comet-scatter-plot-with-density-based-coloring-808c6b16c747#.otop4ry0b,https://www.reddit.com/r/dataisbeautiful/comments/5lenpn/goldbach_comet_scatter_plot_with_density_based/,6,6,,1,Goldbach Comet (Scatter Plot) with Density Based Coloring OC,2017-01-0003.jpg
Your Life in 4680 Weeks,iturki27,2017-01-01 13:38:24,http://waitbutwhy.com/2014/05/life-weeks.html,https://www.reddit.com/r/dataisbeautiful/comments/5lf60b/your_life_in_4680_weeks/,14895,14895,,783,Your Life in 4680 Weeks,2017-01-0004.jpg
Usage of some words in four classical books [OC],egeemirozkan,2017-01-01 14:34:42,https://i.redd.it/67io411k247y.png,https://www.reddit.com/r/dataisbeautiful/comments/5lfcg0/usage_of_some_words_in_four_classical_books_oc/,4,4,,7,Usage of some words in four classical books OC,2017-01-0005.png
I plotted the completion of my New Years Resolutions everyday last year [OC],TomLinkon,2017-01-01 15:55:34,https://i.redd.it/e0q6fvo7h47y.png,https://www.reddit.com/r/dataisbeautiful/comments/5lfnay/i_plotted_the_completion_of_my_new_years/,35,35,,3,I plotted the completion of my New Years Resolutions everyday last year OC,2017-01-0006.png
Animated map shows how religion spread around the world,JulioCesarSalad,2017-01-01 17:36:32,https://www.youtube.com/watch?v=AvFl6UBZLv4,https://www.reddit.com/r/dataisbeautiful/comments/5lg3p4/animated_map_shows_how_religion_spread_around_the/,52,52,,12,Animated map shows how religion spread around the world,2017-01-0007.jpg
"A year of global terrorism, captured in one map.",Wish_you_were_there,2017-01-01 19:02:39,https://www.weforum.org/agenda/2016/12/this-map-shows-the-full-impact-of-terrorism?utm_content=buffercf7df&utm_medium=social&utm_source=twitter.com&utm_campaign=buffer,https://www.reddit.com/r/dataisbeautiful/comments/5lgj73/a_year_of_global_terrorism_captured_in_one_map/,19,19,,7,"A year of global terrorism, captured in one map.",2017-01-0008.jpg
Every hour of my 2016 charted by category [OC],backstreetskeeter,2017-01-01 21:10:09,http://i.imgur.com/iQ7FwUq.png,https://www.reddit.com/r/dataisbeautiful/comments/5lh6tc/every_hour_of_my_2016_charted_by_category_oc/,6452,6452,,489,Every hour of my 2016 charted by category OC,2017-01-0009.png
Sales from my Etsy Shop this year follow the Pareto Principal [OC],philosowaffle,2017-01-01 23:08:56,http://blog.clipartfever.com/content/images/2017/01/ListingRevenueChart.PNG,https://www.reddit.com/r/dataisbeautiful/comments/5lht32/sales_from_my_etsy_shop_this_year_follow_the/,8,8,,5,Sales from my Etsy Shop this year follow the Pareto Principal OC,2017-01-0010.png
This Is How 23 Countries Feel About Transgender Rights,xbettel,2017-01-02 00:24:52,https://www.buzzfeed.com/lesterfeder/this-is-how-23-countries-feel-about-transgender-rights?utm_term=.dojV6dJ7G#.vhzbPBnqo,https://www.reddit.com/r/dataisbeautiful/comments/5li6ta/this_is_how_23_countries_feel_about_transgender/,0,0,,1,This Is How 23 Countries Feel About Transgender Rights,2017-01-0011.jpg
I timed every poop at work in 2016 and calculated how much money I made while pooping. I call it Deuces For Dollars. [xpost from /r/dataispootiful] [OC],kerrybaumann,2017-01-02 02:19:20,http://imgur.com/a/OPpZZ,https://www.reddit.com/r/dataisbeautiful/comments/5lir3s/i_timed_every_poop_at_work_in_2016_and_calculated/,4492,4492,,547,I timed every poop at work in 2016 and calculated how much money I made while pooping. I call it Deuces For Dollars. xpost from rdataispootiful OC,2017-01-0012.jpg
Deadliest Cancers in Men and Women [OC],datashown,2017-01-02 04:51:02,http://i.imgur.com/Ba6YivA.png,https://www.reddit.com/r/dataisbeautiful/comments/5ljfic/deadliest_cancers_in_men_and_women_oc/,210,210,,29,Deadliest Cancers in Men and Women OC,2017-01-0013.png
This website compiles and displays data of Chicago homicides & shootings:,themitchschafer,2017-01-02 07:05:11,http://heyjackass.com/category/2016-stats/,https://www.reddit.com/r/dataisbeautiful/comments/5ljzk2/this_website_compiles_and_displays_data_of/,42,42,,13,This website compiles and displays data of Chicago homicides & shootings,2017-01-0014.jpg
The happy planet index,shabda,2017-01-02 08:09:56,https://en.wikipedia.org/wiki/Happy_Planet_Index,https://www.reddit.com/r/dataisbeautiful/comments/5lk7jv/the_happy_planet_index/,1,1,,0,The happy planet index,2017-01-0015.jpg
"The atmosphere in 2016 visualised using precipitable water. Includes hurricanes, monsoons, tropical convection and more",suckfail,2017-01-02 13:38:57,https://twitter.com/MetmanJames/status/815590682291240960?s=09,https://www.reddit.com/r/dataisbeautiful/comments/5lla68/the_atmosphere_in_2016_visualised_using/,24,24,,5,"The atmosphere in 2016 visualised using precipitable water. Includes hurricanes, monsoons, tropical convection and more",2017-01-0016.jpg
Differences in Video Game MetaCritc and User Scores [OC],gmh1977,2017-01-02 15:11:56,https://www.absentdata.com/differences-video-game-meta-critic-users-scores/,https://www.reddit.com/r/dataisbeautiful/comments/5llnzr/differences_in_video_game_metacritc_and_user/,5,5,,2,Differences in Video Game MetaCritc and User Scores OC,2017-01-0017.jpg
I created a spreadsheet to track levelling in league of legends. [OC],timmy16744,2017-01-02 16:42:39,http://i.imgur.com/QDYtla2.png,https://www.reddit.com/r/dataisbeautiful/comments/5lm46c/i_created_a_spreadsheet_to_track_levelling_in/,17,17,,3,I created a spreadsheet to track levelling in league of legends. OC,2017-01-0018.png
Playing with 80 Million Amazon Product Review Ratings [OC],minimaxir,2017-01-02 17:11:48,http://minimaxir.com/2017/01/amazon-spark/,https://www.reddit.com/r/dataisbeautiful/comments/5lm9yc/playing_with_80_million_amazon_product_review/,28,28,,2,Playing with 80 Million Amazon Product Review Ratings OC,2017-01-0019.jpg
I took 711 poops in 2016 [OC],TallRedditor,2017-01-02 19:39:40,http://imgur.com/gallery/g2a7h,https://www.reddit.com/r/dataisbeautiful/comments/5ln446/i_took_711_poops_in_2016_oc/,295,295,,88,I took 711 poops in 2016 OC,2017-01-0020.jpg
"30,000+ quotes visualized; each edge represents two nouns appearing in the same quote [OC]",icandoitbetter,2017-01-03 00:26:06,http://agermanidis.com/quotes_viz.png,https://www.reddit.com/r/dataisbeautiful/comments/5lop9n/30000_quotes_visualized_each_edge_represents_two/,30,30,,3,"30,000+ quotes visualized; each edge represents two nouns appearing in the same quote OC",2017-01-0021.png
"The NBA 2016-17 Triple-Double Race, Visualized [OC]",bigluzer,2017-01-03 00:56:35,https://i.redd.it/mrtrsat2be7y.png,https://www.reddit.com/r/dataisbeautiful/comments/5lov0m/the_nba_201617_tripledouble_race_visualized_oc/,12,12,,4,"The NBA 2016-17 Triple-Double Race, Visualized OC",2017-01-0022.png
"What classic rock looks like today, by FiveThirtyEight",mbenjamin618,2017-01-03 03:05:52,http://fivethirtyeight.com/features/why-classic-rock-isnt-what-it-used-to-be/?ex_cid=538fb,https://www.reddit.com/r/dataisbeautiful/comments/5lpikb/what_classic_rock_looks_like_today_by/,46,46,,4,"What classic rock looks like today, by FiveThirtyEight",2017-01-0023.jpg
Half of a Year of Running in Philadelphia [OC],brendan1mcmanus,2017-01-03 04:12:17,https://i.redd.it/n0jryh3x9f7y.png,https://www.reddit.com/r/dataisbeautiful/comments/5lpu5i/half_of_a_year_of_running_in_philadelphia_oc/,80,80,,3,Half of a Year of Running in Philadelphia OC,2017-01-0024.png
Map of 2016/2017 NCAA Bowl Wins by State. Does not include championship game. [OC],DaKing97,2017-01-03 05:13:44,https://i.redd.it/vlm4pu00ff7y.png,https://www.reddit.com/r/dataisbeautiful/comments/5lq46y/map_of_20162017_ncaa_bowl_wins_by_state_does_not/,6,6,,3,Map of 20162017 NCAA Bowl Wins by State. Does not include championship game. OC,2017-01-0025.png
Countries by Land Area and Population [OC],datashown,2017-01-03 05:40:42,http://i.imgur.com/FTIrFVp.png,https://www.reddit.com/r/dataisbeautiful/comments/5lq8ix/countries_by_land_area_and_population_oc/,735,735,,93,Countries by Land Area and Population OC,2017-01-0026.png
Interactive: Mapping the Flow of International Trade,heronumberwon,2017-01-03 07:33:38,http://www.visualcapitalist.com/interactive-mapping-flow-international-trade/,https://www.reddit.com/r/dataisbeautiful/comments/5lqop6/interactive_mapping_the_flow_of_international/,22,22,,0,Interactive Mapping the Flow of International Trade,2017-01-0027.jpg
One year time lapse of total precipitable water: 2016,TadyZ,2017-01-03 10:39:02,https://www.youtube.com/watch?v=dDuLAHnnOkY,https://www.reddit.com/r/dataisbeautiful/comments/5lrajf/one_year_time_lapse_of_total_precipitable_water/,31,31,,6,One year time lapse of total precipitable water 2016,2017-01-0028.jpg
Migration background of Berlin citizens [interactive],ladadadas,2017-01-03 11:54:34,http://interaktiv.morgenpost.de/migranten-in-berlin/#11/52.5171/13.3456,https://www.reddit.com/r/dataisbeautiful/comments/5lrjq2/migration_background_of_berlin_citizens/,12,12,,0,Migration background of Berlin citizens interactive,2017-01-0029.jpg
My 2016 tracking data with daily average subjective happiness [OC],happytimetracker,2017-01-03 11:54:53,http://imgur.com/a/UgHdj,https://www.reddit.com/r/dataisbeautiful/comments/5lrjrf/my_2016_tracking_data_with_daily_average/,2,2,,1,My 2016 tracking data with daily average subjective happiness OC,2017-01-0030.jpg
2016 Really Was The Worst Year For Famous People Dying - Here's The Data That Proves It,Psythor,2017-01-03 12:05:16,http://www.gizmodo.co.uk/2017/01/2016-really-was-the-worst-year-for-famous-people-dying-heres-the-data-that-proves-it/,https://www.reddit.com/r/dataisbeautiful/comments/5lrl3s/2016_really_was_the_worst_year_for_famous_people/,7,7,,7,2016 Really Was The Worst Year For Famous People Dying - Here's The Data That Proves It,2017-01-0031.jpg
"The countries that smoke the most weed, in one map",skoalbrother,2017-01-03 13:15:12,https://www.indy100.com/article/smoking-weed-global-prevalence-highest-country-world-data-map-7506716,https://www.reddit.com/r/dataisbeautiful/comments/5lrv0k/the_countries_that_smoke_the_most_weed_in_one_map/,18,18,,8,"The countries that smoke the most weed, in one map",2017-01-0032.jpg
My web browser history per weekday. [OC],davidmasp,2017-01-03 14:22:55,http://imgur.com/a/HES8u,https://www.reddit.com/r/dataisbeautiful/comments/5ls5i7/my_web_browser_history_per_weekday_oc/,10,10,,19,My web browser history per weekday. OC,2017-01-0033.jpg
Where is America's heartland?,thistokenusername,2017-01-03 15:01:42,http://www.nytimes.com/interactive/2017/01/03/upshot/where-is-americas-heartland-pick-your-map.html,https://www.reddit.com/r/dataisbeautiful/comments/5lsc69/where_is_americas_heartland/,8,8,,1,Where is America's heartland,2017-01-0034.jpg
Visualizing a Day in the Life of an Alcoholic [OC],F8Tempter,2017-01-03 16:23:14,https://i.redd.it/zvvmavoawi7y.jpg,https://www.reddit.com/r/dataisbeautiful/comments/5lss3c/visualizing_a_day_in_the_life_of_an_alcoholic_oc/,74,74,,13,Visualizing a Day in the Life of an Alcoholic OC,2017-01-0035.jpg
One square mile of each city at the same scale,deeddaemon,2017-01-03 16:34:56,http://geoffboeing.com/2017/01/square-mile-street-network-visualization/,https://www.reddit.com/r/dataisbeautiful/comments/5lsudv/one_square_mile_of_each_city_at_the_same_scale/,206,206,,24,One square mile of each city at the same scale,2017-01-0036.jpg
Chicago murder rate compared to other cities,Vizual-Statistix,2017-01-03 17:12:08,http://www.cnn.com/2017/01/02/us/chicago-murder-rate-2016-visual-guide/index.html,https://www.reddit.com/r/dataisbeautiful/comments/5lt279/chicago_murder_rate_compared_to_other_cities/,0,0,,1,Chicago murder rate compared to other cities,2017-01-0037.jpg
This map explains the weather the weather the United States had in 2016,lazarogamio,2017-01-03 18:21:02,https://www.washingtonpost.com/graphics/national/2016-weather/,https://www.reddit.com/r/dataisbeautiful/comments/5lthd0/this_map_explains_the_weather_the_weather_the/,6,6,,3,This map explains the weather the weather the United States had in 2016,2017-01-0038.jpg
"New extremely precise animation of total solar eclipse crossing the USA on August 21st, look in video gallery [OC]",MichaelZeiler,2017-01-03 20:21:06,http://www.greatamericaneclipse.com,https://www.reddit.com/r/dataisbeautiful/comments/5lu859/new_extremely_precise_animation_of_total_solar/,26,26,,4,"New extremely precise animation of total solar eclipse crossing the USA on August 21st, look in video gallery OC",2017-01-0039.jpg
Me and the GF have very different tastes when it comes to food. Both what and how much. But it sure looks like we influence the way each other gains and loses weight. [OC],alexgabriel_i,2017-01-03 21:40:18,https://i.redd.it/72w7v8yogk7y.png,https://www.reddit.com/r/dataisbeautiful/comments/5lupkq/me_and_the_gf_have_very_different_tastes_when_it/,27,27,,10,Me and the GF have very different tastes when it comes to food. Both what and how much. But it sure looks like we influence the way each other gains a,2017-01-0040.png
The Amazing Changing World made with a time lapse of Google Earth [OC],ryancool6,2017-01-03 21:59:45,https://www.youtube.com/watch?v=oUvxNTrGE6U,https://www.reddit.com/r/dataisbeautiful/comments/5lutym/the_amazing_changing_world_made_with_a_time_lapse/,17,17,,3,The Amazing Changing World made with a time lapse of Google Earth OC,2017-01-0041.jpg
Bitcoin is the Top Performing Currency for a Second Year in a Row,urbanachiever77,2017-01-03 22:07:38,http://money.visualcapitalist.com/bitcoin-top-performing-currency-second-year/,https://www.reddit.com/r/dataisbeautiful/comments/5luvs0/bitcoin_is_the_top_performing_currency_for_a/,13,13,,11,Bitcoin is the Top Performing Currency for a Second Year in a Row,2017-01-0042.jpg
Movement of US college students between the states [OC],AstroCB,2017-01-04 04:48:50,https://cameronbernhardt.com/College-Flow-Map/,https://www.reddit.com/r/dataisbeautiful/comments/5lx3ty/movement_of_us_college_students_between_the/,5,5,,2,Movement of US college students between the states OC,2017-01-0043.jpg
Things people are saying 2017 will be the year of online [OC],GemmaJ123,2017-01-04 09:03:53,https://www.brandwatch.com/blog/react-predictions-for-2017/,https://www.reddit.com/r/dataisbeautiful/comments/5ly4oy/things_people_are_saying_2017_will_be_the_year_of/,7,7,,2,Things people are saying 2017 will be the year of online OC,2017-01-0044.jpg
"More expensive wine may actually taste better, for literally no other reason than the price on its sticker.",alexgabriel_i,2017-01-04 12:34:28,https://fivethirtyeight.com/features/the-weird-world-of-expensive-wine/?utm_source=pocket&utm_medium=email&utm_campaign=pockethits,https://www.reddit.com/r/dataisbeautiful/comments/5lyv8c/more_expensive_wine_may_actually_taste_better_for/,15841,15841,,2265,"More expensive wine may actually taste better, for literally no other reason than the price on its sticker.",2017-01-0045.jpg
Interactive graphic: Every active satellite orbiting earth,profcyclist,2017-01-04 13:51:46,http://qz.com/296941/interactive-graphic-every-active-satellite-orbiting-earth/,https://www.reddit.com/r/dataisbeautiful/comments/5lz7hi/interactive_graphic_every_active_satellite/,10,10,,0,Interactive graphic Every active satellite orbiting earth,2017-01-0046.jpg
What is the Median Age of the Residents in Each State? [OC],OverflowDs,2017-01-04 14:00:27,http://overflow.solutions/demographic-data/what-is-the-median-age-of-the-residents-in-each-state/,https://www.reddit.com/r/dataisbeautiful/comments/5lz8yn/what_is_the_median_age_of_the_residents_in_each/,29,29,,11,What is the Median Age of the Residents in Each State OC,2017-01-0047.jpg
"The Origin of Prostitutes in Paris, 1836",RyanSmith,2017-01-04 16:22:44,https://digital.library.cornell.edu/catalog/ss:3293828,https://www.reddit.com/r/dataisbeautiful/comments/5m00r5/the_origin_of_prostitutes_in_paris_1836/,3,3,,2,"The Origin of Prostitutes in Paris, 1836",2017-01-0048.jpg
"Compare any two U.S. cities by population, crime, education and other data [OC",dzwiedz,2017-01-04 17:00:52,http://www.city-data.com/city-compare/,https://www.reddit.com/r/dataisbeautiful/comments/5m097c/compare_any_two_us_cities_by_population_crime/,144,144,,29,"Compare any two U.S. cities by population, crime, education and other data OC",2017-01-0049.jpg
The fallen if world war 2,nomad_kk,2017-01-04 18:31:54,https://www.youtube.com/watch?v=DwKPFT-RioU,https://www.reddit.com/r/dataisbeautiful/comments/5m0tnv/the_fallen_if_world_war_2/,27,27,,3,The fallen if world war 2,2017-01-0050.jpg
Github report card visualization,found_dead,2017-01-04 19:10:22,https://githubreportcard.com,https://www.reddit.com/r/dataisbeautiful/comments/5m12jt/github_report_card_visualization/,1,1,,1,Github report card visualization,2017-01-0051.jpg
250 million routing calculations to show the car journey time from anywhere to everywhere (in Great Britain) [OC],farfromio,2017-01-04 20:05:09,http://farfrom.io,https://www.reddit.com/r/dataisbeautiful/comments/5m1ey7/250_million_routing_calculations_to_show_the_car/,9,9,,3,250 million routing calculations to show the car journey time from anywhere to everywhere (in Great Britain) OC,2017-01-0052.jpg
"2016 Box Office totals, visualized [OC]",xach,2017-01-04 21:16:57,http://i.imgur.com/6I5udOe.png,https://www.reddit.com/r/dataisbeautiful/comments/5m1vdp/2016_box_office_totals_visualized_oc/,5,5,,4,"2016 Box Office totals, visualized OC",2017-01-0053.png
Wind and Solar to Provide 4% of Global Primary Energy by 2040!,chabanais,2017-01-04 21:44:45,https://wattsupwiththat.com/2017/01/04/wind-and-solar-to-provide-4-of-global-primary-energy-by-2040/,https://www.reddit.com/r/dataisbeautiful/comments/5m21ht/wind_and_solar_to_provide_4_of_global_primary/,11,11,,3,Wind and Solar to Provide 4% of Global Primary Energy by 2040!,2017-01-0054.jpg
Pew Research Center graphs Pathways to News,benjancewicz,2017-01-04 21:54:59,http://www.journalism.org/2016/07/07/pathways-to-news/,https://www.reddit.com/r/dataisbeautiful/comments/5m23sk/pew_research_center_graphs_pathways_to_news/,3,3,,0,Pew Research Center graphs Pathways to News,2017-01-0055.jpg
Global Sea Ice Area 1978 - 2017 v2 [OC],kevpluck,2017-01-04 21:55:29,http://i.imgur.com/T20V2tk.gifv,https://www.reddit.com/r/dataisbeautiful/comments/5m23we/global_sea_ice_area_1978_2017_v2_oc/,27,27,,12,Global Sea Ice Area 1978 - 2017 v2 OC,2017-01-0056.png
Vladimir Putin's approximate lateness to meetings with world leaders,hlake,2017-01-04 23:23:07,http://www.independent.co.uk/news/world/politics/vladimir-putin-russia-president-late-meetings-world-leaders-queen-pope-angela-merkel-barack-obama-a7507916.html,https://www.reddit.com/r/dataisbeautiful/comments/5m2mxa/vladimir_putins_approximate_lateness_to_meetings/,4,4,,0,Vladimir Putin's approximate lateness to meetings with world leaders,2017-01-0057.jpg
Distribution of Healthcare facilities in Massachusetts (interactive version in comments) [OC],heyusoft,2017-01-04 23:33:37,https://i.redd.it/ct305ycz5s7y.png,https://www.reddit.com/r/dataisbeautiful/comments/5m2p5t/distribution_of_healthcare_facilities_in/,18,18,,5,Distribution of Healthcare facilities in Massachusetts (interactive version in comments) OC,2017-01-0058.png
"The best global currency of 2016 was bitcoin, finishing up 126%. Next closest was Brazil's real at 22%.",jfranzen939393,2017-01-05 00:07:06,http://www.visualcapitalist.com/bitcoin-top-performing-currency-second-year-row/,https://www.reddit.com/r/dataisbeautiful/comments/5m2vxp/the_best_global_currency_of_2016_was_bitcoin/,8,8,,0,"The best global currency of 2016 was bitcoin, finishing up 126%. Next closest was Brazil's real at 22%.",2017-01-0059.jpg
A progressive attempt at a Real Estate Infographic for Edmonton Alberta (DEC 2016) [OC],EdmRealtor,2017-01-05 00:22:07,http://imgur.com/gallery/NqdjD,https://www.reddit.com/r/dataisbeautiful/comments/5m2zba/a_progressive_attempt_at_a_real_estate/,2,2,,3,A progressive attempt at a Real Estate Infographic for Edmonton Alberta (DEC 2016) OC,2017-01-0060.jpg
Map of the World's Countries Rearranged by Population,LinuxNoob9,2017-01-05 05:25:24,http://bigthink.com/strange-maps/490-map-of-the-worlds-countries-rearranged-by-population,https://www.reddit.com/r/dataisbeautiful/comments/5m4jxu/map_of_the_worlds_countries_rearranged_by/,94,94,,17,Map of the World's Countries Rearranged by Population,2017-01-0061.jpg
The U.S. states that currently assemble and formerly assembled cars [OC],Jeedieweedies,2017-01-05 05:41:59,https://i.redd.it/4usfc6fszt7y.png,https://www.reddit.com/r/dataisbeautiful/comments/5m4mn7/the_us_states_that_currently_assemble_and/,153,153,,32,The U.S. states that currently assemble and formerly assembled cars OC,2017-01-0062.png
"Trump increased his support over Mitt Romney in 2012 with 7% more black votes, 8% more hispanic votes, and 11% more Asian votes and 5% more millennial votes (18-29).",ShotBot,2017-01-05 11:25:56,http://www.nytimes.com/interactive/2016/11/08/us/politics/election-exit-polls.html,https://www.reddit.com/r/dataisbeautiful/comments/5m5vs4/trump_increased_his_support_over_mitt_romney_in/,15,15,,14,"Trump increased his support over Mitt Romney in 2012 with 7% more black votes, 8% more hispanic votes, and 11% more Asian votes and 5% more millennial",2017-01-0063.jpg
Alan Shearer's 206 Goals - UK Premier League All Time Top Goalscorer [OC],Simonjcharlton,2017-01-05 11:53:28,https://i.redd.it/ytjl9xhotv7y.jpg,https://www.reddit.com/r/dataisbeautiful/comments/5m5z8f/alan_shearers_206_goals_uk_premier_league_all/,326,326,,26,Alan Shearer's 206 Goals - UK Premier League All Time Top Goalscorer OC,2017-01-0064.jpg
Visitors of artists' Wikipedia pages after they died (numbers from Swedish Wikipedia) [OC],vienno,2017-01-05 12:01:41,https://i.redd.it/r1w6jvyfvv7y.png,https://www.reddit.com/r/dataisbeautiful/comments/5m60c0/visitors_of_artists_wikipedia_pages_after_they/,66,66,,18,Visitors of artists' Wikipedia pages after they died (numbers from Swedish Wikipedia) OC,2017-01-0065.png
Live data viz monitors what people are saying about Trump,GemmaJ123,2017-01-05 12:27:00,http://react.brandwatch.com/trumpwatch/,https://www.reddit.com/r/dataisbeautiful/comments/5m63yl/live_data_viz_monitors_what_people_are_saying/,5,5,,2,Live data viz monitors what people are saying about Trump,2017-01-0066.jpg
Elevation vs Distance with Hiking Speed colorized for my John Muir Trail hike [OC],ars2458,2017-01-05 15:14:47,https://i.redd.it/aphdhpyytw7y.png,https://www.reddit.com/r/dataisbeautiful/comments/5m6wil/elevation_vs_distance_with_hiking_speed_colorized/,46,46,,9,Elevation vs Distance with Hiking Speed colorized for my John Muir Trail hike OC,2017-01-0067.png
I had a 2016 Jeopardy Day-to-Day calendar at work last year. Here's a quick Excel analysis of the data. [OC],CaughtInDireWood,2017-01-05 15:28:19,https://i.redd.it/wyqtxmpgww7y.jpg,https://www.reddit.com/r/dataisbeautiful/comments/5m6z95/i_had_a_2016_jeopardy_daytoday_calendar_at_work/,13,13,,3,I had a 2016 Jeopardy Day-to-Day calendar at work last year. Here's a quick Excel analysis of the data. OC,2017-01-0068.jpg
Presidents of the United States [OC],datashown,2017-01-05 15:41:14,http://i.imgur.com/snoquTK.png,https://www.reddit.com/r/dataisbeautiful/comments/5m71xw/presidents_of_the_united_states_oc/,9588,9588,,1343,Presidents of the United States OC,2017-01-0069.png
How much countries spend on food (as a percentage of household income),Madmaxxin,2017-01-05 15:56:53,http://www.vox.com/2014/7/6/5874499/map-heres-how-much-every-country-spends-on-food,https://www.reddit.com/r/dataisbeautiful/comments/5m759t/how_much_countries_spend_on_food_as_a_percentage/,16,16,,6,How much countries spend on food (as a percentage of household income),2017-01-0070.jpg
An interesting visualisation of daylight hours,IAmACabbageAMA,2017-01-05 16:52:19,https://www.timeanddate.com/sun/uk/london,https://www.reddit.com/r/dataisbeautiful/comments/5m7h8e/an_interesting_visualisation_of_daylight_hours/,6,6,,0,An interesting visualisation of daylight hours,2017-01-0071.jpg
