title,author,created_date,url,full_permalink,score,ups,downs,num_comments,sanitized_title,image_file
Does Your State Care More About Batman or Puppies? [OC],Klarry84,2017-08-17 16:21:09,https://www.discovergeek.com/batman-vs-puppies-us-states-map/,https://www.reddit.com/r/dataisbeautiful/comments/6ub2tk/does_your_state_care_more_about_batman_or_puppies/,13,13,,5,Does Your State Care More About Batman or Puppies OC,2017-08-0290.jpg
Running a Montecarlo Test to decide the chance of a handful of DnD dice landing with adjacent values [OC],DotDecay,2017-08-17 16:31:20,http://i.imgur.com/vZb02m7.png,https://www.reddit.com/r/dataisbeautiful/comments/6ub5cd/running_a_montecarlo_test_to_decide_the_chance_of/,2,2,,4,Running a Montecarlo Test to decide the chance of a handful of DnD dice landing with adjacent values OC,2017-08-0291.png
Fantasy Football Draft Position vs Points [OC],person_ergo,2017-08-17 16:46:31,https://i.redd.it/u55swiyiubgz.png,https://www.reddit.com/r/dataisbeautiful/comments/6ub93j/fantasy_football_draft_position_vs_points_oc/,6,6,,6,Fantasy Football Draft Position vs Points OC,2017-08-0292.png
2016 Presidential Election Vote Density Results by County [OC],bourbonandvinyl,2017-08-17 17:39:03,http://i.imgur.com/buJ58nv.png,https://www.reddit.com/r/dataisbeautiful/comments/6ubm7d/2016_presidential_election_vote_density_results/,85,85,,32,2016 Presidential Election Vote Density Results by County OC,2017-08-0293.png
Constitution Age of Current Sovereign states [OC],filipomar,2017-08-17 18:55:35,https://i.redd.it/bfutp279hcgz.png,https://www.reddit.com/r/dataisbeautiful/comments/6uc5fu/constitution_age_of_current_sovereign_states_oc/,36,36,,13,Constitution Age of Current Sovereign states OC,2017-08-0294.png
[OC] Terry Loves... (Brooklyn Nine Nine),highflyingpigeons,2017-08-17 20:04:53,https://i.redd.it/f3v2krslrcgz.png,https://www.reddit.com/r/dataisbeautiful/comments/6ucmom/oc_terry_loves_brooklyn_nine_nine/,33,33,,4,OC Terry Loves... (Brooklyn Nine Nine),2017-08-0295.png
Ocean and land temperature of different latitudes,kevpluck,2017-08-17 21:42:01,https://www.youtube.com/watch?v=fljISUQWL_s,https://www.reddit.com/r/dataisbeautiful/comments/6uda0s/ocean_and_land_temperature_of_different_latitudes/,6,6,,0,Ocean and land temperature of different latitudes,2017-08-0296.jpg
[OC] my baby's sleeping and eating pattern,timmysbq,2017-08-18 02:24:43,https://i.redd.it/r6avysjspegz.jpg,https://www.reddit.com/r/dataisbeautiful/comments/6uexdi/oc_my_babys_sleeping_and_eating_pattern/,70,70,,8,OC my baby's sleeping and eating pattern,2017-08-0297.jpg
Making Data Human - Pulling a story from the data [OC],rytchbass,2017-08-18 06:29:28,https://becominghuman.ai/making-data-human-2-b5d140ef138e,https://www.reddit.com/r/dataisbeautiful/comments/6ug2xj/making_data_human_pulling_a_story_from_the_data_oc/,7,7,,2,Making Data Human - Pulling a story from the data OC,2017-08-0298.jpg
US Nobel laureates by state or country of birth [OC],Udzu,2017-08-18 13:13:07,https://i.redd.it/1n1giwqcxhgz.png,https://www.reddit.com/r/dataisbeautiful/comments/6uhpz7/us_nobel_laureates_by_state_or_country_of_birth_oc/,81,81,,31,US Nobel laureates by state or country of birth OC,2017-08-0299.png
A Month of NY Motor Vehicle Accidents [OC],radarboy3000,2017-08-18 14:28:19,http://www.radarboy.com/ny_collision,https://www.reddit.com/r/dataisbeautiful/comments/6ui6aw/a_month_of_ny_motor_vehicle_accidents_oc/,8,8,,7,A Month of NY Motor Vehicle Accidents OC,2017-08-0300.jpg
Number of hate incidents against American mosques since 2013,rwescott,2017-08-18 14:54:30,https://projects.propublica.org/graphics/mosques,https://www.reddit.com/r/dataisbeautiful/comments/6uicco/number_of_hate_incidents_against_american_mosques/,3,3,,4,Number of hate incidents against American mosques since 2013,2017-08-0301.jpg
Pennsylvania - Student Arrests 2012-2016 [OC],nathreed,2017-08-18 15:59:21,https://gfycat.com/IdolizedDigitalCatfish,https://www.reddit.com/r/dataisbeautiful/comments/6uirs3/pennsylvania_student_arrests_20122016_oc/,7,7,,5,Pennsylvania - Student Arrests 2012-2016 OC,2017-08-0302.jpg
"Rise in recorded crime in the UK, 1950-2003.",Calingula,2017-08-18 17:39:23,https://i.redd.it/y5g2aggv8jgz.png,https://www.reddit.com/r/dataisbeautiful/comments/6ujfs1/rise_in_recorded_crime_in_the_uk_19502003/,9,9,,5,"Rise in recorded crime in the UK, 1950-2003.",2017-08-0303.png
"Visualizing ""Friends"" Dialogue [OC]",Julien_Assouline,2017-08-18 23:04:33,https://i.redd.it/1jyoygztukgz.png,https://www.reddit.com/r/dataisbeautiful/comments/6ulidy/visualizing_friends_dialogue_oc/,164,164,,11,Visualizing Friends Dialogue OC,2017-08-0304.png
The longest straight line that can be drawn in each US state [OC],e8odie,2017-08-18 23:08:18,http://i.imgur.com/M7DPydM.png,https://www.reddit.com/r/dataisbeautiful/comments/6ulj3v/the_longest_straight_line_that_can_be_drawn_in/,57,57,,18,The longest straight line that can be drawn in each US state OC,2017-08-0305.png
"Support for anti-immigration parties in Sweden, Denmark, Norway and Finland [OC]",desfirsit,2017-08-19 07:38:24,https://i.redd.it/g5efswbxdngz.png,https://www.reddit.com/r/dataisbeautiful/comments/6untep/support_for_antiimmigration_parties_in_sweden/,63,63,,37,"Support for anti-immigration parties in Sweden, Denmark, Norway and Finland OC",2017-08-0306.png
"USA, within-country migration flows (PUMAs), ACS 2012--2015 [OC]",pfoali,2017-08-19 11:48:26,https://i.redd.it/ckvdf1c5nogz.png,https://www.reddit.com/r/dataisbeautiful/comments/6uomt1/usa_withincountry_migration_flows_pumas_acs/,256,256,,17,"USA, within-country migration flows (PUMAs), ACS 2012--2015 OC",2017-08-0307.png
The Complete History Of The NFL,zonination,2017-08-19 13:13:59,https://projects.fivethirtyeight.com/complete-history-of-the-nfl/#ari,https://www.reddit.com/r/dataisbeautiful/comments/6uozbr/the_complete_history_of_the_nfl/,11,11,,1,The Complete History Of The NFL,2017-08-0308.jpg
Deaths due to recognised terror attacks in Europe so far in 2017 [OC],AVirtualDuck,2017-08-19 14:28:00,https://i.redd.it/5ssiagj6epgz.png,https://www.reddit.com/r/dataisbeautiful/comments/6upc2a/deaths_due_to_recognised_terror_attacks_in_europe/,209,209,,93,Deaths due to recognised terror attacks in Europe so far in 2017 OC,2017-08-0309.png
Number of Subscribers by State Subreddit [OC],datashown,2017-08-19 16:36:17,https://i.redd.it/93v0wewl2qgz.png,https://www.reddit.com/r/dataisbeautiful/comments/6uq1hk/number_of_subscribers_by_state_subreddit_oc/,26158,26158,,1949,Number of Subscribers by State Subreddit OC,2017-08-0310.png
Reddit Comment Score in Relation to Tons of Nutella [OC],GarethPW,2017-08-19 22:27:15,https://i.redd.it/mutgqbugsrgz.png,https://www.reddit.com/r/dataisbeautiful/comments/6us159/reddit_comment_score_in_relation_to_tons_of/,37,37,,3,Reddit Comment Score in Relation to Tons of Nutella OC,2017-08-0311.png
Average Fantasy Premier League Price for Players at Each Club [OC],viz-a-week,2017-08-19 22:43:44,https://i.redd.it/a4d4a7xzvrgz.jpg,https://www.reddit.com/r/dataisbeautiful/comments/6us46y/average_fantasy_premier_league_price_for_players/,0,0,,4,Average Fantasy Premier League Price for Players at Each Club OC,2017-08-0312.jpg
Price of a Pint of Guinness in Ireland [OC],VizRight,2017-08-20 11:31:07,https://public.tableau.com/views/PriceofaPint/PriceofaPint?: embed=y&:display_count=no&:showVizHome=no#1,https://www.reddit.com/r/dataisbeautiful/comments/6uv8wn/price_of_a_pint_of_guinness_in_ireland_oc/,4,4,,5,Price of a Pint of Guinness in Ireland OC,2017-08-0313.jpg
Two years of recruiters reaching out to me via LinkedIn [OC],H3llShadow,2017-08-20 12:38:49,http://i.imgur.com/vxOh44E.png,https://www.reddit.com/r/dataisbeautiful/comments/6uvhwz/two_years_of_recruiters_reaching_out_to_me_via/,10158,10158,,660,Two years of recruiters reaching out to me via LinkedIn OC,2017-08-0314.png
PC videogames: Metacritic ratings by year [OC],alex77456,2017-08-20 15:08:54,https://i.redd.it/6dzn11tvrwgz.png,https://www.reddit.com/r/dataisbeautiful/comments/6uw7jl/pc_videogames_metacritic_ratings_by_year_oc/,18,18,,11,PC videogames Metacritic ratings by year OC,2017-08-0315.png
Using XKCD to investigate the priorities of reddit [OC],hilburn,2017-08-20 21:24:15,http://i.imgur.com/xi9S240.png,https://www.reddit.com/r/dataisbeautiful/comments/6uyf0p/using_xkcd_to_investigate_the_priorities_of/,45,45,,9,Using XKCD to investigate the priorities of reddit OC,2017-08-0316.png
The average color of every photo I took in 2016 [OC],subitizer21,2017-08-20 22:05:49,https://i.redd.it/6ek0yqvqtygz.jpg,https://www.reddit.com/r/dataisbeautiful/comments/6uyns1/the_average_color_of_every_photo_i_took_in_2016_oc/,93,93,,18,The average color of every photo I took in 2016 OC,2017-08-0317.jpg
The best Denny's locations to see the total solar eclipse [OC],subitizer21,2017-08-20 22:15:55,https://i.redd.it/9pu8ylkkvygz.png,https://www.reddit.com/r/dataisbeautiful/comments/6uypt4/the_best_dennys_locations_to_see_the_total_solar/,25726,25726,,614,The best Denny's locations to see the total solar eclipse OC,2017-08-0318.png
Subscribers per 100 000 people per Canadian provincial subreddit [OC],regimentsaliere,2017-08-20 23:21:34,https://i.redd.it/fqnqv1vf5zgz.png,https://www.reddit.com/r/dataisbeautiful/comments/6uz2ic/subscribers_per_100_000_people_per_canadian/,21,21,,2,Subscribers per 100 000 people per Canadian provincial subreddit OC,2017-08-0319.png
Age breakdown of United States homeowners in 1980 and 2015 [OC],academiaadvice,2017-08-20 23:42:14,https://i.redd.it/69w1t2fhbzgz.png,https://www.reddit.com/r/dataisbeautiful/comments/6uz6i9/age_breakdown_of_united_states_homeowners_in_1980/,47,47,,11,Age breakdown of United States homeowners in 1980 and 2015 OC,2017-08-0320.png
Biggest tech giants by revenue [OC],icorrectotherpeople,2017-08-21 03:29:30,https://i.redd.it/ktofizj2g0hz.jpg,https://www.reddit.com/r/dataisbeautiful/comments/6v0dl6/biggest_tech_giants_by_revenue_oc/,14,14,,8,Biggest tech giants by revenue OC,2017-08-0321.jpg
Phone Height over Time [OC],mobijoker,2017-08-21 07:01:19,https://i.redd.it/b1l2txonh1hz.png,https://www.reddit.com/r/dataisbeautiful/comments/6v1agt/phone_height_over_time_oc/,1,1,,8,Phone Height over Time OC,2017-08-0322.png
ASK: Is there an online service I can make charts based ony my data like in example? Would like to have public page like this.,agilek,2017-08-21 07:41:24,https://cushionapp.com/running-costs,https://www.reddit.com/r/dataisbeautiful/comments/6v1fy3/ask_is_there_an_online_service_i_can_make_charts/,0,0,,3,ASK Is there an online service I can make charts based ony my data like in example Would like to have public page like this.,2017-08-0323.jpg
How long taxis wait in the airport queue - O'Hare Airport in Chicago [OC],sayWhatNow85,2017-08-21 11:54:57,https://i.redd.it/p1ysrv3wx2hz.png,https://www.reddit.com/r/dataisbeautiful/comments/6v2ete/how_long_taxis_wait_in_the_airport_queue_ohare/,21,21,,4,How long taxis wait in the airport queue - O'Hare Airport in Chicago OC,2017-08-0324.png
Lyrics Repetition by Album [OC],benrules2,2017-08-21 12:11:41,http://imgur.com/a/gH2ZN,https://www.reddit.com/r/dataisbeautiful/comments/6v2hrp/lyrics_repetition_by_album_oc/,4,4,,3,Lyrics Repetition by Album OC,2017-08-0325.jpg
Most Common Birth Months Around the World,UysVentura,2017-08-21 13:32:37,http://blog.visme.co/most-common-birthday/,https://www.reddit.com/r/dataisbeautiful/comments/6v2x98/most_common_birth_months_around_the_world/,10,10,,0,Most Common Birth Months Around the World,2017-08-0326.jpg
"Several excellent maps and interactives about solar eclipses past, present and future",bathroomstalin,2017-08-21 14:17:57,https://www.washingtonpost.com/graphics/national/eclipse/?tid=sm_tw&utm_term=.e5f07eb738b0,https://www.reddit.com/r/dataisbeautiful/comments/6v3730/several_excellent_maps_and_interactives_about/,9,9,,0,"Several excellent maps and interactives about solar eclipses past, present and future",2017-08-0327.jpg
The cyclical nature of solar eclipses | 5 millennia visualized [OC],acrahen,2017-08-21 14:19:39,https://public.tableau.com/views/CyclicalNatureofSolarEclipses/Eclipses?:embed=y&:display_count=yes&:showVizHome=no,https://www.reddit.com/r/dataisbeautiful/comments/6v37gt/the_cyclical_nature_of_solar_eclipses_5_millennia/,11,11,,4,The cyclical nature of solar eclipses 5 millennia visualized OC,2017-08-0328.jpg
"Sperm Count in Western Men has Dropped Over 50% Since 1973, declining precipitously with no signs of 'leveling off', 'a step forward in the clarity of the data'",HenryCorp,2017-08-21 14:49:05,https://www.nytimes.com/2017/08/16/health/male-sperm-count-problem.html?smid=re-share,https://www.reddit.com/r/dataisbeautiful/comments/6v3e7x/sperm_count_in_western_men_has_dropped_over_50/,0,0,,5,"Sperm Count in Western Men has Dropped Over 50% Since 1973, declining precipitously with no signs of 'leveling off', 'a step forward in the clarity of",2017-08-0329.jpg
European Nobel laureates by nationality [OC],Udzu,2017-08-21 15:16:16,https://i.redd.it/a0fs7652y3hz.png,https://www.reddit.com/r/dataisbeautiful/comments/6v3kpr/european_nobel_laureates_by_nationality_oc/,87,87,,11,European Nobel laureates by nationality OC,2017-08-0330.png
Peak Birth Rates in the US [OC],VizRight,2017-08-21 18:33:27,https://public.tableau.com/views/USBirths2003-2015/USBirths?:%20embed=n&:display_count=no&:showVizHome=no#1,https://www.reddit.com/r/dataisbeautiful/comments/6v4y95/peak_birth_rates_in_the_us_oc/,2,2,,3,Peak Birth Rates in the US OC,2017-08-0331.jpg
Eclipse's Path of Totality visible via Google search intensity,AzizAnSorry,2017-08-21 19:00:45,https://googledataorg.carto.com/u/googledata/viz/51003fc8-28bc-4ac8-9d30-3c430a19b0c1/embed_map,https://www.reddit.com/r/dataisbeautiful/comments/6v55mk/eclipses_path_of_totality_visible_via_google/,18,18,,1,Eclipse's Path of Totality visible via Google search intensity,2017-08-0332.jpg
Breakdown of value over replacement player by position in Fantasy Football [OC],themockupblog,2017-08-21 19:02:25,https://i.imgur.com/C3DB2GP.jpg,https://www.reddit.com/r/dataisbeautiful/comments/6v562a/breakdown_of_value_over_replacement_player_by/,2,2,,6,Breakdown of value over replacement player by position in Fantasy Football OC,2017-08-0333.jpg
Dark Souls: An In-Death Analysis [OC],Lun06,2017-08-21 20:04:50,https://i.redd.it/f20h5x3nd5hz.png,https://www.reddit.com/r/dataisbeautiful/comments/6v5nh4/dark_souls_an_indeath_analysis_oc/,33,33,,4,Dark Souls An In-Death Analysis OC,2017-08-0334.png
"Personal saving, 1955-2015 [US]",belgiankid,2017-08-21 20:55:49,http://www.pgpf.org/chart-archive/0063_personal-savings,https://www.reddit.com/r/dataisbeautiful/comments/6v60ie/personal_saving_19552015_us/,5,5,,0,"Personal saving, 1955-2015 US",2017-08-0335.jpg
The Best Schools and Majors for Landing a Job at Facebook [OC],ResumeGem,2017-08-21 21:35:12,https://medium.com/@ResumeGem/the-best-schools-and-majors-for-landing-a-job-at-facebook-74e278628660,https://www.reddit.com/r/dataisbeautiful/comments/6v69wa/the_best_schools_and_majors_for_landing_a_job_at/,2,2,,3,The Best Schools and Majors for Landing a Job at Facebook OC,2017-08-0336.jpg
Temperature in the UK per Month since 1659[OC],cavedave,2017-08-21 22:32:30,https://i.redd.it/1hmiro7o36hz.jpg,https://www.reddit.com/r/dataisbeautiful/comments/6v6nbf/temperature_in_the_uk_per_month_since_1659oc/,3,3,,2,Temperature in the UK per Month since 1659OC,2017-08-0337.jpg
Path of Instagram photos across the US on Twitter on the live MapD Tweetmap.,tmostak,2017-08-22 00:32:51,https://www.mapd.com/demos/tweetmap/#eyJtYXAiOnsibWFwWm9vbSI6MS43NDQwMzA2OTQzMjkxODIxLCJtYXBDZW50ZXIiOnsibG5nIjotMTEuMzI0NTg2MDI3ODQ1MjQzLCJsYXQiOjQ2Ljg1MzE5MTIzNzkwNTgzfX0sInNlYXJjaEZpbHRlcnMiOlsiZWNsaXBzZSJdLCJ0aW1lRmlsdGVyIjpbWyIyMDE3LTA2LTAyVDA5OjAwOjAwLjAwMFoiLCIyMDE3LTA4LTIyVDAwOjAwOjAwLjAwMFoiXV0sImxlZ2VuZERpbWVuc2lvbiI6Im9yaWdpbiJ9,https://www.reddit.com/r/dataisbeautiful/comments/6v7dzt/path_of_instagram_photos_across_the_us_on_twitter/,2,2,,0,Path of Instagram photos across the US on Twitter on the live MapD Tweetmap.,2017-08-0338.jpg
"The music Americans listen to, sorted by neighborhood density. 50 different artists!",NordyNed,2017-08-22 00:49:43,https://www.nytimes.com/interactive/2017/08/07/upshot/music-fandom-maps.html?mc=aud_dev&mcid=tw-nytimes&mccr=AugustTwittermcdt=2017-08&subid=AugustTwitter&ad-keywords=AudDevGate,https://www.reddit.com/r/dataisbeautiful/comments/6v7hj5/the_music_americans_listen_to_sorted_by/,19,19,,3,"The music Americans listen to, sorted by neighborhood density. 50 different artists!",2017-08-0339.jpg
[OC] My solar production on 8/21 compared to 8/20 (>90% occusion at 11:30 AM),UndeadBarber,2017-08-22 00:54:49,http://i.imgur.com/rUkVQPh.jpg,https://www.reddit.com/r/dataisbeautiful/comments/6v7im8/oc_my_solar_production_on_821_compared_to_820_90/,77,77,,9,OC My solar production on 821 compared to 820 (90% occusion at 1130 AM),2017-08-0340.jpg
Median US Household Income by County (2015) [OC],newishtodc,2017-08-22 01:24:41,https://i.redd.it/fv5lmp4gy6hz.png,https://www.reddit.com/r/dataisbeautiful/comments/6v7oxs/median_us_household_income_by_county_2015_oc/,81,81,,24,Median US Household Income by County (2015) OC,2017-08-0341.png
How interest rate rises could tip households into mortgage stress - Australia (ABC),teknofly,2017-08-22 01:45:22,http://www.abc.net.au/news/2017-08-21/how-interest-rate-rises-could-affect-home-loan-stress/8798274,https://www.reddit.com/r/dataisbeautiful/comments/6v7tfr/how_interest_rate_rises_could_tip_households_into/,1,1,,3,How interest rate rises could tip households into mortgage stress - Australia (ABC),2017-08-0342.jpg
"[OC] ""My eyes hurt""",superpaow,2017-08-22 03:06:35,https://i.redd.it/5ybj7f4wg7hz.png,https://www.reddit.com/r/dataisbeautiful/comments/6v8a9m/oc_my_eyes_hurt/,54517,54517,,1100,OC My eyes hurt,2017-08-0343.png
"Looking for some suggestions: ""When does my family typically post to the group chat, and who posts the most?"" [OC]",m3rcury6,2017-08-22 06:20:44,http://imgur.com/a/rlpc4,https://www.reddit.com/r/dataisbeautiful/comments/6v96ck/looking_for_some_suggestions_when_does_my_family/,9,9,,4,"Looking for some suggestions When does my family typically post to the group chat, and who posts the most OC",2017-08-0344.jpg
Englands Average Monthly Temperature since 1659 [OC],cavedave,2017-08-22 10:51:54,https://i.redd.it/80yaotdur9hz.jpg,https://www.reddit.com/r/dataisbeautiful/comments/6va6nx/englands_average_monthly_temperature_since_1659_oc/,6,6,,9,Englands Average Monthly Temperature since 1659 OC,2017-08-0345.jpg
Most searched starter Pokémon by country,GemmaJ123,2017-08-22 11:06:53,https://twitter.com/joshuaDboyd/status/899895478032244736,https://www.reddit.com/r/dataisbeautiful/comments/6va8z5/most_searched_starter_pokémon_by_country/,107,107,,25,Most searched starter Pokémon by country,2017-08-0346.jpg
"Despite so many people watching it early when it got leaked, episode 6 of Game of Thrones S7 got way more live social media mentions when it aired on Sunday than any other of the episodes have had so far this season [OC]",GemmaJ123,2017-08-22 11:08:19,https://www.brandwatch.com/blog/react-game-thrones-season-7-episode-6/?utm_source=reddit&utm_medium=react&utm_term=blog&utm_campaign=08_2017_entertainment_blog,https://www.reddit.com/r/dataisbeautiful/comments/6va96m/despite_so_many_people_watching_it_early_when_it/,54,54,,5,"Despite so many people watching it early when it got leaked, episode 6 of Game of Thrones S7 got way more live social media mentions when it aired on",2017-08-0347.jpg
Heatmap of a city infrastructure. Place rating calculator. [OC],lavrton,2017-08-22 11:09:48,https://isgood.in/r,https://www.reddit.com/r/dataisbeautiful/comments/6va9eu/heatmap_of_a_city_infrastructure_place_rating/,5,5,,3,Heatmap of a city infrastructure. Place rating calculator. OC,2017-08-0348.jpg
Harry Plotter: Part 2 - Stereotypes behind the Hogwarts Houses with TF-IDF [OC],lakenp,2017-08-22 11:26:39,https://paulvanderlaken.com/2017/08/22/harry-plotter-part-2-hogwarts-houses-and-their-stereotypes/,https://www.reddit.com/r/dataisbeautiful/comments/6vacc8/harry_plotter_part_2_stereotypes_behind_the/,3,3,,6,Harry Plotter Part 2 - Stereotypes behind the Hogwarts Houses with TF-IDF OC,2017-08-0349.jpg
Data that my students collected during the eclipse [OC],Nabro3,2017-08-22 12:23:41,https://i.redd.it/2bywdlq68ahz.jpg,https://www.reddit.com/r/dataisbeautiful/comments/6van1c/data_that_my_students_collected_during_the/,20,20,,10,Data that my students collected during the eclipse OC,2017-08-0350.jpg
[OC] I needed to replace my tablesaw blade and wanted to know how much of an improvement it would be. The results indicated that the dull blade effectively halved the power of my saw and made me spend twice the effort to cut.,hawkmoon77,2017-08-22 14:03:13,https://i.redd.it/mfwast32qahz.jpg,https://www.reddit.com/r/dataisbeautiful/comments/6vb7mk/oc_i_needed_to_replace_my_tablesaw_blade_and/,19,19,,2,OC I needed to replace my tablesaw blade and wanted to know how much of an improvement it would be. The results indicated that the dull blade effectiv,2017-08-0351.jpg
Search interest comparison of North Korea & Nuclear War [OC],mcyaqisikli,2017-08-22 14:05:31,https://i.redd.it/ajmxv9d8qahz.png,https://www.reddit.com/r/dataisbeautiful/comments/6vb868/search_interest_comparison_of_north_korea_nuclear/,29,29,,9,Search interest comparison of North Korea & Nuclear War OC,2017-08-0352.png
Sleeping poorly through 2016 (part 2) [OC],JoshKehn,2017-08-22 14:52:33,http://l.kehn.io/3S3A0a0N0H01,https://www.reddit.com/r/dataisbeautiful/comments/6vbiuq/sleeping_poorly_through_2016_part_2_oc/,2,2,,2,Sleeping poorly through 2016 (part 2) OC,2017-08-0353.jpg
The impact of the partial solar eclipse on electricity production of the solar panels on my roof. [OC],sunkid,2017-08-22 15:32:09,https://i.redd.it/pi1jaaqr5bhz.png,https://www.reddit.com/r/dataisbeautiful/comments/6vbs9q/the_impact_of_the_partial_solar_eclipse_on/,32,32,,13,The impact of the partial solar eclipse on electricity production of the solar panels on my roof. OC,2017-08-0354.png
An interactive GPU-powered deep dive into 11.6 billion rows of US shipping data [OC],tmostak,2017-08-22 15:38:52,https://www.mapd.com/blog/2017/08/22/an-interactive-deep-dive-into-11-6b-rows-of-us-shipping-data/,https://www.reddit.com/r/dataisbeautiful/comments/6vbtww/an_interactive_gpupowered_deep_dive_into_116/,11,11,,3,An interactive GPU-powered deep dive into 11.6 billion rows of US shipping data OC,2017-08-0355.jpg
"Old SF Train Lines, in a Bart Style Map",Monicagc,2017-08-22 16:04:35,https://thegreatermarin.wordpress.com/2015/04/06/mapping-the-derelict-lines-of-the-bay-area/,https://www.reddit.com/r/dataisbeautiful/comments/6vc05f/old_sf_train_lines_in_a_bart_style_map/,3,3,,0,"Old SF Train Lines, in a Bart Style Map",2017-08-0356.jpg
What percentage of your life the United States has been at war by birth year,jedrekk,2017-08-22 16:13:09,https://www.washingtonpost.com/news/politics/wp/2017/08/22/heres-how-much-of-your-life-the-u-s-has-been-at-war/?utm_term=.226c9096f734,https://www.reddit.com/r/dataisbeautiful/comments/6vc2b2/what_percentage_of_your_life_the_united_states/,96,96,,51,What percentage of your life the United States has been at war by birth year,2017-08-0357.jpg
[OC]Why does the exact frequency difference (in Hz) between adjacent notes increase as the pitch of the notes get higher?,ilovephysics17,2017-08-22 16:29:31,https://i.redd.it/hr5tzkv9ebhz.png,https://www.reddit.com/r/dataisbeautiful/comments/6vc6b6/ocwhy_does_the_exact_frequency_difference_in_hz/,7,7,,5,OCWhy does the exact frequency difference (in Hz) between adjacent notes increase as the pitch of the notes get higher,2017-08-0358.png
Mapping geo-tagged tweets about the Solar Eclipse [OC],GemmaJ123,2017-08-22 16:56:30,https://www.brandwatch.com/blog/react-solar-eclipse-2017-data/?utm_source=reddit&utm_medium=react&utm_term=blog&utm_campaign=08_2017_trending_blog,https://www.reddit.com/r/dataisbeautiful/comments/6vcd47/mapping_geotagged_tweets_about_the_solar_eclipse/,5,5,,2,Mapping geo-tagged tweets about the Solar Eclipse OC,2017-08-0359.jpg
Nielsen Tracks Podcast Listeners' Consumer Behavior,Musichead2468,2017-08-22 17:24:55,https://www.allaccess.com/net-news/archive/story/168909/nielsen-tracks-podcast-listeners-consumer-behavior?ref=mail_recap,https://www.reddit.com/r/dataisbeautiful/comments/6vck8a/nielsen_tracks_podcast_listeners_consumer_behavior/,3,3,,0,Nielsen Tracks Podcast Listeners' Consumer Behavior,2017-08-0360.jpg
"[OC] Google searches for ""Eclipse"" and ""Eclipse damage""",Samura1_I3,2017-08-22 17:36:59,https://i.redd.it/f6pat1x5sbhz.png,https://www.reddit.com/r/dataisbeautiful/comments/6vcnay/oc_google_searches_for_eclipse_and_eclipse_damage/,13,13,,4,OC Google searches for Eclipse and Eclipse damage,2017-08-0361.png
"She Giggles, He Gallops",juliasilge,2017-08-22 19:08:17,https://pudding.cool/2017/08/screen-direction/,https://www.reddit.com/r/dataisbeautiful/comments/6vda2h/she_giggles_he_gallops/,36,36,,2,"She Giggles, He Gallops",2017-08-0362.jpg
Analysis | Here’s every total solar eclipse happening in your lifetime. Is this year your best chance?,jessegammons,2017-08-22 20:10:45,https://www.washingtonpost.com/graphics/national/eclipse/?tid=sm_fb&utm_term=.8e0699819a52,https://www.reddit.com/r/dataisbeautiful/comments/6vdplr/analysis_heres_every_total_solar_eclipse/,19,19,,1,Analysis Here’s every total solar eclipse happening in your lifetime. Is this year your best chance,2017-08-0363.jpg
