title,author,created_date,url,full_permalink,score,ups,downs,num_comments,sanitized_title,image_file
Beyond the Tip: a data-driven exploration of Archer co- [OC],batpigandme,2017-01-18 16:18:42,https://archervisualization.herokuapp.com/,https://www.reddit.com/r/dataisbeautiful/comments/5oq9l5/beyond_the_tip_a_datadriven_exploration_of_archer/,7,7,,3,Beyond the Tip a data-driven exploration of Archer co- OC,2017-01-0288.jpg
How 2016 Became Earth’s Hottest Year on Record.,gauchnomics,2017-01-18 16:40:06,https://www.nytimes.com/interactive/2017/01/18/science/earth/2016-hottest-year-on-record.html,https://www.reddit.com/r/dataisbeautiful/comments/5oqe7i/how_2016_became_earths_hottest_year_on_record/,7,7,,0,How 2016 Became Earth’s Hottest Year on Record.,2017-01-0289.jpg
I logged every cup of tea I drank in 2016 [OC],TheTim,2017-01-18 17:45:51,http://ellis.fyi/blog/i-logged-every-cup-of-tea-i-drank-in-2016/,https://www.reddit.com/r/dataisbeautiful/comments/5oqtai/i_logged_every_cup_of_tea_i_drank_in_2016_oc/,19,19,,2,I logged every cup of tea I drank in 2016 OC,2017-01-0290.jpg
No Hoax: 2016 Was the Hottest Year on Record,chogall,2017-01-18 19:26:10,https://www.bloomberg.com/graphics/hottest-year-on-record/,https://www.reddit.com/r/dataisbeautiful/comments/5orgq6/no_hoax_2016_was_the_hottest_year_on_record/,126,126,,79,No Hoax 2016 Was the Hottest Year on Record,2017-01-0291.jpg
Some Colleges Have More Students From the Top 1 Percent Than the Bottom 60. Find Yours.,omix,2017-01-18 19:37:20,https://www.nytimes.com/interactive/2017/01/18/upshot/some-colleges-have-more-students-from-the-top-1-percent-than-the-bottom-60.html,https://www.reddit.com/r/dataisbeautiful/comments/5orjcl/some_colleges_have_more_students_from_the_top_1/,117,117,,16,Some Colleges Have More Students From the Top 1 Percent Than the Bottom 60. Find Yours.,2017-01-0292.jpg
One third of consumers would rather wash dishes than visit a retail store,KillersGonnaKill,2017-01-18 20:38:44,https://www.capgemini-consulting.com/resource-file-access/resource/pdf/retail-store-research_dti.pdf,https://www.reddit.com/r/dataisbeautiful/comments/5orxdn/one_third_of_consumers_would_rather_wash_dishes/,25,25,,7,One third of consumers would rather wash dishes than visit a retail store,2017-01-0293.jpg
A pie chart of every word I have ever read in books divided by genre [OC],Obtainer_of_Goods,2017-01-18 20:49:23,https://i.redd.it/48yojydn8jay.png,https://www.reddit.com/r/dataisbeautiful/comments/5orzsn/a_pie_chart_of_every_word_i_have_ever_read_in/,8,8,,4,A pie chart of every word I have ever read in books divided by genre OC,2017-01-0294.png
Income Inequality at Elite Schools,virtu333,2017-01-18 21:13:09,https://www.nytimes.com/interactive/2017/01/18/upshot/some-colleges-have-more-students-from-the-top-1-percent-than-the-bottom-60.html?smid=fb-share&_r=0,https://www.reddit.com/r/dataisbeautiful/comments/5os599/income_inequality_at_elite_schools/,2,2,,0,Income Inequality at Elite Schools,2017-01-0295.jpg
"Percent Change (2015 to 2016) in Burglary in Washington, DC [OC]",smitty1788,2017-01-18 21:18:02,https://i.redd.it/5spewcx1ejay.png,https://www.reddit.com/r/dataisbeautiful/comments/5os6fy/percent_change_2015_to_2016_in_burglary_in/,5,5,,4,"Percent Change (2015 to 2016) in Burglary in Washington, DC OC",2017-01-0296.png
The Most Vermin-Infested American Cities,xemity,2017-01-18 23:08:32,https://www.bloomberg.com/features/2017-america-roach-rats-infected-cities/,https://www.reddit.com/r/dataisbeautiful/comments/5osv4h/the_most_vermininfested_american_cities/,9,9,,1,The Most Vermin-Infested American Cities,2017-01-0297.jpg
USA Interactive Map: Shows ALL 28 States where marijuana use is NOW legal,yucaipaisaac,2017-01-19 00:12:34,http://wehavethenews.com/marijuana-map-usa/,https://www.reddit.com/r/dataisbeautiful/comments/5ot84a/usa_interactive_map_shows_all_28_states_where/,11,11,,3,USA Interactive Map Shows ALL 28 States where marijuana use is NOW legal,2017-01-0298.jpg
Open Data Shows Chicago’s Taxi Industry Shrinking Faster Than NYC’s,hallwaymathlete,2017-01-19 00:59:42,http://toddwschneider.com/posts/chicago-taxi-data/,https://www.reddit.com/r/dataisbeautiful/comments/5othet/open_data_shows_chicagos_taxi_industry_shrinking/,11,11,,0,Open Data Shows Chicago’s Taxi Industry Shrinking Faster Than NYC’s,2017-01-0299.jpg
Should men always pay on the first date? 500 people in NYC surveyed.,SHIGYE22,2017-01-19 01:42:53,https://medium.com/athena-talks/should-men-always-pay-on-the-first-date-8fb7afcd10c6#.ee06ud96o,https://www.reddit.com/r/dataisbeautiful/comments/5otpmq/should_men_always_pay_on_the_first_date_500/,46,46,,43,Should men always pay on the first date 500 people in NYC surveyed.,2017-01-0300.jpg
Probabilistic Real Estate Map in NYC,julian88888888,2017-01-19 03:07:34,http://www.fastforwardlabs.com/pre/#/probability/1000000-50/2016/all_boroughs/all_neighborhoods?_k=0crniu,https://www.reddit.com/r/dataisbeautiful/comments/5ou5g8/probabilistic_real_estate_map_in_nyc/,4,4,,2,Probabilistic Real Estate Map in NYC,2017-01-0301.jpg
2016 was not the hottest year on record when including the margin of error [OC],scedast_dotcom,2017-01-19 03:35:46,https://www.scedast.com/visualization/there-is-no-hottest-year-on-record/?utm_campaign=post&utm_source=reddit&utm_medium=social,https://www.reddit.com/r/dataisbeautiful/comments/5ouaiq/2016_was_not_the_hottest_year_on_record_when/,0,0,,5,2016 was not the hottest year on record when including the margin of error OC,2017-01-0302.jpg
Police shootings by threat level 2016 [OC],jimrosenz,2017-01-19 05:51:37,https://utopiayouarestandinginit.com/2017/01/15/police-shootings-by-threat-level-2016-tylercowen/,https://www.reddit.com/r/dataisbeautiful/comments/5ouwnq/police_shootings_by_threat_level_2016_oc/,2,2,,1,Police shootings by threat level 2016 OC,2017-01-0303.jpg
"Forest cover age of eastern Quebec, Canada, according to the last forest inventory (2004-2016, depending of the sectors) [OC]",gnomonish,2017-01-19 06:23:17,https://i.imgur.com/VyNeCdI.jpg,https://www.reddit.com/r/dataisbeautiful/comments/5ov1c3/forest_cover_age_of_eastern_quebec_canada/,19,19,,4,"Forest cover age of eastern Quebec, Canada, according to the last forest inventory (2004-2016, depending of the sectors) OC",2017-01-0304.jpg
Best-paid U.S. hedge fund managers,jimrosenz,2017-01-19 07:15:19,http://www.reuters.com/article/us-hedgefunds-compensation-idUSKCN0Y11D1,https://www.reddit.com/r/dataisbeautiful/comments/5ov8gx/bestpaid_us_hedge_fund_managers/,5,5,,1,Best-paid U.S. hedge fund managers,2017-01-0305.jpg
How Donald Trump's Twitter attacks affect online sentiment towards brands,GemmaJ123,2017-01-19 09:57:09,http://www.cnbc.com/2017/01/12/trumps-twitter-attacks-can-tank-a-brands-public-sentiment.html,https://www.reddit.com/r/dataisbeautiful/comments/5ovrhw/how_donald_trumps_twitter_attacks_affect_online/,38,38,,6,How Donald Trump's Twitter attacks affect online sentiment towards brands,2017-01-0306.jpg
Reliance of English soccer clubs on TV and other revenues,jimrosenz,2017-01-19 10:18:26,https://www.bloomberg.com/gadfly/articles/2017-01-19/manchester-united-stands-apart-from-soccer-tv-addiction?utm_content=gadfly&utm_campaign=socialflow-organic&utm_source=twitter&utm_medium=social&cmpid%3D=socialflow-twitter-gadfly,https://www.reddit.com/r/dataisbeautiful/comments/5ovu55/reliance_of_english_soccer_clubs_on_tv_and_other/,0,0,,1,Reliance of English soccer clubs on TV and other revenues,2017-01-0307.jpg
How the Uneven Obama Recovery Paved the Way for Trump,victorp93,2017-01-19 13:06:41,https://www.bloomberg.com/graphics/2017-obama-economic-legacy/,https://www.reddit.com/r/dataisbeautiful/comments/5owg8c/how_the_uneven_obama_recovery_paved_the_way_for/,144,144,,23,How the Uneven Obama Recovery Paved the Way for Trump,2017-01-0308.jpg
Craft Can Beer in 'Murica [OC],heuristicmystic,2017-01-19 13:11:56,https://i.redd.it/4ilum1es4oay.png,https://www.reddit.com/r/dataisbeautiful/comments/5owh27/craft_can_beer_in_murica_oc/,3,3,,1,Craft Can Beer in 'Murica OC,2017-01-0309.png
Mapped: President Barack Obama's 156 visits abroad - and half a million million miles flown in Air Force One,dan-gis,2017-01-19 13:15:47,http://www.telegraph.co.uk/news/2017/01/13/mapped-president-barack-obamas-156-visits-abroad-half-million/,https://www.reddit.com/r/dataisbeautiful/comments/5owhp1/mapped_president_barack_obamas_156_visits_abroad/,4042,4042,,469,Mapped President Barack Obama's 156 visits abroad - and half a million million miles flown in Air Force One,2017-01-0310.jpg
Six maps that show the anatomy of America’s vast infrastructure,zonination,2017-01-19 14:23:01,https://www.washingtonpost.com/graphics/national/maps-of-american-infrastrucure/,https://www.reddit.com/r/dataisbeautiful/comments/5owtae/six_maps_that_show_the_anatomy_of_americas_vast/,1855,1855,,147,Six maps that show the anatomy of America’s vast infrastructure,2017-01-0311.jpg
"Income of Immigrants to the US - The Longer You're Here, the More You Make? [OC]",heyusoft,2017-01-19 15:20:28,https://i.redd.it/gfeghwqjroay.png,https://www.reddit.com/r/dataisbeautiful/comments/5ox4f1/income_of_immigrants_to_the_us_the_longer_youre/,17,17,,4,"Income of Immigrants to the US - The Longer You're Here, the More You Make OC",2017-01-0312.png
The one metric that predicts which Democrats are most likely to skip Donald Trump’s inauguration,im-the-stig,2017-01-19 15:39:18,https://www.washingtonpost.com/news/the-fix/wp/2017/01/19/the-one-metric-that-predicts-which-democrats-are-most-likely-to-skip-donald-trumps-inauguration/,https://www.reddit.com/r/dataisbeautiful/comments/5ox8bx/the_one_metric_that_predicts_which_democrats_are/,1,1,,1,The one metric that predicts which Democrats are most likely to skip Donald Trump’s inauguration,2017-01-0313.jpg
FiveThirtyEight underestimated polarization in the 2016 US Presidential Election [OC],maxxamillionandone,2017-01-19 16:15:38,https://i.redd.it/1e8zgp2c1pay.png,https://www.reddit.com/r/dataisbeautiful/comments/5oxg3s/fivethirtyeight_underestimated_polarization_in/,2,2,,2,FiveThirtyEight underestimated polarization in the 2016 US Presidential Election OC,2017-01-0314.png
You Draw It: What Got Better or Worse During Obama’s Presidency [OC],1wheel,2017-01-19 16:30:24,https://www.nytimes.com/interactive/2017/01/15/us/politics/you-draw-obama-legacy.html,https://www.reddit.com/r/dataisbeautiful/comments/5oxjdt/you_draw_it_what_got_better_or_worse_during/,1430,1430,,184,You Draw It What Got Better or Worse During Obama’s Presidency OC,2017-01-0315.jpg
Selfie hotspots in London [OC],GemmaJ123,2017-01-19 16:46:06,https://www.brandwatch.com/blog/react-geo-tagged-selfie-london/,https://www.reddit.com/r/dataisbeautiful/comments/5oxms5/selfie_hotspots_in_london_oc/,12,12,,3,Selfie hotspots in London OC,2017-01-0316.jpg
Bump Chart of World GDP Rankings and Projections 1980-2030 [OC],flerlagekr,2017-01-19 16:56:31,http://www.kenflerlage.com/2017/01/my-thoughts-on-bump-charts-and-when-to.html,https://www.reddit.com/r/dataisbeautiful/comments/5oxozl/bump_chart_of_world_gdp_rankings_and_projections/,7,7,,2,Bump Chart of World GDP Rankings and Projections 1980-2030 OC,2017-01-0317.jpg
Spiral Chart Showing Trump Tweets (and How to Create It),flerlagekr,2017-01-19 17:01:32,https://questionsindataviz.wordpress.com/2017/01/17/how-did-i-create-the-spiral-chart/,https://www.reddit.com/r/dataisbeautiful/comments/5oxq2k/spiral_chart_showing_trump_tweets_and_how_to/,13,13,,2,Spiral Chart Showing Trump Tweets (and How to Create It),2017-01-0318.jpg
sentiment analysis on tweets from Donald Trump’s twitter account,conditionalcognition,2017-01-19 17:39:16,http://www.thecrosstab.com/2017/01/16/trump-twitter-sentiment/,https://www.reddit.com/r/dataisbeautiful/comments/5oxyk3/sentiment_analysis_on_tweets_from_donald_trumps/,5,5,,1,sentiment analysis on tweets from Donald Trump’s twitter account,2017-01-0319.jpg
Bitcoin Traffic Visualization,ToEsExLoMi,2017-01-19 17:52:57,http://btc4me.com/bitcoin/bitcoin-traffic/,https://www.reddit.com/r/dataisbeautiful/comments/5oy1oo/bitcoin_traffic_visualization/,29,29,,1,Bitcoin Traffic Visualization,2017-01-0320.jpg
Favorability of Trump's Cabinet Picks,JMDeutsch,2017-01-19 18:35:51,https://www.graphiq.com/vlp/cXukCJmcto1?data-script-version=true&data-sv=1.1.1&data-index=0&utm_source=viz&utm_medium=viz.referral&utm_campaign=viz.ref&utm_viz_id=cXukCJmcto1&utm_cat=Bar%2FLine%2FArea&utm_click_loc=footer&utm_pubreferrer=s.yimg.com%2Fos%2Fyc%2Fhtml%2Fembed-iframe-min.7f33a83d.html,https://www.reddit.com/r/dataisbeautiful/comments/5oybo6/favorability_of_trumps_cabinet_picks/,6,6,,1,Favorability of Trump's Cabinet Picks,2017-01-0321.jpg
"A Karma Score vs Time graph of ""The official portrait of our President should be the #1 most upvoted post in reddit's history"" post [OC]",RealSchon,2017-01-19 19:24:50,http://i.imgur.com/nPVBiBk.png,https://www.reddit.com/r/dataisbeautiful/comments/5oyn39/a_karma_score_vs_time_graph_of_the_official/,37,37,,8,A Karma Score vs Time graph of The official portrait of our President should be the #1 most upvoted post in reddit's history post OC,2017-01-0322.png
"(Resubmission) The buying power of $1 in 1914 money, seen through the years [OC]",alexgabriel_i,2017-01-19 20:00:07,https://i.redd.it/mkfdw4fk5qay.png,https://www.reddit.com/r/dataisbeautiful/comments/5oyvkc/resubmission_the_buying_power_of_1_in_1914_money/,8,8,,3,"(Resubmission) The buying power of $1 in 1914 money, seen through the years OC",2017-01-0323.png
Text analysis of homeless people's signs,TheRealWa,2017-01-19 20:24:12,https://perplex.city/a-sign-from-below-2d4f12c243f3#.1n1323u7k,https://www.reddit.com/r/dataisbeautiful/comments/5oz1r7/text_analysis_of_homeless_peoples_signs/,97,97,,8,Text analysis of homeless people's signs,2017-01-0324.jpg
This chart shows the age when most people feel the least happy,saul2015,2017-01-19 20:37:24,http://www.businessinsider.com/age-people-are-happiest-2016-5,https://www.reddit.com/r/dataisbeautiful/comments/5oz54s/this_chart_shows_the_age_when_most_people_feel/,22,22,,13,This chart shows the age when most people feel the least happy,2017-01-0325.jpg
Interactive map showing world migration patterns,dancingvandammegif,2017-01-19 21:50:42,http://metrocosm.com/global-migration-map.html,https://www.reddit.com/r/dataisbeautiful/comments/5ozn5a/interactive_map_showing_world_migration_patterns/,18,18,,2,Interactive map showing world migration patterns,2017-01-0326.jpg
The annual temperature cycle from 1880 to 2016,bandor23,2017-01-19 22:27:24,http://climate.nasa.gov/news/2537/nasa-noaa-data-show-2016-warmest-year-on-record-globally/,https://www.reddit.com/r/dataisbeautiful/comments/5ozvn0/the_annual_temperature_cycle_from_1880_to_2016/,8,8,,0,The annual temperature cycle from 1880 to 2016,2017-01-0327.jpg
See for yourself the decline in Arctic sea ice with 37 years of satellite data 4K [OC],kevpluck,2017-01-19 23:04:25,https://www.youtube.com/watch?v=EnVtNcAxWrI,https://www.reddit.com/r/dataisbeautiful/comments/5p03p8/see_for_yourself_the_decline_in_arctic_sea_ice/,3,3,,3,See for yourself the decline in Arctic sea ice with 37 years of satellite data 4K OC,2017-01-0328.jpg
Correlation between Republican votes and higher education [OC],Procrastinator300,2017-01-19 23:09:49,http://imgur.com/nTDeVj0,https://www.reddit.com/r/dataisbeautiful/comments/5p04uk/correlation_between_republican_votes_and_higher/,36,36,,89,Correlation between Republican votes and higher education OC,2017-01-0329.jpg
How America Changed During Barack Obama's Presidency,r_strick,2017-01-19 23:32:42,http://www.pewresearch.org/2017/01/10/how-america-changed-during-barack-obamas-presidency/,https://www.reddit.com/r/dataisbeautiful/comments/5p09pl/how_america_changed_during_barack_obamas/,23,23,,2,How America Changed During Barack Obama's Presidency,2017-01-0330.jpg
A visual representation from the New York Times of all the insults Donald Trump has made since the beginning of his Candidacy.,theUSpopulation,2017-01-20 00:59:50,https://www.nytimes.com/interactive/2016/12/06/upshot/how-to-know-what-donald-trump-really-cares-about-look-at-who-hes-insulting.html?WT.mc_id=2016-KWP-AUD_DEV&WT.mc_ev=click&ad-keywords=AUDDEVREMARK&kwp_0=291418&kwp_4=1144825&kwp_1=525501,https://www.reddit.com/r/dataisbeautiful/comments/5p0rjg/a_visual_representation_from_the_new_york_times/,133,133,,23,A visual representation from the New York Times of all the insults Donald Trump has made since the beginning of his Candidacy.,2017-01-0331.jpg
Chinese Dynasties: 4000+ years of history [OC],datashown,2017-01-20 04:17:34,http://i.imgur.com/unKB9N9.png,https://www.reddit.com/r/dataisbeautiful/comments/5p1sd4/chinese_dynasties_4000_years_of_history_oc/,12625,12625,,994,Chinese Dynasties 4000+ years of history OC,2017-01-0332.png
Interactive graphic: See how your country ranks across seven competitiveness and responsible growth measures,shreya_vajpei,2017-01-20 04:46:04,https://qz.com/877287/interactive-graphic-see-how-your-country-ranks-across-seven-competitiveness-and-responsible-growth-measures/,https://www.reddit.com/r/dataisbeautiful/comments/5p1x6v/interactive_graphic_see_how_your_country_ranks/,3,3,,2,Interactive graphic See how your country ranks across seven competitiveness and responsible growth measures,2017-01-0333.jpg
Commodity Prices and Popular News Stories [OC],wowambored,2017-01-20 11:19:20,https://i.redd.it/1mr1ch1qpuay.png,https://www.reddit.com/r/dataisbeautiful/comments/5p3cnu/commodity_prices_and_popular_news_stories_oc/,4,4,,4,Commodity Prices and Popular News Stories OC,2017-01-0334.png
Drag and compare sizes of countries.,callatista,2017-01-20 15:11:17,http://Thetruesize.com,https://www.reddit.com/r/dataisbeautiful/comments/5p4e8n/drag_and_compare_sizes_of_countries/,1412,1412,,82,Drag and compare sizes of countries.,2017-01-0335.jpg
13 Fans Will Be Arrested If The Steelers Win This Weekend [OC],FritzIronwood,2017-01-20 15:28:08,https://i.redd.it/8ga2jhx2yvay.jpg,https://www.reddit.com/r/dataisbeautiful/comments/5p4hp4/13_fans_will_be_arrested_if_the_steelers_win_this/,12,12,,7,13 Fans Will Be Arrested If The Steelers Win This Weekend OC,2017-01-0336.jpg
Gender Equality and Dialogue in 2016’s Highest Grossing Films,davids_puppies,2017-01-20 16:38:15,https://proquestionasker.github.io/projects/MovieDialogueInteractive/?utm_source=ActiveCampaign&utm_medium=email&utm_content=BDN+%2357+-+conquering+crime+with+ML%2C+data+s+image+issues%2C+unequal+dataviz%2C+%26+more+AI+goodies&utm_campaign=Banana+Data+%2357,https://www.reddit.com/r/dataisbeautiful/comments/5p4wt2/gender_equality_and_dialogue_in_2016s_highest/,18,18,,8,Gender Equality and Dialogue in 2016’s Highest Grossing Films,2017-01-0337.jpg
How Common Is Your County's Name? (x-post r/mapsofamerica),charmcitycuddles,2017-01-20 17:56:40,https://metricmaps.org/2017/01/06/us-county-name-frequency/,https://www.reddit.com/r/dataisbeautiful/comments/5p5fr5/how_common_is_your_countys_name_xpost/,34,34,,3,How Common Is Your County's Name (x-post rmapsofamerica),2017-01-0338.jpg
NBA's most valuable players (+/- stats sum) controlled by team [OC],STNP,2017-01-20 18:23:28,https://i.redd.it/wf0ukf67tway.png,https://www.reddit.com/r/dataisbeautiful/comments/5p5m9g/nbas_most_valuable_players_stats_sum_controlled/,10,10,,3,NBA's most valuable players (+- stats sum) controlled by team OC,2017-01-0339.png
"The NBA season is over ... (no, really!)",kartik_sundar,2017-01-20 21:07:33,http://www.espn.com/espn/feature/story/_/id/18510617/how-nba-standings-never-change-jan-20,https://www.reddit.com/r/dataisbeautiful/comments/5p6m88/the_nba_season_is_over_no_really/,4,4,,3,"The NBA season is over ... (no, really!)",2017-01-0340.jpg
How much do federal taxes redistribute income?,jimrosenz,2017-01-21 01:40:35,http://visualizingeconomics.com/blog/2014/3/12/how-much-do-federal-taxes-redistribute-income,https://www.reddit.com/r/dataisbeautiful/comments/5p82cy/how_much_do_federal_taxes_redistribute_income/,186,186,,34,How much do federal taxes redistribute income,2017-01-0341.jpg
The global race for inventors,jimrosenz,2017-01-21 06:04:50,http://voxeu.org/article/global-race-inventors#.WIL57dCtNFY.reddit,https://www.reddit.com/r/dataisbeautiful/comments/5p97fi/the_global_race_for_inventors/,6,6,,0,The global race for inventors,2017-01-0342.jpg
Netflix Surges in 2016 [OC],profcyclist,2017-01-21 13:15:12,http://www.newsindata.com/home/2017/1/19/netflix-surges-in-2016-comcastnot-so-much,https://www.reddit.com/r/dataisbeautiful/comments/5pakns/netflix_surges_in_2016_oc/,10585,10585,,1200,Netflix Surges in 2016 OC,2017-01-0343.jpg
The U.S. Pays More for Top Drugs Than Other Countries,jimrosenz,2017-01-21 13:45:41,https://www.bloomberg.com/graphics/2015-drug-prices/,https://www.reddit.com/r/dataisbeautiful/comments/5paogz/the_us_pays_more_for_top_drugs_than_other/,807,807,,147,The U.S. Pays More for Top Drugs Than Other Countries,2017-01-0344.jpg
"Catalan Independence support by municipality, language and birthplace [OC]",Merkaartor,2017-01-21 15:45:39,http://imgur.com/a/AVM7u,https://www.reddit.com/r/dataisbeautiful/comments/5pb6fw/catalan_independence_support_by_municipality/,15,15,,5,"Catalan Independence support by municipality, language and birthplace OC",2017-01-0345.jpg
College Football Top 10: 2000 vs. 2016 [OC],flerlagekr,2017-01-21 18:05:40,http://www.kenflerlage.com/2017/01/college-football-top-10-2000-vs-2016.html,https://www.reddit.com/r/dataisbeautiful/comments/5pbwa3/college_football_top_10_2000_vs_2016_oc/,6,6,,1,College Football Top 10 2000 vs. 2016 OC,2017-01-0346.jpg
DC Metro ridership as of 11am for the past 4 inaugurations plus today's Women's March.,pacman529,2017-01-21 18:18:08,https://www.washingtonpost.com/news/dr-gridlock/wp/2017/01/21/the-womens-march-on-washington-heres-what-you-need-to-know/?tid=sm_tw&utm_term=.af354ae98324,https://www.reddit.com/r/dataisbeautiful/comments/5pbyqz/dc_metro_ridership_as_of_11am_for_the_past_4/,13,13,,2,DC Metro ridership as of 11am for the past 4 inaugurations plus today's Women's March.,2017-01-0347.jpg
Visualization of Every Play in the National Championship Game,flerlagekr,2017-01-21 18:29:35,http://sirvizalot.blogspot.com/2017/01/national-championship-2017-clemson-vs.html,https://www.reddit.com/r/dataisbeautiful/comments/5pc11s/visualization_of_every_play_in_the_national/,3,3,,1,Visualization of Every Play in the National Championship Game,2017-01-0348.jpg
Evolutionary Algorithm [OC],shahinrostami,2017-01-21 20:39:32,http://gfycat.com/LightheartedAthleticBlackbear,https://www.reddit.com/r/dataisbeautiful/comments/5pcr08/evolutionary_algorithm_oc/,53,53,,4,Evolutionary Algorithm OC,2017-01-0349.jpg
All meteoroids that have hit earth from 1994-2013,mrmaplebeard,2017-01-21 21:10:29,https://www.google.com/amp/www.universetoday.com/116355/we-are-not-alone-government-sensors-shed-new-light-on-asteroid-hazards/amp/,https://www.reddit.com/r/dataisbeautiful/comments/5pcxae/all_meteoroids_that_have_hit_earth_from_19942013/,17,17,,5,All meteoroids that have hit earth from 1994-2013,2017-01-0350.jpg
US Coins in Current Circulation by Date [OC],BrapTime,2017-01-22 02:16:07,https://imgur.com/gallery/by4ZX,https://www.reddit.com/r/dataisbeautiful/comments/5pejuc/us_coins_in_current_circulation_by_date_oc/,3,3,,7,US Coins in Current Circulation by Date OC,2017-01-0351.jpg
Where millennials work the longest,Madmaxxin,2017-01-22 02:21:09,http://www.forbes.com/sites/niallmccarthy/2016/05/26/where-the-worlds-millennials-work-the-longest-hours-infographic/#3a9c79c86924,https://www.reddit.com/r/dataisbeautiful/comments/5peks9/where_millennials_work_the_longest/,13,13,,6,Where millennials work the longest,2017-01-0352.jpg
Globalization and Poverty,jimrosenz,2017-01-22 09:53:35,http://humanprogress.org/blog/globalization-and-poverty,https://www.reddit.com/r/dataisbeautiful/comments/5pg8ij/globalization_and_poverty/,8,8,,0,Globalization and Poverty,2017-01-0353.jpg
Number of air passengers in the US/EU compared to population 2015 [OC],Handycharts,2017-01-22 10:49:01,http://handycharts.co.uk/charts/Air_passengers.html,https://www.reddit.com/r/dataisbeautiful/comments/5pgdr0/number_of_air_passengers_in_the_useu_compared_to/,3,3,,5,Number of air passengers in the USEU compared to population 2015 OC,2017-01-0354.jpg
The average number of foreign languages taught in European schools,alexgabriel_i,2017-01-22 13:31:43,https://jakubmarian.com/number-of-foreign-languages-studied-per-pupil-in-europe/,https://www.reddit.com/r/dataisbeautiful/comments/5pgx5b/the_average_number_of_foreign_languages_taught_in/,337,337,,105,The average number of foreign languages taught in European schools,2017-01-0355.jpg
Women's rights country by country - interactive | Global development,congalines,2017-01-22 13:47:09,https://www.theguardian.com/global-development/ng-interactive/2014/feb/04/womens-rights-country-by-country-interactive,https://www.reddit.com/r/dataisbeautiful/comments/5pgzgp/womens_rights_country_by_country_interactive/,26,26,,7,Women's rights country by country - interactive Global development,2017-01-0356.jpg
"Ski bum + data viz nerd = dashboard to track 1,410 runs [OC]",mitchtobin,2017-01-22 16:44:08,http://imgur.com/YbWF1F1,https://www.reddit.com/r/dataisbeautiful/comments/5phxxo/ski_bum_data_viz_nerd_dashboard_to_track_1410/,8,8,,2,"Ski bum + data viz nerd = dashboard to track 1,410 runs OC",2017-01-0357.jpg
How income and life expectancy have changed since 1800 (just press play),alexgabriel_i,2017-01-22 16:47:14,https://www.gapminder.org/tools/#_state_entities_select@_geo=usa&trailStartTime=1800;;;;&chart-type=bubbles,https://www.reddit.com/r/dataisbeautiful/comments/5phyok/how_income_and_life_expectancy_have_changed_since/,16,16,,3,How income and life expectancy have changed since 1800 (just press play),2017-01-0358.jpg
