title,author,created_date,url,full_permalink,score,ups,downs,num_comments,sanitized_title,image_file
Counties at Risk of Having No Insurer on the Marketplace (Exchange) in 2018,dr_isk_16,2017-08-22 22:36:24,http://www.kff.org/interactive/counties-at-risk-of-having-no-insurer-on-the-marketplace-exchange-in-2018/,https://www.reddit.com/r/dataisbeautiful/comments/6venmc/counties_at_risk_of_having_no_insurer_on_the/,3,3,,1,Counties at Risk of Having No Insurer on the Marketplace (Exchange) in 2018,2017-08-0364.jpg
"Mapping the most (and least) ""troll-ridden"" places in the US.",airbornesurfer,2017-08-22 23:07:58,https://www.wired.com/2017/08/internet-troll-map,https://www.reddit.com/r/dataisbeautiful/comments/6veujw/mapping_the_most_and_least_trollridden_places_in/,3,3,,3,Mapping the most (and least) troll-ridden places in the US.,2017-08-0365.jpg
"Time saved by speeding for 10 miles & the corresponding speeding fines (Bexar County, TX) [OC]",sdn,2017-08-23 00:51:30,https://i.redd.it/0bm87fe2wdhz.jpg,https://www.reddit.com/r/dataisbeautiful/comments/6vfgti/time_saved_by_speeding_for_10_miles_the/,13471,13471,,1428,"Time saved by speeding for 10 miles & the corresponding speeding fines (Bexar County, TX) OC",2017-08-0366.jpg
One of my Google Summer of Code students made thousands of spectrograms of spoken English diphones (the last half of one phoneme followed by the first half of another),jsalsman,2017-08-23 02:01:42,https://github.com/akreal/diphones/tree/master/data/img/spectrograms,https://www.reddit.com/r/dataisbeautiful/comments/6vfuw6/one_of_my_google_summer_of_code_students_made/,9,9,,2,One of my Google Summer of Code students made thousands of spectrograms of spoken English diphones (the last half of one phoneme followed by the first,2017-08-0367.jpg
"Chart Party: The history of the NFL, 1987-2016",hotelNoiseComplaint,2017-08-23 02:14:51,https://www.sbnation.com/2017/8/22/16181334/chart-party-history-of-nfl,https://www.reddit.com/r/dataisbeautiful/comments/6vfxm6/chart_party_the_history_of_the_nfl_19872016/,17,17,,1,"Chart Party The history of the NFL, 1987-2016",2017-08-0368.jpg
"Lack of sex in last 12 months by marital status, income, ethnicity and other demographic factors [OC]",academiaadvice,2017-08-23 05:02:54,https://i.redd.it/72zofqai6fhz.png,https://www.reddit.com/r/dataisbeautiful/comments/6vgson/lack_of_sex_in_last_12_months_by_marital_status/,193,193,,35,"Lack of sex in last 12 months by marital status, income, ethnicity and other demographic factors OC",2017-08-0369.png
Temperature and illuminance during total eclipse [OC],rootoftrust,2017-08-23 06:36:17,https://i.redd.it/eq8lfg81nfhz.jpg,https://www.reddit.com/r/dataisbeautiful/comments/6vh72d/temperature_and_illuminance_during_total_eclipse/,27,27,,11,Temperature and illuminance during total eclipse OC,2017-08-0370.jpg
What #eclipse2017 looked like across the country,kubaB24,2017-08-23 08:27:33,https://www.washingtonpost.com/graphics/2017/national/health-science/eclipse-2017-instagram/?utm_term=.372d07eced31,https://www.reddit.com/r/dataisbeautiful/comments/6vhm1b/what_eclipse2017_looked_like_across_the_country/,6,6,,0,What #eclipse2017 looked like across the country,2017-08-0371.jpg
What is the real value of US$100 in metropolitan areas?,Pelusteriano,2017-08-23 09:16:53,https://taxfoundation.org/real-value-100-metro-2017/,https://www.reddit.com/r/dataisbeautiful/comments/6vhsie/what_is_the_real_value_of_us100_in_metropolitan/,36,36,,4,What is the real value of US$100 in metropolitan areas,2017-08-0372.jpg
The World Resources Institute posted 6 charts that visualize greenhouse gas emissions by U.S. states,ogie381,2017-08-23 10:32:37,http://www.wri.org/blog/2017/08/6-charts-understand-us-state-greenhouse-gas-emissions?utm_campaign=wridigest&utm_source=wridigest-2017-08-15&utm_medium=email&utm_content=title,https://www.reddit.com/r/dataisbeautiful/comments/6vi3b3/the_world_resources_institute_posted_6_charts/,8,8,,3,The World Resources Institute posted 6 charts that visualize greenhouse gas emissions by U.S. states,2017-08-0373.jpg
How long ago was the United States as rich as other countries around the world are today? [OC],usrname42,2017-08-23 11:30:03,https://i.imgur.com/6jhJXlb.png,https://www.reddit.com/r/dataisbeautiful/comments/6vic72/how_long_ago_was_the_united_states_as_rich_as/,123,123,,29,How long ago was the United States as rich as other countries around the world are today OC,2017-08-0374.png
Top used emojis on Instagram,GemmaJ123,2017-08-23 12:23:37,https://www.quintly.com/blog/2017/01/instagram-emoji-study-higher-interactions/,https://www.reddit.com/r/dataisbeautiful/comments/6vilhp/top_used_emojis_on_instagram/,0,0,,1,Top used emojis on Instagram,2017-08-0375.jpg
What state has the most single person households? [OC],OverflowDs,2017-08-23 12:25:30,http://overflow.solutions/demographic-data/national-data/state-level-analysis/what-state-has-the-most-single-person-households/,https://www.reddit.com/r/dataisbeautiful/comments/6viluq/what_state_has_the_most_single_person_households/,19,19,,7,What state has the most single person households OC,2017-08-0376.jpg
Added/Removed friends on facebook over time [OC],kuehl_,2017-08-23 13:41:31,http://i.imgur.com/wjMhumZ.png,https://www.reddit.com/r/dataisbeautiful/comments/6vj13w/addedremoved_friends_on_facebook_over_time_oc/,72,72,,21,AddedRemoved friends on facebook over time OC,2017-08-0377.png
Alaska’s Permafrost Is Thawing - The New York Times,pipsdontsqueak,2017-08-23 14:01:33,https://www.nytimes.com/interactive/2017/08/23/climate/100000005375594.app.html?_r=0&GLS=1503496899%7CZRFLCl0AkepRbywoK2p6kNRt1sgkMnFSdycLouMM6W0%3D,https://www.reddit.com/r/dataisbeautiful/comments/6vj5dn/alaskas_permafrost_is_thawing_the_new_york_times/,22,22,,2,Alaska’s Permafrost Is Thawing - The New York Times,2017-08-0378.jpg
Church fires in Norway by decade and cause [OC],Belteshassar,2017-08-23 19:28:27,https://i.redd.it/gpat74clgjhz.png,https://www.reddit.com/r/dataisbeautiful/comments/6vld4e/church_fires_in_norway_by_decade_and_cause_oc/,132,132,,20,Church fires in Norway by decade and cause OC,2017-08-0379.png
"Each week for the last few months, I bought 3 Powerball tickets for $6 and invested $6 into a Robo-Advisor App to compare return on investment [OC]",AceTrainer_Li-Wang,2017-08-23 20:13:22,https://i.redd.it/83lzi108njhz.png,https://www.reddit.com/r/dataisbeautiful/comments/6vlo5s/each_week_for_the_last_few_months_i_bought_3/,29747,29747,,1524,"Each week for the last few months, I bought 3 Powerball tickets for $6 and invested $6 into a Robo-Advisor App to compare return on investment OC",2017-08-0380.png
‘It’s a Slow Death’: The World’s Worst Humanitarian Crisis,pipsdontsqueak,2017-08-23 21:01:54,https://www.nytimes.com/interactive/2017/08/23/world/middleeast/yemen-cholera-humanitarian-crisis.html?_r=0,https://www.reddit.com/r/dataisbeautiful/comments/6vlzx5/its_a_slow_death_the_worlds_worst_humanitarian/,5,5,,0,‘It’s a Slow Death’ The World’s Worst Humanitarian Crisis,2017-08-0381.jpg
Roboinvesting vs Lottery (fixed) [OC],nhgrif,2017-08-24 00:12:08,http://i.imgur.com/z8djsQn.png,https://www.reddit.com/r/dataisbeautiful/comments/6vn5py/roboinvesting_vs_lottery_fixed_oc/,101,101,,32,Roboinvesting vs Lottery (fixed) OC,2017-08-0382.png
"Temperature Sensor During the Eclipse (Athens, TN) [OC]",jbodie7,2017-08-24 01:39:33,https://i.redd.it/1w01szpwalhz.png,https://www.reddit.com/r/dataisbeautiful/comments/6vnno2/temperature_sensor_during_the_eclipse_athens_tn_oc/,7,7,,2,"Temperature Sensor During the Eclipse (Athens, TN) OC",2017-08-0383.png
"Average movie length by country (source: IMDB, of course)[OC]",potato_pototo,2017-08-24 02:23:35,https://i.redd.it/s5ncs0hvilhz.png,https://www.reddit.com/r/dataisbeautiful/comments/6vnwa9/average_movie_length_by_country_source_imdb_of/,114,114,,18,"Average movie length by country (source IMDB, of course)OC",2017-08-0384.png
Suburbs of Melbourne by country of birth other than Australia,l33t_sas,2017-08-24 03:57:33,https://fairfax-data.carto.com/viz/bdcb4dce-42b0-4234-a797-12b9672ec1d1/public_map,https://www.reddit.com/r/dataisbeautiful/comments/6vodkw/suburbs_of_melbourne_by_country_of_birth_other/,13,13,,6,Suburbs of Melbourne by country of birth other than Australia,2017-08-0385.jpg
Visualisation of all 2559 direct candidates of the German federal election [OC],moklick,2017-08-24 08:45:46,https://interaktiv.morgenpost.de/kandidaten-bundestagswahl-2017/,https://www.reddit.com/r/dataisbeautiful/comments/6vpk6w/visualisation_of_all_2559_direct_candidates_of/,7,7,,2,Visualisation of all 2559 direct candidates of the German federal election OC,2017-08-0386.jpg
"Karma date for posts submitted to r/gofundme tools used openoffice exel , open office Draw to export it as a jpeg [OC]",squarecoinman,2017-08-24 09:02:43,https://i.redd.it/krucrh7ognhz.jpg,https://www.reddit.com/r/dataisbeautiful/comments/6vpme4/karma_date_for_posts_submitted_to_rgofundme_tools/,2,2,,6,"Karma date for posts submitted to rgofundme tools used openoffice exel , open office Draw to export it as a jpeg OC",2017-08-0387.jpg
All the roads and nothing but the roads [OC],Tjukanov,2017-08-24 09:11:20,https://i.redd.it/fziffv2qjnhz.jpg,https://www.reddit.com/r/dataisbeautiful/comments/6vpnkp/all_the_roads_and_nothing_but_the_roads_oc/,1706,1706,,113,All the roads and nothing but the roads OC,2017-08-0388.jpg
UK Milk Prices - farmgate price (pence per litre) since November 1994 [OC],TheFlyingMunkey,2017-08-24 11:21:01,https://i.redd.it/vxx2alcu6ohz.png,https://www.reddit.com/r/dataisbeautiful/comments/6vq6gd/uk_milk_prices_farmgate_price_pence_per_litre/,4,4,,3,UK Milk Prices - farmgate price (pence per litre) since November 1994 OC,2017-08-0389.png
"US gender wage gap at 10th, 50th and 90th percentile since 1973 [OC]",jimrosenz,2017-08-24 11:45:17,https://utopiayouarestandinginit.com/2015/10/21/us-gender-wage-gap-at-10th-50th-and-90th-percentile/,https://www.reddit.com/r/dataisbeautiful/comments/6vqalk/us_gender_wage_gap_at_10th_50th_and_90th/,4,4,,2,"US gender wage gap at 10th, 50th and 90th percentile since 1973 OC",2017-08-0390.jpg
Presidents of the United States by Party [OC],datashown,2017-08-24 12:02:59,https://i.redd.it/cdv469daeohz.png,https://www.reddit.com/r/dataisbeautiful/comments/6vqdym/presidents_of_the_united_states_by_party_oc/,62,62,,26,Presidents of the United States by Party OC,2017-08-0391.png
How Much Climate Change Will Cost Each U.S. County,OverflowDs,2017-08-24 12:13:42,http://www.governing.com/topics/transportation-infrastructure/gov-counties-climate-change-damages-economic-effects-map.html,https://www.reddit.com/r/dataisbeautiful/comments/6vqfvd/how_much_climate_change_will_cost_each_us_county/,3,3,,0,How Much Climate Change Will Cost Each U.S. County,2017-08-0392.jpg
Mapping the sentiment of tweets during a soccer game as goals for each side are scored,GemmaJ123,2017-08-24 12:30:30,https://www.brandwatch.com/blog/react-soccer-data/?utm_source=reddit&utm_medium=react&utm_term=blog&utm_campaign=08_2017_marketing_blog,https://www.reddit.com/r/dataisbeautiful/comments/6vqiwn/mapping_the_sentiment_of_tweets_during_a_soccer/,0,0,,0,Mapping the sentiment of tweets during a soccer game as goals for each side are scored,2017-08-0393.jpg
This is How Canada Talks (A Series of Maps),Kiereek,2017-08-24 13:21:48,http://www.the10and3.com/this-is-how-canada-talks/,https://www.reddit.com/r/dataisbeautiful/comments/6vqsz4/this_is_how_canada_talks_a_series_of_maps/,24,24,,7,This is How Canada Talks (A Series of Maps),2017-08-0394.jpg
We analyzed 17 months of Fox & Friends transcripts. It’s far weirder than state-run media.,MyNameIsStevenE,2017-08-24 13:45:23,https://www.vox.com/2017/8/7/16083122/breakfast-club-fox-and-friends,https://www.reddit.com/r/dataisbeautiful/comments/6vqxun/we_analyzed_17_months_of_fox_friends_transcripts/,9,9,,3,We analyzed 17 months of Fox & Friends transcripts. It’s far weirder than state-run media.,2017-08-0395.jpg
Can Trump control the media with Negative Tweets? [OC],sgreen_datascientist,2017-08-24 13:58:37,http://greenanalytics.us/Data.Stories/Tweet.Trumps/tweet.trumps.html,https://www.reddit.com/r/dataisbeautiful/comments/6vr0jx/can_trump_control_the_media_with_negative_tweets/,0,0,,2,Can Trump control the media with Negative Tweets OC,2017-08-0396.jpg
Examining FiveThirtyEight's Soccer Power Index Scores [OC],j_yazman,2017-08-24 14:17:54,https://i.redd.it/0w9n88wc2phz.png,https://www.reddit.com/r/dataisbeautiful/comments/6vr4yx/examining_fivethirtyeights_soccer_power_index/,8,8,,3,Examining FiveThirtyEight's Soccer Power Index Scores OC,2017-08-0397.png
"Data Scientist, @conspirator0, looks into Twitter bots and finds interesting results relating to Trump, Russia, and Brexit",MassimoOsti,2017-08-24 15:20:56,https://twitter.com/conspirator0/status/900158823515770880,https://www.reddit.com/r/dataisbeautiful/comments/6vrje1/data_scientist_conspirator0_looks_into_twitter/,19,19,,0,"Data Scientist, @conspirator0, looks into Twitter bots and finds interesting results relating to Trump, Russia, and Brexit",2017-08-0398.jpg
There are more than 140 attempts to access porn and other inappropriate content within the average enterprise every single day.,liarnalaporta,2017-08-24 15:45:28,https://www.wandera.com/blog/inappropriate-mobile-activity/,https://www.reddit.com/r/dataisbeautiful/comments/6vrpcj/there_are_more_than_140_attempts_to_access_porn/,6,6,,3,There are more than 140 attempts to access porn and other inappropriate content within the average enterprise every single day.,2017-08-0399.jpg
Careers with the highest proportion of men and careers with the highest proportion of women [OC],academiaadvice,2017-08-24 16:29:01,https://i.redd.it/mlru2wsvpphz.jpg,https://www.reddit.com/r/dataisbeautiful/comments/6vs02v/careers_with_the_highest_proportion_of_men_and/,124,124,,73,Careers with the highest proportion of men and careers with the highest proportion of women OC,2017-08-0400.jpg
Analyzing Top 20k Github Repositories,sidi09,2017-08-24 17:55:30,https://medium.appbase.io/analyzing-20k-github-repositories-af76de21c3fc,https://www.reddit.com/r/dataisbeautiful/comments/6vsl0u/analyzing_top_20k_github_repositories/,6,6,,0,Analyzing Top 20k Github Repositories,2017-08-0401.jpg
365 days of Trump’s claims,tebriel,2017-08-24 18:08:50,https://www.washingtonpost.com/graphics/politics/trump-claims-database/?utm_term=.11ff753fa356,https://www.reddit.com/r/dataisbeautiful/comments/6vsoct/365_days_of_trumps_claims/,6,6,,2,365 days of Trump’s claims,2017-08-0402.jpg
Game of Throne color analysis. (Scroll down to end of page),devsansfrontiers,2017-08-24 18:12:20,https://www.vox.com/culture/2017/8/24/16162814/game-of-thrones-color-spectrum,https://www.reddit.com/r/dataisbeautiful/comments/6vsp6l/game_of_throne_color_analysis_scroll_down_to_end/,8,8,,0,Game of Throne color analysis. (Scroll down to end of page),2017-08-0403.jpg
[OC] Knight Tournament Simulator league placement by Age & Ability,Pyrollamas,2017-08-24 18:18:06,https://i.redd.it/wtioj0pc9qhz.jpg,https://www.reddit.com/r/dataisbeautiful/comments/6vsqle/oc_knight_tournament_simulator_league_placement/,2,2,,2,OC Knight Tournament Simulator league placement by Age & Ability,2017-08-0404.jpg
Classroom Participation in Online Classes [OC],hinzee,2017-08-24 18:29:26,http://nodatesjustdata.com/ParticipationRetention.html,https://www.reddit.com/r/dataisbeautiful/comments/6vstcn/classroom_participation_in_online_classes_oc/,6,6,,3,Classroom Participation in Online Classes OC,2017-08-0405.jpg
"Air temperature in path of totality during Solar Eclipse in Hartsville, TN [OC]",aparis1983,2017-08-24 19:26:04,https://i.redd.it/wzjkyaahlqhz.jpg,https://www.reddit.com/r/dataisbeautiful/comments/6vt72z/air_temperature_in_path_of_totality_during_solar/,144,144,,8,"Air temperature in path of totality during Solar Eclipse in Hartsville, TN OC",2017-08-0406.jpg
"Trump Approval Changes Over Time, by Party Identification [OC]",DijonPepperberry,2017-08-24 19:36:52,http://imgur.com/a/MtWG0,https://www.reddit.com/r/dataisbeautiful/comments/6vt9n3/trump_approval_changes_over_time_by_party/,4,4,,2,"Trump Approval Changes Over Time, by Party Identification OC",2017-08-0407.jpg
Most frequent paths of chess pieces giving mate [OC],VIII8,2017-08-24 20:28:56,https://i.redd.it/nd26yhalwqhz.png,https://www.reddit.com/r/dataisbeautiful/comments/6vtmbr/most_frequent_paths_of_chess_pieces_giving_mate_oc/,37,37,,15,Most frequent paths of chess pieces giving mate OC,2017-08-0408.png
The Shape of Happiness: The Relationship Between Happiness and Age in seven major surveys.,circuitloss,2017-08-24 20:45:59,https://www.washingtonpost.com/news/wonk/wp/2017/08/24/under-50-you-still-havent-hit-rock-bottom-happiness-wise/?hpid=hp_hp-more-top-stories-2_happiness-150p%3Ahomepage%2Fstory,https://www.reddit.com/r/dataisbeautiful/comments/6vtqis/the_shape_of_happiness_the_relationship_between/,6,6,,2,The Shape of Happiness The Relationship Between Happiness and Age in seven major surveys.,2017-08-0409.jpg
Popular presidential approval/disapproval tracking polls - 2017 [OC],SupaFurry,2017-08-24 21:23:51,https://i.redd.it/058132cg6rhz.png,https://www.reddit.com/r/dataisbeautiful/comments/6vtzof/popular_presidential_approvaldisapproval_tracking/,25,25,,3,Popular presidential approvaldisapproval tracking polls - 2017 OC,2017-08-0410.png
Size of US states by their economy and color coded by their growth,northca,2017-08-24 22:53:42,https://howmuch.net/articles/the-current-state-of-usa-economy,https://www.reddit.com/r/dataisbeautiful/comments/6vujd2/size_of_us_states_by_their_economy_and_color/,128,128,,10,Size of US states by their economy and color coded by their growth,2017-08-0411.jpg
Variations in word usage throughout Australia,snkn179,2017-08-25 02:10:31,https://lingroadshow.com/resources/englishes-in-australia/vocabulary/mapping-words-around-australia/,https://www.reddit.com/r/dataisbeautiful/comments/6vvm20/variations_in_word_usage_throughout_australia/,22,22,,8,Variations in word usage throughout Australia,2017-08-0412.jpg
66k Citi Bike trips from a single day in June [OC],rolyatmax,2017-08-25 02:44:02,https://tbaldw.in/citibike-trips,https://www.reddit.com/r/dataisbeautiful/comments/6vvs57/66k_citi_bike_trips_from_a_single_day_in_june_oc/,3,3,,2,66k Citi Bike trips from a single day in June OC,2017-08-0413.jpg
"Mapping Free Speech Tensions on College Campuses, 2015-2017 [OC]",deisde1,2017-08-25 03:25:02,http://arcg.is/1jCGWW,https://www.reddit.com/r/dataisbeautiful/comments/6vvzjt/mapping_free_speech_tensions_on_college_campuses/,3,3,,2,"Mapping Free Speech Tensions on College Campuses, 2015-2017 OC",2017-08-0414.jpg
Streams of ‘Total Eclipse of the Heart’ Followed the Eclipse,AllSparks,2017-08-25 08:23:01,https://insights.spotify.com/int/2017/08/24/data-viz-total-eclipse-of-the-heart-follows-the-eclipse/,https://www.reddit.com/r/dataisbeautiful/comments/6vx5zq/streams_of_total_eclipse_of_the_heart_followed/,8479,8479,,332,Streams of ‘Total Eclipse of the Heart’ Followed the Eclipse,2017-08-0415.jpg
A quick histogram of the reply times for /u/poem_for_your_sprog [OC],zonination,2017-08-25 12:12:09,http://i.imgur.com/bVFqvl8.png,https://www.reddit.com/r/dataisbeautiful/comments/6vy0yc/a_quick_histogram_of_the_reply_times_for_upoem/,9,9,,5,A quick histogram of the reply times for upoem_for_your_sprog OC,2017-08-0416.png
The probabilities of landing on different places in Monopoly [OC],SahilThePotato,2017-08-25 12:13:48,https://i.redd.it/72oro9dykvhz.png,https://www.reddit.com/r/dataisbeautiful/comments/6vy18w/the_probabilities_of_landing_on_different_places/,301,301,,62,The probabilities of landing on different places in Monopoly OC,2017-08-0417.png
Amazon's explosive growth in revenue [OC],datashown,2017-08-25 13:17:03,https://i.redd.it/6appscthwvhz.png,https://www.reddit.com/r/dataisbeautiful/comments/6vycov/amazons_explosive_growth_in_revenue_oc/,46,46,,8,Amazon's explosive growth in revenue OC,2017-08-0418.png
windy.com,magenta_placenta,2017-08-25 13:34:19,https://www.windy.com/,https://www.reddit.com/r/dataisbeautiful/comments/6vygbn/windycom/,8,8,,0,windy.com,2017-08-0419.jpg
Annual price (£) per tonne of seafood species estimated from UK Sea Fisheries Annual Statistics 2008-2015 [OC],TheFlyingMunkey,2017-08-25 13:54:39,https://i.redd.it/wtzta4t83whz.png,https://www.reddit.com/r/dataisbeautiful/comments/6vykwz/annual_price_per_tonne_of_seafood_species/,6,6,,3,Annual price (£) per tonne of seafood species estimated from UK Sea Fisheries Annual Statistics 2008-2015 OC,2017-08-0420.png
"I redid my ""Perceptions of Probability and Numbers"" as a joyplot [OC]",zonination,2017-08-25 14:30:01,http://imgur.com/a/M6Do6,https://www.reddit.com/r/dataisbeautiful/comments/6vythg/i_redid_my_perceptions_of_probability_and_numbers/,192,192,,18,I redid my Perceptions of Probability and Numbers as a joyplot OC,2017-08-0421.jpg
Price of a natural diamond versus a lab-created one,eritreagold,2017-08-25 18:16:36,http://www.paulzimnisky.com/natural-versus-lab-created-diamond-price-chart,https://www.reddit.com/r/dataisbeautiful/comments/6w0a35/price_of_a_natural_diamond_versus_a_labcreated_one/,5,5,,0,Price of a natural diamond versus a lab-created one,2017-08-0422.jpg
"Homicide Rate US, CA, and Europe Compared [OC]",Kallipoliz,2017-08-25 18:17:12,http://i.imgur.com/8D30K8o.jpg,https://www.reddit.com/r/dataisbeautiful/comments/6w0a7v/homicide_rate_us_ca_and_europe_compared_oc/,324,324,,82,"Homicide Rate US, CA, and Europe Compared OC",2017-08-0423.jpg
"Even With Affirmative Action, Blacks and Hispanics Are More Underrepresented at Top Colleges Than 35 Years Ago [OC]",1wheel,2017-08-25 18:33:41,https://www.nytimes.com/interactive/2017/08/24/us/affirmative-action.html,https://www.reddit.com/r/dataisbeautiful/comments/6w0e9z/even_with_affirmative_action_blacks_and_hispanics/,43,43,,19,"Even With Affirmative Action, Blacks and Hispanics Are More Underrepresented at Top Colleges Than 35 Years Ago OC",2017-08-0424.jpg
4 Months of Beer Ratings on Untappd [OC],thetzeng,2017-08-25 18:45:48,https://i.redd.it/3g9iwiq4jxhz.png,https://www.reddit.com/r/dataisbeautiful/comments/6w0h4e/4_months_of_beer_ratings_on_untappd_oc/,18,18,,6,4 Months of Beer Ratings on Untappd OC,2017-08-0425.png
America's Prescription Drug Problem,samuelgfbaker,2017-08-25 19:28:06,https://www.consumerreports.org/prescription-drugs/too-many-meds-americas-love-affair-with-prescription-medication/,https://www.reddit.com/r/dataisbeautiful/comments/6w0qy6/americas_prescription_drug_problem/,0,0,,2,America's Prescription Drug Problem,2017-08-0426.jpg
Number of vehicle license plates by each country sighted during a 4 hour trip across northern Greece. (August 2017) [OC],grego8324,2017-08-25 19:41:06,https://i.redd.it/1v4nec2ysxhz.png,https://www.reddit.com/r/dataisbeautiful/comments/6w0tsy/number_of_vehicle_license_plates_by_each_country/,27,27,,4,Number of vehicle license plates by each country sighted during a 4 hour trip across northern Greece. (August 2017) OC,2017-08-0427.png
Everything You Needed to Know About Overvalued Unicorns in One Chart,bdelveaux,2017-08-25 20:56:55,http://fortune.com/2017/08/24/unicorn-overvalued-tech-bubble/,https://www.reddit.com/r/dataisbeautiful/comments/6w1b1o/everything_you_needed_to_know_about_overvalued/,3,3,,0,Everything You Needed to Know About Overvalued Unicorns in One Chart,2017-08-0428.jpg
The speed of my wifi correlates with the number of antennas I attach to my desktop wifi card ASUS PCE- AC88) [OC],textisaac,2017-08-25 23:30:10,https://i.redd.it/ygg1mozkxyhz.png,https://www.reddit.com/r/dataisbeautiful/comments/6w278c/the_speed_of_my_wifi_correlates_with_the_number/,7819,7819,,360,The speed of my wifi correlates with the number of antennas I attach to my desktop wifi card ASUS PCE- AC88) OC,2017-08-0429.png
Flag Colors of Sovereign States [OC],100pct_Linda,2017-08-25 23:38:52,https://i.redd.it/tgkssi07zyhz.png,https://www.reddit.com/r/dataisbeautiful/comments/6w28xr/flag_colors_of_sovereign_states_oc/,36,36,,10,Flag Colors of Sovereign States OC,2017-08-0430.png
When is the Swift programming language developed? [OC],nhgrif,2017-08-26 00:16:32,https://docs.google.com/spreadsheets/d/1nwB_odL5DQ6Zh-HC3uiF06Utjs2Bk792imXcATOeHlE/edit?usp=sharing,https://www.reddit.com/r/dataisbeautiful/comments/6w2g83/when_is_the_swift_programming_language_developed/,2,2,,2,When is the Swift programming language developed OC,2017-08-0431.jpg
The United States of Airports,flerlagekr,2017-08-26 00:23:52,https://public.tableau.com/views/TheUnitedStatesofAirports/USIntl_Airports?:embed=y&:display_count=yes,https://www.reddit.com/r/dataisbeautiful/comments/6w2hpb/the_united_states_of_airports/,16,16,,3,The United States of Airports,2017-08-0432.jpg
What you really want: Time Saved versus Speed [OC],pageboysam,2017-08-26 00:55:04,http://i.imgur.com/gM62iZl.png,https://www.reddit.com/r/dataisbeautiful/comments/6w2nkv/what_you_really_want_time_saved_versus_speed_oc/,1819,1819,,182,What you really want Time Saved versus Speed OC,2017-08-0433.png
Tropical Cyclones in the Atlantic Ocean (1958-2017) [OC],Mako18,2017-08-26 00:58:50,https://i.redd.it/swyha0qidzhz.png,https://www.reddit.com/r/dataisbeautiful/comments/6w2o9m/tropical_cyclones_in_the_atlantic_ocean_19582017/,13,13,,4,Tropical Cyclones in the Atlantic Ocean (1958-2017) OC,2017-08-0434.png
The world is an altogether scary place- but good wins out.,Cddye,2017-08-26 01:07:43,https://ourworldindata.org/slides/war-and-violence/#/15,https://www.reddit.com/r/dataisbeautiful/comments/6w2pzp/the_world_is_an_altogether_scary_place_but_good/,7,7,,3,The world is an altogether scary place- but good wins out.,2017-08-0435.jpg
