title,author,created_date,url,full_permalink,score,ups,downs,num_comments,sanitized_title,image_file
Odds on Each Score Outcome for Alabama vs. Clemson in the CFB Championship,ManWarrior,2017-01-09 18:18:30,https://quantitativeperspective.wordpress.com/2017/01/07/what-did-we-learn-from-the-cfb-bowl-games-so-far/,https://www.reddit.com/r/dataisbeautiful/comments/5mzagn/odds_on_each_score_outcome_for_alabama_vs_clemson/,1,1,,1,Odds on Each Score Outcome for Alabama vs. Clemson in the CFB Championship,2017-01-0144.jpg
Joining in on the map thing that's going on • Counties in the UK I've visited and travelled through [OC],GwenTheWelshGal,2017-01-09 18:29:03,https://i.redd.it/qoufmvt3cq8y.png,https://www.reddit.com/r/dataisbeautiful/comments/5mzcsr/joining_in_on_the_map_thing_thats_going_on/,3,3,,4,Joining in on the map thing that's going on • Counties in the UK I've visited and travelled through OC,2017-01-0145.png
How many times was your street plowed? [OC],schwanksta,2017-01-09 19:11:57,http://schwanksta.com/maps/nyc-plow-map-0107,https://www.reddit.com/r/dataisbeautiful/comments/5mzmlu/how_many_times_was_your_street_plowed_oc/,7,7,,4,How many times was your street plowed OC,2017-01-0146.jpg
Analysis of a public OKCupid profile dataset: words used in essays [OC],ag_at_idsia,2017-01-09 20:11:23,http://imgur.com/a/m8Vd8,https://www.reddit.com/r/dataisbeautiful/comments/5n008b/analysis_of_a_public_okcupid_profile_dataset/,6,6,,2,Analysis of a public OKCupid profile dataset words used in essays OC,2017-01-0147.jpg
"Odell Beckham’s Hands Are Great, But His Feet Are Lethal",Vizual-Statistix,2017-01-09 22:52:23,http://www.nytimes.com/interactive/2017/01/08/sports/football/odell-beckham-giants-yards-after-catch.html?_r=2,https://www.reddit.com/r/dataisbeautiful/comments/5n10t6/odell_beckhams_hands_are_great_but_his_feet_are/,3,3,,2,"Odell Beckham’s Hands Are Great, But His Feet Are Lethal",2017-01-0148.jpg
Spanish GDP since 1850 | Franco's Spain looked a lot like Singapore today,69_tcrackcrack,2017-01-09 23:17:05,https://notesonliberty.com/2016/12/23/spanish-gdp-since-1850/,https://www.reddit.com/r/dataisbeautiful/comments/5n1689/spanish_gdp_since_1850_francos_spain_looked_a_lot/,10,10,,0,Spanish GDP since 1850 Franco's Spain looked a lot like Singapore today,2017-01-0149.jpg
"Spectrogram of a piano composition, you can see the different musical notes [OC]",SEND_ME_YOUR_FFT,2017-01-09 23:18:03,https://i.redd.it/3eeticjwrr8y.png,https://www.reddit.com/r/dataisbeautiful/comments/5n16gp/spectrogram_of_a_piano_composition_you_can_see/,97,97,,7,"Spectrogram of a piano composition, you can see the different musical notes OC",2017-01-0150.png
"I created an interactive social network graph of all the philosophers in Wikipedia, charting who influenced whom and including filters for different branches of philosophy [OC]",GOliveira18,2017-01-09 23:41:34,https://oliveiradata.com/2017/01/09/social-network-visualization-a-history-of-philosophy/,https://www.reddit.com/r/dataisbeautiful/comments/5n1bri/i_created_an_interactive_social_network_graph_of/,25,25,,2,"I created an interactive social network graph of all the philosophers in Wikipedia, charting who influenced whom and including filters for different b",2017-01-0151.jpg
Places I've been and lived etc. [OC],PartiallyRibena,2017-01-10 02:36:08,https://i.redd.it/wjw9gb17rs8y.png,https://www.reddit.com/r/dataisbeautiful/comments/5n2be5/places_ive_been_and_lived_etc_oc/,13,13,,7,Places I've been and lived etc. OC,2017-01-0152.png
Yearly temp cycle for my hometown from 20 years of data [OC],imagine449,2017-01-10 04:58:26,https://i.redd.it/ifkuv1qlgt8y.jpg,https://www.reddit.com/r/dataisbeautiful/comments/5n326p/yearly_temp_cycle_for_my_hometown_from_20_years/,22,22,,1,Yearly temp cycle for my hometown from 20 years of data OC,2017-01-0153.jpg
"UK Panel Show Gender Breakdown: out of 12,000+ panel show episodes since 1967, only 18.5% of comedy panelists have been female - it's 48.6% female for non-comedy panel shows [x-post r/panelshow]",kangerluswag,2017-01-10 10:55:58,http://strudel.org.uk/panelshows/index.html,https://www.reddit.com/r/dataisbeautiful/comments/5n4f0h/uk_panel_show_gender_breakdown_out_of_12000_panel/,0,0,,4,"UK Panel Show Gender Breakdown out of 12,000+ panel show episodes since 1967, only 18.5% of comedy panelists have been female - it's 48.6% female for",2017-01-0154.jpg
Visualizing the US Drug Crisis [OC],flerlagekr,2017-01-10 11:45:59,http://www.kenflerlage.com/2016/09/visualizing-us-drug-epidemic.html?m=1,https://www.reddit.com/r/dataisbeautiful/comments/5n4ldg/visualizing_the_us_drug_crisis_oc/,108,108,,39,Visualizing the US Drug Crisis OC,2017-01-0155.jpg
Worldwide Human Sex Ratio,iturki27,2017-01-10 13:24:10,http://chartsbin.com/view/2337,https://www.reddit.com/r/dataisbeautiful/comments/5n508h/worldwide_human_sex_ratio/,5990,5990,,1697,Worldwide Human Sex Ratio,2017-01-0156.jpg
Weekly U.S. Influenza Surveillance Report | Seasonal Influenza (Flu),Seventytvvo,2017-01-10 14:09:52,https://www.cdc.gov/flu/weekly/,https://www.reddit.com/r/dataisbeautiful/comments/5n57we/weekly_us_influenza_surveillance_report_seasonal/,1,1,,0,Weekly U.S. Influenza Surveillance Report Seasonal Influenza (Flu),2017-01-0157.jpg
Who is Poor in the United States,jimrosenz,2017-01-10 15:10:43,http://www.hamiltonproject.org/blog/an_update_on_who_is_poor_in_the_united_states1,https://www.reddit.com/r/dataisbeautiful/comments/5n5j0r/who_is_poor_in_the_united_states/,4,4,,2,Who is Poor in the United States,2017-01-0158.jpg
Daily chart: Can tuna prices predict Japan’s GDP growth?,fencerman,2017-01-10 15:23:07,http://www.economist.com/blogs/graphicdetail/2017/01/daily-chart-9,https://www.reddit.com/r/dataisbeautiful/comments/5n5l96/daily_chart_can_tuna_prices_predict_japans_gdp/,15,15,,4,Daily chart Can tuna prices predict Japan’s GDP growth,2017-01-0159.jpg
Sex Ratio of Each State and County in the Continental U.S. [OC],OverflowDs,2017-01-10 15:48:21,https://i.redd.it/ra3lvmelow8y.png,https://www.reddit.com/r/dataisbeautiful/comments/5n5qcb/sex_ratio_of_each_state_and_county_in_the/,79,79,,25,Sex Ratio of Each State and County in the Continental U.S. OC,2017-01-0160.png
The number of pesticides detected on various fruits and vegetables [OC],Vizual-Statistix,2017-01-10 17:41:42,http://vizual-statistix.tumblr.com/post/155678405761/every-year-the-usdas-pesticide-data-program,https://www.reddit.com/r/dataisbeautiful/comments/5n6ez6/the_number_of_pesticides_detected_on_various/,6,6,,10,The number of pesticides detected on various fruits and vegetables OC,2017-01-0161.jpg
I counted the number of times I sneezed in 2016 (1359) [OC],poop_de_poop,2017-01-10 18:08:51,https://i.redd.it/bwnf8r3ldx8y.jpg,https://www.reddit.com/r/dataisbeautiful/comments/5n6l0r/i_counted_the_number_of_times_i_sneezed_in_2016/,1694,1694,,133,I counted the number of times I sneezed in 2016 (1359) OC,2017-01-0162.jpg
"POLL: Only 49% of Black Americans think race relations in the U.S. are good, down from 61% in 2008",ChroniclyDope,2017-01-10 19:35:33,https://twitter.com/foxandfriends/status/818798296965615616,https://www.reddit.com/r/dataisbeautiful/comments/5n74is/poll_only_49_of_black_americans_think_race/,25,25,,15,"POLL Only 49% of Black Americans think race relations in the U.S. are good, down from 61% in 2008",2017-01-0163.jpg
50 Maps of the US Cultural Divide,ennsy,2017-01-10 19:46:51,http://www.nytimes.com/interactive/2016/12/26/upshot/duck-dynasty-vs-modern-family-television-maps.html?WT.mc_id=2016-KWP-AUD_DEV&WT.mc_ev=click&ad-keywords=AUDDEVREMARK&kwp_0=302296&kwp_4=1169511&kwp_1=532257&_r=0#game_of_thrones,https://www.reddit.com/r/dataisbeautiful/comments/5n7738/50_maps_of_the_us_cultural_divide/,22,22,,3,50 Maps of the US Cultural Divide,2017-01-0164.jpg
Parable of Polygons - An Interactive Visualisation of Society and Diversity,fairlywired,2017-01-10 21:35:55,http://ncase.me/polygons/,https://www.reddit.com/r/dataisbeautiful/comments/5n7vaf/parable_of_polygons_an_interactive_visualisation/,13,13,,0,Parable of Polygons - An Interactive Visualisation of Society and Diversity,2017-01-0165.jpg
"Traffic fines in Montevideo, Uruguay [in Spanish] [OC]",gabitoju,2017-01-10 21:38:51,https://i.redd.it/4qj9gbq1fy8y.png,https://www.reddit.com/r/dataisbeautiful/comments/5n7vwl/traffic_fines_in_montevideo_uruguay_in_spanish_oc/,6,6,,1,"Traffic fines in Montevideo, Uruguay in Spanish OC",2017-01-0166.png
"Los Angeles City Controller releases data on parking tickets: interactive charts showing where and when fines are most common, which types of violations are most frequent, and where parking ticket money goes",SmellGestapo,2017-01-11 00:14:33,http://parking.controlpanel.la/,https://www.reddit.com/r/dataisbeautiful/comments/5n8rgk/los_angeles_city_controller_releases_data_on/,169,169,,4,"Los Angeles City Controller releases data on parking tickets interactive charts showing where and when fines are most common, which types of violation",2017-01-0167.jpg
The useless correlation between US spending on science and suicides by hanging,i_am_team_stark,2017-01-11 13:49:14,http://tylervigen.com/spurious-correlations,https://www.reddit.com/r/dataisbeautiful/comments/5nc94b/the_useless_correlation_between_us_spending_on/,26719,26719,,1440,The useless correlation between US spending on science and suicides by hanging,2017-01-0168.jpg
My bank balance over the last 3 years looks a bit like a city on a hillside [OC],plsdontstealmymoney,2017-01-11 17:37:58,https://i.redd.it/rqf13ssyc49y.png,https://www.reddit.com/r/dataisbeautiful/comments/5ndj53/my_bank_balance_over_the_last_3_years_looks_a_bit/,62,62,,27,My bank balance over the last 3 years looks a bit like a city on a hillside OC,2017-01-0169.png
The United States Ranked by the Tallest Building in Each State,KellyFriedman,2017-01-11 18:41:07,http://www.highrises.com/tallest-building-in-each-state.php,https://www.reddit.com/r/dataisbeautiful/comments/5ndx9k/the_united_states_ranked_by_the_tallest_building/,40,40,,14,The United States Ranked by the Tallest Building in Each State,2017-01-0170.jpg
Saw Films Chronology of events & deaths [OC],Dr__Pi,2017-01-11 19:35:53,https://i.redd.it/qsupwstrx49y.png,https://www.reddit.com/r/dataisbeautiful/comments/5ne9k2/saw_films_chronology_of_events_deaths_oc/,2,2,,1,Saw Films Chronology of events & deaths OC,2017-01-0171.png
Can someone enlighten me on the following graphic?,deckin8r,2017-01-11 20:17:17,https://www.reddit.com/r/dataisbeautiful/comments/5neiwb/can_someone_enlighten_me_on_the_following_graphic/,https://www.reddit.com/r/dataisbeautiful/comments/5neiwb/can_someone_enlighten_me_on_the_following_graphic/,2,2,,0,Can someone enlighten me on the following graphic,2017-01-0172.jpg
5 Astonishing Facts on the Growing Language Diversity of Canadians (2000+ word analysis) [OC],gane5h,2017-01-11 21:39:50,http://www.silota.com/data/canada-language-diversity-census-map/?utm_source=reddit&utm_medium=social,https://www.reddit.com/r/dataisbeautiful/comments/5nf177/5_astonishing_facts_on_the_growing_language/,8,8,,3,5 Astonishing Facts on the Growing Language Diversity of Canadians (2000+ word analysis) OC,2017-01-0173.jpg
27 years of weekly rainfall data mapped in 1.404 wooden blocks [OC],elxavier,2017-01-11 22:39:24,https://i.redd.it/27yhfr8su59y.jpg,https://www.reddit.com/r/dataisbeautiful/comments/5nfe8l/27_years_of_weekly_rainfall_data_mapped_in_1404/,113,113,,5,27 years of weekly rainfall data mapped in 1.404 wooden blocks OC,2017-01-0174.jpg
Everything you ever wanted to know about the U.S. foreign assistance budget,benjancewicz,2017-01-11 23:13:41,http://www.washingtonpost.com/graphics/world/which-countries-get-the-most-foreign-aid/,https://www.reddit.com/r/dataisbeautiful/comments/5nfli3/everything_you_ever_wanted_to_know_about_the_us/,9,9,,1,Everything you ever wanted to know about the U.S. foreign assistance budget,2017-01-0175.jpg
Automotive reliability by analyzing data collected from used car auctions,sataky,2017-01-12 00:23:37,http://community.wolfram.com/groups/-/m/t/992746,https://www.reddit.com/r/dataisbeautiful/comments/5nfzuq/automotive_reliability_by_analyzing_data/,8,8,,1,Automotive reliability by analyzing data collected from used car auctions,2017-01-0176.jpg
List of NBA Teams by Amount of Users on Its Subreddit [OC],j_cruise,2017-01-12 00:29:06,http://imgur.com/gallery/tviwP,https://www.reddit.com/r/dataisbeautiful/comments/5ng0z5/list_of_nba_teams_by_amount_of_users_on_its/,4,4,,8,List of NBA Teams by Amount of Users on Its Subreddit OC,2017-01-0177.jpg
"Two years of running, all at once [OC]",perimosocordiae,2017-01-12 00:34:41,http://imgur.com/G97sYm1,https://www.reddit.com/r/dataisbeautiful/comments/5ng255/two_years_of_running_all_at_once_oc/,6123,6123,,263,"Two years of running, all at once OC",2017-01-0178.jpg
"Cycling in Sydney, Australia",mecon2,2017-01-12 00:51:11,https://cityfutures.be.unsw.edu.au/cityviz/cycling-sydney/,https://www.reddit.com/r/dataisbeautiful/comments/5ng5ez/cycling_in_sydney_australia/,5,5,,2,"Cycling in Sydney, Australia",2017-01-0179.jpg
The reverse gender gap in commuting times across the OECD [OC],jimrosenz,2017-01-12 02:05:21,https://utopiayouarestandinginit.com/2016/01/31/the-reverse-gender-gap-in-commuting-times-across-the-oecd-julieannegenter/,https://www.reddit.com/r/dataisbeautiful/comments/5ngjve/the_reverse_gender_gap_in_commuting_times_across/,13,13,,7,The reverse gender gap in commuting times across the OECD OC,2017-01-0180.jpg
Drug Stocks Plunge as Trump Threatens to Force Price Bidding,jimrosenz,2017-01-12 03:20:29,https://www.bloomberg.com/news/articles/2017-01-11/drug-stocks-plunge-as-trump-threatens-to-force-price-bidding,https://www.reddit.com/r/dataisbeautiful/comments/5ngy5r/drug_stocks_plunge_as_trump_threatens_to_force/,209,209,,63,Drug Stocks Plunge as Trump Threatens to Force Price Bidding,2017-01-0181.jpg
Word Clouds: Barack Obama and Donald Trump first press conference following presidential election [OC],JustWordClouds,2017-01-12 05:48:05,http://imgur.com/gallery/0o8Sv,https://www.reddit.com/r/dataisbeautiful/comments/5nhnuj/word_clouds_barack_obama_and_donald_trump_first/,36,36,,9,Word Clouds Barack Obama and Donald Trump first press conference following presidential election OC,2017-01-0182.jpg
Most streamed netflix series in US,vincest,2017-01-12 06:36:02,https://www.highspeedinternet.com/resources/2016s-streamed-netflix-shows-state/,https://www.reddit.com/r/dataisbeautiful/comments/5nhv2x/most_streamed_netflix_series_in_us/,15,15,,10,Most streamed netflix series in US,2017-01-0183.jpg
Police views vs. public views,Kretenkobr2,2017-01-12 08:19:18,http://www.pewsocialtrends.org/2017/01/11/police-views-public-views/,https://www.reddit.com/r/dataisbeautiful/comments/5ni8la/police_views_vs_public_views/,31,31,,4,Police views vs. public views,2017-01-0184.jpg
Middle-class university graduates will decide the future of the Labour Party,jimrosenz,2017-01-12 09:15:29,http://www.newstatesman.com/politics/staggers/2016/07/middle-class-university-graduates-will-decide-future-labour-party,https://www.reddit.com/r/dataisbeautiful/comments/5nif2s/middleclass_university_graduates_will_decide_the/,2,2,,0,Middle-class university graduates will decide the future of the Labour Party,2017-01-0185.jpg
Switzerland grew by 2 million people since 1981: These beautiful interactive maps show where [OC],wnstnsmth,2017-01-12 10:02:21,http://www.srf.ch/news/wo-die-schweiz-waechst-und-wo-sie-schrumpft-2,https://www.reddit.com/r/dataisbeautiful/comments/5nikm0/switzerland_grew_by_2_million_people_since_1981/,8,8,,3,Switzerland grew by 2 million people since 1981 These beautiful interactive maps show where OC,2017-01-0186.jpg
#1 challenge to being productive and how important is productivity for happiness,maikelson,2017-01-12 10:28:12,https://blogs.office.com/2017/01/10/survey-mastering-your-productivity-in-2017/,https://www.reddit.com/r/dataisbeautiful/comments/5ninpr/1_challenge_to_being_productive_and_how_important/,0,0,,1,#1 challenge to being productive and how important is productivity for happiness,2017-01-0187.jpg
Asked People What They Know About Obamacare.,jimrosenz,2017-01-12 10:35:53,http://www.npr.org/2017/01/12/509314717/we-asked-people-what-they-know-about-obamacare-see-if-you-know-the-answers?utm_source=facebook.com&utm_medium=social&utm_campaign=npr&utm_term=nprnews&utm_content=20170112,https://www.reddit.com/r/dataisbeautiful/comments/5niomq/asked_people_what_they_know_about_obamacare/,118,118,,82,Asked People What They Know About Obamacare.,2017-01-0188.jpg
How Each State Voted in Each Election Since 1964,flerlagekr,2017-01-12 11:36:27,http://duelingdata.blogspot.com/2017/01/presidential-election-viz.html?m=1,https://www.reddit.com/r/dataisbeautiful/comments/5nivzo/how_each_state_voted_in_each_election_since_1964/,6,6,,0,How Each State Voted in Each Election Since 1964,2017-01-0189.jpg
Exactly How Wrong Were the Polls? [OC],flerlagekr,2017-01-12 12:18:14,http://www.kenflerlage.com/2017/01/how-wrong-were-polls.html,https://www.reddit.com/r/dataisbeautiful/comments/5nj1go/exactly_how_wrong_were_the_polls_oc/,6,6,,1,Exactly How Wrong Were the Polls OC,2017-01-0190.jpg
How hot Switzerland has gotten over the last 150 years (animated) [OC],d-qn,2017-01-12 12:21:24,http://www.swissinfo.ch/eng/climate_how-hot-was-it-in-2016-/42828830,https://www.reddit.com/r/dataisbeautiful/comments/5nj1vz/how_hot_switzerland_has_gotten_over_the_last_150/,8,8,,2,How hot Switzerland has gotten over the last 150 years (animated) OC,2017-01-0191.jpg
Global Nuclear Power Database,233C,2017-01-12 12:32:15,http://thebulletin.org/global-nuclear-power-database,https://www.reddit.com/r/dataisbeautiful/comments/5nj3fj/global_nuclear_power_database/,5,5,,0,Global Nuclear Power Database,2017-01-0192.jpg
Presidents - on average - live long enough to see 2-3 of their successors' terms. Then there's Jimmy Carter [OC],Toado85,2017-01-12 13:08:32,http://polstats.com/#!/after,https://www.reddit.com/r/dataisbeautiful/comments/5nj91r/presidents_on_average_live_long_enough_to_see_23/,33,33,,3,Presidents - on average - live long enough to see 2-3 of their successors' terms. Then there's Jimmy Carter OC,2017-01-0193.jpg
NSFW Heat Map of Reddit's Favorite Porn Cross-posts of 2016 [OC],ABCosmos,2017-01-12 14:52:26,http://imgur.com/uuWqwEz,https://www.reddit.com/r/dataisbeautiful/comments/5njr2k/nsfw_heat_map_of_reddits_favorite_porn_crossposts/,24508,24508,,1059,NSFW Heat Map of Reddit's Favorite Porn Cross-posts of 2016 OC,2017-01-0194.jpg
Key findings on how police view their jobs amid protests and calls for reform,Sasquatch2016,2017-01-12 14:56:17,http://www.pewresearch.org/fact-tank/2017/01/11/police-key-findings/,https://www.reddit.com/r/dataisbeautiful/comments/5njrsx/key_findings_on_how_police_view_their_jobs_amid/,6,6,,1,Key findings on how police view their jobs amid protests and calls for reform,2017-01-0195.jpg
The History of the World: Every Year,ieatchipotle,2017-01-12 15:18:39,https://www.youtube.com/watch?annotation_id=annotation_3403044665&feature=iv&src_vid=ymI5Uv5cGU4&v=-6Wu0Q7x5D0,https://www.reddit.com/r/dataisbeautiful/comments/5njw2y/the_history_of_the_world_every_year/,24,24,,2,The History of the World Every Year,2017-01-0196.jpg
Consistency of CS:GO players throughout 2016,cuube-,2017-01-12 15:21:56,https://medium.com/@PMAcsgo/consistency-of-cs-go-players-throughout-2016-6db86800d30#.jeegcq43s,https://www.reddit.com/r/dataisbeautiful/comments/5njwpi/consistency_of_csgo_players_throughout_2016/,8,8,,0,Consistency of CSGO players throughout 2016,2017-01-0197.jpg
[OC] NIH Funding 2016: Geospatial Distribution,dysregulation,2017-01-12 15:27:21,http://imgur.com/a/ft9X1,https://www.reddit.com/r/dataisbeautiful/comments/5njxrf/oc_nih_funding_2016_geospatial_distribution/,1,1,,4,OC NIH Funding 2016 Geospatial Distribution,2017-01-0198.jpg
"Female dialogue in 2016’s biggest movies, visualized",quincylarson,2017-01-12 16:06:44,https://proquestionasker.github.io/projects/MovieDialogueInteractive/,https://www.reddit.com/r/dataisbeautiful/comments/5nk5to/female_dialogue_in_2016s_biggest_movies_visualized/,206,206,,132,"Female dialogue in 2016’s biggest movies, visualized",2017-01-0199.jpg
EVE online development progress over 12 years visualized in a video,predator176,2017-01-12 17:17:19,https://youtu.be/rBJUiCHdmCc,https://www.reddit.com/r/dataisbeautiful/comments/5nkl9o/eve_online_development_progress_over_12_years/,10,10,,0,EVE online development progress over 12 years visualized in a video,2017-01-0200.jpg
Timelapse - The Development Of EVE Online,xJRWR,2017-01-12 17:36:03,https://community.eveonline.com/news/news-channels/eve-online-news/timelapse-the-development-of-eve-online/,https://www.reddit.com/r/dataisbeautiful/comments/5nkpig/timelapse_the_development_of_eve_online/,3,3,,0,Timelapse - The Development Of EVE Online,2017-01-0201.jpg
House of Representatives members by state [OC],datashown,2017-01-12 18:41:16,http://i.imgur.com/TIjrRNU.png,https://www.reddit.com/r/dataisbeautiful/comments/5nl4ay/house_of_representatives_members_by_state_oc/,44,44,,18,House of Representatives members by state OC,2017-01-0202.png
"'Timelapse - The Development of EVE Online' [30:30], a visualization of code development progress on CCPGames' MMO title, EVE Online",Towkin,2017-01-12 18:55:41,https://www.youtube.com/watch?v=rBJUiCHdmCc,https://www.reddit.com/r/dataisbeautiful/comments/5nl7jo/timelapse_the_development_of_eve_online_3030_a/,8,8,,1,"'Timelapse - The Development of EVE Online' 3030, a visualization of code development progress on CCPGames' MMO title, EVE Online",2017-01-0203.jpg
What occupation contains the greatest number of people who studied math? The answer is—teachers.,dbyler139,2017-01-12 20:32:37,https://datausa.io//story/06-16-2016_math-teachers/,https://www.reddit.com/r/dataisbeautiful/comments/5nlt8f/what_occupation_contains_the_greatest_number_of/,11,11,,1,What occupation contains the greatest number of people who studied math The answer is—teachers.,2017-01-0204.jpg
Do women in Wales outlast Females in France? Do Mancunian men live longer than Moroccans? [OC],rytchbass,2017-01-12 20:34:42,http://richard-muir.com/blog/2016/12/31/do-women-in-wales-outlast-females-in-france/,https://www.reddit.com/r/dataisbeautiful/comments/5nltpa/do_women_in_wales_outlast_females_in_france_do/,0,0,,1,Do women in Wales outlast Females in France Do Mancunian men live longer than Moroccans OC,2017-01-0205.jpg
A Donald Trump word cloud using keywords from his most recent Twitter insults [OC],creative_sal,2017-01-12 20:55:35,https://i.redd.it/qgoq00rzgc9y.jpg,https://www.reddit.com/r/dataisbeautiful/comments/5nlyak/a_donald_trump_word_cloud_using_keywords_from_his/,80,80,,10,A Donald Trump word cloud using keywords from his most recent Twitter insults OC,2017-01-0206.jpg
New World Map Visualizing Ocean Waves in Real-Time,LuborS,2017-01-12 20:56:06,https://www.ventusky.com/?l=wave,https://www.reddit.com/r/dataisbeautiful/comments/5nlyep/new_world_map_visualizing_ocean_waves_in_realtime/,51,51,,2,New World Map Visualizing Ocean Waves in Real-Time,2017-01-0207.jpg
The Global Risks Landscape 2017 - World Economic Forum,mudbot,2017-01-12 21:44:23,http://reports.weforum.org/global-risks-2017/global-risks-landscape-2017/#landscape,https://www.reddit.com/r/dataisbeautiful/comments/5nm971/the_global_risks_landscape_2017_world_economic/,9,9,,0,The Global Risks Landscape 2017 - World Economic Forum,2017-01-0208.jpg
We Asked People What They Know About Obamacare,jstuartmill,2017-01-13 00:19:44,http://www.npr.org/2017/01/12/509314717/we-asked-people-what-they-know-about-obamacare-see-if-you-know-the-answers?utm_medium=RSS&utm_campaign=news,https://www.reddit.com/r/dataisbeautiful/comments/5nn6as/we_asked_people_what_they_know_about_obamacare/,3,3,,1,We Asked People What They Know About Obamacare,2017-01-0209.jpg
Subscriber Change for /r/EnoughTrumpSpam and /r/the_donald mapped with current events [OC],TomatoJoe11,2017-01-13 01:36:12,http://imgur.com/gallery/DZdfr,https://www.reddit.com/r/dataisbeautiful/comments/5nnl4x/subscriber_change_for_renoughtrumpspam_and_rthe/,29,29,,12,Subscriber Change for rEnoughTrumpSpam and rthe_donald mapped with current events OC,2017-01-0210.jpg
"[OC] A graphic representation of the Impractical Jokers challenges, punishments, thumbs up, and thumbs down. (data source in comments)",TarterSauce54321,2017-01-13 02:07:45,https://i.redd.it/7ok1sqfx0e9y.png,https://www.reddit.com/r/dataisbeautiful/comments/5nnr87/oc_a_graphic_representation_of_the_impractical/,70,70,,13,"OC A graphic representation of the Impractical Jokers challenges, punishments, thumbs up, and thumbs down. (data source in comments)",2017-01-0211.png
Earth Population (-5000 to 2016) [OC],bra-_-ket,2017-01-13 03:02:40,https://www.datazar.com/file/full/f3b082d25-d7a9-47db-a498-6d3f82ac914f,https://www.reddit.com/r/dataisbeautiful/comments/5no22w/earth_population_5000_to_2016_oc/,0,0,,1,Earth Population (-5000 to 2016) OC,2017-01-0212.jpg
"Beautiful phylogenetic trees of various language families, in various forms",WavesWashSands,2017-01-13 10:48:29,http://new.multitree.org/browse,https://www.reddit.com/r/dataisbeautiful/comments/5npyqx/beautiful_phylogenetic_trees_of_various_language/,12,12,,1,"Beautiful phylogenetic trees of various language families, in various forms",2017-01-0213.jpg
The superhero movies people are most excited for this year [OC],GemmaJ123,2017-01-13 11:24:10,https://www.brandwatch.com/blog/react-superhero-movies-2017/,https://www.reddit.com/r/dataisbeautiful/comments/5nq3c1/the_superhero_movies_people_are_most_excited_for/,0,0,,1,The superhero movies people are most excited for this year OC,2017-01-0214.jpg
