title,author,created_date,url,full_permalink,score,ups,downs,num_comments,sanitized_title,image_file
Retirement Age Around the World [Interactive Map],iliadmusic,2017-08-01 04:23:46,https://aperioncare.com/blog/retirement-age-around-world/,https://www.reddit.com/r/dataisbeautiful/comments/6qtwww/retirement_age_around_the_world_interactive_map/,5,5,,2,Retirement Age Around the World Interactive Map,2017-08-0000.jpg
Map of When Buildings in Indianapolis were Built [OC],DavidWaldron,2017-08-01 11:24:03,https://www.waldrn.com/indy-building-age-map/,https://www.reddit.com/r/dataisbeautiful/comments/6qvkjv/map_of_when_buildings_in_indianapolis_were_built/,28,28,,6,Map of When Buildings in Indianapolis were Built OC,2017-08-0001.jpg
"The top five moments of Game of Thrones S7 Episode 3, according to spikes in social media posts [OC]",GemmaJ123,2017-08-01 11:32:15,https://www.brandwatch.com/blog/react-game-thrones-season-7-episode-3/?utm_source=reddit&utm_medium=react&utm_term=blog&utm_campaign=08_2017_entertainment_blog,https://www.reddit.com/r/dataisbeautiful/comments/6qvlvx/the_top_five_moments_of_game_of_thrones_s7/,3,3,,2,"The top five moments of Game of Thrones S7 Episode 3, according to spikes in social media posts OC",2017-08-0002.jpg
Usage of coal vs other energy sources in the UK 1920-2016 [OC],gavurin,2017-08-01 11:36:50,https://i.redd.it/lw76gmx544dz.png,https://www.reddit.com/r/dataisbeautiful/comments/6qvmnl/usage_of_coal_vs_other_energy_sources_in_the_uk/,139,139,,13,Usage of coal vs other energy sources in the UK 1920-2016 OC,2017-08-0003.png
What percentage of each state's population has a disability? [OC],OverflowDs,2017-08-01 11:40:40,http://overflow.solutions/demographic-data/national-data/state-level-analysis/what-percentage-of-each-states-population-has-a-disability/,https://www.reddit.com/r/dataisbeautiful/comments/6qvnad/what_percentage_of_each_states_population_has_a/,3,3,,3,What percentage of each state's population has a disability OC,2017-08-0004.jpg
The most famous reddit accounts [OC],fhoffa,2017-08-01 13:09:04,https://medium.com/@hoffa/the-most-famous-reddit-accounts-c9958b5bc376,https://www.reddit.com/r/dataisbeautiful/comments/6qw3lq/the_most_famous_reddit_accounts_oc/,7900,7900,,812,The most famous reddit accounts OC,2017-08-0005.jpg
World's Most Visited Cities and Visitor Spending in These Cities,lapivan,2017-08-01 14:45:21,https://knoema.com/infographics/bgsmpbf/world-s-most-visited-cities,https://www.reddit.com/r/dataisbeautiful/comments/6qwofk/worlds_most_visited_cities_and_visitor_spending/,18,18,,0,World's Most Visited Cities and Visitor Spending in These Cities,2017-08-0006.jpg
What if the map of Virginia was based on population?,oldsoulrevival,2017-08-01 16:30:08,https://www.youtube.com/watch?v=0P6vqtoPgeQ,https://www.reddit.com/r/dataisbeautiful/comments/6qxdpo/what_if_the_map_of_virginia_was_based_on/,10,10,,1,What if the map of Virginia was based on population,2017-08-0007.jpg
The path of the solar eclipse is already altering real-world behavior,jimiffondu,2017-08-01 17:15:57,https://www.washingtonpost.com/news/wonk/wp/2017/08/01/the-path-of-the-solar-eclipse-is-already-altering-real-world-behavior/,https://www.reddit.com/r/dataisbeautiful/comments/6qxpcn/the_path_of_the_solar_eclipse_is_already_altering/,14,14,,1,The path of the solar eclipse is already altering real-world behavior,2017-08-0008.jpg
Temperature Anomalies arranged by Country 1900 - 2016,__tosh,2017-08-01 18:30:11,https://www.flickr.com/photos/150411108@N06/35471910724/,https://www.reddit.com/r/dataisbeautiful/comments/6qy881/temperature_anomalies_arranged_by_country_1900/,7,7,,1,Temperature Anomalies arranged by Country 1900 - 2016,2017-08-0009.jpg
Lines Spoken Per Episode By the Four Most Popular Characters From the Office [OC],cheekyfractal,2017-08-01 20:41:08,https://i.redd.it/rai0cgvst6dz.png,https://www.reddit.com/r/dataisbeautiful/comments/6qz4b9/lines_spoken_per_episode_by_the_four_most_popular/,17,17,,6,Lines Spoken Per Episode By the Four Most Popular Characters From the Office OC,2017-08-0010.png
Rating of the episodes of The Simpsons according of IMDB score.,cuak,2017-08-01 20:54:14,https://i.redd.it/p0or3k2rv6dz.jpg,https://www.reddit.com/r/dataisbeautiful/comments/6qz7gk/rating_of_the_episodes_of_the_simpsons_according/,107,107,,18,Rating of the episodes of The Simpsons according of IMDB score.,2017-08-0011.jpg
State Department Daily Briefings By Presidential Administration,allbrightallways,2017-08-01 21:26:29,https://www.nytimes.com/interactive/2017/08/01/upshot/lowest-profile-state-department-in-decades.html?_r=0,https://www.reddit.com/r/dataisbeautiful/comments/6qzfab/state_department_daily_briefings_by_presidential/,5,5,,0,State Department Daily Briefings By Presidential Administration,2017-08-0012.jpg
Opioid Prescriptions Across The U.S.,allbrightallways,2017-08-01 21:28:34,https://fivethirtyeight.com/features/opioid-prescriptions-across-the-u-s/,https://www.reddit.com/r/dataisbeautiful/comments/6qzfs6/opioid_prescriptions_across_the_us/,3,3,,1,Opioid Prescriptions Across The U.S.,2017-08-0013.jpg
Data Viz Showing Summers Are Getting Hotter,allbrightallways,2017-08-01 22:17:56,https://www.nytimes.com/interactive/2017/07/28/climate/more-frequent-extreme-summer-heat.html?smid=tw-share,https://www.reddit.com/r/dataisbeautiful/comments/6qzrfr/data_viz_showing_summers_are_getting_hotter/,5,5,,1,Data Viz Showing Summers Are Getting Hotter,2017-08-0014.jpg
Where Researchers Found CTE Among Football Players,allbrightallways,2017-08-01 22:25:04,http://www.npr.org/2017/07/25/539198429/study-cte-found-in-nearly-all-donated-nfl-player-brains?utm_source=twitter.com&utm_medium=social&utm_campaign=npr&utm_term=nprnews&utm_content=20170725,https://www.reddit.com/r/dataisbeautiful/comments/6qzt37/where_researchers_found_cte_among_football_players/,6,6,,1,Where Researchers Found CTE Among Football Players,2017-08-0015.jpg
Alcohol-related car accidents declined in New York after the introduction of Uber,allbrightallways,2017-08-01 22:30:23,http://www.economist.com/blogs/graphicdetail/2017/04/daily-chart-0,https://www.reddit.com/r/dataisbeautiful/comments/6qzua9/alcoholrelated_car_accidents_declined_in_new_york/,1781,1781,,84,Alcohol-related car accidents declined in New York after the introduction of Uber,2017-08-0016.jpg
A pilot study on the science of dating (VIDEO) [OC],SharathCK,2017-08-01 22:51:04,https://youtu.be/YZB2t3uzWD8,https://www.reddit.com/r/dataisbeautiful/comments/6qzywo/a_pilot_study_on_the_science_of_dating_video_oc/,8,8,,2,A pilot study on the science of dating (VIDEO) OC,2017-08-0017.jpg
What news outlets publish vs. what we react to,allbrightallways,2017-08-01 23:20:55,http://www.tjpalanca.com/2017/07/databeers-mnl.html,https://www.reddit.com/r/dataisbeautiful/comments/6r05gh/what_news_outlets_publish_vs_what_we_react_to/,11,11,,3,What news outlets publish vs. what we react to,2017-08-0018.jpg
I'm almost driving my car for free: the results of tracking everything related to my car [OC],TrackingHappiness,2017-08-02 07:26:38,http://imgur.com/a/6JXiv,https://www.reddit.com/r/dataisbeautiful/comments/6r2lhm/im_almost_driving_my_car_for_free_the_results_of/,32,32,,10,I'm almost driving my car for free the results of tracking everything related to my car OC,2017-08-0019.jpg
What Would be the World's Population if People Stopped Dying in 1950? [OC],lapivan,2017-08-02 08:42:19,https://knoema.com/armawfd/what-would-be-the-world-s-population-if-people-stopped-dying-in-1950,https://www.reddit.com/r/dataisbeautiful/comments/6r2v6l/what_would_be_the_worlds_population_if_people/,8,8,,3,What Would be the World's Population if People Stopped Dying in 1950 OC,2017-08-0020.jpg
Temperature anomalies arranged by coutry 1900-2016,pio1976,2017-08-02 09:20:00,https://flic.kr/p/W3wPeE,https://www.reddit.com/r/dataisbeautiful/comments/6r3067/temperature_anomalies_arranged_by_coutry_19002016/,24,24,,4,Temperature anomalies arranged by coutry 1900-2016,2017-08-0021.jpg
What happened to the 270 occupations listed in the 1950 US Census?,jimrosenz,2017-08-02 10:42:30,https://www.theatlas.com/charts/B1ltXRHsx?utm_content=buffer814dd&utm_medium=social&utm_source=twitter.com&utm_campaign=buffer,https://www.reddit.com/r/dataisbeautiful/comments/6r3bwc/what_happened_to_the_270_occupations_listed_in/,0,0,,0,What happened to the 270 occupations listed in the 1950 US Census,2017-08-0022.jpg
[OC] I've secretly been keeping track of my coworkers Diet Coke consumption,genoohh,2017-08-02 11:02:34,https://i.redd.it/3ezl9zjl3bdz.jpg,https://www.reddit.com/r/dataisbeautiful/comments/6r3ew4/oc_ive_secretly_been_keeping_track_of_my/,51504,51504,,4402,OC I've secretly been keeping track of my coworkers Diet Coke consumption,2017-08-0023.jpg
Average daily steps in different countries across the world,amigidot,2017-08-02 11:47:13,http://www.nature.com/nature/journal/v547/n7663/fig_tab/nature23018_F1.html,https://www.reddit.com/r/dataisbeautiful/comments/6r3m40/average_daily_steps_in_different_countries_across/,16,16,,10,Average daily steps in different countries across the world,2017-08-0024.jpg
Diagrams of the flow of products between U.S. states,lazarogamio,2017-08-02 12:02:05,https://www.axios.com/the-flow-of-goods-2463665414.html,https://www.reddit.com/r/dataisbeautiful/comments/6r3ov2/diagrams_of_the_flow_of_products_between_us_states/,19,19,,3,Diagrams of the flow of products between U.S. states,2017-08-0025.jpg
"A ""Circle Graph"" based on the Amount of Resources we Consume to the Amount of Resources Regenerated by Earth in one Year",VoxelHD,2017-08-02 12:29:15,https://phys.org/news/2017-08-earth-resource-spent-august.html,https://www.reddit.com/r/dataisbeautiful/comments/6r3twi/a_circle_graph_based_on_the_amount_of_resources/,8,8,,0,A Circle Graph based on the Amount of Resources we Consume to the Amount of Resources Regenerated by Earth in one Year,2017-08-0026.jpg
Usain Bolt: The fastest man that has ever lived,Jholder112233,2017-08-02 12:37:31,https://www.theguardian.com/sport/ng-interactive/2017/aug/02/usain-bolt-fastest-man-ever-lived,https://www.reddit.com/r/dataisbeautiful/comments/6r3vfn/usain_bolt_the_fastest_man_that_has_ever_lived/,4,4,,2,Usain Bolt The fastest man that has ever lived,2017-08-0027.jpg
The UK's digital economy [OC],datboipugsy,2017-08-02 14:11:53,https://i.redd.it/gwb9uw2y0cdz.png,https://www.reddit.com/r/dataisbeautiful/comments/6r4fav/the_uks_digital_economy_oc/,68,68,,7,The UK's digital economy OC,2017-08-0028.png
Pairwise Correlation of Whisky Flavors [OC],weare13888,2017-08-02 14:42:12,https://i.redd.it/2gjzf3116cdz.png,https://www.reddit.com/r/dataisbeautiful/comments/6r4m9m/pairwise_correlation_of_whisky_flavors_oc/,5,5,,6,Pairwise Correlation of Whisky Flavors OC,2017-08-0029.png
How digital methods can be used to analyse language and understand Reddit communities - LSE Impact of Social Sciences [OC],mitsquirrell,2017-08-02 15:46:03,http://blogs.lse.ac.uk/impactofsocialsciences/2017/08/02/new-digital-methods-can-be-used-to-analyse-linguistic-terms-and-better-understand-reddit-communities/,https://www.reddit.com/r/dataisbeautiful/comments/6r51qz/how_digital_methods_can_be_used_to_analyse/,11,11,,3,How digital methods can be used to analyse language and understand Reddit communities - LSE Impact of Social Sciences OC,2017-08-0030.jpg
"Graph of NZEF casualties, 1915-1919",RyanSmith,2017-08-02 17:37:58,https://nzhistory.govt.nz/media/photo/graph-nzef-casualties-1915-1919,https://www.reddit.com/r/dataisbeautiful/comments/6r5upw/graph_of_nzef_casualties_19151919/,2,2,,0,"Graph of NZEF casualties, 1915-1919",2017-08-0031.jpg
Average Annual Rainfall Per State,allbrightallways,2017-08-02 17:50:06,http://jonahadkins.com/cartography/esri/2017/07/30/rainfall-cubes.html,https://www.reddit.com/r/dataisbeautiful/comments/6r5y0o/average_annual_rainfall_per_state/,5,5,,0,Average Annual Rainfall Per State,2017-08-0032.jpg
How much money you need to earn to be in the top 1% at every age,emilNYC,2017-08-02 18:43:58,http://www.businessinsider.com/1-percent-salary-at-every-age-2017-8,https://www.reddit.com/r/dataisbeautiful/comments/6r6c5e/how_much_money_you_need_to_earn_to_be_in_the_top/,27,27,,0,How much money you need to earn to be in the top 1% at every age,2017-08-0033.jpg
Chat message response times as scatter plot [OC],douira,2017-08-02 19:31:07,https://i.redd.it/h98nq936mddz.png,https://www.reddit.com/r/dataisbeautiful/comments/6r6o5u/chat_message_response_times_as_scatter_plot_oc/,6,6,,9,Chat message response times as scatter plot OC,2017-08-0034.png
"[OC] Calculate time saved by speeding, also increase in aero. drag and stopping distance.",off21z00,2017-08-02 19:37:24,https://docs.google.com/spreadsheets/d/1R1NfKo267ooNxZwbqXjBOn8AX_ywLpwe8eMW1h52GO0,https://www.reddit.com/r/dataisbeautiful/comments/6r6pnz/oc_calculate_time_saved_by_speeding_also_increase/,2,2,,6,"OC Calculate time saved by speeding, also increase in aero. drag and stopping distance.",2017-08-0035.jpg
GIF: How the national economies of the world compare to U.S. states [OC],FSMPBUH,2017-08-02 20:51:58,http://imgur.com/gallery/lKYpq,https://www.reddit.com/r/dataisbeautiful/comments/6r78qx/gif_how_the_national_economies_of_the_world/,49,49,,10,GIF How the national economies of the world compare to U.S. states OC,2017-08-0036.jpg
‘Ordinary’ Australia probably isn’t where you think it is - Visualizing key demographics in Australia,Prometheus09,2017-08-02 21:58:15,http://www.abc.net.au/news/2017-08-03/census-2016-ordinary-australia-probably-isnt-where-you-think/8680052,https://www.reddit.com/r/dataisbeautiful/comments/6r7otm/ordinary_australia_probably_isnt_where_you_think/,22,22,,8,‘Ordinary’ Australia probably isn’t where you think it is - Visualizing key demographics in Australia,2017-08-0037.jpg
"Al Gore's ""An Inconvenient Sequel"" IMDB rating distribution shows that 81.5% of users voted either 1 or 10, giving the film an overall score of 5.0",Greenturkeypants,2017-08-03 01:55:06,http://www.imdb.com/title/tt6322922/ratings?ref_=tt_ov_rt,https://www.reddit.com/r/dataisbeautiful/comments/6r9591/al_gores_an_inconvenient_sequel_imdb_rating/,30934,30934,,2749,"Al Gore's An Inconvenient Sequel IMDB rating distribution shows that 81.5% of users voted either 1 or 10, giving the film an overall score of 5.0",2017-08-0038.jpg
Data Visualisation with 1 Billion Shazam Music Recognitions,dmyl,2017-08-03 07:21:26,https://medium.com/@umaar/data-visualisation-with-1-billion-shazam-music-recognitions-90728df3a8c9?source=linkShare-85402856083b-1501744852,https://www.reddit.com/r/dataisbeautiful/comments/6rap9z/data_visualisation_with_1_billion_shazam_music/,39,39,,1,Data Visualisation with 1 Billion Shazam Music Recognitions,2017-08-0039.jpg
Up until march of this year bitcoin had ~90% of the overall cryptocurrency market cap,Zhaopow,2017-08-03 10:31:03,https://coinmarketcap.com/charts/,https://www.reddit.com/r/dataisbeautiful/comments/6rbegz/up_until_march_of_this_year_bitcoin_had_90_of_the/,3,3,,0,Up until march of this year bitcoin had ~90% of the overall cryptocurrency market cap,2017-08-0040.jpg
Harry Plotter: Visualizing sentiment in R [OC],lakenp,2017-08-03 12:34:23,https://paulvanderlaken.com/2017/08/03/harry-plotter-celebrating-the-20-year-anniversary-with-tidytext-the-tidyverse-and-r/,https://www.reddit.com/r/dataisbeautiful/comments/6rbz3t/harry_plotter_visualizing_sentiment_in_r_oc/,6,6,,9,Harry Plotter Visualizing sentiment in R OC,2017-08-0041.jpg
"Comparing the times of day, retweeting and ""!"" use of Trump's two Twitter accounts (@POTUS and @realdonaldtrump) [OC]",GemmaJ123,2017-08-03 12:50:36,https://www.brandwatch.com/blog/react-realdonaldtrump-vs-potus/?utm_source=reddit&utm_medium=react&utm_term=blog&utm_campaign=08_2017_politics_blog,https://www.reddit.com/r/dataisbeautiful/comments/6rc20x/comparing_the_times_of_day_retweeting_and_use_of/,8,8,,3,"Comparing the times of day, retweeting and ! use of Trump's two Twitter accounts (@POTUS and @realdonaldtrump) OC",2017-08-0042.jpg
Temperature anomalies arranged by country 1900 - 2016,astronautom,2017-08-03 12:59:17,https://twitter.com/anttilip/status/892318734244884480,https://www.reddit.com/r/dataisbeautiful/comments/6rc3sd/temperature_anomalies_arranged_by_country_1900/,20,20,,9,Temperature anomalies arranged by country 1900 - 2016,2017-08-0043.jpg
Interactive - Evolution of Manufacturing Employment by State and County [OC],sayWhatNow85,2017-08-03 13:01:27,https://i.redd.it/fm29gv3vsidz.png,https://www.reddit.com/r/dataisbeautiful/comments/6rc49o/interactive_evolution_of_manufacturing_employment/,4,4,,2,Interactive - Evolution of Manufacturing Employment by State and County OC,2017-08-0044.png
Cumulative U.S. Debt: 1981-2015 - Actual vs. Pre-Reagan Tax Rates [OC],Perrin42,2017-08-03 13:14:28,https://i.redd.it/e8bv8giuvidz.png,https://www.reddit.com/r/dataisbeautiful/comments/6rc6zd/cumulative_us_debt_19812015_actual_vs_prereagan/,17,17,,14,Cumulative U.S. Debt 1981-2015 - Actual vs. Pre-Reagan Tax Rates OC,2017-08-0045.png
Visualising color distribution with an interactive 3D Histogram [OC],douira,2017-08-03 14:03:16,https://youtu.be/-uBUcUELIZM,https://www.reddit.com/r/dataisbeautiful/comments/6rchig/visualising_color_distribution_with_an/,4,4,,2,Visualising color distribution with an interactive 3D Histogram OC,2017-08-0046.jpg
Website tracks Russian propaganda in real time,terriblehuman,2017-08-03 15:09:04,http://dashboard.securingdemocracy.org,https://www.reddit.com/r/dataisbeautiful/comments/6rcwuy/website_tracks_russian_propaganda_in_real_time/,0,0,,0,Website tracks Russian propaganda in real time,2017-08-0047.jpg
Nitrogen oxide levels in London on typical Sundays and bicycle-event road closure Sundays,architecty,2017-08-03 15:21:06,https://twitter.com/jwoLondon/status/892004529545379840,https://www.reddit.com/r/dataisbeautiful/comments/6rczs3/nitrogen_oxide_levels_in_london_on_typical/,1,1,,2,Nitrogen oxide levels in London on typical Sundays and bicycle-event road closure Sundays,2017-08-0048.jpg
Fired/Rehired: Police chiefs are often forced to put officers fired for misconduct back on the streets,nowhathappenedwas,2017-08-03 16:55:18,https://www.washingtonpost.com/graphics/2017/investigations/police-fired-rehired/,https://www.reddit.com/r/dataisbeautiful/comments/6rdnt6/firedrehired_police_chiefs_are_often_forced_to/,15,15,,3,FiredRehired Police chiefs are often forced to put officers fired for misconduct back on the streets,2017-08-0049.jpg
‘The Office’ Dialogue in Five Charts,allbrightallways,2017-08-03 18:43:07,https://pudding.cool/2017/08/the-office/,https://www.reddit.com/r/dataisbeautiful/comments/6regib/the_office_dialogue_in_five_charts/,38,38,,5,‘The Office’ Dialogue in Five Charts,2017-08-0050.jpg
NFL Preseason Win Percent vs Regular Season [OC],person_ergo,2017-08-03 20:40:05,https://i.redd.it/i3ugnrbi3ldz.png,https://www.reddit.com/r/dataisbeautiful/comments/6rfb0b/nfl_preseason_win_percent_vs_regular_season_oc/,8,8,,4,NFL Preseason Win Percent vs Regular Season OC,2017-08-0051.png
Interactive track record: 138 predictions on science and technology,Metaculus,2017-08-03 20:58:53,https://www.metaculus.com/questions/track-record/,https://www.reddit.com/r/dataisbeautiful/comments/6rfg3f/interactive_track_record_138_predictions_on/,3,3,,0,Interactive track record 138 predictions on science and technology,2017-08-0052.jpg
How many Brits like their jobs and their wages?,jimrosenz,2017-08-03 21:00:31,https://yougov.co.uk/news/2017/08/03/love-wage-balance-how-many-brits-their-job-and-the/,https://www.reddit.com/r/dataisbeautiful/comments/6rfgiz/how_many_brits_like_their_jobs_and_their_wages/,7,7,,1,How many Brits like their jobs and their wages,2017-08-0053.jpg
"LinkedIn's internal ""inGraphs"" for visualizing operational metrics",neilpomerleau,2017-08-03 22:31:18,https://engineering.linkedin.com/blog/2017/08/ingraphs--monitoring-and-unexpected-artwork,https://www.reddit.com/r/dataisbeautiful/comments/6rg3k8/linkedins_internal_ingraphs_for_visualizing/,1,1,,0,LinkedIn's internal inGraphs for visualizing operational metrics,2017-08-0054.jpg
West Virginia’s governor is switching parties. And Democrats just hit a new low.,OverflowDs,2017-08-04 00:32:50,https://www.washingtonpost.com/news/the-fix/wp/2017/08/03/west-virginias-governor-is-switching-parties-and-democrats-just-hit-a-new-low/?utm_term=.03d3a8f90ccb,https://www.reddit.com/r/dataisbeautiful/comments/6rgw1k/west_virginias_governor_is_switching_parties_and/,300,300,,154,West Virginia’s governor is switching parties. And Democrats just hit a new low.,2017-08-0055.jpg
"[OC] On average, I've spent the most at Buffalo Wild Wings this year.",Kingoftwilight6,2017-08-04 00:47:18,https://i.redd.it/szhyl1gnbmdz.jpg,https://www.reddit.com/r/dataisbeautiful/comments/6rgz4a/oc_on_average_ive_spent_the_most_at_buffalo_wild/,5,5,,6,"OC On average, I've spent the most at Buffalo Wild Wings this year.",2017-08-0056.jpg
The Unusually Popular Summer Travel Spots for Each State,Bloodmeister,2017-08-04 03:48:45,https://www.nytimes.com/interactive/2017/08/03/sunday-review/summer-vacation-travel-destinations.html?smid=tw-nytimes&smtyp=cur&mtrref=t.co&gwh=C7DDFDBF4AF8F73DF9C051AD75163050&gwt=pay,https://www.reddit.com/r/dataisbeautiful/comments/6rhz7a/the_unusually_popular_summer_travel_spots_for/,46,46,,11,The Unusually Popular Summer Travel Spots for Each State,2017-08-0057.jpg
Box Office vs Budget by Genre (interactive viz in comments) [OC],takeasecond,2017-08-04 03:54:38,http://imgur.com/a/j0GAT,https://www.reddit.com/r/dataisbeautiful/comments/6ri08j/box_office_vs_budget_by_genre_interactive_viz_in/,11,11,,5,Box Office vs Budget by Genre (interactive viz in comments) OC,2017-08-0058.jpg
Flight track of new Dreamliner (undergoing range test) outlines it as well,StevenMaurer,2017-08-04 05:46:55,http://flightaware.com/live/flight/BOE4/history/20170803/0448Z/KBFI/KBFI,https://www.reddit.com/r/dataisbeautiful/comments/6riilm/flight_track_of_new_dreamliner_undergoing_range/,17,17,,2,Flight track of new Dreamliner (undergoing range test) outlines it as well,2017-08-0059.jpg
"We Analyzed 1,000 Fortune Cookies To Unlock Their Secrets",GemmaJ123,2017-08-04 08:25:01,http://fivethirtyeight.com/features/fortune-cookie-math/,https://www.reddit.com/r/dataisbeautiful/comments/6rj4qt/we_analyzed_1000_fortune_cookies_to_unlock_their/,53,53,,3,"We Analyzed 1,000 Fortune Cookies To Unlock Their Secrets",2017-08-0060.jpg
Effect of month of birth on grammar school admissions in UK [OC],tirboki,2017-08-04 10:05:40,https://i.redd.it/ziayxwns2pdz.jpg,https://www.reddit.com/r/dataisbeautiful/comments/6rjhzy/effect_of_month_of_birth_on_grammar_school/,171,171,,24,Effect of month of birth on grammar school admissions in UK OC,2017-08-0061.jpg
Letter and next-letter frequencies in English [OC],Udzu,2017-08-04 12:17:23,https://i.redd.it/snny9gfpqpdz.png,https://www.reddit.com/r/dataisbeautiful/comments/6rk2yr/letter_and_nextletter_frequencies_in_english_oc/,31320,31320,,1071,Letter and next-letter frequencies in English OC,2017-08-0062.png
"A simple, but important question. How necessary are the Y axis and gridlines? [Critique] [OC]",progtastical,2017-08-04 14:32:37,http://imgur.com/a/i9xYZ,https://www.reddit.com/r/dataisbeautiful/comments/6rku9r/a_simple_but_important_question_how_necessary_are/,8,8,,12,"A simple, but important question. How necessary are the Y axis and gridlines Critique OC",2017-08-0063.jpg
Roger Federer's path to 19 Grand Slam titles,gotnicerice,2017-08-04 14:42:39,https://www.swissinfo.ch/eng/business/age-of-success_federer-s-path-to-18-grand-slam-tennis-titles/42919320,https://www.reddit.com/r/dataisbeautiful/comments/6rkwj1/roger_federers_path_to_19_grand_slam_titles/,8,8,,0,Roger Federer's path to 19 Grand Slam titles,2017-08-0064.jpg
Average widths of each letter (from 700 font) [OC],Scatropolis,2017-08-04 14:45:17,http://imgur.com/a/8TWDW,https://www.reddit.com/r/dataisbeautiful/comments/6rkx3j/average_widths_of_each_letter_from_700_font_oc/,3,3,,4,Average widths of each letter (from 700 font) OC,2017-08-0065.jpg
Have Smartphones Destroyed a Generation?,csk0083,2017-08-04 16:20:23,https://www.theatlantic.com/magazine/archive/2017/09/has-the-smartphone-destroyed-a-generation/534198/,https://www.reddit.com/r/dataisbeautiful/comments/6rljyf/have_smartphones_destroyed_a_generation/,0,0,,4,Have Smartphones Destroyed a Generation,2017-08-0066.jpg
How Air-Conditioning Conquered America (Even the Pacific Northwest),nowhathappenedwas,2017-08-04 16:35:41,https://www.nytimes.com/2017/08/04/upshot/the-all-conquering-air-conditioner.html,https://www.reddit.com/r/dataisbeautiful/comments/6rlnx6/how_airconditioning_conquered_america_even_the/,13,13,,1,How Air-Conditioning Conquered America (Even the Pacific Northwest),2017-08-0067.jpg
Short Answers to Hard Questions About the Opioid Crisis,profcyclist,2017-08-04 17:16:21,https://www.nytimes.com/interactive/2017/08/03/upshot/opioid-drug-overdose-epidemic.html?action=click&contentCollection=upshot&region=rank&module=package&version=highlights&contentPlacement=4&pgtype=sectionfront,https://www.reddit.com/r/dataisbeautiful/comments/6rlyeq/short_answers_to_hard_questions_about_the_opioid/,16,16,,0,Short Answers to Hard Questions About the Opioid Crisis,2017-08-0068.jpg
Compare Climates of Cities Around the World [OC],hammertime84,2017-08-04 17:44:27,http://cityprojections.com/CityTemperatureHistograms.html,https://www.reddit.com/r/dataisbeautiful/comments/6rm5gz/compare_climates_of_cities_around_the_world_oc/,10,10,,2,Compare Climates of Cities Around the World OC,2017-08-0069.jpg
