title,author,created_date,url,full_permalink,score,ups,downs,num_comments,sanitized_title,image_file
What States Have the Largest Families? [OC],OverflowDs,2017-01-22 17:14:24,http://overflow.solutions/demographic-data/what-states-have-the-largest-families/,https://www.reddit.com/r/dataisbeautiful/comments/5pi54d/what_states_have_the_largest_families_oc/,9,9,,8,What States Have the Largest Families OC,2017-01-0359.jpg
My Year in Facebook Messages. Created with D3.js [OC],robmoo_re,2017-01-22 17:34:15,https://i.redd.it/u97obp09uaby.jpg,https://www.reddit.com/r/dataisbeautiful/comments/5pi9sn/my_year_in_facebook_messages_created_with_d3js_oc/,6483,6483,,360,My Year in Facebook Messages. Created with D3.js OC,2017-01-0360.jpg
118 years of position ranking of the English Premier League [OC],TSchmidt83,2017-01-22 21:51:37,https://i.redd.it/ri7jk1y04cby.png,https://www.reddit.com/r/dataisbeautiful/comments/5pjyqr/118_years_of_position_ranking_of_the_english/,18,18,,8,118 years of position ranking of the English Premier League OC,2017-01-0361.png
DIB: The influence celebrities have on names,imrankhan88,2017-01-22 22:33:47,https://www.reddit.com/r/dataisbeautiful/comments/5pk8pk/dib_the_influence_celebrities_have_on_names/,https://www.reddit.com/r/dataisbeautiful/comments/5pk8pk/dib_the_influence_celebrities_have_on_names/,9,9,,1,DIB The influence celebrities have on names,2017-01-0362.jpg
The Changing Anatomy of U.S. Oil Imports over the Last 10 Years,urbanachiever77,2017-01-22 22:52:40,http://www.visualcapitalist.com/changing-anatomy-u-s-oil-imports/,https://www.reddit.com/r/dataisbeautiful/comments/5pkcx4/the_changing_anatomy_of_us_oil_imports_over_the/,15,15,,1,The Changing Anatomy of U.S. Oil Imports over the Last 10 Years,2017-01-0363.jpg
Global Participation in the Women's March [OC],flerlagekr,2017-01-22 23:29:02,http://www.kenflerlage.com/2017/01/global-participation-in-womens-march.html,https://www.reddit.com/r/dataisbeautiful/comments/5pkl43/global_participation_in_the_womens_march_oc/,16,16,,3,Global Participation in the Women's March OC,2017-01-0364.jpg
Heatmap of my Strava usage [OC],tylern4,2017-01-23 00:42:41,https://i.redd.it/eeznrh8sxcby.png,https://www.reddit.com/r/dataisbeautiful/comments/5pl14q/heatmap_of_my_strava_usage_oc/,23,23,,9,Heatmap of my Strava usage OC,2017-01-0365.png
I tracked my musical ear training scores to see my rate of learning [OC],graydawg99,2017-01-23 03:35:04,http://imgur.com/a/jJbf9,https://www.reddit.com/r/dataisbeautiful/comments/5plzso/i_tracked_my_musical_ear_training_scores_to_see/,20,20,,7,I tracked my musical ear training scores to see my rate of learning OC,2017-01-0366.jpg
Top 10 Billboard 'Rap Albums' by area under the curve [OC],joepatmckenna,2017-01-23 03:36:49,https://i.redd.it/1ka9fwtxtdby.png,https://www.reddit.com/r/dataisbeautiful/comments/5pm04c/top_10_billboard_rap_albums_by_area_under_the/,3,3,,4,Top 10 Billboard 'Rap Albums' by area under the curve OC,2017-01-0367.png
Australian prime ministers and state/territory heads since 1901,superegz,2017-01-23 04:00:35,https://en.wikipedia.org/wiki/Template:Timeline_Australian_leaders,https://www.reddit.com/r/dataisbeautiful/comments/5pm4ji/australian_prime_ministers_and_stateterritory/,7,7,,0,Australian prime ministers and stateterritory heads since 1901,2017-01-0368.jpg
"visualized: 10 years, 1 million+ instant messages, 9 chat services [OC]",cbabraham,2017-01-23 04:22:49,http://hipsterdatascience.com/messages/?sort=messageCount&show=25&date=2016&color=colorbycontact,https://www.reddit.com/r/dataisbeautiful/comments/5pm8tk/visualized_10_years_1_million_instant_messages_9/,13,13,,4,"visualized 10 years, 1 million+ instant messages, 9 chat services OC",2017-01-0369.jpg
"Mozillas Internet Health Report: 52% of all websites are in English, even though only 25% of the global population understands English.",patrisack,2017-01-23 08:58:46,https://internethealthreport.org/v01/digital-inclusion/,https://www.reddit.com/r/dataisbeautiful/comments/5pnitr/mozillas_internet_health_report_52_of_all/,2014,2014,,434,"Mozillas Internet Health Report 52% of all websites are in English, even though only 25% of the global population understands English.",2017-01-0370.jpg
interactive map shows development of far-right voting patterns for German federal elections since 1990 [OC],moklick,2017-01-23 09:28:23,https://interaktiv.morgenpost.de/wo-deutschland-rechts-waehlt/,https://www.reddit.com/r/dataisbeautiful/comments/5pnn1r/interactive_map_shows_development_of_farright/,47,47,,10,interactive map shows development of far-right voting patterns for German federal elections since 1990 OC,2017-01-0371.jpg
What 3 years of Console Gaming costs!,_jaycue_,2017-01-23 10:00:06,https://docs.google.com/spreadsheets/d/1vOHyvlhD7QGt6c13YQMI8ZO83DGD40iDRk7WH73dHfA/edit#gid=0,https://www.reddit.com/r/dataisbeautiful/comments/5pnrhd/what_3_years_of_console_gaming_costs/,8,8,,20,What 3 years of Console Gaming costs!,2017-01-0372.jpg
"Animated map of how the Unofficial Football World Championship has travelled around the world, via Georgia, North Korea and Netherland Antilles. [OC]",andybarefoot,2017-01-23 13:22:02,http://andybarefoot.com/football/world-champions.html,https://www.reddit.com/r/dataisbeautiful/comments/5ponll/animated_map_of_how_the_unofficial_football_world/,1,1,,2,"Animated map of how the Unofficial Football World Championship has travelled around the world, via Georgia, North Korea and Netherland Antilles. OC",2017-01-0373.jpg
NFL in London,davidmpires,2017-01-23 13:48:07,https://public.tableau.com/views/NFLinLondon/NFLinLondon?:embed=y&:display_count=yes&:showVizHome=no,https://www.reddit.com/r/dataisbeautiful/comments/5poslx/nfl_in_london/,43,43,,19,NFL in London,2017-01-0374.jpg
A Tale of Two Teams - Visualizing Referee Bias in Hockey [OC],Tomer139,2017-01-23 14:08:41,https://sportchart.wordpress.com/2017/01/23/a-tale-of-two-teams/,https://www.reddit.com/r/dataisbeautiful/comments/5powq4/a_tale_of_two_teams_visualizing_referee_bias_in/,19,19,,7,A Tale of Two Teams - Visualizing Referee Bias in Hockey OC,2017-01-0375.jpg
The world split into regions with the same population as the United States [OC],Udzu,2017-01-23 15:05:50,https://i.redd.it/ueh5ukjr8hby.png,https://www.reddit.com/r/dataisbeautiful/comments/5pp8k1/the_world_split_into_regions_with_the_same/,10636,10636,,747,The world split into regions with the same population as the United States OC,2017-01-0376.png
"This 3D map shows the height of every building under construction throughout New York, effectively showing people how their neighborhood will change in the future",coolidge_,2017-01-23 16:41:38,https://www.dnainfo.com/new-york/visualizations/skyline,https://www.reddit.com/r/dataisbeautiful/comments/5ppvb5/this_3d_map_shows_the_height_of_every_building/,64,64,,5,"This 3D map shows the height of every building under construction throughout New York, effectively showing people how their neighborhood will change i",2017-01-0377.jpg
Super Smash Bros. for Wii U character usage rates over time [OC],heyisjambo,2017-01-24 03:28:11,http://imgur.com/a/1IJ5s,https://www.reddit.com/r/dataisbeautiful/comments/5ptuu1/super_smash_bros_for_wii_u_character_usage_rates/,34,34,,10,Super Smash Bros. for Wii U character usage rates over time OC,2017-01-0378.jpg
"California's major water reservoir levels after a relatively ""insane"" amount of rain",StormCloudSeven,2017-01-24 07:10:38,http://cdec.water.ca.gov/cdecapp/resapp/getResGraphsMain.action,https://www.reddit.com/r/dataisbeautiful/comments/5put57/californias_major_water_reservoir_levels_after_a/,58,58,,9,California's major water reservoir levels after a relatively insane amount of rain,2017-01-0379.jpg
Education pushes back age of marriage for rural women in India,shabda,2017-01-24 11:48:42,http://everylifecounts.ndtv.com/education-pushes-back-age-marriage-rural-women-9252,https://www.reddit.com/r/dataisbeautiful/comments/5pvoq1/education_pushes_back_age_of_marriage_for_rural/,12126,12126,,459,Education pushes back age of marriage for rural women in India,2017-01-0380.jpg
"Expansica, America and Compactica: three world regions with the same population [OC]",Udzu,2017-01-24 13:28:46,https://i.redd.it/c4r7zp69wnby.png,https://www.reddit.com/r/dataisbeautiful/comments/5pw3lp/expansica_america_and_compactica_three_world/,57,57,,9,"Expansica, America and Compactica three world regions with the same population OC",2017-01-0381.png
"What makes a person English, according to the English",alexgabriel_i,2017-01-24 15:35:00,https://yougov.co.uk/news/2017/01/24/what-makes-person-english-according-english/,https://www.reddit.com/r/dataisbeautiful/comments/5pwqsj/what_makes_a_person_english_according_to_the/,7,7,,5,"What makes a person English, according to the English",2017-01-0382.jpg
Swedish Polls (Oct 2014 - Jan 2017) [OC],Morris360,2017-01-24 17:46:44,http://imgur.com/a/PdrPa,https://www.reddit.com/r/dataisbeautiful/comments/5pxj11/swedish_polls_oct_2014_jan_2017_oc/,7,7,,3,Swedish Polls (Oct 2014 - Jan 2017) OC,2017-01-0383.jpg
"One Dataset, Visualized 25 Ways",shabda,2017-01-24 18:11:04,http://flowingdata.com/2017/01/24/one-dataset-visualized-25-ways/,https://www.reddit.com/r/dataisbeautiful/comments/5pxoh7/one_dataset_visualized_25_ways/,21,21,,4,"One Dataset, Visualized 25 Ways",2017-01-0384.jpg
Treepedia :: MIT Senseable City Lab,VerGuy,2017-01-24 19:23:52,http://senseable.mit.edu/treepedia,https://www.reddit.com/r/dataisbeautiful/comments/5py4rn/treepedia_mit_senseable_city_lab/,3,3,,0,Treepedia MIT Senseable City Lab,2017-01-0385.jpg
[OC] IMDB user ratings for The Simpsons episodes,Twitchy_throttle,2017-01-24 20:00:59,http://imgur.com/a/Wnht2,https://www.reddit.com/r/dataisbeautiful/comments/5pydbj/oc_imdb_user_ratings_for_the_simpsons_episodes/,20,20,,5,OC IMDB user ratings for The Simpsons episodes,2017-01-0386.jpg
Acceptance Of Dual Citizenship In All European Countries [OC],asdlpg,2017-01-24 20:14:29,https://i.redd.it/ppep9ewqwpby.png,https://www.reddit.com/r/dataisbeautiful/comments/5pygit/acceptance_of_dual_citizenship_in_all_european/,28,28,,9,Acceptance Of Dual Citizenship In All European Countries OC,2017-01-0387.png
"Less cash, less crime: the effects of replacing paper checks with debit cards for welfare benefits [OC]",alexgabriel_i,2017-01-24 22:26:56,https://i.redd.it/4dbk3k1ckqby.png,https://www.reddit.com/r/dataisbeautiful/comments/5pzae2/less_cash_less_crime_the_effects_of_replacing/,7,7,,3,"Less cash, less crime the effects of replacing paper checks with debit cards for welfare benefits OC",2017-01-0388.png
Would I Survive A Nuke?,yum_blue_waffles,2017-01-24 23:06:50,http://wouldisurviveanuke.com/,https://www.reddit.com/r/dataisbeautiful/comments/5pzirq/would_i_survive_a_nuke/,20,20,,8,Would I Survive A Nuke,2017-01-0389.jpg
2017’s Most & Least Educated States,RowdyReader,2017-01-24 23:39:04,https://wallethub.com/edu/most-educated-states/31075/,https://www.reddit.com/r/dataisbeautiful/comments/5pzphx/2017s_most_least_educated_states/,8,8,,0,2017’s Most & Least Educated States,2017-01-0390.jpg
Visualizing the global weapon trade of the past 7 years [OC],visualminder,2017-01-25 02:08:15,https://i.redd.it/o4zc4mirnrby.png,https://www.reddit.com/r/dataisbeautiful/comments/5q0iau/visualizing_the_global_weapon_trade_of_the_past_7/,5361,5361,,386,Visualizing the global weapon trade of the past 7 years OC,2017-01-0391.png
Language diversity measured around the world [OC],alexgabriel_i,2017-01-25 07:42:14,https://i.redd.it/g5atty4hbtby.png,https://www.reddit.com/r/dataisbeautiful/comments/5q1z2z/language_diversity_measured_around_the_world_oc/,1574,1574,,281,Language diversity measured around the world OC,2017-01-0392.png
'The Unlikely Odds of Making it Big' for bands in NYC,AllSparks,2017-01-25 09:28:38,https://pudding.cool/2017/01/making-it-big/,https://www.reddit.com/r/dataisbeautiful/comments/5q2av0/the_unlikely_odds_of_making_it_big_for_bands_in/,24,24,,2,'The Unlikely Odds of Making it Big' for bands in NYC,2017-01-0393.jpg
(USA only) If you have more than 500 Twitter followers you’re in the top 15% most followed accounts [OC],GemmaJ123,2017-01-25 11:08:49,https://www.brandwatch.com/blog/react-tweeters-in-the-usa/,https://www.reddit.com/r/dataisbeautiful/comments/5q2ma7/usa_only_if_you_have_more_than_500_twitter/,14,14,,3,(USA only) If you have more than 500 Twitter followers you’re in the top 15% most followed accounts OC,2017-01-0394.jpg
Levels of corruption in the world,Victor4X,2017-01-25 11:59:50,https://www.transparency.org/news/feature/corruption_perceptions_index_2016,https://www.reddit.com/r/dataisbeautiful/comments/5q2sev/levels_of_corruption_in_the_world/,18,18,,14,Levels of corruption in the world,2017-01-0395.jpg
"When People Move Out of State, What States Do They Move To? [OC]",OverflowDs,2017-01-25 13:10:33,http://overflow.solutions/interactive-visualizations/when-people-move-out-of-state-what-states-do-they-move-to/,https://www.reddit.com/r/dataisbeautiful/comments/5q32tt/when_people_move_out_of_state_what_states_do_they/,44,44,,8,"When People Move Out of State, What States Do They Move To OC",2017-01-0396.jpg
Interactive visualization comparing the biggest tech IPOs to Snapchat's 2017 target,mhstrom,2017-01-25 14:21:57,https://www.geckoboard.com/tech-ipos/,https://www.reddit.com/r/dataisbeautiful/comments/5q3ewe/interactive_visualization_comparing_the_biggest/,8,8,,0,Interactive visualization comparing the biggest tech IPOs to Snapchat's 2017 target,2017-01-0397.jpg
Crowdsourced Predictive-Policing Reliability?,jazuqui,2017-01-25 14:53:23,https://www.reddit.com/r/dataisbeautiful/comments/5q3kpi/crowdsourced_predictivepolicing_reliability/,https://www.reddit.com/r/dataisbeautiful/comments/5q3kpi/crowdsourced_predictivepolicing_reliability/,2,2,,1,Crowdsourced Predictive-Policing Reliability,2017-01-0398.jpg
Aaron Koblin: Visualizing ourselves with crowd sourced data,lucidgazorpazorp,2017-01-25 15:40:01,https://www.ted.com/talks/aaron_koblin,https://www.reddit.com/r/dataisbeautiful/comments/5q3u7i/aaron_koblin_visualizing_ourselves_with_crowd/,3,3,,1,Aaron Koblin Visualizing ourselves with crowd sourced data,2017-01-0399.jpg
Al-Shabab attacks in Somalia (2006-2016),RedDyeNumber4,2017-01-25 15:40:39,http://www.aljazeera.com/indepth/interactive/2016/08/al-shabab-attacks-somalia-2006-2016-160830110231063.html,https://www.reddit.com/r/dataisbeautiful/comments/5q3uc6/alshabab_attacks_in_somalia_20062016/,5,5,,0,Al-Shabab attacks in Somalia (2006-2016),2017-01-0400.jpg
Which is the most obese country in the EU? (interactive viz),alexgabriel_i,2017-01-25 15:44:27,http://www.euronews.com/2016/10/20/which-is-the-most-obese-country-in-the-eu,https://www.reddit.com/r/dataisbeautiful/comments/5q3v5c/which_is_the_most_obese_country_in_the_eu/,2,2,,0,Which is the most obese country in the EU (interactive viz),2017-01-0401.jpg
Food at Shake Shack JFK is about a penny per calorie [OC],tilapios,2017-01-25 15:54:20,https://i.redd.it/365v1z8zpvby.png,https://www.reddit.com/r/dataisbeautiful/comments/5q3xat/food_at_shake_shack_jfk_is_about_a_penny_per/,14024,14024,,673,Food at Shake Shack JFK is about a penny per calorie OC,2017-01-0402.png
Animated chart of age distribution of workers for social security benefits from 1969 to 2016,victorp93,2017-01-25 16:37:22,https://vysda.com/post/age-distribution-of-workers-for-social-security-benefits-from-1969-to-2016-numbers-are-in-thousands/1072,https://www.reddit.com/r/dataisbeautiful/comments/5q46u0/animated_chart_of_age_distribution_of_workers_for/,3,3,,0,Animated chart of age distribution of workers for social security benefits from 1969 to 2016,2017-01-0403.jpg
Fast Food Frequency [OC],johnnelsonIDV,2017-01-25 17:26:48,https://adventuresinmapping.com/2017/01/18/fast-food-frequency/,https://www.reddit.com/r/dataisbeautiful/comments/5q4i0t/fast_food_frequency_oc/,96,96,,19,Fast Food Frequency OC,2017-01-0404.jpg
"Slang, ranked by Google searches for its definition in 2016 [OC]",mfdaniels,2017-01-25 17:33:28,http://googletrends.github.io/year-in-language,https://www.reddit.com/r/dataisbeautiful/comments/5q4jkk/slang_ranked_by_google_searches_for_its/,92,92,,21,"Slang, ranked by Google searches for its definition in 2016 OC",2017-01-0405.jpg
Naturally Occurring Fibonacci Ratios in Financial Markets [OC],bglueck,2017-01-25 17:39:17,https://i.redd.it/kjohcc72awby.jpg,https://www.reddit.com/r/dataisbeautiful/comments/5q4kwg/naturally_occurring_fibonacci_ratios_in_financial/,11,11,,7,Naturally Occurring Fibonacci Ratios in Financial Markets OC,2017-01-0406.jpg
Google's Unfiltered News platform that visualizes news coverage from around the world.,friendofmany,2017-01-25 17:47:50,https://unfiltered.news/#/2017/01/25,https://www.reddit.com/r/dataisbeautiful/comments/5q4ms7/googles_unfiltered_news_platform_that_visualizes/,12,12,,2,Google's Unfiltered News platform that visualizes news coverage from around the world.,2017-01-0407.jpg
Alcohol belts of Europe,shabda,2017-01-25 18:18:17,https://en.wikipedia.org/wiki/Alcohol_belts_of_Europe,https://www.reddit.com/r/dataisbeautiful/comments/5q4toc/alcohol_belts_of_europe/,7,7,,3,Alcohol belts of Europe,2017-01-0408.jpg
Extreme poverty and child mortality over time,winstonl,2017-01-25 18:21:59,https://ourworldindata.org/grapher/poverty-and-child-mortality?time=2015,https://www.reddit.com/r/dataisbeautiful/comments/5q4uj1/extreme_poverty_and_child_mortality_over_time/,16,16,,1,Extreme poverty and child mortality over time,2017-01-0409.jpg
"In the West, falling confidence in political elites has pushed down democracy-index scores",GlobalClimateChange,2017-01-25 18:29:16,http://www.economist.com/blogs/graphicdetail/2017/01/daily-chart-20?fsrc=scn/tw/te/bl/ed/decliningtrustingovernmentisdentingdemocracy,https://www.reddit.com/r/dataisbeautiful/comments/5q4w6n/in_the_west_falling_confidence_in_political/,21,21,,8,"In the West, falling confidence in political elites has pushed down democracy-index scores",2017-01-0410.jpg
Data USA: A comprehensive website and visualization engine of public US Government data,namaloom,2017-01-25 21:08:13,https://datausa.io,https://www.reddit.com/r/dataisbeautiful/comments/5q5wu5/data_usa_a_comprehensive_website_and/,8,8,,0,Data USA A comprehensive website and visualization engine of public US Government data,2017-01-0411.jpg
$ Spent / Student in the US by dsistrict,RedPilledIt,2017-01-25 21:40:17,http://www.edweek.org/ew/section/multimedia/map-how-per-pupil-spending-compares-across-us.html,https://www.reddit.com/r/dataisbeautiful/comments/5q63wx/spent_student_in_the_us_by_dsistrict/,4,4,,0,$ Spent Student in the US by dsistrict,2017-01-0412.jpg
Fascinating NY Times article on what TV shows are popular in different regions!,DrDakka13,2017-01-25 22:40:06,https://www.nytimes.com/interactive/2016/12/26/upshot/duck-dynasty-vs-modern-family-television-maps.html?WT.mc_id=2016-KWP-MOBILE-AUD_DEV&WT.mc_ev=click&ad-keywords=MOBILEFULLPAGE&kwp_0=301801&kwp_4=1169215&kwp_1=532113&_r=0,https://www.reddit.com/r/dataisbeautiful/comments/5q6gzw/fascinating_ny_times_article_on_what_tv_shows_are/,2,2,,0,Fascinating NY Times article on what TV shows are popular in different regions!,2017-01-0413.jpg
How to interact with the 1.2 billion row NYC taxi dataset demo using the Immerse visual analytics engine [OC],jtsymonds,2017-01-25 22:53:53,https://www.mapd.com/blog/2017/01/25/tips-tricks-tasks-for-the-1-2-billion-row-taxi-dataset/,https://www.reddit.com/r/dataisbeautiful/comments/5q6jyd/how_to_interact_with_the_12_billion_row_nyc_taxi/,9,9,,4,How to interact with the 1.2 billion row NYC taxi dataset demo using the Immerse visual analytics engine OC,2017-01-0414.jpg
Income Distribution in NYC [OC],heyusoft,2017-01-26 02:56:45,https://i.redd.it/hh68a6sg1zby.png,https://www.reddit.com/r/dataisbeautiful/comments/5q7ux2/income_distribution_in_nyc_oc/,555,555,,89,Income Distribution in NYC OC,2017-01-0415.png
Data Sonification using the Twitter API and IBM-Watson Tone Analyzer [OC],besaph,2017-01-26 03:37:16,https://vimeo.com/200977840,https://www.reddit.com/r/dataisbeautiful/comments/5q821t/data_sonification_using_the_twitter_api_and/,9,9,,1,Data Sonification using the Twitter API and IBM-Watson Tone Analyzer OC,2017-01-0416.jpg
"Actually, Many ‘Inner Cities’ Are Doing Great",profcyclist,2017-01-26 03:40:14,https://nytimes.com/2016/10/12/upshot/actually-many-inner-cities-are-doing-great.html?rref=collection%2Fsectioncollection%2Fupshot&action=click&contentCollection=upshot&region=rank&module=package&version=highlights&contentPlacement=2&pgtype=sectionfront&referer=,https://www.reddit.com/r/dataisbeautiful/comments/5q82jk/actually_many_inner_cities_are_doing_great/,2,2,,0,"Actually, Many ‘Inner Cities’ Are Doing Great",2017-01-0417.jpg
"Trump inauguration numbers compared to previous presidents, relative to voter turnout [repost, Political Thursdays] [OC]",alwaystooupbeat,2017-01-26 06:00:29,http://imgur.com/gallery/dKUrX,https://www.reddit.com/r/dataisbeautiful/comments/5q8oru/trump_inauguration_numbers_compared_to_previous/,55,55,,36,"Trump inauguration numbers compared to previous presidents, relative to voter turnout repost, Political Thursdays OC",2017-01-0418.jpg
Clemency Statistics By (US) President Since McKinley [OC],wanmoar,2017-01-26 08:57:45,https://www.reddit.com/r/dataisbeautiful/comments/5q98w9/clemency_statistics_by_us_president_since/,https://www.reddit.com/r/dataisbeautiful/comments/5q98w9/clemency_statistics_by_us_president_since/,3,3,,3,Clemency Statistics By (US) President Since McKinley OC,2017-01-0419.jpg
"Cigarette consumption trends, seen by country income groups [OC]",alexgabriel_i,2017-01-26 10:13:24,https://i.redd.it/x5lfo80171cy.png,https://www.reddit.com/r/dataisbeautiful/comments/5q9ghp/cigarette_consumption_trends_seen_by_country/,27,27,,10,"Cigarette consumption trends, seen by country income groups OC",2017-01-0420.png
"Presidential approval ratings: Trump sets new low, Obama ties Ike (again) [OC]",Toado85,2017-01-26 13:00:52,http://polstats.com/#!/approval,https://www.reddit.com/r/dataisbeautiful/comments/5qa0aa/presidential_approval_ratings_trump_sets_new_low/,9,9,,11,"Presidential approval ratings Trump sets new low, Obama ties Ike (again) OC",2017-01-0421.jpg
Sentiment Comparison between Trump and Obama's Inauguration Speeches [OC],madzthakz,2017-01-26 13:46:18,http://i.imgur.com/JaGfRX4.jpg,https://www.reddit.com/r/dataisbeautiful/comments/5qa7ra/sentiment_comparison_between_trump_and_obamas/,4,4,,2,Sentiment Comparison between Trump and Obama's Inauguration Speeches OC,2017-01-0422.jpg
When Trump's NYC hotels will be flooded by sea level rise (pdf) [OC],nicholaides,2017-01-26 14:45:43,http://imgur.com/a/eToFo,https://www.reddit.com/r/dataisbeautiful/comments/5qaief/when_trumps_nyc_hotels_will_be_flooded_by_sea/,10,10,,3,When Trump's NYC hotels will be flooded by sea level rise (pdf) OC,2017-01-0423.jpg
Word count and significance analysis of Trump's inauguration speech compared to other Presidents' inauguration speeches [OC],joeltenenbaum,2017-01-26 15:02:29,http://imgur.com/a/LcmmF,https://www.reddit.com/r/dataisbeautiful/comments/5qals7/word_count_and_significance_analysis_of_trumps/,4,4,,2,Word count and significance analysis of Trump's inauguration speech compared to other Presidents' inauguration speeches OC,2017-01-0424.jpg
Word Clouds of Obama's and Trump's Inauguration Speeches [OC],KrAzYkArL18769,2017-01-26 15:02:37,http://imgur.com/a/KZCEU,https://www.reddit.com/r/dataisbeautiful/comments/5qalt2/word_clouds_of_obamas_and_trumps_inauguration/,100,100,,19,Word Clouds of Obama's and Trump's Inauguration Speeches OC,2017-01-0425.jpg
Age Differences of Celebrity Couples [OC],CuriousGnu,2017-01-26 15:20:32,https://www.curiousgnu.com/age-differences-celebrity-couples,https://www.reddit.com/r/dataisbeautiful/comments/5qaplx/age_differences_of_celebrity_couples_oc/,4,4,,2,Age Differences of Celebrity Couples OC,2017-01-0426.jpg
US manufacturing is 85% higher today than it was under Ronald Reagan.,MoesBAR,2017-01-26 15:34:33,https://fred.stlouisfed.org/series/OUTMS#0,https://www.reddit.com/r/dataisbeautiful/comments/5qasg9/us_manufacturing_is_85_higher_today_than_it_was/,8,8,,5,US manufacturing is 85% higher today than it was under Ronald Reagan.,2017-01-0427.jpg
Women's Marches Bubble Map [OC],zazerr,2017-01-26 15:40:33,https://zischwartz.github.io/womensmarches/,https://www.reddit.com/r/dataisbeautiful/comments/5qatnl/womens_marches_bubble_map_oc/,20,20,,4,Women's Marches Bubble Map OC,2017-01-0428.jpg
Here's how Obamacare covered Americans with pre-existing conditions. What happens next?,collared_dropout,2017-01-26 16:14:55,https://www.theguardian.com/us-news/ng-interactive/2017/jan/26/obamacare-what-next-healthcare-preexisting-conditions,https://www.reddit.com/r/dataisbeautiful/comments/5qb0zd/heres_how_obamacare_covered_americans_with/,12,12,,17,Here's how Obamacare covered Americans with pre-existing conditions. What happens next,2017-01-0429.jpg
The average color of each frame of movies put into a single picture [OC],I_cant_speel,2017-01-26 16:29:22,http://imgur.com/gallery/WvnnU?lr=0,https://www.reddit.com/r/dataisbeautiful/comments/5qb41f/the_average_color_of_each_frame_of_movies_put/,50,50,,17,The average color of each frame of movies put into a single picture OC,2017-01-0430.jpg
Inauguration vs. Women's March crowds [OC],AltStatistician,2017-01-26 16:37:45,https://i.redd.it/qtsbu7bw33cy.png,https://www.reddit.com/r/dataisbeautiful/comments/5qb5v7/inauguration_vs_womens_march_crowds_oc/,6,6,,4,Inauguration vs. Women's March crowds OC,2017-01-0431.png
Ringing in 2017 with Uber,profcyclist,2017-01-26 17:19:28,https://newsroom.uber.com/nye2016/,https://www.reddit.com/r/dataisbeautiful/comments/5qbfed/ringing_in_2017_with_uber/,1,1,,0,Ringing in 2017 with Uber,2017-01-0432.jpg
