title,author,created_date,url,full_permalink,score,ups,downs,num_comments,sanitized_title,image_file
How will the Rajya Sabha elections affect NDA and UPA numbers? [OC],ultimateposeur,2017-08-09 07:32:05,http://projects.wionews.com/how-will-rajya-sabha-elections-affect-nda-and-upa-numbers/,https://www.reddit.com/r/dataisbeautiful/comments/6sjx5g/how_will_the_rajya_sabha_elections_affect_nda_and/,8,8,,4,How will the Rajya Sabha elections affect NDA and UPA numbers OC,2017-08-0145.jpg
City maps from Airbnb location ratings [OC] [2123x2123],txafer,2017-08-09 09:54:12,https://i.redd.it/br5vs0g2poez.jpg,https://www.reddit.com/r/dataisbeautiful/comments/6skgfu/city_maps_from_airbnb_location_ratings_oc/,31510,31510,,1031,City maps from Airbnb location ratings OC 2123x2123,2017-08-0146.jpg
"The most talked about moments from GoT ""Spoils of War"" [OC]",GemmaJ123,2017-08-09 11:03:00,https://www.brandwatch.com/blog/react-game-thrones-season-7-episode-4/?utm_source=reddit&utm_medium=react&utm_term=blog&utm_campaign=08_2017_entertainment_blog,https://www.reddit.com/r/dataisbeautiful/comments/6skqem/the_most_talked_about_moments_from_got_spoils_of/,4,4,,2,The most talked about moments from GoT Spoils of War OC,2017-08-0147.jpg
D.C.'s Heat Islands [OC],smitty1788,2017-08-09 13:08:37,https://i.redd.it/jpqxc6qbopez.png,https://www.reddit.com/r/dataisbeautiful/comments/6slcl0/dcs_heat_islands_oc/,52,52,,8,D.C.'s Heat Islands OC,2017-08-0148.png
Shark attacks in Australia (1869-2017) [OC],mgouldy,2017-08-09 15:07:42,https://i.redd.it/0kvtdgra9qez.png,https://www.reddit.com/r/dataisbeautiful/comments/6sm2sj/shark_attacks_in_australia_18692017_oc/,29,29,,11,Shark attacks in Australia (1869-2017) OC,2017-08-0149.png
2017’s Safest States in America,emilNYC,2017-08-09 15:32:50,https://wallethub.com/edu/safest-states-to-live-in/4566/,https://www.reddit.com/r/dataisbeautiful/comments/6sm8t3/2017s_safest_states_in_america/,2,2,,1,2017’s Safest States in America,2017-08-0150.jpg
Game of Thrones viewers chart beauty-ugliness and good-evil | NY Times,tingtanguh,2017-08-09 17:05:55,https://www.nytimes.com/interactive/2017/08/09/upshot/game-of-thrones-chart.html?smid=fb-nytimes&smtyp=cur,https://www.reddit.com/r/dataisbeautiful/comments/6smvpq/game_of_thrones_viewers_chart_beautyugliness_and/,26,26,,5,Game of Thrones viewers chart beauty-ugliness and good-evil NY Times,2017-08-0151.jpg
A visualization of a Counter-Strike Global Offensive round [OC],yohghoj,2017-08-09 17:37:00,http://imgur.com/jm9BG18,https://www.reddit.com/r/dataisbeautiful/comments/6sn3j4/a_visualization_of_a_counterstrike_global/,85,85,,11,A visualization of a Counter-Strike Global Offensive round OC,2017-08-0152.jpg
1st and Last Update: Method of Orgasm by Both Me and my Wife (aka the update no-one wanted) [OC],sexydataset,2017-08-09 18:28:13,https://i.redd.it/4jqxnm1s8rez.png,https://www.reddit.com/r/dataisbeautiful/comments/6sngh2/1st_and_last_update_method_of_orgasm_by_both_me/,108,108,,30,1st and Last Update Method of Orgasm by Both Me and my Wife (aka the update no-one wanted) OC,2017-08-0153.png
Charting the change in income distribution throughout NYC’s five boroughs between 1990 and 2015,btumpak,2017-08-09 22:36:28,https://ny.curbed.com/platform/amp/2017/8/9/16119400/income-distribution-nyc-map,https://www.reddit.com/r/dataisbeautiful/comments/6sp3pf/charting_the_change_in_income_distribution/,2,2,,0,Charting the change in income distribution throughout NYC’s five boroughs between 1990 and 2015,2017-08-0154.jpg
"Texas Live Births trended against Abortions, each trend line is per 100k people to remove population change bias [OC]",karate_skillz,2017-08-09 22:53:01,https://i.redd.it/24e2alsaksez.jpg,https://www.reddit.com/r/dataisbeautiful/comments/6sp7dn/texas_live_births_trended_against_abortions_each/,4,4,,3,"Texas Live Births trended against Abortions, each trend line is per 100k people to remove population change bias OC",2017-08-0155.jpg
Percentage of men and women by the career on my university [OC],EtraStyle,2017-08-09 23:28:50,https://i.redd.it/dk4jnum0rsez.png,https://www.reddit.com/r/dataisbeautiful/comments/6spewh/percentage_of_men_and_women_by_the_career_on_my/,994,994,,173,Percentage of men and women by the career on my university OC,2017-08-0156.png
"MLB player Adrian Beltre's 3,000 hits visualized",KindaSortaSuccinct,2017-08-10 01:10:31,https://interactives.dallasnews.com/2017/beltre-3000-hits/,https://www.reddit.com/r/dataisbeautiful/comments/6spzdl/mlb_player_adrian_beltres_3000_hits_visualized/,7,7,,0,"MLB player Adrian Beltre's 3,000 hits visualized",2017-08-0157.jpg
The state-by-state correlation between teen birth rates and religious conviction [OC],academiaadvice,2017-08-10 04:22:32,https://i.redd.it/pu04carq6uez.png,https://www.reddit.com/r/dataisbeautiful/comments/6sqz0d/the_statebystate_correlation_between_teen_birth/,15924,15924,,1357,The state-by-state correlation between teen birth rates and religious conviction OC,2017-08-0158.png
Shortfalls on paris emissions targets,jimrosenz,2017-08-10 07:52:33,http://www.nature.com/news/prove-paris-was-more-than-paper-promises-1.22378,https://www.reddit.com/r/dataisbeautiful/comments/6srun2/shortfalls_on_paris_emissions_targets/,3,3,,0,Shortfalls on paris emissions targets,2017-08-0159.jpg
"How much banks ""should"" and how little they ""must"". Analysis of banking regulatory texts of the past four decades [OC]",marie-joseKolly,2017-08-10 10:35:23,https://i.redd.it/i74n91v20wez.png,https://www.reddit.com/r/dataisbeautiful/comments/6ssgnq/how_much_banks_should_and_how_little_they_must/,20,20,,3,How much banks should and how little they must. Analysis of banking regulatory texts of the past four decades OC,2017-08-0160.png
Postal vote relative turnout by age group (Australia) [OC],JohnWilliamStrutt,2017-08-10 10:54:47,http://imgur.com/a/MSqwE,https://www.reddit.com/r/dataisbeautiful/comments/6ssjgt/postal_vote_relative_turnout_by_age_group/,9,9,,6,Postal vote relative turnout by age group (Australia) OC,2017-08-0161.jpg
The demographics of self-identified Flat Earthers,GemmaJ123,2017-08-10 10:55:15,https://www.brandwatch.com/blog/react-flat-earthers/?utm_source=reddit&utm_medium=react&utm_term=other&utm_campaign=08_2017_entertainment_blog,https://www.reddit.com/r/dataisbeautiful/comments/6ssjis/the_demographics_of_selfidentified_flat_earthers/,22,22,,15,The demographics of self-identified Flat Earthers,2017-08-0162.jpg
[OC] All vetoes by president,LastGolbScholar,2017-08-10 11:08:36,https://i.redd.it/0kwgu4sy7wez.jpg,https://www.reddit.com/r/dataisbeautiful/comments/6sslkw/oc_all_vetoes_by_president/,62,62,,13,OC All vetoes by president,2017-08-0163.jpg
States With More Abortion Restrictions Score Worse On Women's Health,einespast,2017-08-10 11:17:29,http://www.wbur.org/commonhealth/2017/08/01/states-abortion-restrictions-health,https://www.reddit.com/r/dataisbeautiful/comments/6ssmy9/states_with_more_abortion_restrictions_score/,28,28,,0,States With More Abortion Restrictions Score Worse On Women's Health,2017-08-0164.jpg
"Improving the Rainbow (AKA: Visual comparison of the colours in the visible spectrum, approximated with different algorithms) [OC]",AlanZucconi,2017-08-10 12:11:46,http://imgur.com/a/ki1pw,https://www.reddit.com/r/dataisbeautiful/comments/6ssvwg/improving_the_rainbow_aka_visual_comparison_of/,12,12,,6,"Improving the Rainbow (AKA Visual comparison of the colours in the visible spectrum, approximated with different algorithms) OC",2017-08-0165.jpg
Nuclear weapons tests from 1945 - 2017 (Washington Post),DLC204,2017-08-10 12:45:12,https://www.washingtonpost.com/graphics/world/nuclear-tests/?%3Ftid%3D=sm_pg&utm_term=.c7afeb66fff4,https://www.reddit.com/r/dataisbeautiful/comments/6st21e/nuclear_weapons_tests_from_1945_2017_washington/,8,8,,0,Nuclear weapons tests from 1945 - 2017 (Washington Post),2017-08-0166.jpg
What percentage of households own a computer in each state? [OC],OverflowDs,2017-08-10 13:17:53,http://overflow.solutions/demographic-data/what-percentage-of-households-own-a-computer-in-each-state/,https://www.reddit.com/r/dataisbeautiful/comments/6st8pb/what_percentage_of_households_own_a_computer_in/,10,10,,5,What percentage of households own a computer in each state OC,2017-08-0167.jpg
Tweetcloud of Donald Trump's recent tweets [OC],SeanCooke,2017-08-10 13:30:31,http://imgur.com/Ck6pOqF,https://www.reddit.com/r/dataisbeautiful/comments/6stb9n/tweetcloud_of_donald_trumps_recent_tweets_oc/,14,14,,6,Tweetcloud of Donald Trump's recent tweets OC,2017-08-0168.jpg
A world of languages - and how many speak them,Raja_Raja_Cholan,2017-08-10 13:37:18,http://www.scmp.com/infographics/article/1810040/infographic-world-languages,https://www.reddit.com/r/dataisbeautiful/comments/6stclm/a_world_of_languages_and_how_many_speak_them/,60,60,,13,A world of languages - and how many speak them,2017-08-0169.jpg
My take on the state-by-state correlation between birth rates and religious conviction [OC],assman312,2017-08-10 15:18:56,https://i.redd.it/qxwk1e6ggxez.png,https://www.reddit.com/r/dataisbeautiful/comments/6stzc2/my_take_on_the_statebystate_correlation_between/,23,23,,15,My take on the state-by-state correlation between birth rates and religious conviction OC,2017-08-0170.png
Income growth by income percentile over the last 34 years,fl4v1,2017-08-10 15:22:20,https://www.nytimes.com/interactive/2017/08/07/opinion/leonhardt-income-inequality.html,https://www.reddit.com/r/dataisbeautiful/comments/6su058/income_growth_by_income_percentile_over_the_last/,87,87,,18,Income growth by income percentile over the last 34 years,2017-08-0171.jpg
The average days you'll spend in a prison when stealing $1 million: Ponzi Scheme vs. committing robbery,cyberhye,2017-08-10 15:57:00,http://securitiesanalytics.com/would-you-spend-21-days-in-prison-for-1-million-dollars-2016-ponzi-scheme-analytics/,https://www.reddit.com/r/dataisbeautiful/comments/6su8h8/the_average_days_youll_spend_in_a_prison_when/,44,44,,12,The average days you'll spend in a prison when stealing $1 million Ponzi Scheme vs. committing robbery,2017-08-0172.jpg
Sequel to The Fallen of World War II is on nuclear warfare & peacekeeping,filmydataviz,2017-08-10 17:03:43,https://youtu.be/bIAF7kBbGKk,https://www.reddit.com/r/dataisbeautiful/comments/6sup1m/sequel_to_the_fallen_of_world_war_ii_is_on/,5,5,,1,Sequel to The Fallen of World War II is on nuclear warfare & peacekeeping,2017-08-0173.jpg
The bottom 50% of Russians have experienced negative income growth since the fall of the Soviet Union,kludgeocracy,2017-08-10 17:21:44,http://i.imgur.com/3eAPiTS.jpg,https://www.reddit.com/r/dataisbeautiful/comments/6sutjd/the_bottom_50_of_russians_have_experienced/,72,72,,13,The bottom 50% of Russians have experienced negative income growth since the fall of the Soviet Union,2017-08-0174.jpg
"World map from 20,108 pairs of sister cities [5586x4098] [OC]",Belteshassar,2017-08-10 17:59:18,https://i.redd.it/38n6ztni8yez.png,https://www.reddit.com/r/dataisbeautiful/comments/6sv2ud/world_map_from_20108_pairs_of_sister_cities/,145,145,,8,"World map from 20,108 pairs of sister cities 5586x4098 OC",2017-08-0175.png
If All the Billionaires in Each Country Gave Everyone an Equal Share of their Fortune,Van_ae,2017-08-10 19:20:25,http://www.vividmaps.com/2017/08/if-all-billionaires-in-each-country.html,https://www.reddit.com/r/dataisbeautiful/comments/6svn7e/if_all_the_billionaires_in_each_country_gave/,10,10,,1,If All the Billionaires in Each Country Gave Everyone an Equal Share of their Fortune,2017-08-0176.jpg
"How did ""Last Week Tonight with John Oliver"" use YouTube to grow their brand and maximize their audience? [OC]",mskm203,2017-08-10 19:24:56,https://public.tableau.com/views/LastWeekTonight-IronViz/LastWeekTonight?:embed=y&:display_count=yes&publish=yes&:showVizHome=no,https://www.reddit.com/r/dataisbeautiful/comments/6svocx/how_did_last_week_tonight_with_john_oliver_use/,7,7,,2,How did Last Week Tonight with John Oliver use YouTube to grow their brand and maximize their audience OC,2017-08-0177.jpg
10 years of fact-checking: It got easier -- and harder,DijonPepperberry,2017-08-10 19:36:16,http://www.politifact.com/truth-o-meter/article/2017/aug/02/10-years-fact-checking-it-got-easier-and-harder/,https://www.reddit.com/r/dataisbeautiful/comments/6svr5o/10_years_of_factchecking_it_got_easier_and_harder/,4,4,,1,10 years of fact-checking It got easier -- and harder,2017-08-0178.jpg
Airline Performance in 2015,sataky,2017-08-10 20:05:33,http://community.wolfram.com/groups/-/m/t/1161914,https://www.reddit.com/r/dataisbeautiful/comments/6svybp/airline_performance_in_2015/,3,3,,0,Airline Performance in 2015,2017-08-0179.jpg
The state-by-state correlation between teen birth rates and abstinence [OC],SandyPastor,2017-08-10 20:09:19,https://i.redd.it/atzmyn3fwyez.jpg,https://www.reddit.com/r/dataisbeautiful/comments/6svzah/the_statebystate_correlation_between_teen_birth/,5,5,,4,The state-by-state correlation between teen birth rates and abstinence OC,2017-08-0180.jpg
[OC] US State Trumpcare Votes,cruyff8,2017-08-10 20:24:21,http://i.imgur.com/geZ8cTN.png,https://www.reddit.com/r/dataisbeautiful/comments/6sw2w9/oc_us_state_trumpcare_votes/,0,0,,5,OC US State Trumpcare Votes,2017-08-0181.png
Correlation of Abortion Rates and Religiosity by State for 2013. Expanding Upon /u/academiaadvice Post Earlier Today. [OC],dubweezie,2017-08-10 23:37:46,https://i.redd.it/4jol4lb1wzez.png,https://www.reddit.com/r/dataisbeautiful/comments/6sxb6l/correlation_of_abortion_rates_and_religiosity_by/,7,7,,7,Correlation of Abortion Rates and Religiosity by State for 2013. Expanding Upon uacademiaadvice Post Earlier Today. OC,2017-08-0182.png
$100 of Bitcoin in 2010 is now $4.3M [OC],myDataTraining,2017-08-10 23:39:57,https://i.redd.it/4ze5dwxaxzez.png,https://www.reddit.com/r/dataisbeautiful/comments/6sxbkv/100_of_bitcoin_in_2010_is_now_43m_oc/,25069,25069,,2702,$100 of Bitcoin in 2010 is now $4.3M OC,2017-08-0183.png
isometric joyplot,whoInvited,2017-08-11 03:52:13,http://bl.ocks.org/tomshanley/42d09e832ade97b354ef268c534f5a92,https://www.reddit.com/r/dataisbeautiful/comments/6syos6/isometric_joyplot/,6,6,,2,isometric joyplot,2017-08-0184.jpg
Changing climate shifts timing of European floods,Belteshassar,2017-08-11 09:27:46,http://science.sciencemag.org/content/357/6351/588.full,https://www.reddit.com/r/dataisbeautiful/comments/6t01a0/changing_climate_shifts_timing_of_european_floods/,2,2,,0,Changing climate shifts timing of European floods,2017-08-0185.jpg
"A Comparison of Financial Performance of Amazon, Alphabet, Apple & FB",vladatb,2017-08-11 09:29:03,https://www.accompany.com/insights/growth-of-apple-amazon-google-facebook/,https://www.reddit.com/r/dataisbeautiful/comments/6t01f0/a_comparison_of_financial_performance_of_amazon/,6,6,,1,"A Comparison of Financial Performance of Amazon, Alphabet, Apple & FB",2017-08-0186.jpg
COOL warming visualization: Temperature anomalies arranged by country 1900 - 2016. Visualization based on GISTEMP data,Sorosbot666,2017-08-11 11:34:47,https://www.flickr.com/photos/150411108@N06/35471910724/,https://www.reddit.com/r/dataisbeautiful/comments/6t0jmr/cool_warming_visualization_temperature_anomalies/,3,3,,1,COOL warming visualization Temperature anomalies arranged by country 1900 - 2016. Visualization based on GISTEMP data,2017-08-0187.jpg
Daily steps taken since we got a pup [OC],howMuchCheeseIs2Much,2017-08-11 12:12:16,https://i.redd.it/yreaavzyn3fz.png,https://www.reddit.com/r/dataisbeautiful/comments/6t0q2x/daily_steps_taken_since_we_got_a_pup_oc/,87,87,,7,Daily steps taken since we got a pup OC,2017-08-0188.png
A guide to 21st century Hollywood film directors. [OC],KeenB_,2017-08-11 12:31:43,https://i.redd.it/v6fge6lgr3fz.png,https://www.reddit.com/r/dataisbeautiful/comments/6t0tqt/a_guide_to_21st_century_hollywood_film_directors/,42,42,,9,A guide to 21st century Hollywood film directors. OC,2017-08-0189.png
Looking for blue skies for the August 21 eclipse? I analyzed 16 years of data to see where the skies are clearest [OC],Geographist,2017-08-11 12:53:18,https://i.redd.it/9m3fth27v3fz.png,https://www.reddit.com/r/dataisbeautiful/comments/6t0xwq/looking_for_blue_skies_for_the_august_21_eclipse/,24729,24729,,1163,Looking for blue skies for the August 21 eclipse I analyzed 16 years of data to see where the skies are clearest OC,2017-08-0190.png
What percentage of the population lives in poverty in each U.S. county? [OC],OverflowDs,2017-08-11 13:01:46,http://overflow.solutions/demographic-data/what-percentage-of-the-population-lives-in-poverty-in-each-u-s-county/,https://www.reddit.com/r/dataisbeautiful/comments/6t0zm8/what_percentage_of_the_population_lives_in/,24,24,,2,What percentage of the population lives in poverty in each U.S. county OC,2017-08-0191.jpg
Map of Canada native languages,the_isra17,2017-08-11 15:05:45,http://www.ledevoir.com/documents/special/17-08_carte-points-recensement/index.html,https://www.reddit.com/r/dataisbeautiful/comments/6t1q8w/map_of_canada_native_languages/,39,39,,9,Map of Canada native languages,2017-08-0192.jpg
Top 15 Craft Beer Choices based on American taste buds [OC],eltigrevalioso,2017-08-11 15:49:18,https://i.redd.it/8jsktlnlq4fz.png,https://www.reddit.com/r/dataisbeautiful/comments/6t20mv/top_15_craft_beer_choices_based_on_american_taste/,11,11,,9,Top 15 Craft Beer Choices based on American taste buds OC,2017-08-0193.png
"The Shadow Peace, Part 1 - The Nuclear Threat",KC_Buddyl33,2017-08-11 16:13:02,https://www.youtube.com/watch?v=bIAF7kBbGKk&feature=youtu.be,https://www.reddit.com/r/dataisbeautiful/comments/6t26bu/the_shadow_peace_part_1_the_nuclear_threat/,6,6,,1,"The Shadow Peace, Part 1 - The Nuclear Threat",2017-08-0194.jpg
How Airbnb Visitors Rate Location in Major US Cities,dwaxe,2017-08-11 17:35:39,http://flowingdata.com/2017/08/10/how-neighborhoods-in-major-us-cities-rate-on-airbnb/,https://www.reddit.com/r/dataisbeautiful/comments/6t2qmm/how_airbnb_visitors_rate_location_in_major_us/,3,3,,0,How Airbnb Visitors Rate Location in Major US Cities,2017-08-0195.jpg
"Good, Evil, Ugly, Beautiful: Help Make a ‘Game of Thrones’ Chart",Hugh_Lauries_Ghost,2017-08-11 17:58:17,https://www.nytimes.com/interactive/2017/08/09/upshot/game-of-thrones-chart.html,https://www.reddit.com/r/dataisbeautiful/comments/6t2wif/good_evil_ugly_beautiful_help_make_a_game_of/,13,13,,2,"Good, Evil, Ugly, Beautiful Help Make a ‘Game of Thrones’ Chart",2017-08-0196.jpg
The Cheddar Counter: Disposable income by city and profession [OC],import_this,2017-08-11 18:11:15,https://www.mytrove.com/t/cheddar-counter,https://www.reddit.com/r/dataisbeautiful/comments/6t2zos/the_cheddar_counter_disposable_income_by_city_and/,6,6,,5,The Cheddar Counter Disposable income by city and profession OC,2017-08-0197.jpg
Baseball - Comparison of the top 10 in batting average w/ RISP compared to their overall batting averages (2017). [OC],bill_murrays_liver,2017-08-11 18:31:31,https://i.redd.it/v3dgxfu1j5fz.jpg,https://www.reddit.com/r/dataisbeautiful/comments/6t34l0/baseball_comparison_of_the_top_10_in_batting/,6,6,,7,Baseball - Comparison of the top 10 in batting average w RISP compared to their overall batting averages (2017). OC,2017-08-0198.jpg
Global Shark Tracker - Find your favorite sharks and follow them through their life.,DeveloperDaniel,2017-08-11 19:22:57,http://www.ocearch.org/tracker/,https://www.reddit.com/r/dataisbeautiful/comments/6t3h88/global_shark_tracker_find_your_favorite_sharks/,2,2,,3,Global Shark Tracker - Find your favorite sharks and follow them through their life.,2017-08-0199.jpg
What Can North Korea Reach With Its Missiles?,Ietsnba,2017-08-11 20:42:42,https://www.nytimes.com/interactive/2017/08/10/world/asia/what-can-north-korea-reach-with-its-missiles.html,https://www.reddit.com/r/dataisbeautiful/comments/6t40pz/what_can_north_korea_reach_with_its_missiles/,13,13,,1,What Can North Korea Reach With Its Missiles,2017-08-0200.jpg
'The Refugee Project' by the design firm Hyperakt. Looking at the growth of Refugees around the world.,slappathebass,2017-08-11 20:55:43,http://www.therefugeeproject.org/,https://www.reddit.com/r/dataisbeautiful/comments/6t43qf/the_refugee_project_by_the_design_firm_hyperakt/,4,4,,0,'The Refugee Project' by the design firm Hyperakt. Looking at the growth of Refugees around the world.,2017-08-0201.jpg
Percent of electricity produced from all renewable sources worldwide [OC],Ponicrat,2017-08-11 21:47:04,https://i.redd.it/423ddagei6fz.png,https://www.reddit.com/r/dataisbeautiful/comments/6t4f53/percent_of_electricity_produced_from_all/,83,83,,15,Percent of electricity produced from all renewable sources worldwide OC,2017-08-0202.png
Analysis | Leaving downtown at rush hour in America’s largest cities,peter177,2017-08-11 22:34:23,https://www.washingtonpost.com/graphics/2017/national/escape-time/?hpid=hp_rhp-top-table-main_rush-hour-340pm%3Ahomepage%2Fstory,https://www.reddit.com/r/dataisbeautiful/comments/6t4pfi/analysis_leaving_downtown_at_rush_hour_in/,1,1,,2,Analysis Leaving downtown at rush hour in America’s largest cities,2017-08-0203.jpg
Leaving downtown at rush hour in America’s largest cities,Ghawr,2017-08-11 22:46:23,https://www.washingtonpost.com/graphics/2017/national/escape-time/?hpid=hp_hp-top-table-main_rush-hour-340pm%3Ahomepage%2Fstory&utm_term=.e0fdfeaf6674,https://www.reddit.com/r/dataisbeautiful/comments/6t4rxq/leaving_downtown_at_rush_hour_in_americas_largest/,34,34,,3,Leaving downtown at rush hour in America’s largest cities,2017-08-0204.jpg
I interviewed my previous 8 ex girlfriends and graphed the data based on how we viewed each other in the relationship. [OC],New_data_guy,2017-08-12 00:18:14,https://i.redd.it/uvm3s29u77fz.png,https://www.reddit.com/r/dataisbeautiful/comments/6t5a8v/i_interviewed_my_previous_8_ex_girlfriends_and/,71,71,,31,I interviewed my previous 8 ex girlfriends and graphed the data based on how we viewed each other in the relationship. OC,2017-08-0205.png
Budget and Worldwide Gross of FATF Franchise [OC],gronke,2017-08-12 04:29:15,https://i.redd.it/p2apt5qgi8fz.png,https://www.reddit.com/r/dataisbeautiful/comments/6t6hz1/budget_and_worldwide_gross_of_fatf_franchise_oc/,10,10,,3,Budget and Worldwide Gross of FATF Franchise OC,2017-08-0206.png
Gun-related deaths compared to car accident deaths over time in the USA [OC],academiaadvice,2017-08-12 06:34:21,https://i.redd.it/piidaydt49fz.png,https://www.reddit.com/r/dataisbeautiful/comments/6t6zsw/gunrelated_deaths_compared_to_car_accident_deaths/,9,9,,15,Gun-related deaths compared to car accident deaths over time in the USA OC,2017-08-0207.png
Religious Landscape Study with respect to political ideologies - Pew Research Center,nordcapp,2017-08-12 06:43:17,http://www.pewforum.org/religious-landscape-study/political-ideology/,https://www.reddit.com/r/dataisbeautiful/comments/6t70wi/religious_landscape_study_with_respect_to/,18,18,,0,Religious Landscape Study with respect to political ideologies - Pew Research Center,2017-08-0208.jpg
City Centre To Check In,Emmused,2017-08-12 08:15:36,http://www.lastminute.com/blog/city-centre-check/?acntb=content&utm_source=facebook&utm_medium=social_paid&utm_campaign=LMN_UK_Travel%20_NCA_FB&utm_content=blog&utm_term=post_linkpreview&dclid=CJS2_9Cf0dUCFYcYGwodz3EOag,https://www.reddit.com/r/dataisbeautiful/comments/6t7c72/city_centre_to_check_in/,5,5,,1,City Centre To Check In,2017-08-0209.jpg
How many kisses when greeting a friend in France by region?,jimrosenz,2017-08-12 11:51:39,http://combiendebises.free.fr/,https://www.reddit.com/r/dataisbeautiful/comments/6t812d/how_many_kisses_when_greeting_a_friend_in_france/,8644,8644,,660,How many kisses when greeting a friend in France by region,2017-08-0210.jpg
A beautiful set of data for the best Waffle Houses to see the upcoming Eclipse.,williamhungster,2017-08-12 14:08:37,https://twitter.com/jerry_shannon/status/893117028671913984/photo/1,https://www.reddit.com/r/dataisbeautiful/comments/6t8m4x/a_beautiful_set_of_data_for_the_best_waffle/,1432,1432,,59,A beautiful set of data for the best Waffle Houses to see the upcoming Eclipse.,2017-08-0211.jpg
Mysterious location patterns of daycare homes vs centers in Chicago. Any idea why?[OC],wshanshan,2017-08-12 14:12:24,https://i.redd.it/tlu1nt00ebfz.png,https://www.reddit.com/r/dataisbeautiful/comments/6t8mtk/mysterious_location_patterns_of_daycare_homes_vs/,25,25,,14,Mysterious location patterns of daycare homes vs centers in Chicago. Any idea whyOC,2017-08-0212.png
How fast do you have to go to get a ticket on MN highways? [OC],dhmontgomery,2017-08-12 14:48:58,http://www.twincities.com/2017/08/11/how-fast-do-you-have-to-go-to-get-a-ticket-on-mn-highways/,https://www.reddit.com/r/dataisbeautiful/comments/6t8tcx/how_fast_do_you_have_to_go_to_get_a_ticket_on_mn/,12,12,,5,How fast do you have to go to get a ticket on MN highways OC,2017-08-0213.jpg
I did an interactive visualization showing character mentions on The Office. Link in the comments [OC],fussyplatypus,2017-08-12 17:57:39,http://imgur.com/a/Q2R4s,https://www.reddit.com/r/dataisbeautiful/comments/6t9vsx/i_did_an_interactive_visualization_showing/,13,13,,5,I did an interactive visualization showing character mentions on The Office. Link in the comments OC,2017-08-0214.jpg
Net Tourism by GEO Region (1995 - 2013) [OC],viz-a-week,2017-08-12 19:30:33,https://i.redd.it/znx7cz77zcfz.png,https://www.reddit.com/r/dataisbeautiful/comments/6tafk4/net_tourism_by_geo_region_1995_2013_oc/,10,10,,4,Net Tourism by GEO Region (1995 - 2013) OC,2017-08-0215.png
Animated Map of the Vietnam War: Every Fortnight [OC],EmperorTigerstar,2017-08-13 04:28:20,https://www.youtube.com/watch?v=pxF6YrLprJk,https://www.reddit.com/r/dataisbeautiful/comments/6td7cv/animated_map_of_the_vietnam_war_every_fortnight_oc/,13,13,,3,Animated Map of the Vietnam War Every Fortnight OC,2017-08-0216.jpg
