title,author,created_date,url,full_permalink,score,ups,downs,num_comments,sanitized_title,image_file
Labor Force and Unemployment Rate in California - Dec. 2018 [OC],tasunahara,2018-02-01 00:08:02,https://i.redd.it/uamieoxlthd01.jpg,https://www.reddit.com/r/dataisbeautiful/comments/7ueklk/labor_force_and_unemployment_rate_in_california/,9,9,,2,Labor Force and Unemployment Rate in California - Dec. 2018 OC,2018-02-0000.jpg
Give more birth on the weekends!!! [OC],mhviraf,2018-02-01 00:49:06,https://i.redd.it/0ena8c3w0id01.png,https://www.reddit.com/r/dataisbeautiful/comments/7ueupk/give_more_birth_on_the_weekends_oc/,0,0,,8,Give more birth on the weekends!!! OC,2018-02-0001.png
"The first 200 elements of 4 different Fibonacci sequences depicted as a ""random walk"". [OC]",atoponce,2018-02-01 01:22:30,https://imgur.com/gallery/vnP5G/,https://www.reddit.com/r/dataisbeautiful/comments/7uf2e5/the_first_200_elements_of_4_different_fibonacci/,36,36,,10,The first 200 elements of 4 different Fibonacci sequences depicted as a random walk. OC,2018-02-0002.jpg
State of the Union/Annual Message to Congress by words per minute [OC],girlybandgeek,2018-02-01 05:05:44,https://i.redd.it/o7f3eq3bzid01.png,https://www.reddit.com/r/dataisbeautiful/comments/7ugeql/state_of_the_unionannual_message_to_congress_by/,880,880,,131,State of the UnionAnnual Message to Congress by words per minute OC,2018-02-0003.png
Civilian gun ownership per capita,urbinsanity,2018-02-01 05:54:28,https://en.m.wikipedia.org/wiki/File:World_map_of_civilian_gun_ownership_-_2nd_color_scheme.svg,https://www.reddit.com/r/dataisbeautiful/comments/7ugo04/civilian_gun_ownership_per_capita/,37,37,,9,Civilian gun ownership per capita,2018-02-0004.jpg
Forest cover map of Europe [OC],Fejetlenfej,2018-02-01 08:08:19,https://imgur.com/gallery/xyzpZ,https://www.reddit.com/r/dataisbeautiful/comments/7uhag4/forest_cover_map_of_europe_oc/,567,567,,31,Forest cover map of Europe OC,2018-02-0005.jpg
The countries that have been mentioned most often in all State of the Union addresses since 1790.,davidbauer,2018-02-01 09:42:26,https://www.nzz.ch/international/freund-und-feind-betrachtet-durch-die-brille-des-weissen-hauses-ld.1349175,https://www.reddit.com/r/dataisbeautiful/comments/7uho3s/the_countries_that_have_been_mentioned_most_often/,6,6,,1,The countries that have been mentioned most often in all State of the Union addresses since 1790.,2018-02-0006.jpg
"[The Pudding] The Differences in How CNN, MSNBC, and FOX Cover the News",yelper,2018-02-01 09:42:35,https://pudding.cool/2018/01/chyrons/,https://www.reddit.com/r/dataisbeautiful/comments/7uho4i/the_pudding_the_differences_in_how_cnn_msnbc_and/,24,24,,1,"The Pudding The Differences in How CNN, MSNBC, and FOX Cover the News",2018-02-0007.jpg
This is how the 11.000 German municipalities voted in 2017 [OC],david-berlin,2018-02-01 12:15:11,https://interaktiv.morgenpost.de/gemeindekarte-bundestagswahl-2017/,https://www.reddit.com/r/dataisbeautiful/comments/7uic60/this_is_how_the_11000_german_municipalities_voted/,21,21,,4,This is how the 11.000 German municipalities voted in 2017 OC,2018-02-0008.jpg
Distribution of U.S. University Admission Rate [OC],divergentdata,2018-02-01 13:32:34,https://i.redd.it/qs8lu8k1tld01.png,https://www.reddit.com/r/dataisbeautiful/comments/7uiqr5/distribution_of_us_university_admission_rate_oc/,10,10,,9,Distribution of U.S. University Admission Rate OC,2018-02-0009.png
US Coal Continues to Decline Under Trump [OC],mra1385,2018-02-01 14:56:33,http://mikerazar.com/chart-it/2018/01/30/uscoal2017/,https://www.reddit.com/r/dataisbeautiful/comments/7uj95w/us_coal_continues_to_decline_under_trump_oc/,3441,3441,,285,US Coal Continues to Decline Under Trump OC,2018-02-0010.jpg
Topics in the 2018 State of the Union Address [OC],colemanrharris,2018-02-01 15:11:06,https://i.redd.it/4c9jp41ramd01.jpg,https://www.reddit.com/r/dataisbeautiful/comments/7ujctm/topics_in_the_2018_state_of_the_union_address_oc/,24,24,,10,Topics in the 2018 State of the Union Address OC,2018-02-0011.jpg
How many congressional seats does each political party control in every state? [OC],OverflowDs,2018-02-01 15:21:23,http://overflow.solutions/special-projects/how-many-congressional-seats-does-each-political-party-control-in-every-state/,https://www.reddit.com/r/dataisbeautiful/comments/7ujfbk/how_many_congressional_seats_does_each_political/,7,7,,6,How many congressional seats does each political party control in every state OC,2018-02-0012.jpg
I have re-visualised the data of the Tokyo Peace Commemorative Exhibition 1922 [OC],Angelthehunter,2018-02-01 17:10:35,https://imgur.com/a/skBKT,https://www.reddit.com/r/dataisbeautiful/comments/7uk814/i_have_revisualised_the_data_of_the_tokyo_peace/,1,1,,3,I have re-visualised the data of the Tokyo Peace Commemorative Exhibition 1922 OC,2018-02-0013.jpg
"Every county in America, who they voted for in 2016, college education level, and median income [OC]",Inspector_Zorro,2018-02-01 17:16:58,https://i.redd.it/2obweve5xmd01.png,https://www.reddit.com/r/dataisbeautiful/comments/7uk9rf/every_county_in_america_who_they_voted_for_in/,74,74,,68,"Every county in America, who they voted for in 2016, college education level, and median income OC",2018-02-0014.png
"On this date 65 years ago, the Netherlands was hit by the devastating North Sea Flood of 1953. Let's visualize what parts of our country lie below sea level. [OC]",tr4ce,2018-02-01 17:25:14,https://lucasvandijk.nl/2018/02/visualising-the-height-of-the-netherlands/,https://www.reddit.com/r/dataisbeautiful/comments/7ukbzg/on_this_date_65_years_ago_the_netherlands_was_hit/,6,6,,3,"On this date 65 years ago, the Netherlands was hit by the devastating North Sea Flood of 1953. Let's visualize what parts of our country lie below sea",2018-02-0015.jpg
2018 World Cup Probabilities [OC],mbmccurdy,2018-02-01 17:32:20,https://i.redd.it/u09q33pvzmd01.png,https://www.reddit.com/r/dataisbeautiful/comments/7ukdtw/2018_world_cup_probabilities_oc/,18,18,,11,2018 World Cup Probabilities OC,2018-02-0016.png
The Hardest Boulder Problems in the World (rock climbing),kayriss,2018-02-01 18:06:44,http://rockandice.com/climbing-news/the-hardest-boulder-problems-in-the-world/,https://www.reddit.com/r/dataisbeautiful/comments/7ukna2/the_hardest_boulder_problems_in_the_world_rock/,0,0,,0,The Hardest Boulder Problems in the World (rock climbing),2018-02-0017.jpg
History of Interracial Marriage Laws in the United States [OC],TalkToMeNerdy,2018-02-01 18:20:57,https://i.redd.it/83ux93i88nd01.png,https://www.reddit.com/r/dataisbeautiful/comments/7ukra8/history_of_interracial_marriage_laws_in_the/,11,11,,4,History of Interracial Marriage Laws in the United States OC,2018-02-0018.png
Multigenerational Households as % of Total Households by State (US) [OC],ColleenEHA,2018-02-01 19:31:51,https://i.redd.it/9ooym7i1lnd01.png,https://www.reddit.com/r/dataisbeautiful/comments/7ulasa/multigenerational_households_as_of_total/,26,26,,9,Multigenerational Households as % of Total Households by State (US) OC,2018-02-0019.png
5 Charts that will make you love or hate the Patriots,jackbeckwith,2018-02-01 19:47:16,https://www.ceros.com/originals/the-polarizing-patriots/,https://www.reddit.com/r/dataisbeautiful/comments/7ulf23/5_charts_that_will_make_you_love_or_hate_the/,1,1,,0,5 Charts that will make you love or hate the Patriots,2018-02-0020.jpg
Interactive graph shows democracy trends across the world,ser_zone,2018-02-01 19:58:16,https://www.economist.com/blogs/graphicdetail/2018/01/daily-chart-21,https://www.reddit.com/r/dataisbeautiful/comments/7uli1a/interactive_graph_shows_democracy_trends_across/,3,3,,2,Interactive graph shows democracy trends across the world,2018-02-0021.jpg
1950 vs. 2017 Tax Brackets - How to Make America Great Again? [OC],Stegeman,2018-02-01 20:02:11,https://i.redd.it/aw7r5yaqpnd01.png,https://www.reddit.com/r/dataisbeautiful/comments/7ulj3q/1950_vs_2017_tax_brackets_how_to_make_america/,66,66,,31,1950 vs. 2017 Tax Brackets - How to Make America Great Again OC,2018-02-0022.png
Berlin's new skyline,pnagypal,2018-02-01 20:11:55,https://interaktiv.morgenpost.de/berlins-neue-skyline/,https://www.reddit.com/r/dataisbeautiful/comments/7ullyr/berlins_new_skyline/,13,13,,0,Berlin's new skyline,2018-02-0023.jpg
Charting the frequency of references to Dragon Ball in Hip Hop,aksumighty,2018-02-01 21:43:23,https://genius.com/a/a-look-at-hip-hop-s-love-for-dragon-ball,https://www.reddit.com/r/dataisbeautiful/comments/7umart/charting_the_frequency_of_references_to_dragon/,11,11,,1,Charting the frequency of references to Dragon Ball in Hip Hop,2018-02-0024.jpg
Tracking Trump’s Goals in His First Year,30101961,2018-02-01 21:57:01,https://fivethirtyeight.com/features/we-measured-trumps-first-year-according-to-his-own-goals-heres-what-we-found/?ex_cid=politicsnewsletter,https://www.reddit.com/r/dataisbeautiful/comments/7umeel/tracking_trumps_goals_in_his_first_year/,15,15,,1,Tracking Trump’s Goals in His First Year,2018-02-0025.jpg
"[OC] State of the Union Viewers by Year, 1993-Present (number and as % of population)",dobraf,2018-02-01 22:09:12,https://i.redd.it/rkr35w7sbod01.jpg,https://www.reddit.com/r/dataisbeautiful/comments/7umhog/oc_state_of_the_union_viewers_by_year_1993present/,1,1,,2,"OC State of the Union Viewers by Year, 1993-Present (number and as % of population)",2018-02-0026.jpg
DNA is not random; here is the MHC locus from the human [NA12878] genome [OC],gringer,2018-02-01 22:21:44,https://v.redd.it/xhxr8ffefod01,https://www.reddit.com/r/dataisbeautiful/comments/7umkun/dna_is_not_random_here_is_the_mhc_locus_from_the/,13,13,,6,DNA is not random; here is the MHC locus from the human NA12878 genome OC,2018-02-0027.png
USA - Civilian labor force participation rate 1990-2017 | Timeline,taw6411231,2018-02-01 22:34:05,https://www.statista.com/statistics/191734/us-civilian-labor-force-participation-rate-since-1990/,https://www.reddit.com/r/dataisbeautiful/comments/7umo2r/usa_civilian_labor_force_participation_rate/,5,5,,0,USA - Civilian labor force participation rate 1990-2017 Timeline,2018-02-0028.jpg
"Global, Arctic and Antarctic sea ice area barrel January 2018 [OC]",kevpluck,2018-02-01 22:51:10,https://v.redd.it/wazyc1efkod01,https://www.reddit.com/r/dataisbeautiful/comments/7ums7k/global_arctic_and_antarctic_sea_ice_area_barrel/,408,408,,35,"Global, Arctic and Antarctic sea ice area barrel January 2018 OC",2018-02-0029.png
Chart of 3 Years of Annual Leave [OC],finiteresource,2018-02-01 23:08:50,http://blog.tekkies.co.uk/2018/02/3-years-of-holiday-planning.html,https://www.reddit.com/r/dataisbeautiful/comments/7umwpk/chart_of_3_years_of_annual_leave_oc/,2,2,,2,Chart of 3 Years of Annual Leave OC,2018-02-0030.jpg
Bruises -- Giorgia Lupi collaborates with guitarist Kaki King to make art from King's notations about her daughter's disease.,wardepartment,2018-02-01 23:33:52,http://flowingdata.com/2018/02/01/bruises/,https://www.reddit.com/r/dataisbeautiful/comments/7un2p4/bruises_giorgia_lupi_collaborates_with_guitarist/,1,1,,1,Bruises -- Giorgia Lupi collaborates with guitarist Kaki King to make art from King's notations about her daughter's disease.,2018-02-0031.jpg
How to Grade a Groundhog,chrisw428,2018-02-01 23:42:53,http://time.com/5127939/groundhog-day-punxsutawney-phil-accuracy/,https://www.reddit.com/r/dataisbeautiful/comments/7un4sy/how_to_grade_a_groundhog/,1,1,,1,How to Grade a Groundhog,2018-02-0032.jpg
Where did the money go? Sankey chart of where my wife and I spent 2017's earnings [OC],OddPaper,2018-02-02 00:54:26,https://i.redd.it/hgueijic6pd01.png,https://www.reddit.com/r/dataisbeautiful/comments/7unlea/where_did_the_money_go_sankey_chart_of_where_my/,6,6,,6,Where did the money go Sankey chart of where my wife and I spent 2017's earnings OC,2018-02-0033.png
Number of rooms per person across the OECD [OC],jimrosenz,2018-02-02 02:50:40,https://utopiayouarestandinginit.com/2018/02/02/number-of-rooms-per-person-across-the-oecd/,https://www.reddit.com/r/dataisbeautiful/comments/7uoajv/number_of_rooms_per_person_across_the_oecd_oc/,7,7,,3,Number of rooms per person across the OECD OC,2018-02-0034.jpg
Eleven is the most popular Stranger Things character [OC],Thatshelbs,2018-02-02 03:29:25,https://public.tableau.com/views/StrangerThings-PopularityAnalysis/Popularity?%3AshowVizHome=no&%3Aembed=y&%3Atoolbar=n,https://www.reddit.com/r/dataisbeautiful/comments/7uoirt/eleven_is_the_most_popular_stranger_things/,7,7,,4,Eleven is the most popular Stranger Things character OC,2018-02-0035.jpg
The economic returns to university,jimrosenz,2018-02-02 08:22:51,https://www.economist.com/blogs/graphicdetail/2018/02/higher-education?fsrc=scn/tw/once,https://www.reddit.com/r/dataisbeautiful/comments/7upy6a/the_economic_returns_to_university/,5,5,,8,The economic returns to university,2018-02-0036.jpg
CDC flu activity trends for each state in context of previous 14 years--off to a quick start [OC],xangg,2018-02-02 12:15:18,https://pbs.twimg.com/media/DU9R8-wX0AENsmL.jpg:large,https://www.reddit.com/r/dataisbeautiful/comments/7uqwo1/cdc_flu_activity_trends_for_each_state_in_context/,6,6,,7,CDC flu activity trends for each state in context of previous 14 years--off to a quick start OC,2018-02-0037.jpg
Visualising the gap between Rich and Poor in the UK [OC],chris-love,2018-02-02 12:59:36,https://medium.com/@loveandradburn/the-haves-and-have-nots-and-big-sam-bf911dd1ffd9,https://www.reddit.com/r/dataisbeautiful/comments/7ur4dx/visualising_the_gap_between_rich_and_poor_in_the/,4,4,,3,Visualising the gap between Rich and Poor in the UK OC,2018-02-0038.jpg
Neat tool for creating visualizations of GitHub profiles,teledig,2018-02-02 13:56:45,https://github-profile-summary.com/user/tipsy,https://www.reddit.com/r/dataisbeautiful/comments/7urfz9/neat_tool_for_creating_visualizations_of_github/,11,11,,0,Neat tool for creating visualizations of GitHub profiles,2018-02-0039.jpg
How people search for and discuss student debt on the internet,GemmaJ123,2018-02-02 15:09:23,https://www.brandwatch.com/blog/react-student-debt-data/?utm_source=reddit&utm_medium=react&utm_term=blog&utm_campaign=02_2018_research_blog,https://www.reddit.com/r/dataisbeautiful/comments/7urwhs/how_people_search_for_and_discuss_student_debt_on/,5,5,,1,How people search for and discuss student debt on the internet,2018-02-0040.jpg
Interactive US Immigration Map [OC],braxex,2018-02-02 15:15:23,https://i.redd.it/f7j5z1rdgtd01.png,https://www.reddit.com/r/dataisbeautiful/comments/7urxzk/interactive_us_immigration_map_oc/,29,29,,10,Interactive US Immigration Map OC,2018-02-0041.png
Democracy Index and the Word “Democratic” in the Name of the Country [OC],TheOhNoNotAgain,2018-02-02 15:43:00,https://i.redd.it/zp6fm397ltd01.png,https://www.reddit.com/r/dataisbeautiful/comments/7us4mw/democracy_index_and_the_word_democratic_in_the/,25092,25092,,1738,Democracy Index and the Word “Democratic” in the Name of the Country OC,2018-02-0042.png
Every super bowl score [OC],OffTheChartsC,2018-02-02 15:52:52,https://public.tableau.com/views/SBScores/Dashboard1?:embed=y&:showVizHome=no#1,https://www.reddit.com/r/dataisbeautiful/comments/7us744/every_super_bowl_score_oc/,4,4,,3,Every super bowl score OC,2018-02-0043.jpg
Why Pay Has Been Lagging as Job Growth Continues,dont_tread_on_dc,2018-02-02 17:41:12,https://www.nytimes.com/interactive/2018/02/01/business/economy/wages-salaries-job-market.html?action=click&module=Top%20Stories&pgtype=Homepage,https://www.reddit.com/r/dataisbeautiful/comments/7ut03x/why_pay_has_been_lagging_as_job_growth_continues/,13,13,,4,Why Pay Has Been Lagging as Job Growth Continues,2018-02-0044.jpg
"Visualzing Bach, Michael Jackson and heavy metal using t-sne and Mel spectrogram",longhowlam,2018-02-02 17:55:16,https://longhowlam.wordpress.com/2018/01/31/t-sne-dimension-reduction-on-spotify-mp3-samples/,https://www.reddit.com/r/dataisbeautiful/comments/7ut3yl/visualzing_bach_michael_jackson_and_heavy_metal/,3,3,,0,"Visualzing Bach, Michael Jackson and heavy metal using t-sne and Mel spectrogram",2018-02-0045.jpg
Tesla Model 3 Sales Tracker [OC],EngagingData,2018-02-02 19:14:10,http://engaging-data.com/model-3-sales-tracker/,https://www.reddit.com/r/dataisbeautiful/comments/7utpfa/tesla_model_3_sales_tracker_oc/,3,3,,5,Tesla Model 3 Sales Tracker OC,2018-02-0046.jpg
"College football team quality over the past five years, using S&P+ percentile ratings [OC]",luketheduke03,2018-02-02 19:40:37,https://imgur.com/a/BOX09,https://www.reddit.com/r/dataisbeautiful/comments/7utwl0/college_football_team_quality_over_the_past_five/,12,12,,4,"College football team quality over the past five years, using S&P+ percentile ratings OC",2018-02-0047.jpg
A history of current NFL franchise field surfaces [OC],bourbonandvinyl,2018-02-02 19:50:32,https://i.imgur.com/Mgk8F5t.png,https://www.reddit.com/r/dataisbeautiful/comments/7utz72/a_history_of_current_nfl_franchise_field_surfaces/,25,25,,5,A history of current NFL franchise field surfaces OC,2018-02-0048.png
Office Wide Super Bowl Dip Party Voting Results [OC],kralanalytics,2018-02-02 20:19:46,https://i.redd.it/n5y0i9fixud01.png,https://www.reddit.com/r/dataisbeautiful/comments/7uu6zn/office_wide_super_bowl_dip_party_voting_results_oc/,6,6,,9,Office Wide Super Bowl Dip Party Voting Results OC,2018-02-0049.png
Flipping Humble Bundle Games; Is It Worth It? [OC],RamblingBison,2018-02-02 22:02:24,https://imgur.com/a/BVhJ6,https://www.reddit.com/r/dataisbeautiful/comments/7uuxw6/flipping_humble_bundle_games_is_it_worth_it_oc/,8,8,,11,Flipping Humble Bundle Games; Is It Worth It OC,2018-02-0050.jpg
Percentage of All Corn Planted that is Genetically Engineered [OC],tasunahara,2018-02-03 00:07:18,https://i.redd.it/yhtv7dx73wd01.jpg,https://www.reddit.com/r/dataisbeautiful/comments/7uvrvh/percentage_of_all_corn_planted_that_is/,34,34,,25,Percentage of All Corn Planted that is Genetically Engineered OC,2018-02-0051.jpg
Clone Wars episodes by IMDB rating [OC],b1uJ4y,2018-02-03 00:34:38,https://i.redd.it/ak80wmny7wd01.png,https://www.reddit.com/r/dataisbeautiful/comments/7uvyai/clone_wars_episodes_by_imdb_rating_oc/,78,78,,7,Clone Wars episodes by IMDB rating OC,2018-02-0052.png
How Cape Town is running out of water [OC],nk_gu,2018-02-03 09:34:08,https://www.theguardian.com/cities/ng-interactive/2018/feb/03/day-zero-how-cape-town-running-out-water,https://www.reddit.com/r/dataisbeautiful/comments/7uyfpg/how_cape_town_is_running_out_of_water_oc/,2692,2692,,159,How Cape Town is running out of water OC,2018-02-0053.jpg
"Serie A, anatomy of the italian soccer league",Elios4Freedom,2018-02-03 10:05:38,http://www.gazzetta.it/Datamania/Tutti_i_gol_della_A/,https://www.reddit.com/r/dataisbeautiful/comments/7uyjil/serie_a_anatomy_of_the_italian_soccer_league/,0,0,,3,"Serie A, anatomy of the italian soccer league",2018-02-0054.jpg
The 2017 News Nerd Survey,ImP_Gamer,2018-02-03 15:24:57,https://opennews.org/projects/2017-newsnerd-survey/,https://www.reddit.com/r/dataisbeautiful/comments/7uzw0g/the_2017_news_nerd_survey/,2,2,,0,The 2017 News Nerd Survey,2018-02-0055.jpg
Super Bowl Squares expected value of squares based on past SB scores [OC],badstatz,2018-02-03 16:10:31,https://i.redd.it/z8en3310v0e01.png,https://www.reddit.com/r/dataisbeautiful/comments/7v060k/super_bowl_squares_expected_value_of_squares/,10,10,,7,Super Bowl Squares expected value of squares based on past SB scores OC,2018-02-0056.png
Climate change risk by country,hammertime84,2018-02-03 18:51:54,http://gain.nd.edu/our-work/country-index/,https://www.reddit.com/r/dataisbeautiful/comments/7v1850/climate_change_risk_by_country/,3,3,,0,Climate change risk by country,2018-02-0057.jpg
"A year of grad student living in Cambridge, MA (2016) [OC]",Amurfalcon,2018-02-03 19:27:38,https://i.redd.it/uisgc3z7u1e01.png,https://www.reddit.com/r/dataisbeautiful/comments/7v1gfw/a_year_of_grad_student_living_in_cambridge_ma/,43,43,,24,"A year of grad student living in Cambridge, MA (2016) OC",2018-02-0058.png
Share in Departures of the Dominating Airline at Major Airports [OC],flightera_blog,2018-02-03 19:58:58,https://i.redd.it/mmbbaoqmy1e01.png,https://www.reddit.com/r/dataisbeautiful/comments/7v1nw1/share_in_departures_of_the_dominating_airline_at/,31,31,,9,Share in Departures of the Dominating Airline at Major Airports OC,2018-02-0059.png
[OC] Degrees of Separation Among the High School Class of 2019,reindeer_poronkusema,2018-02-03 21:02:57,https://imgur.com/gallery/SkSTO,https://www.reddit.com/r/dataisbeautiful/comments/7v22o0/oc_degrees_of_separation_among_the_high_school/,22,22,,8,OC Degrees of Separation Among the High School Class of 2019,2018-02-0060.jpg
"[OC] Lemmatized word frequency analysis of the Bible, the Quram and the Vedas",shablyka,2018-02-03 22:06:34,https://i.redd.it/0bbzytzml2e01.jpg,https://www.reddit.com/r/dataisbeautiful/comments/7v2h39/oc_lemmatized_word_frequency_analysis_of_the/,22540,22540,,1297,"OC Lemmatized word frequency analysis of the Bible, the Quram and the Vedas",2018-02-0061.jpg
A graph of a bunch of singer/songwriters' album score on rateyourmusic.com over time [OC],newottawavegan,2018-02-03 22:46:29,https://i.redd.it/f108spcrt2e01.png,https://www.reddit.com/r/dataisbeautiful/comments/7v2pzw/a_graph_of_a_bunch_of_singersongwriters_album/,0,0,,14,A graph of a bunch of singersongwriters' album score on rateyourmusic.com over time OC,2018-02-0062.png
[OC] Superbowl Score Heat Map by Quarter,ntfaw,2018-02-03 22:59:22,https://imgur.com/mhICOVz,https://www.reddit.com/r/dataisbeautiful/comments/7v2swk/oc_superbowl_score_heat_map_by_quarter/,6,6,,3,OC Superbowl Score Heat Map by Quarter,2018-02-0063.jpg
"Mazda RX-8 driving; Scatter of RPM vs. Engine Load, Air and fuel flow rates [OC]",prawnlol22,2018-02-04 02:01:25,https://i.redd.it/7l9329bjs3e01.png,https://www.reddit.com/r/dataisbeautiful/comments/7v3vgn/mazda_rx8_driving_scatter_of_rpm_vs_engine_load/,20,20,,4,"Mazda RX-8 driving; Scatter of RPM vs. Engine Load, Air and fuel flow rates OC",2018-02-0064.png
Prostate cancer deaths overtake those from breast cancer,jimrosenz,2018-02-04 03:05:09,http://www.bbc.co.uk/news/health-42890405,https://www.reddit.com/r/dataisbeautiful/comments/7v47q8/prostate_cancer_deaths_overtake_those_from_breast/,43,43,,2,Prostate cancer deaths overtake those from breast cancer,2018-02-0065.jpg
UEFA Champions League vs. Local League Success [OC],yorgunson,2018-02-04 03:23:42,http://cforus.blogspot.com.au/2018/01/uefa-champions-leage-succes-vs-local_5.html,https://www.reddit.com/r/dataisbeautiful/comments/7v4b4m/uefa_champions_league_vs_local_league_success_oc/,5,5,,0,UEFA Champions League vs. Local League Success OC,2018-02-0066.jpg
Map of all the roads in New Zealand Inspired by u/Tjukanov [OC],Samlauderuel1,2018-02-04 05:23:48,https://i.redd.it/i7gx0l8fr4e01.jpg,https://www.reddit.com/r/dataisbeautiful/comments/7v4x19/map_of_all_the_roads_in_new_zealand_inspired_by/,76,76,,11,Map of all the roads in New Zealand Inspired by uTjukanov OC,2018-02-0067.jpg
Homicide Rate in Longmire vs the Real US Cities [OC],TheNewMadisonian,2018-02-04 06:20:24,https://i.redd.it/kt5vo3jq25e01.jpg,https://www.reddit.com/r/dataisbeautiful/comments/7v56az/homicide_rate_in_longmire_vs_the_real_us_cities_oc/,31,31,,4,Homicide Rate in Longmire vs the Real US Cities OC,2018-02-0068.jpg
What does the business landscape look like on Kickstarter? [OC],takeasecond,2018-02-04 08:55:09,https://i.redd.it/0fazy6zqt5e01.png,https://www.reddit.com/r/dataisbeautiful/comments/7v5qqw/what_does_the_business_landscape_look_like_on/,18,18,,8,What does the business landscape look like on Kickstarter OC,2018-02-0069.png
Eight things more likely to kill you in 1970s Britain than today,Currency_Cat,2018-02-04 09:53:09,http://www.bbc.co.uk/news/uk-42324984,https://www.reddit.com/r/dataisbeautiful/comments/7v5xja/eight_things_more_likely_to_kill_you_in_1970s/,8,8,,0,Eight things more likely to kill you in 1970s Britain than today,2018-02-0070.jpg
How much area you can cover by car in one hour? A comparison between European capitals.,zaxaw,2018-02-04 10:54:45,https://twitter.com/tjukanov/status/960101495562756096,https://www.reddit.com/r/dataisbeautiful/comments/7v64wo/how_much_area_you_can_cover_by_car_in_one_hour_a/,26,26,,3,How much area you can cover by car in one hour A comparison between European capitals.,2018-02-0071.jpg
Hyman Minsky sequences in BitCoin Price [OC],junkwhinger,2018-02-04 11:31:41,https://i.redd.it/e7xc3kj7m6e01.png,https://www.reddit.com/r/dataisbeautiful/comments/7v69ij/hyman_minsky_sequences_in_bitcoin_price_oc/,35,35,,11,Hyman Minsky sequences in BitCoin Price OC,2018-02-0072.png
Map of countries by ease of doing business,john-bryan,2018-02-04 12:03:15,https://knoema.com/atlas/maps/Ease-of-doing-business-index,https://www.reddit.com/r/dataisbeautiful/comments/7v6dia/map_of_countries_by_ease_of_doing_business/,9,9,,1,Map of countries by ease of doing business,2018-02-0073.jpg
Change of Population in European countries relative to 1950 [OC],datekram,2018-02-04 14:16:51,https://imgur.com/a/Bv8dk,https://www.reddit.com/r/dataisbeautiful/comments/7v6xud/change_of_population_in_european_countries/,22,22,,3,Change of Population in European countries relative to 1950 OC,2018-02-0074.jpg
Population of the world by time zone [OC],martiensch,2018-02-04 14:52:43,https://i.redd.it/s03wjp90m7e01.png,https://www.reddit.com/r/dataisbeautiful/comments/7v743h/population_of_the_world_by_time_zone_oc/,165,165,,22,Population of the world by time zone OC,2018-02-0075.png
Enhanced a viz of pizza sizes from OP's photo [OC],obey_the_curve,2018-02-04 15:51:48,https://i.redd.it/i190kkxnw7e01.png,https://www.reddit.com/r/dataisbeautiful/comments/7v7g2i/enhanced_a_viz_of_pizza_sizes_from_ops_photo_oc/,280,280,,34,Enhanced a viz of pizza sizes from OP's photo OC,2018-02-0076.png
