title,author,created_date,url,full_permalink,score,ups,downs,num_comments,sanitized_title,image_file
Falcon's launch acceleration [OC],monkey_prick,2018-02-07 17:36:25,https://i.imgur.com/rhUqZSA.png,https://www.reddit.com/r/dataisbeautiful/comments/7vxsq5/falcons_launch_acceleration_oc/,10,10,,7,Falcon's launch acceleration OC,2018-02-0152.png
INFOGRAPHIC: A world of languages - and how many speak them,DungBeetle007,2018-02-07 18:04:38,http://www.scmp.com/infographics/article/1810040/infographic-world-languages?page=all,https://www.reddit.com/r/dataisbeautiful/comments/7vy0n9/infographic_a_world_of_languages_and_how_many/,13,13,,2,INFOGRAPHIC A world of languages - and how many speak them,2018-02-0153.jpg
Summary of many Game of the Year Awards 2017 [OC],TheSeahorseHS,2018-02-07 18:15:37,https://i.redd.it/0xb403e11ue01.png,https://www.reddit.com/r/dataisbeautiful/comments/7vy3rp/summary_of_many_game_of_the_year_awards_2017_oc/,3423,3423,,316,Summary of many Game of the Year Awards 2017 OC,2018-02-0154.png
"Dota 2 item timings, and how they correlate with winrates",fireflash38,2018-02-07 18:52:50,https://medium.com/@STRATZ/dota-2-item-timings-22d2dbd76bc4,https://www.reddit.com/r/dataisbeautiful/comments/7vyeab/dota_2_item_timings_and_how_they_correlate_with/,3,3,,0,"Dota 2 item timings, and how they correlate with winrates",2018-02-0155.jpg
Visualization of 2500+ TED Talks [OC],360withthewrist,2018-02-07 19:52:00,http://thedataface.com/2018/02/education/explore-ted-talks,https://www.reddit.com/r/dataisbeautiful/comments/7vyut1/visualization_of_2500_ted_talks_oc/,4,4,,6,Visualization of 2500+ TED Talks OC,2018-02-0156.jpg
33 Years of volatility in the Dow Jones [OC],gemmerich,2018-02-07 20:11:16,https://i.redd.it/w9iyfzsflue01.png,https://www.reddit.com/r/dataisbeautiful/comments/7vz05x/33_years_of_volatility_in_the_dow_jones_oc/,29,29,,7,33 Years of volatility in the Dow Jones OC,2018-02-0157.png
There’s Plenty of Room in the Corners: On the Volume of High Dimensional Spheres,jashkenas,2018-02-07 21:44:34,https://beta.observablehq.com/@tophtucker/theres-plenty-of-room-in-the-corners,https://www.reddit.com/r/dataisbeautiful/comments/7vzpka/theres_plenty_of_room_in_the_corners_on_the/,2,2,,0,There’s Plenty of Room in the Corners On the Volume of High Dimensional Spheres,2018-02-0158.jpg
Rap / Hip-Hop Album Lyric Analysis [OC],brownclowntown,2018-02-07 22:05:58,https://i.redd.it/v13xsy2w5ve01.jpg,https://www.reddit.com/r/dataisbeautiful/comments/7vzvc7/rap_hiphop_album_lyric_analysis_oc/,50,50,,11,Rap Hip-Hop Album Lyric Analysis OC,2018-02-0159.jpg
Weight loss since 2012 that shows it was not a straight drop [OC],bbkfotu,2018-02-07 22:59:23,https://i.redd.it/zs1o7wkxeve01.jpg,https://www.reddit.com/r/dataisbeautiful/comments/7w08rn/weight_loss_since_2012_that_shows_it_was_not_a/,22,22,,7,Weight loss since 2012 that shows it was not a straight drop OC,2018-02-0160.jpg
I created a daily schedule for myself and instead of making a legend I chose graphics to represent each category. I had to get creative with a few. [OC],ZombieTurtle2,2018-02-07 23:35:41,https://i.redd.it/kxx5y8lolve01.png,https://www.reddit.com/r/dataisbeautiful/comments/7w0htv/i_created_a_daily_schedule_for_myself_and_instead/,10,10,,28,I created a daily schedule for myself and instead of making a legend I chose graphics to represent each category. I had to get creative with a few. OC,2018-02-0161.png
I tracked my commute times for 150 days to find out which option was fastest and most reliable [OC],old_gold_mountain,2018-02-08 00:30:26,https://i.imgur.com/0KPt4LV.png,https://www.reddit.com/r/dataisbeautiful/comments/7w0uv2/i_tracked_my_commute_times_for_150_days_to_find/,24,24,,6,I tracked my commute times for 150 days to find out which option was fastest and most reliable OC,2018-02-0162.png
Plotting Population Weighted Mean Centroids for India [OC],SirCasms,2018-02-08 01:13:53,https://medium.com/@93b61e3f97aa/22da408c1397,https://www.reddit.com/r/dataisbeautiful/comments/7w14w8/plotting_population_weighted_mean_centroids_for/,3,3,,2,Plotting Population Weighted Mean Centroids for India OC,2018-02-0163.jpg
Global Migration Flow Estimates 1960-2015,lori-lee,2018-02-08 01:14:05,https://twitter.com/guyabelguyabel/status/960558261190606848,https://www.reddit.com/r/dataisbeautiful/comments/7w14xk/global_migration_flow_estimates_19602015/,29,29,,4,Global Migration Flow Estimates 1960-2015,2018-02-0164.jpg
2017: the safest skies record,jackbeckwith,2018-02-08 02:08:23,http://multimedia.scmp.com/news/world/article/safety-aviation-2017/index.html,https://www.reddit.com/r/dataisbeautiful/comments/7w1hak/2017_the_safest_skies_record/,5,5,,0,2017 the safest skies record,2018-02-0165.jpg
List of all UFC fights and results since the beginning of time. Pie chart included. [OC],StunPumpkin,2018-02-08 03:04:14,https://docs.google.com/spreadsheets/d/1sty9Y0LujsQLDaEnOYMwvWiIEYTW4-elq_38KaubQ94/edit?usp=sharing,https://www.reddit.com/r/dataisbeautiful/comments/7w1tlu/list_of_all_ufc_fights_and_results_since_the/,3,3,,2,List of all UFC fights and results since the beginning of time. Pie chart included. OC,2018-02-0166.jpg
My happiness diary over the last 3 years [OC],crd1992,2018-02-08 06:49:04,https://i.redd.it/aq98gkyhrxe01.jpg,https://www.reddit.com/r/dataisbeautiful/comments/7w30k8/my_happiness_diary_over_the_last_3_years_oc/,52,52,,20,My happiness diary over the last 3 years OC,2018-02-0167.jpg
My daily workout progress over 1.5 years in charts: is there any progress? [OC],lapivan,2018-02-08 07:38:52,https://knoema.com/rxmihyd/my-fitness-progress,https://www.reddit.com/r/dataisbeautiful/comments/7w38br/my_daily_workout_progress_over_15_years_in_charts/,0,0,,2,My daily workout progress over 1.5 years in charts is there any progress OC,2018-02-0168.jpg
Too Big to Fail? The funding crisis in Local Government.,chris-love,2018-02-08 11:00:23,https://medium.com/@databeats/too-big-to-fail-8b5db03c5bdf,https://www.reddit.com/r/dataisbeautiful/comments/7w41k8/too_big_to_fail_the_funding_crisis_in_local/,2,2,,2,Too Big to Fail The funding crisis in Local Government.,2018-02-0169.jpg
RAJAR Q4 2017: Quarterly infographic sheet - British radio listening figures from Radio Today,SuperCustard320,2018-02-08 11:31:19,https://radiotoday.co.uk/2018/02/rajar-q4-2017-quarterly-infographic-sheet/,https://www.reddit.com/r/dataisbeautiful/comments/7w46b1/rajar_q4_2017_quarterly_infographic_sheet_british/,1,1,,0,RAJAR Q4 2017 Quarterly infographic sheet - British radio listening figures from Radio Today,2018-02-0170.jpg
Can Democrats Win the Senate?,OverflowDs,2018-02-08 11:43:59,https://www.nytimes.com/interactive/2018/02/07/us/politics/senate-midterm-elections.html,https://www.reddit.com/r/dataisbeautiful/comments/7w488f/can_democrats_win_the_senate/,10,10,,7,Can Democrats Win the Senate,2018-02-0171.jpg
Updated US flu activity trends (simpler coloring and more data) [OC],xangg,2018-02-08 12:40:51,https://pbs.twimg.com/media/DVg3FWwW4AAbN3X.jpg:large,https://www.reddit.com/r/dataisbeautiful/comments/7w4i1y/updated_us_flu_activity_trends_simpler_coloring/,112,112,,11,Updated US flu activity trends (simpler coloring and more data) OC,2018-02-0172.jpg
Lifespans of US presidents,Visualmodelofdata,2018-02-08 13:15:22,https://public.tableau.com/views/presidentsv2/Dashboardwithoutlines?:embed=y&:showVizHome=no,https://www.reddit.com/r/dataisbeautiful/comments/7w4oum/lifespans_of_us_presidents/,1,1,,3,Lifespans of US presidents,2018-02-0173.jpg
Pursuing a Goal of 50% Women Speakers at a Tech Conference [OC],BackgroundChemical,2018-02-08 13:15:45,https://i.redd.it/yzfil111oze01.png,https://www.reddit.com/r/dataisbeautiful/comments/7w4ox6/pursuing_a_goal_of_50_women_speakers_at_a_tech/,19,19,,63,Pursuing a Goal of 50% Women Speakers at a Tech Conference OC,2018-02-0174.png
Women's long race to parity in the Winter Olympics,feildingcage,2018-02-08 13:54:34,https://www.theguardian.com/sport/ng-interactive/2018/feb/08/winter-olympics-womens-long-race-to-parity,https://www.reddit.com/r/dataisbeautiful/comments/7w4x4v/womens_long_race_to_parity_in_the_winter_olympics/,43,43,,2,Women's long race to parity in the Winter Olympics,2018-02-0175.jpg
The Slow Decline of NBA Stat Leaders [OC],mra1385,2018-02-08 14:39:28,http://mikerazar.com/chart-it/2018/02/03/nba-stat-leaders/,https://www.reddit.com/r/dataisbeautiful/comments/7w57co/the_slow_decline_of_nba_stat_leaders_oc/,9,9,,2,The Slow Decline of NBA Stat Leaders OC,2018-02-0176.jpg
Headed to the Olympics 2018? Enjoy! Safety threats low.,IKomlev,2018-02-08 15:00:34,https://knoema.com/infographics/srsepee/is-south-korea-a-safe-place-for-olympics-2018,https://www.reddit.com/r/dataisbeautiful/comments/7w5clc/headed_to_the_olympics_2018_enjoy_safety_threats/,317,317,,27,Headed to the Olympics 2018 Enjoy! Safety threats low.,2018-02-0177.jpg
"The richer, the happier (or: five ways to read a scatterplot) [OC]",lisacrost,2018-02-08 15:43:42,https://blog.datawrapper.de/weekly-chart-lifesatisfaction/,https://www.reddit.com/r/dataisbeautiful/comments/7w5ni7/the_richer_the_happier_or_five_ways_to_read_a/,13,13,,5,"The richer, the happier (or five ways to read a scatterplot) OC",2018-02-0178.jpg
Protein/Carbs/Saturated Fats in Convenience Foods [OC],ootsby,2018-02-08 16:39:55,https://i.redd.it/2x2vhnqto0f01.png,https://www.reddit.com/r/dataisbeautiful/comments/7w62v8/proteincarbssaturated_fats_in_convenience_foods_oc/,48,48,,15,ProteinCarbsSaturated Fats in Convenience Foods OC,2018-02-0179.png
"Apartment value in the Top 100 US Cities: What Can You Rent for $1,500? Now with the original source!",mungoflago,2018-02-08 17:11:55,https://www.rentcafe.com/blog/apartment-search-2/apartment-value-in-the-top-100-us-cities-what-can-you-rent-for-1500/,https://www.reddit.com/r/dataisbeautiful/comments/7w6bwi/apartment_value_in_the_top_100_us_cities_what_can/,13,13,,1,"Apartment value in the Top 100 US Cities What Can You Rent for $1,500 Now with the original source!",2018-02-0180.jpg
"[OC] Voting age US citizens not registered to vote, by state",BlueEagleFly,2018-02-08 18:15:11,https://imgur.com/a/5nztX,https://www.reddit.com/r/dataisbeautiful/comments/7w6trh/oc_voting_age_us_citizens_not_registered_to_vote/,115,115,,40,"OC Voting age US citizens not registered to vote, by state",2018-02-0181.jpg
Someone statistically analyzed all the ad-libs on the new Migos album (Culture II) and the results are actually pretty interesting.,BobSaget232323,2018-02-08 18:53:04,http://djbooth.net/mobile/feature/2018-02-08-migos-culture-ii-ab-lib-analysis,https://www.reddit.com/r/dataisbeautiful/comments/7w74d7/someone_statistically_analyzed_all_the_adlibs_on/,11,11,,3,Someone statistically analyzed all the ad-libs on the new Migos album (Culture II) and the results are actually pretty interesting.,2018-02-0182.jpg
The correlation between how good your democracy is and how well your citizens live [OC],HughMannn,2018-02-08 19:16:03,https://i.redd.it/753qq1wpg1f01.jpg,https://www.reddit.com/r/dataisbeautiful/comments/7w7aqt/the_correlation_between_how_good_your_democracy/,34,34,,4,The correlation between how good your democracy is and how well your citizens live OC,2018-02-0183.jpg
Great data and analysis on the 2018 Senate elections,GortMaringa,2018-02-08 19:55:02,https://nyti.ms/2BJ5eM6,https://www.reddit.com/r/dataisbeautiful/comments/7w7liw/great_data_and_analysis_on_the_2018_senate/,8,8,,0,Great data and analysis on the 2018 Senate elections,2018-02-0184.jpg
Causality in Crypto Markets [OC],austingwalters,2018-02-08 19:59:43,https://blog.projectpiglet.com/2018/01/causality-in-cryptomarkets/,https://www.reddit.com/r/dataisbeautiful/comments/7w7msz/causality_in_crypto_markets_oc/,1,1,,2,Causality in Crypto Markets OC,2018-02-0185.jpg
"Based on one year of data, I question the validity of my body composition metrics from my Detecto scale [OC]",mtkeepsrolling,2018-02-08 21:21:51,https://i.redd.it/e50781sx22f01.jpg,https://www.reddit.com/r/dataisbeautiful/comments/7w8981/based_on_one_year_of_data_i_question_the_validity/,3,3,,2,"Based on one year of data, I question the validity of my body composition metrics from my Detecto scale OC",2018-02-0186.jpg
Top States and Salaries for Data Jobs Dashboard [OC],kaysuez,2018-02-08 22:24:31,https://i.redd.it/lpivwaafe2f01.png,https://www.reddit.com/r/dataisbeautiful/comments/7w8q1g/top_states_and_salaries_for_data_jobs_dashboard_oc/,7,7,,2,Top States and Salaries for Data Jobs Dashboard OC,2018-02-0187.png
Years my favorite 500 songs were released [OC],pm_hot_spicy_noodles,2018-02-08 23:01:50,https://imgur.com/kfpDGdC,https://www.reddit.com/r/dataisbeautiful/comments/7w8zfw/years_my_favorite_500_songs_were_released_oc/,15,15,,8,Years my favorite 500 songs were released OC,2018-02-0188.jpg
"[OC] Did this for a class a few years back. Wanted to see the percentage loss if each state during the Vietnam War, not just the total population.",vonage91,2018-02-08 23:48:25,https://i.redd.it/ncbxbzcft2f01.jpg,https://www.reddit.com/r/dataisbeautiful/comments/7w9aj5/oc_did_this_for_a_class_a_few_years_back_wanted/,38,38,,4,"OC Did this for a class a few years back. Wanted to see the percentage loss if each state during the Vietnam War, not just the total population.",2018-02-0189.jpg
Top 10 performing stocks last year [OC],rohan_joseph93,2018-02-09 00:53:57,https://i.redd.it/gmuf90uz43f01.png,https://www.reddit.com/r/dataisbeautiful/comments/7w9pu2/top_10_performing_stocks_last_year_oc/,7,7,,4,Top 10 performing stocks last year OC,2018-02-0190.png
My steps for 40 months [OC],bengarvey,2018-02-09 01:03:24,https://i.redd.it/5jq099nm63f01.png,https://www.reddit.com/r/dataisbeautiful/comments/7w9s06/my_steps_for_40_months_oc/,8,8,,4,My steps for 40 months OC,2018-02-0191.png
The Fallen of World War II,BaeMei,2018-02-09 01:50:13,https://www.youtube.com/watch?time_continue=106&v=DwKPFT-RioU,https://www.reddit.com/r/dataisbeautiful/comments/7wa2dx/the_fallen_of_world_war_ii/,10,10,,1,The Fallen of World War II,2018-02-0192.jpg
Top 100 Subreddits By Percentage of Frontpage Posts [OC],The1RGood,2018-02-09 02:31:10,https://i.imgur.com/jHbCQmk.png,https://www.reddit.com/r/dataisbeautiful/comments/7wabcv/top_100_subreddits_by_percentage_of_frontpage/,48,48,,9,Top 100 Subreddits By Percentage of Frontpage Posts OC,2018-02-0193.png
Women's Olympic Hockey Chances [OC],mbmccurdy,2018-02-09 02:42:57,https://i.redd.it/rhzh8x3jo3f01.png,https://www.reddit.com/r/dataisbeautiful/comments/7wadvd/womens_olympic_hockey_chances_oc/,5,5,,2,Women's Olympic Hockey Chances OC,2018-02-0194.png
"Dow Jones Industrial Average, 2001- Present, Log-Scale [OC]",jonnyyboyy,2018-02-09 03:11:33,https://i.redd.it/17nh0i1it3f01.png,https://www.reddit.com/r/dataisbeautiful/comments/7wak4c/dow_jones_industrial_average_2001_present/,176,176,,44,"Dow Jones Industrial Average, 2001- Present, Log-Scale OC",2018-02-0195.png
Inelastic collisions of 30 randomly distributed particles within a rectangular container [OC],PeasantPunisher,2018-02-09 03:28:39,https://v.redd.it/pkd8c8egw3f01,https://www.reddit.com/r/dataisbeautiful/comments/7wanpr/inelastic_collisions_of_30_randomly_distributed/,10,10,,7,Inelastic collisions of 30 randomly distributed particles within a rectangular container OC,2018-02-0196.png
Comparison of the Dow Jones Industrial Average by days in office. President Obama vs Trump [OC],mega386,2018-02-09 03:30:58,https://i.redd.it/jn9m1uiow3f01.png,https://www.reddit.com/r/dataisbeautiful/comments/7wao9a/comparison_of_the_dow_jones_industrial_average_by/,12,12,,10,Comparison of the Dow Jones Industrial Average by days in office. President Obama vs Trump OC,2018-02-0197.png
Portfolio value over time with different asset allocations [OC],pockettanyas,2018-02-09 04:06:56,https://i.redd.it/dmbvzm0g34f01.png,https://www.reddit.com/r/dataisbeautiful/comments/7wavib/portfolio_value_over_time_with_different_asset/,3,3,,2,Portfolio value over time with different asset allocations OC,2018-02-0198.png
How Different Income Groups Spend Money,dwaxe,2018-02-09 06:23:28,http://flowingdata.com/2018/02/08/how-different-income-groups-spend-money/,https://www.reddit.com/r/dataisbeautiful/comments/7wblej/how_different_income_groups_spend_money/,22,22,,4,How Different Income Groups Spend Money,2018-02-0199.jpg
The History of Winter Olympics [OC],beefislife,2018-02-09 11:42:38,https://i.redd.it/0dldes6uc6f01.png,https://www.reddit.com/r/dataisbeautiful/comments/7wcw0c/the_history_of_winter_olympics_oc/,47,47,,19,The History of Winter Olympics OC,2018-02-0200.png
Followup Post: US C-Section Hospital Charges vs Insurance Payments vs Insurance Discounts vs My Actual Cost [OC],TheOnlyToast,2018-02-09 11:47:57,https://i.redd.it/b3lgs0lld6f01.png,https://www.reddit.com/r/dataisbeautiful/comments/7wcwti/followup_post_us_csection_hospital_charges_vs/,4,4,,8,Followup Post US C-Section Hospital Charges vs Insurance Payments vs Insurance Discounts vs My Actual Cost OC,2018-02-0201.png
This is what 8 months of Roulette looks like [OC],Bohrapar,2018-02-09 11:58:04,https://i.redd.it/jp0qeqoff6f01.png,https://www.reddit.com/r/dataisbeautiful/comments/7wcyiq/this_is_what_8_months_of_roulette_looks_like_oc/,16291,16291,,1897,This is what 8 months of Roulette looks like OC,2018-02-0202.png
"Fly Eddie, Fly! Ski Jumps from the 90 Meter Hill at the Calgary 1988 Olympics",Visualmodelofdata,2018-02-09 12:48:40,https://public.tableau.com/views/eddie/Dashboard1?:embed=y&:showVizHome=no,https://www.reddit.com/r/dataisbeautiful/comments/7wd7jk/fly_eddie_fly_ski_jumps_from_the_90_meter_hill_at/,8,8,,0,"Fly Eddie, Fly! Ski Jumps from the 90 Meter Hill at the Calgary 1988 Olympics",2018-02-0203.jpg
WWII Deaths Visualized,Me_you_who,2018-02-09 13:23:10,https://www.youtube.com/watch?v=DwKPFT-RioU&t=106s,https://www.reddit.com/r/dataisbeautiful/comments/7wde5b/wwii_deaths_visualized/,12,12,,1,WWII Deaths Visualized,2018-02-0204.jpg
A visualisation of what nations can place misslies over the globe,PortfolioDesign,2018-02-09 15:05:25,https://www.nytimes.com/interactive/2018/02/07/world/asia/north-korea-missile-proliferation-range-intercontinental-iran-pakistan-india.html,https://www.reddit.com/r/dataisbeautiful/comments/7we02i/a_visualisation_of_what_nations_can_place/,27,27,,2,A visualisation of what nations can place misslies over the globe,2018-02-0205.jpg
"Even if you play perfectly, the casino comes out on top in Video Poker (Monte Carlo) [OC]",zaglamir,2018-02-09 15:10:37,https://i.redd.it/tfrvj3vod7f01.png,https://www.reddit.com/r/dataisbeautiful/comments/7we1e6/even_if_you_play_perfectly_the_casino_comes_out/,16,16,,17,"Even if you play perfectly, the casino comes out on top in Video Poker (Monte Carlo) OC",2018-02-0206.png
A Visual Graph of Star Wars: The Last Jedi's Messy Pacing [OC],Taclys64,2018-02-09 16:37:09,https://i.redd.it/m51oovj9t7f01.jpg,https://www.reddit.com/r/dataisbeautiful/comments/7wen09/a_visual_graph_of_star_wars_the_last_jedis_messy/,17,17,,7,A Visual Graph of Star Wars The Last Jedi's Messy Pacing OC,2018-02-0207.jpg
The peaks and lows of online and in-game steam users across a 7 day period (made this for a school project and wanted to post it here),danmur15,2018-02-09 16:42:51,https://docs.google.com/spreadsheets/d/1t7Cx3cgsK19M6-8gJuD-QTbGCasUz_7l_d-8uYHNPCA/edit?usp=sharing,https://www.reddit.com/r/dataisbeautiful/comments/7weoml/the_peaks_and_lows_of_online_and_ingame_steam/,6,6,,0,The peaks and lows of online and in-game steam users across a 7 day period (made this for a school project and wanted to post it here),2018-02-0208.jpg
Visualizing the 2018 NBA Trades [OC],Baron_of_BBQ,2018-02-09 16:50:28,https://i.redd.it/xunzkk0rv7f01.png,https://www.reddit.com/r/dataisbeautiful/comments/7weqq1/visualizing_the_2018_nba_trades_oc/,13,13,,2,Visualizing the 2018 NBA Trades OC,2018-02-0209.png
Electricity demand is cyclical both over time and season [OC],ikmckenz,2018-02-09 16:59:02,https://streamable.com/ob3e2,https://www.reddit.com/r/dataisbeautiful/comments/7weszo/electricity_demand_is_cyclical_both_over_time_and/,10,10,,4,Electricity demand is cyclical both over time and season OC,2018-02-0210.jpg
Small Business - Where does the money go? [OC],TorturedChaos,2018-02-09 17:10:18,https://i.redd.it/iqoknceoy7f01.png,https://www.reddit.com/r/dataisbeautiful/comments/7wew5i/small_business_where_does_the_money_go_oc/,357,357,,48,Small Business - Where does the money go OC,2018-02-0211.png
A Visual Overview of Stack Overflow's Question Tags [OC],minimaxir,2018-02-09 17:12:55,http://minimaxir.com/2018/02/stack-overflow-questions/,https://www.reddit.com/r/dataisbeautiful/comments/7wewuy/a_visual_overview_of_stack_overflows_question/,9,9,,2,A Visual Overview of Stack Overflow's Question Tags OC,2018-02-0212.jpg
This is what 1 Million Craps Rolls looks like [OC],Loco4FourLoko,2018-02-09 17:48:10,https://i.redd.it/rjcjjgs348f01.png,https://www.reddit.com/r/dataisbeautiful/comments/7wf6di/this_is_what_1_million_craps_rolls_looks_like_oc/,12,12,,2,This is what 1 Million Craps Rolls looks like OC,2018-02-0213.png
NHL Odds (cross post),Dementedpenguin,2018-02-09 18:33:06,https://www.reddit.com/r/winnipegjets/comments/7wbcxd/current_odds_for_nhl_teams_to_make_playoffs/?utm_source=reddit-android,https://www.reddit.com/r/dataisbeautiful/comments/7wfihp/nhl_odds_cross_post/,2,2,,0,NHL Odds (cross post),2018-02-0214.jpg
Six Weeks of Gambling Using 20 years of NBA data with Machine Learning Algorithm [OC],RockTheGoodOlAg,2018-02-09 18:35:13,https://i.redd.it/2qwvyvs6e8f01.png,https://www.reddit.com/r/dataisbeautiful/comments/7wfj2w/six_weeks_of_gambling_using_20_years_of_nba_data/,38,38,,22,Six Weeks of Gambling Using 20 years of NBA data with Machine Learning Algorithm OC,2018-02-0215.png
Data Visualization in Art Education,obervella,2018-02-09 19:33:38,http://www.tandfonline.com/doi/full/10.1080/00043125.2018.1414537,https://www.reddit.com/r/dataisbeautiful/comments/7wfygp/data_visualization_in_art_education/,1,1,,0,Data Visualization in Art Education,2018-02-0216.jpg
"Cumulative Winter Olympic medals, at least 100 medals in total [OC]",hn_ns,2018-02-09 21:18:49,https://i.redd.it/fhhgoeax69f01.jpg,https://www.reddit.com/r/dataisbeautiful/comments/7wgpfv/cumulative_winter_olympic_medals_at_least_100/,12,12,,8,"Cumulative Winter Olympic medals, at least 100 medals in total OC",2018-02-0217.jpg
Windy,mshebel,2018-02-09 21:25:16,http://www.windyty.com/,https://www.reddit.com/r/dataisbeautiful/comments/7wgr5a/windy/,2,2,,0,Windy,2018-02-0218.jpg
"Comparing Chinese regions to countries using total GDP, GDP per capita, population, and life expectancy [OC]",cllmtylr,2018-02-09 23:27:48,https://medium.com/@callummtaylor/what-if-chinese-regions-were-independent-countries-7029f7c6d738,https://www.reddit.com/r/dataisbeautiful/comments/7whkit/comparing_chinese_regions_to_countries_using/,10,10,,3,"Comparing Chinese regions to countries using total GDP, GDP per capita, population, and life expectancy OC",2018-02-0219.jpg
Are we still doing double pendulums? I just found out about Observable and made an interactive notebook to play with [OC],travisdoesmath,2018-02-10 00:49:58,https://beta.observablehq.com/@travisdoesmath/double-pendulums-are-chaotic,https://www.reddit.com/r/dataisbeautiful/comments/7wi32r/are_we_still_doing_double_pendulums_i_just_found/,7,7,,6,Are we still doing double pendulums I just found out about Observable and made an interactive notebook to play with OC,2018-02-0220.jpg
Unique visitors to /r/MovingToCanada over the last 2 years (explination in comments) [OC],The-Lying-Tree,2018-02-10 01:53:42,https://i.redd.it/0mck3ef9eaf01.png,https://www.reddit.com/r/dataisbeautiful/comments/7wigsg/unique_visitors_to_rmovingtocanada_over_the_last/,20,20,,5,Unique visitors to rMovingToCanada over the last 2 years (explination in comments) OC,2018-02-0221.png
Number of movies per decade in top 100 list [OC],Ninjabassist777,2018-02-10 02:34:06,https://i.imgur.com/Li4KOtG.png,https://www.reddit.com/r/dataisbeautiful/comments/7wip45/number_of_movies_per_decade_in_top_100_list_oc/,16022,16022,,1286,Number of movies per decade in top 100 list OC,2018-02-0222.png
Interactive plot of how long it takes a double pendulum to flip [OC],jnaf,2018-02-10 02:56:07,https://jnafzig.github.io/2018/02/09/interactive-double-pendulum.html,https://www.reddit.com/r/dataisbeautiful/comments/7witnl/interactive_plot_of_how_long_it_takes_a_double/,18,18,,3,Interactive plot of how long it takes a double pendulum to flip OC,2018-02-0223.jpg
"Check out your Quality of Life Index, how does it stack with others? [OC]",lanhhuyet88,2018-02-10 03:30:20,https://i.redd.it/2d2prl9s0bf01.png,https://www.reddit.com/r/dataisbeautiful/comments/7wj0a4/check_out_your_quality_of_life_index_how_does_it/,14,14,,7,"Check out your Quality of Life Index, how does it stack with others OC",2018-02-0224.png
Race Representation in Super Bowl LII Commercials vs. Actual U.S. Race Percentages [OC],Halostar,2018-02-10 05:54:42,https://i.imgur.com/aW8sbeg.png,https://www.reddit.com/r/dataisbeautiful/comments/7wjpy7/race_representation_in_super_bowl_lii_commercials/,94,94,,31,Race Representation in Super Bowl LII Commercials vs. Actual U.S. Race Percentages OC,2018-02-0225.png
Free kick conversion rates by location taken [OC],TheSignificantGame,2018-02-10 17:26:07,https://i.redd.it/m36p4if25ff01.jpg,https://www.reddit.com/r/dataisbeautiful/comments/7wmrkn/free_kick_conversion_rates_by_location_taken_oc/,11557,11557,,294,Free kick conversion rates by location taken OC,2018-02-0226.jpg
Deviation from Budgeted Expenses in 2017 [OC],darthsinistro,2018-02-10 19:12:36,https://i.redd.it/p7y49rnxpff01.png,https://www.reddit.com/r/dataisbeautiful/comments/7wnhau/deviation_from_budgeted_expenses_in_2017_oc/,0,0,,2,Deviation from Budgeted Expenses in 2017 OC,2018-02-0227.png
