title,author,created_date,url,full_permalink,score,ups,downs,num_comments,sanitized_title,image_file
% adults smoking daily by gender across the OECD [OC],jimrosenz,2018-02-18 01:20:59,https://utopiayouarestandinginit.com/2016/08/17/adults-smoking-daily-by-gender-across-the-oecd/,https://www.reddit.com/r/dataisbeautiful/comments/7yb1r8/adults_smoking_daily_by_gender_across_the_oecd_oc/,10,10,,13,% adults smoking daily by gender across the OECD OC,2018-02-0373.jpg
Found my height chart from 1999 [OC],milos2,2018-02-18 01:42:23,https://i.redd.it/m1rn31wmlvg01.jpg,https://www.reddit.com/r/dataisbeautiful/comments/7yb65b/found_my_height_chart_from_1999_oc/,19,19,,10,Found my height chart from 1999 OC,2018-02-0374.jpg
"An animated data-driven documentary about war and peace, The Fallen of World War II looks at the human cost of the second World War and sizes up the numbers to other wars in history, including trends in recent conflicts.",sateeshkumar44,2018-02-18 12:28:20,https://vimeo.com/128373915,https://www.reddit.com/r/dataisbeautiful/comments/7ydy59/an_animated_datadriven_documentary_about_war_and/,16337,16337,,516,"An animated data-driven documentary about war and peace, The Fallen of World War II looks at the human cost of the second World War and sizes up the n",2018-02-0375.jpg
Heatmaps of IMDb user review ratings for the last three Star Wars movies [OC],nephridium,2018-02-18 12:56:45,https://imgur.com/gallery/aIjro,https://www.reddit.com/r/dataisbeautiful/comments/7ye2ng/heatmaps_of_imdb_user_review_ratings_for_the_last/,23,23,,11,Heatmaps of IMDb user review ratings for the last three Star Wars movies OC,2018-02-0376.jpg
Votes per comment ratio for the top 500 subreddits [OC],glatteis,2018-02-18 13:20:21,https://i.redd.it/5a20dqxd2zg01.png,https://www.reddit.com/r/dataisbeautiful/comments/7ye6nv/votes_per_comment_ratio_for_the_top_500/,8,8,,5,Votes per comment ratio for the top 500 subreddits OC,2018-02-0377.png
Inflation adjusted market capitalization of various high value companies,informat3,2018-02-18 13:25:42,https://qz.com/335147/apples-massive-market-cap-still-trails-these-historical-giants/,https://www.reddit.com/r/dataisbeautiful/comments/7ye7kn/inflation_adjusted_market_capitalization_of/,0,0,,0,Inflation adjusted market capitalization of various high value companies,2018-02-0378.jpg
Handwritten digits from another planet generated by a non-variational autoencoder [OC],csizsek,2018-02-18 14:46:19,https://i.redd.it/6zzreau0hzg01.png,https://www.reddit.com/r/dataisbeautiful/comments/7yemw8/handwritten_digits_from_another_planet_generated/,17,17,,6,Handwritten digits from another planet generated by a non-variational autoencoder OC,2018-02-0379.png
Germany is the most balanced nation in the Winter Olympics using this metric [OC],JPAnalyst,2018-02-18 15:31:16,https://i.redd.it/ujxsr3snpzg01.jpg,https://www.reddit.com/r/dataisbeautiful/comments/7yewq8/germany_is_the_most_balanced_nation_in_the_winter/,20,20,,9,Germany is the most balanced nation in the Winter Olympics using this metric OC,2018-02-0380.jpg
Same-sex marriage status by state and year for DataViz Battle [OC],xangg,2018-02-18 17:05:14,https://i.redd.it/khr7l2wt50h01.png,https://www.reddit.com/r/dataisbeautiful/comments/7yfj9d/samesex_marriage_status_by_state_and_year_for/,19,19,,6,Same-sex marriage status by state and year for DataViz Battle OC,2018-02-0381.png
Each NBA team's season at the All-Star Break [OC],ptunnel,2018-02-18 18:53:48,https://imgur.com/a/hBNFp,https://www.reddit.com/r/dataisbeautiful/comments/7ygc1a/each_nba_teams_season_at_the_allstar_break_oc/,7,7,,5,Each NBA team's season at the All-Star Break OC,2018-02-0382.jpg
Wages in an inflationary environment [OC],elpili,2018-02-18 20:45:50,https://i.redd.it/8qy9fk0u81h01.jpg,https://www.reddit.com/r/dataisbeautiful/comments/7yh72v/wages_in_an_inflationary_environment_oc/,79,79,,19,Wages in an inflationary environment OC,2018-02-0383.jpg
Popular Book Covers by Genre [OC],liortulip,2018-02-18 22:15:34,https://i.redd.it/o56k4zxlp1h01.png,https://www.reddit.com/r/dataisbeautiful/comments/7yhu68/popular_book_covers_by_genre_oc/,7168,7168,,119,Popular Book Covers by Genre OC,2018-02-0384.png
Average attendance to games,nathan_nuggets,2018-02-18 22:31:46,https://www.reddit.com/r/soccer/comments/7yerfl/the_average_attendances_of_the_top_6_leagues_this/?utm_source=reddit-android,https://www.reddit.com/r/dataisbeautiful/comments/7yhy0u/average_attendance_to_games/,1,1,,0,Average attendance to games,2018-02-0385.png
Quantity of songs of different lengths from my Spotify playlist of over 1500 songs [OC],hydraulic2,2018-02-18 22:32:41,https://imgur.com/JgMGHaI,https://www.reddit.com/r/dataisbeautiful/comments/7yhy7x/quantity_of_songs_of_different_lengths_from_my/,44,44,,7,Quantity of songs of different lengths from my Spotify playlist of over 1500 songs OC,2018-02-0386.jpg
"2017 was the most expensive year for the U.S. in extreme weather damages, costing taxpayers over $306 billion.",tribranchvo,2018-02-18 23:10:24,https://www.ceros.com/originals/a-most-violent-year/,https://www.reddit.com/r/dataisbeautiful/comments/7yi6tg/2017_was_the_most_expensive_year_for_the_us_in/,43,43,,2,"2017 was the most expensive year for the U.S. in extreme weather damages, costing taxpayers over $306 billion.",2018-02-0387.jpg
Portions of Kimchi I ate my first year in Korea [OC],OnIowa,2018-02-19 02:05:02,https://i.redd.it/bwpjvvkmu2h01.jpg,https://www.reddit.com/r/dataisbeautiful/comments/7yja4l/portions_of_kimchi_i_ate_my_first_year_in_korea_oc/,18,18,,7,Portions of Kimchi I ate my first year in Korea OC,2018-02-0388.jpg
Tips I've accumulated over the past week based on ethnicity [OC],garrenkeith,2018-02-19 02:37:31,https://i.redd.it/ttidkg23z2h01.png,https://www.reddit.com/r/dataisbeautiful/comments/7yjgzw/tips_ive_accumulated_over_the_past_week_based_on/,18635,18635,,3163,Tips I've accumulated over the past week based on ethnicity OC,2018-02-0389.png
The most consistent NBA teams this decade [OC],academiaadvice,2018-02-19 04:01:28,https://i.redd.it/ek9ijunmf3h01.png,https://www.reddit.com/r/dataisbeautiful/comments/7yjysm/the_most_consistent_nba_teams_this_decade_oc/,60,60,,12,The most consistent NBA teams this decade OC,2018-02-0390.png
Reddit Comment Grade Levels[OC],Angarius,2018-02-19 09:26:46,https://i.redd.it/gb2tdspn15h01.png,https://www.reddit.com/r/dataisbeautiful/comments/7ylict/reddit_comment_grade_levelsoc/,660,660,,95,Reddit Comment Grade LevelsOC,2018-02-0391.png
"I've analysed all my long distance relationship (LDR) periods, and how much damage they did to me and my girlfriend [OC]",TrackingHappiness,2018-02-19 09:39:02,https://www.trackinghappiness.com/how-long-distance-relationship-influenced-happiness/,https://www.reddit.com/r/dataisbeautiful/comments/7ylk5k/ive_analysed_all_my_long_distance_relationship/,30,30,,9,"I've analysed all my long distance relationship (LDR) periods, and how much damage they did to me and my girlfriend OC",2018-02-0392.jpg
Berlin noise map 2018 [OC],moklick,2018-02-19 09:52:20,https://interaktiv.morgenpost.de/laermkarte-berlin/,https://www.reddit.com/r/dataisbeautiful/comments/7ylm56/berlin_noise_map_2018_oc/,39,39,,7,Berlin noise map 2018 OC,2018-02-0393.jpg
World University Rankings 2018 visualised for top 20 countries [OC],quelarion,2018-02-19 13:26:43,https://imgur.com/a/mFpSi,https://www.reddit.com/r/dataisbeautiful/comments/7ymmnv/world_university_rankings_2018_visualised_for_top/,18,18,,10,World University Rankings 2018 visualised for top 20 countries OC,2018-02-0394.jpg
"Medal table of the Olympic Winter games 2018 in Pyeongchang, ordered by population of the countries (19. Feb. 2018, 13:00 GMT+1) [OC]",GodEmperor42,2018-02-19 13:33:16,https://i.redd.it/mpcpn0vh96h01.png,https://www.reddit.com/r/dataisbeautiful/comments/7ymnw7/medal_table_of_the_olympic_winter_games_2018_in/,5565,5565,,449,"Medal table of the Olympic Winter games 2018 in Pyeongchang, ordered by population of the countries (19. Feb. 2018, 1300 GMT+1) OC",2018-02-0395.png
[OC] Pursuit to gain weight starting January first.,a-patterson,2018-02-19 15:07:07,https://i.redd.it/b9nznc4gq6h01.jpg,https://www.reddit.com/r/dataisbeautiful/comments/7yn8cg/oc_pursuit_to_gain_weight_starting_january_first/,15,15,,9,OC Pursuit to gain weight starting January first.,2018-02-0396.jpg
[OC] An visualization and analysis of my daily movement on 2/17/17. Data captured by the motion tracking function of my Garmin 230 running watch.,CherokeePilot1997,2018-02-19 15:55:04,https://i.redd.it/2qtmptxzy6h01.jpg,https://www.reddit.com/r/dataisbeautiful/comments/7ynkmc/oc_an_visualization_and_analysis_of_my_daily/,10,10,,2,OC An visualization and analysis of my daily movement on 21717. Data captured by the motion tracking function of my Garmin 230 running watch.,2018-02-0397.jpg
"Price changes vs. inflation in the US, 1997-2017",rhiever,2018-02-19 16:21:52,https://www.aei.org/publication/chart-of-the-day-century-price-changes-1997-to-2017/,https://www.reddit.com/r/dataisbeautiful/comments/7yns7a/price_changes_vs_inflation_in_the_us_19972017/,185,185,,74,"Price changes vs. inflation in the US, 1997-2017",2018-02-0398.jpg
graph of my colored pencil use [oc],yoseflerner,2018-02-19 17:04:18,https://i.redd.it/5u07xm1r87h01.jpg,https://www.reddit.com/r/dataisbeautiful/comments/7yo4mg/graph_of_my_colored_pencil_use_oc/,24872,24872,,764,graph of my colored pencil use oc,2018-02-0399.jpg
Lego sets prices visualised for different themes and number of pieces [OC],waterced1,2018-02-19 17:30:05,https://i.redd.it/294dq6zjf7h01.png,https://www.reddit.com/r/dataisbeautiful/comments/7yoc1a/lego_sets_prices_visualised_for_different_themes/,17,17,,10,Lego sets prices visualised for different themes and number of pieces OC,2018-02-0400.png
"This chart shows the % of teams in the NFL that improve, decline or stay the same the next season based on their record in the previous season. [OC]",JPAnalyst,2018-02-19 17:49:00,https://i.redd.it/o2vfrzz9j7h01.jpg,https://www.reddit.com/r/dataisbeautiful/comments/7yohkp/this_chart_shows_the_of_teams_in_the_nfl_that/,32,32,,12,"This chart shows the % of teams in the NFL that improve, decline or stay the same the next season based on their record in the previous season. OC",2018-02-0401.jpg
Spectra of F1 Liveries over the years [OC],chainbearf1,2018-02-19 18:05:41,https://i.redd.it/0ymzbsz5m7h01.png,https://www.reddit.com/r/dataisbeautiful/comments/7yomg7/spectra_of_f1_liveries_over_the_years_oc/,12,12,,5,Spectra of F1 Liveries over the years OC,2018-02-0402.png
"Breakdown of the top 100 r/prequelmemes posts. Don't know why I made this, but I did. [OC]",rick1719,2018-02-19 18:15:09,https://i.redd.it/361vsu4rn7h01.png,https://www.reddit.com/r/dataisbeautiful/comments/7yopbv/breakdown_of_the_top_100_rprequelmemes_posts_dont/,81,81,,4,"Breakdown of the top 100 rprequelmemes posts. Don't know why I made this, but I did. OC",2018-02-0403.png
Pokémon - Offensive Ability by Type [OC],Neoptolemy,2018-02-19 18:36:05,https://i.redd.it/97fcxcfcr7h01.png,https://www.reddit.com/r/dataisbeautiful/comments/7yovmg/pokémon_offensive_ability_by_type_oc/,21,21,,7,Pokémon - Offensive Ability by Type OC,2018-02-0404.png
This chart shows the average shift in wins for an NFL team the next season based on the number of wins in the previous season [OC],JPAnalyst,2018-02-19 18:39:26,https://i.redd.it/60l65kq3s7h01.jpg,https://www.reddit.com/r/dataisbeautiful/comments/7yown7/this_chart_shows_the_average_shift_in_wins_for_an/,16,16,,7,This chart shows the average shift in wins for an NFL team the next season based on the number of wins in the previous season OC,2018-02-0405.jpg
Strength of chess Grandmasters by country [OC],karlpoppery,2018-02-19 18:46:25,https://imgur.com/fkJ6mdL,https://www.reddit.com/r/dataisbeautiful/comments/7yoypl/strength_of_chess_grandmasters_by_country_oc/,27,27,,8,Strength of chess Grandmasters by country OC,2018-02-0406.jpg
Entry for : DataViz Battle for the month of February 2018: Visualize the Legal Status of Same-sex Marriage by US State and Year [OC],qlambron,2018-02-19 20:31:29,https://i.redd.it/rn8s73f4c8h01.png,https://www.reddit.com/r/dataisbeautiful/comments/7ypuyt/entry_for_dataviz_battle_for_the_month_of/,10,10,,2,Entry for DataViz Battle for the month of February 2018 Visualize the Legal Status of Same-sex Marriage by US State and Year OC,2018-02-0407.png
Paid vacations & paid holidays in selected countries [OC],lisacrost,2018-02-19 20:44:43,https://i.redd.it/ko8eu0gke8h01.png,https://www.reddit.com/r/dataisbeautiful/comments/7ypyz5/paid_vacations_paid_holidays_in_selected/,9,9,,14,Paid vacations & paid holidays in selected countries OC,2018-02-0408.png
The top 10 trending memes of 2017 ranked by country where they were most popular. [OC],IMA_BLACKSTAR,2018-02-19 20:57:47,https://i.redd.it/w6konwsrf8h01.png,https://www.reddit.com/r/dataisbeautiful/comments/7yq32u/the_top_10_trending_memes_of_2017_ranked_by/,9,9,,3,The top 10 trending memes of 2017 ranked by country where they were most popular. OC,2018-02-0409.png
[OC] News headlines and social media posts regarding SP500 companies broken down by word -- depicts frequency using the radius and most common next-day market movement association using the color,TheLoneDonut,2018-02-19 21:12:33,https://imgur.com/rFbogMv,https://www.reddit.com/r/dataisbeautiful/comments/7yq7np/oc_news_headlines_and_social_media_posts/,7,7,,6,OC News headlines and social media posts regarding SP500 companies broken down by word -- depicts frequency using the radius and most common next-day,2018-02-0410.jpg
Total WORDS spoken by each main character of The Office [OC],experimex,2018-02-19 21:55:12,https://i.redd.it/h3acn788r8h01.png,https://www.reddit.com/r/dataisbeautiful/comments/7yqjwt/total_words_spoken_by_each_main_character_of_the/,30350,30350,,1289,Total WORDS spoken by each main character of The Office OC,2018-02-0411.png
"Flu mortality vs vaccination rates show correlation in 2014 and 2016, but not 2015 [OC]",pkarski,2018-02-20 01:02:56,https://i.redd.it/bma68401o9h01.png,https://www.reddit.com/r/dataisbeautiful/comments/7yrwln/flu_mortality_vs_vaccination_rates_show/,7,7,,7,"Flu mortality vs vaccination rates show correlation in 2014 and 2016, but not 2015 OC",2018-02-0412.png
Search popularity of the three 'controversial' 2018 Winter Olympics competitors [OC],Phnx_Gdwn,2018-02-20 01:31:57,https://i.redd.it/m3zx52be29h01.png,https://www.reddit.com/r/dataisbeautiful/comments/7ys3kv/search_popularity_of_the_three_controversial_2018/,4,4,,2,Search popularity of the three 'controversial' 2018 Winter Olympics competitors OC,2018-02-0413.png
Immigration to Norway from 1970 to 2017 [OC],NevCee,2018-02-20 01:32:34,https://i.redd.it/6h5czts8r9h01.png,https://www.reddit.com/r/dataisbeautiful/comments/7ys3r4/immigration_to_norway_from_1970_to_2017_oc/,5,5,,2,Immigration to Norway from 1970 to 2017 OC,2018-02-0414.png
The Marvel Movie Social Graph [OC],dethtron5000,2018-02-20 03:08:18,https://medium.com/@dethtron5000/the-marvel-movie-graph-5-years-later-7334a6a01398,https://www.reddit.com/r/dataisbeautiful/comments/7yspnm/the_marvel_movie_social_graph_oc/,12,12,,3,The Marvel Movie Social Graph OC,2018-02-0415.jpg
Where the Sugar Babies Are,jimrosenz,2018-02-20 03:13:34,https://www.theatlantic.com/education/archive/2015/01/where-the-sugar-babies-are/384547/,https://www.reddit.com/r/dataisbeautiful/comments/7ysqut/where_the_sugar_babies_are/,1,1,,2,Where the Sugar Babies Are,2018-02-0416.jpg
Languages by Total Number of Speakers [OC],Impulse_you_html,2018-02-20 04:27:04,https://i.redd.it/n709jag4pah01.png,https://www.reddit.com/r/dataisbeautiful/comments/7yt6ss/languages_by_total_number_of_speakers_oc/,14,14,,8,Languages by Total Number of Speakers OC,2018-02-0417.png
Facebook vs. Snap [OC],ChickenTeriyakiBoy1,2018-02-20 04:40:19,https://i.redd.it/4a40s8merah01.jpg,https://www.reddit.com/r/dataisbeautiful/comments/7yt9jh/facebook_vs_snap_oc/,14,14,,5,Facebook vs. Snap OC,2018-02-0418.jpg
Sports of the Winter Olympics [OC],takeasecond,2018-02-20 07:16:35,https://i.redd.it/ust7rlwcjbh01.png,https://www.reddit.com/r/dataisbeautiful/comments/7yu2yd/sports_of_the_winter_olympics_oc/,30,30,,4,Sports of the Winter Olympics OC,2018-02-0419.png
"Olympic Winter Games 2018 Medal Table normalized by GDP per Capita (20. Feb. 2018, 09:00 GMT+1) [OC]",GodEmperor42,2018-02-20 08:53:00,https://i.redd.it/f0xfh1f70ch01.png,https://www.reddit.com/r/dataisbeautiful/comments/7yuhn4/olympic_winter_games_2018_medal_table_normalized/,3,3,,4,"Olympic Winter Games 2018 Medal Table normalized by GDP per Capita (20. Feb. 2018, 0900 GMT+1) OC",2018-02-0420.png
"Cape Town, South Africa, is about to run out of water. Here's a map visualisation of which suburbs use more water than they should.",thepurplemongoose,2018-02-20 11:51:21,http://water.eighty20.co.za/?utm_source=reddit&utm_medium=reddit_cape_town&utm_campaign=water_tracker&utm_content=post#heading,https://www.reddit.com/r/dataisbeautiful/comments/7yvbgr/cape_town_south_africa_is_about_to_run_out_of/,11,11,,3,"Cape Town, South Africa, is about to run out of water. Here's a map visualisation of which suburbs use more water than they should.",2018-02-0421.jpg
Roger Federer becomes the oldest ATP World No. 1 in history [OC],snowyninch,2018-02-20 12:13:44,https://i.imgur.com/slRfbxL.jpg,https://www.reddit.com/r/dataisbeautiful/comments/7yvfsc/roger_federer_becomes_the_oldest_atp_world_no_1/,8,8,,2,Roger Federer becomes the oldest ATP World No. 1 in history OC,2018-02-0422.jpg
Heatmap of countries by amount of banned books [OC],Not_Scary_Anymore,2018-02-20 12:18:34,https://i.redd.it/coilqy901dh01.png,https://www.reddit.com/r/dataisbeautiful/comments/7yvgm3/heatmap_of_countries_by_amount_of_banned_books_oc/,31,31,,45,Heatmap of countries by amount of banned books OC,2018-02-0423.png
Market share of the most used C/C++ IDEs in 2018 [OC],vivaladav,2018-02-20 14:20:30,http://blog.davidecoppola.com/2018/02/market-share-most-used-c-cpp-ides-in-2018-statistics-estimates/,https://www.reddit.com/r/dataisbeautiful/comments/7yw77q/market_share_of_the_most_used_cc_ides_in_2018_oc/,9,9,,5,Market share of the most used CC++ IDEs in 2018 OC,2018-02-0424.jpg
The US Has Dominated in Snowboarding,flerlagekr,2018-02-20 15:27:37,https://public.tableau.com/views/MakeoverMondayS3E7-Olympics/Snowboarding?:embed=y&:display_count=yes:showVizHome=no,https://www.reddit.com/r/dataisbeautiful/comments/7ywp35/the_us_has_dominated_in_snowboarding/,4,4,,0,The US Has Dominated in Snowboarding,2018-02-0425.jpg
Budapest pub density map [OC],bekalaki,2018-02-20 15:33:13,https://i.imgur.com/JHEZ80U.png,https://www.reddit.com/r/dataisbeautiful/comments/7ywqo6/budapest_pub_density_map_oc/,18634,18634,,434,Budapest pub density map OC,2018-02-0426.png
"Lego sets numbers of pieces visualized for price, for different theme (xkcd version) [OC]",waterced1,2018-02-20 17:04:27,https://i.redd.it/99ypcb9rfeh01.png,https://www.reddit.com/r/dataisbeautiful/comments/7yxhez/lego_sets_numbers_of_pieces_visualized_for_price/,55,55,,10,"Lego sets numbers of pieces visualized for price, for different theme (xkcd version) OC",2018-02-0427.png
[OC] My progression in an MMO's hardest solo content (x-post /r/elderscrollsonline),UncleChickenHam,2018-02-20 19:18:07,https://imgur.com/a/6zp6K,https://www.reddit.com/r/dataisbeautiful/comments/7yyl2f/oc_my_progression_in_an_mmos_hardest_solo_content/,5,5,,2,OC My progression in an MMO's hardest solo content (x-post relderscrollsonline),2018-02-0428.jpg
The history of Logan Paul's Youtube Channel [OC],Radinic,2018-02-20 21:12:17,https://i.redd.it/hcby0agfofh01.png,https://www.reddit.com/r/dataisbeautiful/comments/7yzkud/the_history_of_logan_pauls_youtube_channel_oc/,57,57,,16,The history of Logan Paul's Youtube Channel OC,2018-02-0429.png
"These narrative charts showing the character interactions through Star Wars, Lord of the Rings and others.",fatmanny1901,2018-02-21 05:23:27,https://xkcd.com/657/,https://www.reddit.com/r/dataisbeautiful/comments/7z353q/these_narrative_charts_showing_the_character/,12,12,,2,"These narrative charts showing the character interactions through Star Wars, Lord of the Rings and others.",2018-02-0430.jpg
"Ten years of saving dollar bills, and I find myself swimming in them [OC]",StoicEeyore,2018-02-21 11:19:06,https://i.redd.it/1lxiqhnmihh01.jpg,https://www.reddit.com/r/dataisbeautiful/comments/7z4u02/ten_years_of_saving_dollar_bills_and_i_find/,5,5,,10,"Ten years of saving dollar bills, and I find myself swimming in them OC",2018-02-0431.jpg
56.6% of early-onset dementia is alcohol-related,kushalc,2018-02-21 11:25:41,http://www.thelancet.com/journals/lanpub/article/PIIS2468-2667(18)30022-7/fulltext,https://www.reddit.com/r/dataisbeautiful/comments/7z4v68/566_of_earlyonset_dementia_is_alcoholrelated/,22562,22562,,1632,56.6% of early-onset dementia is alcohol-related,2018-02-0432.jpg
Are music artists trotting out the same set lists gig after gig? [OC],chris-love,2018-02-21 13:12:23,https://medium.com/@databeats/on-repeat-70aba1cdc5f8,https://www.reddit.com/r/dataisbeautiful/comments/7z5f8t/are_music_artists_trotting_out_the_same_set_lists/,9,9,,4,Are music artists trotting out the same set lists gig after gig OC,2018-02-0433.jpg
IPv4 Address Map from 2007 to 2016,man-rata,2018-02-21 13:15:40,https://www.ip2location.com/articles/study-of-ipv4-address-allocation-by-continents,https://www.reddit.com/r/dataisbeautiful/comments/7z5fxb/ipv4_address_map_from_2007_to_2016/,13,13,,0,IPv4 Address Map from 2007 to 2016,2018-02-0434.jpg
Most of Europe as a map of dots [OC],datekram,2018-02-21 13:17:29,https://i.imgur.com/3o0w6Rw.png,https://www.reddit.com/r/dataisbeautiful/comments/7z5gd0/most_of_europe_as_a_map_of_dots_oc/,19,19,,3,Most of Europe as a map of dots OC,2018-02-0435.png
Visual Analysis of 2018 Olympic Women's Downhill,Chuckmac88,2018-02-21 14:55:41,https://www.nytimes.com/interactive/2018/02/21/sports/olympics/downhill-lindsey-vonn-sofia-goggia.html?hp&action=click&pgtype=Homepage&clickSource=story-heading&module=second-column-region&region=top-news&WT.nav=top-news,https://www.reddit.com/r/dataisbeautiful/comments/7z63gr/visual_analysis_of_2018_olympic_womens_downhill/,58,58,,3,Visual Analysis of 2018 Olympic Women's Downhill,2018-02-0436.jpg
Distribution of Artists on my playlist over time [OC],yoshijosh55,2018-02-21 19:20:39,https://i.redd.it/pbjcw8ee9mh01.png,https://www.reddit.com/r/dataisbeautiful/comments/7z87ri/distribution_of_artists_on_my_playlist_over_time/,10,10,,8,Distribution of Artists on my playlist over time OC,2018-02-0437.png
IMDb recommendations interactive graph [OC],iguanasv9t,2018-02-21 20:08:06,https://medium.com/@iggisv9t/what-to-watch-tonight-scraping-imdb-and-visualizing-its-data-as-interactive-website-328a794498a2,https://www.reddit.com/r/dataisbeautiful/comments/7z8lrh/imdb_recommendations_interactive_graph_oc/,22,22,,5,IMDb recommendations interactive graph OC,2018-02-0438.jpg
"The time it takes for a pendulum to swing back and forth is the same, regardless of it's starting deflection [OC]",ScLi432,2018-02-21 20:23:40,https://imgur.com/a/itgez,https://www.reddit.com/r/dataisbeautiful/comments/7z8qes/the_time_it_takes_for_a_pendulum_to_swing_back/,24,24,,8,"The time it takes for a pendulum to swing back and forth is the same, regardless of it's starting deflection OC",2018-02-0439.jpg
Emotional sentiment in NFL coaches' post-game press conferences -- wins and losses affect coaches differently [OC],SCPerformanceScience,2018-02-21 21:36:30,https://medium.com/@USCPerformanceScience/coach-speak-analyzing-nfl-coaches-post-game-press-conference-e2f219bd0d4f,https://www.reddit.com/r/dataisbeautiful/comments/7z9bbs/emotional_sentiment_in_nfl_coaches_postgame_press/,2,2,,2,Emotional sentiment in NFL coaches' post-game press conferences -- wins and losses affect coaches differently OC,2018-02-0440.jpg
Last time each NFL team had a better record than each other team,drsjsmith,2018-02-21 21:43:45,https://www.reddit.com/r/nfl/comments/7z6kgc/last_time_each_nfl_team_had_a_better_record_than/,https://www.reddit.com/r/dataisbeautiful/comments/7z9dec/last_time_each_nfl_team_had_a_better_record_than/,10,10,,1,Last time each NFL team had a better record than each other team,2018-02-0441.jpg
Thoughts on Position: 288 people were asked questions about their perceptions of basic shapes in order to determine if the same element can communicate different messages when placed in different positions.,articulateantagonist,2018-02-22 04:20:36,http://neivalente.com/thoughts-on-position,https://www.reddit.com/r/dataisbeautiful/comments/7zc36s/thoughts_on_position_288_people_were_asked/,18,18,,3,Thoughts on Position 288 people were asked questions about their perceptions of basic shapes in order to determine if the same element can communicate,2018-02-0442.jpg
Efficiency of manual code optimisation for the STM32F0 USB CDC library [OC],random-jimmy,2018-02-22 06:26:46,https://i.redd.it/ofpyd9v5kph01.png,https://www.reddit.com/r/dataisbeautiful/comments/7zcsh3/efficiency_of_manual_code_optimisation_for_the/,5,5,,2,Efficiency of manual code optimisation for the STM32F0 USB CDC library OC,2018-02-0443.png
What did the Top 25 Fortune 500 Companies Make per second in 2016? [OC],sateeshkumar44,2018-02-22 12:28:22,https://vizard.co/top-25-profitable-companies-made-2016/,https://www.reddit.com/r/dataisbeautiful/comments/7zej41/what_did_the_top_25_fortune_500_companies_make/,4,4,,4,What did the Top 25 Fortune 500 Companies Make per second in 2016 OC,2018-02-0444.jpg
I mapped the artist collaboration network of my most played hip-hop songs [OC],MelosMojo,2018-02-22 13:35:55,https://imgur.com/57OV8EJ,https://www.reddit.com/r/dataisbeautiful/comments/7zewu0/i_mapped_the_artist_collaboration_network_of_my/,30,30,,11,I mapped the artist collaboration network of my most played hip-hop songs OC,2018-02-0445.jpg
