title,author,created_date,url,full_permalink,score,ups,downs,num_comments,sanitized_title,image_file
"How a Police Chief, a Governor and a Sociologist Would Spend $100 Billion to Solve the Opioid Crisis",endthestory,2018-02-14 19:48:54,https://www.nytimes.com/interactive/2018/02/14/upshot/opioid-crisis-solutions.html,https://www.reddit.com/r/dataisbeautiful/comments/7xkqu3/how_a_police_chief_a_governor_and_a_sociologist/,11,11,,3,"How a Police Chief, a Governor and a Sociologist Would Spend $100 Billion to Solve the Opioid Crisis",2018-02-0299.jpg
"Annual visitors to the most popular U.S. National Parks, 1950-2017 [OC]",academiaadvice,2018-02-14 21:14:31,https://i.redd.it/glhizb3fv8g01.png,https://www.reddit.com/r/dataisbeautiful/comments/7xldur/annual_visitors_to_the_most_popular_us_national/,19,19,,12,"Annual visitors to the most popular U.S. National Parks, 1950-2017 OC",2018-02-0300.png
I mapped the network of corporate investments by Alphabet (Google's parent company) [OC],jrowley,2018-02-14 23:26:56,https://i.redd.it/8q9p8d4ti9g01.jpg,https://www.reddit.com/r/dataisbeautiful/comments/7xmb02/i_mapped_the_network_of_corporate_investments_by/,13,13,,6,I mapped the network of corporate investments by Alphabet (Google's parent company) OC,2018-02-0301.jpg
"My Google search activity, graphed by average time of day and animated over time for 8 years. [OC]",labtec901,2018-02-15 01:59:06,https://v.redd.it/xibjk4487ag01,https://www.reddit.com/r/dataisbeautiful/comments/7xn7q4/my_google_search_activity_graphed_by_average_time/,180,180,,19,"My Google search activity, graphed by average time of day and animated over time for 8 years. OC",2018-02-0302.png
Total Nuclear Detonations Over Time [OC],rohrmanpacker,2018-02-15 02:41:12,https://i.redd.it/irw4rsmihag01.png,https://www.reddit.com/r/dataisbeautiful/comments/7xngvb/total_nuclear_detonations_over_time_oc/,1153,1153,,78,Total Nuclear Detonations Over Time OC,2018-02-0303.png
My blood pressure and heart rate measurements over the past two weeks [OC],Skizm,2018-02-15 03:59:24,https://i.imgur.com/n84lv3z.png,https://www.reddit.com/r/dataisbeautiful/comments/7xnwcs/my_blood_pressure_and_heart_rate_measurements/,2,2,,10,My blood pressure and heart rate measurements over the past two weeks OC,2018-02-0304.png
"Gun Homicides per 100,000 residents, by U.S. State, 2007-2016 [OC]",academiaadvice,2018-02-15 05:16:08,https://i.redd.it/aimwfsv72bg01.png,https://www.reddit.com/r/dataisbeautiful/comments/7xoalk/gun_homicides_per_100000_residents_by_us_state/,9304,9304,,2361,"Gun Homicides per 100,000 residents, by U.S. State, 2007-2016 OC",2018-02-0305.png
What if men and women skied against each other in the Olympics?,jetleigh,2018-02-15 05:30:57,https://fivethirtyeight.com/features/what-if-men-and-women-skied-against-each-other-in-the-olympics/?ex_cid=538twitter,https://www.reddit.com/r/dataisbeautiful/comments/7xod59/what_if_men_and_women_skied_against_each_other_in/,25,25,,11,What if men and women skied against each other in the Olympics,2018-02-0306.jpg
I've recorded the time between my girlfriend's sneezes and made a figure showing interval vs. time [OC],theplayingdead,2018-02-15 09:39:50,https://i.redd.it/1jgg48j6kcg01.jpg,https://www.reddit.com/r/dataisbeautiful/comments/7xpbqf/ive_recorded_the_time_between_my_girlfriends/,10,10,,19,I've recorded the time between my girlfriend's sneezes and made a figure showing interval vs. time OC,2018-02-0307.jpg
Nuclear Detonations Per Year [OC],topamine2,2018-02-15 09:41:23,https://i.redd.it/raqbsnqmkcg01.jpg,https://www.reddit.com/r/dataisbeautiful/comments/7xpbyb/nuclear_detonations_per_year_oc/,97,97,,13,Nuclear Detonations Per Year OC,2018-02-0308.jpg
How the demand for cryptocurrencies is driving up GPU prices [OC],stekhn,2018-02-15 10:36:20,https://stekhn.github.io/gpu-price-surge-analysis/,https://www.reddit.com/r/dataisbeautiful/comments/7xpjrl/how_the_demand_for_cryptocurrencies_is_driving_up/,10,10,,10,How the demand for cryptocurrencies is driving up GPU prices OC,2018-02-0309.jpg
Migration and female genital mutilation,jimrosenz,2018-02-15 10:59:20,https://wol.iza.org/articles/migration-and-female-genital-mutilation,https://www.reddit.com/r/dataisbeautiful/comments/7xpn3c/migration_and_female_genital_mutilation/,2,2,,1,Migration and female genital mutilation,2018-02-0310.jpg
"Limbo Lines: Dead Here, Alive There",DLC204,2018-02-15 12:48:29,https://pudding.cool/2018/02/death/,https://www.reddit.com/r/dataisbeautiful/comments/7xq4q9/limbo_lines_dead_here_alive_there/,3,3,,0,"Limbo Lines Dead Here, Alive There",2018-02-0311.jpg
College tuition cost visualization shows state-by-state prices,caccionecup,2018-02-15 14:01:43,https://www.simplethriftyliving.com/college-tuition-costs-united-states-state-compare/,https://www.reddit.com/r/dataisbeautiful/comments/7xqivf/college_tuition_cost_visualization_shows/,179,179,,34,College tuition cost visualization shows state-by-state prices,2018-02-0312.jpg
Death penalty: execution rates in G20 members in 2016 [OC],Udzu,2018-02-15 14:14:53,https://i.redd.it/o0chvoggxdg01.png,https://www.reddit.com/r/dataisbeautiful/comments/7xqloz/death_penalty_execution_rates_in_g20_members_in/,34040,34040,,4261,Death penalty execution rates in G20 members in 2016 OC,2018-02-0313.png
New York Times Visualization of School Shootings Since Sandy Hook,pipsdontsqueak,2018-02-15 14:16:49,https://www.nytimes.com/interactive/2018/02/15/us/school-shootings-sandy-hook-parkland.html,https://www.reddit.com/r/dataisbeautiful/comments/7xqm4s/new_york_times_visualization_of_school_shootings/,67,67,,16,New York Times Visualization of School Shootings Since Sandy Hook,2018-02-0314.jpg
"Murders in US very concentrated: 54% of US counties in 2014 had zero murders, 2% of counties have 51% of the murders",intrepidone66,2018-02-15 15:31:44,https://crimeresearch.org/2017/04/number-murders-county-54-us-counties-2014-zero-murders-69-1-murder/,https://www.reddit.com/r/dataisbeautiful/comments/7xr3ax/murders_in_us_very_concentrated_54_of_us_counties/,107,107,,180,"Murders in US very concentrated 54% of US counties in 2014 had zero murders, 2% of counties have 51% of the murders",2018-02-0315.jpg
Crumbling Infrastructure: The State of American Roads and Bridges [OC],flerlagekr,2018-02-15 15:33:01,https://public.tableau.com/views/CrumblingInfrastructure/USInfrastructure?:embed=y&:display_count=yes,https://www.reddit.com/r/dataisbeautiful/comments/7xr3nk/crumbling_infrastructure_the_state_of_american/,9,9,,2,Crumbling Infrastructure The State of American Roads and Bridges OC,2018-02-0316.jpg
A Public Health Approach to Gun Violence (NYTimes),deeayytch,2018-02-15 15:38:30,https://www.nytimes.com/interactive/2017/11/06/opinion/how-to-reduce-shootings.html,https://www.reddit.com/r/dataisbeautiful/comments/7xr4wx/a_public_health_approach_to_gun_violence_nytimes/,11,11,,6,A Public Health Approach to Gun Violence (NYTimes),2018-02-0317.jpg
The Words of Larry Nassar Survivors [OC],atleastbeth3,2018-02-15 17:35:56,https://i.redd.it/k5d6m32bxeg01.png,https://www.reddit.com/r/dataisbeautiful/comments/7xrzpk/the_words_of_larry_nassar_survivors_oc/,13,13,,2,The Words of Larry Nassar Survivors OC,2018-02-0318.png
Income and spending for family of 4 [OC],Caasi67,2018-02-15 17:47:14,https://i.redd.it/ayulxnfazeg01.png,https://www.reddit.com/r/dataisbeautiful/comments/7xs2sa/income_and_spending_for_family_of_4_oc/,55,55,,11,Income and spending for family of 4 OC,2018-02-0319.png
Digging into the data: How attainable is the California Dream today?,BlankVerse,2018-02-15 19:51:50,https://www.scpr.org/news/2018/02/15/80783/digging-into-the-data-how-attainable-is-the-califo/,https://www.reddit.com/r/dataisbeautiful/comments/7xt05z/digging_into_the_data_how_attainable_is_the/,1,1,,0,Digging into the data How attainable is the California Dream today,2018-02-0320.jpg
How many Tesla Model 3's are being built each week (Bloomberg estimate),ChickenTeriyakiBoy1,2018-02-15 20:15:39,https://www.bloomberg.com/graphics/2018-tesla-tracker/,https://www.reddit.com/r/dataisbeautiful/comments/7xt6lm/how_many_tesla_model_3s_are_being_built_each_week/,2,2,,0,How many Tesla Model 3's are being built each week (Bloomberg estimate),2018-02-0321.jpg
Here is a short list of countries with at least 5 medals and 90% or more of their medals coming from one sport in the Winter Olympics. This really highlights how specialized the Netherlands is in speed-skating. [OC],JPAnalyst,2018-02-15 20:26:02,https://i.redd.it/emryf44prfg01.jpg,https://www.reddit.com/r/dataisbeautiful/comments/7xt9eh/here_is_a_short_list_of_countries_with_at_least_5/,88,88,,21,Here is a short list of countries with at least 5 medals and 90% or more of their medals coming from one sport in the Winter Olympics. This really hig,2018-02-0322.jpg
US Government Spending vs. Revenue,ChickenTeriyakiBoy1,2018-02-15 20:41:55,https://usafacts.org/the-big-picture?return_to=%2F,https://www.reddit.com/r/dataisbeautiful/comments/7xtdnw/us_government_spending_vs_revenue/,20,20,,7,US Government Spending vs. Revenue,2018-02-0323.jpg
The World's Largest Human Migration Is About To Begin,jimrosenz,2018-02-15 21:17:57,https://www.statista.com/chart/12916/the-worlds-largest-migration-is-about-to-begin/,https://www.reddit.com/r/dataisbeautiful/comments/7xtn2s/the_worlds_largest_human_migration_is_about_to/,14,14,,1,The World's Largest Human Migration Is About To Begin,2018-02-0324.jpg
Which sequence of letters has the highest number of permutations that are words? [OC],jtang9001,2018-02-15 21:25:44,https://i.redd.it/au1n535v1gg01.png,https://www.reddit.com/r/dataisbeautiful/comments/7xtp3j/which_sequence_of_letters_has_the_highest_number/,2,2,,7,Which sequence of letters has the highest number of permutations that are words OC,2018-02-0325.png
Money is the reason gun control legislation won't pass [OC],DontVoteForMe,2018-02-15 21:51:56,https://medium.com/vote-lab/money-votes-and-the-power-dynamics-of-gun-laws-3430aea6c146,https://www.reddit.com/r/dataisbeautiful/comments/7xtvva/money_is_the_reason_gun_control_legislation_wont/,14,14,,36,Money is the reason gun control legislation won't pass OC,2018-02-0326.jpg
Sydney drawn by its buses [OC],winklevos,2018-02-15 22:05:23,https://imgur.com/a/N3pje,https://www.reddit.com/r/dataisbeautiful/comments/7xtzab/sydney_drawn_by_its_buses_oc/,21,21,,7,Sydney drawn by its buses OC,2018-02-0327.jpg
"Chaotic double pendulum, created using p5.js [OC]",pokepuns11,2018-02-16 00:40:02,https://v.redd.it/1nab1izuxgg01,https://www.reddit.com/r/dataisbeautiful/comments/7xv076/chaotic_double_pendulum_created_using_p5js_oc/,18,18,,3,"Chaotic double pendulum, created using p5.js OC",2018-02-0328.png
President Trump's Approval Ratings vs. The Congressional Race between Democrats and Republicans in the last 10 months. [OC],pianoboy8,2018-02-16 01:37:11,https://imgur.com/a/vGmX8,https://www.reddit.com/r/dataisbeautiful/comments/7xvd1z/president_trumps_approval_ratings_vs_the/,5,5,,2,President Trump's Approval Ratings vs. The Congressional Race between Democrats and Republicans in the last 10 months. OC,2018-02-0329.jpg
"Nuclear detonations 1945-2017 by country, Inspired by /u/topamine2 's post [OC]",mrscottflo,2018-02-16 02:51:51,https://i.redd.it/kerh7i78ohg01.png,https://www.reddit.com/r/dataisbeautiful/comments/7xvswz/nuclear_detonations_19452017_by_country_inspired/,6,6,,5,"Nuclear detonations 1945-2017 by country, Inspired by utopamine2 's post OC",2018-02-0330.png
"A comparison of powerboat length vs. price, color coded by manufacturer [OC]",labtec901,2018-02-16 05:12:35,https://imgur.com/a/pk2gk,https://www.reddit.com/r/dataisbeautiful/comments/7xwk49/a_comparison_of_powerboat_length_vs_price_color/,3,3,,3,"A comparison of powerboat length vs. price, color coded by manufacturer OC",2018-02-0331.jpg
2017-2018 influenza season vs previous years - CDC,juniperwak,2018-02-16 05:32:26,https://www.cdc.gov/mmwr/volumes/67/wr/mm6706a1.htm?s_cid=mm6706a1_e,https://www.reddit.com/r/dataisbeautiful/comments/7xwnr8/20172018_influenza_season_vs_previous_years_cdc/,1,1,,2,2017-2018 influenza season vs previous years - CDC,2018-02-0332.jpg
Probability that two random babies are given the same first name in the US [OC],TravelFaster,2018-02-16 09:45:06,https://i.redd.it/9ptspmtjpjg01.png,https://www.reddit.com/r/dataisbeautiful/comments/7xxpd7/probability_that_two_random_babies_are_given_the/,29,29,,13,Probability that two random babies are given the same first name in the US OC,2018-02-0333.png
Top 100 Countries by Game Revenues,IKomlev,2018-02-16 10:17:39,https://knoema.com/infographics/tqldbq/top-100-countries-by-game-revenues,https://www.reddit.com/r/dataisbeautiful/comments/7xxu70/top_100_countries_by_game_revenues/,3,3,,0,Top 100 Countries by Game Revenues,2018-02-0334.jpg
Irritable Bowel Syndrome: a month in graphs [OC],vizinmypants,2018-02-16 11:24:18,https://public.tableau.com/views/Quantifiedselfcoprorate-style/Loglogging?:tabs=no&embed=y&:display_count=yes&:showVizHome=no,https://www.reddit.com/r/dataisbeautiful/comments/7xy455/irritable_bowel_syndrome_a_month_in_graphs_oc/,6,6,,2,Irritable Bowel Syndrome a month in graphs OC,2018-02-0335.jpg
"Carbon Dioxide flux in the Southern Ocean. Red=outgassing, Blue=ingassing [OC]",paleoceanographer,2018-02-16 12:50:08,https://i.redd.it/qdxv7k05nkg01.png,https://www.reddit.com/r/dataisbeautiful/comments/7xyiau/carbon_dioxide_flux_in_the_southern_ocean/,15,15,,2,"Carbon Dioxide flux in the Southern Ocean. Red=outgassing, Blue=ingassing OC",2018-02-0336.png
The struggle to conceive with frozen eggs,OverflowDs,2018-02-16 12:57:10,https://www.washingtonpost.com/news/national/wp/2018/01/27/feature/she-championed-the-idea-that-freezing-your-eggs-would-free-your-career-but-things-didnt-quite-work-out/?utm_term=.f298c992a665,https://www.reddit.com/r/dataisbeautiful/comments/7xyjn5/the_struggle_to_conceive_with_frozen_eggs/,9,9,,0,The struggle to conceive with frozen eggs,2018-02-0337.jpg
Ruined skiis and hypothermia: Complaints of cold in Pyeongchang backed up by satellite data [OC],Geographist,2018-02-16 14:08:54,https://i.redd.it/t34sivyz0lg01.png,https://www.reddit.com/r/dataisbeautiful/comments/7xyxxz/ruined_skiis_and_hypothermia_complaints_of_cold/,24,24,,7,Ruined skiis and hypothermia Complaints of cold in Pyeongchang backed up by satellite data OC,2018-02-0338.png
Winter Olympic Medals Adjusted by GDP and Population [OC],flerlagekr,2018-02-16 14:32:40,https://public.tableau.com/views/GDPandPopulationImpactonWinterOlympicPerformance/WinterOlympics?:embed=y&:display_count=yes,https://www.reddit.com/r/dataisbeautiful/comments/7xz376/winter_olympic_medals_adjusted_by_gdp_and/,11,11,,3,Winter Olympic Medals Adjusted by GDP and Population OC,2018-02-0339.jpg
My weight loss over 126 weeks [OC],Galendis,2018-02-16 14:54:52,https://i.redd.it/j8ul7c4j9lg01.png,https://www.reddit.com/r/dataisbeautiful/comments/7xz836/my_weight_loss_over_126_weeks_oc/,36446,36446,,1385,My weight loss over 126 weeks OC,2018-02-0340.png
Where our Money Goes: $150k/yr couple aiming for early retirement [OC],Humble_brag01,2018-02-16 16:46:14,https://i.imgur.com/eCabrjf.png,https://www.reddit.com/r/dataisbeautiful/comments/7y003x/where_our_money_goes_150kyr_couple_aiming_for/,17,17,,6,Where our Money Goes $150kyr couple aiming for early retirement OC,2018-02-0341.png
Minimum age to buy a beer [OC],Udzu,2018-02-16 17:03:02,https://i.redd.it/h011c729wlg01.png,https://www.reddit.com/r/dataisbeautiful/comments/7y04sk/minimum_age_to_buy_a_beer_oc/,54,54,,24,Minimum age to buy a beer OC,2018-02-0342.png
My PhD in Chemistry in Numbers [OC],tifosi1990,2018-02-16 17:23:51,https://i.redd.it/tduxa2c00mg01.png,https://www.reddit.com/r/dataisbeautiful/comments/7y0ag1/my_phd_in_chemistry_in_numbers_oc/,182,182,,49,My PhD in Chemistry in Numbers OC,2018-02-0343.png
"Whatever you think about guns, this is a moving data vis",doebedoe,2018-02-16 17:48:28,https://www.nytimes.com/interactive/2018/02/15/opinion/congress-gun-progress.html,https://www.reddit.com/r/dataisbeautiful/comments/7y0haq/whatever_you_think_about_guns_this_is_a_moving/,34,34,,7,"Whatever you think about guns, this is a moving data vis",2018-02-0344.jpg
Simulating Jury Selection Bias in Favor of a Majority Population from Peremptory Challenges [OC],almatean,2018-02-16 18:07:57,https://i.redd.it/2e787g4m7mg01.png,https://www.reddit.com/r/dataisbeautiful/comments/7y0mpl/simulating_jury_selection_bias_in_favor_of_a/,10,10,,3,Simulating Jury Selection Bias in Favor of a Majority Population from Peremptory Challenges OC,2018-02-0345.png
Color of Wire Chosen to Diffuse Bombs [OC],AbbyWest,2018-02-16 18:19:52,https://i.redd.it/oqlc9uue9mg01.jpg,https://www.reddit.com/r/dataisbeautiful/comments/7y0pxk/color_of_wire_chosen_to_diffuse_bombs_oc/,38,38,,11,Color of Wire Chosen to Diffuse Bombs OC,2018-02-0346.jpg
"Deaths v. match time in PUBG visualizing ~500,000 deaths. [OC]",ajgoodm,2018-02-16 18:34:13,https://imgur.com/a/3LGz0,https://www.reddit.com/r/dataisbeautiful/comments/7y0ttd/deaths_v_match_time_in_pubg_visualizing_500000/,17,17,,5,"Deaths v. match time in PUBG visualizing ~500,000 deaths. OC",2018-02-0347.jpg
Where is Reddit applying to College? (Analyzing ~500k /r/ApplyingToCollege Comments) [OC],Theriley106,2018-02-16 19:09:22,https://i.redd.it/yobczj9qimg01.png,https://www.reddit.com/r/dataisbeautiful/comments/7y13bb/where_is_reddit_applying_to_college_analyzing/,249,249,,55,Where is Reddit applying to College (Analyzing ~500k rApplyingToCollege Comments) OC,2018-02-0348.png
The glass-ceiling index,kaumaron,2018-02-16 20:03:31,https://www.economist.com/blogs/graphicdetail/2018/02/daily-chart-10?fsrc=scn/tw/te/bl/ed/,https://www.reddit.com/r/dataisbeautiful/comments/7y1h8k/the_glassceiling_index/,0,0,,0,The glass-ceiling index,2018-02-0349.jpg
Solar Energy Potential for the United States,3lchucho,2018-02-16 20:12:43,https://arstechnica.com/science/2018/02/a-solar-panel-on-every-roof-in-the-us-here-are-the-numbers/,https://www.reddit.com/r/dataisbeautiful/comments/7y1jnv/solar_energy_potential_for_the_united_states/,11,11,,1,Solar Energy Potential for the United States,2018-02-0350.jpg
"Trucks and Beer: Textual analysis of 12,446 country songs [OC]",textureflow,2018-02-16 22:36:17,http://www.johnwmillr.com/trucks-and-beer/,https://www.reddit.com/r/dataisbeautiful/comments/7y2j5k/trucks_and_beer_textual_analysis_of_12446_country/,49,49,,11,"Trucks and Beer Textual analysis of 12,446 country songs OC",2018-02-0351.jpg
Temperature distribution of an aluminum cylinder in a transient state [OC],tmevangelista,2018-02-16 23:14:28,https://v.redd.it/0g3n0rteqng01,https://www.reddit.com/r/dataisbeautiful/comments/7y2ryy/temperature_distribution_of_an_aluminum_cylinder/,19,19,,4,Temperature distribution of an aluminum cylinder in a transient state OC,2018-02-0352.png
Car vs plane Emissions,Apsylem,2018-02-16 23:27:45,https://www.youtube.com/watch?v=PNsjl7-zr88,https://www.reddit.com/r/dataisbeautiful/comments/7y2v30/car_vs_plane_emissions/,0,0,,2,Car vs plane Emissions,2018-02-0353.jpg
[OC] My airplane's cabin pressure during a flight.,aww_snap,2018-02-16 23:38:39,https://i.imgur.com/KTSpevt.jpg,https://www.reddit.com/r/dataisbeautiful/comments/7y2xj2/oc_my_airplanes_cabin_pressure_during_a_flight/,76,76,,13,OC My airplane's cabin pressure during a flight.,2018-02-0354.jpg
Visualization of Basic Craps Bets [OC],EMD_2,2018-02-17 01:26:50,https://i.redd.it/1qxd9n02eog01.png,https://www.reddit.com/r/dataisbeautiful/comments/7y3lav/visualization_of_basic_craps_bets_oc/,14,14,,3,Visualization of Basic Craps Bets OC,2018-02-0355.png
Visualizing the nanoscale evolution of copper interface morphology during electrodeposition - heat map of growth rate (normal velocity). Each panel create with Mathematica by processing video frames from experiments carried out in an transmission electron microscope. [OC],NMSchneider,2018-02-17 02:14:17,https://i.redd.it/zz8hik5zlog01.png,https://www.reddit.com/r/dataisbeautiful/comments/7y3v23/visualizing_the_nanoscale_evolution_of_copper/,7,7,,3,Visualizing the nanoscale evolution of copper interface morphology during electrodeposition - heat map of growth rate (normal velocity). Each panel cr,2018-02-0356.png
NBA Rookie of the Year Race 2017-18 [OC],Harris7Curtis,2018-02-17 03:04:22,https://public.tableau.com/views/NBARookieoftheYearRace2017-18/NBARookieoftheYearRace?:embed=y&:display_count=yes&:showVizHome=no,https://www.reddit.com/r/dataisbeautiful/comments/7y44pk/nba_rookie_of_the_year_race_201718_oc/,29,29,,19,NBA Rookie of the Year Race 2017-18 OC,2018-02-0357.jpg
Made this SankeyMATIC on the songs of my Post Rock Playlist and their respective bands. [OC],ArmoredSpearhead,2018-02-17 04:44:07,https://i.redd.it/f9t35e2bdpg01.png,https://www.reddit.com/r/dataisbeautiful/comments/7y4m5e/made_this_sankeymatic_on_the_songs_of_my_post/,4,4,,8,Made this SankeyMATIC on the songs of my Post Rock Playlist and their respective bands. OC,2018-02-0358.png
Number of Scientific Papers using Data from Each Modeling Centre participating in the Coupled Model Intercomparison Project Phase 5 (CMIP5) [OC],Saeiou,2018-02-17 04:55:21,https://i.redd.it/8plo9m66epg01.png,https://www.reddit.com/r/dataisbeautiful/comments/7y4o1u/number_of_scientific_papers_using_data_from_each/,5,5,,2,Number of Scientific Papers using Data from Each Modeling Centre participating in the Coupled Model Intercomparison Project Phase 5 (CMIP5) OC,2018-02-0359.png
Olympics Women's Super G animation,vladatb,2018-02-17 06:45:43,https://www.nytimes.com/2018/02/16/sports/olympics/lindsey-vonn-super-g.html,https://www.reddit.com/r/dataisbeautiful/comments/7y55ab/olympics_womens_super_g_animation/,4,4,,0,Olympics Women's Super G animation,2018-02-0360.jpg
Chart of milk products,bdzz,2018-02-17 09:58:59,https://commons.wikimedia.org/wiki/File:Milkproducts.svg,https://www.reddit.com/r/dataisbeautiful/comments/7y5ul5/chart_of_milk_products/,8,8,,2,Chart of milk products,2018-02-0361.jpg
American TV Series in 2017 [OC],goncho314,2018-02-17 10:56:37,https://i.redd.it/sv62so9u7rg01.jpg,https://www.reddit.com/r/dataisbeautiful/comments/7y61ou/american_tv_series_in_2017_oc/,4,4,,4,American TV Series in 2017 OC,2018-02-0362.jpg
This is how America runs in a day.,sateeshkumar44,2018-02-17 12:32:21,http://flowingdata.com/2015/12/15/a-day-in-the-life-of-americans/,https://www.reddit.com/r/dataisbeautiful/comments/7y6ecy/this_is_how_america_runs_in_a_day/,53,53,,5,This is how America runs in a day.,2018-02-0363.jpg
Estimating the date an alleged bribery was agreed upon between Israel's prime minister and a top news publisher [OC],einkloom,2018-02-17 12:45:42,https://i.redd.it/jgglznkfprg01.png,https://www.reddit.com/r/dataisbeautiful/comments/7y6g8f/estimating_the_date_an_alleged_bribery_was_agreed/,39,39,,3,Estimating the date an alleged bribery was agreed upon between Israel's prime minister and a top news publisher OC,2018-02-0364.png
"EVA-indexed restaurants in Flanders, Belgium. Size by number of tags the restaurant has. [OC]",unixftw,2018-02-17 12:58:29,https://i.redd.it/vhutkpvisrg01.png,https://www.reddit.com/r/dataisbeautiful/comments/7y6i4t/evaindexed_restaurants_in_flanders_belgium_size/,0,0,,3,"EVA-indexed restaurants in Flanders, Belgium. Size by number of tags the restaurant has. OC",2018-02-0365.png
A Statistical Analysis of Robert Jordan's The Wheel of Time (4.4 million words),vkatariya8,2018-02-17 13:04:25,https://www.barnesandnoble.com/blog/sci-fi-fantasy/statistical-analysis-wheel-time/,https://www.reddit.com/r/dataisbeautiful/comments/7y6j10/a_statistical_analysis_of_robert_jordans_the/,63,63,,6,A Statistical Analysis of Robert Jordan's The Wheel of Time (4.4 million words),2018-02-0366.jpg
Top Five Largest Cities Troughout History [pt. 2],Apsylem,2018-02-17 13:59:01,https://www.youtube.com/watch?v=B1BTSI-d2sw,https://www.reddit.com/r/dataisbeautiful/comments/7y6rim/top_five_largest_cities_troughout_history_pt_2/,25,25,,0,Top Five Largest Cities Troughout History pt. 2,2018-02-0367.jpg
"Gun Deaths per Private Gun Owned, by Country [OC]",fu-depaul,2018-02-17 17:16:00,https://i.redd.it/21s2zn5j3tg01.jpg,https://www.reddit.com/r/dataisbeautiful/comments/7y7we7/gun_deaths_per_private_gun_owned_by_country_oc/,64,64,,146,"Gun Deaths per Private Gun Owned, by Country OC",2018-02-0368.jpg
Track Elon Musk’s Tesla Roadster in space with this aptly named website,pixelbomb2,2018-02-17 17:37:56,http://www.whereisroadster.com,https://www.reddit.com/r/dataisbeautiful/comments/7y81gb/track_elon_musks_tesla_roadster_in_space_with/,14,14,,1,Track Elon Musk’s Tesla Roadster in space with this aptly named website,2018-02-0369.jpg
Top 10 cities where MLB players were born from 1901 to 2017,BDWabashFiji,2018-02-17 22:25:48,https://twitter.com/darenw/status/964722418324471808,https://www.reddit.com/r/dataisbeautiful/comments/7y9z1d/top_10_cities_where_mlb_players_were_born_from/,2,2,,1,Top 10 cities where MLB players were born from 1901 to 2017,2018-02-0370.jpg
Live from New York: Who's the most influential cast member over 43 seasons? [OC],lane_dog,2018-02-18 00:12:34,https://i.redd.it/h6j75p005vg01.jpg,https://www.reddit.com/r/dataisbeautiful/comments/7yammg/live_from_new_york_whos_the_most_influential_cast/,217,217,,34,Live from New York Who's the most influential cast member over 43 seasons OC,2018-02-0371.jpg
All PlayStation 1 game covers arranged on a 2d map by color using the t-SNE algorithm. [OC],GuiguiLeGui,2018-02-18 00:35:55,https://imgur.com/EvV8wnd,https://www.reddit.com/r/dataisbeautiful/comments/7yarw5/all_playstation_1_game_covers_arranged_on_a_2d/,37,37,,11,All PlayStation 1 game covers arranged on a 2d map by color using the t-SNE algorithm. OC,2018-02-0372.jpg
