title,author,created_date,url,full_permalink,score,ups,downs,num_comments,sanitized_title,image_file
"Timeline of events vs Elapsed video time in Bill Wurtz's 'history of the entire world, I guess'. [OC]",n44m,2018-07-20 03:58:28,https://i.redd.it/4nurw3xm01b11.jpg,https://www.reddit.com/r/dataisbeautiful/comments/90cq4o/timeline_of_events_vs_elapsed_video_time_in_bill/,8911,8911,,398,"Timeline of events vs Elapsed video time in Bill Wurtz's 'history of the entire world, I guess'. OC",2018-07-0375.jpg
NZ commuter flow map [OC],RoachOfRivia,2018-07-20 06:30:22,https://i.redd.it/78d62d5eq1b11.png,https://www.reddit.com/r/dataisbeautiful/comments/90dmv8/nz_commuter_flow_map_oc/,24,24,,5,NZ commuter flow map OC,2018-07-0376.png
Popularity of Metallica tracks by album [OC],comoor,2018-07-20 09:17:09,https://i.redd.it/7f9tex2cl2b11.png,https://www.reddit.com/r/dataisbeautiful/comments/90ehj0/popularity_of_metallica_tracks_by_album_oc/,34,34,,18,Popularity of Metallica tracks by album OC,2018-07-0377.png
How Football World Cup made one small Croatia big in the eyes of the World,gospon,2018-07-20 12:38:39,https://twitter.com/mediatoolkit/status/1018836414446829569,https://www.reddit.com/r/dataisbeautiful/comments/90fmlf/how_football_world_cup_made_one_small_croatia_big/,12,12,,2,How Football World Cup made one small Croatia big in the eyes of the World,2018-07-0378.jpg
"Quantifying ""Hot Streaks"" Across Tens of Thousands of Careers: Contains Video and Interactive Links [OC]",felavsky,2018-07-20 13:16:10,https://i.redd.it/lrdmjyamp3b11.png,https://www.reddit.com/r/dataisbeautiful/comments/90fw6i/quantifying_hot_streaks_across_tens_of_thousands/,142,142,,16,Quantifying Hot Streaks Across Tens of Thousands of Careers Contains Video and Interactive Links OC,2018-07-0379.png
[OC][QUESTION] Conditional formatting of the treemap squares color is possible in Excel 2016?,MrAnsatz,2018-07-20 13:34:08,https://i.redd.it/eawkr5jev3b11.png,https://www.reddit.com/r/dataisbeautiful/comments/90g0st/ocquestion_conditional_formatting_of_the_treemap/,3,3,,5,OCQUESTION Conditional formatting of the treemap squares color is possible in Excel 2016,2018-07-0380.png
Varying Personality Traits with Brexit Vote [OC],ChemEngandTripHop,2018-07-20 13:37:16,https://i.redd.it/yin5zaqfu3b11.png,https://www.reddit.com/r/dataisbeautiful/comments/90g1mq/varying_personality_traits_with_brexit_vote_oc/,21,21,,19,Varying Personality Traits with Brexit Vote OC,2018-07-0381.png
UK Population by Country of Birth and Nationality (2017) [OC],SoLateToTheGame,2018-07-20 13:47:15,https://i.redd.it/6po7qbapx3b11.jpg,https://www.reddit.com/r/dataisbeautiful/comments/90g4e9/uk_population_by_country_of_birth_and_nationality/,2,2,,5,UK Population by Country of Birth and Nationality (2017) OC,2018-07-0382.jpg
[League of Legends] Team Play Visualizations for NA LCS Spring Split,FinFel,2018-07-20 16:23:13,http://www.thegeeklocker.net/blog/2018/7/16/pf8crixj63gikeb3og2yq1f3zqa4uf,https://www.reddit.com/r/dataisbeautiful/comments/90heik/league_of_legends_team_play_visualizations_for_na/,2,2,,0,League of Legends Team Play Visualizations for NA LCS Spring Split,2018-07-0383.jpg
[OC] How do young fans of Comedy movies discover new movies?,JamesEntSight,2018-07-20 16:44:07,https://i.redd.it/xdrk7pfet4b11.jpg,https://www.reddit.com/r/dataisbeautiful/comments/90hksf/oc_how_do_young_fans_of_comedy_movies_discover/,10,10,,2,OC How do young fans of Comedy movies discover new movies,2018-07-0384.jpg
[OC] I collected 100 frozen geodes in the game Stardew Valley and had them broken open. Here are the results (count data in comments).,jbird221,2018-07-20 19:17:31,https://i.imgur.com/KVMsspH.jpg,https://www.reddit.com/r/dataisbeautiful/comments/90iw47/oc_i_collected_100_frozen_geodes_in_the_game/,57,57,,3,OC I collected 100 frozen geodes in the game Stardew Valley and had them broken open. Here are the results (count data in comments).,2018-07-0385.jpg
Python has brought computer programming to a vast new audience,jsalsman,2018-07-20 19:24:21,https://www.economist.com/science-and-technology/2018/07/21/python-has-brought-computer-programming-to-a-vast-new-audience,https://www.reddit.com/r/dataisbeautiful/comments/90iy84/python_has_brought_computer_programming_to_a_vast/,5,5,,2,Python has brought computer programming to a vast new audience,2018-07-0386.jpg
"175,276 km flown since 2012 [OC]",hn_ns,2018-07-20 19:47:10,https://i.redd.it/0lkr7vkho5b11.jpg,https://www.reddit.com/r/dataisbeautiful/comments/90j4wm/175276_km_flown_since_2012_oc/,10,10,,3,"175,276 km flown since 2012 OC",2018-07-0387.jpg
The Cryptocurrency Filter-Bubble [twitter data research],PubWookie,2018-07-20 20:10:23,https://medium.com/@avivzohar/the-cryptocurrency-filter-bubble-faa0901f0e0a,https://www.reddit.com/r/dataisbeautiful/comments/90jbvy/the_cryptocurrency_filterbubble_twitter_data/,5,5,,0,The Cryptocurrency Filter-Bubble twitter data research,2018-07-0388.jpg
"[OC] Which Climate you prefer? (Left, Cold, Boston) VS (Right, Hot, Dallas)",cooldudetonds,2018-07-20 21:09:34,https://i.redd.it/z4j0uood36b11.png,https://www.reddit.com/r/dataisbeautiful/comments/90jtn0/oc_which_climate_you_prefer_left_cold_boston_vs/,5,5,,5,"OC Which Climate you prefer (Left, Cold, Boston) VS (Right, Hot, Dallas)",2018-07-0389.png
[OC] My tan(delta) plots don't feel so good,khal_loran,2018-07-21 00:36:15,https://imgur.com/fQUaqw7,https://www.reddit.com/r/dataisbeautiful/comments/90lbaf/oc_my_tandelta_plots_dont_feel_so_good/,16,16,,6,OC My tan(delta) plots don't feel so good,2018-07-0390.jpg
Comparing every team’s amount of playoff appearances since 2000 in the four major sports [OC],ChartedInterests,2018-07-21 01:25:44,https://i.redd.it/2uy7afube7b11.png,https://www.reddit.com/r/dataisbeautiful/comments/90lmte/comparing_every_teams_amount_of_playoff/,8,8,,5,Comparing every team’s amount of playoff appearances since 2000 in the four major sports OC,2018-07-0391.png
[OC] Pokémon Red/Blue Word Cloud,Flood1993,2018-07-21 02:27:16,https://i.redd.it/lf7nyewap7b11.png,https://www.reddit.com/r/dataisbeautiful/comments/90m0t3/oc_pokémon_redblue_word_cloud/,13,13,,6,OC Pokémon RedBlue Word Cloud,2018-07-0392.png
Seed & Feeder Preferences in Birds [OC],colemanrharris,2018-07-21 04:05:28,https://i.redd.it/hivfuk7v68b11.png,https://www.reddit.com/r/dataisbeautiful/comments/90mmd7/seed_feeder_preferences_in_birds_oc/,29,29,,7,Seed & Feeder Preferences in Birds OC,2018-07-0393.png
Room Temperature after the Air Conditioner is Shut Down [OC],epsilon4_,2018-07-21 06:11:15,https://i.redd.it/98ardg3bt8b11.png,https://www.reddit.com/r/dataisbeautiful/comments/90na3x/room_temperature_after_the_air_conditioner_is/,61,61,,11,Room Temperature after the Air Conditioner is Shut Down OC,2018-07-0394.png
"Avg. cost of internet expressed as a percent of net income, by country [OC]",kylekun513,2018-07-21 06:22:12,https://i.redd.it/mk1c9vi1v8b11.png,https://www.reddit.com/r/dataisbeautiful/comments/90nbxi/avg_cost_of_internet_expressed_as_a_percent_of/,17417,17417,,1184,"Avg. cost of internet expressed as a percent of net income, by country OC",2018-07-0395.png
[OC] So I asked 105 Redditors how many followers they had and then plotted that against their karma,etymologynerd,2018-07-21 06:29:06,https://i.redd.it/asmcygskw8b11.jpg,https://www.reddit.com/r/dataisbeautiful/comments/90nd3f/oc_so_i_asked_105_redditors_how_many_followers/,24,24,,7,OC So I asked 105 Redditors how many followers they had and then plotted that against their karma,2018-07-0396.jpg
How much money do I make busking on the tube? â Dan Hough,pr33tish,2018-07-21 12:57:21,https://danhough.com/busking/2018-07-17-how-much-do-i-make-july-2018/,https://www.reddit.com/r/dataisbeautiful/comments/90p3ms/how_much_money_do_i_make_busking_on_the_tube_â/,0,0,,1,How much money do I make busking on the tube â Dan Hough,2018-07-0397.jpg
[OC] National debt as percentage of GDP for some random European countries.,theXpanther,2018-07-21 13:09:04,https://i.redd.it/voegw7sxuab11.png,https://www.reddit.com/r/dataisbeautiful/comments/90p64m/oc_national_debt_as_percentage_of_gdp_for_some/,11,11,,3,OC National debt as percentage of GDP for some random European countries.,2018-07-0398.png
What is my biggest source of happiness? - a live personal dashboard [OC],TrackingHappiness,2018-07-21 13:23:07,https://www.trackinghappiness.com/source-of-happiness-live/,https://www.reddit.com/r/dataisbeautiful/comments/90p91p/what_is_my_biggest_source_of_happiness_a_live/,6,6,,5,What is my biggest source of happiness - a live personal dashboard OC,2018-07-0399.jpg
How your social network could save you from a disaster,batman613,2018-07-21 13:27:03,https://theconversation.com/how-your-social-network-could-save-you-from-a-disaster-96450,https://www.reddit.com/r/dataisbeautiful/comments/90p9vz/how_your_social_network_could_save_you_from_a/,2,2,,1,How your social network could save you from a disaster,2018-07-0400.jpg
Ranking News Bias with Python!,Fidel_Willis,2018-07-21 17:26:42,https://towardsdatascience.com/ranking-news-bias-in-python-e9bb5d1ba93f?source=linkShare-11f6119feee0-1532192735,https://www.reddit.com/r/dataisbeautiful/comments/90qxjz/ranking_news_bias_with_python/,1,1,,1,Ranking News Bias with Python!,2018-07-0401.jpg
"The childless, aging future",pr33tish,2018-07-21 17:37:07,https://www.axios.com/newsletters/axios-am-c7902702-0ed3-46b0-97ba-77a77cd1d16c.html?,https://www.reddit.com/r/dataisbeautiful/comments/90r0dd/the_childless_aging_future/,35,35,,5,"The childless, aging future",2018-07-0402.jpg
[OC] Monthly Average Agriculture Producer Prices (APP) for Bananas in Ecuador from 2012-2016,glowiep,2018-07-21 18:47:17,https://i.redd.it/hpfekrnwjcb11.jpg,https://www.reddit.com/r/dataisbeautiful/comments/90rixt/oc_monthly_average_agriculture_producer_prices/,8,8,,3,OC Monthly Average Agriculture Producer Prices (APP) for Bananas in Ecuador from 2012-2016,2018-07-0403.jpg
Animated arrest data for narcotics in Chicago [OC],030Economist,2018-07-21 19:05:28,https://imgur.com/a/m4jByRd,https://www.reddit.com/r/dataisbeautiful/comments/90rnun/animated_arrest_data_for_narcotics_in_chicago_oc/,13,13,,6,Animated arrest data for narcotics in Chicago OC,2018-07-0404.jpg
The frequency of stripe colors in tricolor national flags [OC],conspiracie,2018-07-21 19:52:47,https://i.redd.it/5b87en6xvcb11.png,https://www.reddit.com/r/dataisbeautiful/comments/90s0fi/the_frequency_of_stripe_colors_in_tricolor/,721,721,,40,The frequency of stripe colors in tricolor national flags OC,2018-07-0405.png
Drivers of atmospheric CO2,avogadros_number,2018-07-22 01:10:40,http://folk.uio.no/roberan/t/CO2_drivers.shtml,https://www.reddit.com/r/dataisbeautiful/comments/90u677/drivers_of_atmospheric_co2/,0,0,,8,Drivers of atmospheric CO2,2018-07-0406.jpg
[OC]Draw On My Choropleth Map (fCC Data Visualization Projects),Maarondesigns,2018-07-22 07:32:12,https://v.redd.it/g6wwuc2kcgb11,https://www.reddit.com/r/dataisbeautiful/comments/90w6g9/ocdraw_on_my_choropleth_map_fcc_data/,28,28,,4,OCDraw On My Choropleth Map (fCC Data Visualization Projects),2018-07-0407.png
Two Beatles Song Charts [OC],john_horner,2018-07-22 07:34:54,https://imgur.com/a/0R4p5md,https://www.reddit.com/r/dataisbeautiful/comments/90w6x2/two_beatles_song_charts_oc/,0,0,,6,Two Beatles Song Charts OC,2018-07-0408.jpg
Which birds prefer which seeds? [OC],anguimorpha,2018-07-22 12:33:05,https://i.redd.it/nnj7f9v0uhb11.png,https://www.reddit.com/r/dataisbeautiful/comments/90xfx8/which_birds_prefer_which_seeds_oc/,7162,7162,,257,Which birds prefer which seeds OC,2018-07-0409.png
[OC] Number of comments for the threads in the World Cup knock-out phase,Data_Moments,2018-07-22 17:12:17,https://i.redd.it/ox85v6578jb11.png,https://www.reddit.com/r/dataisbeautiful/comments/90z9i0/oc_number_of_comments_for_the_threads_in_the/,22,22,,3,OC Number of comments for the threads in the World Cup knock-out phase,2018-07-0410.png
Songs Played during Weird Al's 2018 Tour [OC],deancovert,2018-07-22 17:52:38,https://i.redd.it/ubmtxjthdjb11.png,https://www.reddit.com/r/dataisbeautiful/comments/90zkju/songs_played_during_weird_als_2018_tour_oc/,12,12,,3,Songs Played during Weird Al's 2018 Tour OC,2018-07-0411.png
Directors with 3 or more titles in the top 1000 feature films with most votes on IMDb (and where in the top 1000 these titles are) [OC],threuweu,2018-07-22 18:18:05,https://i.redd.it/j1g2i6v1ijb11.png,https://www.reddit.com/r/dataisbeautiful/comments/90zroz/directors_with_3_or_more_titles_in_the_top_1000/,681,681,,114,Directors with 3 or more titles in the top 1000 feature films with most votes on IMDb (and where in the top 1000 these titles are) OC,2018-07-0412.png
Cyclone tracks inside the Philippine islands • u/mapmakerdavid,mapmakerdavid,2018-07-22 19:24:24,https://www.reddit.com/user/mapmakerdavid/comments/90wj44/cyclone_tracks_inside_the_philippine_islands/,https://www.reddit.com/r/dataisbeautiful/comments/9109w5/cyclone_tracks_inside_the_philippine_islands/,11,11,,2,Cyclone tracks inside the Philippine islands • umapmakerdavid,2018-07-0413.jpg
[OC] U.N. World Population Prospects: 2017 Revision,StainChrist,2018-07-22 19:39:05,https://i.redd.it/a7cxdcvfyjb11.jpg,https://www.reddit.com/r/dataisbeautiful/comments/910dxd/oc_un_world_population_prospects_2017_revision/,17,17,,30,OC U.N. World Population Prospects 2017 Revision,2018-07-0414.jpg
Objections on The Good Wife [OC],goncho314,2018-07-22 20:57:18,https://i.redd.it/o4q87gpdckb11.jpg,https://www.reddit.com/r/dataisbeautiful/comments/910zcj/objections_on_the_good_wife_oc/,205,205,,17,Objections on The Good Wife OC,2018-07-0415.jpg
"Marathoners wearing the Nike Vaporfly were ~4% faster than the competition, based on ~495K race results across ~700 races",kushalc,2018-07-22 22:35:32,https://www.nytimes.com/interactive/2018/07/18/upshot/nike-vaporfly-shoe-strava.html,https://www.reddit.com/r/dataisbeautiful/comments/911pih/marathoners_wearing_the_nike_vaporfly_were_4/,2564,2564,,441,"Marathoners wearing the Nike Vaporfly were ~4% faster than the competition, based on ~495K race results across ~700 races",2018-07-0416.jpg
[OC] Phone usage after disengagement,BardzyBear,2018-07-22 23:40:06,https://i.redd.it/t9sgax345lb11.png,https://www.reddit.com/r/dataisbeautiful/comments/91261c/oc_phone_usage_after_disengagement/,6,6,,4,OC Phone usage after disengagement,2018-07-0417.png
A beautiful way to interrogate academic literature [OC],scholx33,2018-07-23 01:59:05,https://citehero.com/search?q=reddit&show=network,https://www.reddit.com/r/dataisbeautiful/comments/9133fx/a_beautiful_way_to_interrogate_academic/,1,1,,3,A beautiful way to interrogate academic literature OC,2018-07-0418.jpg
University of Oregon Average Pay By Academic Department and By Professorship Rank [OC],OregonianPicathartes,2018-07-23 02:52:57,https://i.redd.it/j7ybajjt3mb11.png,https://www.reddit.com/r/dataisbeautiful/comments/913g7h/university_of_oregon_average_pay_by_academic/,15,15,,10,University of Oregon Average Pay By Academic Department and By Professorship Rank OC,2018-07-0419.png
"Couple of months ago, I went on a mountaineering trip in the Nepal Himalayas. Here's the data collected over the trip in a visual format (Interactive link inside comments) [OC]",intrepidk,2018-07-23 04:18:24,https://i.imgur.com/IPFT6uT.png,https://www.reddit.com/r/dataisbeautiful/comments/913zn5/couple_of_months_ago_i_went_on_a_mountaineering/,786,786,,49,"Couple of months ago, I went on a mountaineering trip in the Nepal Himalayas. Here's the data collected over the trip in a visual format (Interactive",2018-07-0420.png
Wine consumed per capita in liters [OC],Risky_Bets,2018-07-23 04:30:15,https://www.displayr.com/who-is-the-booziest-wine-drinking-country-in-the-world/,https://www.reddit.com/r/dataisbeautiful/comments/91426k/wine_consumed_per_capita_in_liters_oc/,5,5,,9,Wine consumed per capita in liters OC,2018-07-0421.jpg
[OC] Analysing comments for fcc docket 18-197,gabrielchow,2018-07-23 04:42:18,https://i.redd.it/wa3lgen7nmb11.jpg,https://www.reddit.com/r/dataisbeautiful/comments/9144r0/oc_analysing_comments_for_fcc_docket_18197/,0,0,,4,OC Analysing comments for fcc docket 18-197,2018-07-0422.jpg
[OC]Fertility Rate vs Life Expectancy at Birth in 2013,minato3421,2018-07-23 07:10:52,https://i.redd.it/fypjcz0ndnb11.jpg,https://www.reddit.com/r/dataisbeautiful/comments/914xxk/ocfertility_rate_vs_life_expectancy_at_birth_in/,19,19,,3,OCFertility Rate vs Life Expectancy at Birth in 2013,2018-07-0423.jpg
A who's who guide to the Marvel Cinematic Universe,pr33tish,2018-07-23 07:49:35,https://graphics.straitstimes.com/STI/STIMEDIA/Interactives/2018/04/marvel-cinematic-universe-whos-who-interactive/index.html,https://www.reddit.com/r/dataisbeautiful/comments/9154sl/a_whos_who_guide_to_the_marvel_cinematic_universe/,10,10,,2,A who's who guide to the Marvel Cinematic Universe,2018-07-0424.jpg
[OC] Regional population structures at a glance,ikashnitsky,2018-07-23 09:06:20,https://i.redd.it/cz0ikcxewnb11.png,https://www.reddit.com/r/dataisbeautiful/comments/915hxe/oc_regional_population_structures_at_a_glance/,11831,11831,,385,OC Regional population structures at a glance,2018-07-0425.png
Monte Carlo simulation of Amazon stock price over the next year.[OC],matt2001,2018-07-23 09:51:33,https://imgur.com/a/upcRAhl,https://www.reddit.com/r/dataisbeautiful/comments/915px2/monte_carlo_simulation_of_amazon_stock_price_over/,6,6,,6,Monte Carlo simulation of Amazon stock price over the next year.OC,2018-07-0426.jpg
Elected Leaders Are Making the World Less Democratic,envatted_love,2018-07-23 09:58:43,https://www.bloomberg.com/graphics/2018-democracy-decline/,https://www.reddit.com/r/dataisbeautiful/comments/915r7j/elected_leaders_are_making_the_world_less/,15,15,,3,Elected Leaders Are Making the World Less Democratic,2018-07-0427.jpg
Comparison of the Knuth-Morris-Pratt algorithm and a naive algorithm for finding a substring in a string [OC],XCapitan_1,2018-07-23 10:24:44,https://i.redd.it/8sorivlabob11.png,https://www.reddit.com/r/dataisbeautiful/comments/915w4q/comparison_of_the_knuthmorrispratt_algorithm_and/,15,15,,3,Comparison of the Knuth-Morris-Pratt algorithm and a naive algorithm for finding a substring in a string OC,2018-07-0428.png
Number of births on each day in the USA (1994-2014) [OC],been_burytoe,2018-07-23 11:20:54,https://i.redd.it/hb0qcb7ulob11.jpg,https://www.reddit.com/r/dataisbeautiful/comments/9167eh/number_of_births_on_each_day_in_the_usa_19942014/,60,60,,22,Number of births on each day in the USA (1994-2014) OC,2018-07-0429.jpg
[OC] Animated world map shows median age by country from 1950 to 2100 (UN Population Division data),simongerman600,2018-07-23 12:24:26,https://v.redd.it/laqtwwfazgb11,https://www.reddit.com/r/dataisbeautiful/comments/916lkc/oc_animated_world_map_shows_median_age_by_country/,59,59,,7,OC Animated world map shows median age by country from 1950 to 2100 (UN Population Division data),2018-07-0430.png
Bringing up baby - Parental leave across the OECD [OC],dav1b,2018-07-23 13:52:53,https://i.redd.it/qcbryjzadpb11.png,https://www.reddit.com/r/dataisbeautiful/comments/9178mf/bringing_up_baby_parental_leave_across_the_oecd_oc/,68,68,,23,Bringing up baby - Parental leave across the OECD OC,2018-07-0431.png
[OC] Rainfall over Singapore each month,lohord_sfw,2018-07-23 14:01:40,https://i.imgur.com/hMyulGv.jpg,https://www.reddit.com/r/dataisbeautiful/comments/917azb/oc_rainfall_over_singapore_each_month/,5,5,,3,OC Rainfall over Singapore each month,2018-07-0432.jpg
Principle Coordinate Analyses of Frequency Spectrograms from UK Bird Species by Body Weight and Order [OC],Ipecacuanha,2018-07-23 14:56:02,https://imgur.com/a/FuNuc1P,https://www.reddit.com/r/dataisbeautiful/comments/917qmg/principle_coordinate_analyses_of_frequency/,10,10,,3,Principle Coordinate Analyses of Frequency Spectrograms from UK Bird Species by Body Weight and Order OC,2018-07-0433.jpg
Afghanistan's versus Algeria's Camel Production [OC],finkbeca,2018-07-23 15:12:04,https://i.redd.it/tm7ogzhjrpb11.png,https://www.reddit.com/r/dataisbeautiful/comments/917vky/afghanistans_versus_algerias_camel_production_oc/,4,4,,3,Afghanistan's versus Algeria's Camel Production OC,2018-07-0434.png
"[OC] 7 years. 33 airports. 79 routes. 266,102 miles.",israblof,2018-07-23 16:24:49,https://i.redd.it/ykal0gqv3qb11.jpg,https://www.reddit.com/r/dataisbeautiful/comments/918huw/oc_7_years_33_airports_79_routes_266102_miles/,19,19,,5,"OC 7 years. 33 airports. 79 routes. 266,102 miles.",2018-07-0435.jpg
"Crayola Color Chart, 1903-2010",moultano,2018-07-23 17:02:18,http://www.datapointed.net/2010/01/crayola-crayon-color-chart/,https://www.reddit.com/r/dataisbeautiful/comments/918toh/crayola_color_chart_19032010/,30,30,,1,"Crayola Color Chart, 1903-2010",2018-07-0436.jpg
[OC] The most expensive city to rent a two-bedroom apartment,ketodnepr,2018-07-23 17:32:53,https://i.redd.it/yt5jlvauzia11.png,https://www.reddit.com/r/dataisbeautiful/comments/9193ms/oc_the_most_expensive_city_to_rent_a_twobedroom/,1446,1446,,259,OC The most expensive city to rent a two-bedroom apartment,2018-07-0437.png
Game of Thrones characters plotted by morality and beauty,myfriendscode,2018-07-23 19:05:19,https://www.nytimes.com/interactive/2017/08/09/upshot/game-of-thrones-chart.html?mtrref=tinyletter.com,https://www.reddit.com/r/dataisbeautiful/comments/919xbh/game_of_thrones_characters_plotted_by_morality/,118,118,,37,Game of Thrones characters plotted by morality and beauty,2018-07-0438.jpg
[OC] Battery capacity of my laptop over last 1.5 years,minoshabaal,2018-07-23 19:46:19,https://i.redd.it/2utwsmth4rb11.png,https://www.reddit.com/r/dataisbeautiful/comments/91aabe/oc_battery_capacity_of_my_laptop_over_last_15/,536,536,,41,OC Battery capacity of my laptop over last 1.5 years,2018-07-0439.png
[OC] The World's Airports & Airstrips: Global Locations & Elevation Above Sea Level,Aeromidd,2018-07-23 22:42:06,https://i.redd.it/j0fgyjyszrb11.png,https://www.reddit.com/r/dataisbeautiful/comments/91bs8u/oc_the_worlds_airports_airstrips_global_locations/,384,384,,19,OC The World's Airports & Airstrips Global Locations & Elevation Above Sea Level,2018-07-0440.png
"[OC] The evolution of Major League Baseball, tracked through 9 key statistics/metrics from 1871 to 2015. Selected players identified where notable.",doublestufcoreo,2018-07-23 22:47:27,https://i.redd.it/eaarkelkzrb11.png,https://www.reddit.com/r/dataisbeautiful/comments/91btqs/oc_the_evolution_of_major_league_baseball_tracked/,1087,1087,,115,"OC The evolution of Major League Baseball, tracked through 9 key statisticsmetrics from 1871 to 2015. Selected players identified where notable.",2018-07-0441.png
All Known Asteroids in the Solar System (1999-2018),httpLifer,2018-07-24 12:57:51,https://youtu.be/vfvo-Ujb_qk,https://www.reddit.com/r/dataisbeautiful/comments/91h5jm/all_known_asteroids_in_the_solar_system_19992018/,9,9,,2,All Known Asteroids in the Solar System (1999-2018),2018-07-0442.jpg
[OC] OECD Paid Leave,RobertJanezic,2018-07-24 13:39:39,https://i.redd.it/ez3s2cd1gwb11.png,https://www.reddit.com/r/dataisbeautiful/comments/91hgu6/oc_oecd_paid_leave/,13,13,,29,OC OECD Paid Leave,2018-07-0443.png
Haitian Public Forcing New Approach to Fuel Price Reform - knoema.com,IKomlev,2018-07-24 13:59:02,https://knoema.com/infographics/wdtpvnc/haiti-will-gradually-increase-fuel-prices-in-spite-of-protests,https://www.reddit.com/r/dataisbeautiful/comments/91hm85/haitian_public_forcing_new_approach_to_fuel_price/,3,3,,1,Haitian Public Forcing New Approach to Fuel Price Reform - knoema.com,2018-07-0444.jpg
[OC] NBA Income vs. Household Income,RobertJanezic,2018-07-24 13:59:17,https://i.redd.it/hen9m3rfjwb11.png,https://www.reddit.com/r/dataisbeautiful/comments/91hmaq/oc_nba_income_vs_household_income/,4,4,,2,OC NBA Income vs. Household Income,2018-07-0445.png
"Chess ELO rating -vs- age (using ""virtual X-ray glasses"" on dense scatter plots) [OC]",graphguy,2018-07-24 14:23:52,https://blogs.sas.com/content/sastraining/2018/07/24/using-x-ray-glasses-to-see-patterns-in-your-data/,https://www.reddit.com/r/dataisbeautiful/comments/91htt7/chess_elo_rating_vs_age_using_virtual_xray/,12,12,,5,Chess ELO rating -vs- age (using virtual X-ray glasses on dense scatter plots) OC,2018-07-0446.jpg
[OC] Average Sea Surface Temperature in the Atlantic from 1901 to 2015,glowiep,2018-07-24 14:35:12,https://i.redd.it/zir9795rmwb11.jpg,https://www.reddit.com/r/dataisbeautiful/comments/91hx5b/oc_average_sea_surface_temperature_in_the/,13,13,,4,OC Average Sea Surface Temperature in the Atlantic from 1901 to 2015,2018-07-0447.jpg
[OC] Probability of Selecting Random Scrabble Tiles and Having them Spell an English Word in the Order that You Chose Them (Including Blanks),HardlyChicken,2018-07-24 16:06:41,https://i.redd.it/03la9i474xb11.png,https://www.reddit.com/r/dataisbeautiful/comments/91ipma/oc_probability_of_selecting_random_scrabble_tiles/,36,36,,7,OC Probability of Selecting Random Scrabble Tiles and Having them Spell an English Word in the Order that You Chose Them (Including Blanks),2018-07-0448.png
Density map of stars on national flags [OC],conspiracie,2018-07-24 16:14:16,https://i.redd.it/qviunrko7xb11.png,https://www.reddit.com/r/dataisbeautiful/comments/91is49/density_map_of_stars_on_national_flags_oc/,48150,48150,,646,Density map of stars on national flags OC,2018-07-0449.png
Average monthly salary in 176 countries [OC],rohan_joseph93,2018-07-24 17:41:41,https://i.redd.it/65pgnt63nxb11.png,https://www.reddit.com/r/dataisbeautiful/comments/91jkeg/average_monthly_salary_in_176_countries_oc/,1,1,,18,Average monthly salary in 176 countries OC,2018-07-0450.png
