title,author,created_date,url,full_permalink,score,ups,downs,num_comments,sanitized_title,image_file
Addiction in American from a Google Trends Perspective,colorsounds,2018-07-09 18:44:41,https://experienceibogaine.com/addiction-usa-state-map/,https://www.reddit.com/r/dataisbeautiful/comments/8xeq27/addiction_in_american_from_a_google_trends/,0,0,,9,Addiction in American from a Google Trends Perspective,2018-07-0146.jpg
The Death of Soda,Cdubeu,2018-07-09 19:33:35,http://www.visualcapitalist.com/death-of-soda/,https://www.reddit.com/r/dataisbeautiful/comments/8xf91t/the_death_of_soda/,23,23,,7,The Death of Soda,2018-07-0147.jpg
C.Ronaldo and Messi's Ballon d'Or (FIFA player of the year) finishes since 2007 [OC],Continuity_organizer,2018-07-09 21:15:54,https://i.imgur.com/jM2pYM0.png,https://www.reddit.com/r/dataisbeautiful/comments/8xgc7w/cronaldo_and_messis_ballon_dor_fifa_player_of_the/,26,26,,2,C.Ronaldo and Messi's Ballon d'Or (FIFA player of the year) finishes since 2007 OC,2018-07-0148.png
Formula 1 Grand Prix Winners by Season 2008-2018 [OC],Pyrollamas,2018-07-09 22:07:49,https://i.redd.it/3vt4kubqlz811.png,https://www.reddit.com/r/dataisbeautiful/comments/8xguvi/formula_1_grand_prix_winners_by_season_20082018_oc/,145,145,,25,Formula 1 Grand Prix Winners by Season 2008-2018 OC,2018-07-0149.png
What industry has the highest revenue per employee?,emaercklein,2018-07-09 22:33:08,https://craft.co/reports/where-do-the-most-productive-employees-work,https://www.reddit.com/r/dataisbeautiful/comments/8xh3tp/what_industry_has_the_highest_revenue_per_employee/,11,11,,1,What industry has the highest revenue per employee,2018-07-0150.jpg
The Dutch East India Company was worth $7.9 Trillion at its peak - more than 20 of the largest companies today.,VenomLore,2018-07-10 00:47:20,http://www.visualcapitalist.com/most-valuable-companies-all-time/,https://www.reddit.com/r/dataisbeautiful/comments/8xiodq/the_dutch_east_india_company_was_worth_79/,733,733,,55,The Dutch East India Company was worth $7.9 Trillion at its peak - more than 20 of the largest companies today.,2018-07-0151.jpg
Number of login attempts to a new server by IP address [OC],charmingpea,2018-07-10 03:43:41,https://i.redd.it/gf3gpgrj71911.jpg,https://www.reddit.com/r/dataisbeautiful/comments/8xkvqm/number_of_login_attempts_to_a_new_server_by_ip/,12,12,,7,Number of login attempts to a new server by IP address OC,2018-07-0152.jpg
Google trend search data of r/thanosdidnothingwrong over the past 7 days. [OC],downvoteforwhy,2018-07-10 03:48:35,https://i.redd.it/7iz4blp7c1911.jpg,https://www.reddit.com/r/dataisbeautiful/comments/8xl07d/google_trend_search_data_of/,1,1,,3,Google trend search data of rthanosdidnothingwrong over the past 7 days. OC,2018-07-0153.jpg
Change in the number of Internet users in top four countries from 2014-16 [OC],SlytherinSlayer,2018-07-10 04:52:13,https://i.redd.it/c26lj944w1911.png,https://www.reddit.com/r/dataisbeautiful/comments/8xloen/change_in_the_number_of_internet_users_in_top/,34,34,,4,Change in the number of Internet users in top four countries from 2014-16 OC,2018-07-0154.png
007 Box Office Totals: What movie and actor are the highest grossing? [OC],IamBatDude,2018-07-10 06:29:44,https://i.redd.it/hqlm9z30e2911.png,https://www.reddit.com/r/dataisbeautiful/comments/8xmaia/007_box_office_totals_what_movie_and_actor_are/,9,9,,3,007 Box Office Totals What movie and actor are the highest grossing OC,2018-07-0155.png
Historic Soccer World Cup Average Scored Goals per Match [OC],ferralbus,2018-07-10 07:29:41,https://i.redd.it/iv4h85mcp2911.jpg,https://www.reddit.com/r/dataisbeautiful/comments/8xmn5k/historic_soccer_world_cup_average_scored_goals/,27,27,,7,Historic Soccer World Cup Average Scored Goals per Match OC,2018-07-0156.jpg
Industries in Europe with the largest increase in the number of people employed (2008–2017) [OC],NaytaData,2018-07-10 08:17:57,https://i.redd.it/m16tarf6x2911.png,https://www.reddit.com/r/dataisbeautiful/comments/8xmx8w/industries_in_europe_with_the_largest_increase_in/,34,34,,2,Industries in Europe with the largest increase in the number of people employed (2008–2017) OC,2018-07-0157.png
My transition from lurker to submitter on Reddit [OC],Riversharp4,2018-07-10 08:50:21,https://i.redd.it/uimb76zn33911.png,https://www.reddit.com/r/dataisbeautiful/comments/8xn45y/my_transition_from_lurker_to_submitter_on_reddit/,248,248,,19,My transition from lurker to submitter on Reddit OC,2018-07-0158.png
[Critique] How can I visualize both values and corresponding weight of values in bigger data set? [OC],TripleDub1024,2018-07-10 10:01:45,https://imgur.com/aag44Fv,https://www.reddit.com/r/dataisbeautiful/comments/8xnkw4/critique_how_can_i_visualize_both_values_and/,1,1,,7,Critique How can I visualize both values and corresponding weight of values in bigger data set OC,2018-07-0159.jpg
Incoming phone calls to Swedish customer service during Swedish World cup games [OC],Sacsdata,2018-07-10 10:09:21,https://i.redd.it/bkuczjnrh3911.png,https://www.reddit.com/r/dataisbeautiful/comments/8xnmoy/incoming_phone_calls_to_swedish_customer_service/,7,7,,2,Incoming phone calls to Swedish customer service during Swedish World cup games OC,2018-07-0160.png
"In Hong Kong, flats really are cheaper when they contain the number 4",bdzz,2018-07-10 11:16:03,https://blog.dataguru.hk/2018/07/10/hong-kong-higher-floors-are-more-expensive-and-4-is-avoided/,https://www.reddit.com/r/dataisbeautiful/comments/8xo2h7/in_hong_kong_flats_really_are_cheaper_when_they/,67,67,,18,"In Hong Kong, flats really are cheaper when they contain the number 4",2018-07-0161.jpg
"Vessel, an album by Twenty One Pilots visualized [OC]",Mentaxman,2018-07-10 12:52:45,https://i.redd.it/2a93oyoya4911.jpg,https://www.reddit.com/r/dataisbeautiful/comments/8xossb/vessel_an_album_by_twenty_one_pilots_visualized_oc/,3315,3315,,159,"Vessel, an album by Twenty One Pilots visualized OC",2018-07-0162.jpg
Visualisation of RAF aircraft marshalling ahead of a flypast in London to mark the Force's 100th anniversary,twitch135,2018-07-10 13:45:04,https://twitter.com/RoyalAirForce/status/1016646875729006592,https://www.reddit.com/r/dataisbeautiful/comments/8xp8p5/visualisation_of_raf_aircraft_marshalling_ahead/,35,35,,1,Visualisation of RAF aircraft marshalling ahead of a flypast in London to mark the Force's 100th anniversary,2018-07-0163.jpg
"Submissions per Minute to /r/thanosdidnothingwrong and /r/inthesoulstone Before, During, and After the *Snap* [OC]",minimaxir,2018-07-10 14:14:56,https://i.redd.it/i1kh4ijuo4911.png,https://www.reddit.com/r/dataisbeautiful/comments/8xpioa/submissions_per_minute_to_rthanosdidnothingwrong/,1318,1318,,68,"Submissions per Minute to rthanosdidnothingwrong and rinthesoulstone Before, During, and After the Snap OC",2018-07-0164.png
The 30 Most Published DC Comics Characters as August 2018.,CoRo83486,2018-07-10 14:37:49,https://comicvine.gamespot.com/dc-comics/4010-10/characters/,https://www.reddit.com/r/dataisbeautiful/comments/8xpq67/the_30_most_published_dc_comics_characters_as/,8,8,,2,The 30 Most Published DC Comics Characters as August 2018.,2018-07-0165.jpg
Pride and Prejudice's most repeated 30 words compared to Ziphf curve [OC],Enguzelharf,2018-07-10 15:53:40,https://i.redd.it/jciiny6x65911.png,https://www.reddit.com/r/dataisbeautiful/comments/8xqgi5/pride_and_prejudices_most_repeated_30_words/,3,3,,12,Pride and Prejudice's most repeated 30 words compared to Ziphf curve OC,2018-07-0166.png
Daytime Population Density in the San Francisco Bay Area,didnteventri,2018-07-10 17:15:48,https://www.tandfonline.com/doi/full/10.1080/21681376.2018.1455535,https://www.reddit.com/r/dataisbeautiful/comments/8xraf9/daytime_population_density_in_the_san_francisco/,1,1,,1,Daytime Population Density in the San Francisco Bay Area,2018-07-0167.jpg
EU Parliament Vote Participation [OC],SomeRedPanda,2018-07-10 17:59:08,https://i.imgur.com/s4bcbdO.png,https://www.reddit.com/r/dataisbeautiful/comments/8xroq0/eu_parliament_vote_participation_oc/,7,7,,5,EU Parliament Vote Participation OC,2018-07-0168.png
Subscriber count on r/ThanosDidNothingWrong during the day of the cull [OC],MachWerx,2018-07-10 18:29:48,https://i.redd.it/svbvgknxw5911.png,https://www.reddit.com/r/dataisbeautiful/comments/8xryhs/subscriber_count_on_rthanosdidnothingwrong_during/,75,75,,9,Subscriber count on rThanosDidNothingWrong during the day of the cull OC,2018-07-0169.png
Pro League of Legends Visualizations,FinFel,2018-07-10 18:45:00,http://www.thegeeklocker.net/blog/2018/7/10/na-lcs-spring-2018-data-analysis-wip,https://www.reddit.com/r/dataisbeautiful/comments/8xs324/pro_league_of_legends_visualizations/,3,3,,0,Pro League of Legends Visualizations,2018-07-0170.jpg
[OC] The Snappening subscriber change since The Snap,aboothe726,2018-07-10 20:12:40,https://i.redd.it/wq42ytxah6911.png,https://www.reddit.com/r/dataisbeautiful/comments/8xsu73/oc_the_snappening_subscriber_change_since_the_snap/,49,49,,15,OC The Snappening subscriber change since The Snap,2018-07-0171.png
Wordcloud of /r/AskReddit questions [OC],mac_cumhaill,2018-07-10 21:34:54,https://i.redd.it/kvpyfxk1w6911.png,https://www.reddit.com/r/dataisbeautiful/comments/8xtjeb/wordcloud_of_raskreddit_questions_oc/,3,3,,3,Wordcloud of rAskReddit questions OC,2018-07-0172.png
[oc] Soccer vs porn internet traffic during today’s France-Belgium World Cup match,hamburgler81,2018-07-10 21:36:02,https://i.redd.it/grh21i0dw6911.jpg,https://www.reddit.com/r/dataisbeautiful/comments/8xtjq9/oc_soccer_vs_porn_internet_traffic_during_todays/,91,91,,8,oc Soccer vs porn internet traffic during today’s France-Belgium World Cup match,2018-07-0173.jpg
Why my microwave makes me lose Wi-Fi connection. Part 1? [OC],ATastyPeanut,2018-07-10 23:02:14,https://i.redd.it/xw3545ukb7911.png,https://www.reddit.com/r/dataisbeautiful/comments/8xu89b/why_my_microwave_makes_me_lose_wifi_connection/,33881,33881,,1348,Why my microwave makes me lose Wi-Fi connection. Part 1 OC,2018-07-0174.png
Every single goal scored by Cristiano Ronaldo,santosflores,2018-07-11 00:48:22,http://www.marca.com/multimedia/primeras/18/07/0711.html?intcmp=BOTONPORTADA&s_kw=portada-del-dia,https://www.reddit.com/r/dataisbeautiful/comments/8xv0lv/every_single_goal_scored_by_cristiano_ronaldo/,4,4,,1,Every single goal scored by Cristiano Ronaldo,2018-07-0175.jpg
Where shootings happen in NYC [OC],remotecar,2018-07-11 01:28:22,https://i.imgur.com/mnc6TCs.png,https://www.reddit.com/r/dataisbeautiful/comments/8xvb9t/where_shootings_happen_in_nyc_oc/,34,34,,16,Where shootings happen in NYC OC,2018-07-0176.png
Car crashes by injury from 2010-2016 [OC],ZinoByte,2018-07-11 01:42:16,https://i.redd.it/wdpg5pgm38911.png,https://www.reddit.com/r/dataisbeautiful/comments/8xvet2/car_crashes_by_injury_from_20102016_oc/,0,0,,13,Car crashes by injury from 2010-2016 OC,2018-07-0177.png
Miles Driven As An US Police Officer [OC],CopThrowAway6969,2018-07-11 04:34:59,https://imgur.com/a/WNlrsKY,https://www.reddit.com/r/dataisbeautiful/comments/8xwkuy/miles_driven_as_an_us_police_officer_oc/,5,5,,8,Miles Driven As An US Police Officer OC,2018-07-0178.jpg
See the IOTA Tangle in action,qazxswedxcderty,2018-07-11 07:43:41,http://tangle.glumb.de/,https://www.reddit.com/r/dataisbeautiful/comments/8xxnjh/see_the_iota_tangle_in_action/,3,3,,1,See the IOTA Tangle in action,2018-07-0179.jpg
Power BI Documenter July 2018 Release,soheileee,2018-07-11 08:42:38,http://blog.datavizioner.com/power-bi-documenter/power-bi-documenter-july-2018-release/,https://www.reddit.com/r/dataisbeautiful/comments/8xxwax/power_bi_documenter_july_2018_release/,1,1,,0,Power BI Documenter July 2018 Release,2018-07-0180.jpg
Summer precipitation change in Europe: 1988–2017 vs. 1948–1977 [OC],NaytaData,2018-07-11 11:17:38,https://i.redd.it/ya308rrkya911.png,https://www.reddit.com/r/dataisbeautiful/comments/8xyp9r/summer_precipitation_change_in_europe_19882017_vs/,46,46,,16,Summer precipitation change in Europe 1988–2017 vs. 1948–1977 OC,2018-07-0181.png
I took 76 courses at Ohio State [OC],CharcoalCharts,2018-07-11 11:19:34,https://i.redd.it/vmaa64qvya911.png,https://www.reddit.com/r/dataisbeautiful/comments/8xypn4/i_took_76_courses_at_ohio_state_oc/,10249,10249,,578,I took 76 courses at Ohio State OC,2018-07-0182.png
Conception rates UK showing impact of contraception late 60's,nick9000,2018-07-11 12:13:14,https://twitter.com/ONS/status/1017015722260779008,https://www.reddit.com/r/dataisbeautiful/comments/8xz1ig/conception_rates_uk_showing_impact_of/,8,8,,0,Conception rates UK showing impact of contraception late 60's,2018-07-0183.jpg
Animation of aircraft flight paths in the RAF100 London flypast,nanoamp,2018-07-11 12:22:52,https://www.independent.co.uk/news/uk/home-news/raf-100-flypast-route-london-map-where-flight-path-watch-a8440076.html,https://www.reddit.com/r/dataisbeautiful/comments/8xz3u2/animation_of_aircraft_flight_paths_in_the_raf100/,2,2,,0,Animation of aircraft flight paths in the RAF100 London flypast,2018-07-0184.jpg
Microwave Ovens vs Wifi - A Throughput Visualization [OC],DarknSilentNight,2018-07-11 12:51:20,https://i.redd.it/hkx59c5ffb911.jpg,https://www.reddit.com/r/dataisbeautiful/comments/8xzapr/microwave_ovens_vs_wifi_a_throughput/,2654,2654,,183,Microwave Ovens vs Wifi - A Throughput Visualization OC,2018-07-0185.jpg
Aviation Accidents/Fatalities by Year [OC],elephanturd,2018-07-11 14:18:15,https://imgur.com/a/de2lNcj,https://www.reddit.com/r/dataisbeautiful/comments/8xzymd/aviation_accidentsfatalities_by_year_oc/,9,9,,2,Aviation AccidentsFatalities by Year OC,2018-07-0186.jpg
"[OC] Homes built in Detroit during the 20th century, organized by year and exterior material material type",Pop-X-,2018-07-11 14:35:56,https://i.redd.it/bx50ld97yb911.png,https://www.reddit.com/r/dataisbeautiful/comments/8y03pn/oc_homes_built_in_detroit_during_the_20th_century/,131,131,,21,"OC Homes built in Detroit during the 20th century, organized by year and exterior material material type",2018-07-0187.png
Is Educational Attainment Related to the Teen Birth Rate? [OC],OverflowDs,2018-07-11 15:20:41,http://overflow.solutions/demographic-data/is-educational-attainment-related-to-the-rate-of-teen-birth-rate/,https://www.reddit.com/r/dataisbeautiful/comments/8y0h2k/is_educational_attainment_related_to_the_teen/,10,10,,5,Is Educational Attainment Related to the Teen Birth Rate OC,2018-07-0188.jpg
Distribution of OC Flairs on /r/dataisbeautiful,zonination,2018-07-11 15:51:55,https://imgur.com/a/aPhn6Sc,https://www.reddit.com/r/dataisbeautiful/comments/8y0qm8/distribution_of_oc_flairs_on_rdataisbeautiful/,7,7,,3,Distribution of OC Flairs on rdataisbeautiful,2018-07-0189.jpg
Which Freelance Nation of Doers Has World Cup Fever? [OC],fiverrhq,2018-07-11 17:14:41,https://i.redd.it/y88dhvldoc911.jpg,https://www.reddit.com/r/dataisbeautiful/comments/8y1h2l/which_freelance_nation_of_doers_has_world_cup/,1,1,,4,Which Freelance Nation of Doers Has World Cup Fever OC,2018-07-0190.jpg
FAMGA Latest Quarter Earnings Call Transcripts [OC],Byt3r,2018-07-11 18:55:04,https://i.redd.it/753kzx8h8d911.png,https://www.reddit.com/r/dataisbeautiful/comments/8y2bzr/famga_latest_quarter_earnings_call_transcripts_oc/,24,24,,5,FAMGA Latest Quarter Earnings Call Transcripts OC,2018-07-0191.png
[OC] Country's National Days by month,Fez_Mast-er,2018-07-11 20:29:40,https://i.redd.it/obzf7zhtmd911.png,https://www.reddit.com/r/dataisbeautiful/comments/8y33zj/oc_countrys_national_days_by_month/,12,12,,2,OC Country's National Days by month,2018-07-0192.png
Elo rating progression since the start of the 2018 WC for participating teams [OC],s2367890,2018-07-11 21:16:04,https://i.redd.it/kay7dnq5xd911.png,https://www.reddit.com/r/dataisbeautiful/comments/8y3j38/elo_rating_progression_since_the_start_of_the/,14,14,,4,Elo rating progression since the start of the 2018 WC for participating teams OC,2018-07-0193.png
[OC] Shots attempted vs % succeeded in World Cup 2018 to-date. No one will catch Brazil.,scottishbee,2018-07-11 21:40:20,https://i.redd.it/bxevs6ov1e911.png,https://www.reddit.com/r/dataisbeautiful/comments/8y3q7g/oc_shots_attempted_vs_succeeded_in_world_cup_2018/,16,16,,12,OC Shots attempted vs % succeeded in World Cup 2018 to-date. No one will catch Brazil.,2018-07-0194.png
General trend of subscribers for r/thanosdidnothingwrong before and after the snap [OC],derpyofthegods,2018-07-11 22:25:26,https://i.redd.it/if4v8q9w9e911.png,https://www.reddit.com/r/dataisbeautiful/comments/8y43fx/general_trend_of_subscribers_for/,4,4,,3,General trend of subscribers for rthanosdidnothingwrong before and after the snap OC,2018-07-0195.png
2018 Formula 1 Complete Driver Results [OC],Pyrollamas,2018-07-11 23:58:25,https://i.redd.it/evhfwhaiqe911.png,https://www.reddit.com/r/dataisbeautiful/comments/8y4sow/2018_formula_1_complete_driver_results_oc/,21,21,,3,2018 Formula 1 Complete Driver Results OC,2018-07-0196.png
Decided to see just how much different the temperatures are between home (San Jose) and work (San Francisco) [OC],XerxesDGreat,2018-07-12 01:18:31,https://i.redd.it/p444bgli4f911.png,https://www.reddit.com/r/dataisbeautiful/comments/8y5dkn/decided_to_see_just_how_much_different_the/,8,8,,8,Decided to see just how much different the temperatures are between home (San Jose) and work (San Francisco) OC,2018-07-0197.png
Difference in time between speedruns in The Impossible Quiz [OC],TheCygnusLoop,2018-07-12 01:43:31,https://i.redd.it/44e4legv7f911.png,https://www.reddit.com/r/dataisbeautiful/comments/8y5jyh/difference_in_time_between_speedruns_in_the/,11,11,,3,Difference in time between speedruns in The Impossible Quiz OC,2018-07-0198.png
I wanted to know if my home town was getting hotter or if it just felt like it so I made this. It took forever. [OC],MannyDantyla,2018-07-12 04:11:40,https://i.redd.it/n784x12vzf911.jpg,https://www.reddit.com/r/dataisbeautiful/comments/8y6joz/i_wanted_to_know_if_my_home_town_was_getting/,18072,18072,,1072,I wanted to know if my home town was getting hotter or if it just felt like it so I made this. It took forever. OC,2018-07-0199.jpg
Global humidity heatmap [OC],quorumetrix,2018-07-12 04:43:26,https://i.redd.it/qxo9f7c75g911.png,https://www.reddit.com/r/dataisbeautiful/comments/8y6qmo/global_humidity_heatmap_oc/,152,152,,11,Global humidity heatmap OC,2018-07-0200.png
Instagram eCommerce - how brands are adapting to Instagram,pr33tish,2018-07-12 06:19:20,http://blog.pipecandy.com/instagram-ecommerce-report/,https://www.reddit.com/r/dataisbeautiful/comments/8y79x7/instagram_ecommerce_how_brands_are_adapting_to/,1,1,,0,Instagram eCommerce - how brands are adapting to Instagram,2018-07-0201.jpg
Comparison of street network orientation,eliseomartelli,2018-07-12 08:21:11,https://twitter.com/gboeing/status/1017066749479358466?s=19,https://www.reddit.com/r/dataisbeautiful/comments/8y7wfl/comparison_of_street_network_orientation/,34,34,,2,Comparison of street network orientation,2018-07-0202.jpg
"[New York Times] How Trump’s Trade War Went From 18 Products to 10,000",Gryff22,2018-07-12 09:12:00,https://www.nytimes.com/interactive/2018/07/11/business/trade-war.html,https://www.reddit.com/r/dataisbeautiful/comments/8y84tb/new_york_times_how_trumps_trade_war_went_from_18/,43,43,,4,"New York Times How Trump’s Trade War Went From 18 Products to 10,000",2018-07-0203.jpg
[OC] Visualization of Word-Number Chains,ghost20000,2018-07-12 11:43:23,https://i.redd.it/mlz0glnf8i911.png,https://www.reddit.com/r/dataisbeautiful/comments/8y918f/oc_visualization_of_wordnumber_chains/,9,9,,2,OC Visualization of Word-Number Chains,2018-07-0204.png
U.S. Time Zones by Month [OC],ptgorman,2018-07-12 12:51:35,https://i.redd.it/o7ajsh2lki911.png,https://www.reddit.com/r/dataisbeautiful/comments/8y9hq4/us_time_zones_by_month_oc/,14,14,,2,U.S. Time Zones by Month OC,2018-07-0205.png
[OC] Disproportionate NATO defense spending? The 2 percent obsession,ketodnepr,2018-07-12 15:20:49,https://i.redd.it/fglg4862md911.png,https://www.reddit.com/r/dataisbeautiful/comments/8yaohi/oc_disproportionate_nato_defense_spending_the_2/,60,60,,41,OC Disproportionate NATO defense spending The 2 percent obsession,2018-07-0206.png
"The Stolen Years of 10,000 USA Gun Crime Victims (2010) [x-post /r/DataArt]",jmerlinb,2018-07-12 15:37:52,https://www.youtube.com/watch?v=8R8UOjMy-5k&feature=youtu.be,https://www.reddit.com/r/dataisbeautiful/comments/8yatpz/the_stolen_years_of_10000_usa_gun_crime_victims/,0,0,,2,"The Stolen Years of 10,000 USA Gun Crime Victims (2010) x-post rDataArt",2018-07-0207.jpg
"Average Temperatures (Summer/Winter/Annual) for Lawrence, Kansas (1896 - 2017) [OC]",BRENNEJM,2018-07-12 15:57:37,https://i.redd.it/fxko1u8thj911.jpg,https://www.reddit.com/r/dataisbeautiful/comments/8yazyj/average_temperatures_summerwinterannual_for/,8,8,,10,"Average Temperatures (SummerWinterAnnual) for Lawrence, Kansas (1896 - 2017) OC",2018-07-0208.jpg
"Uses of the word ""Fuck"" in the r/soccer match thread during yesterdays game between England and Croatia. 3.86% of 40,888 comments used the word [OC]",PieGeters,2018-07-12 17:26:02,https://i.redd.it/jjy7s72ixj911.png,https://www.reddit.com/r/dataisbeautiful/comments/8ybsr3/uses_of_the_word_fuck_in_the_rsoccer_match_thread/,36576,36576,,638,"Uses of the word Fuck in the rsoccer match thread during yesterdays game between England and Croatia. 3.86% of 40,888 comments used the word OC",2018-07-0209.png
How policing and crime changed in Baltimore,mrbrightside170,2018-07-12 17:56:16,https://www.usatoday.com/story/news/nation/2018/07/12/baltimore-police-not-noticing-crime-after-freddie-gray-wave-killings-followed/744741002/,https://www.reddit.com/r/dataisbeautiful/comments/8yc2kk/how_policing_and_crime_changed_in_baltimore/,8,8,,0,How policing and crime changed in Baltimore,2018-07-0210.jpg
Determining a webcomic's dominant page colors using k-means clustering [OC],ceilius,2018-07-12 18:22:25,https://i.redd.it/4u49kkfc7k911.png,https://www.reddit.com/r/dataisbeautiful/comments/8ycb5n/determining_a_webcomics_dominant_page_colors/,16,16,,4,Determining a webcomic's dominant page colors using k-means clustering OC,2018-07-0211.png
My Heart Rate during England's 2018 FIFA World Cup games [OC],DaveyMN,2018-07-12 19:06:49,https://i.redd.it/cqgshq1ifk911.png,https://www.reddit.com/r/dataisbeautiful/comments/8ycp04/my_heart_rate_during_englands_2018_fifa_world_cup/,42,42,,3,My Heart Rate during England's 2018 FIFA World Cup games OC,2018-07-0212.png
[OC] I tracked my friends legal substance consumption last year while he was in college.,random_data1,2018-07-12 19:09:54,https://imgur.com/a/nsKqa9E,https://www.reddit.com/r/dataisbeautiful/comments/8ycpy3/oc_i_tracked_my_friends_legal_substance/,0,0,,2,OC I tracked my friends legal substance consumption last year while he was in college.,2018-07-0213.jpg
I finally earned my computer science degree so I made this visualization of how well I slept during my senior year [OC],SageJiraiya,2018-07-12 19:13:53,https://i.imgur.com/rTJxfVH.png,https://www.reddit.com/r/dataisbeautiful/comments/8ycr3n/i_finally_earned_my_computer_science_degree_so_i/,78,78,,18,I finally earned my computer science degree so I made this visualization of how well I slept during my senior year OC,2018-07-0214.png
"[OC] Land speed record, by year.",Rethling,2018-07-12 19:31:47,https://i.redd.it/n1qd082vjk911.png,https://www.reddit.com/r/dataisbeautiful/comments/8ycwpk/oc_land_speed_record_by_year/,3,3,,5,"OC Land speed record, by year.",2018-07-0215.png
Earthquake sensors registered seismic movement when Croatia scored every goal in the World Cup semifinal!,michelangelogt,2018-07-12 19:34:48,https://translate.google.fr/translate?sl=hr&tl=en&js=y&prev=_t&hl=en&ie=UTF-8&u=http%3A%2F%2Fwww.pmf.unizg.hr%2Fgeof%3F%2540%3D1kuk2%23news_33612&edit-text=&act=url,https://www.reddit.com/r/dataisbeautiful/comments/8ycxn5/earthquake_sensors_registered_seismic_movement/,23,23,,1,Earthquake sensors registered seismic movement when Croatia scored every goal in the World Cup semifinal!,2018-07-0216.jpg
[OC] Comparative Google search queries of r/thanosdidnothingwrong leading up to the 'Snap',downvoteforwhy,2018-07-12 20:00:45,https://i.redd.it/w18qx980pk911.png,https://www.reddit.com/r/dataisbeautiful/comments/8yd5v8/oc_comparative_google_search_queries_of/,6,6,,4,OC Comparative Google search queries of rthanosdidnothingwrong leading up to the 'Snap',2018-07-0217.png
25-Year Return on 401k Company Matching Amount (S&P 50) [OC],kylekun513,2018-07-12 20:11:28,https://i.redd.it/ucxsdgvzqk911.png,https://www.reddit.com/r/dataisbeautiful/comments/8yd98j/25year_return_on_401k_company_matching_amount_sp/,23,23,,13,25-Year Return on 401k Company Matching Amount (S&P 50) OC,2018-07-0218.png
Countries I visited and amount of stadiums I have attended association football matches in [OC],hn_ns,2018-07-12 20:40:48,https://i.redd.it/ccj7mryquk911.png,https://www.reddit.com/r/dataisbeautiful/comments/8ydicl/countries_i_visited_and_amount_of_stadiums_i_have/,16,16,,11,Countries I visited and amount of stadiums I have attended association football matches in OC,2018-07-0219.png
[OC] My Brain Activity – fMRI Animated Data Visualization,xDrardx,2018-07-12 20:53:47,https://www.youtube.com/watch?v=R0hdbEwDhtQ,https://www.reddit.com/r/dataisbeautiful/comments/8ydmae/oc_my_brain_activity_fmri_animated_data/,4,4,,2,OC My Brain Activity – fMRI Animated Data Visualization,2018-07-0220.jpg
Number of Americans alive today who were at least 10 yrs old when President ________ took office. [OC],BRENNEJM,2018-07-12 21:27:07,https://i.redd.it/iqqjktkl4l911.jpg,https://www.reddit.com/r/dataisbeautiful/comments/8ydw9j/number_of_americans_alive_today_who_were_at_least/,42,42,,17,Number of Americans alive today who were at least 10 yrs old when President ________ took office. OC,2018-07-0221.jpg
