title,author,created_date,url,full_permalink,score,ups,downs,num_comments,sanitized_title,image_file
In State vs. Out of State Acceptance Rates for the University of California System for Class of 2022 [OC],Spherical_Melon,2018-07-16 23:28:01,https://i.redd.it/wyhowzoz8ea11.png,https://www.reddit.com/r/dataisbeautiful/comments/8zfzwi/in_state_vs_out_of_state_acceptance_rates_for_the/,11,11,,7,In State vs. Out of State Acceptance Rates for the University of California System for Class of 2022 OC,2018-07-0300.png
[OC] I collected 100 geodes in the game Stardew Valley and had them broken open. Here are the results (count data in comments).,jbird221,2018-07-17 01:20:52,https://i.imgur.com/JuSiUwf.jpg,https://www.reddit.com/r/dataisbeautiful/comments/8zgtw7/oc_i_collected_100_geodes_in_the_game_stardew/,8836,8836,,193,OC I collected 100 geodes in the game Stardew Valley and had them broken open. Here are the results (count data in comments).,2018-07-0301.jpg
All the countries Anthony Bourdain visited in his TV travels [OC],ChartedInterests,2018-07-17 01:53:47,https://i.imgur.com/ixXKR45.jpg,https://www.reddit.com/r/dataisbeautiful/comments/8zh22b/all_the_countries_anthony_bourdain_visited_in_his/,1373,1373,,118,All the countries Anthony Bourdain visited in his TV travels OC,2018-07-0302.jpg
Video Game Sales by Platform (20 Years) [OC],dataninjachef,2018-07-17 02:00:41,https://i.redd.it/jh7pv1w11fa11.jpg,https://www.reddit.com/r/dataisbeautiful/comments/8zh3uz/video_game_sales_by_platform_20_years_oc/,7,7,,20,Video Game Sales by Platform (20 Years) OC,2018-07-0303.jpg
[OC] Post 2018 FIFA World Cup Football Teams Ranking Elo Ratings World Map,uglyorgan8038,2018-07-17 07:25:48,https://i.redd.it/sx5onmzvmga11.jpg,https://www.reddit.com/r/dataisbeautiful/comments/8zj304/oc_post_2018_fifa_world_cup_football_teams/,12,12,,5,OC Post 2018 FIFA World Cup Football Teams Ranking Elo Ratings World Map,2018-07-0304.jpg
"[OC] On World Emoji Day, let's check out the top 10 emojis used on Twitter right now!",pr33tish,2018-07-17 07:31:01,https://i.redd.it/lbyjufswnga11.png,https://www.reddit.com/r/dataisbeautiful/comments/8zj3yz/oc_on_world_emoji_day_lets_check_out_the_top_10/,752,752,,91,"OC On World Emoji Day, let's check out the top 10 emojis used on Twitter right now!",2018-07-0305.png
[OC] Interactive Map of Human Development Index of Indonesia (by Regencies and Cities),tvalentius,2018-07-17 07:39:51,https://i.redd.it/8ank9oaepga11.png,https://www.reddit.com/r/dataisbeautiful/comments/8zj5ib/oc_interactive_map_of_human_development_index_of/,10,10,,3,OC Interactive Map of Human Development Index of Indonesia (by Regencies and Cities),2018-07-0306.png
GDP Distribution in Indonesia [OC],ydail,2018-07-17 09:02:04,https://i.redd.it/4x1xtyx72ha11.png,https://www.reddit.com/r/dataisbeautiful/comments/8zjjlu/gdp_distribution_in_indonesia_oc/,3,3,,4,GDP Distribution in Indonesia OC,2018-07-0307.png
Height and Width of Pyramids around the World (interactive graphic in link),actionrat,2018-07-17 09:32:48,https://en.wikipedia.org/wiki/List_of_pyramids,https://www.reddit.com/r/dataisbeautiful/comments/8zjp23/height_and_width_of_pyramids_around_the_world/,4,4,,0,Height and Width of Pyramids around the World (interactive graphic in link),2018-07-0308.jpg
Fish Exports in US dollars [OC],databayou,2018-07-17 09:54:07,https://i.redd.it/907qn89fdha11.png,https://www.reddit.com/r/dataisbeautiful/comments/8zjswv/fish_exports_in_us_dollars_oc/,22,22,,8,Fish Exports in US dollars OC,2018-07-0309.png
[OC] Visualised spendings for our 9-day Eurotrip,H3llShadow,2018-07-17 11:24:35,https://i.imgur.com/RJOSCIQ.png,https://www.reddit.com/r/dataisbeautiful/comments/8zkaqz/oc_visualised_spendings_for_our_9day_eurotrip/,638,638,,76,OC Visualised spendings for our 9-day Eurotrip,2018-07-0310.png
"[OC] Charts of earnings, plus success of songs and locations on the London Underground in my experience as a busker",basicallydan,2018-07-17 12:26:07,https://danhough.com/busking/2018-07-17-how-much-do-i-make-july-2018/,https://www.reddit.com/r/dataisbeautiful/comments/8zkolb/oc_charts_of_earnings_plus_success_of_songs_and/,17,17,,9,"OC Charts of earnings, plus success of songs and locations on the London Underground in my experience as a busker",2018-07-0311.jpg
How does marital status differ by race in the U.S.? [OC],OverflowDs,2018-07-17 12:58:52,https://overflow.solutions/demographic-data/how-does-marital-status-differ-by-race-in-the-u-s/,https://www.reddit.com/r/dataisbeautiful/comments/8zkwjk/how_does_marital_status_differ_by_race_in_the_us/,8,8,,9,How does marital status differ by race in the U.S. OC,2018-07-0312.jpg
Relative weekly rental expenses in Australia [OC],George_Monkley,2018-07-17 13:09:01,https://i.redd.it/8qm9gbkwbia11.png,https://www.reddit.com/r/dataisbeautiful/comments/8zkz97/relative_weekly_rental_expenses_in_australia_oc/,345,345,,42,Relative weekly rental expenses in Australia OC,2018-07-0313.png
Visualizing street orientations anywhere on an interactive map [OC],MournerV,2018-07-17 13:20:43,https://mourner.github.io/road-orientation-map/,https://www.reddit.com/r/dataisbeautiful/comments/8zl2ex/visualizing_street_orientations_anywhere_on_an/,7783,7783,,254,Visualizing street orientations anywhere on an interactive map OC,2018-07-0314.jpg
US Health Agency Research Supports Vaccinating Against Flu,IKomlev,2018-07-17 13:48:12,https://knoema.com/infographics/znzpqhf/us-health-agency-research-supports-vaccinating-against-flu,https://www.reddit.com/r/dataisbeautiful/comments/8zl9lv/us_health_agency_research_supports_vaccinating/,0,0,,0,US Health Agency Research Supports Vaccinating Against Flu,2018-07-0315.jpg
For a scientific project I weighed 2856 tubes [OC],s3035212,2018-07-17 14:35:22,https://i.redd.it/4gqmb6kqqia11.jpg,https://www.reddit.com/r/dataisbeautiful/comments/8zln64/for_a_scientific_project_i_weighed_2856_tubes_oc/,27,27,,27,For a scientific project I weighed 2856 tubes OC,2018-07-0316.jpg
Interactive map of clean energy progress by state I created for my nonprofit.,CivilBison,2018-07-17 15:36:24,https://environmentamerica.org/sites/environment/files/cpn/AMN-071718-A1-REPORT/RenewablesOnTheRise-2018.html,https://www.reddit.com/r/dataisbeautiful/comments/8zm5pu/interactive_map_of_clean_energy_progress_by_state/,14,14,,3,Interactive map of clean energy progress by state I created for my nonprofit.,2018-07-0317.jpg
Freshwater from Amazon entering the Atlantic,desitola,2018-07-17 15:54:24,https://twitter.com/NASAEarth/status/1019247492322349057?s=09,https://www.reddit.com/r/dataisbeautiful/comments/8zmba0/freshwater_from_amazon_entering_the_atlantic/,13,13,,3,Freshwater from Amazon entering the Atlantic,2018-07-0318.jpg
[OC]The Usage of My Mobile Contract Allowance Over 12 Months,xnch1,2018-07-17 15:57:00,https://i.redd.it/0orkxhw86ja11.png,https://www.reddit.com/r/dataisbeautiful/comments/8zmc2q/octhe_usage_of_my_mobile_contract_allowance_over/,25,25,,14,OCThe Usage of My Mobile Contract Allowance Over 12 Months,2018-07-0319.png
"The 2018 MLB Home Run Derby, by Baseball Savant",NSFAnythingAtAll,2018-07-17 16:05:12,https://baseballsavant.mlb.com/hr_derby,https://www.reddit.com/r/dataisbeautiful/comments/8zmesa/the_2018_mlb_home_run_derby_by_baseball_savant/,0,0,,0,"The 2018 MLB Home Run Derby, by Baseball Savant",2018-07-0320.jpg
Which Seeds Are Preferred How Often? [OC],anguimorpha,2018-07-17 17:12:32,https://i.redd.it/zjahvyr7jja11.png,https://www.reddit.com/r/dataisbeautiful/comments/8zn06n/which_seeds_are_preferred_how_often_oc/,14,14,,5,Which Seeds Are Preferred How Often OC,2018-07-0321.png
Players with the most stars in Super Mario Maker [OC],bananatheswitch,2018-07-17 19:08:41,https://i.redd.it/heogztsv3ka11.png,https://www.reddit.com/r/dataisbeautiful/comments/8zo2pc/players_with_the_most_stars_in_super_mario_maker/,1,1,,3,Players with the most stars in Super Mario Maker OC,2018-07-0322.png
"How many subscribers does each (""Yes"", ""No) subreddit have? [OC]",nafrotag,2018-07-17 20:08:15,https://i.redd.it/bap82stxeka11.png,https://www.reddit.com/r/dataisbeautiful/comments/8zoly3/how_many_subscribers_does_each_yes_no_subreddit/,10093,10093,,286,"How many subscribers does each (Yes, No) subreddit have OC",2018-07-0323.png
Public holidays in Germany [OC],hn_ns,2018-07-17 20:10:28,https://i.imgur.com/EXZXdky.png,https://www.reddit.com/r/dataisbeautiful/comments/8zomqa/public_holidays_in_germany_oc/,22,22,,6,Public holidays in Germany OC,2018-07-0324.png
"Let's Talk About Birth Control, from The Pudding!",thesarahkay,2018-07-17 20:13:46,https://pudding.cool/2018/07/birth_control/,https://www.reddit.com/r/dataisbeautiful/comments/8zonr4/lets_talk_about_birth_control_from_the_pudding/,0,0,,0,"Let's Talk About Birth Control, from The Pudding!",2018-07-0325.jpg
2018 FIFA World Cup | Google Data Studio Leaderboard,COloradoYS,2018-07-17 20:13:47,https://datastudio.google.com/open/1Rg5y6r0640X8uo2xo2XY48sG9IyMiYEN,https://www.reddit.com/r/dataisbeautiful/comments/8zonr9/2018_fifa_world_cup_google_data_studio_leaderboard/,2,2,,1,2018 FIFA World Cup Google Data Studio Leaderboard,2018-07-0326.jpg
Here's how much more the typical baby boomer makes than the typical millennial in every US state,FoolishFellow,2018-07-17 21:03:14,http://www.businessinsider.com/baby-boomer-millennial-income-in-every-state-us-2018-7,https://www.reddit.com/r/dataisbeautiful/comments/8zp32q/heres_how_much_more_the_typical_baby_boomer_makes/,2,2,,7,Here's how much more the typical baby boomer makes than the typical millennial in every US state,2018-07-0327.jpg
CalArts Factbook [OC],Zaqius,2018-07-18 02:04:51,https://calarts.edu/about/institute/facts-and-figures,https://www.reddit.com/r/dataisbeautiful/comments/8zrdgo/calarts_factbook_oc/,1,1,,2,CalArts Factbook OC,2018-07-0328.jpg
[OC] Pokémon Type by Generation,_IAmGrover,2018-07-18 02:07:51,https://i.redd.it/fvb5p8i87ma11.jpg,https://www.reddit.com/r/dataisbeautiful/comments/8zre8w/oc_pokémon_type_by_generation/,31,31,,16,OC Pokémon Type by Generation,2018-07-0329.jpg
[OC] 2 Styles of Beer Dominate Counts Among Top 250 Beers,skent259,2018-07-18 03:12:22,https://i.redd.it/flwltyechma11.png,https://www.reddit.com/r/dataisbeautiful/comments/8zru7p/oc_2_styles_of_beer_dominate_counts_among_top_250/,7,7,,2,OC 2 Styles of Beer Dominate Counts Among Top 250 Beers,2018-07-0330.png
"[OC] Google Trends for ""oral-b"" Worldwide from 2004-2018",glowiep,2018-07-18 03:29:05,https://i.redd.it/yh5nzm2klma11.png,https://www.reddit.com/r/dataisbeautiful/comments/8zry81/oc_google_trends_for_oralb_worldwide_from_20042018/,16,16,,13,OC Google Trends for oral-b Worldwide from 2004-2018,2018-07-0331.png
"QWERTY, DVORAK, and COLEMAK, Oh My [OC]",billshander,2018-07-18 04:07:13,https://beehivemedia.com/dataviz/keyboardviz/,https://www.reddit.com/r/dataisbeautiful/comments/8zs747/qwerty_dvorak_and_colemak_oh_my_oc/,21,21,,9,"QWERTY, DVORAK, and COLEMAK, Oh My OC",2018-07-0332.jpg
Nicked from 1MDB or donation?,law_abiding_animals,2018-07-18 06:36:08,https://pages.malaysiakini.com/politicalfund/en/,https://www.reddit.com/r/dataisbeautiful/comments/8zt1sg/nicked_from_1mdb_or_donation/,0,0,,0,Nicked from 1MDB or donation,2018-07-0333.jpg
Which tool can I make this visual in? Can I use Power BI?,acid4207,2018-07-18 09:32:48,http://junkcharts.typepad.com/.a/6a00d8341e992c53ef0148c6ca3daf970c-pi,https://www.reddit.com/r/dataisbeautiful/comments/8ztzb3/which_tool_can_i_make_this_visual_in_can_i_use/,2,2,,5,Which tool can I make this visual in Can I use Power BI,2018-07-0334.jpg
Mapping the Best (and Worst) Places for Millennials to Make a Living,mon_d2,2018-07-18 09:42:04,https://howmuch.net/articles/how-much-money-millennials-make-in-every-state,https://www.reddit.com/r/dataisbeautiful/comments/8zu15p/mapping_the_best_and_worst_places_for_millennials/,2,2,,1,Mapping the Best (and Worst) Places for Millennials to Make a Living,2018-07-0335.jpg
Mapping and Ranking the Worst Urban Light Pollution on Earth [OC],thearrowhead,2018-07-18 11:57:31,https://therevelator.org/cities-ranked-light-pollution/,https://www.reddit.com/r/dataisbeautiful/comments/8zuu8a/mapping_and_ranking_the_worst_urban_light/,21,21,,6,Mapping and Ranking the Worst Urban Light Pollution on Earth OC,2018-07-0336.jpg
Rivers and Streams Make Up 0.35% of Earth's non-Glaciated Land Surface [OC],Geographist,2018-07-18 12:47:46,https://i.redd.it/795rmetxcpa11.png,https://www.reddit.com/r/dataisbeautiful/comments/8zv725/rivers_and_streams_make_up_035_of_earths/,8,8,,2,Rivers and Streams Make Up 0.35% of Earth's non-Glaciated Land Surface OC,2018-07-0337.png
[OC] Data Visualization and Analysis of Taylor Swift's Song Lyrics - R code included,pr33tish,2018-07-18 13:03:16,https://www.promptcloud.com/blog/data-visualization-text-mining-taylor-swift-song-lyrics,https://www.reddit.com/r/dataisbeautiful/comments/8zvaz5/oc_data_visualization_and_analysis_of_taylor/,18,18,,6,OC Data Visualization and Analysis of Taylor Swift's Song Lyrics - R code included,2018-07-0338.jpg
"[OC]Success stats of 392,000 Kickstarters from 2009-2017",OffTheChartsC,2018-07-18 13:33:40,https://i.redd.it/x9dwivjclpa11.png,https://www.reddit.com/r/dataisbeautiful/comments/8zvj8g/ocsuccess_stats_of_392000_kickstarters_from/,9629,9629,,339,"OCSuccess stats of 392,000 Kickstarters from 2009-2017",2018-07-0339.png
Movies With Samuel L. Jackson [OC],CharcoalCharts,2018-07-18 13:48:53,https://v.redd.it/kun40kd1opa11,https://www.reddit.com/r/dataisbeautiful/comments/8zvnco/movies_with_samuel_l_jackson_oc/,11,11,,6,Movies With Samuel L. Jackson OC,2018-07-0340.png
Brands on boards advertising at the time of goals on the World Cup 2018: rating [OC],aktavian8,2018-07-18 14:36:12,https://i.redd.it/dql5se1hwpa11.png,https://www.reddit.com/r/dataisbeautiful/comments/8zw11h/brands_on_boards_advertising_at_the_time_of_goals/,20,20,,6,Brands on boards advertising at the time of goals on the World Cup 2018 rating OC,2018-07-0341.png
[OC] Clipping position on my train ticket,tacbecon,2018-07-18 14:38:07,https://i.redd.it/s7z7by72xpa11.jpg,https://www.reddit.com/r/dataisbeautiful/comments/8zw1k1/oc_clipping_position_on_my_train_ticket/,11,11,,3,OC Clipping position on my train ticket,2018-07-0342.jpg
The Warming Atlantic: small multiples of sea surface temperature anomalies in the Atlantic Ocean [OC],bradyrx,2018-07-18 16:08:02,https://twitter.com/rileyxbrady/status/1019611904082432002,https://www.reddit.com/r/dataisbeautiful/comments/8zwtbx/the_warming_atlantic_small_multiples_of_sea/,12,12,,2,The Warming Atlantic small multiples of sea surface temperature anomalies in the Atlantic Ocean OC,2018-07-0343.jpg
Over 75% of US counties have negative savings potential [OC],mimseylovespeanuts,2018-07-18 16:45:19,https://i.redd.it/6gblvl69jqa11.png,https://www.reddit.com/r/dataisbeautiful/comments/8zx4y7/over_75_of_us_counties_have_negative_savings/,108,108,,41,Over 75% of US counties have negative savings potential OC,2018-07-0344.png
Loudness of all UK number ones (1952 - 2018) in LUFS [OC],richieahb,2018-07-18 17:09:52,https://i.redd.it/zv1i1bs4oqa11.png,https://www.reddit.com/r/dataisbeautiful/comments/8zxczh/loudness_of_all_uk_number_ones_1952_2018_in_lufs/,15,15,,5,Loudness of all UK number ones (1952 - 2018) in LUFS OC,2018-07-0345.png
"[OC] We're having a baby girl in November and couldn't decide on a name, so I built a baby-namer viz command center partly powered by machine learning, from over 140 years of name data.",data_crunch,2018-07-18 17:31:53,https://i.redd.it/zma9syyepqa11.png,https://www.reddit.com/r/dataisbeautiful/comments/8zxk5h/oc_were_having_a_baby_girl_in_november_and/,258,258,,27,"OC We're having a baby girl in November and couldn't decide on a name, so I built a baby-namer viz command center partly powered by machine learning,",2018-07-0346.png
NBA Analytics Dashboard - Visual Insights to Compare Multiple Players and Teams,dr_isk_16,2018-07-18 18:40:15,https://relativitydigest.com/2018/07/18/nba-analytics-dashboard/,https://www.reddit.com/r/dataisbeautiful/comments/8zy65c/nba_analytics_dashboard_visual_insights_to/,3,3,,0,NBA Analytics Dashboard - Visual Insights to Compare Multiple Players and Teams,2018-07-0347.jpg
"The size of wildfires in the United States has been going up since 1960, and they're killing more people too. [OC]",MannyDantyla,2018-07-18 18:47:01,https://i.redd.it/2owps66c5ra11.png,https://www.reddit.com/r/dataisbeautiful/comments/8zy8ef/the_size_of_wildfires_in_the_united_states_has/,3,3,,7,"The size of wildfires in the United States has been going up since 1960, and they're killing more people too. OC",2018-07-0348.png
[OC] I've Been on the Job Hunt for the Past Few Months...,ilovetogarden,2018-07-18 20:14:46,https://i.redd.it/orxc34zmkra11.png,https://www.reddit.com/r/dataisbeautiful/comments/8zyzyw/oc_ive_been_on_the_job_hunt_for_the_past_few/,37,37,,21,OC I've Been on the Job Hunt for the Past Few Months...,2018-07-0349.png
[OC] Financial Times Visual Vocabulary: Tableau Edition,kriebela,2018-07-18 21:01:22,https://i.redd.it/8598xg0htra11.jpg,https://www.reddit.com/r/dataisbeautiful/comments/8zze9i/oc_financial_times_visual_vocabulary_tableau/,10,10,,4,OC Financial Times Visual Vocabulary Tableau Edition,2018-07-0350.jpg
Tadjikistan in bloody colormap [OC],SiggyF,2018-07-18 21:05:52,https://i.redd.it/vchf67f3ura11.png,https://www.reddit.com/r/dataisbeautiful/comments/8zzflo/tadjikistan_in_bloody_colormap_oc/,56,56,,5,Tadjikistan in bloody colormap OC,2018-07-0351.png
[OC]Titanic Survival Based on Class and Title.,ColeTrainlxl,2018-07-18 23:23:21,https://i.redd.it/y8bt7kggisa11.png,https://www.reddit.com/r/dataisbeautiful/comments/900ioq/octitanic_survival_based_on_class_and_title/,11,11,,14,OCTitanic Survival Based on Class and Title.,2018-07-0352.png
"Amount of subscribers to the ""aww"" subreddits [OC]",etnguyen03,2018-07-19 00:24:06,https://i.imgur.com/FFYNJCq.png,https://www.reddit.com/r/dataisbeautiful/comments/900yru/amount_of_subscribers_to_the_aww_subreddits_oc/,15,15,,6,Amount of subscribers to the aww subreddits OC,2018-07-0353.png
"Best methods of suicide based on the lethality, time and agony scores of each method. The higher the score the better. [OC]",Genderless_Alien,2018-07-19 00:26:00,https://i.redd.it/ybefa7mqssa11.png,https://www.reddit.com/r/dataisbeautiful/comments/900z91/best_methods_of_suicide_based_on_the_lethality/,15,15,,9,"Best methods of suicide based on the lethality, time and agony scores of each method. The higher the score the better. OC",2018-07-0354.png
More of the U.S. is Seeing Extremely Warm Temperatures at Night,HenryCorp,2018-07-19 00:53:44,https://www.nytimes.com/interactive/2018/07/11/climate/summer-nights-warming-faster-than-days-dangerous.html,https://www.reddit.com/r/dataisbeautiful/comments/9016gm/more_of_the_us_is_seeing_extremely_warm/,14,14,,3,More of the U.S. is Seeing Extremely Warm Temperatures at Night,2018-07-0355.jpg
"Nonce histograms for the first 532,000 Bitcoin blocks, inception to 2018-07-15 [OC]",Yzaamb,2018-07-19 02:14:11,https://i.redd.it/13b1hylhcta11.png,https://www.reddit.com/r/dataisbeautiful/comments/901r4y/nonce_histograms_for_the_first_532000_bitcoin/,11,11,,4,"Nonce histograms for the first 532,000 Bitcoin blocks, inception to 2018-07-15 OC",2018-07-0356.png
[OC] College Professor Rating vs. Average Grade Given in Class (On 4.0 GPA Scale),HardlyChicken,2018-07-19 03:15:47,https://i.redd.it/3npz8zr3ota11.png,https://www.reddit.com/r/dataisbeautiful/comments/9026xi/oc_college_professor_rating_vs_average_grade/,43,43,,11,OC College Professor Rating vs. Average Grade Given in Class (On 4.0 GPA Scale),2018-07-0357.png
"[OC] Rise and fall of sea levels during a day (Data collected by sensor, for each minute)",reitnorF_,2018-07-19 04:29:46,https://i.redd.it/x826hq5tzta11.png,https://www.reddit.com/r/dataisbeautiful/comments/902oww/oc_rise_and_fall_of_sea_levels_during_a_day_data/,62,62,,9,"OC Rise and fall of sea levels during a day (Data collected by sensor, for each minute)",2018-07-0358.png
Flags of the World: Why does the world love RED?,datamoron,2018-07-19 12:34:28,https://gramener.com/2018/07/18/flags-of-the-world-red-reason/,https://www.reddit.com/r/dataisbeautiful/comments/905g15/flags_of_the_world_why_does_the_world_love_red/,6,6,,3,Flags of the World Why does the world love RED,2018-07-0359.jpg
[OC] US Net Neutrality comments per hour,yes-i-am-a-wizzard,2018-07-19 12:34:58,https://imgur.com/a/Npb8V5u,https://www.reddit.com/r/dataisbeautiful/comments/905g5z/oc_us_net_neutrality_comments_per_hour/,24,24,,5,OC US Net Neutrality comments per hour,2018-07-0360.jpg
Population Distribution of Foundation Shades per Company,LocaChoca,2018-07-19 13:25:54,https://pudding.cool/2018/06/makeup-shades/,https://www.reddit.com/r/dataisbeautiful/comments/905tpo/population_distribution_of_foundation_shades_per/,36,36,,4,Population Distribution of Foundation Shades per Company,2018-07-0361.jpg
"New York City murders per month, 1976 to June 2018",Rajkalex,2018-07-19 13:40:42,https://twitter.com/Crimealytics/status/1019588324493754368,https://www.reddit.com/r/dataisbeautiful/comments/905xpb/new_york_city_murders_per_month_1976_to_june_2018/,1024,1024,,264,"New York City murders per month, 1976 to June 2018",2018-07-0362.jpg
Croatia won the fouls competition on WorldCup,davecarpenter,2018-07-19 14:02:55,https://twitter.com/AnswerMiner/status/1019661609780875270,https://www.reddit.com/r/dataisbeautiful/comments/9063wx/croatia_won_the_fouls_competition_on_worldcup/,43,43,,18,Croatia won the fouls competition on WorldCup,2018-07-0363.jpg
[OC] Number of Promoted Posts (Ads) per Regular Post on Reddit Front Page (New Design),wortkotze,2018-07-19 14:15:58,https://i.redd.it/c991maj6xwa11.png,https://www.reddit.com/r/dataisbeautiful/comments/9067uy/oc_number_of_promoted_posts_ads_per_regular_post/,7,7,,4,OC Number of Promoted Posts (Ads) per Regular Post on Reddit Front Page (New Design),2018-07-0364.png
Market Cap of the Top 5 S&P Companies vs the bottom 282,bigdaysahead,2018-07-19 14:50:34,https://twitter.com/michaelbatnick/status/1019680856837849090?s=19,https://www.reddit.com/r/dataisbeautiful/comments/906i49/market_cap_of_the_top_5_sp_companies_vs_the/,5,5,,1,Market Cap of the Top 5 S&P Companies vs the bottom 282,2018-07-0365.jpg
[OC] The Murray Fallacy and the Heritability of Bias – Nathan Harvey – Medium,NathanHarveyModels,2018-07-19 15:32:38,https://medium.com/@n.k.h.73908513321516/the-murray-fallacy-and-the-heritability-of-bias-c20c2381fe27,https://www.reddit.com/r/dataisbeautiful/comments/906v80/oc_the_murray_fallacy_and_the_heritability_of/,3,3,,5,OC The Murray Fallacy and the Heritability of Bias – Nathan Harvey – Medium,2018-07-0366.jpg
[OC] During the summer months the water at the bottom of my hot water tank is about the same as highest outside air temperature,nick9000,2018-07-19 16:37:40,https://i.imgur.com/lHgstt6.jpg,https://www.reddit.com/r/dataisbeautiful/comments/907foq/oc_during_the_summer_months_the_water_at_the/,8,8,,8,OC During the summer months the water at the bottom of my hot water tank is about the same as highest outside air temperature,2018-07-0367.jpg
Relative message frequency in my friends' soccer chat group during the World Cup [OC],ropote,2018-07-19 17:45:15,https://i.redd.it/kp4ihuf3zxa11.jpg,https://www.reddit.com/r/dataisbeautiful/comments/9081md/relative_message_frequency_in_my_friends_soccer/,20,20,,5,Relative message frequency in my friends' soccer chat group during the World Cup OC,2018-07-0368.jpg
Which birds prefer which seeds? [OC],colemanrharris,2018-07-19 17:49:40,https://i.redd.it/2ygz37a30ya11.png,https://www.reddit.com/r/dataisbeautiful/comments/90831w/which_birds_prefer_which_seeds_oc/,82,82,,11,Which birds prefer which seeds OC,2018-07-0369.png
Area Graph of Global Right/Left-Wing Ideological Trend Juxtaposed with Notable Global Events and Financial Crises (1948-2018) [OC],sutpenicity,2018-07-19 18:45:13,https://i.redd.it/a6dlsjb08ya11.jpg,https://www.reddit.com/r/dataisbeautiful/comments/908krw/area_graph_of_global_rightleftwing_ideological/,10,10,,5,Area Graph of Global RightLeft-Wing Ideological Trend Juxtaposed with Notable Global Events and Financial Crises (1948-2018) OC,2018-07-0370.jpg
How can I recreate this visualization with different data?,naijatea,2018-07-19 19:00:10,https://projects.fivethirtyeight.com/world-cup-comparisons/denis-cheryshev-2018/,https://www.reddit.com/r/dataisbeautiful/comments/908pfs/how_can_i_recreate_this_visualization_with/,5,5,,0,How can I recreate this visualization with different data,2018-07-0371.jpg
[OC] Looking at the 2107 IRS Life Expectancy Table. They say I should have bought that convertible a few years ago.,brianjackson,2018-07-19 19:17:46,https://i.redd.it/bvosb4kifya11.png,https://www.reddit.com/r/dataisbeautiful/comments/908v25/oc_looking_at_the_2107_irs_life_expectancy_table/,2,2,,4,OC Looking at the 2107 IRS Life Expectancy Table. They say I should have bought that convertible a few years ago.,2018-07-0372.png
FIFA World Cup Goals Scored Per Minute [OC],conspiracie,2018-07-20 00:17:49,https://i.redd.it/hd633hpcxza11.png,https://www.reddit.com/r/dataisbeautiful/comments/90b8h2/fifa_world_cup_goals_scored_per_minute_oc/,19,19,,5,FIFA World Cup Goals Scored Per Minute OC,2018-07-0373.png
US Congressional Districts by PVI [OC],MattyB929,2018-07-20 00:19:08,https://i.redd.it/6vs9puwgxza11.png,https://www.reddit.com/r/dataisbeautiful/comments/90b8r9/us_congressional_districts_by_pvi_oc/,9,9,,3,US Congressional Districts by PVI OC,2018-07-0374.png
