title,author,created_date,url,full_permalink,score,ups,downs,num_comments,sanitized_title,image_file
"Global, Arctic and Antarctic sea-ice area barrel - June 2018 [OC]",kevpluck,2018-07-01 00:38:32,https://v.redd.it/vkfaf4yee8711,https://www.reddit.com/r/dataisbeautiful/comments/8v6a2w/global_arctic_and_antarctic_seaice_area_barrel/,8628,8628,,195,"Global, Arctic and Antarctic sea-ice area barrel - June 2018 OC",2018-07-0000.png
[OC] My AC broke at 1pm on Thursday. it was not fixed until today at 4pm.,PonyToast,2018-07-01 02:27:57,https://i.imgur.com/CNzNyzB.png,https://www.reddit.com/r/dataisbeautiful/comments/8v6vvj/oc_my_ac_broke_at_1pm_on_thursday_it_was_not/,18,18,,6,OC My AC broke at 1pm on Thursday. it was not fixed until today at 4pm.,2018-07-0001.png
Animated Directional Chord Diagrams,_Neuromancer_,2018-07-01 03:15:07,https://guyabel.com/post/animated-directional-chord-diagrams/,https://www.reddit.com/r/dataisbeautiful/comments/8v74vo/animated_directional_chord_diagrams/,2,2,,1,Animated Directional Chord Diagrams,2018-07-0002.jpg
"Water use in the U.S., 2015",BlueRidgeGawker,2018-07-01 10:58:57,https://owi.usgs.gov/vizlab/water-use-15/?utm_source=reddit&utm_campaign=redditdark,https://www.reddit.com/r/dataisbeautiful/comments/8v96c7/water_use_in_the_us_2015/,3,3,,1,"Water use in the U.S., 2015",2018-07-0003.jpg
Originality at the Box Office: Story Source for Top 50 US Films in Domestic Box Office 1930-2017 [OC],EvanMinn,2018-07-01 11:28:58,https://i.redd.it/e7alp8yrnb711.png,https://www.reddit.com/r/dataisbeautiful/comments/8v9asy/originality_at_the_box_office_story_source_for/,78,78,,15,Originality at the Box Office Story Source for Top 50 US Films in Domestic Box Office 1930-2017 OC,2018-07-0004.png
"[OC] 161 small multiple maps of China's NO2 pollution. Story is now free to read, follow link in comment",sdbernard,2018-07-01 13:40:50,https://i.redd.it/q3tqhn65bc711.jpg,https://www.reddit.com/r/dataisbeautiful/comments/8v9yjr/oc_161_small_multiple_maps_of_chinas_no2/,28,28,,4,"OC 161 small multiple maps of China's NO2 pollution. Story is now free to read, follow link in comment",2018-07-0005.jpg
"[OC] We are a couple (23M, 21F) that records our sex acts on Google Sheets (variables: Orgasm Champion/ recipient, location, and more) and does quarterly reviews! Q2 results are here! Full spreadsheet can be found in comment.",GingerAle69,2018-07-01 15:02:59,https://i.imgur.com/zAAfpoU.png,https://www.reddit.com/r/dataisbeautiful/comments/8vagnp/oc_we_are_a_couple_23m_21f_that_records_our_sex/,0,0,,12,"OC We are a couple (23M, 21F) that records our sex acts on Google Sheets (variables Orgasm Champion recipient, location, and more) and does quarterly",2018-07-0006.png
"The Physics of Kung Fu, brought to life through motion capture data visualizations [x-post /r/DataArt]",jmerlinb,2018-07-01 15:08:59,https://vimeo.com/163153865,https://www.reddit.com/r/dataisbeautiful/comments/8vai41/the_physics_of_kung_fu_brought_to_life_through/,10628,10628,,192,"The Physics of Kung Fu, brought to life through motion capture data visualizations x-post rDataArt",2018-07-0007.jpg
Global temperature change as Joyplot (2010-2017 v 1951-1980) [OC],nk_gu,2018-07-01 15:27:05,https://i.redd.it/wwqp6ap7uc711.png,https://www.reddit.com/r/dataisbeautiful/comments/8vamhb/global_temperature_change_as_joyplot_20102017_v/,40,40,,13,Global temperature change as Joyplot (2010-2017 v 1951-1980) OC,2018-07-0008.png
Prime Ministers of Sweden [OC],sbetner,2018-07-01 15:32:35,https://imgur.com/gUbaaF6,https://www.reddit.com/r/dataisbeautiful/comments/8vanuk/prime_ministers_of_sweden_oc/,21,21,,10,Prime Ministers of Sweden OC,2018-07-0009.jpg
[OC] Depreciation to Date since first Sample ~1000%,hola_senor_6bin,2018-07-01 16:20:38,https://i.redd.it/n7f4jk7n3d711.png,https://www.reddit.com/r/dataisbeautiful/comments/8vaztq/oc_depreciation_to_date_since_first_sample_1000/,2,2,,6,OC Depreciation to Date since first Sample ~1000%,2018-07-0010.png
HOI4,Escusemeimvenom,2018-07-01 19:25:37,https://www.reddit.com/r/hoi4/comments/8vag3m/all_1936_manpower_by_country_and_ideology/?utm_source=reddit-android,https://www.reddit.com/r/dataisbeautiful/comments/8vccvr/hoi4/,0,0,,0,HOI4,2018-07-0011.png
Variation in Travel Consult and Vaccine Fees across Canada [OC],hish123,2018-07-01 19:36:24,https://i.redd.it/yhmy4h70pd711.png,https://www.reddit.com/r/dataisbeautiful/comments/8vcfut/variation_in_travel_consult_and_vaccine_fees/,2,2,,5,Variation in Travel Consult and Vaccine Fees across Canada OC,2018-07-0012.png
I created an interactive time lapse about bikes rent from Vienna's Citybike stations (free bicycle rental),Vieltrinker,2018-07-01 20:20:15,https://www.youtube.com/watch?v=Asjg59rAh5k,https://www.reddit.com/r/dataisbeautiful/comments/8vcrbu/i_created_an_interactive_time_lapse_about_bikes/,6,6,,2,I created an interactive time lapse about bikes rent from Vienna's Citybike stations (free bicycle rental),2018-07-0013.jpg
"Not mine but wanted to share, this app let’s you see in depth data about your Apple Music listening habits.",doctormisterboss,2018-07-01 23:46:35,https://itunes.apple.com/us/app/snd-wave/id1326673854?mt=8,https://www.reddit.com/r/dataisbeautiful/comments/8ve571/not_mine_but_wanted_to_share_this_app_lets_you/,0,0,,1,"Not mine but wanted to share, this app let’s you see in depth data about your Apple Music listening habits.",2018-07-0014.jpg
[OC] Squash Player Heatmap,pdix_datascience,2018-07-02 04:37:25,https://imgur.com/a/VktkDLV,https://www.reddit.com/r/dataisbeautiful/comments/8vfwfw/oc_squash_player_heatmap/,4,4,,7,OC Squash Player Heatmap,2018-07-0015.jpg
FIFA World Cup 2018 - Russia - Where do the players come from? [OC],snorermadlysnored,2018-07-02 05:58:34,https://i.redd.it/5p7wtw2s5h711.png,https://www.reddit.com/r/dataisbeautiful/comments/8vgbqo/fifa_world_cup_2018_russia_where_do_the_players/,29,29,,9,FIFA World Cup 2018 - Russia - Where do the players come from OC,2018-07-0016.png
Updated progression probability (after the first four knockout matches) for each team based on their Elo ranking. [OC],overactor,2018-07-02 07:40:21,https://i.imgur.com/UxvXofw.png,https://www.reddit.com/r/dataisbeautiful/comments/8vgu17/updated_progression_probability_after_the_first/,17,17,,2,Updated progression probability (after the first four knockout matches) for each team based on their Elo ranking. OC,2018-07-0017.png
"Simulating 10,000 Yahtzee dice throws: how many throws are required to land a Yahtzee? [OC]",TrackingHappiness,2018-07-02 08:03:53,https://i.redd.it/3wejv18trh711.jpg,https://www.reddit.com/r/dataisbeautiful/comments/8vgxwl/simulating_10000_yahtzee_dice_throws_how_many/,39,39,,8,"Simulating 10,000 Yahtzee dice throws how many throws are required to land a Yahtzee OC",2018-07-0018.jpg
Average Monthly Rent Comparison - 540 Cities - Expanded [OC],kylekun513,2018-07-02 08:45:04,https://i.redd.it/0lji1j8bzh711.png,https://www.reddit.com/r/dataisbeautiful/comments/8vh4du/average_monthly_rent_comparison_540_cities/,29144,29144,,3913,Average Monthly Rent Comparison - 540 Cities - Expanded OC,2018-07-0019.png
A summary of the mixes posted to tinymixtapes [OC],a_moss_snake,2018-07-02 09:21:26,https://i.redd.it/g7tur2wt5i711.png,https://www.reddit.com/r/dataisbeautiful/comments/8vhab2/a_summary_of_the_mixes_posted_to_tinymixtapes_oc/,6,6,,2,A summary of the mixes posted to tinymixtapes OC,2018-07-0020.png
"Russia, Sweden and Belgium are the most efficient WC teams so far (average goals per number of succesfull passes), Germany being the worst [OC]",TrackingHappiness,2018-07-02 10:17:41,https://i.redd.it/tyoaacwufi711.jpg,https://www.reddit.com/r/dataisbeautiful/comments/8vhjpk/russia_sweden_and_belgium_are_the_most_efficient/,25,25,,5,"Russia, Sweden and Belgium are the most efficient WC teams so far (average goals per number of succesfull passes), Germany being the worst OC",2018-07-0021.jpg
NHS at 70: draw the chart to see how much you know about the health service,Jholder112233,2018-07-02 10:34:16,https://www.theguardian.com/society/ng-interactive/2018/jul/02/nhs-at-70-how-well-do-you-know-the-health-service,https://www.reddit.com/r/dataisbeautiful/comments/8vhmke/nhs_at_70_draw_the_chart_to_see_how_much_you_know/,11,11,,2,NHS at 70 draw the chart to see how much you know about the health service,2018-07-0022.jpg
How Australians spend their time online,CybergothiChe,2018-07-02 11:20:51,http://www.abc.net.au/news/2018-07-02/how-we-spend-our-internet-minutes/9923822,https://www.reddit.com/r/dataisbeautiful/comments/8vhutf/how_australians_spend_their_time_online/,6,6,,7,How Australians spend their time online,2018-07-0023.jpg
[Battle] DataViz Battle for the month of July 2018: Make it better: Which Birds prefer Which Seeds,AutoModerator,2018-07-02 11:35:46,https://www.reddit.com/r/dataisbeautiful/comments/8vhxhq/battle_dataviz_battle_for_the_month_of_july_2018/,https://www.reddit.com/r/dataisbeautiful/comments/8vhxhq/battle_dataviz_battle_for_the_month_of_july_2018/,85,85,,83,Battle DataViz Battle for the month of July 2018 Make it better Which Birds prefer Which Seeds,2018-07-0024.jpg
Stylometric analysis of the number of writers for Prime Minister of Pakistan,soggypocket,2018-07-02 12:36:11,http://aliarsalankazmi.github.io/blog_DA/posts/r/2016/11/18/authorial_analysis_pm.html,https://www.reddit.com/r/dataisbeautiful/comments/8via3g/stylometric_analysis_of_the_number_of_writers_for/,0,0,,0,Stylometric analysis of the number of writers for Prime Minister of Pakistan,2018-07-0025.jpg
"[OC] I landed at the basketball court in Tilted Towers 75 times and did the Orange Justice dance until I died, and then I created this infographic! cross-post from r/FortniteBR",jrachet1,2018-07-02 13:30:26,https://imgur.com/gallery/qzxpJxR,https://www.reddit.com/r/dataisbeautiful/comments/8vimz6/oc_i_landed_at_the_basketball_court_in_tilted/,118,118,,14,"OC I landed at the basketball court in Tilted Towers 75 times and did the Orange Justice dance until I died, and then I created this infographic! cros",2018-07-0026.jpg
"Distribution of scores in a whack-a-mole style game with time bonuses when the player reaches 100, 500, 900, 1500, 2000 and 2500 points [OC]",nadinengland,2018-07-02 13:42:44,https://i.redd.it/888rmdrpej711.png,https://www.reddit.com/r/dataisbeautiful/comments/8viq1l/distribution_of_scores_in_a_whackamole_style_game/,2,2,,2,"Distribution of scores in a whack-a-mole style game with time bonuses when the player reaches 100, 500, 900, 1500, 2000 and 2500 points OC",2018-07-0027.png
"World Energy Consumption, proportion (1965-2017) and absolute (1983-2017) [OC]",gringer,2018-07-02 14:09:49,https://i.imgur.com/e3QwFqR.png,https://www.reddit.com/r/dataisbeautiful/comments/8vix3r/world_energy_consumption_proportion_19652017_and/,12,12,,5,"World Energy Consumption, proportion (1965-2017) and absolute (1983-2017) OC",2018-07-0028.png
Most popular brands on Reddit by mentions and upvotes [OC],hendrickj,2018-07-02 14:55:58,https://lineupapp.io/search.html?q=sweaters,https://www.reddit.com/r/dataisbeautiful/comments/8vj98p/most_popular_brands_on_reddit_by_mentions_and/,33,33,,7,Most popular brands on Reddit by mentions and upvotes OC,2018-07-0029.jpg
Stack Overflow Survey 2018: Language Preferences [OC],yaph,2018-07-02 14:59:56,https://i.redd.it/o67lddhauj711.png,https://www.reddit.com/r/dataisbeautiful/comments/8vjaad/stack_overflow_survey_2018_language_preferences_oc/,24,24,,4,Stack Overflow Survey 2018 Language Preferences OC,2018-07-0030.png
Pumpkin Production in the United States,SkinnyNerd,2018-07-02 15:15:14,https://www.stockingblue.com/article/67/pumpkin-production-in-the-united-states/,https://www.reddit.com/r/dataisbeautiful/comments/8vjek2/pumpkin_production_in_the_united_states/,2,2,,0,Pumpkin Production in the United States,2018-07-0031.jpg
I've connected new server to the internet. Automated botnets made over 60k various requests to it in a month [OC],Shmakov,2018-07-02 16:12:18,https://i.redd.it/0av73gjr6k711.png,https://www.reddit.com/r/dataisbeautiful/comments/8vjuqc/ive_connected_new_server_to_the_internet/,1106,1106,,60,I've connected new server to the internet. Automated botnets made over 60k various requests to it in a month OC,2018-07-0032.png
[OC] Dinosaur Stats for Jurassic World Evolution,hiplobonoxa,2018-07-02 16:36:47,https://i.redd.it/6cizi8qkbk711.png,https://www.reddit.com/r/dataisbeautiful/comments/8vk244/oc_dinosaur_stats_for_jurassic_world_evolution/,12,12,,3,OC Dinosaur Stats for Jurassic World Evolution,2018-07-0033.png
Visualizing Knowledge at Forge.AI,jenniferlum,2018-07-02 18:27:36,https://medium.com/@Forge_AI/visualizing-knowledge-at-forge-ai-c9bb6797341,https://www.reddit.com/r/dataisbeautiful/comments/8vkzpg/visualizing_knowledge_at_forgeai/,0,0,,0,Visualizing Knowledge at Forge.AI,2018-07-0034.jpg
Dog names by neighborhood. NYC,zackatzert,2018-07-02 18:28:24,https://nycdohmh.carto.com/u/nycdohmh-eaa/viz/43f87e78-307e-4216-9600-1904ab7efd3e/embed_map,https://www.reddit.com/r/dataisbeautiful/comments/8vkzxx/dog_names_by_neighborhood_nyc/,11,11,,1,Dog names by neighborhood. NYC,2018-07-0035.jpg
North Atlantic Fish Species [OC],databayou,2018-07-02 19:20:36,https://v.redd.it/2ex15gsg2l711,https://www.reddit.com/r/dataisbeautiful/comments/8vlfhq/north_atlantic_fish_species_oc/,11,11,,4,North Atlantic Fish Species OC,2018-07-0036.png
Timeline of Gone with the Wind cast from date of birth [OC],ChartedInterests,2018-07-02 22:05:29,https://time.graphics/line/104797,https://www.reddit.com/r/dataisbeautiful/comments/8vmq9m/timeline_of_gone_with_the_wind_cast_from_date_of/,5,5,,3,Timeline of Gone with the Wind cast from date of birth OC,2018-07-0037.jpg
Mountainbike Race Analysis Breakdown [by Dominic Wrapson],Germany_Guy,2018-07-02 23:11:35,https://www.pinkbike.com/news/race-analysis-leogang-world-cup-2018.html,https://www.reddit.com/r/dataisbeautiful/comments/8vn7m6/mountainbike_race_analysis_breakdown_by_dominic/,2,2,,0,Mountainbike Race Analysis Breakdown by Dominic Wrapson,2018-07-0038.jpg
"Number of persons in custody for terrorism-relatdd offences, sorted by their ideology in the UK",Undercover5051,2018-07-02 23:17:00,https://i.imgur.com/O0ft2ym.jpg,https://www.reddit.com/r/dataisbeautiful/comments/8vn90i/number_of_persons_in_custody_for_terrorismrelatdd/,18,18,,8,"Number of persons in custody for terrorism-relatdd offences, sorted by their ideology in the UK",2018-07-0039.png
Visualizing the human footprint [OC],Reldresal,2018-07-02 23:58:34,https://i.redd.it/xyg7gplbem711.jpg,https://www.reddit.com/r/dataisbeautiful/comments/8vnjb4/visualizing_the_human_footprint_oc/,41658,41658,,1199,Visualizing the human footprint OC,2018-07-0040.jpg
The Secret Weapon of Tulsa's Republican Mayor - Improving a city through a data driven initiative,dispirited-centrist,2018-07-03 00:12:48,https://www.citylab.com/life/2018/07/the-data-brigade-of-tulsa-oklahoma/564167/?utm_source=feedburner&utm_medium=feed&utm_campaign=Feed%3A+TheAtlanticCities+%28CityLab%29,https://www.reddit.com/r/dataisbeautiful/comments/8vnmv0/the_secret_weapon_of_tulsas_republican_mayor/,6,6,,2,The Secret Weapon of Tulsa's Republican Mayor - Improving a city through a data driven initiative,2018-07-0041.jpg
"My heart rate before, during, and after a 2:30-4:00 job interview for a position I really want. The phrase ""It's all in your head"" illustrated. [OC]",Flrg808,2018-07-03 00:59:20,https://i.redd.it/zeq9kzcwrm711.png,https://www.reddit.com/r/dataisbeautiful/comments/8vnyt6/my_heart_rate_before_during_and_after_a_230400/,27,27,,9,"My heart rate before, during, and after a 230-400 job interview for a position I really want. The phrase It's all in your head illustrated. OC",2018-07-0042.png
[OC] 11 Months of Heart Rate and Sleep Data from an Apple Watch,blodgrahm,2018-07-03 01:44:05,https://imgur.com/a/xieAzab,https://www.reddit.com/r/dataisbeautiful/comments/8voa87/oc_11_months_of_heart_rate_and_sleep_data_from_an/,16,16,,7,OC 11 Months of Heart Rate and Sleep Data from an Apple Watch,2018-07-0043.jpg
Number of Last Season's All-Stars on Each Team [OC],1wheel,2018-07-03 03:24:20,https://i.redd.it/71qtrya6jn711.png,https://www.reddit.com/r/dataisbeautiful/comments/8voxwk/number_of_last_seasons_allstars_on_each_team_oc/,25,25,,7,Number of Last Season's All-Stars on Each Team OC,2018-07-0044.png
Trends and patterns in intermarriage,jimrosenz,2018-07-03 03:32:29,http://www.pewsocialtrends.org/2017/05/18/1-trends-and-patterns-in-intermarriage/,https://www.reddit.com/r/dataisbeautiful/comments/8vozow/trends_and_patterns_in_intermarriage/,5,5,,1,Trends and patterns in intermarriage,2018-07-0045.jpg
Grouping birds by their feeding preferences using ICA and K-means clustering [OC],DrDalmaijer,2018-07-03 10:27:47,https://i.redd.it/9ohjgmfkip711.png,https://www.reddit.com/r/dataisbeautiful/comments/8vr4rv/grouping_birds_by_their_feeding_preferences_using/,21,21,,12,Grouping birds by their feeding preferences using ICA and K-means clustering OC,2018-07-0046.png
"African Conflict, Quantified [OC]",divergentdata,2018-07-03 12:26:02,https://v.redd.it/ol1n6v4l7q711,https://www.reddit.com/r/dataisbeautiful/comments/8vrrwi/african_conflict_quantified_oc/,45,45,,7,"African Conflict, Quantified OC",2018-07-0047.png
What states have the highest rates of teens giving birth? [OC],OverflowDs,2018-07-03 12:47:32,https://overflow.solutions/special-projects/what-states-have-the-highest-rates-of-teens-giving-birth/,https://www.reddit.com/r/dataisbeautiful/comments/8vrwy5/what_states_have_the_highest_rates_of_teens/,18,18,,10,What states have the highest rates of teens giving birth OC,2018-07-0048.jpg
Sea-level rise in 1508 tide gauges [OC],SiggyF,2018-07-03 12:52:15,https://i.redd.it/luypnh0ecq711.png,https://www.reddit.com/r/dataisbeautiful/comments/8vrxzz/sealevel_rise_in_1508_tide_gauges_oc/,10,10,,4,Sea-level rise in 1508 tide gauges OC,2018-07-0049.png
visualization of the length of terms of services of large corporations like facebook and instagram,shabda,2018-07-03 14:25:39,https://www.designboom.com/readers/dima-yarovinsky-visualizes-facebook-instagram-snapchat-terms-of-service-05-07-2018/,https://www.reddit.com/r/dataisbeautiful/comments/8vslrm/visualization_of_the_length_of_terms_of_services/,13,13,,4,visualization of the length of terms of services of large corporations like facebook and instagram,2018-07-0050.jpg
This ESPN analyst comes closest to what the median Twitter verified user looks like,bansalsamarth,2018-07-03 14:39:02,https://medium.com/@bansalsamarth/this-espn-analyst-comes-closest-to-what-the-median-twitter-verified-user-looks-like-c1818aafc6e7,https://www.reddit.com/r/dataisbeautiful/comments/8vspg0/this_espn_analyst_comes_closest_to_what_the/,3,3,,1,This ESPN analyst comes closest to what the median Twitter verified user looks like,2018-07-0051.jpg
Breaking Down Crime In The Safest And Most Dangerous Cities In America [OC],kolz13,2018-07-03 16:12:29,https://i.redd.it/4bl1u388cr711.jpg,https://www.reddit.com/r/dataisbeautiful/comments/8vtgc1/breaking_down_crime_in_the_safest_and_most/,76,76,,40,Breaking Down Crime In The Safest And Most Dangerous Cities In America OC,2018-07-0052.jpg
The Cost of Communication: Cost of In-State Calls from Prison vs. Household Income [OC],michaelalwill,2018-07-03 16:16:14,https://i.imgur.com/4XO1LOl.jpg,https://www.reddit.com/r/dataisbeautiful/comments/8vthfb/the_cost_of_communication_cost_of_instate_calls/,18,18,,7,The Cost of Communication Cost of In-State Calls from Prison vs. Household Income OC,2018-07-0053.jpg
[OC] The Ratio of Gen. 1 - 6 Pokemon Types,LeaderKimJungUn,2018-07-03 16:35:02,https://i.redd.it/o5ud9bk4gr711.jpg,https://www.reddit.com/r/dataisbeautiful/comments/8vtn08/oc_the_ratio_of_gen_1_6_pokemon_types/,9,9,,12,OC The Ratio of Gen. 1 - 6 Pokemon Types,2018-07-0054.jpg
A Diagram of All the Batteries,dwaxe,2018-07-03 18:56:26,https://flowingdata.com/2018/07/03/a-diagram-of-all-the-batteries/,https://www.reddit.com/r/dataisbeautiful/comments/8vutfp/a_diagram_of_all_the_batteries/,8,8,,3,A Diagram of All the Batteries,2018-07-0055.jpg
An interactive map showing the location of nearby defibrillators that are ready to use in an emergency- saving you precious time recuscitating the casualty. (UK),mitchanium,2018-07-03 19:03:04,http://www.heartsafe.org.uk/AED-Locations,https://www.reddit.com/r/dataisbeautiful/comments/8vuvg0/an_interactive_map_showing_the_location_of_nearby/,1,1,,0,An interactive map showing the location of nearby defibrillators that are ready to use in an emergency- saving you precious time recuscitating the cas,2018-07-0056.jpg
My phone data usage over the last three months [OC],20-CharactersAllowed,2018-07-03 20:17:15,https://i.redd.it/svqv7cxwis711.png,https://www.reddit.com/r/dataisbeautiful/comments/8vvgjs/my_phone_data_usage_over_the_last_three_months_oc/,14,14,,7,My phone data usage over the last three months OC,2018-07-0057.png
Penalty shootout success rate (for soccer/football) [OC],Rodiran,2018-07-03 21:20:51,https://i.redd.it/bcjem8z8vs711.png,https://www.reddit.com/r/dataisbeautiful/comments/8vvy4u/penalty_shootout_success_rate_for_soccerfootball/,0,0,,4,Penalty shootout success rate (for soccerfootball) OC,2018-07-0058.png
Altitudes of Solar System versus time of the night [OC],w6equj5,2018-07-04 00:22:49,https://imgur.com/wewQQ44,https://www.reddit.com/r/dataisbeautiful/comments/8vx990/altitudes_of_solar_system_versus_time_of_the/,10,10,,8,Altitudes of Solar System versus time of the night OC,2018-07-0059.jpg
"our busiest day ever. 202,157 flights tracked in Single day via Flight Radar",raoolp,2018-07-04 05:59:07,https://twitter.com/flightradar24/status/1013088775973556224,https://www.reddit.com/r/dataisbeautiful/comments/8vzau4/our_busiest_day_ever_202157_flights_tracked_in/,674,674,,81,"our busiest day ever. 202,157 flights tracked in Single day via Flight Radar",2018-07-0060.jpg
What kind of fireworks do Americans use on the Fourth of July? [OC],antirabbit,2018-07-04 12:25:18,https://maxcandocia.com/article/2018/Jul/02/fourth-of-july-fireworks/,https://www.reddit.com/r/dataisbeautiful/comments/8w191v/what_kind_of_fireworks_do_americans_use_on_the/,4,4,,5,What kind of fireworks do Americans use on the Fourth of July OC,2018-07-0061.jpg
How many people are injured by fireworks each year? [OC],OverflowDs,2018-07-04 12:41:12,https://overflow.solutions/special-projects/how-many-people-are-injured-by-fireworks-each-year/,https://www.reddit.com/r/dataisbeautiful/comments/8w1ccs/how_many_people_are_injured_by_fireworks_each/,11,11,,7,How many people are injured by fireworks each year OC,2018-07-0062.jpg
Average coins and notes in wallet for worlds top 20 currencies [OC],chinguetti,2018-07-04 14:18:43,https://i.redd.it/d7erx58lwx711.png,https://www.reddit.com/r/dataisbeautiful/comments/8w1ys9/average_coins_and_notes_in_wallet_for_worlds_top/,14,14,,9,Average coins and notes in wallet for worlds top 20 currencies OC,2018-07-0063.png
I decided to do one of those color coded mode diaries. Here's how I'm doing now that we're halfway through the year. [OC],whamber,2018-07-04 14:58:27,https://i.redd.it/iy600cak3y711.png,https://www.reddit.com/r/dataisbeautiful/comments/8w28wd/i_decided_to_do_one_of_those_color_coded_mode/,195,195,,32,I decided to do one of those color coded mode diaries. Here's how I'm doing now that we're halfway through the year. OC,2018-07-0064.png
Animation of a World Cup goal (Belgium's third against Japan) focusing on a player's off the ball movement [OC],rjtavares,2018-07-04 16:12:59,https://streamable.com/wjlkl,https://www.reddit.com/r/dataisbeautiful/comments/8w2t5n/animation_of_a_world_cup_goal_belgiums_third/,68,68,,8,Animation of a World Cup goal (Belgium's third against Japan) focusing on a player's off the ball movement OC,2018-07-0065.jpg
How popular was your name in Victorian Britain? Flourish-based interactive visualisation of 22 million historical baby name records.,duncanclark,2018-07-04 16:35:06,https://demos.flourish.studio/namehistory/,https://www.reddit.com/r/dataisbeautiful/comments/8w2zam/how_popular_was_your_name_in_victorian_britain/,19,19,,2,How popular was your name in Victorian Britain Flourish-based interactive visualisation of 22 million historical baby name records.,2018-07-0066.jpg
Malefactors of airliner shootdown incidents 1938-2014 [OC],cyberanakinvader,2018-07-04 16:38:52,https://i.redd.it/omztsfnuly711.png,https://www.reddit.com/r/dataisbeautiful/comments/8w30f9/malefactors_of_airliner_shootdown_incidents/,0,0,,15,Malefactors of airliner shootdown incidents 1938-2014 OC,2018-07-0067.png
How popular was your name in Victorian Britain? Flourish-based interactive visualisation of 22 million historical baby name records. [OC],duncanclark,2018-07-04 16:45:33,https://demos.flourish.studio/namehistory/,https://www.reddit.com/r/dataisbeautiful/comments/8w32cc/how_popular_was_your_name_in_victorian_britain/,2,2,,3,How popular was your name in Victorian Britain Flourish-based interactive visualisation of 22 million historical baby name records. OC,2018-07-0068.jpg
Travelscope – Interactive worldmap of visa-free travel – A Chrome Experiment,yaph,2018-07-04 19:27:30,https://www.markuslerner.com/travelscope/,https://www.reddit.com/r/dataisbeautiful/comments/8w4abx/travelscope_interactive_worldmap_of_visafree/,17,17,,0,Travelscope – Interactive worldmap of visa-free travel – A Chrome Experiment,2018-07-0069.jpg
"My 3rd beermile, new PR! [OC]",butwhysirr,2018-07-04 22:20:09,https://i.redd.it/n0b4xii9a0811.png,https://www.reddit.com/r/dataisbeautiful/comments/8w5j4k/my_3rd_beermile_new_pr_oc/,11,11,,3,"My 3rd beermile, new PR! OC",2018-07-0070.png
