title,author,created_date,url,full_permalink,score,ups,downs,num_comments,sanitized_title,image_file
What I'm most likely to be doing at any time on a given day [OC],crunchwrapsupreezy,2019-01-01 00:09:44,https://i.redd.it/0s5bnw45ep721.png,https://www.reddit.com/r/dataisbeautiful/comments/abcxuz/what_im_most_likely_to_be_doing_at_any_time_on_a/,17,17,,6,What I'm most likely to be doing at any time on a given day OC,2019-01-0000.png
I tracked every episode I watched and series I completed in 2018 [OC],ValiantSerpant,2019-01-01 00:31:32,https://imgur.com/a/bVOKOyA,https://www.reddit.com/r/dataisbeautiful/comments/abd550/i_tracked_every_episode_i_watched_and_series_i/,1,1,,4,I tracked every episode I watched and series I completed in 2018 OC,2019-01-0001.jpg
Palette of Pollution [OC],gurmanbh,2019-01-01 00:42:01,https://graphics.reuters.com/INDIA-POLLUTION/010081VR3BW/index.html,https://www.reddit.com/r/dataisbeautiful/comments/abd8dw/palette_of_pollution_oc/,3,3,,4,Palette of Pollution OC,2019-01-0002.jpg
I kept track of how many unique puns I made each day in 2018. I made 888 in total [OC],WeegeeFett,2019-01-01 02:06:39,https://i.redd.it/8jrgk8m1zp721.png,https://www.reddit.com/r/dataisbeautiful/comments/abdx6k/i_kept_track_of_how_many_unique_puns_i_made_each/,28,28,,10,I kept track of how many unique puns I made each day in 2018. I made 888 in total OC,2019-01-0003.png
I recorded every hour of my life in 2018 [OC],Kamikurin,2019-01-01 03:45:41,https://i.redd.it/jljofdvggq721.png,https://www.reddit.com/r/dataisbeautiful/comments/abemlp/i_recorded_every_hour_of_my_life_in_2018_oc/,24,24,,10,I recorded every hour of my life in 2018 OC,2019-01-0004.png
[OC] Deaths From Car Accidents on New Year's by Hour,SmirkyGraphs,2019-01-01 03:46:16,https://i.imgur.com/ED5wARB.png,https://www.reddit.com/r/dataisbeautiful/comments/abemqu/oc_deaths_from_car_accidents_on_new_years_by_hour/,3498,3498,,101,OC Deaths From Car Accidents on New Year's by Hour,2019-01-0005.png
[OC] I recorded every hour of my 2018 in Google Sheets,JackPhoto97,2019-01-01 04:28:07,https://i.redd.it/3rne73ohoq721.jpg,https://www.reddit.com/r/dataisbeautiful/comments/abex63/oc_i_recorded_every_hour_of_my_2018_in_google/,14,14,,6,OC I recorded every hour of my 2018 in Google Sheets,2019-01-0006.jpg
[OC] Trend for usage of words 'Bear' & 'Bull' in /r/CryptoCurrency Comments for 2018,DownUnderDataSci,2019-01-01 04:43:36,https://imgur.com/gallery/WxLGQQi,https://www.reddit.com/r/dataisbeautiful/comments/abf0yx/oc_trend_for_usage_of_words_bear_bull_in/,2,2,,2,OC Trend for usage of words 'Bear' & 'Bull' in rCryptoCurrency Comments for 2018,2019-01-0007.jpg
[OC] I recorded my daily mood from every 2018 day,RaioMagikarpBR,2019-01-01 04:53:08,https://i.redd.it/3tfputhkrq721.png,https://www.reddit.com/r/dataisbeautiful/comments/abf39w/oc_i_recorded_my_daily_mood_from_every_2018_day/,5,5,,5,OC I recorded my daily mood from every 2018 day,2019-01-0008.png
Burgers eaten in 2018 [OC],OnIowa,2019-01-01 05:03:11,https://i.redd.it/85hv46cmuq721.jpg,https://www.reddit.com/r/dataisbeautiful/comments/abf6cj/burgers_eaten_in_2018_oc/,55,55,,17,Burgers eaten in 2018 OC,2019-01-0009.jpg
[OC] I charted my first full year of investing compared against various indices,itstrider,2019-01-01 05:48:19,https://i.redd.it/3m2l83dr2r721.png,https://www.reddit.com/r/dataisbeautiful/comments/abfjmr/oc_i_charted_my_first_full_year_of_investing/,28,28,,15,OC I charted my first full year of investing compared against various indices,2019-01-0010.png
[OC] I analyzed my step activity for 2018 (full description and link to data in the comments),Songs4Soulsma,2019-01-01 06:40:58,https://i.redd.it/rtjo3r57cr721.jpg,https://www.reddit.com/r/dataisbeautiful/comments/abfxca/oc_i_analyzed_my_step_activity_for_2018_full/,2,2,,2,OC I analyzed my step activity for 2018 (full description and link to data in the comments),2019-01-0011.jpg
"[OC] Late for the ride, but I recorded every hour of my 2018!",Skittlethrill,2019-01-01 08:30:14,https://i.redd.it/km3jnk1ivr721.jpg,https://www.reddit.com/r/dataisbeautiful/comments/abglhf/oc_late_for_the_ride_but_i_recorded_every_hour_of/,10,10,,8,"OC Late for the ride, but I recorded every hour of my 2018!",2019-01-0012.jpg
"Bell curve of the times of my 3,495 Rubik's cube solves, plotted by frequency of each second mark [OC]",oi_peiD,2019-01-01 11:36:35,https://i.redd.it/mzrm0rnoss721.png,https://www.reddit.com/r/dataisbeautiful/comments/abhkjq/bell_curve_of_the_times_of_my_3495_rubiks_cube/,22,22,,12,"Bell curve of the times of my 3,495 Rubik's cube solves, plotted by frequency of each second mark OC",2019-01-0013.png
[OC] A visualisation of how I felt throughout 2018,LeChatParle,2019-01-01 11:49:14,https://i.redd.it/z7so5g4vus721.png,https://www.reddit.com/r/dataisbeautiful/comments/abhmzq/oc_a_visualisation_of_how_i_felt_throughout_2018/,15146,15146,,462,OC A visualisation of how I felt throughout 2018,2019-01-0014.png
[OC] My Alcohol Consumption For 2018.,gonzo_rulz,2019-01-01 12:52:46,https://imgur.com/a/pv7Crhd,https://www.reddit.com/r/dataisbeautiful/comments/abhzb5/oc_my_alcohol_consumption_for_2018/,0,0,,7,OC My Alcohol Consumption For 2018.,2019-01-0015.jpg
[OC] Football matchs watched trough the year 2018,question_everyday,2019-01-01 13:05:31,https://i.redd.it/kp4bvxzo8t721.png,https://www.reddit.com/r/dataisbeautiful/comments/abi1ye/oc_football_matchs_watched_trough_the_year_2018/,0,0,,4,OC Football matchs watched trough the year 2018,2019-01-0016.png
[OC] Every Mood of Every Day I Had In 2018,lukethat,2019-01-01 13:40:35,https://i.redd.it/xsq4qy12ft721.png,https://www.reddit.com/r/dataisbeautiful/comments/abi97g/oc_every_mood_of_every_day_i_had_in_2018/,34,34,,17,OC Every Mood of Every Day I Had In 2018,2019-01-0017.png
[OC] Gender make-up of state Supreme Courts from Jan 2019,oze385,2019-01-01 15:19:57,https://i.redd.it/6t9hvxlxvt721.png,https://www.reddit.com/r/dataisbeautiful/comments/abiw9a/oc_gender_makeup_of_state_supreme_courts_from_jan/,17,17,,11,OC Gender make-up of state Supreme Courts from Jan 2019,2019-01-0018.png
[OC] My last 300 flights,_noel,2019-01-01 15:20:59,https://v.redd.it/z55bd3ilwt721,https://www.reddit.com/r/dataisbeautiful/comments/abiwcn/oc_my_last_300_flights/,1523,1523,,116,OC My last 300 flights,2019-01-0019.png
[OC] I recorded every hour of my 2018,mateusbandeiraa,2019-01-01 15:42:46,https://i.redd.it/qab4sz6nzt721.png,https://www.reddit.com/r/dataisbeautiful/comments/abj26u/oc_i_recorded_every_hour_of_my_2018/,11,11,,10,OC I recorded every hour of my 2018,2019-01-0020.png
[OC] Beers I Drank In 2018,TheBaneOfTheInternet,2019-01-01 16:05:19,https://i.redd.it/iajxf0pr1u721.png,https://www.reddit.com/r/dataisbeautiful/comments/abj8n4/oc_beers_i_drank_in_2018/,41,41,,17,OC Beers I Drank In 2018,2019-01-0021.png
Chart of the day (century?): Price changes 1997 to 2017,caudron,2019-01-01 16:53:34,https://twitter.com/Mark_J_Perry/status/959095271916490752,https://www.reddit.com/r/dataisbeautiful/comments/abjmxg/chart_of_the_day_century_price_changes_1997_to/,42,42,,18,Chart of the day (century) Price changes 1997 to 2017,2019-01-0022.jpg
I tracked my habits of 2018 [OC],mezod,2019-01-01 16:57:22,https://i.redd.it/cavypr95eu721.png,https://www.reddit.com/r/dataisbeautiful/comments/abjo3v/i_tracked_my_habits_of_2018_oc/,25,25,,12,I tracked my habits of 2018 OC,2019-01-0023.png
[OC] Every hour of my 2018 graphically represented,JDwight53,2019-01-01 17:11:25,https://i.redd.it/io8lznijgu721.jpg,https://www.reddit.com/r/dataisbeautiful/comments/abjsiq/oc_every_hour_of_my_2018_graphically_represented/,17,17,,10,OC Every hour of my 2018 graphically represented,2019-01-0024.jpg
[oc] My 2018 in Pixels,internetti_spaghetti,2019-01-01 18:59:56,https://i.imgur.com/TseWgMh.jpg,https://www.reddit.com/r/dataisbeautiful/comments/abksc9/oc_my_2018_in_pixels/,10,10,,8,oc My 2018 in Pixels,2019-01-0025.jpg
[OC] One Month's Worth of NYC expenses,SeveralJob,2019-01-01 19:12:06,https://i.redd.it/vv6myfii1v721.png,https://www.reddit.com/r/dataisbeautiful/comments/abkwfy/oc_one_months_worth_of_nyc_expenses/,6,6,,16,OC One Month's Worth of NYC expenses,2019-01-0026.png
"[OC] Here is my 2018, pixelated.",MendiPont,2019-01-01 19:30:00,https://i.redd.it/ao60z72e5v721.jpg,https://www.reddit.com/r/dataisbeautiful/comments/abl2i3/oc_here_is_my_2018_pixelated/,18,18,,16,"OC Here is my 2018, pixelated.",2019-01-0027.jpg
Steps Taken in 2018 [OC],MTnMan10,2019-01-01 19:30:55,https://i.redd.it/ymmhv1of5v721.png,https://www.reddit.com/r/dataisbeautiful/comments/abl2vn/steps_taken_in_2018_oc/,3,3,,10,Steps Taken in 2018 OC,2019-01-0028.png
I recorded my entire 2018 life.,Gumbasketball99,2019-01-01 19:42:11,https://docs.google.com/spreadsheets/d/1cXJsCXjBoHhMg5r1WEtA15BCLU04I2Nx1pm9E9GOxzk,https://www.reddit.com/r/dataisbeautiful/comments/abl6qs/i_recorded_my_entire_2018_life/,3,3,,2,I recorded my entire 2018 life.,2019-01-0029.jpg
[OC] I recorded how I felt about each day in 2018,oph7831,2019-01-01 19:47:53,https://i.redd.it/6dtgiodg3v721.jpg,https://www.reddit.com/r/dataisbeautiful/comments/abl8ps/oc_i_recorded_how_i_felt_about_each_day_in_2018/,12,12,,12,OC I recorded how I felt about each day in 2018,2019-01-0030.jpg
This years tracking statistic of my ADS-B antenna on my roof. [OC],TheFox720p,2019-01-01 19:54:28,https://i.redd.it/ofecjxkh9v721.jpg,https://www.reddit.com/r/dataisbeautiful/comments/ablaxz/this_years_tracking_statistic_of_my_adsb_antenna/,1,1,,4,This years tracking statistic of my ADS-B antenna on my roof. OC,2019-01-0031.jpg
My 2018 fitbit sleep data [OC],cliff14,2019-01-01 20:36:37,https://imgur.com/g8ZHhK3,https://www.reddit.com/r/dataisbeautiful/comments/ablpow/my_2018_fitbit_sleep_data_oc/,0,0,,4,My 2018 fitbit sleep data OC,2019-01-0032.jpg
Every Hour of my Life in 2018 Documented [OC],AProx221,2019-01-01 21:05:49,https://i.redd.it/93doj62dmv721.jpg,https://www.reddit.com/r/dataisbeautiful/comments/ablzn6/every_hour_of_my_life_in_2018_documented_oc/,13,13,,9,Every Hour of my Life in 2018 Documented OC,2019-01-0033.jpg
"[OC] Inspired by a post from last year, I documented my daily emotions in 2018",Based_Fermata,2019-01-01 21:20:06,https://i.redd.it/xm3e9ed4ov721.png,https://www.reddit.com/r/dataisbeautiful/comments/abm4je/oc_inspired_by_a_post_from_last_year_i_documented/,4,4,,5,"OC Inspired by a post from last year, I documented my daily emotions in 2018",2019-01-0034.png
"2018 Cincinnati, OH Temperatures with 10-Day Weather.com Forecast [OC]",sgtpowerpickle,2019-01-01 22:10:21,https://i.redd.it/45xzk21xxv721.png,https://www.reddit.com/r/dataisbeautiful/comments/abmldk/2018_cincinnati_oh_temperatures_with_10day/,10,10,,6,"2018 Cincinnati, OH Temperatures with 10-Day Weather.com Forecast OC",2019-01-0035.png
"""House of Cards"" IDMB Ratings by Episode [OC]",serpentinestats,2019-01-01 22:48:11,https://i.redd.it/1d2zug9o4w721.png,https://www.reddit.com/r/dataisbeautiful/comments/abmxsg/house_of_cards_idmb_ratings_by_episode_oc/,17746,17746,,1033,House of Cards IDMB Ratings by Episode OC,2019-01-0036.png
[OC] A visualisation of abstraction in word problems for algebra learners,mjl2009,2019-01-01 23:06:27,https://i.redd.it/l7vigd717w721.png,https://www.reddit.com/r/dataisbeautiful/comments/abn3sm/oc_a_visualisation_of_abstraction_in_word/,9,9,,12,OC A visualisation of abstraction in word problems for algebra learners,2019-01-0037.png
[OC] This is why Email Filters are Important - A Breakdown of my University Emails in 2018,EricJEarley,2019-01-01 23:58:10,https://i.redd.it/cemosheggw721.png,https://www.reddit.com/r/dataisbeautiful/comments/abnkqn/oc_this_is_why_email_filters_are_important_a/,22,22,,8,OC This is why Email Filters are Important - A Breakdown of my University Emails in 2018,2019-01-0038.png
[OC] I number crunched every hour of my 2018.,carsnip,2019-01-02 00:42:45,https://i.redd.it/wz2eil66pw721.png,https://www.reddit.com/r/dataisbeautiful/comments/abnz2w/oc_i_number_crunched_every_hour_of_my_2018/,8,8,,4,OC I number crunched every hour of my 2018.,2019-01-0039.png
[OC] I Suck At Fantasy Football: My DFS Account Balance Through The 2018 NFL Season,MastrOfNone,2019-01-02 00:44:00,https://i.redd.it/bmah33wtow721.png,https://www.reddit.com/r/dataisbeautiful/comments/abnzg9/oc_i_suck_at_fantasy_football_my_dfs_account/,13,13,,4,OC I Suck At Fantasy Football My DFS Account Balance Through The 2018 NFL Season,2019-01-0040.png
[OC] Visualization of Grandfather's Temperature Data 1981-2018,adamkriegel,2019-01-02 00:48:50,https://i.redd.it/3kibehuwpw721.png,https://www.reddit.com/r/dataisbeautiful/comments/abo0ys/oc_visualization_of_grandfathers_temperature_data/,24,24,,14,OC Visualization of Grandfather's Temperature Data 1981-2018,2019-01-0041.png
All LeBron James's shots charted on the court,the1_2kid,2019-01-02 01:06:30,http://www.espn.com/nba/story/_/id/25649207/lebron-james-23039-career-shots-one-graphic-nba?fbclid=IwAR04KsKeeKUmREFg5ljk-GLBov65JlGbZ98OmBvY2aqoDVU_lKWtItVGXCY,https://www.reddit.com/r/dataisbeautiful/comments/abo6i7/all_lebron_jamess_shots_charted_on_the_court/,3,3,,2,All LeBron James's shots charted on the court,2019-01-0042.jpg
The average amount spent on Christmas gifts in the U.S. [OC],ComicKnightZero,2019-01-02 02:23:17,https://i.redd.it/4z86fztc3x721.png,https://www.reddit.com/r/dataisbeautiful/comments/abotyt/the_average_amount_spent_on_christmas_gifts_in/,20,20,,14,The average amount spent on Christmas gifts in the U.S. OC,2019-01-0043.png
An attempt to visualize sail data in a useful way... [OC],InsuredApple,2019-01-02 02:24:43,https://i.redd.it/qjydnise5x721.png,https://www.reddit.com/r/dataisbeautiful/comments/aboueh/an_attempt_to_visualize_sail_data_in_a_useful_way/,1,1,,5,An attempt to visualize sail data in a useful way... OC,2019-01-0044.png
[OC] My weightlifting progress in 2018,dooley211,2019-01-02 03:36:58,https://i.redd.it/6rwe1xgwgx721.png,https://www.reddit.com/r/dataisbeautiful/comments/abpfmb/oc_my_weightlifting_progress_in_2018/,10,10,,6,OC My weightlifting progress in 2018,2019-01-0045.png
Visualization of Taco Bell’s if they were connected by rail in the SF Bay Area,idarwishman,2019-01-02 04:00:32,https://www.reddit.com/r/subwaysubway/comments/abnblz/san_francisco_bay_area_taco_bell/?st=JQENKU72&sh=43dfed8d,https://www.reddit.com/r/dataisbeautiful/comments/abpmhp/visualization_of_taco_bells_if_they_were/,8,8,,3,Visualization of Taco Bell’s if they were connected by rail in the SF Bay Area,2019-01-0046.png
[OC] Originality of the Top 25 Highest Grossing Film By Year (Domestic),rewindturtle,2019-01-02 07:43:05,https://i.redd.it/9ktl1zk2sy721.jpg,https://www.reddit.com/r/dataisbeautiful/comments/abr95u/oc_originality_of_the_top_25_highest_grossing/,74,74,,24,OC Originality of the Top 25 Highest Grossing Film By Year (Domestic),2019-01-0047.jpg
"[OC] My 2018 Mood Tracker tracking a rating number and a ""feeling"" value",daveyb86,2019-01-02 10:48:09,https://i.redd.it/z7xfuduilz721.png,https://www.reddit.com/r/dataisbeautiful/comments/absclo/oc_my_2018_mood_tracker_tracking_a_rating_number/,16,16,,13,OC My 2018 Mood Tracker tracking a rating number and a feeling value,2019-01-0048.png
2018 : I tracked my mood every day for another year [OC],Dysona,2019-01-02 11:37:07,https://i.redd.it/ceishay9xz721.jpg,https://www.reddit.com/r/dataisbeautiful/comments/absn9o/2018_i_tracked_my_mood_every_day_for_another_year/,15,15,,15,2018 I tracked my mood every day for another year OC,2019-01-0049.jpg
A review of what ˜50k SGD bought me in 2018 (Singapore) [OC],frasola93,2019-01-02 12:46:09,https://i.redd.it/m2l6cfs8a0821.png,https://www.reddit.com/r/dataisbeautiful/comments/abt3cv/a_review_of_what_50k_sgd_bought_me_in_2018/,71,71,,37,A review of what ˜50k SGD bought me in 2018 (Singapore) OC,2019-01-0050.png
"A comparison of my coloured ""mood chart"" visualised as a pie chart between 17/18 and 18/19. Raw data in comments. [OC]",deliberatelyanon2,2019-01-02 13:07:34,https://i.redd.it/qvl5c4elc0821.png,https://www.reddit.com/r/dataisbeautiful/comments/abt8wg/a_comparison_of_my_coloured_mood_chart_visualised/,12,12,,11,A comparison of my coloured mood chart visualised as a pie chart between 1718 and 1819. Raw data in comments. OC,2019-01-0051.png
I recorded my sleep this year as I transitioned from high school to college [OC],himynameissid,2019-01-02 15:07:05,https://imgur.com/a/h2GQ9jS,https://www.reddit.com/r/dataisbeautiful/comments/abu61q/i_recorded_my_sleep_this_year_as_i_transitioned/,6,6,,9,I recorded my sleep this year as I transitioned from high school to college OC,2019-01-0052.jpg
MLB Team Payroll History [OC],TroublesomeKangaroo,2019-01-02 15:27:49,https://imgur.com/HQG6ihg,https://www.reddit.com/r/dataisbeautiful/comments/abucir/mlb_team_payroll_history_oc/,6389,6389,,307,MLB Team Payroll History OC,2019-01-0053.jpg
[OC] United States orbital launches 1957-2010,youzicha,2019-01-02 15:31:16,https://i.redd.it/n31yx0sl31821.png,https://www.reddit.com/r/dataisbeautiful/comments/abudlv/oc_united_states_orbital_launches_19572010/,21,21,,9,OC United States orbital launches 1957-2010,2019-01-0054.png
US Births By Day 1994-2014 [OC],flerlagekr,2019-01-02 15:44:04,https://public.tableau.com/shared/PRMR3BXN2?:display_count=yes,https://www.reddit.com/r/dataisbeautiful/comments/abuhho/us_births_by_day_19942014_oc/,18,18,,21,US Births By Day 1994-2014 OC,2019-01-0055.jpg
The Evolution of My Musical Preferences (2012-18) [OC],St_ElmosFire,2019-01-02 17:29:13,https://i.redd.it/lgmi5rfro1821.jpg,https://www.reddit.com/r/dataisbeautiful/comments/abvhaj/the_evolution_of_my_musical_preferences_201218_oc/,5,5,,25,The Evolution of My Musical Preferences (2012-18) OC,2019-01-0056.jpg
My Weight over the last 10 years [OC],Spanky2k,2019-01-02 17:33:55,https://imgur.com/a/kiEMhGH,https://www.reddit.com/r/dataisbeautiful/comments/abviz2/my_weight_over_the_last_10_years_oc/,22,22,,12,My Weight over the last 10 years OC,2019-01-0057.jpg
"Over the past year, I kept track of my sleep patterns every day. Here's a brief analysis of the results. [OC]",picsnipe,2019-01-02 17:35:15,https://i.redd.it/0sceakyzj1821.png,https://www.reddit.com/r/dataisbeautiful/comments/abvjgw/over_the_past_year_i_kept_track_of_my_sleep/,11,11,,6,"Over the past year, I kept track of my sleep patterns every day. Here's a brief analysis of the results. OC",2019-01-0058.png
"[OC] I pooped 1,431 times in the last 3 years. Here is detailed data on every single one of them.",tomhawk69,2019-01-02 18:29:14,https://imgur.com/a/nfGMZfo,https://www.reddit.com/r/dataisbeautiful/comments/abw2xq/oc_i_pooped_1431_times_in_the_last_3_years_here/,20,20,,16,"OC I pooped 1,431 times in the last 3 years. Here is detailed data on every single one of them.",2019-01-0059.jpg
[OC] The life of a 1st year PhD Student,The-Angus-Burger,2019-01-02 18:31:46,https://imgur.com/a/RWtZX1Z,https://www.reddit.com/r/dataisbeautiful/comments/abw3wp/oc_the_life_of_a_1st_year_phd_student/,50,50,,18,OC The life of a 1st year PhD Student,2019-01-0060.jpg
[OC] My 2018 NFL pick'em results vs expected,CastleRock_,2019-01-02 18:53:39,https://i.redd.it/czg3edib32821.png,https://www.reddit.com/r/dataisbeautiful/comments/abwc7l/oc_my_2018_nfl_pickem_results_vs_expected/,8,8,,7,OC My 2018 NFL pick'em results vs expected,2019-01-0061.png
"My goal of working out 200 times in 2018, visualized [OC]",YuckFourself,2019-01-02 19:56:03,https://imgur.com/gallery/AtGyAlB,https://www.reddit.com/r/dataisbeautiful/comments/abwzva/my_goal_of_working_out_200_times_in_2018/,4,4,,5,"My goal of working out 200 times in 2018, visualized OC",2019-01-0062.jpg
"[OC] I failed to achieve last year's resolution, but I still see it as a win. 2019 here I come!",Doppelkecks,2019-01-02 20:07:16,https://i.redd.it/1ghzd9n4f2821.png,https://www.reddit.com/r/dataisbeautiful/comments/abx4bv/oc_i_failed_to_achieve_last_years_resolution_but/,27,27,,9,"OC I failed to achieve last year's resolution, but I still see it as a win. 2019 here I come!",2019-01-0063.png
"[OC] New job means a new schedule, wanted to get a concept of what my week will look like with a shorter commute. How do you break down your week?",illneedaname,2019-01-02 21:23:44,https://i.redd.it/zuyl40kgt2821.jpg,https://www.reddit.com/r/dataisbeautiful/comments/abxwpk/oc_new_job_means_a_new_schedule_wanted_to_get_a/,8,8,,5,"OC New job means a new schedule, wanted to get a concept of what my week will look like with a shorter commute. How do you break down your week",2019-01-0064.jpg
Mapping out Dave Portnoy's 'onebite' pizza reviews from Barstool sports - Microsoft Power BI [OC],mssqlsage,2019-01-02 22:17:32,http://www.libertybrewtours.com/project-portnoy/,https://www.reddit.com/r/dataisbeautiful/comments/abyghf/mapping_out_dave_portnoys_onebite_pizza_reviews/,19,19,,6,Mapping out Dave Portnoy's 'onebite' pizza reviews from Barstool sports - Microsoft Power BI OC,2019-01-0065.jpg
In 2018 I challenged myself to run a mile a day and narrowly succeeded [OC],CLBUK,2019-01-02 23:01:46,https://i.redd.it/6alzqw3tb3821.jpg,https://www.reddit.com/r/dataisbeautiful/comments/abywm8/in_2018_i_challenged_myself_to_run_a_mile_a_day/,967,967,,78,In 2018 I challenged myself to run a mile a day and narrowly succeeded OC,2019-01-0066.jpg
Death of the NBA Mid-Range Jumper [OC],bigjoeak,2019-01-02 23:15:15,https://i.redd.it/6yb0k8jce3821.png,https://www.reddit.com/r/dataisbeautiful/comments/abz1fv/death_of_the_nba_midrange_jumper_oc/,15,15,,6,Death of the NBA Mid-Range Jumper OC,2019-01-0067.png
[OC] I moved to London in Fall 2016 - here's my location history on the map of central London,k1ckin,2019-01-02 23:33:18,https://gfycat.com/CraftyVelvetyGeese,https://www.reddit.com/r/dataisbeautiful/comments/abz7uk/oc_i_moved_to_london_in_fall_2016_heres_my/,22,22,,6,OC I moved to London in Fall 2016 - here's my location history on the map of central London,2019-01-0068.jpg
[OC] SodaStream Calculator: When will you break even?,mali_codes,2019-01-02 23:52:51,https://i.redd.it/grw4q1u6l3821.png,https://www.reddit.com/r/dataisbeautiful/comments/abzeqs/oc_sodastream_calculator_when_will_you_break_even/,40,40,,31,OC SodaStream Calculator When will you break even,2019-01-0069.png
[OC] I tracked the monthly plays for my Podcast during my first year.,daithiD,2019-01-03 00:08:01,https://i.redd.it/yzr6sy0xn3821.png,https://www.reddit.com/r/dataisbeautiful/comments/abzjqf/oc_i_tracked_the_monthly_plays_for_my_podcast/,4,4,,5,OC I tracked the monthly plays for my Podcast during my first year.,2019-01-0070.png
Meat vs Smoker temperature on a whole packer 17lb brisket,SoapyNipples,2019-01-03 00:10:32,https://www.reddit.com/r/smoking/comments/abt24x/225hr_smoke_on_a_17lb_brisket/,https://www.reddit.com/r/dataisbeautiful/comments/abzkp6/meat_vs_smoker_temperature_on_a_whole_packer_17lb/,1,1,,1,Meat vs Smoker temperature on a whole packer 17lb brisket,2019-01-0071.jpg
Books I Read in 2018 [OC],NerdyCaptainMal,2019-01-03 00:42:58,https://i.redd.it/93xrxuyqt3821.jpg,https://www.reddit.com/r/dataisbeautiful/comments/abzvnx/books_i_read_in_2018_oc/,9,9,,16,Books I Read in 2018 OC,2019-01-0072.jpg
My Top 10 Bands of 2018 [OC],ArmoredSpearhead,2019-01-03 01:13:06,https://i.redd.it/e00ei6q5z3821.png,https://www.reddit.com/r/dataisbeautiful/comments/ac05rf/my_top_10_bands_of_2018_oc/,6,6,,5,My Top 10 Bands of 2018 OC,2019-01-0073.png
"[OC] A Spreadsheet of my life throughout 2018, broken down hour by hour",Snipshow777,2019-01-03 02:16:02,https://i.redd.it/8bvb1cw984821.jpg,https://www.reddit.com/r/dataisbeautiful/comments/ac0qgx/oc_a_spreadsheet_of_my_life_throughout_2018/,6,6,,17,"OC A Spreadsheet of my life throughout 2018, broken down hour by hour",2019-01-0074.jpg
One year of progress switching from QWERTY to Dvorak [OC],a_silent_bard,2019-01-03 02:18:27,https://i.redd.it/qissd9hza4821.png,https://www.reddit.com/r/dataisbeautiful/comments/ac0r9c/one_year_of_progress_switching_from_qwerty_to/,7,7,,8,One year of progress switching from QWERTY to Dvorak OC,2019-01-0075.png
Repetition pattern of lyrics in a Beatles song. [OC],omgardner,2019-01-03 04:19:46,https://i.redd.it/uhy6vs01w4821.png,https://www.reddit.com/r/dataisbeautiful/comments/ac1uxg/repetition_pattern_of_lyrics_in_a_beatles_song_oc/,10018,10018,,225,Repetition pattern of lyrics in a Beatles song. OC,2019-01-0076.png
Every Hour of an Australian Girl in 2018 Tracked [OC],AdzyPadzy,2019-01-03 07:25:56,https://i.redd.it/hlsdrnfys5821.png,https://www.reddit.com/r/dataisbeautiful/comments/ac3byf/every_hour_of_an_australian_girl_in_2018_tracked/,43,43,,17,Every Hour of an Australian Girl in 2018 Tracked OC,2019-01-0077.png
"Simple data, yet very usefull - How long does apple support older iphones in IOS",QlusiveNL,2019-01-03 07:33:08,https://www.reddit.com/r/iphone/comments/abpghk/does_siri_get_better_with_different_ios_versions/,https://www.reddit.com/r/dataisbeautiful/comments/ac3drd/simple_data_yet_very_usefull_how_long_does_apple/,6,6,,1,"Simple data, yet very usefull - How long does apple support older iphones in IOS",2019-01-0078.jpg
2017 and 2018 Data Comparison of Household Bills [OC],refisherated05,2019-01-03 07:39:16,https://i.redd.it/g63dpf5vq5821.jpg,https://www.reddit.com/r/dataisbeautiful/comments/ac3f74/2017_and_2018_data_comparison_of_household_bills/,5,5,,8,2017 and 2018 Data Comparison of Household Bills OC,2019-01-0079.jpg
[OC] The Rise of Tennis Hero Boris Becker,ltavernier,2019-01-03 09:30:58,https://i.redd.it/kxv7wqxbg6821.jpg,https://www.reddit.com/r/dataisbeautiful/comments/ac453j/oc_the_rise_of_tennis_hero_boris_becker/,2,2,,6,OC The Rise of Tennis Hero Boris Becker,2019-01-0080.jpg
2018 of a relationship in numbers [OC],b1sakher,2019-01-03 10:24:07,https://i.redd.it/rkjd4spcp6821.png,https://www.reddit.com/r/dataisbeautiful/comments/ac4go3/2018_of_a_relationship_in_numbers_oc/,53,53,,21,2018 of a relationship in numbers OC,2019-01-0081.png
