title,author,created_date,url,full_permalink,score,ups,downs,num_comments,sanitized_title,image_file
[OC] The results from u/u/jazzastudios latest choose your own adventure style video (Linked in comments),ThePurpleArcher,2019-01-15 15:35:02,https://i.redd.it/2oq8p4wtula21.png,https://www.reddit.com/r/dataisbeautiful/comments/ag9opo/oc_the_results_from_uujazzastudios_latest_choose/,13,13,,6,OC The results from uujazzastudios latest choose your own adventure style video (Linked in comments),2019-01-0315.png
Messi's 400 goals in La Liga visualised (in spanish),mwouaz,2019-01-15 15:49:41,https://www.mundodeportivo.com/futbol/fc-barcelona/20190115/454142088263/barca-messi.html,https://www.reddit.com/r/dataisbeautiful/comments/ag9ub1/messis_400_goals_in_la_liga_visualised_in_spanish/,4,4,,2,Messi's 400 goals in La Liga visualised (in spanish),2019-01-0316.jpg
Mean age at first marriage in Sweden (1871-2017) [OC],HiddenMarkovModel,2019-01-15 16:05:59,https://i.redd.it/5vd0io2p1ma21.png,https://www.reddit.com/r/dataisbeautiful/comments/aga0jv/mean_age_at_first_marriage_in_sweden_18712017_oc/,118,118,,20,Mean age at first marriage in Sweden (1871-2017) OC,2019-01-0317.png
Shooting Pi - using random sampling to calculate pi by estimating area of a disk [OC],Gedankenfurz,2019-01-15 17:12:09,https://gfycat.com/RigidGrimCalf,https://www.reddit.com/r/dataisbeautiful/comments/agapu1/shooting_pi_using_random_sampling_to_calculate_pi/,95,95,,14,Shooting Pi - using random sampling to calculate pi by estimating area of a disk OC,2019-01-0318.jpg
"[OC] Evaluating the Popular Effect of ""The Egg"" on Wikipedia. Info in comments!",fluidvapor,2019-01-15 17:15:59,https://i.redd.it/kcdxuns2ema21.jpg,https://www.reddit.com/r/dataisbeautiful/comments/agarce/oc_evaluating_the_popular_effect_of_the_egg_on/,7,7,,5,OC Evaluating the Popular Effect of The Egg on Wikipedia. Info in comments!,2019-01-0319.jpg
[OC] Accuracy of Content Published by News Outlets to Facebook Before the 2016 Election,TheGasBoi,2019-01-15 17:27:56,https://i.redd.it/e6ltslvvfma21.jpg,https://www.reddit.com/r/dataisbeautiful/comments/agavzl/oc_accuracy_of_content_published_by_news_outlets/,5,5,,8,OC Accuracy of Content Published by News Outlets to Facebook Before the 2016 Election,2019-01-0320.jpg
My tax summary includes a visualisation of how my income tax was spent,ac07682,2019-01-15 17:46:27,https://i.redd.it/hzc5rjiojma21.jpg,https://www.reddit.com/r/dataisbeautiful/comments/agb34u/my_tax_summary_includes_a_visualisation_of_how_my/,27,27,,20,My tax summary includes a visualisation of how my income tax was spent,2019-01-0321.jpg
"Dialogue analysis of ""The Left/Right Game"" [OC]",andersonjdev,2019-01-15 18:54:07,https://i.redd.it/wablxhectma21.jpg,https://www.reddit.com/r/dataisbeautiful/comments/agbtrp/dialogue_analysis_of_the_leftright_game_oc/,8,8,,5,Dialogue analysis of The LeftRight Game OC,2019-01-0322.jpg
"[oc] Uber eat restaurant popularity in Mooresville, NC",adheisler11,2019-01-15 19:24:48,https://i.redd.it/c40nqde51na21.png,https://www.reddit.com/r/dataisbeautiful/comments/agc5y0/oc_uber_eat_restaurant_popularity_in_mooresville/,8,8,,7,"oc Uber eat restaurant popularity in Mooresville, NC",2019-01-0323.png
[OC] Sports Dynasties,TalkToMeNerdy,2019-01-15 20:02:40,https://i.redd.it/tl33xgsu7na21.png,https://www.reddit.com/r/dataisbeautiful/comments/agclxz/oc_sports_dynasties/,376,376,,62,OC Sports Dynasties,2019-01-0324.png
"[OC] Tennis Prize Money awarded to the US Open Champion went up from 14,000$ to 3.8m$ over 50 years (1968-2018).",whawhawhahello,2019-01-15 22:32:37,https://i.redd.it/5dkxurx8vna21.png,https://www.reddit.com/r/dataisbeautiful/comments/age85a/oc_tennis_prize_money_awarded_to_the_us_open/,10,10,,7,"OC Tennis Prize Money awarded to the US Open Champion went up from 14,000$ to 3.8m$ over 50 years (1968-2018).",2019-01-0325.png
[OC] Does salary impact employee retention? (yes-ish),scottishbee,2019-01-15 23:24:14,https://i.redd.it/1kra59xk7oa21.png,https://www.reddit.com/r/dataisbeautiful/comments/ageqp6/oc_does_salary_impact_employee_retention_yesish/,238,238,,45,OC Does salary impact employee retention (yes-ish),2019-01-0326.png
Comparing US City Street Orientations - Geoff Boeing,Wostear,2019-01-15 23:57:34,https://geoffboeing.com/2018/07/comparing-city-street-orientations/,https://www.reddit.com/r/dataisbeautiful/comments/agf2ga/comparing_us_city_street_orientations_geoff_boeing/,38,38,,3,Comparing US City Street Orientations - Geoff Boeing,2019-01-0327.jpg
Origins of AAF Players by Team [OC],Jman9420,2019-01-16 00:46:00,https://imgur.com/a/UY4U4wi,https://www.reddit.com/r/dataisbeautiful/comments/agfjd0/origins_of_aaf_players_by_team_oc/,1,1,,4,Origins of AAF Players by Team OC,2019-01-0328.jpg
"Australian's attitudes towards Parliament's upper house, the Senate according to The Australia Institute",superegz,2019-01-16 01:26:07,http://www.tai.org.au/node/4909,https://www.reddit.com/r/dataisbeautiful/comments/agfw33/australians_attitudes_towards_parliaments_upper/,3,3,,2,"Australian's attitudes towards Parliament's upper house, the Senate according to The Australia Institute",2019-01-0329.jpg
San Francisco bikeshare activity map [OC],ResidentMario,2019-01-16 01:45:42,http://www.residentmar.io/static/post_assets/ford-go-bike-maps/san-francisco-go-bike.png,https://www.reddit.com/r/dataisbeautiful/comments/agg2fl/san_francisco_bikeshare_activity_map_oc/,44,44,,5,San Francisco bikeshare activity map OC,2019-01-0330.png
'Star Trek: TNG' Characters' Most Distinguishing Words [OC],lolawlol,2019-01-16 03:13:06,https://i.redd.it/sf3yniaqcpa21.png,https://www.reddit.com/r/dataisbeautiful/comments/agguhm/star_trek_tng_characters_most_distinguishing/,36,36,,14,'Star Trek TNG' Characters' Most Distinguishing Words OC,2019-01-0331.png
Daughter's First 100+ Words before 1.5 years old [OC],enidsera,2019-01-16 06:33:10,https://i.redd.it/25u0c9b7aqa21.jpg,https://www.reddit.com/r/dataisbeautiful/comments/agietf/daughters_first_100_words_before_15_years_old_oc/,31,31,,9,Daughter's First 100+ Words before 1.5 years old OC,2019-01-0332.jpg
"Goodbye, Mid-Range Shot",dwaxe,2019-01-16 06:33:16,https://flowingdata.com/2019/01/15/goodbye-mid-range-shot/,https://www.reddit.com/r/dataisbeautiful/comments/agieuf/goodbye_midrange_shot/,6,6,,1,"Goodbye, Mid-Range Shot",2019-01-0333.jpg
"[OC] I visualized the ""show your setup"" trend at r/BeamNG",blijo_,2019-01-16 09:58:13,https://i.redd.it/qqkvu3q0dra21.png,https://www.reddit.com/r/dataisbeautiful/comments/agjnl5/oc_i_visualized_the_show_your_setup_trend_at/,12,12,,6,OC I visualized the show your setup trend at rBeamNG,2019-01-0334.png
Map of annual mean temperature (ZOOM IN to see the values in degree C) [OC],neilrkaye,2019-01-16 11:39:30,https://i.redd.it/plrouey3vra21.jpg,https://www.reddit.com/r/dataisbeautiful/comments/agkbdq/map_of_annual_mean_temperature_zoom_in_to_see_the/,142,142,,13,Map of annual mean temperature (ZOOM IN to see the values in degree C) OC,2019-01-0335.jpg
[OC] Google trends data for 'iPhone slow' Vs. new iOS release dates,DLC204,2019-01-16 12:00:48,https://i.redd.it/f0ttigcjyra21.png,https://www.reddit.com/r/dataisbeautiful/comments/agkgha/oc_google_trends_data_for_iphone_slow_vs_new_ios/,32721,32721,,879,OC Google trends data for 'iPhone slow' Vs. new iOS release dates,2019-01-0336.png
[OC] Sparkbars in Hex Map in Tableau,kschulte_ms,2019-01-16 13:05:32,https://i.redd.it/ihwazcjx9sa21.jpg,https://www.reddit.com/r/dataisbeautiful/comments/agky3d/oc_sparkbars_in_hex_map_in_tableau/,21,21,,9,OC Sparkbars in Hex Map in Tableau,2019-01-0337.jpg
Programming Languages Influence Network based on Wikidata retrieved 2018-12-31 [OC],yaph,2019-01-16 14:10:31,https://i.redd.it/tmj2b53plsa21.png,https://www.reddit.com/r/dataisbeautiful/comments/aglhez/programming_languages_influence_network_based_on/,33,33,,6,Programming Languages Influence Network based on Wikidata retrieved 2018-12-31 OC,2019-01-0338.png
I have tracked every hour of 2018 (template included!) [OC],Cheddarlad,2019-01-16 15:11:37,https://i.redd.it/rrlsepqvwsa21.png,https://www.reddit.com/r/dataisbeautiful/comments/agm1xr/i_have_tracked_every_hour_of_2018_template/,152,152,,36,I have tracked every hour of 2018 (template included!) OC,2019-01-0339.png
Vaccine-preventable disease outbreaks,rigel2112,2019-01-16 18:35:45,http://www.vaccineswork.org/vaccine-preventable-disease-outbreaks/,https://www.reddit.com/r/dataisbeautiful/comments/ago6a7/vaccinepreventable_disease_outbreaks/,28,28,,6,Vaccine-preventable disease outbreaks,2019-01-0340.jpg
Steph Curry's career 3 point shot range - via twitter,austriker27,2019-01-16 18:37:15,https://twitter.com/kirkgoldsberry/status/1085294576917770246?s=19,https://www.reddit.com/r/dataisbeautiful/comments/ago6t1/steph_currys_career_3_point_shot_range_via_twitter/,8,8,,1,Steph Curry's career 3 point shot range - via twitter,2019-01-0341.jpg
"Vote share of largest party (by seats won) in UK elections since 1945, remain(x) is the share of people who voted to remain in the EU in 2016 [OC]",Cravatitude,2019-01-16 18:44:40,https://i.redd.it/w4hglh2gxta21.png,https://www.reddit.com/r/dataisbeautiful/comments/ago9pg/vote_share_of_largest_party_by_seats_won_in_uk/,0,0,,8,"Vote share of largest party (by seats won) in UK elections since 1945, remain(x) is the share of people who voted to remain in the EU in 2016 OC",2019-01-0342.png
Chrome extension to visualize your reading [OC],massanishi,2019-01-16 19:43:27,https://i.redd.it/ne55995c9ua21.png,https://www.reddit.com/r/dataisbeautiful/comments/agovtq/chrome_extension_to_visualize_your_reading_oc/,9,9,,9,Chrome extension to visualize your reading OC,2019-01-0343.png
Witchcraft in U.S. Caselaw,caselawaccess,2019-01-16 21:28:47,https://lil.law.harvard.edu/blog/2018/10/31/witchcraft-in-u-s-caselaw/,https://www.reddit.com/r/dataisbeautiful/comments/agq1s9/witchcraft_in_us_caselaw/,4,4,,1,Witchcraft in U.S. Caselaw,2019-01-0344.jpg
"[OC] Explore Canada's annual GHG emissions data by province, territory and sector between 1990 and 2016",energyinfo-NEB,2019-01-16 22:46:13,http://www.neb-one.gc.ca/nrg/ntgrtd/mrkt/snpsht/2019/01-03cndhstrclghgmssn-eng.html,https://www.reddit.com/r/dataisbeautiful/comments/agqx1t/oc_explore_canadas_annual_ghg_emissions_data_by/,3,3,,6,"OC Explore Canada's annual GHG emissions data by province, territory and sector between 1990 and 2016",2019-01-0345.jpg
[OC] The admins' favourite top 100 subreddits,CustardFilled,2019-01-16 23:19:54,https://i.redd.it/32sjg0opava21.jpg,https://www.reddit.com/r/dataisbeautiful/comments/agr9dm/oc_the_admins_favourite_top_100_subreddits/,29,29,,7,OC The admins' favourite top 100 subreddits,2019-01-0346.jpg
[OC] Visualization of 1D slices of 2D Multivariate Normal Distribution,EricJEarley,2019-01-17 00:36:31,https://v.redd.it/833o2cu1pva21,https://www.reddit.com/r/dataisbeautiful/comments/agrzps/oc_visualization_of_1d_slices_of_2d_multivariate/,61,61,,13,OC Visualization of 1D slices of 2D Multivariate Normal Distribution,2019-01-0347.png
A History of Relegation in the Premier League [OC],senor_bexis,2019-01-17 01:55:21,https://i.redd.it/ituc8txe2wa21.png,https://www.reddit.com/r/dataisbeautiful/comments/agspuz/a_history_of_relegation_in_the_premier_league_oc/,8,8,,5,A History of Relegation in the Premier League OC,2019-01-0348.png
Frequency of words in top 100 pop songs 2018 [OC],son_of_a_byss,2019-01-17 05:46:38,https://i.redd.it/34gn3v539xa21.jpg,https://www.reddit.com/r/dataisbeautiful/comments/aguno3/frequency_of_words_in_top_100_pop_songs_2018_oc/,3298,3298,,261,Frequency of words in top 100 pop songs 2018 OC,2019-01-0349.jpg
Kept track of my credit card debt load for 2018. [OC],MaximiusSirius,2019-01-17 08:02:06,https://imgur.com/a/Vl3Th9i,https://www.reddit.com/r/dataisbeautiful/comments/agvk3m/kept_track_of_my_credit_card_debt_load_for_2018_oc/,3,3,,4,Kept track of my credit card debt load for 2018. OC,2019-01-0350.jpg
Racial Disparities in Illinois Traffic Stops,MollzMP,2019-01-17 08:21:08,https://illinoistrafficstops.com/,https://www.reddit.com/r/dataisbeautiful/comments/agvocq/racial_disparities_in_illinois_traffic_stops/,4,4,,1,Racial Disparities in Illinois Traffic Stops,2019-01-0351.jpg
[OC] Tracking my wealth over the past 22 months as a 15 y/o,another_reddit_user_,2019-01-17 10:16:37,https://i.redd.it/1046l3ztkya21.png,https://www.reddit.com/r/dataisbeautiful/comments/agwd3b/oc_tracking_my_wealth_over_the_past_22_months_as/,172,172,,59,OC Tracking my wealth over the past 22 months as a 15 yo,2019-01-0352.png
Eras of dominance in top flight English football (soccer) (Description in comments) [OC],shlam16,2019-01-17 12:12:14,https://imgur.com/bx7YZqp.png,https://www.reddit.com/r/dataisbeautiful/comments/agx5v9/eras_of_dominance_in_top_flight_english_football/,191,191,,16,Eras of dominance in top flight English football (soccer) (Description in comments) OC,2019-01-0353.png
The Average (Self-Reported) Penis Size by State -- and How Much Men Lie About It,sunnybeachdays4days,2019-01-17 12:57:25,https://www.bespokesurgical.com/2019/01/14/blog-average-penis-size-state/,https://www.reddit.com/r/dataisbeautiful/comments/agxic1/the_average_selfreported_penis_size_by_state_and/,91,91,,20,The Average (Self-Reported) Penis Size by State -- and How Much Men Lie About It,2019-01-0354.jpg
City profiles (city histograms) [OC],dvrnd,2019-01-17 13:02:17,https://i.redd.it/c7vabxtkdza21.png,https://www.reddit.com/r/dataisbeautiful/comments/agxjsm/city_profiles_city_histograms_oc/,31,31,,7,City profiles (city histograms) OC,2019-01-0355.png
[OC] Progression of the record for world's oldest person alive (1955- 2018),Slurpieslurp,2019-01-17 14:17:01,https://i.redd.it/t6d3jpnirza21.png,https://www.reddit.com/r/dataisbeautiful/comments/agy6fk/oc_progression_of_the_record_for_worlds_oldest/,293,293,,50,OC Progression of the record for world's oldest person alive (1955- 2018),2019-01-0356.png
Does undocumented immigration increase violent crime?,draypresct,2019-01-17 15:09:40,https://onlinelibrary.wiley.com/doi/full/10.1111/1745-9125.12175,https://www.reddit.com/r/dataisbeautiful/comments/agyo0w/does_undocumented_immigration_increase_violent/,6,6,,3,Does undocumented immigration increase violent crime,2019-01-0357.jpg
[OC] Visualization of 1D slices of 2D Multivariate Normal Distribution (v2),EricJEarley,2019-01-17 16:26:18,https://v.redd.it/0dgo57eue0b21,https://www.reddit.com/r/dataisbeautiful/comments/agzgcj/oc_visualization_of_1d_slices_of_2d_multivariate/,47,47,,10,OC Visualization of 1D slices of 2D Multivariate Normal Distribution (v2),2019-01-0358.png
What's on the other side of the Earth? Interactive Antipodes Map [OC],EngagingData,2019-01-17 16:58:32,https://engaging-data.com/antipodes-map/,https://www.reddit.com/r/dataisbeautiful/comments/agzsvx/whats_on_the_other_side_of_the_earth_interactive/,158,158,,43,What's on the other side of the Earth Interactive Antipodes Map OC,2019-01-0359.jpg
Summary of many Game of the Year awards 2018 [OC],TheSeahorseHS,2019-01-17 17:19:06,https://i.redd.it/sadl1lado0b21.png,https://www.reddit.com/r/dataisbeautiful/comments/ah00rl/summary_of_many_game_of_the_year_awards_2018_oc/,70,70,,17,Summary of many Game of the Year awards 2018 OC,2019-01-0360.png
[OC] Which CitiBike stations are most used?,mali_codes,2019-01-17 19:05:32,https://i.redd.it/xc0f4jve71b21.png,https://www.reddit.com/r/dataisbeautiful/comments/ah16th/oc_which_citibike_stations_are_most_used/,12,12,,5,OC Which CitiBike stations are most used,2019-01-0361.png
[UPDATE] 3 months of Drinks per Night compared to Level of Happiness [OC],onTheUpUp,2019-01-17 19:45:52,https://i.redd.it/46zxh4iqe1b21.png,https://www.reddit.com/r/dataisbeautiful/comments/ah1mbf/update_3_months_of_drinks_per_night_compared_to/,14,14,,18,UPDATE 3 months of Drinks per Night compared to Level of Happiness OC,2019-01-0362.png
[OC] Trump's most tweeted words: A word cloud of 36K tweets,maksimava,2019-01-17 20:03:42,https://i.redd.it/kv7x7bozh1b21.png,https://www.reddit.com/r/dataisbeautiful/comments/ah1tir/oc_trumps_most_tweeted_words_a_word_cloud_of_36k/,19672,19672,,926,OC Trump's most tweeted words A word cloud of 36K tweets,2019-01-0363.png
[OC] Long-term temperature trends at 338 Canadian climate stations,pmbarks,2019-01-17 21:06:27,https://patrickbarks.github.io/canada-clim/,https://www.reddit.com/r/dataisbeautiful/comments/ah2id0/oc_longterm_temperature_trends_at_338_canadian/,4,4,,5,OC Long-term temperature trends at 338 Canadian climate stations,2019-01-0364.jpg
Number of completed skyscrapers over 700ft in the United States by year [OC],akos_barta,2019-01-17 21:27:06,https://i.redd.it/03e6efshw1b21.png,https://www.reddit.com/r/dataisbeautiful/comments/ah2qfn/number_of_completed_skyscrapers_over_700ft_in_the/,7,7,,3,Number of completed skyscrapers over 700ft in the United States by year OC,2019-01-0365.png
Giraffe population change [OC],ivanesas,2019-01-17 22:26:02,https://i.redd.it/h2nle39l62b21.png,https://www.reddit.com/r/dataisbeautiful/comments/ah3dq2/giraffe_population_change_oc/,32,32,,6,Giraffe population change OC,2019-01-0366.png
[OC] A heat map of Tinder activity using volume of messages sent at each time/date combination from a sample of a group of my friend's Tinder data as a proxy.,jackcballinger,2019-01-17 22:26:41,https://i.redd.it/puon6qzc72b21.png,https://www.reddit.com/r/dataisbeautiful/comments/ah3dy3/oc_a_heat_map_of_tinder_activity_using_volume_of/,16,16,,13,OC A heat map of Tinder activity using volume of messages sent at each timedate combination from a sample of a group of my friend's Tinder data as a p,2019-01-0367.png
"4-variable graph of the US housing market, by state. California is quite the special case! [OC]",nickwarino,2019-01-18 00:26:12,https://i.redd.it/2rco77xss2b21.png,https://www.reddit.com/r/dataisbeautiful/comments/ah4l13/4variable_graph_of_the_us_housing_market_by_state/,18,18,,6,"4-variable graph of the US housing market, by state. California is quite the special case! OC",2019-01-0368.png
Mapping the Chicago Neighborhoods Most at Risk From Pollution,EnigmaTrain,2019-01-18 00:56:12,https://psmag.com/environment/which-chicago-neighborhoods-are-most-at-risk-from-pollution,https://www.reddit.com/r/dataisbeautiful/comments/ah4vbv/mapping_the_chicago_neighborhoods_most_at_risk/,3,3,,2,Mapping the Chicago Neighborhoods Most at Risk From Pollution,2019-01-0369.jpg
Population per Electoral Vote and Party by State 1900-2016 elections [OC],CastleRock_,2019-01-18 02:49:43,https://v.redd.it/ahu047cci3b21,https://www.reddit.com/r/dataisbeautiful/comments/ah5vz7/population_per_electoral_vote_and_party_by_state/,25,25,,6,Population per Electoral Vote and Party by State 1900-2016 elections OC,2019-01-0370.png
"% Approval of US, China, and Russia [OC]",GentlemanSeal,2019-01-18 02:58:03,https://i.redd.it/ejr95c7pj3b21.png,https://www.reddit.com/r/dataisbeautiful/comments/ah5ylz/approval_of_us_china_and_russia_oc/,19,19,,34,"% Approval of US, China, and Russia OC",2019-01-0371.png
[OC] Agglomerative Clustering of Nutrients in Food,AMaskedAvenger,2019-01-18 03:36:43,https://i.redd.it/nx8fve4oq3b21.png,https://www.reddit.com/r/dataisbeautiful/comments/ah6ate/oc_agglomerative_clustering_of_nutrients_in_food/,6,6,,7,OC Agglomerative Clustering of Nutrients in Food,2019-01-0372.png
Young Americans Gaining on Older Peers as Job Market Tightens,pr33tish,2019-01-18 07:05:51,https://www.bloomberg.com/news/articles/2019-01-17/young-americans-gaining-on-older-peers-as-job-market-tightens,https://www.reddit.com/r/dataisbeautiful/comments/ah7x11/young_americans_gaining_on_older_peers_as_job/,4,4,,1,Young Americans Gaining on Older Peers as Job Market Tightens,2019-01-0373.jpg
Dialects change in certain places – not so much in others. How we visualized variability in language: https://www.nzz.ch/gesellschaft/schweizerdeutsch-viel-wandel-im-freiburger-dialekt-kaum-in-baar-ld.1390868?mktcid=nled&mktcval=107&kid=_2019-1-18 [OC],marie-joseKolly,2019-01-18 09:33:08,https://i.redd.it/unap5o7le5b21.png,https://www.reddit.com/r/dataisbeautiful/comments/ah8t6t/dialects_change_in_certain_places_not_so_much_in/,16,16,,5,Dialects change in certain places – not so much in others. How we visualized variability in language httpswww.nzz.chgesellschaftschweizerdeutsch-viel-,2019-01-0374.png
[OC] Word cloud of all populated place names in Great Britain,Dr_Heron,2019-01-18 10:17:55,https://imgur.com/XQnctf3,https://www.reddit.com/r/dataisbeautiful/comments/ah9394/oc_word_cloud_of_all_populated_place_names_in/,42,42,,8,OC Word cloud of all populated place names in Great Britain,2019-01-0375.jpg
Most liked Instagram posts [OC],phenri,2019-01-18 11:54:18,https://imgur.com/gallery/FCH3HPD,https://www.reddit.com/r/dataisbeautiful/comments/ah9pme/most_liked_instagram_posts_oc/,5,5,,5,Most liked Instagram posts OC,2019-01-0376.jpg
I modeled my heart rate recovery from running over various temperature ranges [OC],antirabbit,2019-01-18 13:28:45,https://imgur.com/J6YPuIu.png,https://www.reddit.com/r/dataisbeautiful/comments/ahafsx/i_modeled_my_heart_rate_recovery_from_running/,41,41,,11,I modeled my heart rate recovery from running over various temperature ranges OC,2019-01-0377.png
"Rappers, sorted by the size of their vocabulary",Hairyballzak,2019-01-18 13:42:35,https://pudding.cool/projects/vocabulary/?fbclid=IwAR3zC92GarhqDp17Ma9NzGOMl3Ml-dp5MQpaHg5VgGaRPyiU9gN1j0M4ljs,https://www.reddit.com/r/dataisbeautiful/comments/ahak0t/rappers_sorted_by_the_size_of_their_vocabulary/,11833,11833,,1200,"Rappers, sorted by the size of their vocabulary",2019-01-0378.jpg
"Estimated Total Home Equity, by Zip Code, for the Seattle, Washington Area [OC]",eyeball1234,2019-01-18 14:48:58,https://i.redd.it/zie8bm3p27b21.png,https://www.reddit.com/r/dataisbeautiful/comments/ahb582/estimated_total_home_equity_by_zip_code_for_the/,9,9,,6,"Estimated Total Home Equity, by Zip Code, for the Seattle, Washington Area OC",2019-01-0379.png
Interactive DUI Calculator based on Widmark formula [OC],DaDaDaonald,2019-01-18 17:40:34,https://communitylawfirm.com/bac-calculator,https://www.reddit.com/r/dataisbeautiful/comments/ahcx71/interactive_dui_calculator_based_on_widmark/,5,5,,5,Interactive DUI Calculator based on Widmark formula OC,2019-01-0380.jpg
Hawaii's cutting edge sea level rise viewer,small_zack,2019-01-18 19:29:47,http://hawaiisealevelriseviewer.org,https://www.reddit.com/r/dataisbeautiful/comments/ahe1ss/hawaiis_cutting_edge_sea_level_rise_viewer/,9,9,,1,Hawaii's cutting edge sea level rise viewer,2019-01-0381.jpg
17 Years of Antarctic Icebergs Whizzing Around [OC],johnnelsonIDV,2019-01-18 20:50:03,https://adventuresinmapping.com/2019/01/18/iceberg-motion/,https://www.reddit.com/r/dataisbeautiful/comments/aheumq/17_years_of_antarctic_icebergs_whizzing_around_oc/,14,14,,4,17 Years of Antarctic Icebergs Whizzing Around OC,2019-01-0382.jpg
World map of Y-DNA Haplogroups. This is how humanity spread across the globe,DruidOfDiscord,2019-01-18 21:00:09,https://www.behance.net/gallery/31696657/Infographics-Y-DNA-Genetics,https://www.reddit.com/r/dataisbeautiful/comments/aheyac/world_map_of_ydna_haplogroups_this_is_how/,3,3,,1,World map of Y-DNA Haplogroups. This is how humanity spread across the globe,2019-01-0383.jpg
Number of civilian deaths in Pakistan due to terrorism each year since 2001. Includes important events [OC],PakAttentionSeeker,2019-01-18 21:04:58,https://i.redd.it/6d6dwdq2x8b21.jpg,https://www.reddit.com/r/dataisbeautiful/comments/ahf03p/number_of_civilian_deaths_in_pakistan_due_to/,21,21,,5,Number of civilian deaths in Pakistan due to terrorism each year since 2001. Includes important events OC,2019-01-0384.jpg
"Google Searches from the UK for ""Irish Passport"" spiked after the Brexit Referendum (Ireland will remain in the EU). [OC] from Instagram @chartrdaily.",chartr,2019-01-18 22:54:43,https://i.redd.it/qel27rl8h9b21.jpg,https://www.reddit.com/r/dataisbeautiful/comments/ahg29h/google_searches_from_the_uk_for_irish_passport/,5895,5895,,316,Google Searches from the UK for Irish Passport spiked after the Brexit Referendum (Ireland will remain in the EU). OC from Instagram @chartrdaily.,2019-01-0385.jpg
Total Assets By Country [OC],Triplebeambalancebar,2019-01-18 23:10:29,https://datastudio.google.com/open/1Gz7NZ7gDDGmV9o4xot2rappFLCRI4T68,https://www.reddit.com/r/dataisbeautiful/comments/ahg7l0/total_assets_by_country_oc/,1,1,,4,Total Assets By Country OC,2019-01-0386.jpg
Cumulative death toll of modern wars [OC],eradiate_i,2019-01-19 03:47:33,https://www.youtube.com/watch?v=LZsCZJ0r8xU,https://www.reddit.com/r/dataisbeautiful/comments/ahiiwc/cumulative_death_toll_of_modern_wars_oc/,11,11,,7,Cumulative death toll of modern wars OC,2019-01-0387.jpg
"The more I travel, the less I exercise [OC]",WhiskeySourWithIce,2019-01-19 05:57:03,https://i.redd.it/wjdezs7nkbb21.png,https://www.reddit.com/r/dataisbeautiful/comments/ahjfre/the_more_i_travel_the_less_i_exercise_oc/,32,32,,11,"The more I travel, the less I exercise OC",2019-01-0388.png
[OC] My median hourly internet speed over a month,Nogtail,2019-01-19 08:13:20,https://i.redd.it/6rgqsnn17cb21.png,https://www.reddit.com/r/dataisbeautiful/comments/ahk9lr/oc_my_median_hourly_internet_speed_over_a_month/,114,114,,17,OC My median hourly internet speed over a month,2019-01-0389.png
"Time series prediction with autoregressive model in StatSim (2000 samples, 3 chains, MCMC) [OC]",zemlyansky,2019-01-19 09:38:48,https://i.redd.it/rn2k122xmcb21.png,https://www.reddit.com/r/dataisbeautiful/comments/ahkqdf/time_series_prediction_with_autoregressive_model/,1,1,,4,"Time series prediction with autoregressive model in StatSim (2000 samples, 3 chains, MCMC) OC",2019-01-0390.png
