title,author,created_date,url,full_permalink,score,ups,downs,num_comments,sanitized_title,image_file
What happens to my sleep pattern when I don't have to work [OC],mvuijlst,2019-01-06 22:39:45,https://imgur.com/yu7hE72,https://www.reddit.com/r/dataisbeautiful/comments/adatjq/what_happens_to_my_sleep_pattern_when_i_dont_have/,17945,17945,,1087,What happens to my sleep pattern when I don't have to work OC,2019-01-0163.jpg
"Google search results for ""Hangover"" over the past 3 months [OC]",goldeneag,2019-01-06 23:48:17,https://i.redd.it/aozse2nt3w821.png,https://www.reddit.com/r/dataisbeautiful/comments/adbhsb/google_search_results_for_hangover_over_the_past/,118,118,,12,Google search results for Hangover over the past 3 months OC,2019-01-0164.png
"[OC] In 2018 I read 73 books. Here's how it broke out, and how it compared to previous years:",lizerob,2019-01-07 01:53:03,https://i.redd.it/8bxquuawpw821.png,https://www.reddit.com/r/dataisbeautiful/comments/adcoo5/oc_in_2018_i_read_73_books_heres_how_it_broke_out/,37,37,,17,"OC In 2018 I read 73 books. Here's how it broke out, and how it compared to previous years",2019-01-0165.png
World population by freedom of press [OC],canonicalized,2019-01-07 09:51:53,https://i.redd.it/z0rws91m3z821.png,https://www.reddit.com/r/dataisbeautiful/comments/adg8n9/world_population_by_freedom_of_press_oc/,90,90,,14,World population by freedom of press OC,2019-01-0166.png
[OC] I was tracking how much pages I have read for month.,tapchik,2019-01-07 10:55:28,https://i.redd.it/er98dkk2fz821.jpg,https://www.reddit.com/r/dataisbeautiful/comments/adgmir/oc_i_was_tracking_how_much_pages_i_have_read_for/,0,0,,9,OC I was tracking how much pages I have read for month.,2019-01-0167.jpg
[OC] Interactive Starcraft II Player Network,Datapluslogic,2019-01-07 13:51:39,https://i.redd.it/d2wiub1uty821.png,https://www.reddit.com/r/dataisbeautiful/comments/adhuio/oc_interactive_starcraft_ii_player_network/,99,99,,7,OC Interactive Starcraft II Player Network,2019-01-0168.png
How has Confidence in America’s Institutions Changed over the Last 40 Years? [OC],OverflowDs,2019-01-07 13:56:47,https://overflow.solutions/special-projects/how-has-confidence-in-americas-institutions-changed-over-the-last-40-years/,https://www.reddit.com/r/dataisbeautiful/comments/adhvzy/how_has_confidence_in_americas_institutions/,5,5,,4,How has Confidence in America’s Institutions Changed over the Last 40 Years OC,2019-01-0169.jpg
Average Household Income Compared to the COL Index of the 10 Most Populous Cities in the US [OC],TheNerdyProgrammer,2019-01-07 14:07:40,https://i.redd.it/93vy3s98c0921.png,https://www.reddit.com/r/dataisbeautiful/comments/adhzdt/average_household_income_compared_to_the_col/,7,7,,9,Average Household Income Compared to the COL Index of the 10 Most Populous Cities in the US OC,2019-01-0170.png
"[OC] Network graph of bi-grams based on 10,000+ tweets (in English) with #GoldenGlobes.",pr33tish,2019-01-07 14:24:21,https://i.redd.it/n8yncv2wf0921.png,https://www.reddit.com/r/dataisbeautiful/comments/adi4hu/oc_network_graph_of_bigrams_based_on_10000_tweets/,10,10,,4,"OC Network graph of bi-grams based on 10,000+ tweets (in English) with #GoldenGlobes.",2019-01-0171.png
Steam's 2018 in Review [OC],AltSk0P,2019-01-07 14:49:37,https://i.redd.it/ey6tl48sk0921.png,https://www.reddit.com/r/dataisbeautiful/comments/adicg3/steams_2018_in_review_oc/,174,174,,22,Steam's 2018 in Review OC,2019-01-0172.png
I rated my day and a couple of other factors every day for the past year [OC],meduza3,2019-01-07 15:10:40,https://i.redd.it/w1oua7leo0921.png,https://www.reddit.com/r/dataisbeautiful/comments/adijh3/i_rated_my_day_and_a_couple_of_other_factors/,147,147,,36,I rated my day and a couple of other factors every day for the past year OC,2019-01-0173.png
Minimum wage & Affordability Ratio for U.S. Cities & Towns [OC],eyeball1234,2019-01-07 16:39:54,https://i.redd.it/8rd2gr8e41921.png,https://www.reddit.com/r/dataisbeautiful/comments/adjf6y/minimum_wage_affordability_ratio_for_us_cities/,122,122,,18,Minimum wage & Affordability Ratio for U.S. Cities & Towns OC,2019-01-0174.png
Wordcloud of last words from inmates on Texas' death row [OC],d-construkt,2019-01-07 17:38:41,https://i.redd.it/zdkcxk3ld1921.png,https://www.reddit.com/r/dataisbeautiful/comments/adk0v5/wordcloud_of_last_words_from_inmates_on_texas/,31,31,,8,Wordcloud of last words from inmates on Texas' death row OC,2019-01-0175.png
A Year of Game Streaming Data - From Stream Hatchet,mongooserider301,2019-01-07 17:53:59,https://blog.streamhatchet.com/2018-game-streaming-wrap-up-c9f84dfc0c50,https://www.reddit.com/r/dataisbeautiful/comments/adk6ps/a_year_of_game_streaming_data_from_stream_hatchet/,1,1,,1,A Year of Game Streaming Data - From Stream Hatchet,2019-01-0176.jpg
USA Spotify Streams of Christmas Artists (Interactive Site in comments) [OC],76willcommenceagain,2019-01-07 18:46:52,https://i.redd.it/5jlka683r1921.png,https://www.reddit.com/r/dataisbeautiful/comments/adkr0a/usa_spotify_streams_of_christmas_artists/,9,9,,5,USA Spotify Streams of Christmas Artists (Interactive Site in comments) OC,2019-01-0177.png
[OC] Why You Grind a Catch Combo in Pokemon,GammaLoaf,2019-01-07 21:23:56,https://i.redd.it/mt55jgn5j2921.png,https://www.reddit.com/r/dataisbeautiful/comments/admfnd/oc_why_you_grind_a_catch_combo_in_pokemon/,12,12,,4,OC Why You Grind a Catch Combo in Pokemon,2019-01-0178.png
The Decline of Imgur on Reddit and the Rise of Reddit's Native Image Hosting,vbahero,2019-01-07 22:57:17,https://minimaxir.com/2017/06/imgur-decline/,https://www.reddit.com/r/dataisbeautiful/comments/adnexy/the_decline_of_imgur_on_reddit_and_the_rise_of/,21,21,,2,The Decline of Imgur on Reddit and the Rise of Reddit's Native Image Hosting,2019-01-0179.jpg
Wanks and Dranks - An Analysis of my Vices in 2018 [OC],Throwawanksndranks,2019-01-07 23:16:28,https://i.redd.it/gjm5cxav13921.png,https://www.reddit.com/r/dataisbeautiful/comments/adnlzi/wanks_and_dranks_an_analysis_of_my_vices_in_2018/,82,82,,13,Wanks and Dranks - An Analysis of my Vices in 2018 OC,2019-01-0180.png
633 days counting wanks [OC],Akhlys1,2019-01-07 23:16:30,https://i.redd.it/tdgot5f433921.jpg,https://www.reddit.com/r/dataisbeautiful/comments/adnm02/633_days_counting_wanks_oc/,34,34,,24,633 days counting wanks OC,2019-01-0181.jpg
Average Elevation of 50 US States[OC],NaryANuke,2019-01-07 23:17:12,https://i.redd.it/n887botd33921.jpg,https://www.reddit.com/r/dataisbeautiful/comments/adnm8r/average_elevation_of_50_us_statesoc/,73,73,,17,Average Elevation of 50 US StatesOC,2019-01-0182.jpg
Percentage of population employed by State Government [OC],sarxy,2019-01-08 00:45:03,https://imgur.com/a/KFf7Bxi,https://www.reddit.com/r/dataisbeautiful/comments/adohdj/percentage_of_population_employed_by_state/,17,17,,4,Percentage of population employed by State Government OC,2019-01-0183.jpg
Dr Pepper Consumption for 2018 [OC],peeshivers243,2019-01-08 00:54:49,https://i.redd.it/3hkjef0fj3921.png,https://www.reddit.com/r/dataisbeautiful/comments/adokv7/dr_pepper_consumption_for_2018_oc/,8,8,,14,Dr Pepper Consumption for 2018 OC,2019-01-0184.png
Press Freedom's Dark Horizon [OC],MarkBradbourne,2019-01-08 02:44:58,https://i.redd.it/jewvntzd44921.png,https://www.reddit.com/r/dataisbeautiful/comments/adpmsa/press_freedoms_dark_horizon_oc/,23,23,,5,Press Freedom's Dark Horizon OC,2019-01-0185.png
"All of LeBron's shots in order, by team [OC]",elbevee,2019-01-08 02:59:13,https://imgur.com/4Kix9Du,https://www.reddit.com/r/dataisbeautiful/comments/adprl4/all_of_lebrons_shots_in_order_by_team_oc/,10,10,,9,"All of LeBron's shots in order, by team OC",2019-01-0186.jpg
Every Hour of my 2018 recorded [OC],kikiee241,2019-01-08 03:12:04,https://i.redd.it/ageukohl74921.png,https://www.reddit.com/r/dataisbeautiful/comments/adpvo1/every_hour_of_my_2018_recorded_oc/,66,66,,14,Every Hour of my 2018 recorded OC,2019-01-0187.png
[OC] Comparison of the growth of population and mobile phones,raketenforschung,2019-01-08 07:58:33,https://dorowski.com/billions/,https://www.reddit.com/r/dataisbeautiful/comments/ads31p/oc_comparison_of_the_growth_of_population_and/,3,3,,4,OC Comparison of the growth of population and mobile phones,2019-01-0188.jpg
Freedom of press 1993-2016 [OC],busttropical,2019-01-08 08:57:48,https://i.redd.it/8e5edkgzy5921.jpg,https://www.reddit.com/r/dataisbeautiful/comments/adsftf/freedom_of_press_19932016_oc/,5,5,,4,Freedom of press 1993-2016 OC,2019-01-0189.jpg
How Frequently Words of Various Lengths are Used on the Internet [OC],TheNerdyProgrammer,2019-01-08 10:40:59,https://i.redd.it/s52rvmbbh6921.png,https://www.reddit.com/r/dataisbeautiful/comments/adt1pt/how_frequently_words_of_various_lengths_are_used/,23,23,,12,How Frequently Words of Various Lengths are Used on the Internet OC,2019-01-0190.png
The semiconductor device fabrication size has exponentially decreased since the 70's [OC],andersoonasd,2019-01-08 11:27:11,https://i.imgur.com/stBmuGB.jpg,https://www.reddit.com/r/dataisbeautiful/comments/adtbxi/the_semiconductor_device_fabrication_size_has/,51,51,,13,The semiconductor device fabrication size has exponentially decreased since the 70's OC,2019-01-0191.jpg
[OC] Peusdo-Potential in the Earth-Moon System,Gereshes,2019-01-08 12:42:06,https://i.redd.it/9xzvob1y27921.png,https://www.reddit.com/r/dataisbeautiful/comments/adttul/oc_peusdopotential_in_the_earthmoon_system/,7425,7425,,298,OC Peusdo-Potential in the Earth-Moon System,2019-01-0192.png
Global temperature compared to pre-industrial value since 1850 [OC],neilrkaye,2019-01-08 14:56:37,https://i.redd.it/k3jvvy0vq7921.jpg,https://www.reddit.com/r/dataisbeautiful/comments/aduxmi/global_temperature_compared_to_preindustrial/,69,69,,9,Global temperature compared to pre-industrial value since 1850 OC,2019-01-0193.jpg
Granular mining pool mapping with Bitcoin's coinbase outputs - Coin Metrics,DrWD,2019-01-08 15:51:19,https://coinmetrics.io/mining-pool-mapping/,https://www.reddit.com/r/dataisbeautiful/comments/advidp/granular_mining_pool_mapping_with_bitcoins/,1,1,,1,Granular mining pool mapping with Bitcoin's coinbase outputs - Coin Metrics,2019-01-0194.jpg
"The most dangerous times to be on the road in Australia, based on traffic fatalities",mwar93,2019-01-08 15:51:28,https://www.teletracnavman.com.au/infographics/most-dangerous-times-to-be-on-the-roads-of-australia,https://www.reddit.com/r/dataisbeautiful/comments/advifk/the_most_dangerous_times_to_be_on_the_road_in/,5,5,,1,"The most dangerous times to be on the road in Australia, based on traffic fatalities",2019-01-0195.jpg
US marginal an net tax rates [OC],ButterflyCatastrophe,2019-01-08 16:59:51,https://i.redd.it/qvapo1ivc8921.png,https://www.reddit.com/r/dataisbeautiful/comments/adw9mf/us_marginal_an_net_tax_rates_oc/,38,38,,19,US marginal an net tax rates OC,2019-01-0196.png
"World's Oldest Person Titleholders, 1955-Present [OC]",SportsAnalyticsGuy,2019-01-08 17:59:38,https://i.redd.it/2rqltb9jn8921.png,https://www.reddit.com/r/dataisbeautiful/comments/adwy7z/worlds_oldest_person_titleholders_1955present_oc/,98,98,,20,"World's Oldest Person Titleholders, 1955-Present OC",2019-01-0197.png
Marginal Tax Rates for Individuals in 2018 [OC],baughberick,2019-01-08 18:57:54,https://i.imgur.com/vJpVtE1.jpg,https://www.reddit.com/r/dataisbeautiful/comments/adxm3t/marginal_tax_rates_for_individuals_in_2018_oc/,16,16,,10,Marginal Tax Rates for Individuals in 2018 OC,2019-01-0198.jpg
French presidents' popularity ratings compare to PM's [OC] (v2),pixgarden,2019-01-08 19:26:10,https://i.redd.it/pmy7dhc039921.png,https://www.reddit.com/r/dataisbeautiful/comments/adxwq5/french_presidents_popularity_ratings_compare_to/,22,22,,14,French presidents' popularity ratings compare to PM's OC (v2),2019-01-0199.png
"I recorded the pressure when going under the Hudson River on the NJT Train, and it correlates to my ears popping.",NooJoisey,2019-01-08 19:29:10,https://www.reddit.com/r/newjersey/comments/adu6ig/i_recorded_the_pressure_when_going_under_the/,https://www.reddit.com/r/dataisbeautiful/comments/adxxvg/i_recorded_the_pressure_when_going_under_the/,24,24,,2,"I recorded the pressure when going under the Hudson River on the NJT Train, and it correlates to my ears popping.",2019-01-0200.jpg
Entire message history with my BF since the first time we talked in Direct Messages [OC],Isotheis,2019-01-08 20:46:29,https://i.redd.it/hlhzpkbic9921.png,https://www.reddit.com/r/dataisbeautiful/comments/adyqo7/entire_message_history_with_my_bf_since_the_first/,12,12,,8,Entire message history with my BF since the first time we talked in Direct Messages OC,2019-01-0201.png
"Speed and Kinetic Energy of Sports Shots, Throws, and Kicks [OC]",EngagingData,2019-01-08 22:06:15,https://engaging-data.com/kinetic-energy-sports/,https://www.reddit.com/r/dataisbeautiful/comments/adzk94/speed_and_kinetic_energy_of_sports_shots_throws/,52,52,,17,"Speed and Kinetic Energy of Sports Shots, Throws, and Kicks OC",2019-01-0202.jpg
Two months of dating with Bumble [OC],FormCheckThrowawayTM,2019-01-08 22:14:14,https://i.redd.it/5unq1d4zw9921.png,https://www.reddit.com/r/dataisbeautiful/comments/adzn65/two_months_of_dating_with_bumble_oc/,30,30,,17,Two months of dating with Bumble OC,2019-01-0203.png
"I tabulated more than 5,000,000 data points on movie tastes to find the gender gap, best, worst, and other fun stats about movies made in 2018 [OC] [x /r/movies]",johnjuanlin,2019-01-08 23:27:31,https://i.redd.it/6sumxx6w9a921.png,https://www.reddit.com/r/dataisbeautiful/comments/ae0dw5/i_tabulated_more_than_5000000_data_points_on/,16,16,,13,"I tabulated more than 5,000,000 data points on movie tastes to find the gender gap, best, worst, and other fun stats about movies made in 2018 OC x rm",2019-01-0204.png
How to detect ban evasion on Reddit,ruanchaves,2019-01-09 00:15:17,https://ruanchaves.github.io/reddit-ban-evasion/,https://www.reddit.com/r/dataisbeautiful/comments/ae0v58/how_to_detect_ban_evasion_on_reddit/,12,12,,6,How to detect ban evasion on Reddit,2019-01-0205.jpg
3D visualization of a meta-analysis on studies examining the reconstruction of images from human brain activity [OC],DrDamgaard,2019-01-09 00:25:25,https://imgur.com/ryw9R9Q,https://www.reddit.com/r/dataisbeautiful/comments/ae0yq1/3d_visualization_of_a_metaanalysis_on_studies/,9,9,,4,3D visualization of a meta-analysis on studies examining the reconstruction of images from human brain activity OC,2019-01-0206.jpg
Die Hard debate settled once and for all... up to 5x the search volume in December. [OC] from Instagram @chartrdaily which I run.,chartr,2019-01-09 02:01:17,https://i.redd.it/821s4rth0b921.jpg,https://www.reddit.com/r/dataisbeautiful/comments/ae1vus/die_hard_debate_settled_once_and_for_all_up_to_5x/,19662,19662,,785,Die Hard debate settled once and for all... up to 5x the search volume in December. OC from Instagram @chartrdaily which I run.,2019-01-0207.jpg
"Solar Irradiance, from my first project [OC]",futureblues26,2019-01-09 05:43:27,https://i.redd.it/sui70ec55c921.png,https://www.reddit.com/r/dataisbeautiful/comments/ae3s93/solar_irradiance_from_my_first_project_oc/,14,14,,5,"Solar Irradiance, from my first project OC",2019-01-0208.png
[OC] Yearly budget for a Dutch couple in IT (€70k total),ekst3r,2019-01-09 07:53:49,https://i.redd.it/xreecfaeoc921.png,https://www.reddit.com/r/dataisbeautiful/comments/ae4o5s/oc_yearly_budget_for_a_dutch_couple_in_it_70k/,25,25,,12,OC Yearly budget for a Dutch couple in IT (€70k total),2019-01-0209.png
1930s graph: aggressive criminality (bars) and alcohol usage (lines) from 1901 to 1937. Translation and info in comments,jumja,2019-01-09 14:13:49,https://i.redd.it/d0p852i5oe921.jpg,https://www.reddit.com/r/dataisbeautiful/comments/ae777l/1930s_graph_aggressive_criminality_bars_and/,20,20,,4,1930s graph aggressive criminality (bars) and alcohol usage (lines) from 1901 to 1937. Translation and info in comments,2019-01-0211.jpg
"Here's every color of every lightsaber in ""Star Wars,"" in one chart [FiveThirtyEight]",ar_604,2019-01-09 15:37:31,https://twitter.com/FiveThirtyEight/status/1082855256235618304,https://www.reddit.com/r/dataisbeautiful/comments/ae7yf1/heres_every_color_of_every_lightsaber_in_star/,10,10,,5,"Here's every color of every lightsaber in Star Wars, in one chart FiveThirtyEight",2019-01-0212.jpg
How Do Americans Differ by Age? [OC],OverflowDs,2019-01-09 15:44:04,http://overflow.solutions/special-projects/how-do-americans-differ-by-age-17/,https://www.reddit.com/r/dataisbeautiful/comments/ae80nj/how_do_americans_differ_by_age_oc/,16,16,,9,How Do Americans Differ by Age OC,2019-01-0213.jpg
Interactive visualization of related subreddits based on 39 million comments [OC],anvaka,2019-01-09 16:06:32,https://v.redd.it/v30gkxhx6f921,https://www.reddit.com/r/dataisbeautiful/comments/ae88pk/interactive_visualization_of_related_subreddits/,4990,4990,,111,Interactive visualization of related subreddits based on 39 million comments OC,2019-01-0214.png
"One day in Buenos Aires crime cases, (2016-2017) [OC]",Igncferreiro,2019-01-09 18:50:58,https://v.redd.it/868fy80i1g921,https://www.reddit.com/r/dataisbeautiful/comments/ae9xxr/one_day_in_buenos_aires_crime_cases_20162017_oc/,28,28,,15,"One day in Buenos Aires crime cases, (2016-2017) OC",2019-01-0215.png
[OC] Offensive Rating vs. Defensive Rating for Guards at the Halfway Point of the NBA Season,kalifornia_kid,2019-01-09 19:18:22,https://vizzlo.com/share/I5psWm7VSvWTLcUZKROxDQ,https://www.reddit.com/r/dataisbeautiful/comments/aea8g7/oc_offensive_rating_vs_defensive_rating_for/,3,3,,4,OC Offensive Rating vs. Defensive Rating for Guards at the Halfway Point of the NBA Season,2019-01-0216.jpg
[OC] I Tracked Nearly Every Hour of Media Watched in 2018,BridgeOperator,2019-01-09 20:06:50,https://i.redd.it/52be72foeg921.png,https://www.reddit.com/r/dataisbeautiful/comments/aeaqim/oc_i_tracked_nearly_every_hour_of_media_watched/,15,15,,4,OC I Tracked Nearly Every Hour of Media Watched in 2018,2019-01-0217.png
[OC] Age & Skill in Pro Counter-Strike,Analytical_Gaming,2019-01-09 20:24:40,https://i.redd.it/d2jnokgtib921.png,https://www.reddit.com/r/dataisbeautiful/comments/aeax5n/oc_age_skill_in_pro_counterstrike/,34,34,,12,OC Age & Skill in Pro Counter-Strike,2019-01-0218.png
[OC] Graph of my running activity 2018 vs. my goal of running a cumulative 600km over the year,farinbela,2019-01-09 21:07:47,https://i.redd.it/g879zpymkg921.png,https://www.reddit.com/r/dataisbeautiful/comments/aebdeb/oc_graph_of_my_running_activity_2018_vs_my_goal/,18,18,,5,OC Graph of my running activity 2018 vs. my goal of running a cumulative 600km over the year,2019-01-0219.png
Progression of Title Race in Europe's Top 5 Soccer Leagues,tanstaafl_why,2019-01-09 21:12:29,https://www.reddit.com/r/soccer/comments/ae8iq5/progression_of_title_race_in_europes_top_5/,https://www.reddit.com/r/dataisbeautiful/comments/aebf6l/progression_of_title_race_in_europes_top_5_soccer/,3,3,,1,Progression of Title Race in Europe's Top 5 Soccer Leagues,2019-01-0220.png
[OC] College Undergrad Fall 18 Job Applications (Class of Spring 18),kev96h,2019-01-09 21:30:40,https://i.redd.it/f0m0yoy9tg921.png,https://www.reddit.com/r/dataisbeautiful/comments/aebm12/oc_college_undergrad_fall_18_job_applications/,19,19,,5,OC College Undergrad Fall 18 Job Applications (Class of Spring 18),2019-01-0221.png
[OC] Stations with direct rail connections to London (left) Vs Manchester (right).,kwn2,2019-01-09 23:01:40,https://i.imgur.com/b3YOerU.png,https://www.reddit.com/r/dataisbeautiful/comments/aecjk3/oc_stations_with_direct_rail_connections_to/,68,68,,9,OC Stations with direct rail connections to London (left) Vs Manchester (right).,2019-01-0222.png
"National Diversity against points earned, LaLiga 1929-2017 [OC]",TheACmadman,2019-01-10 00:00:06,https://i.redd.it/zb3mk5zzjh921.jpg,https://www.reddit.com/r/dataisbeautiful/comments/aed3vz/national_diversity_against_points_earned_laliga/,3,3,,5,"National Diversity against points earned, LaLiga 1929-2017 OC",2019-01-0223.jpg
[OC] Post-Tax Expenditures on $67K (2018 data),wanderguides,2019-01-10 00:42:52,https://i.redd.it/dgxzckvsrh921.png,https://www.reddit.com/r/dataisbeautiful/comments/aedi2y/oc_posttax_expenditures_on_67k_2018_data/,5,5,,7,OC Post-Tax Expenditures on $67K (2018 data),2019-01-0224.png
[OC] The Life Cycle of my Wife's Student Loan Debt,4510,2019-01-10 01:50:45,https://i.redd.it/sq6i64e94i921.jpg,https://www.reddit.com/r/dataisbeautiful/comments/aee497/oc_the_life_cycle_of_my_wifes_student_loan_debt/,19,19,,6,OC The Life Cycle of my Wife's Student Loan Debt,2019-01-0225.jpg
"If Jeff and Mackenzie Bezos hypothetically split their assets in half in their divorce, both would still be in the top 5 wealthiest individuals globally. [OC] from my Instagram: https://www.instagram.com/p/Bsb6kVJgbQU/.",chartr,2019-01-10 02:08:42,https://i.redd.it/zh99k1xe7i921.jpg,https://www.reddit.com/r/dataisbeautiful/comments/aeea1o/if_jeff_and_mackenzie_bezos_hypothetically_split/,624,624,,217,"If Jeff and Mackenzie Bezos hypothetically split their assets in half in their divorce, both would still be in the top 5 wealthiest individuals global",2019-01-0226.jpg
Beer Brewing: Original & Final Gravity Ranges by BJCP Styles (2008) [OC],Oktober44,2019-01-10 07:01:26,https://i.redd.it/qkr17ssinj921.jpg,https://www.reddit.com/r/dataisbeautiful/comments/aeglj2/beer_brewing_original_final_gravity_ranges_by/,8,8,,6,Beer Brewing Original & Final Gravity Ranges by BJCP Styles (2008) OC,2019-01-0227.jpg
"Boxplot of the times I started work for the last three years, by month, and printed on a mug [OC]",DataIsBoring,2019-01-10 10:31:14,https://i.redd.it/5usorwwlok921.png,https://www.reddit.com/r/dataisbeautiful/comments/aehuo9/boxplot_of_the_times_i_started_work_for_the_last/,13320,13320,,274,"Boxplot of the times I started work for the last three years, by month, and printed on a mug OC",2019-01-0228.png
[OC] How I explore my workflow with charts,doraby1,2019-01-10 12:09:51,https://medium.com/vizydrop/managing-life-with-charts-96d9715714b8,https://www.reddit.com/r/dataisbeautiful/comments/aeiiug/oc_how_i_explore_my_workflow_with_charts/,6,6,,4,OC How I explore my workflow with charts,2019-01-0229.jpg
"[OC] I took some suggestions from various reddit users, and improved my ""Firework"" diagrams of direct rail connections to main UK hubs. There's also now maps for nine hubs rather than just two, and a bonus distance-weighted heatmap at the end.",kwn2,2019-01-10 13:08:24,https://imgur.com/a/H95ZPab,https://www.reddit.com/r/dataisbeautiful/comments/aeiz9f/oc_i_took_some_suggestions_from_various_reddit/,10,10,,5,"OC I took some suggestions from various reddit users, and improved my Firework diagrams of direct rail connections to main UK hubs. There's also now m",2019-01-0230.jpg
[OC] Every time I have peed or pooped in 2018.,Slurpieslurp,2019-01-10 15:34:34,https://i.redd.it/g5r8e1dzul921.png,https://www.reddit.com/r/dataisbeautiful/comments/aek21l/oc_every_time_i_have_peed_or_pooped_in_2018/,182,182,,58,OC Every time I have peed or pooped in 2018.,2019-01-0231.png
Tree of Oldest Life [OC],Raych56,2019-01-10 17:52:28,https://bl.ocks.org/timchu90/ba3ca1da4535a9e6ca792d2cecc446fa,https://www.reddit.com/r/dataisbeautiful/comments/aelh8v/tree_of_oldest_life_oc/,10,10,,7,Tree of Oldest Life OC,2019-01-0232.jpg
2018 Chicago Gun Violence,tilttovictory,2019-01-10 19:23:19,https://heyjackass.com/category/2018-stats/#,https://www.reddit.com/r/dataisbeautiful/comments/aemf3k/2018_chicago_gun_violence/,3,3,,2,2018 Chicago Gun Violence,2019-01-0233.jpg
Ages of members of congress at the beginning of each new congress (1789-2019) [OC],SteamedHamsInAlbany,2019-01-10 19:26:06,https://i.imgur.com/8CNbM2e.png,https://www.reddit.com/r/dataisbeautiful/comments/aemg3q/ages_of_members_of_congress_at_the_beginning_of/,103,103,,21,Ages of members of congress at the beginning of each new congress (1789-2019) OC,2019-01-0234.png
"A data visualization, in quilt form. The coloured blocks represent the extent of arctic sea ice from 1979-2017, while the quilting shows the rising sea temperatures over the same time period. [OC]",RosiePB2,2019-01-10 19:40:10,https://i.redd.it/oczv4gk9fn921.jpg,https://www.reddit.com/r/dataisbeautiful/comments/aeml8i/a_data_visualization_in_quilt_form_the_coloured/,22,22,,8,"A data visualization, in quilt form. The coloured blocks represent the extent of arctic sea ice from 1979-2017, while the quilting shows the rising se",2019-01-0235.jpg
Best/Weirdest Charts From FiveThirtyEight in 2018,Syring,2019-01-10 19:50:09,https://fivethirtyeight.com/features/the-45-best-and-weirdest-charts-we-made-in-2018/,https://www.reddit.com/r/dataisbeautiful/comments/aemp02/bestweirdest_charts_from_fivethirtyeight_in_2018/,13,13,,3,BestWeirdest Charts From FiveThirtyEight in 2018,2019-01-0236.jpg
Identifying Signs of the Solar Revolution Using Maps and Graphs [OC],ChesterEnergyDC,2019-01-10 20:38:00,http://chesterenergyandpolicy.com/2018/11/30/identifying-signs-of-the-solar-revolution-using-maps-and-graphs/,https://www.reddit.com/r/dataisbeautiful/comments/aen6zt/identifying_signs_of_the_solar_revolution_using/,2,2,,4,Identifying Signs of the Solar Revolution Using Maps and Graphs OC,2019-01-0237.jpg
Trump Addresses The Nation Word Cloud [OC],SoggyYak,2019-01-10 20:40:36,https://imgur.com/X9RP8Yh,https://www.reddit.com/r/dataisbeautiful/comments/aen7y1/trump_addresses_the_nation_word_cloud_oc/,6,6,,4,Trump Addresses The Nation Word Cloud OC,2019-01-0238.jpg
"Monthly Central England Temperature (CET) Values, Colour Ranked: January 1659 to November 2018 [OC]",IceBean,2019-01-10 21:38:49,https://i.redd.it/wshxsor00o921.png,https://www.reddit.com/r/dataisbeautiful/comments/aentvx/monthly_central_england_temperature_cet_values/,8,8,,7,"Monthly Central England Temperature (CET) Values, Colour Ranked January 1659 to November 2018 OC",2019-01-0239.png
