title,author,created_date,url,full_permalink,score,ups,downs,num_comments,sanitized_title,image_file
[OC] Critics' vs. Audience's Reviews of 2020's Top Grossing Movies,singerep,2020-12-22 23:27:13,https://i.redd.it/d68wpmouot661.jpg,https://www.reddit.com/r/dataisbeautiful/comments/kigtix/oc_critics_vs_audiences_reviews_of_2020s_top/,49,49,,12,OC Critics' vs. Audience's Reviews of 2020's Top Grossing Movies,2020-12-0504.jpg
2020 vs 2019 Monthly U.S. Air Travel Passengers [OC],adventurepaul,2020-12-23 00:04:41,https://i.redd.it/ffrl15alvt661.jpg,https://www.reddit.com/r/dataisbeautiful/comments/kihix5/2020_vs_2019_monthly_us_air_travel_passengers_oc/,20,20,,9,2020 vs 2019 Monthly U.S. Air Travel Passengers OC,2020-12-0505.jpg
[OC] A spiral visualization for tracking COVID-19 numbers in the US by state,analyzer2004,2020-12-23 01:17:42,https://observablehq.com/@analyzer2004/timespiral,https://www.reddit.com/r/dataisbeautiful/comments/kiiuml/oc_a_spiral_visualization_for_tracking_covid19/,5,5,,2,OC A spiral visualization for tracking COVID-19 numbers in the US by state,2020-12-0506.jpg
[OC] Plotted the number of corporate insiders selling shares v. buying shares in publicly traded real estate companies (rolling 90 days),badpauly,2020-12-23 04:43:14,https://i.redd.it/4x25702u8v661.png,https://www.reddit.com/r/dataisbeautiful/comments/kimbdh/oc_plotted_the_number_of_corporate_insiders/,14,14,,12,OC Plotted the number of corporate insiders selling shares v. buying shares in publicly traded real estate companies (rolling 90 days),2020-12-0507.png
We created an interactive cocktail visualization with a DIY recommender. [OC],LiuhuayingYang,2020-12-23 06:44:35,https://v.redd.it/gvc3r0h1tv661,https://www.reddit.com/r/dataisbeautiful/comments/kio30b/we_created_an_interactive_cocktail_visualization/,253,253,,27,We created an interactive cocktail visualization with a DIY recommender. OC,2020-12-0508.png
History of East Asia 1800-2020 - Agario Style [OC],TheCarloza,2020-12-23 12:25:28,https://v.redd.it/2zp2cmk3jx661,https://www.reddit.com/r/dataisbeautiful/comments/kis64o/history_of_east_asia_18002020_agario_style_oc/,22866,22866,,764,History of East Asia 1800-2020 - Agario Style OC,2020-12-0509.png
[OC] Annual percent increase in the number of deaths from all causes by age group in the United States: Age 25-44 has the largest % increase this year (+20.5%),JPAnalyst,2020-12-23 12:30:05,https://i.redd.it/3xoevikmkx661.jpg,https://www.reddit.com/r/dataisbeautiful/comments/kis87l/oc_annual_percent_increase_in_the_number_of/,30,30,,16,OC Annual percent increase in the number of deaths from all causes by age group in the United States Age 25-44 has the largest % increase this year (+,2020-12-0510.jpg
[OC] #California and #Tennessee seem to currently be the #covid19 outliers,graphguy,2020-12-23 12:33:26,https://i.redd.it/gtwwq56xkx661.png,https://www.reddit.com/r/dataisbeautiful/comments/kis9sa/oc_california_and_tennessee_seem_to_currently_be/,82,82,,26,OC #California and #Tennessee seem to currently be the #covid19 outliers,2020-12-0511.png
"World’s Busiest Airports, just before Covid-19 [OC]",Landgeist,2020-12-23 12:49:23,https://i.redd.it/0m0qdcwynx661.png,https://www.reddit.com/r/dataisbeautiful/comments/kishpy/worlds_busiest_airports_just_before_covid19_oc/,44,44,,10,"World’s Busiest Airports, just before Covid-19 OC",2020-12-0512.png
[OC] Suicides in United States of America by gender,lukaskuko,2020-12-23 14:26:26,https://i.redd.it/aucacrl45y661.png,https://www.reddit.com/r/dataisbeautiful/comments/kiu0jb/oc_suicides_in_united_states_of_america_by_gender/,77,77,,23,OC Suicides in United States of America by gender,2020-12-0513.png
[OC] A More Accurate Breakdown of the ~$900B Coronavirus Response and Relief Act,TheyreGoodDogsBrent,2020-12-23 15:02:59,https://i.redd.it/lszvya9kby661.png,https://www.reddit.com/r/dataisbeautiful/comments/kiumhk/oc_a_more_accurate_breakdown_of_the_900b/,1064,1064,,157,OC A More Accurate Breakdown of the ~$900B Coronavirus Response and Relief Act,2020-12-0514.png
[OC] 2020 Timeline By Top Daily Search Trends,osherz5,2020-12-23 15:09:54,https://i.redd.it/j47226oocy661.png,https://www.reddit.com/r/dataisbeautiful/comments/kiuqqj/oc_2020_timeline_by_top_daily_search_trends/,74,74,,16,OC 2020 Timeline By Top Daily Search Trends,2020-12-0515.png
[OC] United States COVID-19 Case and Death Distribution by Age Group,dak0j0,2020-12-23 15:49:59,https://i.redd.it/ymxz16k7ky661.png,https://www.reddit.com/r/dataisbeautiful/comments/kivfue/oc_united_states_covid19_case_and_death/,52,52,,11,OC United States COVID-19 Case and Death Distribution by Age Group,2020-12-0516.png
[OC] How Dream (or Anyone) Could Cheat in Minecraft Speedruns Without Anyone Noticing,antirabbit,2020-12-23 16:17:09,https://maxcandocia.com/article/2020/Dec/19/dream-power/,https://www.reddit.com/r/dataisbeautiful/comments/kivxiv/oc_how_dream_or_anyone_could_cheat_in_minecraft/,14,14,,10,OC How Dream (or Anyone) Could Cheat in Minecraft Speedruns Without Anyone Noticing,2020-12-0517.jpg
Household income vs math test scores,already-taken-wtf,2020-12-23 20:17:44,https://www.economist.com/graphic-detail/2020/10/03/its-better-to-be-a-poor-pupil-in-a-rich-country-than-the-reverse,https://www.reddit.com/r/dataisbeautiful/comments/kj0f8y/household_income_vs_math_test_scores/,20,20,,13,Household income vs math test scores,2020-12-0518.jpg
[OC] Comparison of Reddit's take on the ~$900B Covid bill and the CRFP.org breakdown,gainmargin,2020-12-23 21:22:57,https://i.redd.it/000makpt60761.png,https://www.reddit.com/r/dataisbeautiful/comments/kj1mlm/oc_comparison_of_reddits_take_on_the_900b_covid/,44,44,,3,OC Comparison of Reddit's take on the ~$900B Covid bill and the CRFP.org breakdown,2020-12-0519.png
"The 40 Weirdest (And Best) Charts We Made In This Long, Strange Year",DV8_MKD,2020-12-23 21:38:13,https://fivethirtyeight.com/features/the-40-weirdest-and-best-charts-we-made-in-2020/?ex_cid=538twitter,https://www.reddit.com/r/dataisbeautiful/comments/kj1wqz/the_40_weirdest_and_best_charts_we_made_in_this/,10,10,,3,"The 40 Weirdest (And Best) Charts We Made In This Long, Strange Year",2020-12-0520.jpg
"An animation comparing countries by Covid cases, week by week",dablusniper,2020-12-24 00:26:05,https://www.rferl.org/a/day-by-day-how-the-coronavirus-spread/30552844.html,https://www.reddit.com/r/dataisbeautiful/comments/kj4wio/an_animation_comparing_countries_by_covid_cases/,8,8,,3,"An animation comparing countries by Covid cases, week by week",2020-12-0521.jpg
See Where U.S. Intensive Care Units Are Filling Up,thexylom,2020-12-24 01:34:10,https://www.nytimes.com/interactive/2020/12/23/us/covid-rising-icu-capacity.html,https://www.reddit.com/r/dataisbeautiful/comments/kj60oi/see_where_us_intensive_care_units_are_filling_up/,5,5,,2,See Where U.S. Intensive Care Units Are Filling Up,2020-12-0522.jpg
[OC] American Ninja Warrior - Most common obstacles across 10 seasons (#TidyTuesday 2020-12-15).,brianhaas19,2020-12-24 03:02:24,https://i.redd.it/6xcxbqg0w1761.png,https://www.reddit.com/r/dataisbeautiful/comments/kj7e1l/oc_american_ninja_warrior_most_common_obstacles/,76,76,,7,OC American Ninja Warrior - Most common obstacles across 10 seasons (#TidyTuesday 2020-12-15).,2020-12-0523.png
[OC] The rise of sex work on NSFW reddit,Bandeau,2020-12-24 06:54:18,https://i.redd.it/w7pvi2ij13761.png,https://www.reddit.com/r/dataisbeautiful/comments/kjapnt/oc_the_rise_of_sex_work_on_nsfw_reddit/,54,54,,31,OC The rise of sex work on NSFW reddit,2020-12-0524.png
"[OC] Deaths from all causes are up 14.5% in the United States this year, compared to an annual average of 1.3% in the previous 4 years. (data through week 50)",JPAnalyst,2020-12-24 13:15:16,https://i.redd.it/uh3rmaldx4761.png,https://www.reddit.com/r/dataisbeautiful/comments/kjf9gs/oc_deaths_from_all_causes_are_up_145_in_the/,138,138,,83,"OC Deaths from all causes are up 14.5% in the United States this year, compared to an annual average of 1.3% in the previous 4 years. (data through we",2020-12-0525.png
"[OC] NBA Team Salary Inequality, 2020-21: Gini Coefficient and Selected Lorenz Curves",notthenextfreddyadu,2020-12-24 13:16:16,https://i.redd.it/1yriayxlx4761.png,https://www.reddit.com/r/dataisbeautiful/comments/kjf9y0/oc_nba_team_salary_inequality_202021_gini/,10,10,,3,"OC NBA Team Salary Inequality, 2020-21 Gini Coefficient and Selected Lorenz Curves",2020-12-0526.png
[OC] Votes Without Electoral College Representation (2012),jonahfeld,2020-12-24 13:59:03,https://i.redd.it/gxn5vxb355761.png,https://www.reddit.com/r/dataisbeautiful/comments/kjfv7o/oc_votes_without_electoral_college_representation/,52,52,,41,OC Votes Without Electoral College Representation (2012),2020-12-0527.png
"[OC]The value of a wyoming vote: If every state received 1 electoral college vote per 192,919 residents.",Bananaslug00,2020-12-24 14:40:04,https://imgur.com/gDxdkPg,https://www.reddit.com/r/dataisbeautiful/comments/kjggt8/octhe_value_of_a_wyoming_vote_if_every_state/,242,242,,191,"OCThe value of a wyoming vote If every state received 1 electoral college vote per 192,919 residents.",2020-12-0528.jpg
[OC] Most Awarded Reddit Awards,randomo_redditor,2020-12-24 14:41:22,https://i.redd.it/pbosz8kyc5761.jpg,https://www.reddit.com/r/dataisbeautiful/comments/kjghhe/oc_most_awarded_reddit_awards/,70,70,,6,OC Most Awarded Reddit Awards,2020-12-0529.jpg
"[OC] A chart of the gifts the wise men brought to Jesus. Merry Christmas, to those who celebrate. Happy Holidays and Happy New Year to all.",JPAnalyst,2020-12-24 14:56:54,https://i.redd.it/gzu1rq9pf5761.png,https://www.reddit.com/r/dataisbeautiful/comments/kjgpvl/oc_a_chart_of_the_gifts_the_wise_men_brought_to/,0,0,,7,"OC A chart of the gifts the wise men brought to Jesus. Merry Christmas, to those who celebrate. Happy Holidays and Happy New Year to all.",2020-12-0530.png
[OC] Minecraft 1.16.1: Probability of getting 12 ender pearls after trading N gold ingots,BRENNEJM,2020-12-24 15:41:43,https://i.redd.it/hv1bx41kn5761.png,https://www.reddit.com/r/dataisbeautiful/comments/kjhf1t/oc_minecraft_1161_probability_of_getting_12_ender/,56,56,,18,OC Minecraft 1.16.1 Probability of getting 12 ender pearls after trading N gold ingots,2020-12-0531.png
"[OC] US cases per million (7 day average), by county, from Jan 23 to Dec 21. Color-coded by daily percentiles",DrDavidLevinson,2020-12-24 15:50:08,https://v.redd.it/rcck7i76p5761,https://www.reddit.com/r/dataisbeautiful/comments/kjhjve/oc_us_cases_per_million_7_day_average_by_county/,73,73,,22,"OC US cases per million (7 day average), by county, from Jan 23 to Dec 21. Color-coded by daily percentiles",2020-12-0532.png
[OC] 2020 electoral map if only ____ voted. Breakdown by each major demographics.,dustingibson,2020-12-24 16:24:17,https://i.redd.it/9ksetpj8v5761.png,https://www.reddit.com/r/dataisbeautiful/comments/kji3wx/oc_2020_electoral_map_if_only_voted_breakdown_by/,77999,77999,,4928,OC 2020 electoral map if only ____ voted. Breakdown by each major demographics.,2020-12-0533.png
"State political leaning vs various metrics, like obesity rates, family income, and poverty",pdxf,2020-12-24 16:34:13,https://drempd.com/red-america-blue-america/,https://www.reddit.com/r/dataisbeautiful/comments/kji9nh/state_political_leaning_vs_various_metrics_like/,12,12,,5,"State political leaning vs various metrics, like obesity rates, family income, and poverty",2020-12-0534.jpg
US Presidential Election spending by candidate over the years [OC],theimpossiblesalad,2020-12-24 16:56:03,https://i.redd.it/opa5pz1v06761.jpg,https://www.reddit.com/r/dataisbeautiful/comments/kjimp0/us_presidential_election_spending_by_candidate/,312,312,,82,US Presidential Election spending by candidate over the years OC,2020-12-0535.jpg
"[OC] US Google search results for “in transit arriving late”, the USPS’s catch-all for mail or packages arriving late.",slipangle28,2020-12-24 18:32:05,https://i.redd.it/r6qnxgg4i6761.jpg,https://www.reddit.com/r/dataisbeautiful/comments/kjk9dd/oc_us_google_search_results_for_in_transit/,564,564,,29,"OC US Google search results for “in transit arriving late”, the USPS’s catch-all for mail or packages arriving late.",2020-12-0536.jpg
"[OC] U.S. Air Travelers During Thanksgiving and Christmas Holidays, 2019 vs. 2020",snowmaninheat,2020-12-24 20:10:54,https://i.redd.it/25l9brynz6761.png,https://www.reddit.com/r/dataisbeautiful/comments/kjlxhm/oc_us_air_travelers_during_thanksgiving_and/,42,42,,6,"OC U.S. Air Travelers During Thanksgiving and Christmas Holidays, 2019 vs. 2020",2020-12-0537.png
"[OC] # of instances of ""day"" and ""night"" in Avicii's The Days and The Nights",saddwarflime,2020-12-24 21:53:06,https://i.redd.it/y8p9oxqsh7761.png,https://www.reddit.com/r/dataisbeautiful/comments/kjnkx0/oc_of_instances_of_day_and_night_in_aviciis_the/,44,44,,3,OC # of instances of day and night in Avicii's The Days and The Nights,2020-12-0538.png
"My hand-drawn chart of the 2020 Election represented by stick figures for every 100,000 votes. (It's high-res so please do open and zoom into the image.) [OC]",Baroque--Obama,2020-12-24 22:38:15,https://i.redd.it/x9lbfrnup7761.png,https://www.reddit.com/r/dataisbeautiful/comments/kjoa42/my_handdrawn_chart_of_the_2020_election/,417,417,,57,"My hand-drawn chart of the 2020 Election represented by stick figures for every 100,000 votes. (It's high-res so please do open and zoom into the imag",2020-12-0539.png
"[OC] Word cloud of Congress' ""6000 Page"" Spending Bill",Xendarq,2020-12-24 22:38:17,https://i.redd.it/9aito860q7761.png,https://www.reddit.com/r/dataisbeautiful/comments/kjoa4k/oc_word_cloud_of_congress_6000_page_spending_bill/,34,34,,12,OC Word cloud of Congress' 6000 Page Spending Bill,2020-12-0540.png
[OC] NBA - Multiple 30+ Point Games on Christmas Day,kenjdaws,2020-12-24 23:22:29,https://i.redd.it/ozhb9nrux7761.png,https://www.reddit.com/r/dataisbeautiful/comments/kjoxx9/oc_nba_multiple_30_point_games_on_christmas_day/,20,20,,1,OC NBA - Multiple 30+ Point Games on Christmas Day,2020-12-0541.png
[OC] An year in review analysis of keywords that have dominated news on Reddit in 2020!,2hrstocolumbiadecisi,2020-12-24 23:34:51,https://i.redd.it/bjz4o0q408761.jpg,https://www.reddit.com/r/dataisbeautiful/comments/kjp4bx/oc_an_year_in_review_analysis_of_keywords_that/,30,30,,3,OC An year in review analysis of keywords that have dominated news on Reddit in 2020!,2020-12-0542.jpg
Bubble bath reduces radiant heat losses from water. [OC],katlian,2020-12-24 23:56:22,https://i.redd.it/z2o0esbv38761.png,https://www.reddit.com/r/dataisbeautiful/comments/kjpfkb/bubble_bath_reduces_radiant_heat_losses_from/,89,89,,13,Bubble bath reduces radiant heat losses from water. OC,2020-12-0543.png
"Wealth, shown to scale (not mine, but I found this to be an interesting perspective)",RegyptianStrut,2020-12-25 01:06:56,https://mkorostoff.github.io/1-pixel-wealth/?fbclid=IwAR266DYM_HEp__7y-7CUqwufqtMQpgtDH2XVpkh3-td29t0aOG34Jy44qlQ,https://www.reddit.com/r/dataisbeautiful/comments/kjqfdj/wealth_shown_to_scale_not_mine_but_i_found_this/,111,111,,38,"Wealth, shown to scale (not mine, but I found this to be an interesting perspective)",2020-12-0544.jpg
Number of unique OP from latest 1K posts on popular NSFW subs and portion that advertise 'OnlyFans' on their profile [OC],i_like_the_idea,2020-12-25 03:42:06,https://i.redd.it/agbnazmp79761.png,https://www.reddit.com/r/dataisbeautiful/comments/kjsgeo/number_of_unique_op_from_latest_1k_posts_on/,22482,22482,,1183,Number of unique OP from latest 1K posts on popular NSFW subs and portion that advertise 'OnlyFans' on their profile OC,2020-12-0545.png
Visualizing NES games [OC],ravan666,2020-12-25 05:47:48,https://i.redd.it/caqzn9ymu9761.png,https://www.reddit.com/r/dataisbeautiful/comments/kju0x8/visualizing_nes_games_oc/,16,16,,1,Visualizing NES games OC,2020-12-0546.png
[OC] Percentage of nudity by years in the Playboy Magazines,RedBlaze4,2020-12-25 08:01:50,https://i.redd.it/8ugy4vxxha761.png,https://www.reddit.com/r/dataisbeautiful/comments/kjvjgr/oc_percentage_of_nudity_by_years_in_the_playboy/,164,164,,25,OC Percentage of nudity by years in the Playboy Magazines,2020-12-0547.png
"[OC] Modern Family Characters' Screen Time, Visualized",tchp86,2020-12-25 13:01:01,https://v.redd.it/c4jbc4fkzb761,https://www.reddit.com/r/dataisbeautiful/comments/kjyode/oc_modern_family_characters_screen_time_visualized/,7666,7666,,227,"OC Modern Family Characters' Screen Time, Visualized",2020-12-0548.png
"[OC] In honor of Christmas, a comparison of Google Search Trends from 2016 to 2020 for 'Polar Express' and 'Die Hard'. Which is the true Christmas Movie (TM)?",teddyterminal,2020-12-25 13:06:32,https://v.redd.it/5u3rg2550c761,https://www.reddit.com/r/dataisbeautiful/comments/kjyqyf/oc_in_honor_of_christmas_a_comparison_of_google/,82,82,,17,"OC In honor of Christmas, a comparison of Google Search Trends from 2016 to 2020 for 'Polar Express' and 'Die Hard'. Which is the true Christmas Movie",2020-12-0549.png
TSA Checkpoint Total Traveler Throughput (2019 VS 2020) [OC],anactualscientist2,2020-12-25 13:17:02,https://i.redd.it/efe2oyas2c761.png,https://www.reddit.com/r/dataisbeautiful/comments/kjyvnt/tsa_checkpoint_total_traveler_throughput_2019_vs/,35,35,,3,TSA Checkpoint Total Traveler Throughput (2019 VS 2020) OC,2020-12-0550.png
US COVID-19 Daily Confirmed Cases & Days Between Each Million Case Milestone (18 Total) [OC],anactualscientist2,2020-12-25 15:08:15,https://i.redd.it/xfb2ovunmc761.png,https://www.reddit.com/r/dataisbeautiful/comments/kk0ezd/us_covid19_daily_confirmed_cases_days_between/,108,108,,9,US COVID-19 Daily Confirmed Cases & Days Between Each Million Case Milestone (18 Total) OC,2020-12-0551.png
[OC] Tired of hearing about the good kids and their Christmas presents? Here's a map of where Santa gets the coal for the bad kids. 2018 Coal Production by State.,toddrjones,2020-12-25 16:26:26,https://i.redd.it/4kyocuql0d761.png,https://www.reddit.com/r/dataisbeautiful/comments/kk1mfp/oc_tired_of_hearing_about_the_good_kids_and_their/,1098,1098,,92,OC Tired of hearing about the good kids and their Christmas presents Here's a map of where Santa gets the coal for the bad kids. 2018 Coal Production,2020-12-0552.png
"Empires, Ideologies, Economies and Vaccines.. Thinking about places that don't have access to SARS-CoV-2 vaccines yet. [OC]",Superfl0,2020-12-25 17:37:40,https://i.redd.it/qjjx19cpcd761.png,https://www.reddit.com/r/dataisbeautiful/comments/kk2r0c/empires_ideologies_economies_and_vaccines/,6,6,,18,"Empires, Ideologies, Economies and Vaccines.. Thinking about places that don't have access to SARS-CoV-2 vaccines yet. OC",2020-12-0553.png
[OC] Geographic epicenter of the Covid-19 pandemic based on the concentration of active cases,TheShimas,2020-12-25 18:02:41,https://v.redd.it/agb41ho3gd761,https://www.reddit.com/r/dataisbeautiful/comments/kk35db/oc_geographic_epicenter_of_the_covid19_pandemic/,47,47,,15,OC Geographic epicenter of the Covid-19 pandemic based on the concentration of active cases,2020-12-0554.png
"[OC] [Remix] The True Christmas Movie: Comparison of Google Search Trends from 2016-2020 for ""Die Hard"" and ""Polar Express""",teddyterminal,2020-12-26 02:29:36,https://i.redd.it/lpg2skrozf761.png,https://www.reddit.com/r/dataisbeautiful/comments/kkau3n/oc_remix_the_true_christmas_movie_comparison_of/,15804,15804,,419,OC Remix The True Christmas Movie Comparison of Google Search Trends from 2016-2020 for Die Hard and Polar Express,2020-12-0555.png
"Visualization of the actual number of Americans jailed or imprisoned, about 2.3 million",Herrkarlson,2020-12-26 09:45:17,https://mkorostoff.github.io/incarceration-in-real-numbers/,https://www.reddit.com/r/dataisbeautiful/comments/kkg2dq/visualization_of_the_actual_number_of_americans/,63,63,,11,"Visualization of the actual number of Americans jailed or imprisoned, about 2.3 million",2020-12-0556.jpg
"[OC] Google Trends of ""Apocalypse"" in Past 5 Years",AmericaSortaSucks,2020-12-26 10:45:39,https://i.redd.it/66vr0p2ngi761.png,https://www.reddit.com/r/dataisbeautiful/comments/kkgpdj/oc_google_trends_of_apocalypse_in_past_5_years/,4,4,,6,OC Google Trends of Apocalypse in Past 5 Years,2020-12-0557.png
"[OC] Better Call Saul Characters' Screen Time, Visualized",tchp86,2020-12-26 13:14:04,https://v.redd.it/j8hthu727j761,https://www.reddit.com/r/dataisbeautiful/comments/kkif1j/oc_better_call_saul_characters_screen_time/,8836,8836,,336,"OC Better Call Saul Characters' Screen Time, Visualized",2020-12-0558.png
[OC] Top 5 schools that have been to the most NCAA women’s basketball championship games since 1982 and their wins vs expectations in each tournament,dataviz_guru,2020-12-26 13:44:48,https://i.redd.it/nq80vkuocj761.jpg,https://www.reddit.com/r/dataisbeautiful/comments/kkistq/oc_top_5_schools_that_have_been_to_the_most_ncaa/,33,33,,7,OC Top 5 schools that have been to the most NCAA women’s basketball championship games since 1982 and their wins vs expectations in each tournament,2020-12-0559.jpg
[OC] Pokemon Metacritic Ratings - Gotta Play 'em All!,randomo_redditor,2020-12-26 14:11:10,https://i.redd.it/oak3qnqahj761.png,https://www.reddit.com/r/dataisbeautiful/comments/kkj5ds/oc_pokemon_metacritic_ratings_gotta_play_em_all/,22,22,,14,OC Pokemon Metacritic Ratings - Gotta Play 'em All!,2020-12-0560.png
Bitcoin just dominated Samsung and Visa in market cap taking gobal ranking #13 Berkshire Hathaway next,ArrayBoy,2020-12-26 16:00:16,https://companiesmarketcap.com/assets-by-market-cap/,https://www.reddit.com/r/dataisbeautiful/comments/kkkq5s/bitcoin_just_dominated_samsung_and_visa_in_market/,5,5,,9,Bitcoin just dominated Samsung and Visa in market cap taking gobal ranking #13 Berkshire Hathaway next,2020-12-0561.jpg
[OC] BioNTech/Pfizer vaccine sequence visualized,futilon,2020-12-26 17:34:42,https://i.redd.it/wpvrf6hzek761.png,https://www.reddit.com/r/dataisbeautiful/comments/kkmavd/oc_biontechpfizer_vaccine_sequence_visualized/,149,149,,24,OC BioNTechPfizer vaccine sequence visualized,2020-12-0562.png
Audience Reception of Twin Peaks [OC],Waffle2006,2020-12-26 18:19:52,https://i.redd.it/o1jy0mjqpk761.png,https://www.reddit.com/r/dataisbeautiful/comments/kkn2kq/audience_reception_of_twin_peaks_oc/,31,31,,4,Audience Reception of Twin Peaks OC,2020-12-0563.png
"""Our Solar System Poster - Version B"" by National Aeronautics and Space Administration -- The ""graphic is intended to show the accurate scale of the planets, relative to each other and the Sun."" The planets from left to right: Mercury, Venus, Earth, Mars, Jupiter, Saturn, Uranus, Neptune.",trot-trot,2020-12-26 18:44:39,https://solarsystem.nasa.gov/resources/2284/our-solar-system-poster-version-b/,https://www.reddit.com/r/dataisbeautiful/comments/kknhxa/our_solar_system_poster_version_b_by_national/,59,59,,13,Our Solar System Poster - Version B by National Aeronautics and Space Administration -- The graphic is intended to show the accurate scale of the plan,2020-12-0564.jpg
[OC] Interaction Intensity in the Simpsons,Gandagorn,2020-12-26 20:17:13,https://i.redd.it/ev8vk1ooal761.png,https://www.reddit.com/r/dataisbeautiful/comments/kkp3lr/oc_interaction_intensity_in_the_simpsons/,50920,50920,,1210,OC Interaction Intensity in the Simpsons,2020-12-0565.png
[OC] Hourly passengers for NYC yellow taxis before and after Covid,manningkyle304,2020-12-26 21:14:36,https://i.redd.it/g7jekxffkl761.png,https://www.reddit.com/r/dataisbeautiful/comments/kkq3dc/oc_hourly_passengers_for_nyc_yellow_taxis_before/,187,187,,11,OC Hourly passengers for NYC yellow taxis before and after Covid,2020-12-0566.png
[OC] Traffic Fatality Rate (2019CY) vs COVID-19 Fatality Rate (2020CY) by Age (Americans),Fox_Powers,2020-12-26 23:10:09,https://i.redd.it/om9kfknh5m761.png,https://www.reddit.com/r/dataisbeautiful/comments/kks3u9/oc_traffic_fatality_rate_2019cy_vs_covid19/,100,100,,23,OC Traffic Fatality Rate (2019CY) vs COVID-19 Fatality Rate (2020CY) by Age (Americans),2020-12-0567.png
"UK ""Trade in Numbers"" February 2020",blue_strat,2020-12-27 03:32:09,https://i.redd.it/ysk8f1vxfn761.png,https://www.reddit.com/r/dataisbeautiful/comments/kkwb6i/uk_trade_in_numbers_february_2020/,26,26,,3,UK Trade in Numbers February 2020,2020-12-0568.png
[OC][Update] Pokemon Games Metacritic Ratings - Gotta Play 'em All!,randomo_redditor,2020-12-27 04:21:15,https://i.redd.it/ajq7fl51pn761.png,https://www.reddit.com/r/dataisbeautiful/comments/kkx0xu/ocupdate_pokemon_games_metacritic_ratings_gotta/,27,27,,16,OCUpdate Pokemon Games Metacritic Ratings - Gotta Play 'em All!,2020-12-0569.png
Arsenal’s worst start ever? [oc],Inside-Advantage-636,2020-12-27 04:40:04,https://i.redd.it/ipdzs5sesn761.jpg,https://www.reddit.com/r/dataisbeautiful/comments/kkxavv/arsenals_worst_start_ever_oc/,7,7,,4,Arsenal’s worst start ever oc,2020-12-0570.jpg
[OC] Potentially good areas to look for dinner in LA (data from Los Angeles County Department of Public Health aggregated from years 2018 to June 2020),ira_koroleva,2020-12-27 05:01:23,https://i.redd.it/uku26p3orn761.png,https://www.reddit.com/r/dataisbeautiful/comments/kkxmra/oc_potentially_good_areas_to_look_for_dinner_in/,19,19,,5,OC Potentially good areas to look for dinner in LA (data from Los Angeles County Department of Public Health aggregated from years 2018 to June 2020),2020-12-0571.png
[OC] r/IBSResearch Survey 2020 Results,Robert_Larsson,2020-12-27 09:03:25,https://i.redd.it/rdu0jgeb3p761.png,https://www.reddit.com/r/dataisbeautiful/comments/kl0l9c/oc_ribsresearch_survey_2020_results/,21,21,,9,OC rIBSResearch Survey 2020 Results,2020-12-0572.png
Population Density Across the Globe,booksmoothie,2020-12-27 14:08:03,https://luminocity3d.org/WorldPopDen,https://www.reddit.com/r/dataisbeautiful/comments/kl48cs/population_density_across_the_globe/,35,35,,3,Population Density Across the Globe,2020-12-0573.jpg
