title,author,created_date,url,full_permalink,score,ups,downs,num_comments,sanitized_title,image_file
"[OC] Comparing how Happy each country is to the median income (US$, PPP)",Rakoor_11037,2020-12-01 01:10:20,https://i.redd.it/xqhhheb86h261.png,https://www.reddit.com/r/dataisbeautiful/comments/k4a48j/oc_comparing_how_happy_each_country_is_to_the/,130,130,,46,"OC Comparing how Happy each country is to the median income (US$, PPP)",2020-12-0000.png
"[OC] Number of prostitutes per 10,000 people, as of 2016-2018.",zombieggs,2020-12-01 01:40:56,https://i.redd.it/9vfjqtgoch261.png,https://www.reddit.com/r/dataisbeautiful/comments/k4aofi/oc_number_of_prostitutes_per_10000_people_as_of/,831,831,,184,"OC Number of prostitutes per 10,000 people, as of 2016-2018.",2020-12-0001.png
COVID19 mean growth rate per Mexican state for the last 28 days [OC],toothlesshark123,2020-12-01 02:43:23,https://i.redd.it/dr25jnbwnh261.jpg,https://www.reddit.com/r/dataisbeautiful/comments/k4bspz/covid19_mean_growth_rate_per_mexican_state_for/,9,9,,1,COVID19 mean growth rate per Mexican state for the last 28 days OC,2020-12-0002.jpg
US correlation of deaths vs days after new cases. Deaths trends tend to follow about 17 days after new cases. [OC],gatogetaway,2020-12-01 06:31:34,https://i.redd.it/iiacxc6ksi261.png,https://www.reddit.com/r/dataisbeautiful/comments/k4fhad/us_correlation_of_deaths_vs_days_after_new_cases/,38,38,,16,US correlation of deaths vs days after new cases. Deaths trends tend to follow about 17 days after new cases. OC,2020-12-0003.png
New coronavirus cases per million by country [OC],Uncleniles,2020-12-01 09:36:33,https://i.redd.it/xn3s8udsoj261.png,https://www.reddit.com/r/dataisbeautiful/comments/k4ht8q/new_coronavirus_cases_per_million_by_country_oc/,5,5,,11,New coronavirus cases per million by country OC,2020-12-0004.png
[OC] Accessibility by public transport over 24 hours from Malmö Central Station (Sweden),walwstrow,2020-12-01 10:08:41,https://v.redd.it/n7kgm9m9vj261,https://www.reddit.com/r/dataisbeautiful/comments/k4i7ac/oc_accessibility_by_public_transport_over_24/,652,652,,25,OC Accessibility by public transport over 24 hours from Malmö Central Station (Sweden),2020-12-0005.png
[OC] Visualisation of Population density of a part of India in 2020,The_DarkMatter,2020-12-01 11:01:32,https://i.redd.it/6pvqj9if4k261.png,https://www.reddit.com/r/dataisbeautiful/comments/k4itm6/oc_visualisation_of_population_density_of_a_part/,266,266,,16,OC Visualisation of Population density of a part of India in 2020,2020-12-0006.png
[OC] Weekly death rate in Poland from 2000,corn86,2020-12-01 11:48:20,https://i.redd.it/yjk217kuck261.png,https://www.reddit.com/r/dataisbeautiful/comments/k4jes9/oc_weekly_death_rate_in_poland_from_2000/,81,81,,12,OC Weekly death rate in Poland from 2000,2020-12-0007.png
[OC] Solving a maze using the A* pathfinding algorithm,Gullyn1,2020-12-01 11:53:07,https://v.redd.it/55imperpdk261,https://www.reddit.com/r/dataisbeautiful/comments/k4jgzg/oc_solving_a_maze_using_the_a_pathfinding/,626,626,,40,OC Solving a maze using the A pathfinding algorithm,2020-12-0008.png
[OC] COVID-19 pushed more growth in online shopping than anything in history.,takenorinvalid,2020-12-01 13:54:33,https://i.redd.it/imdg8l57wk261.jpg,https://www.reddit.com/r/dataisbeautiful/comments/k4l94w/oc_covid19_pushed_more_growth_in_online_shopping/,150,150,,13,OC COVID-19 pushed more growth in online shopping than anything in history.,2020-12-0009.jpg
[OC] The vascular system of Croatia,futilon,2020-12-01 15:48:44,https://i.redd.it/oja1k92xjl261.png,https://www.reddit.com/r/dataisbeautiful/comments/k4ne4u/oc_the_vascular_system_of_croatia/,167,167,,6,OC The vascular system of Croatia,2020-12-0010.png
"South Dakota and Illinois became the 9th & 10th states where COVID19 has killed at least 1 out of every 1,000 residents",julian88888888,2020-12-01 15:54:58,https://pbs.twimg.com/media/En3zVwlXYAEx_1L?format=jpg&name=4096x4096,https://www.reddit.com/r/dataisbeautiful/comments/k4nirv/south_dakota_and_illinois_became_the_9th_10th/,8,8,,4,"South Dakota and Illinois became the 9th & 10th states where COVID19 has killed at least 1 out of every 1,000 residents",2020-12-0011.jpg
[OC] Nov. 2020 Exact US COVID Deaths in a Jar - NYT Data,domriccobene,2020-12-01 17:03:25,https://v.redd.it/emvajcd6xl261,https://www.reddit.com/r/dataisbeautiful/comments/k4oyd9/oc_nov_2020_exact_us_covid_deaths_in_a_jar_nyt/,108,108,,27,OC Nov. 2020 Exact US COVID Deaths in a Jar - NYT Data,2020-12-0012.png
Global temperature spear Inspired by @velimirgasp who animated a brilliant idea by @paulrickards [OC],neilrkaye,2020-12-01 17:12:07,https://v.redd.it/f29bmyfvyl261,https://www.reddit.com/r/dataisbeautiful/comments/k4p566/global_temperature_spear_inspired_by_velimirgasp/,156,156,,14,Global temperature spear Inspired by @velimirgasp who animated a brilliant idea by @paulrickards OC,2020-12-0013.png
Population map of the U.S. in bubbles [OC],lookatnum,2020-12-01 17:53:48,https://v.redd.it/mh8okeq96m261,https://www.reddit.com/r/dataisbeautiful/comments/k4q1iw/population_map_of_the_us_in_bubbles_oc/,17861,17861,,398,Population map of the U.S. in bubbles OC,2020-12-0014.png
Leftover Turkey Flowchart,dwaxe,2020-12-01 17:58:33,https://flowingdata.com/2020/11/30/leftover-turkey-flowchart/,https://www.reddit.com/r/dataisbeautiful/comments/k4q55q/leftover_turkey_flowchart/,7,7,,1,Leftover Turkey Flowchart,2020-12-0015.jpg
"Result of Reddit users collectively searching ""why is my pee red"" at 1:00pm EST. We..did it?? [OC]",ISAIDPEWPEW,2020-12-01 18:35:11,https://i.redd.it/rso5mhljdm261.png,https://www.reddit.com/r/dataisbeautiful/comments/k4qxc7/result_of_reddit_users_collectively_searching_why/,47,47,,8,Result of Reddit users collectively searching why is my pee red at 100pm EST. We..did it OC,2020-12-0016.png
[OC] Dark Souls 3 bosses ranked by nearest possible crab,SenatorFoghorn,2020-12-01 19:35:19,https://i.redd.it/v7vo3e7bom261.png,https://www.reddit.com/r/dataisbeautiful/comments/k4s7r7/oc_dark_souls_3_bosses_ranked_by_nearest_possible/,269,269,,42,OC Dark Souls 3 bosses ranked by nearest possible crab,2020-12-0017.png
[OC] commonality of month names sorted in chronological order,Frankthetank8,2020-12-01 20:32:45,https://i.redd.it/85hp3fxmym261.png,https://www.reddit.com/r/dataisbeautiful/comments/k4tflk/oc_commonality_of_month_names_sorted_in/,30,30,,6,OC commonality of month names sorted in chronological order,2020-12-0018.png
[OC] 2020 UK population density map,Totti1024,2020-12-01 20:43:26,https://i.redd.it/0tvb01ui0n261.png,https://www.reddit.com/r/dataisbeautiful/comments/k4tnqv/oc_2020_uk_population_density_map/,2007,2007,,132,OC 2020 UK population density map,2020-12-0019.png
[OC] Visualization of Europe's Population Density as of 2015,Priestrix,2020-12-01 22:12:13,https://i.redd.it/voktcc1cgn261.png,https://www.reddit.com/r/dataisbeautiful/comments/k4vgi6/oc_visualization_of_europes_population_density_as/,66,66,,17,OC Visualization of Europe's Population Density as of 2015,2020-12-0020.png
[OC] Map of the percentage of people in Texas without health insurance in 2019 [OC},agirlwithoutrage,2020-12-01 22:25:27,https://i.redd.it/qpsd3tv4in261.png,https://www.reddit.com/r/dataisbeautiful/comments/k4vps3/oc_map_of_the_percentage_of_people_in_texas/,22,22,,18,OC Map of the percentage of people in Texas without health insurance in 2019 OC},2020-12-0021.png
The price of electricity from solar declined by 89% in the last 10 years [OC],Max_OurWorldinData,2020-12-01 22:41:55,https://i.redd.it/mb87bpepln261.png,https://www.reddit.com/r/dataisbeautiful/comments/k4w1tq/the_price_of_electricity_from_solar_declined_by/,37719,37719,,1876,The price of electricity from solar declined by 89% in the last 10 years OC,2020-12-0022.png
[OC] Number of climbers at my local gym over during the week.,f---_society,2020-12-01 22:46:15,https://i.redd.it/tddy0tftln261.png,https://www.reddit.com/r/dataisbeautiful/comments/k4w4wj/oc_number_of_climbers_at_my_local_gym_over_during/,20,20,,6,OC Number of climbers at my local gym over during the week.,2020-12-0023.png
"New daily COVID-19 cases per 100,000 among mask-mandated and non–mask-mandated counties before and after the Kansas governor’s executive order requiring masks allowing county opt-out.",Lighting,2020-12-01 22:57:39,https://www.cdc.gov/mmwr/volumes/69/wr/mm6947e2.htm#F1_down,https://www.reddit.com/r/dataisbeautiful/comments/k4wcwq/new_daily_covid19_cases_per_100000_among/,17,17,,10,"New daily COVID-19 cases per 100,000 among mask-mandated and non–mask-mandated counties before and after the Kansas governor’s executive order requiri",2020-12-0024.jpg
"Nearly the entire U.S. has become a COVID hot spot, government map shows",KhabaLox,2020-12-02 02:30:13,https://www.yahoo.com/now/nearly-the-entire-us-has-become-a-covid-hotspot-government-map-shows-221959095.html?pid=8099906&aid=11557605&sid=&guccounter=1,https://www.reddit.com/r/dataisbeautiful/comments/k507vi/nearly_the_entire_us_has_become_a_covid_hot_spot/,511,511,,146,"Nearly the entire U.S. has become a COVID hot spot, government map shows",2020-12-0025.jpg
Amazon Candle Reviews and Covid,SnooSketches4278,2020-12-02 04:27:56,https://twitter.com/kate_ptrv/status/1332398737604431874,https://www.reddit.com/r/dataisbeautiful/comments/k527on/amazon_candle_reviews_and_covid/,0,0,,1,Amazon Candle Reviews and Covid,2020-12-0026.jpg
[OC] Bath & Body Works Fragrances Word Bubble,hannah15153,2020-12-02 04:51:48,https://i.redd.it/7na1zdepfp261.png,https://www.reddit.com/r/dataisbeautiful/comments/k52l2c/oc_bath_body_works_fragrances_word_bubble/,71,71,,19,OC Bath & Body Works Fragrances Word Bubble,2020-12-0027.png
[OC] Which schools get most players drafted to the NBA?,random-data-plots,2020-12-02 05:01:00,https://i.redd.it/ekojc7yvgp261.jpg,https://www.reddit.com/r/dataisbeautiful/comments/k52q37/oc_which_schools_get_most_players_drafted_to_the/,12,12,,4,OC Which schools get most players drafted to the NBA,2020-12-0028.jpg
[OC] Two Friends' SoundCloud mix performance varies by number of unique songs in each mix,rishi524,2020-12-02 05:55:51,https://i.redd.it/io1qdmlqqp261.png,https://www.reddit.com/r/dataisbeautiful/comments/k53jk2/oc_two_friends_soundcloud_mix_performance_varies/,7,7,,3,OC Two Friends' SoundCloud mix performance varies by number of unique songs in each mix,2020-12-0029.png
"Percentage of Each State's Population born in Italy, 1930 [OC]",Biohzd05,2020-12-02 06:43:30,https://i.redd.it/aq16clegzp261.png,https://www.reddit.com/r/dataisbeautiful/comments/k547c7/percentage_of_each_states_population_born_in/,224,224,,56,"Percentage of Each State's Population born in Italy, 1930 OC",2020-12-0030.png
hours of daylight across the world as the year progresses [OC],neilrkaye,2020-12-02 08:37:08,https://v.redd.it/lcs7xjaujq261,https://www.reddit.com/r/dataisbeautiful/comments/k55lq6/hours_of_daylight_across_the_world_as_the_year/,405,405,,19,hours of daylight across the world as the year progresses OC,2020-12-0031.png
[OC] Top Exporters and Importers of COVID-19 essentials,rohitsuratekar,2020-12-02 09:01:41,https://i.redd.it/78z4zw43oq261.png,https://www.reddit.com/r/dataisbeautiful/comments/k55vwn/oc_top_exporters_and_importers_of_covid19/,111,111,,20,OC Top Exporters and Importers of COVID-19 essentials,2020-12-0032.png
[OC] Swiss Popular Initiative result since 1900,Gpapig,2020-12-02 09:07:07,https://i.redd.it/bmv3yv38pq261.png,https://www.reddit.com/r/dataisbeautiful/comments/k55y62/oc_swiss_popular_initiative_result_since_1900/,25,25,,12,OC Swiss Popular Initiative result since 1900,2020-12-0033.png
[OC] Most Popular Anime Genre Combinations,DataCrayon,2020-12-02 10:23:13,https://v.redd.it/qb0vr6in2r261,https://www.reddit.com/r/dataisbeautiful/comments/k56t9h/oc_most_popular_anime_genre_combinations/,72,72,,21,OC Most Popular Anime Genre Combinations,2020-12-0034.png
[OC] Population of the Netherlands as a 3D Map,archibabu,2020-12-02 10:23:20,https://imgur.com/a/vMPvvuf,https://www.reddit.com/r/dataisbeautiful/comments/k56tba/oc_population_of_the_netherlands_as_a_3d_map/,7,7,,4,OC Population of the Netherlands as a 3D Map,2020-12-0035.jpg
[OC] Carbon dioxide emissions from fossil fuel in the Korean Peninsula,datagist,2020-12-02 10:41:54,https://i.redd.it/qcwiqn8p5r261.png,https://www.reddit.com/r/dataisbeautiful/comments/k5716m/oc_carbon_dioxide_emissions_from_fossil_fuel_in/,503,503,,124,OC Carbon dioxide emissions from fossil fuel in the Korean Peninsula,2020-12-0036.png
Foreign Debt to China [OC],AndyClarke527,2020-12-02 11:57:51,https://i.redd.it/tklb839ejr261.jpg,https://www.reddit.com/r/dataisbeautiful/comments/k57xjl/foreign_debt_to_china_oc/,23,23,,9,Foreign Debt to China OC,2020-12-0037.jpg
[OC] Age of Astronauts at Their First Space Flight,justatoysoldier,2020-12-02 12:03:41,https://imgur.com/TYsFtCN,https://www.reddit.com/r/dataisbeautiful/comments/k580d0/oc_age_of_astronauts_at_their_first_space_flight/,12396,12396,,220,OC Age of Astronauts at Their First Space Flight,2020-12-0038.jpg
Ratio Between Subscribers on State Subreddit and State Population [OC],diadem015,2020-12-02 12:49:29,https://i.redd.it/p1liheivsr261.png,https://www.reddit.com/r/dataisbeautiful/comments/k58mdv/ratio_between_subscribers_on_state_subreddit_and/,434,434,,56,Ratio Between Subscribers on State Subreddit and State Population OC,2020-12-0039.png
"Daily deaths, France, 2001 - 2020",Youriclinton,2020-12-02 13:21:03,https://twitter.com/coulmont/status/1334100923992453121?s=21,https://www.reddit.com/r/dataisbeautiful/comments/k5937u/daily_deaths_france_2001_2020/,18,18,,5,"Daily deaths, France, 2001 - 2020",2020-12-0040.jpg
[OC] 3D Mapping of The Global Climate,vividmaps,2020-12-02 13:33:46,https://vividmaps.com/global-climate-3d-maps/,https://www.reddit.com/r/dataisbeautiful/comments/k59a8t/oc_3d_mapping_of_the_global_climate/,2,2,,1,OC 3D Mapping of The Global Climate,2020-12-0041.jpg
Average Differential of Projected vs Scored Points by Position Group for NFL Players in ESPN Fantasy Football (Non-PPR) [OC],ivantf15,2020-12-02 14:02:07,https://i.redd.it/i41bxx5c5s261.jpg,https://www.reddit.com/r/dataisbeautiful/comments/k59qsp/average_differential_of_projected_vs_scored/,5,5,,1,Average Differential of Projected vs Scored Points by Position Group for NFL Players in ESPN Fantasy Football (Non-PPR) OC,2020-12-0042.jpg
The whitest provinces of South Africa are also the most crime-ridden [OC],190807,2020-12-02 15:35:54,https://i.redd.it/j30jwvzjms261.png,https://www.reddit.com/r/dataisbeautiful/comments/k5bf2s/the_whitest_provinces_of_south_africa_are_also/,46,46,,46,The whitest provinces of South Africa are also the most crime-ridden OC,2020-12-0043.png
One year of Spotify data plotted alongside my top artist [OC],martinw00,2020-12-02 16:06:24,https://i.redd.it/790lq5u2ss261.jpg,https://www.reddit.com/r/dataisbeautiful/comments/k5c16o/one_year_of_spotify_data_plotted_alongside_my_top/,11,11,,4,One year of Spotify data plotted alongside my top artist OC,2020-12-0044.jpg
Suicides count in 100+ countries [OC],Myphhz,2020-12-02 16:12:17,https://i.redd.it/7nifpzmtss261.png,https://www.reddit.com/r/dataisbeautiful/comments/k5c5jz/suicides_count_in_100_countries_oc/,28,28,,26,Suicides count in 100+ countries OC,2020-12-0045.png
[OC] Spotify tops the trending list Worldwide with 2.6 Million Tweets!,TheVisualizED,2020-12-02 16:16:14,https://i.redd.it/fwj9o9ipts261.png,https://www.reddit.com/r/dataisbeautiful/comments/k5c8dy/oc_spotify_tops_the_trending_list_worldwide_with/,10,10,,7,OC Spotify tops the trending list Worldwide with 2.6 Million Tweets!,2020-12-0046.png
[OC] GDP and GDP per Capita Comparison of Asian Countries,PieChartPirate,2020-12-02 16:24:10,https://v.redd.it/y8bcvwf2vs261,https://www.reddit.com/r/dataisbeautiful/comments/k5ce8m/oc_gdp_and_gdp_per_capita_comparison_of_asian/,808,808,,109,OC GDP and GDP per Capita Comparison of Asian Countries,2020-12-0047.png
"Been a while since this has been shown. Visualization of the Beatles' career including their albums, hit songs, and lyrics from 1964 to 1970.",Locke_N_Load,2020-12-02 16:25:29,http://duelingdata.blogspot.com/2016/01/the-beatles.html,https://www.reddit.com/r/dataisbeautiful/comments/k5cfab/been_a_while_since_this_has_been_shown/,15,15,,3,"Been a while since this has been shown. Visualization of the Beatles' career including their albums, hit songs, and lyrics from 1964 to 1970.",2020-12-0048.jpg
[OC] Who talks the most in South Park?,randomo_redditor,2020-12-02 16:37:21,https://i.redd.it/tj0x7k1ixs261.png,https://www.reddit.com/r/dataisbeautiful/comments/k5cobo/oc_who_talks_the_most_in_south_park/,67,67,,17,OC Who talks the most in South Park,2020-12-0049.png
[OC] Poland: Most common foreign tourists' nationality by region,pieca_111,2020-12-02 17:53:16,https://i.redd.it/tkbkke5x9t261.png,https://www.reddit.com/r/dataisbeautiful/comments/k5eaue/oc_poland_most_common_foreign_tourists/,20198,20198,,993,OC Poland Most common foreign tourists' nationality by region,2020-12-0050.png
[OC] Relationships of F.R.I.E.N.D.S. characters,rohitsuratekar,2020-12-02 18:46:30,https://i.redd.it/1yove5yhkt261.png,https://www.reddit.com/r/dataisbeautiful/comments/k5fg7p/oc_relationships_of_friends_characters/,18,18,,11,OC Relationships of F.R.I.E.N.D.S. characters,2020-12-0051.png
Visualizing 40 Years of Music Industry Sales,vijay2208,2020-12-02 18:50:08,https://www.styleinmood.com/visualizing-40-years-of-music-industry-sales/,https://www.reddit.com/r/dataisbeautiful/comments/k5fj1w/visualizing_40_years_of_music_industry_sales/,0,0,,1,Visualizing 40 Years of Music Industry Sales,2020-12-0052.jpg
American COVID-19 and Overall Deaths by Week and Year [OC],DerekFroese,2020-12-02 20:12:10,https://i.redd.it/u7t79usuzt261.png,https://www.reddit.com/r/dataisbeautiful/comments/k5hail/american_covid19_and_overall_deaths_by_week_and/,245,245,,57,American COVID-19 and Overall Deaths by Week and Year OC,2020-12-0053.png
"[OC] Simultaneous Wing / Dual Airfoil Optimization to Equalize Lift and Minimize Drag for Two Separate Flight Conditions (Octave, Screen2gif)",DesignPrintBuild,2020-12-02 20:58:52,https://v.redd.it/xky2ezoz7u261,https://www.reddit.com/r/dataisbeautiful/comments/k5i9lw/oc_simultaneous_wing_dual_airfoil_optimization_to/,1,1,,1,"OC Simultaneous Wing Dual Airfoil Optimization to Equalize Lift and Minimize Drag for Two Separate Flight Conditions (Octave, Screen2gif)",2020-12-0054.png
[OC] Air travel over Thanksgiving in the US down almost 60% compared to this time last year,USAFacts_Official,2020-12-03 00:00:47,https://i.redd.it/36p9i2wi4v261.png,https://www.reddit.com/r/dataisbeautiful/comments/k5lsqt/oc_air_travel_over_thanksgiving_in_the_us_down/,1080,1080,,92,OC Air travel over Thanksgiving in the US down almost 60% compared to this time last year,2020-12-0055.png
[OC] IMDb Ratings of The Simpsons TV Show,informatica6,2020-12-03 01:25:07,https://i.redd.it/kc7ngx4rjv261.png,https://www.reddit.com/r/dataisbeautiful/comments/k5na1g/oc_imdb_ratings_of_the_simpsons_tv_show/,389,389,,76,OC IMDb Ratings of The Simpsons TV Show,2020-12-0056.png
"A collection of artistic and interactive data visuals that highlights people's thoughts, moods, and experiences during these uncertain times.",foodetama,2020-12-03 01:31:28,http://odyssee.community/gallery.html,https://www.reddit.com/r/dataisbeautiful/comments/k5ne1p/a_collection_of_artistic_and_interactive_data/,11,11,,5,"A collection of artistic and interactive data visuals that highlights people's thoughts, moods, and experiences during these uncertain times.",2020-12-0057.jpg
[OC] IMDb User Ratings of The Bachelor and The Bachelorette,randomo_redditor,2020-12-03 04:02:13,https://i.redd.it/jbr0rs2pbw261.png,https://www.reddit.com/r/dataisbeautiful/comments/k5px2h/oc_imdb_user_ratings_of_the_bachelor_and_the/,35,35,,15,OC IMDb User Ratings of The Bachelor and The Bachelorette,2020-12-0058.png
Height of the Ocean's Surface [OC],Mathew_Barlow,2020-12-03 04:29:52,https://i.redd.it/qb7ngwcigw261.jpg,https://www.reddit.com/r/dataisbeautiful/comments/k5qcfq/height_of_the_oceans_surface_oc/,137,137,,37,Height of the Ocean's Surface OC,2020-12-0059.jpg
[OC] Population density of Bulgaria,SalamuraSan,2020-12-03 06:04:53,https://i.redd.it/zrhi4ichxw261.png,https://www.reddit.com/r/dataisbeautiful/comments/k5rppv/oc_population_density_of_bulgaria/,40,40,,5,OC Population density of Bulgaria,2020-12-0060.png
When is it acceptable to start playing christmas music? [OC],GradientMetrics,2020-12-03 08:20:28,https://i.redd.it/fc81j8wtlx261.png,https://www.reddit.com/r/dataisbeautiful/comments/k5td4c/when_is_it_acceptable_to_start_playing_christmas/,49022,49022,,2432,When is it acceptable to start playing christmas music OC,2020-12-0061.png
Donald Trump's abysmal post-election litigation record compared to the worst teams in U.S. sports history [OC],JPAnalyst,2020-12-03 11:17:18,https://i.redd.it/44g494dahy261.png,https://www.reddit.com/r/dataisbeautiful/comments/k5ve2h/donald_trumps_abysmal_postelection_litigation/,176,176,,93,Donald Trump's abysmal post-election litigation record compared to the worst teams in U.S. sports history OC,2020-12-0062.png
Most Common Chords in 1504 Ukulele Play Along Songs [OC],yaph,2020-12-03 12:13:08,https://i.redd.it/1511iseary261.png,https://www.reddit.com/r/dataisbeautiful/comments/k5w3mq/most_common_chords_in_1504_ukulele_play_along/,7,7,,2,Most Common Chords in 1504 Ukulele Play Along Songs OC,2020-12-0063.png
[OC] San Francisco road infrastructure (wallpaper?),futilon,2020-12-03 12:24:35,https://i.redd.it/ax7ggtc35y261.png,https://www.reddit.com/r/dataisbeautiful/comments/k5w973/oc_san_francisco_road_infrastructure_wallpaper/,21,21,,4,OC San Francisco road infrastructure (wallpaper),2020-12-0064.png
Deaths in A Song of Fire and Ice by Chapter published in PNAS,Wards_and_Witchcraft,2020-12-03 12:32:25,https://www.pnas.org/content/117/46/28582,https://www.reddit.com/r/dataisbeautiful/comments/k5wczl/deaths_in_a_song_of_fire_and_ice_by_chapter/,6,6,,3,Deaths in A Song of Fire and Ice by Chapter published in PNAS,2020-12-0065.jpg
[OC] Popularity of the Queen's Gambit (opening),steveads,2020-12-03 12:51:21,https://i.redd.it/f1ujx6z1yy261.png,https://www.reddit.com/r/dataisbeautiful/comments/k5wmt1/oc_popularity_of_the_queens_gambit_opening/,75,75,,9,OC Popularity of the Queen's Gambit (opening),2020-12-0066.png
[OC] Disney+ | Growing Film Library w/ Declining IMDB Scores,Crash_Recovery,2020-12-03 13:22:18,https://i.redd.it/f6x7fodo3z261.png,https://www.reddit.com/r/dataisbeautiful/comments/k5x3ip/oc_disney_growing_film_library_w_declining_imdb/,61,61,,6,OC Disney+ Growing Film Library w Declining IMDB Scores,2020-12-0067.png
S&P 500 Performance Under the Past 6 Presidents [OC],8BallDuVal,2020-12-03 14:09:26,https://i.redd.it/o0r4qty3cz261.png,https://www.reddit.com/r/dataisbeautiful/comments/k5xun5/sp_500_performance_under_the_past_6_presidents_oc/,10,10,,4,S&P 500 Performance Under the Past 6 Presidents OC,2020-12-0068.png
[OC] Covid case per capita by US state,RLJ05,2020-12-03 14:17:42,https://i.redd.it/ea2r6ij8dz261.png,https://www.reddit.com/r/dataisbeautiful/comments/k5xzp6/oc_covid_case_per_capita_by_us_state/,32,32,,21,OC Covid case per capita by US state,2020-12-0069.png
Most points scored between 1999 and 2020 on NBA WordCloud [OC].,caiowsky,2020-12-03 14:20:14,https://i.redd.it/98mmb171ez261.png,https://www.reddit.com/r/dataisbeautiful/comments/k5y16y/most_points_scored_between_1999_and_2020_on_nba/,99,99,,15,Most points scored between 1999 and 2020 on NBA WordCloud OC.,2020-12-0070.png
"[OC] Number of times ""Mask"" was said on the Joe Rogan Podcast over time",bazebazebaze,2020-12-03 14:23:02,https://i.imgur.com/f0BX7mx.png,https://www.reddit.com/r/dataisbeautiful/comments/k5y2xt/oc_number_of_times_mask_was_said_on_the_joe_rogan/,4,4,,2,OC Number of times Mask was said on the Joe Rogan Podcast over time,2020-12-0071.png
Looking at the impact of rural voters in 2020 US Presidential Election [OC],Deltanomics,2020-12-03 14:42:36,https://i.redd.it/7t6qaftrhz261.png,https://www.reddit.com/r/dataisbeautiful/comments/k5yfe7/looking_at_the_impact_of_rural_voters_in_2020_us/,31,31,,27,Looking at the impact of rural voters in 2020 US Presidential Election OC,2020-12-0072.png
[OC] US Supreme Court: # of Senators who voted against each nominee,Paduchen,2020-12-03 14:44:29,https://i.redd.it/dmwnwcjl2w261.png,https://www.reddit.com/r/dataisbeautiful/comments/k5ygnz/oc_us_supreme_court_of_senators_who_voted_against/,23,23,,5,OC US Supreme Court # of Senators who voted against each nominee,2020-12-0073.png
[OC] How wrong were the polls? (US election 2020),shaxos,2020-12-03 15:53:00,https://i.redd.it/r6syv84guz261.jpg,https://www.reddit.com/r/dataisbeautiful/comments/k5zr04/oc_how_wrong_were_the_polls_us_election_2020/,1688,1688,,319,OC How wrong were the polls (US election 2020),2020-12-0074.jpg
Netflix made chess cool again,theviktorreznov,2020-12-03 16:58:21,https://medium.com/portfolio-danyal-huq/netflix-made-chess-cool-again-11032d99842c?source=friends_link&sk=079c28b5d3469d3d2f88b23322a90ff3,https://www.reddit.com/r/dataisbeautiful/comments/k612qo/netflix_made_chess_cool_again/,11,11,,6,Netflix made chess cool again,2020-12-0075.jpg
Most Fastballs in Each Zone Since 2008,updoee,2020-12-03 17:12:48,https://twitter.com/darenw/status/1334506034770178062?s=21,https://www.reddit.com/r/dataisbeautiful/comments/k61e5o/most_fastballs_in_each_zone_since_2008/,0,0,,2,Most Fastballs in Each Zone Since 2008,2020-12-0076.jpg
Population Density vs. 2020 Presidential Vote Margin [OC],lookatnum,2020-12-03 17:50:04,https://i.redd.it/6l8ihdbff0361.png,https://www.reddit.com/r/dataisbeautiful/comments/k6262m/population_density_vs_2020_presidential_vote/,187,187,,53,Population Density vs. 2020 Presidential Vote Margin OC,2020-12-0077.png
