title,author,created_date,url,full_permalink,score,ups,downs,num_comments,sanitized_title,image_file
The West vs. The East Active COVID-19 Cases [OC],therealpren,2020-12-13 21:47:33,https://i.redd.it/2vv3yahyy0561.png,https://www.reddit.com/r/dataisbeautiful/comments/kcjkrh/the_west_vs_the_east_active_covid19_cases_oc/,25,25,,27,The West vs. The East Active COVID-19 Cases OC,2020-12-0291.png
Bitcoin is Near All-Time Highs vs search interest (Winter 2020),ConradKilroy,2020-12-13 23:45:29,https://www.visualcapitalist.com/bitcoin-is-near-all-time-highs-and-the-mainstream-doesnt-careyet/,https://www.reddit.com/r/dataisbeautiful/comments/kclrg5/bitcoin_is_near_alltime_highs_vs_search_interest/,4,4,,1,Bitcoin is Near All-Time Highs vs search interest (Winter 2020),2020-12-0292.jpg
A breakdown of my first 1275 games of Among Us [OC],mekdot83,2020-12-13 23:46:08,https://i.redd.it/rlpf1xl4k1561.jpg,https://www.reddit.com/r/dataisbeautiful/comments/kclrvc/a_breakdown_of_my_first_1275_games_of_among_us_oc/,1668,1668,,81,A breakdown of my first 1275 games of Among Us OC,2020-12-0293.jpg
[OC] Women of 2020 - Word clouds of The BBC's 100 Women of 2020 (#TidyTuesday 2020-12-08),brianhaas19,2020-12-14 01:40:41,https://i.redd.it/w2e9a81c42561.png,https://www.reddit.com/r/dataisbeautiful/comments/kcnsfz/oc_women_of_2020_word_clouds_of_the_bbcs_100/,8,8,,4,OC Women of 2020 - Word clouds of The BBC's 100 Women of 2020 (#TidyTuesday 2020-12-08),2020-12-0294.png
"[OC] Deaths by age group in the United States due to September 11,2001 Terrorist Attacks and COVID-19",graphjerk,2020-12-14 03:46:28,https://i.redd.it/wg287wqtq2561.png,https://www.reddit.com/r/dataisbeautiful/comments/kcpvqq/oc_deaths_by_age_group_in_the_united_states_due/,37950,37950,,2591,"OC Deaths by age group in the United States due to September 11,2001 Terrorist Attacks and COVID-19",2020-12-0295.png
[OC] Top Genres from Spotify 2020 Wrapped Survey,rfilla,2020-12-14 03:56:35,https://i.redd.it/9bo1ldyps2561.png,https://www.reddit.com/r/dataisbeautiful/comments/kcq1gx/oc_top_genres_from_spotify_2020_wrapped_survey/,76,76,,13,OC Top Genres from Spotify 2020 Wrapped Survey,2020-12-0296.png
[OC] Zodiac Sign of 293 serial killers,SweetSoursop,2020-12-14 05:15:52,https://i.redd.it/chbzd8ux63561.png,https://www.reddit.com/r/dataisbeautiful/comments/kcr9wa/oc_zodiac_sign_of_293_serial_killers/,79,79,,40,OC Zodiac Sign of 293 serial killers,2020-12-0297.png
[OC] Deadliest Days in US History since 1862,applesauce566,2020-12-14 07:21:53,https://i.redd.it/4peibf7ft3561.jpg,https://www.reddit.com/r/dataisbeautiful/comments/kct00d/oc_deadliest_days_in_us_history_since_1862/,19,19,,20,OC Deadliest Days in US History since 1862,2020-12-0298.jpg
[OC] Topic Graphs: Find the important missing topics in any page,MayhemUK,2020-12-14 12:47:14,https://i.redd.it/dsw8lobed5561.jpg,https://www.reddit.com/r/dataisbeautiful/comments/kcx08o/oc_topic_graphs_find_the_important_missing_topics/,25,25,,2,OC Topic Graphs Find the important missing topics in any page,2020-12-0299.jpg
[OC] The Simpsons Seasons 1-10 catalogued by their popular Memes.,Kaizerdave,2020-12-14 13:15:58,https://i.redd.it/z2xt867nh5561.jpg,https://www.reddit.com/r/dataisbeautiful/comments/kcxf9n/oc_the_simpsons_seasons_110_catalogued_by_their/,71,71,,8,OC The Simpsons Seasons 1-10 catalogued by their popular Memes.,2020-12-0300.jpg
[OC] Where I spent my time working on a game for a year.,TheSeahorseHS,2020-12-14 13:38:36,https://i.redd.it/n6jrvcd8o5561.png,https://www.reddit.com/r/dataisbeautiful/comments/kcxrqw/oc_where_i_spent_my_time_working_on_a_game_for_a/,103,103,,13,OC Where I spent my time working on a game for a year.,2020-12-0301.png
[OC] Time that fathers and mothers spend with their children (1965-2010),eortizospina,2020-12-14 13:41:14,https://i.redd.it/fot79cn2p5561.png,https://www.reddit.com/r/dataisbeautiful/comments/kcxt8i/oc_time_that_fathers_and_mothers_spend_with_their/,32898,32898,,1534,OC Time that fathers and mothers spend with their children (1965-2010),2020-12-0302.png
[OC] Most Popular Cookie Recipes,databayou,2020-12-14 14:06:54,https://i.redd.it/tjpu8avot5561.jpg,https://www.reddit.com/r/dataisbeautiful/comments/kcy8r6/oc_most_popular_cookie_recipes/,6,6,,10,OC Most Popular Cookie Recipes,2020-12-0303.jpg
A day in the Indian Railways Network. Animating Rajdhani trains from and to New Delhi [OC],pratapvardhan,2020-12-14 14:20:03,https://v.redd.it/ki11pp6cv5561,https://www.reddit.com/r/dataisbeautiful/comments/kcyh52/a_day_in_the_indian_railways_network_animating/,60,60,,5,A day in the Indian Railways Network. Animating Rajdhani trains from and to New Delhi OC,2020-12-0304.png
"[OC] Tracked my Chronic Headaches alongside daily ""factors"" for 2 years to spot patterns and monitor changes.",HeroJournal,2020-12-14 14:35:14,https://i.redd.it/q20g7f70y5561.png,https://www.reddit.com/r/dataisbeautiful/comments/kcyqp6/oc_tracked_my_chronic_headaches_alongside_daily/,108,108,,20,OC Tracked my Chronic Headaches alongside daily factors for 2 years to spot patterns and monitor changes.,2020-12-0305.png
[OC] This is a (beautiful?) visualization of how I achieved my goal for 2020: Running 100 km (~62 miles) per month on average.,Long-Danzi,2020-12-14 14:37:14,https://i.redd.it/rp6a5lk3z5561.png,https://www.reddit.com/r/dataisbeautiful/comments/kcyrwj/oc_this_is_a_beautiful_visualization_of_how_i/,23,23,,10,OC This is a (beautiful) visualization of how I achieved my goal for 2020 Running 100 km (~62 miles) per month on average.,2020-12-0306.png
[OC] I created a dashboard in Saleforce to help organize my job search,xhoi,2020-12-14 15:16:22,https://i.redd.it/tjoxznwr56561.png,https://www.reddit.com/r/dataisbeautiful/comments/kczhm3/oc_i_created_a_dashboard_in_saleforce_to_help/,6,6,,5,OC I created a dashboard in Saleforce to help organize my job search,2020-12-0307.png
[OC] Reddit Secret Santa signups from 2009 to 2020,NerdBeast,2020-12-14 15:37:38,https://i.redd.it/03lqbpb496561.png,https://www.reddit.com/r/dataisbeautiful/comments/kczvoc/oc_reddit_secret_santa_signups_from_2009_to_2020/,55,55,,13,OC Reddit Secret Santa signups from 2009 to 2020,2020-12-0308.png
Percentage of People in Poverty by County: 2015-2019,OverflowDs,2020-12-14 16:04:11,https://www.census.gov/library/visualizations/interactive/acs-percentage-poverty-2015-2019.html,https://www.reddit.com/r/dataisbeautiful/comments/kd0duv/percentage_of_people_in_poverty_by_county_20152019/,5,5,,3,Percentage of People in Poverty by County 2015-2019,2020-12-0309.jpg
[OC] My Podcast Download Numbers,SupremeRumHam,2020-12-14 16:22:16,https://i.redd.it/y9v87zysh6561.png,https://www.reddit.com/r/dataisbeautiful/comments/kd0qch/oc_my_podcast_download_numbers/,4,4,,2,OC My Podcast Download Numbers,2020-12-0310.png
Cases of influenza in the USA 2020. Sorry if this is a repost. CDC website https://www.cdc.gov/flu/weekly/index.htm,justtheentiredick,2020-12-14 18:50:42,https://i.redd.it/4zsy5utb87561.jpg,https://www.reddit.com/r/dataisbeautiful/comments/kd3pyi/cases_of_influenza_in_the_usa_2020_sorry_if_this/,8,8,,2,Cases of influenza in the USA 2020. Sorry if this is a repost. CDC website httpswww.cdc.govfluweeklyindex.htm,2020-12-0311.jpg
"[OC] Ratio of the words ""Life(Live)"" and ""Na"" to word count in Opus' ""Live is Life""",rokit2space,2020-12-14 18:53:36,https://i.redd.it/x89741wp87561.jpg,https://www.reddit.com/r/dataisbeautiful/comments/kd3s2l/oc_ratio_of_the_words_lifelive_and_na_to_word/,12,12,,5,OC Ratio of the words Life(Live) and Na to word count in Opus' Live is Life,2020-12-0312.jpg
[OC] Price of a base Chicken Burrito at Chipotle by County,thesabreslicer,2020-12-14 19:09:48,https://i.redd.it/g9jvlc3fb7561.png,https://www.reddit.com/r/dataisbeautiful/comments/kd443y/oc_price_of_a_base_chicken_burrito_at_chipotle_by/,612,612,,80,OC Price of a base Chicken Burrito at Chipotle by County,2020-12-0313.png
[OC] How Much CO2 Driving a Tesla Model 3 Produces Depending on the State in Which the Energy Used to Charge it Was Generated?,tetrakishexahedron,2020-12-14 19:17:27,https://i.redd.it/ate9uzy1d7561.png,https://www.reddit.com/r/dataisbeautiful/comments/kd49y2/oc_how_much_co2_driving_a_tesla_model_3_produces/,50,50,,16,OC How Much CO2 Driving a Tesla Model 3 Produces Depending on the State in Which the Energy Used to Charge it Was Generated,2020-12-0314.png
[OC] The Colors of The Mandalorian (Hue/Saturation Map),PrandtlMan,2020-12-14 19:21:11,https://v.redd.it/hmyg8ocnd7561,https://www.reddit.com/r/dataisbeautiful/comments/kd4cuq/oc_the_colors_of_the_mandalorian_huesaturation_map/,113,113,,11,OC The Colors of The Mandalorian (HueSaturation Map),2020-12-0315.png
[OC] Nevada Split into 2 Areas of Equal Population. Blue and Green spaces each have around 1.35 Million People,TheRealJosh0,2020-12-14 19:35:22,https://i.redd.it/e7ys5fiyf7561.png,https://www.reddit.com/r/dataisbeautiful/comments/kd4o1r/oc_nevada_split_into_2_areas_of_equal_population/,28209,28209,,761,OC Nevada Split into 2 Areas of Equal Population. Blue and Green spaces each have around 1.35 Million People,2020-12-0316.png
"[OC] Nearly 4 years of my Tinder data. [M26, 6', Midwest] Sorry for potato quality and colors, made it over my lunch break. More info in comments.",neregekaj,2020-12-14 19:48:18,https://i.redd.it/2rqb5g9ji7561.png,https://www.reddit.com/r/dataisbeautiful/comments/kd4xqn/oc_nearly_4_years_of_my_tinder_data_m26_6_midwest/,34,34,,20,"OC Nearly 4 years of my Tinder data. M26, 6', Midwest Sorry for potato quality and colors, made it over my lunch break. More info in comments.",2020-12-0317.png
[OC] The Thick Red Line: Governors' Sharpie vs Pen Signing Ratio by Party Affiliation,Zombie_John_Strachan,2020-12-14 20:07:46,https://i.redd.it/2rw3ji82m7561.png,https://www.reddit.com/r/dataisbeautiful/comments/kd5cic/oc_the_thick_red_line_governors_sharpie_vs_pen/,47,47,,15,OC The Thick Red Line Governors' Sharpie vs Pen Signing Ratio by Party Affiliation,2020-12-0318.png
[OC] A year of /r/RedditRequest data - graph shows the time taken to complete successful requests,zzpza,2020-12-14 20:18:18,https://i.imgur.com/qdH4tNU.png,https://www.reddit.com/r/dataisbeautiful/comments/kd5ki1/oc_a_year_of_rredditrequest_data_graph_shows_the/,13,13,,4,OC A year of rRedditRequest data - graph shows the time taken to complete successful requests,2020-12-0319.png
"[OC] Building off of u/graphjerk, Deaths and LIFE YEAR LOSS by age group in the US due to Sept 11, 2001 Terrorist Attacks and COVID-19",sock_fighter,2020-12-14 20:59:53,https://i.redd.it/9sohr38av7561.png,https://www.reddit.com/r/dataisbeautiful/comments/kd6fdu/oc_building_off_of_ugraphjerk_deaths_and_life/,4,4,,2,"OC Building off of ugraphjerk, Deaths and LIFE YEAR LOSS by age group in the US due to Sept 11, 2001 Terrorist Attacks and COVID-19",2020-12-0320.png
[OC] Freezer and Refrigerator Temperature vs. Time,hudson4351,2020-12-14 21:21:49,https://i.imgur.com/cyRXaDZ.jpg,https://www.reddit.com/r/dataisbeautiful/comments/kd6v9y/oc_freezer_and_refrigerator_temperature_vs_time/,46,46,,15,OC Freezer and Refrigerator Temperature vs. Time,2020-12-0321.jpg
US COVID-19 Daily Confirmed Cases & Days Between Each Million Case Milestone (16 Total) [OC],anactualscientist2,2020-12-14 21:57:28,https://i.redd.it/n4rvqz0m58561.png,https://www.reddit.com/r/dataisbeautiful/comments/kd7l1x/us_covid19_daily_confirmed_cases_days_between/,88,88,,13,US COVID-19 Daily Confirmed Cases & Days Between Each Million Case Milestone (16 Total) OC,2020-12-0322.png
United States - Stream order visualization [OC],shadedrelief,2020-12-14 22:22:01,https://i.redd.it/3utikmq0a8561.jpg,https://www.reddit.com/r/dataisbeautiful/comments/kd82iy/united_states_stream_order_visualization_oc/,185,185,,22,United States - Stream order visualization OC,2020-12-0323.jpg
The World’s Biggest Shipping Hubs,Asian_Juan,2020-12-15 02:09:26,https://www.statista.com/chart/23766/biggest-container-ports-by-shipping-volume/,https://www.reddit.com/r/dataisbeautiful/comments/kdcel0/the_worlds_biggest_shipping_hubs/,9,9,,1,The World’s Biggest Shipping Hubs,2020-12-0324.jpg
"[OC] Inspired by the 50/50 post, Made a map showing 90% of Nevada's population in Blue",Zigxy,2020-12-15 02:14:13,https://i.redd.it/ngeuut9ff9561.png,https://www.reddit.com/r/dataisbeautiful/comments/kdchlo/oc_inspired_by_the_5050_post_made_a_map_showing/,361,361,,21,"OC Inspired by the 5050 post, Made a map showing 90% of Nevada's population in Blue",2020-12-0325.png
[OC] A Visualization of NBA Teams 3PT Attempts to Overall Field Goal Attempts - It has been a crazy growth as analytics comes into play 🔥,bobohoe1997,2020-12-15 02:59:13,https://i.redd.it/uk9o1rjhn9561.png,https://www.reddit.com/r/dataisbeautiful/comments/kdd9my/oc_a_visualization_of_nba_teams_3pt_attempts_to/,13,13,,5,OC A Visualization of NBA Teams 3PT Attempts to Overall Field Goal Attempts - It has been a crazy growth as analytics comes into play 🔥,2020-12-0326.png
"[OC] Arizona Deaths from All Causes 2016–19 Average vs 2020 with % Difference, Jan–Oct. Note that the more recent the month, the more likely that some causes of death are still being investigated. In those cases, those deaths have not yet been officially tallied. Nov and Dec 2020 not yet available.",mwltruffaut,2020-12-15 05:47:06,https://i.redd.it/0f7lqj98ga561.png,https://www.reddit.com/r/dataisbeautiful/comments/kdfwo9/oc_arizona_deaths_from_all_causes_201619_average/,23,23,,24,"OC Arizona Deaths from All Causes 2016–19 Average vs 2020 with % Difference, Jan–Oct. Note that the more recent the month, the more likely that some c",2020-12-0327.png
[OC] Applying to internships for three years in film school,electricguitar146,2020-12-15 06:20:51,https://i.redd.it/56bkrofena561.png,https://www.reddit.com/r/dataisbeautiful/comments/kdgd0i/oc_applying_to_internships_for_three_years_in/,56,56,,3,OC Applying to internships for three years in film school,2020-12-0328.png
[OC] Google Year in Search 2020 Top Search Terms,informatica6,2020-12-15 07:55:54,https://i.redd.it/v78l5due4b561.png,https://www.reddit.com/r/dataisbeautiful/comments/kdhjpn/oc_google_year_in_search_2020_top_search_terms/,80441,80441,,2703,OC Google Year in Search 2020 Top Search Terms,2020-12-0329.png
Unemployment and Occupation,dwaxe,2020-12-15 07:58:07,https://flowingdata.com/2020/12/14/unemployment-and-occupation/,https://www.reddit.com/r/dataisbeautiful/comments/kdhkoi/unemployment_and_occupation/,20,20,,3,Unemployment and Occupation,2020-12-0330.jpg
Which data skills are hot right now?,mr_georges,2020-12-15 07:59:03,https://datastudio.google.com/u/0/reporting/8bb2a7bb-4105-474c-a3c7-00b0c86a5861/page/5l4pB,https://www.reddit.com/r/dataisbeautiful/comments/kdhl1c/which_data_skills_are_hot_right_now/,7,7,,0,Which data skills are hot right now,2020-12-0331.jpg
Beton dökerken miksere su katılması faciaya neden oluyor…,kunt312,2020-12-15 08:16:03,http://www.zararlarinelerdir.com/beton-dokerken-miksere-su-katilmasi-faciaya-neden-oluyor/,https://www.reddit.com/r/dataisbeautiful/comments/kdhslo/beton_dökerken_miksere_su_katılması_faciaya_neden/,0,0,,0,Beton dökerken miksere su katılması faciaya neden oluyor…,2020-12-0332.jpg
[OC] The most common finishing time in the London Marathon 2019 was 3hrs 59mins (unsurprising given a lot of people aim for sub 4 hours),knessmonster,2020-12-15 11:58:58,https://i.redd.it/ar9eflsobc561.png,https://www.reddit.com/r/dataisbeautiful/comments/kdkgg8/oc_the_most_common_finishing_time_in_the_london/,145,145,,20,OC The most common finishing time in the London Marathon 2019 was 3hrs 59mins (unsurprising given a lot of people aim for sub 4 hours),2020-12-0333.png
[OC] Increase in Atmospheric Water Vapour Since 1950,a__square__peg,2020-12-15 12:58:22,https://i.redd.it/txomaejmkc561.jpg,https://www.reddit.com/r/dataisbeautiful/comments/kdl9el/oc_increase_in_atmospheric_water_vapour_since_1950/,60,60,,11,OC Increase in Atmospheric Water Vapour Since 1950,2020-12-0334.jpg
[OC] Positions and Angular Separation of Jupiter and Saturn during the Great Conjunction of 2020,myopicsettlement,2020-12-15 14:23:04,https://i.redd.it/0u2pv6cmyc561.png,https://www.reddit.com/r/dataisbeautiful/comments/kdmlbl/oc_positions_and_angular_separation_of_jupiter/,89,89,,10,OC Positions and Angular Separation of Jupiter and Saturn during the Great Conjunction of 2020,2020-12-0335.png
[OC] 57% of all satellites currently in orbit were launched in the last 4 years and ~20% are starlink satellites (launched in the last 2 years),poleco1,2020-12-15 18:07:37,https://i.redd.it/vupptuob5e561.png,https://www.reddit.com/r/dataisbeautiful/comments/kdqv2y/oc_57_of_all_satellites_currently_in_orbit_were/,5883,5883,,215,OC 57% of all satellites currently in orbit were launched in the last 4 years and ~20% are starlink satellites (launched in the last 2 years),2020-12-0336.png
Evolution of the 3 man defence in soccer [OC],pleasehireme777,2020-12-15 18:15:49,https://i.redd.it/x003jdbw4e561.jpg,https://www.reddit.com/r/dataisbeautiful/comments/kdr0zs/evolution_of_the_3_man_defence_in_soccer_oc/,20,20,,6,Evolution of the 3 man defence in soccer OC,2020-12-0337.jpg
Cooperative and solo play board games over the last 20 years [OC],arg2054,2020-12-15 18:38:42,https://i.redd.it/20y4zgptae561.png,https://www.reddit.com/r/dataisbeautiful/comments/kdri5l/cooperative_and_solo_play_board_games_over_the/,17,17,,9,Cooperative and solo play board games over the last 20 years OC,2020-12-0338.png
[OC] Update: 3 weeks later. Case count vs deaths with a two week lag. Shows link between cases and deaths two weeks later.,puredwige,2020-12-15 19:23:43,https://i.redd.it/ql80gsigie561.png,https://www.reddit.com/r/dataisbeautiful/comments/kdsf67/oc_update_3_weeks_later_case_count_vs_deaths_with/,59,59,,19,OC Update 3 weeks later. Case count vs deaths with a two week lag. Shows link between cases and deaths two weeks later.,2020-12-0339.png
"Currently, no single Champions League participant has the #1 position in their own competition [OC]",nickkuiper11,2020-12-15 19:40:43,https://i.redd.it/8imekpeele561.png,https://www.reddit.com/r/dataisbeautiful/comments/kdsreu/currently_no_single_champions_league_participant/,34,34,,14,"Currently, no single Champions League participant has the #1 position in their own competition OC",2020-12-0340.png
Estimates of the effectiveness of policy interventions on the reproductive number of COVID-19 [OC],tamay1,2020-12-16 01:21:51,https://i.redd.it/zvk9oaw0bg561.jpg,https://www.reddit.com/r/dataisbeautiful/comments/kdz6z4/estimates_of_the_effectiveness_of_policy/,29,29,,5,Estimates of the effectiveness of policy interventions on the reproductive number of COVID-19 OC,2020-12-0341.jpg
[OC] Bathymetry of the Zealandia continent,MindsEye_,2020-12-16 01:41:24,https://i.redd.it/3jag9r2ieg561.jpg,https://www.reddit.com/r/dataisbeautiful/comments/kdzj2p/oc_bathymetry_of_the_zealandia_continent/,11693,11693,,260,OC Bathymetry of the Zealandia continent,2020-12-0342.jpg
"[OC] Use of ""Women"" vs ""Females"" - differences in word usage with each",notimeforarcs,2020-12-16 02:53:03,https://i.redd.it/vb930qa4qg561.png,https://www.reddit.com/r/dataisbeautiful/comments/ke0qwu/oc_use_of_women_vs_females_differences_in_word/,129,129,,16,OC Use of Women vs Females - differences in word usage with each,2020-12-0343.png
[OC] I measured the G forces of different rides at Disney World,ar243,2020-12-16 03:13:46,https://i.redd.it/ytuvcuhzug561.png,https://www.reddit.com/r/dataisbeautiful/comments/ke1390/oc_i_measured_the_g_forces_of_different_rides_at/,72,72,,13,OC I measured the G forces of different rides at Disney World,2020-12-0344.png
High School Drug Use Rates Lowest Ever Recorded - RadicalRuss Radio,Outrageous-Channel62,2020-12-16 04:17:30,https://radicalruss.com/high-school-drug-use-rates-lowest-ever-recorded/,https://www.reddit.com/r/dataisbeautiful/comments/ke23xs/high_school_drug_use_rates_lowest_ever_recorded/,27,27,,13,High School Drug Use Rates Lowest Ever Recorded - RadicalRuss Radio,2020-12-0345.jpg
Gravitational-wave apps help students learn about black holes,tcr98,2020-12-16 04:34:16,https://blog.streamlit.io/gravitational-wave-apps-help-students-learn-about-black-holes/,https://www.reddit.com/r/dataisbeautiful/comments/ke2cvt/gravitationalwave_apps_help_students_learn_about/,10,10,,2,Gravitational-wave apps help students learn about black holes,2020-12-0346.jpg
[OC] I Analyzed Twitter Sentiment During Tonight's Bachelorette Episode,Pocky785,2020-12-16 06:44:45,https://i.redd.it/zjgan9zgwh561.png,https://www.reddit.com/r/dataisbeautiful/comments/ke471j/oc_i_analyzed_twitter_sentiment_during_tonights/,33,33,,7,OC I Analyzed Twitter Sentiment During Tonight's Bachelorette Episode,2020-12-0347.png
GPS of 6 Territorial Wolf Packs and How Territorial They Are Except for That White Dude,msdrxn,2020-12-16 08:47:38,https://www.thisiscolossal.com/2019/01/voyageurs-wolf-project/,https://www.reddit.com/r/dataisbeautiful/comments/ke5o23/gps_of_6_territorial_wolf_packs_and_how/,27,27,,1,GPS of 6 Territorial Wolf Packs and How Territorial They Are Except for That White Dude,2020-12-0348.jpg
"[OC] COVID-19 deaths per 100,000 people",Aurify,2020-12-16 08:57:39,https://i.redd.it/uzgwwsw2ki561.png,https://www.reddit.com/r/dataisbeautiful/comments/ke5s25/oc_covid19_deaths_per_100000_people/,248,248,,140,"OC COVID-19 deaths per 100,000 people",2020-12-0349.png
Two parts of a pandemic: How the coronavirus spread in Canada,naelshiab,2020-12-16 13:45:54,https://ici.radio-canada.ca/info/2020/12/pandemie-vagues-covid-19-coronavirus-rassemblements-noel-carte-3D/index-en.html,https://www.reddit.com/r/dataisbeautiful/comments/ke9fuf/two_parts_of_a_pandemic_how_the_coronavirus/,3,3,,1,Two parts of a pandemic How the coronavirus spread in Canada,2020-12-0350.jpg
[OC] Number of COVID-19 vaccination doses administered,redouad,2020-12-16 14:12:03,https://i.redd.it/g632wgce4k561.png,https://www.reddit.com/r/dataisbeautiful/comments/ke9vtw/oc_number_of_covid19_vaccination_doses/,22,22,,21,OC Number of COVID-19 vaccination doses administered,2020-12-0351.png
[OC] The Elements in Bob Ross Paintings,VizWithDan,2020-12-16 14:39:35,https://i.redd.it/bq4mjclc9k561.jpg,https://www.reddit.com/r/dataisbeautiful/comments/keacv4/oc_the_elements_in_bob_ross_paintings/,106,106,,14,OC The Elements in Bob Ross Paintings,2020-12-0352.jpg
Having a little too much fun playing with Excel's 3d mapping for the first time. This is Austin's total COVID count per zip.[OC],gatogetaway,2020-12-16 15:14:57,https://i.redd.it/ujidyqvhfk561.png,https://www.reddit.com/r/dataisbeautiful/comments/keazj9/having_a_little_too_much_fun_playing_with_excels/,453,453,,28,Having a little too much fun playing with Excel's 3d mapping for the first time. This is Austin's total COVID count per zip.OC,2020-12-0353.png
Coronavirus (COVID-19) Vaccinations - Statistics and Research,2old-you,2020-12-16 15:34:29,https://ourworldindata.org/covid-vaccinations,https://www.reddit.com/r/dataisbeautiful/comments/kebbv1/coronavirus_covid19_vaccinations_statistics_and/,5,5,,0,Coronavirus (COVID-19) Vaccinations - Statistics and Research,2020-12-0354.jpg
[OC] Watch COVID-19 spread throughout the UK in this animation,barkmap,2020-12-16 15:54:57,https://v.redd.it/rduy3kaamk561,https://www.reddit.com/r/dataisbeautiful/comments/kebpe0/oc_watch_covid19_spread_throughout_the_uk_in_this/,53527,53527,,1773,OC Watch COVID-19 spread throughout the UK in this animation,2020-12-0355.png
[OC] I plotted the score distributions of 4901 recent /r/science posts to see which fields received the most upvotes. (Feb 27 - Dec 15),gibsramen,2020-12-16 17:22:02,https://i.redd.it/rbbupouh1l561.png,https://www.reddit.com/r/dataisbeautiful/comments/kedf8b/oc_i_plotted_the_score_distributions_of_4901/,26,26,,7,OC I plotted the score distributions of 4901 recent rscience posts to see which fields received the most upvotes. (Feb 27 - Dec 15),2020-12-0356.png
[OC] All Gen 1 Pokemon Ranked by Total Stats,PieChartPirate,2020-12-16 17:32:00,https://v.redd.it/ig5awf1z3l561,https://www.reddit.com/r/dataisbeautiful/comments/kedm72/oc_all_gen_1_pokemon_ranked_by_total_stats/,1418,1418,,89,OC All Gen 1 Pokemon Ranked by Total Stats,2020-12-0357.png
Blockbuster Video US store locations between 1986 and 2019,vijay2208,2020-12-16 18:42:57,https://www.styleinmood.com/blockbuster-video-us-store-locations-between-1986-and-2019/,https://www.reddit.com/r/dataisbeautiful/comments/kef1wb/blockbuster_video_us_store_locations_between_1986/,5,5,,0,Blockbuster Video US store locations between 1986 and 2019,2020-12-0358.jpg
[OC] ~14% of all satellites in orbit are Starlink (and the constellation is only ~2% complete),WazardHarry,2020-12-16 18:55:34,https://i.redd.it/nxytwwhqal561.png,https://www.reddit.com/r/dataisbeautiful/comments/kefazc/oc_14_of_all_satellites_in_orbit_are_starlink_and/,44,44,,12,OC ~14% of all satellites in orbit are Starlink (and the constellation is only ~2% complete),2020-12-0359.png
[OC] Top 5 Google Trending Searches of 2020,shacs27,2020-12-16 20:44:27,https://i.redd.it/0c950jof2m561.png,https://www.reddit.com/r/dataisbeautiful/comments/kehiyu/oc_top_5_google_trending_searches_of_2020/,66,66,,6,OC Top 5 Google Trending Searches of 2020,2020-12-0360.png
"[OC] Sexual assault prosecutions in New Zealand by outcome, 1980-2019",lcmortensen,2020-12-16 21:12:52,https://i.redd.it/mjbgyq4u6m561.png,https://www.reddit.com/r/dataisbeautiful/comments/kei3tm/oc_sexual_assault_prosecutions_in_new_zealand_by/,9,9,,3,"OC Sexual assault prosecutions in New Zealand by outcome, 1980-2019",2020-12-0361.png
