title,author,created_date,url,full_permalink,score,ups,downs,num_comments,sanitized_title,image_file
[OC] Evolution of my friend network on Facebook (2008-2020),rhando94,2020-12-07 14:26:08,https://v.redd.it/lpr233o8yr361,https://www.reddit.com/r/dataisbeautiful/comments/k8hj1n/oc_evolution_of_my_friend_network_on_facebook/,66,66,,8,OC Evolution of my friend network on Facebook (2008-2020),2020-12-0149.png
"[OC] Last week, I defended my dissertation and recorded my heart rate during the event",doctor_who_17,2020-12-07 16:17:08,https://i.redd.it/tjcui4ojis361.jpg,https://www.reddit.com/r/dataisbeautiful/comments/k8jkwp/oc_last_week_i_defended_my_dissertation_and/,61695,61695,,939,"OC Last week, I defended my dissertation and recorded my heart rate during the event",2020-12-0150.jpg
Daily deaths in France 2001-2020,Nilsss,2020-12-07 17:46:44,https://twitter.com/coulmont/status/1334100923992453121,https://www.reddit.com/r/dataisbeautiful/comments/k8le8q/daily_deaths_in_france_20012020/,22,22,,6,Daily deaths in France 2001-2020,2020-12-0151.jpg
Emissions from individual plane flights is comparable to annual per-capita emissions from many less-developed countries [OC],EngagingData,2020-12-07 18:24:53,https://engaging-data.com/airplane-emissions/,https://www.reddit.com/r/dataisbeautiful/comments/k8m7kx/emissions_from_individual_plane_flights_is/,53,53,,3,Emissions from individual plane flights is comparable to annual per-capita emissions from many less-developed countries OC,2020-12-0152.jpg
Jan-Jun American Deaths by Year [OC],smarz1223,2020-12-07 18:38:01,https://i.redd.it/v9qgwjoo7t361.jpg,https://www.reddit.com/r/dataisbeautiful/comments/k8mhd5/janjun_american_deaths_by_year_oc/,46,46,,28,Jan-Jun American Deaths by Year OC,2020-12-0153.jpg
Climate Change Perceptions Index,altmorty,2020-12-07 18:40:30,https://twitter.com/Germanwatch/status/1335887273758482432,https://www.reddit.com/r/dataisbeautiful/comments/k8mj6c/climate_change_perceptions_index/,2,2,,1,Climate Change Perceptions Index,2020-12-0154.jpg
The International Growth of Netflix in the last 20 years Visualized,Used-Personality9560,2020-12-07 18:55:11,https://www.styleinmood.com/the-international-growth-of-netflix-visualized/,https://www.reddit.com/r/dataisbeautiful/comments/k8mtxp/the_international_growth_of_netflix_in_the_last/,1,1,,1,The International Growth of Netflix in the last 20 years Visualized,2020-12-0155.jpg
"Sometimes the data is not very beautiful at all (USA COVID spread rates, 07Dec20)",IcyMike1782,2020-12-07 19:20:04,https://twitter.com/markgongloff/status/1335957618473447428,https://www.reddit.com/r/dataisbeautiful/comments/k8ncoz/sometimes_the_data_is_not_very_beautiful_at_all/,7,7,,3,"Sometimes the data is not very beautiful at all (USA COVID spread rates, 07Dec20)",2020-12-0156.jpg
[OC] Distribution of flavours within a Quality Street selection tub.,hjw5774,2020-12-07 19:24:47,https://i.redd.it/0jzt9wcgft361.jpg,https://www.reddit.com/r/dataisbeautiful/comments/k8ng9w/oc_distribution_of_flavours_within_a_quality/,27,27,,4,OC Distribution of flavours within a Quality Street selection tub.,2020-12-0157.jpg
"All Ships on Earth (every cyan dot is a vessel) overlaid on a political, physical, and population map [OC]",Ebardie,2020-12-07 19:38:16,https://i.redd.it/t8oxdmz2it361.jpg,https://www.reddit.com/r/dataisbeautiful/comments/k8npvt/all_ships_on_earth_every_cyan_dot_is_a_vessel/,36,36,,6,"All Ships on Earth (every cyan dot is a vessel) overlaid on a political, physical, and population map OC",2020-12-0158.jpg
"Daily deaths in every Italian region: 2020 (blue) vs 2015-19 (orange), January to August [OC]",_ptk,2020-12-07 20:06:53,https://i.redd.it/i7z3f7d2nt361.png,https://www.reddit.com/r/dataisbeautiful/comments/k8ob3v/daily_deaths_in_every_italian_region_2020_blue_vs/,13,13,,8,"Daily deaths in every Italian region 2020 (blue) vs 2015-19 (orange), January to August OC",2020-12-0159.png
"[OC] With One Piece approaching chapter 1000, I visualized a timeline of character appearances for the main crew members over the course of the series.",at8official,2020-12-07 20:16:19,https://i.redd.it/3ak5vwzuot361.jpg,https://www.reddit.com/r/dataisbeautiful/comments/k8ohyr/oc_with_one_piece_approaching_chapter_1000_i/,64,64,,4,"OC With One Piece approaching chapter 1000, I visualized a timeline of character appearances for the main crew members over the course of the series.",2020-12-0160.jpg
Price fluctuations of a chessboard on Amazon before and after The queen's gambit,davidoff999,2020-12-07 20:38:43,https://www.joinhoney.com/shop/amazon/p/1_44cb0eb81148ed230147dd048cd75822_44cb0eb81148ed230147dd048cd75822#price-history,https://www.reddit.com/r/dataisbeautiful/comments/k8oxvf/price_fluctuations_of_a_chessboard_on_amazon/,6,6,,2,Price fluctuations of a chessboard on Amazon before and after The queen's gambit,2020-12-0161.jpg
[OC] My approximate Sriracha usage measured once per week,Revanje,2020-12-07 20:46:41,https://i.redd.it/5zc0ekzmut361.jpg,https://www.reddit.com/r/dataisbeautiful/comments/k8p42k/oc_my_approximate_sriracha_usage_measured_once/,317,317,,72,OC My approximate Sriracha usage measured once per week,2020-12-0162.jpg
[OC] 4 months of applying after quitting sales job and applying for only non sales jobs,22sauce,2020-12-07 21:43:16,https://i.redd.it/vrsk0t5t3u361.png,https://www.reddit.com/r/dataisbeautiful/comments/k8q8ss/oc_4_months_of_applying_after_quitting_sales_job/,17,17,,1,OC 4 months of applying after quitting sales job and applying for only non sales jobs,2020-12-0163.png
Cyberpunk 2077 Steam preload https://store.steampowered.com/stats/content/,EndstyleGG,2020-12-07 21:51:05,https://i.redd.it/djg6blkj5u361.png,https://www.reddit.com/r/dataisbeautiful/comments/k8qf0g/cyberpunk_2077_steam_preload/,4,4,,0,Cyberpunk 2077 Steam preload httpsstore.steampowered.comstatscontent,2020-12-0164.png
Car value decay over time and mileage [OC]. Data modeling for 4 cars.,pimprz,2020-12-07 22:29:11,https://i.redd.it/gej9ywnxau361.jpg,https://www.reddit.com/r/dataisbeautiful/comments/k8r4zi/car_value_decay_over_time_and_mileage_oc_data/,206,206,,47,Car value decay over time and mileage OC. Data modeling for 4 cars.,2020-12-0165.jpg
Global Population Density created by Alasdair Rae,CullenaryArtist,2020-12-07 22:45:53,https://twitter.com/undertheraedar/status/1332733136715780096?s=21,https://www.reddit.com/r/dataisbeautiful/comments/k8riay/global_population_density_created_by_alasdair_rae/,15,15,,1,Global Population Density created by Alasdair Rae,2020-12-0166.jpg
[OC] Fifty snowflakes for fifty of the largest North American ski resorts. How do they compare?,Delavyz,2020-12-07 23:17:19,https://i.redd.it/82qpjrs5ku361.png,https://www.reddit.com/r/dataisbeautiful/comments/k8s41o/oc_fifty_snowflakes_for_fifty_of_the_largest/,40,40,,6,OC Fifty snowflakes for fifty of the largest North American ski resorts. How do they compare,2020-12-0167.png
"Violent crime in England, Wales and Northern Ireland [OC]",rspeigal,2020-12-07 23:59:49,https://i.redd.it/rhezq2kusu361.jpg,https://www.reddit.com/r/dataisbeautiful/comments/k8svqy/violent_crime_in_england_wales_and_northern/,47,47,,6,"Violent crime in England, Wales and Northern Ireland OC",2020-12-0168.jpg
U.S. cities with the most new housing in 2020.,JoytotheUniverse,2020-12-08 00:04:47,https://www.yourlawyer.com/library/us-cities-new-housing-2020/,https://www.reddit.com/r/dataisbeautiful/comments/k8sz1u/us_cities_with_the_most_new_housing_in_2020/,13,13,,3,U.S. cities with the most new housing in 2020.,2020-12-0169.jpg
[OC] How has COVID/The Queen's Gambit impacted America's interest in learning chess?,madzthakz,2020-12-08 00:47:21,https://v.redd.it/oaq5mjyb1v361,https://www.reddit.com/r/dataisbeautiful/comments/k8tpuu/oc_how_has_covidthe_queens_gambit_impacted/,57,57,,1,OC How has COVIDThe Queen's Gambit impacted America's interest in learning chess,2020-12-0170.png
"[OC] Viktor Orban's sickly football-mania in Hungary: here's the amount spent on Puskas Arena (190 billion HUF = 527 million EUR) vs the amount missing to renovate Chain Bridge, Budapest's oldest and most iconic bridge (6 billion HUF = 17 million EUR) visualized with 20K HUF (55 EUR) banknotes",GeryGreyhound,2020-12-08 00:54:28,https://i.redd.it/vay96uq91v361.jpg,https://www.reddit.com/r/dataisbeautiful/comments/k8tuf2/oc_viktor_orbans_sickly_footballmania_in_hungary/,27,27,,3,OC Viktor Orban's sickly football-mania in Hungary here's the amount spent on Puskas Arena (190 billion HUF = 527 million EUR) vs the amount missing t,2020-12-0171.jpg
Cumulative number of tropical storms formed in the Atlantic basin during hurricane seasons 1995-2020 [OC][UPDATED],mnms93,2020-12-08 01:22:52,https://i.redd.it/qq3kl1vq7v361.jpg,https://www.reddit.com/r/dataisbeautiful/comments/k8ubya/cumulative_number_of_tropical_storms_formed_in/,55,55,,15,Cumulative number of tropical storms formed in the Atlantic basin during hurricane seasons 1995-2020 OCUPDATED,2020-12-0172.jpg
[OC] The impact that various kinds of orders and vacation days has on my performance at work of sending approval drawings out in the allotted time given. My annual review is this week so any criticism on how to make this better and visually pleasing is welcomed!,cmillzzzzz,2020-12-08 01:30:37,https://i.redd.it/h9hqlioa9v361.jpg,https://www.reddit.com/r/dataisbeautiful/comments/k8ugp7/oc_the_impact_that_various_kinds_of_orders_and/,3,3,,7,OC The impact that various kinds of orders and vacation days has on my performance at work of sending approval drawings out in the allotted time given,2020-12-0173.jpg
[OC] Toronto Shelters - Average nightly number of people served in Toronto's shelter system. (#TidyTuesday 2020-12-01),brianhaas19,2020-12-08 01:37:33,https://i.redd.it/tf235xq1av361.png,https://www.reddit.com/r/dataisbeautiful/comments/k8ul1y/oc_toronto_shelters_average_nightly_number_of/,7,7,,7,OC Toronto Shelters - Average nightly number of people served in Toronto's shelter system. (#TidyTuesday 2020-12-01),2020-12-0174.png
"[OC] How Many Taco Bell Sauce Packets Received After Asking for ""Two of Each""",MayoDomo,2020-12-08 01:38:08,https://i.redd.it/cjix1ankav361.png,https://www.reddit.com/r/dataisbeautiful/comments/k8ulez/oc_how_many_taco_bell_sauce_packets_received/,117,117,,17,OC How Many Taco Bell Sauce Packets Received After Asking for Two of Each,2020-12-0175.png
[OC] Tracked my runs in November,scottishbee,2020-12-08 01:42:33,https://v.redd.it/b9pjfu23bv361,https://www.reddit.com/r/dataisbeautiful/comments/k8uo4b/oc_tracked_my_runs_in_november/,47,47,,10,OC Tracked my runs in November,2020-12-0176.png
[OC] I made web 3D interactive visualization of Periodic Table of Elements,dev_kr,2020-12-08 04:47:56,https://v.redd.it/m1mwex888w361,https://www.reddit.com/r/dataisbeautiful/comments/k8xpj6/oc_i_made_web_3d_interactive_visualization_of/,33084,33084,,450,OC I made web 3D interactive visualization of Periodic Table of Elements,2020-12-0177.png
[OC] Waves of hype: Organic vs bot-amplified tweets about Cyberpunk 2077,eschibli,2020-12-08 05:59:28,https://i.redd.it/judk89h4lw361.png,https://www.reddit.com/r/dataisbeautiful/comments/k8yr9z/oc_waves_of_hype_organic_vs_botamplified_tweets/,15,15,,5,OC Waves of hype Organic vs bot-amplified tweets about Cyberpunk 2077,2020-12-0178.png
"[OC] I ""re-discovered"" the solar analemma in a 3D globe simulation",OmarShehata,2020-12-08 06:05:33,https://v.redd.it/hlk3dcx4mw361,https://www.reddit.com/r/dataisbeautiful/comments/k8yuh9/oc_i_rediscovered_the_solar_analemma_in_a_3d/,42,42,,3,OC I re-discovered the solar analemma in a 3D globe simulation,2020-12-0179.png
Covid deaths and equivalent battle loses by U.S [OC],cavedave,2020-12-08 06:56:47,https://i.redd.it/7i2uucv6vw361.png,https://www.reddit.com/r/dataisbeautiful/comments/k8zifk/covid_deaths_and_equivalent_battle_loses_by_us_oc/,170,170,,56,Covid deaths and equivalent battle loses by U.S OC,2020-12-0180.png
[OC] U.S. Regions According to the Census Bureau,jkim088,2020-12-08 07:20:39,https://i.redd.it/ftugl2wlzw361.png,https://www.reddit.com/r/dataisbeautiful/comments/k8ztdr/oc_us_regions_according_to_the_census_bureau/,51,51,,10,OC U.S. Regions According to the Census Bureau,2020-12-0181.png
[OC] The biomass distribution of the animal kingdom,davidmasp,2020-12-08 11:53:45,https://i.redd.it/9sud82eacy361.png,https://www.reddit.com/r/dataisbeautiful/comments/k92wof/oc_the_biomass_distribution_of_the_animal_kingdom/,35529,35529,,1248,OC The biomass distribution of the animal kingdom,2020-12-0182.png
[OC] PS5 Online Availability Since Launch,ArchitectureWontDo,2020-12-08 13:13:54,https://i.redd.it/r9fhxvspqy361.png,https://www.reddit.com/r/dataisbeautiful/comments/k93xt8/oc_ps5_online_availability_since_launch/,70,70,,21,OC PS5 Online Availability Since Launch,2020-12-0183.png
[OC] I finished watching Star Trek TNG and decided to double down on being a nerd and analyze the scripts over the 7 seasons.,flying-nerd,2020-12-08 14:18:02,https://i.redd.it/0n8eg8j72z361.jpg,https://www.reddit.com/r/dataisbeautiful/comments/k94xe3/oc_i_finished_watching_star_trek_tng_and_decided/,824,824,,133,OC I finished watching Star Trek TNG and decided to double down on being a nerd and analyze the scripts over the 7 seasons.,2020-12-0184.jpg
[OC] Density of the places of worship in the USA,futilon,2020-12-08 15:06:22,https://i.redd.it/jug90ykoaz361.png,https://www.reddit.com/r/dataisbeautiful/comments/k95rqs/oc_density_of_the_places_of_worship_in_the_usa/,70,70,,21,OC Density of the places of worship in the USA,2020-12-0185.png
[OC] Numbers in Reddit Comments Follow Benford's Law. The most similar subreddit is kind of embarrassing...,encode_,2020-12-08 15:37:33,https://i.redd.it/02ofz1omez361.png,https://www.reddit.com/r/dataisbeautiful/comments/k96cv5/oc_numbers_in_reddit_comments_follow_benfords_law/,115,115,,22,OC Numbers in Reddit Comments Follow Benford's Law. The most similar subreddit is kind of embarrassing...,2020-12-0186.png
COVIDCast | The Delphi Team - Mask Compliance in USA,FarPhilosophy4,2020-12-08 16:06:17,https://delphi.cmu.edu/covidcast/?sensor=fb-survey-smoothed_wearing_mask&level=county&date=20201204&signalType=value&encoding=color&mode=overview&region=42003,https://www.reddit.com/r/dataisbeautiful/comments/k96wre/covidcast_the_delphi_team_mask_compliance_in_usa/,4,4,,1,COVIDCast The Delphi Team - Mask Compliance in USA,2020-12-0187.jpg
Audio-Visual Report of 2020 California Wildfires Data,Katy_AI,2020-12-08 16:11:08,https://www.macheye.com/blog/2020-California-wildfires-in-6-audio-visuals/,https://www.reddit.com/r/dataisbeautiful/comments/k9705b/audiovisual_report_of_2020_california_wildfires/,3,3,,0,Audio-Visual Report of 2020 California Wildfires Data,2020-12-0188.jpg
Lived-area and lived-population density: geo-regions w/ 99.7% of population,CuttingWithScissors,2020-12-08 17:06:30,https://community.wolfram.com/groups/-/m/t/2123980,https://www.reddit.com/r/dataisbeautiful/comments/k9845p/livedarea_and_livedpopulation_density_georegions/,1,1,,0,Lived-area and lived-population density geo-regions w 99.7% of population,2020-12-0189.jpg
Where highly educated migrants come from,RGBchocolate,2020-12-08 17:09:46,https://twitter.com/wef/status/1336211443537108994?s=20,https://www.reddit.com/r/dataisbeautiful/comments/k986ib/where_highly_educated_migrants_come_from/,26,26,,10,Where highly educated migrants come from,2020-12-0190.jpg
"[OC] COVID Deaths Per Capita Over Time, Small Multiples",jonahfeld,2020-12-08 17:20:53,https://i.redd.it/tt6xojepxz361.png,https://www.reddit.com/r/dataisbeautiful/comments/k98eh8/oc_covid_deaths_per_capita_over_time_small/,31,31,,15,"OC COVID Deaths Per Capita Over Time, Small Multiples",2020-12-0191.png
Elevation of the Contiguous US Interstate System [OC],newishtodc,2020-12-08 17:29:16,https://i.redd.it/pnh16s6600461.jpg,https://www.reddit.com/r/dataisbeautiful/comments/k98ks2/elevation_of_the_contiguous_us_interstate_system/,1725,1725,,90,Elevation of the Contiguous US Interstate System OC,2020-12-0192.jpg
World Countries Ranked by Electricity-Consumption Per Person,Artemistical,2020-12-08 18:04:01,https://solarpower.guide/solar-energy-insights/countries-energy-consumption-per-capita,https://www.reddit.com/r/dataisbeautiful/comments/k99a9u/world_countries_ranked_by_electricityconsumption/,8,8,,1,World Countries Ranked by Electricity-Consumption Per Person,2020-12-0193.jpg
"[OC] All ships on Earth (version 2 — more data, more accurate, 2020 year)",datagist,2020-12-08 18:14:19,https://i.redd.it/57iwxrwt70461.png,https://www.reddit.com/r/dataisbeautiful/comments/k99i38/oc_all_ships_on_earth_version_2_more_data_more/,154,154,,17,"OC All ships on Earth (version 2 — more data, more accurate, 2020 year)",2020-12-0194.png
Record-Breaking Hurricane Season 2020: The path and intensity of every storm [OC],chogan272,2020-12-08 18:38:51,https://v.redd.it/m3b7y74hc0461,https://www.reddit.com/r/dataisbeautiful/comments/k9a0c8/recordbreaking_hurricane_season_2020_the_path_and/,180,180,,26,Record-Breaking Hurricane Season 2020 The path and intensity of every storm OC,2020-12-0195.png
A region and country breakdown of commodities driving deforestation,Friend_of_the_trees,2020-12-08 19:10:44,https://i.imgur.com/cS10bF9.jpeg,https://www.reddit.com/r/dataisbeautiful/comments/k9aoet/a_region_and_country_breakdown_of_commodities/,9,9,,2,A region and country breakdown of commodities driving deforestation,2020-12-0196.jpg
"[OC] As the pandemic stretches into its 9th month, people’s attitudes toward COVID have relaxed. We animated real-time, COVID data to visualize the latest COVID’s surge spread through the U.S. from September 2020.",covidactnow,2020-12-08 19:28:45,https://v.redd.it/m04je8ckl0461,https://www.reddit.com/r/dataisbeautiful/comments/k9b2l2/oc_as_the_pandemic_stretches_into_its_9th_month/,108,108,,31,"OC As the pandemic stretches into its 9th month, people’s attitudes toward COVID have relaxed. We animated real-time, COVID data to visualize the late",2020-12-0197.png
[OC] House or flat? Distribution of EU state populations by dwelling type,theYode,2020-12-08 20:21:32,https://i.redd.it/3wey5w4wu0461.png,https://www.reddit.com/r/dataisbeautiful/comments/k9c59q/oc_house_or_flat_distribution_of_eu_state/,11,11,,6,OC House or flat Distribution of EU state populations by dwelling type,2020-12-0198.png
BBC Covonavirus Flowers (Better With Sound On),andrewcooke,2020-12-08 20:33:21,https://www.bbc.co.uk/news/resources/idt-7464500a-6368-4029-aa41-ab94e0ee09fb,https://www.reddit.com/r/dataisbeautiful/comments/k9cdq7/bbc_covonavirus_flowers_better_with_sound_on/,2,2,,1,BBC Covonavirus Flowers (Better With Sound On),2020-12-0199.jpg
[OC] Nightly bat activity by species over last winter in Middle Tennessee with temperature at sunset,dustfinger26,2020-12-08 21:56:48,https://i.redd.it/adp6kg5mb1461.png,https://www.reddit.com/r/dataisbeautiful/comments/k9e0pp/oc_nightly_bat_activity_by_species_over_last/,16,16,,1,OC Nightly bat activity by species over last winter in Middle Tennessee with temperature at sunset,2020-12-0200.png
Pfizer COVID vaccine effectiveness vs time,hypnotheorist,2020-12-09 00:50:28,https://marginalrevolution.com/marginalrevolution/2020/12/the-vaccine-works-fast.html,https://www.reddit.com/r/dataisbeautiful/comments/k9h90u/pfizer_covid_vaccine_effectiveness_vs_time/,19,19,,2,Pfizer COVID vaccine effectiveness vs time,2020-12-0201.jpg
Updated: Spread of covid in the US 10/6 - 12/6 [OC],Gerald_Fjord,2020-12-09 03:14:43,https://v.redd.it/f6d0aasgw2461,https://www.reddit.com/r/dataisbeautiful/comments/k9jqgy/updated_spread_of_covid_in_the_us_106_126_oc/,10,10,,6,Updated Spread of covid in the US 106 - 126 OC,2020-12-0202.png
"""The Short History of Global Living Conditions"" #HumanProgress",tonymmorley,2020-12-09 03:38:47,https://ourworldindata.org/a-history-of-global-living-conditions-in-5-charts,https://www.reddit.com/r/dataisbeautiful/comments/k9k50v/the_short_history_of_global_living_conditions/,32,32,,6,The Short History of Global Living Conditions #HumanProgress,2020-12-0203.jpg
[OC] Which Kitchen Nightmares (US) Restaurants Survived,SJFree,2020-12-09 07:51:50,https://i.redd.it/wryl90jp94461.png,https://www.reddit.com/r/dataisbeautiful/comments/k9nr87/oc_which_kitchen_nightmares_us_restaurants/,45235,45235,,1530,OC Which Kitchen Nightmares (US) Restaurants Survived,2020-12-0204.png
[OC] Countries where at least one road is named after Mahatma Gandhi,rohitsuratekar,2020-12-09 08:32:50,https://i.redd.it/r19tiocgh4461.png,https://www.reddit.com/r/dataisbeautiful/comments/k9o8e2/oc_countries_where_at_least_one_road_is_named/,370,370,,53,OC Countries where at least one road is named after Mahatma Gandhi,2020-12-0205.png
"This October was one of the Arctic's hottest, following a long trend of increasing warmth and declining sea ice [OC]",Geographist,2020-12-09 13:05:06,https://i.redd.it/jeuue9ewt5461.png,https://www.reddit.com/r/dataisbeautiful/comments/k9rhr6/this_october_was_one_of_the_arctics_hottest/,135,135,,13,"This October was one of the Arctic's hottest, following a long trend of increasing warmth and declining sea ice OC",2020-12-0206.png
Visualisation of a discretised form of the 2D Wave Equation for my MATLAB assignment 😋 [OC],orange_rc_pilot,2020-12-09 13:10:27,https://v.redd.it/rsvu6umyu5461,https://www.reddit.com/r/dataisbeautiful/comments/k9rkdt/visualisation_of_a_discretised_form_of_the_2d/,72,72,,9,Visualisation of a discretised form of the 2D Wave Equation for my MATLAB assignment 😋 OC,2020-12-0207.png
"[OC] During COVID-19, Americans started a record number of new businesses",takenorinvalid,2020-12-09 13:20:36,https://i.redd.it/4h2xhnvpw5461.jpg,https://www.reddit.com/r/dataisbeautiful/comments/k9rpg9/oc_during_covid19_americans_started_a_record/,64,64,,52,"OC During COVID-19, Americans started a record number of new businesses",2020-12-0208.jpg
[OC] Pokémon Type Combinations,DataCrayon,2020-12-09 14:30:48,https://v.redd.it/sue14fd696461,https://www.reddit.com/r/dataisbeautiful/comments/k9std1/oc_pokémon_type_combinations/,116,116,,17,OC Pokémon Type Combinations,2020-12-0209.png
[OC] Visualising how far you can drive from San Francisco within 8 hours,TravelTime_VA,2020-12-09 15:31:53,https://i.redd.it/srk6mpdxj6461.png,https://www.reddit.com/r/dataisbeautiful/comments/k9twap/oc_visualising_how_far_you_can_drive_from_san/,22565,22565,,1097,OC Visualising how far you can drive from San Francisco within 8 hours,2020-12-0210.png
[OC] Most used colors by hue on top 600 of r/pixelart,kerm64,2020-12-09 16:06:19,https://i.redd.it/30b3wr29q6461.png,https://www.reddit.com/r/dataisbeautiful/comments/k9ujxk/oc_most_used_colors_by_hue_on_top_600_of_rpixelart/,315,315,,15,OC Most used colors by hue on top 600 of rpixelart,2020-12-0211.png
"[OC] Most Viewed WikiPedia Articles, November 2020",PieChartPirate,2020-12-09 16:15:10,https://v.redd.it/7y615689q6461,https://www.reddit.com/r/dataisbeautiful/comments/k9uq08/oc_most_viewed_wikipedia_articles_november_2020/,198,198,,27,"OC Most Viewed WikiPedia Articles, November 2020",2020-12-0212.png
"NBA Players Traded, Historical Percentages",dwaxe,2020-12-09 17:58:22,https://flowingdata.com/2020/12/09/nba-players-traded-historical-percentages/,https://www.reddit.com/r/dataisbeautiful/comments/k9wty3/nba_players_traded_historical_percentages/,5,5,,0,"NBA Players Traded, Historical Percentages",2020-12-0213.jpg
Blockbuster Video US store locations between 1986 and 2019,Used-Personality9560,2020-12-09 18:18:08,https://www.styleinmood.com/blockbuster-video-us-store-locations-between-1986-and-2019/,https://www.reddit.com/r/dataisbeautiful/comments/k9x8mt/blockbuster_video_us_store_locations_between_1986/,5,5,,1,Blockbuster Video US store locations between 1986 and 2019,2020-12-0214.jpg
Coronavirus cases in California have doubled since Thanksgiving [OC],EngagingData,2020-12-09 19:12:06,https://i.redd.it/3ptqizxhn7461.png,https://www.reddit.com/r/dataisbeautiful/comments/k9ycz2/coronavirus_cases_in_california_have_doubled/,131,131,,29,Coronavirus cases in California have doubled since Thanksgiving OC,2020-12-0215.png
[OC] How do people spend their time around the world?,eortizospina,2020-12-09 19:12:23,https://i.redd.it/xp8eifx5n7461.png,https://www.reddit.com/r/dataisbeautiful/comments/k9yd6d/oc_how_do_people_spend_their_time_around_the_world/,867,867,,182,OC How do people spend their time around the world,2020-12-0216.png
"Top causes of death in the United States in 2020: Heart disease, cancer and COVID-19",janjinx,2020-12-09 19:54:19,https://usafacts.org/articles/top-causes-death-united-states-heart-disease-cancer-and-covid-19/,https://www.reddit.com/r/dataisbeautiful/comments/k9z88i/top_causes_of_death_in_the_united_states_in_2020/,7,7,,6,"Top causes of death in the United States in 2020 Heart disease, cancer and COVID-19",2020-12-0217.jpg
[OC] Map of each NCAA Football and Men's Basketball Championship,aquavoss,2020-12-09 21:20:15,https://i.redd.it/ygbi7j8ea8461.png,https://www.reddit.com/r/dataisbeautiful/comments/ka0yii/oc_map_of_each_ncaa_football_and_mens_basketball/,29,29,,10,OC Map of each NCAA Football and Men's Basketball Championship,2020-12-0218.png
UK search interest in top NHS diets [OC],rspeigal,2020-12-09 23:37:08,https://i.redd.it/ziceeydry8461.png,https://www.reddit.com/r/dataisbeautiful/comments/ka3iuh/uk_search_interest_in_top_nhs_diets_oc/,84,84,,3,UK search interest in top NHS diets OC,2020-12-0219.png
US COVID-19 Daily Confirmed Cases & Days Between Each Million Case Milestone (15 Total) [OC],anactualscientist2,2020-12-10 00:26:38,https://i.redd.it/g2xnm0qn79461.png,https://www.reddit.com/r/dataisbeautiful/comments/ka4f87/us_covid19_daily_confirmed_cases_days_between/,37,37,,3,US COVID-19 Daily Confirmed Cases & Days Between Each Million Case Milestone (15 Total) OC,2020-12-0220.png
