title,author,created_date,url,full_permalink,score,ups,downs,num_comments,sanitized_title,image_file
This data is not beautiful: Iranian regime's recent murders [OC],imnitwit,2022-11-01 01:25:32,https://i.redd.it/5ro16dnrr8x91.png,https://www.reddit.com/r/dataisbeautiful/comments/yiuyae/this_data_is_not_beautiful_iranian_regimes_recent/,1048,1048,,76,This data is not beautiful Iranian regime's recent murders OC,2022-11-0000.png
Highest Grossing Horror Movies of All Time [OC],takeasecond,2022-11-01 03:34:43,https://i.redd.it/p5ajy3nye9x91.png,https://www.reddit.com/r/dataisbeautiful/comments/yixnlw/highest_grossing_horror_movies_of_all_time_oc/,302,302,,113,Highest Grossing Horror Movies of All Time OC,2022-11-0001.png
[OC] There are more self-described vegans than vegetarians among US users of Twitter,jasonjonesresearch,2022-11-01 04:37:49,https://i.redd.it/c5n4rzg8q9x91.png,https://www.reddit.com/r/dataisbeautiful/comments/yiywdz/oc_there_are_more_selfdescribed_vegans_than/,188,188,,91,OC There are more self-described vegans than vegetarians among US users of Twitter,2022-11-0002.png
[OC] Volcanic eruptions since 1900,mapsbyy,2022-11-01 07:34:47,https://v.redd.it/gbv3fqyglax91,https://www.reddit.com/r/dataisbeautiful/comments/yj23ag/oc_volcanic_eruptions_since_1900/,754,754,,29,OC Volcanic eruptions since 1900,2022-11-0003.png
[OC] How does Man United ⚽️ make money?,giteam,2022-11-01 07:58:49,https://i.redd.it/cv3zvj49qax91.png,https://www.reddit.com/r/dataisbeautiful/comments/yj2h09/oc_how_does_man_united_make_money/,477,477,,76,OC How does Man United ⚽️ make money,2022-11-0004.png
[OC] The top 25 most discussed products on r/IKEA,madredditscientist,2022-11-01 08:39:11,https://i.redd.it/d2918m1gxax91.png,https://www.reddit.com/r/dataisbeautiful/comments/yj34by/oc_the_top_25_most_discussed_products_on_rikea/,277,277,,49,OC The top 25 most discussed products on rIKEA,2022-11-0005.png
Europe - % share of vehicle types for individual mobility from 1990-2020 [OC],Chris_Schmitz,2022-11-01 09:03:36,https://i.redd.it/a20azq9o1bx91.png,https://www.reddit.com/r/dataisbeautiful/comments/yj3l2f/europe_share_of_vehicle_types_for_individual/,11,11,,3,Europe - % share of vehicle types for individual mobility from 1990-2020 OC,2022-11-0006.png
[OC] Big Pharm’s yearly revenue in 2021 exceeds the GDPs of some countries,Round-Bodybuilder187,2022-11-01 10:25:51,https://i.redd.it/oau4xfvggbx91.png,https://www.reddit.com/r/dataisbeautiful/comments/yj51wn/oc_big_pharms_yearly_revenue_in_2021_exceeds_the/,1441,1441,,171,OC Big Pharm’s yearly revenue in 2021 exceeds the GDPs of some countries,2022-11-0007.png
[OC] Breakdown of Tradescantia plant cultivar names by validity and which species they belong to,TradescantiaHub,2022-11-01 12:38:21,https://i.redd.it/j1s3jsjt3cx91.png,https://www.reddit.com/r/dataisbeautiful/comments/yj7me5/oc_breakdown_of_tradescantia_plant_cultivar_names/,17,17,,6,OC Breakdown of Tradescantia plant cultivar names by validity and which species they belong to,2022-11-0008.png
"What should kids really be afraid of, part 2",cgspam,2022-11-01 14:40:04,https://www.kff.org/global-health-policy/issue-brief/child-and-teen-firearm-mortality-in-the-u-s-and-peer-countries/,https://www.reddit.com/r/dataisbeautiful/comments/yjafds/what_should_kids_really_be_afraid_of_part_2/,24,24,,18,"What should kids really be afraid of, part 2",2022-11-0009.jpg
US Child Pedestrian Deaths by Day of the Year: 2006-2020 [OC],rosetechnology,2022-11-01 14:54:45,https://i.redd.it/6tduv27escx91.png,https://www.reddit.com/r/dataisbeautiful/comments/yjarqg/us_child_pedestrian_deaths_by_day_of_the_year/,1417,1417,,149,US Child Pedestrian Deaths by Day of the Year 2006-2020 OC,2022-11-0010.png
Words of the Queen. Most used words in 330 Queen Elizabeth II speeches. [OC],juanosborne,2022-11-01 14:56:57,https://i.redd.it/1r7b8r6fscx91.jpg,https://www.reddit.com/r/dataisbeautiful/comments/yjatmz/words_of_the_queen_most_used_words_in_330_queen/,106,106,,20,Words of the Queen. Most used words in 330 Queen Elizabeth II speeches. OC,2022-11-0011.jpg
[OC] How Harvard admissions rates Asian American candidates relative to White American candidates,tabthough,2022-11-01 15:20:23,https://i.redd.it/nbe5raxpwcx91.png,https://www.reddit.com/r/dataisbeautiful/comments/yjbefg/oc_how_harvard_admissions_rates_asian_american/,14937,14937,,3020,OC How Harvard admissions rates Asian American candidates relative to White American candidates,2022-11-0012.png
[OC] A histogram of unwanted candies by trick-or-treaters from my 300-piece candy sample.,RoozGol,2022-11-01 15:45:58,https://i.redd.it/5jv7l3921dx91.jpg,https://www.reddit.com/r/dataisbeautiful/comments/yjc2vu/oc_a_histogram_of_unwanted_candies_by/,763,763,,159,OC A histogram of unwanted candies by trick-or-treaters from my 300-piece candy sample.,2022-11-0013.jpg
"Share of global population with mental health disorders, 2019",zooweemama1738,2022-11-01 16:08:06,https://ourworldindata.org/grapher/share-with-mental-and-substance-disorders,https://www.reddit.com/r/dataisbeautiful/comments/yjcpq5/share_of_global_population_with_mental_health/,7,7,,0,"Share of global population with mental health disorders, 2019",2022-11-0014.jpg
The Quality of Medical Advice from TV: Dr. Oz and The Doctors (2013) [OC],CognitiveFeedback,2022-11-01 16:09:29,https://i.redd.it/gffrleer5dx91.png,https://www.reddit.com/r/dataisbeautiful/comments/yjcr7a/the_quality_of_medical_advice_from_tv_dr_oz_and/,78,78,,10,The Quality of Medical Advice from TV Dr. Oz and The Doctors (2013) OC,2022-11-0015.png
Deforestation In The Amazon Has Increased Significantly Over the Past Decade [OC],chartr,2022-11-01 16:12:05,https://i.redd.it/erbwtucw5dx91.jpg,https://www.reddit.com/r/dataisbeautiful/comments/yjctv6/deforestation_in_the_amazon_has_increased/,7479,7479,,305,Deforestation In The Amazon Has Increased Significantly Over the Past Decade OC,2022-11-0016.jpg
[OC] The Highest Paid Twitch Streamers,Dremarious,2022-11-01 16:52:35,https://i.redd.it/8nvpsouxcdx91.png,https://www.reddit.com/r/dataisbeautiful/comments/yjdzlq/oc_the_highest_paid_twitch_streamers/,61,61,,33,OC The Highest Paid Twitch Streamers,2022-11-0017.png
Independent lawyer makes Lucidspark map of LA corruption,WaterInfluencer,2022-11-01 18:15:02,https://thecarousel.substack.com/p/whos-winning-the-la-astroturf-war,https://www.reddit.com/r/dataisbeautiful/comments/yjgdq4/independent_lawyer_makes_lucidspark_map_of_la/,10,10,,3,Independent lawyer makes Lucidspark map of LA corruption,2022-11-0018.jpg
[OC] Max Unemployment benefits vs. Median state income,Fun-Parsley5540,2022-11-01 20:18:13,https://i.redd.it/546wrk6idex91.png,https://www.reddit.com/r/dataisbeautiful/comments/yjk1gu/oc_max_unemployment_benefits_vs_median_state/,25,25,,31,OC Max Unemployment benefits vs. Median state income,2022-11-0019.png
Animation of historical inflation (CPI) from 1988 to 2022 [OC],asap011,2022-11-01 22:44:44,https://v.redd.it/ynzuxt334fx91,https://www.reddit.com/r/dataisbeautiful/comments/yjnv0w/animation_of_historical_inflation_cpi_from_1988/,653,653,,41,Animation of historical inflation (CPI) from 1988 to 2022 OC,2022-11-0020.png
[OC] Median Wage vs. Happiness Score for US states,RelativeDoughnut6967,2022-11-01 23:17:11,https://i.redd.it/e3iriqtmrgx91.png,https://www.reddit.com/r/dataisbeautiful/comments/yjonga/oc_median_wage_vs_happiness_score_for_us_states/,0,0,,30,OC Median Wage vs. Happiness Score for US states,2022-11-0021.png
[OC] Is Nuclear Energy Dangerous? A comparison of chinese coal mining related fatalities to worldwide nuclear and radiation related fatalities,Alyx1337,2022-11-01 23:26:30,https://i.redd.it/4v51druibfx91.png,https://www.reddit.com/r/dataisbeautiful/comments/yjovks/oc_is_nuclear_energy_dangerous_a_comparison_of/,1327,1327,,374,OC Is Nuclear Energy Dangerous A comparison of chinese coal mining related fatalities to worldwide nuclear and radiation related fatalities,2022-11-0022.png
[OC] Explorable Map of 6.4 Million AI Art Images,NomicAI,2022-11-02 03:15:36,https://i.redd.it/5wfn2xqiggx91.png,https://www.reddit.com/r/dataisbeautiful/comments/yjtzcu/oc_explorable_map_of_64_million_ai_art_images/,55,55,,5,OC Explorable Map of 6.4 Million AI Art Images,2022-11-0023.png
[OC] Billboard's top 10 singles are getting progressively more negative (and less acoustic) over time,robert_ritz,2022-11-02 04:54:15,https://i.redd.it/hpyqjseyxgx91.png,https://www.reddit.com/r/dataisbeautiful/comments/yjvwiz/oc_billboards_top_10_singles_are_getting/,438,438,,67,OC Billboard's top 10 singles are getting progressively more negative (and less acoustic) over time,2022-11-0024.png
[OC] Different types of government systems,giteam,2022-11-02 09:59:23,https://i.redd.it/8yho7yrmgix91.png,https://www.reddit.com/r/dataisbeautiful/comments/yk1028/oc_different_types_of_government_systems/,9951,9951,,939,OC Different types of government systems,2022-11-0025.png
"Religions of Canada, 2021 [OC]",throwbarrieaway,2022-11-02 11:30:50,https://i.redd.it/4x6sbxpvwix91.png,https://www.reddit.com/r/dataisbeautiful/comments/yk2pqh/religions_of_canada_2021_oc/,1613,1613,,287,"Religions of Canada, 2021 OC",2022-11-0026.png
US Credit Card Loans v. Personal Savings Rate [OC],rosetechnology,2022-11-02 16:23:24,https://i.redd.it/6n4oyce3dkx91.png,https://www.reddit.com/r/dataisbeautiful/comments/yk9nsx/us_credit_card_loans_v_personal_savings_rate_oc/,284,284,,59,US Credit Card Loans v. Personal Savings Rate OC,2022-11-0027.png
[OC] There are now 15x more coca plantations in Colombia than during the times of Pablo Escobar.,latinometrics,2022-11-02 17:06:36,https://i.redd.it/xaso5vcskkx91.png,https://www.reddit.com/r/dataisbeautiful/comments/ykarpm/oc_there_are_now_15x_more_coca_plantations_in/,10033,10033,,549,OC There are now 15x more coca plantations in Colombia than during the times of Pablo Escobar.,2022-11-0028.png
[OC] Social Media Post Volume and Sentiment around HBO's House of the Dragon vs. Amazon's Rings of Power,infegy,2022-11-02 18:53:49,https://i.redd.it/o5xja0vr1lx91.png,https://www.reddit.com/r/dataisbeautiful/comments/ykdk12/oc_social_media_post_volume_and_sentiment_around/,2,2,,1,OC Social Media Post Volume and Sentiment around HBO's House of the Dragon vs. Amazon's Rings of Power,2022-11-0029.png
Neutron flux across the ITER Tokamak.,233C,2022-11-02 22:25:22,https://fusionforenergy.europa.eu/news/two-soft-innovation-prizes-go-to-technologies-supported-by-f4e/,https://www.reddit.com/r/dataisbeautiful/comments/ykjs0i/neutron_flux_across_the_iter_tokamak/,25,25,,15,Neutron flux across the ITER Tokamak.,2022-11-0030.jpg
[OC] U.S. Minimum wage rates by state (2022),EvilSpySnail,2022-11-02 23:30:55,https://i.redd.it/ml0s86sfhmx91.png,https://www.reddit.com/r/dataisbeautiful/comments/yklphz/oc_us_minimum_wage_rates_by_state_2022/,31,31,,23,OC U.S. Minimum wage rates by state (2022),2022-11-0031.png
[OC] Do more democratic countries have more women in government?,Equal-Crew-3367,2022-11-03 09:42:18,https://i.redd.it/sknz5w9iipx91.png,https://www.reddit.com/r/dataisbeautiful/comments/ykxk0x/oc_do_more_democratic_countries_have_more_women/,730,730,,411,OC Do more democratic countries have more women in government,2022-11-0032.png
[OC] Salesforce is one of the largest SaaS company in the world - how does it make money and how much?,giteam,2022-11-03 10:07:08,https://i.redd.it/sipkw9hympx91.png,https://www.reddit.com/r/dataisbeautiful/comments/yky36h/oc_salesforce_is_one_of_the_largest_saas_company/,125,125,,42,OC Salesforce is one of the largest SaaS company in the world - how does it make money and how much,2022-11-0033.png
[OC] Herschel Walker makes everything worse,JPAnalyst,2022-11-03 10:12:38,https://i.redd.it/uvr37wkynpx91.jpg,https://www.reddit.com/r/dataisbeautiful/comments/yky7q2/oc_herschel_walker_makes_everything_worse/,32735,32735,,1763,OC Herschel Walker makes everything worse,2022-11-0034.jpg
[OC] US Twitter reached Peak MAGA in 2020 (as measured by Trump and MAGA prevalence in bios),jasonjonesresearch,2022-11-03 13:34:57,https://i.redd.it/bgcyne6unqx91.png,https://www.reddit.com/r/dataisbeautiful/comments/yl313c/oc_us_twitter_reached_peak_maga_in_2020_as/,68,68,,26,OC US Twitter reached Peak MAGA in 2020 (as measured by Trump and MAGA prevalence in bios),2022-11-0035.png
Biden Disapproval Rating v. Price of Gasoline (per Gallon) [OC],rosetechnology,2022-11-03 14:10:00,https://i.redd.it/ii22oorktqx91.png,https://www.reddit.com/r/dataisbeautiful/comments/yl3uio/biden_disapproval_rating_v_price_of_gasoline_per/,0,0,,12,Biden Disapproval Rating v. Price of Gasoline (per Gallon) OC,2022-11-0036.png
[OC] Top 10 Deadliest Human Stampedes and Crushes of the 21st Century,Spirited-Focus-7312,2022-11-03 14:19:42,https://i.redd.it/zsbj8p0yvqx91.png,https://www.reddit.com/r/dataisbeautiful/comments/yl42sv/oc_top_10_deadliest_human_stampedes_and_crushes/,4227,4227,,286,OC Top 10 Deadliest Human Stampedes and Crushes of the 21st Century,2022-11-0037.png
A Simple Analysis Of Twitter's Potential Change In Business Model [OC],chartr,2022-11-03 15:16:42,https://i.redd.it/a61tw60w5rx91.jpg,https://www.reddit.com/r/dataisbeautiful/comments/yl5gml/a_simple_analysis_of_twitters_potential_change_in/,155,155,,56,A Simple Analysis Of Twitter's Potential Change In Business Model OC,2022-11-0038.jpg
[OC] Tenure Length of UK Prime Ministers,SnooPoems2010,2022-11-03 15:36:49,https://i.redd.it/2fjrfo5o9rx91.png,https://www.reddit.com/r/dataisbeautiful/comments/yl5yl5/oc_tenure_length_of_uk_prime_ministers/,40,40,,8,OC Tenure Length of UK Prime Ministers,2022-11-0039.png
The Most American Names [OC],df_iris,2022-11-03 17:34:58,https://i.redd.it/vj7d5zdytrx91.png,https://www.reddit.com/r/dataisbeautiful/comments/yl8wxy/the_most_american_names_oc/,273,273,,99,The Most American Names OC,2022-11-0040.png
What factors contribute to gas prices? [OC],USAFacts_Official,2022-11-03 17:36:24,https://i.redd.it/tf8mojalprx91.png,https://www.reddit.com/r/dataisbeautiful/comments/yl8yag/what_factors_contribute_to_gas_prices_oc/,628,628,,194,What factors contribute to gas prices OC,2022-11-0041.png
Cha vs Tea,oveis86,2022-11-03 19:13:31,https://qz.com/1176962/map-how-the-word-tea-spread-over-land-and-sea-to-conquer-the-world,https://www.reddit.com/r/dataisbeautiful/comments/ylbsmb/cha_vs_tea/,17,17,,5,Cha vs Tea,2022-11-0042.jpg
"The Columbia Journal Review unveiled a tool Thursday that calculates the number of stories your disappearance would not, based on demographics. I would be worth 19 stories, reaching 36.6% of Americans.",GraciousCinnamonRoll,2022-11-03 19:29:28,https://areyoupressworthy.com/,https://www.reddit.com/r/dataisbeautiful/comments/ylc8c0/the_columbia_journal_review_unveiled_a_tool/,61,61,,30,"The Columbia Journal Review unveiled a tool Thursday that calculates the number of stories your disappearance would not, based on demographics. I woul",2022-11-0043.jpg
[OC] Top 10 Highest Selling Weeks for Alcohol Purchases at Grocery Stores in the US in 2020 - 2021 vs Super Bowl Purchases,semideclared,2022-11-03 20:20:55,https://i.redd.it/0gj5v3abosx91.png,https://www.reddit.com/r/dataisbeautiful/comments/yldnsa/oc_top_10_highest_selling_weeks_for_alcohol/,11,11,,10,OC Top 10 Highest Selling Weeks for Alcohol Purchases at Grocery Stores in the US in 2020 - 2021 vs Super Bowl Purchases,2022-11-0044.png
"[OC] Inflation Adjusted Housing Affordability (Cost, Monthly Payment, CPI Adjusted)",Dont____Panic,2022-11-03 22:18:40,https://i.redd.it/0kjv6hl69tx91.jpg,https://www.reddit.com/r/dataisbeautiful/comments/ylgfce/oc_inflation_adjusted_housing_affordability_cost/,34,34,,8,"OC Inflation Adjusted Housing Affordability (Cost, Monthly Payment, CPI Adjusted)",2022-11-0045.jpg
"Nuclear Shutdowns Have Already Harmed the Planet: Every year, avoidable nuclear power plant shutdowns release CO2 emissions equivalent to 37 African countries",233C,2022-11-03 22:53:59,https://thebreakthrough.org/issues/energy/nuclear-shutdowns-have-already-harmed-the-planet,https://www.reddit.com/r/dataisbeautiful/comments/ylhhad/nuclear_shutdowns_have_already_harmed_the_planet/,11,11,,16,"Nuclear Shutdowns Have Already Harmed the Planet Every year, avoidable nuclear power plant shutdowns release CO2 emissions equivalent to 37 African co",2022-11-0046.jpg
The Berlin Wall fell 30 years ago but the economic ramifications of Germany's Soviet occupation still linger,Rear-gunner,2022-11-04 00:43:58,https://www.zeit.de/arbeit/2022-09/gemeinde-gehalt-deutschland-vergleich-daten-entwicklung#comments,https://www.reddit.com/r/dataisbeautiful/comments/ylk5aw/the_berlin_wall_fell_30_years_ago_but_the/,25,25,,36,The Berlin Wall fell 30 years ago but the economic ramifications of Germany's Soviet occupation still linger,2022-11-0047.jpg
[OC] 2022 Mid-Term Ballots already cast by Seniors 65+ outweighs Young Voters (18-29) by 8 to 1,SexyDoorDasherDude,2022-11-04 02:12:53,https://i.redd.it/1b2g7ty5fux91.png,https://www.reddit.com/r/dataisbeautiful/comments/ylm2eg/oc_2022_midterm_ballots_already_cast_by_seniors/,14308,14308,,2595,OC 2022 Mid-Term Ballots already cast by Seniors 65+ outweighs Young Voters (18-29) by 8 to 1,2022-11-0048.png
[OC] Where are the most programming languages created?,breck,2022-11-04 02:18:57,https://pldb.com/posts/originCountries11-3-2022.html,https://www.reddit.com/r/dataisbeautiful/comments/ylm6ye/oc_where_are_the_most_programming_languages/,14,14,,5,OC Where are the most programming languages created,2022-11-0049.jpg
"[OC] best-fit lines, correlations: incarceration vs diversity* – 2020 election",terrykrohe,2022-11-04 05:16:29,https://i.redd.it/uygfyt80cvx91.png,https://www.reddit.com/r/dataisbeautiful/comments/ylpn4j/oc_bestfit_lines_correlations_incarceration_vs/,0,0,,10,"OC best-fit lines, correlations incarceration vs diversity – 2020 election",2022-11-0050.png
A shaded relief map of Canada rendered from 3d data and satellite imagery [OC],visualgeomatics,2022-11-04 05:41:56,https://i.redd.it/pfnq7naggvx91.jpg,https://www.reddit.com/r/dataisbeautiful/comments/ylq2sk/a_shaded_relief_map_of_canada_rendered_from_3d/,377,377,,30,A shaded relief map of Canada rendered from 3d data and satellite imagery OC,2022-11-0051.jpg
[OC] How will the future of tourism in Hokkaido (Japan) look like?,Equal-Crew-3367,2022-11-04 09:50:04,https://i.redd.it/vx7ha9loowx91.png,https://www.reddit.com/r/dataisbeautiful/comments/ylub3s/oc_how_will_the_future_of_tourism_in_hokkaido/,36,36,,5,OC How will the future of tourism in Hokkaido (Japan) look like,2022-11-0052.png
[OC] Visualising Zoom's revenue and profit sources,giteam,2022-11-04 10:00:04,https://i.redd.it/cz6gptzlqwx91.png,https://www.reddit.com/r/dataisbeautiful/comments/yluiif/oc_visualising_zooms_revenue_and_profit_sources/,234,234,,48,OC Visualising Zoom's revenue and profit sources,2022-11-0053.png
"Flooding in Eastern Australia | NASA Earth Observatory, released October 31, 2022",marketrent,2022-11-04 11:40:24,https://earthobservatory.nasa.gov/images/150542/flooding-in-eastern-australia,https://www.reddit.com/r/dataisbeautiful/comments/ylwpvr/flooding_in_eastern_australia_nasa_earth/,18,18,,1,"Flooding in Eastern Australia NASA Earth Observatory, released October 31, 2022",2022-11-0054.jpg
"[OC] In the last five years, the number of new probation cases for Singaporeans aged 19 to 21 has increased by 1.5 times",eqqqxy,2022-11-04 12:24:08,https://i.redd.it/xilyo28bgxx91.png,https://www.reddit.com/r/dataisbeautiful/comments/ylxmp5/oc_in_the_last_five_years_the_number_of_new/,38,38,,7,"OC In the last five years, the number of new probation cases for Singaporeans aged 19 to 21 has increased by 1.5 times",2022-11-0055.png
Where Around the World Are People Paying the Most for Their Cell Phone Bill?,Artemistical,2022-11-04 14:18:50,https://voicenation.com/press/where-around-the-world-are-people-paying-the-most-for-their-cell-phone-bill/,https://www.reddit.com/r/dataisbeautiful/comments/ym0a2f/where_around_the_world_are_people_paying_the_most/,20,20,,9,Where Around the World Are People Paying the Most for Their Cell Phone Bill,2022-11-0056.jpg
[OC] ETFs are increasingly popular in recent years - what are the biggest players?,giteam,2022-11-04 14:47:29,https://i.redd.it/hg9ygm0r5yx91.png,https://www.reddit.com/r/dataisbeautiful/comments/ym0yjv/oc_etfs_are_increasingly_popular_in_recent_years/,84,84,,18,OC ETFs are increasingly popular in recent years - what are the biggest players,2022-11-0057.png
[OC] Much of Latin America has caught up to the 90%+ literacy rate the US has had since 1900.,latinometrics,2022-11-04 15:06:21,https://i.redd.it/zmizym5s8yx91.png,https://www.reddit.com/r/dataisbeautiful/comments/ym1f6q/oc_much_of_latin_america_has_caught_up_to_the_90/,32120,32120,,1039,OC Much of Latin America has caught up to the 90%+ literacy rate the US has had since 1900.,2022-11-0058.png
[OC] Forbes 2022's Most Philanthropic US Billionaires,row64software,2022-11-04 16:24:47,https://i.redd.it/ub7nbd37nyx91.jpg,https://www.reddit.com/r/dataisbeautiful/comments/ym3ddi/oc_forbes_2022s_most_philanthropic_us_billionaires/,238,238,,122,OC Forbes 2022's Most Philanthropic US Billionaires,2022-11-0059.jpg
[OC] Every Formula 1 racing lap ever completed since GP #1 (Britain 1950),spectrummonkey,2022-11-04 16:43:50,https://v.redd.it/vgfgmg2vpyx91,https://www.reddit.com/r/dataisbeautiful/comments/ym3u4j/oc_every_formula_1_racing_lap_ever_completed/,374,374,,12,OC Every Formula 1 racing lap ever completed since GP #1 (Britain 1950),2022-11-0060.png
[OC] Did Twitter have too many employees?,jtsg_,2022-11-04 23:06:55,https://i.redd.it/bc72icjhk0y91.png,https://www.reddit.com/r/dataisbeautiful/comments/ymdbwc/oc_did_twitter_have_too_many_employees/,8335,8335,,966,OC Did Twitter have too many employees,2022-11-0061.png
[OC] How long headphones last and where they fail,madredditscientist,2022-11-05 07:29:15,https://i.redd.it/fychkekm43y91.png,https://www.reddit.com/r/dataisbeautiful/comments/ymn7rs/oc_how_long_headphones_last_and_where_they_fail/,668,668,,76,OC How long headphones last and where they fail,2022-11-0062.png
[OC] Japan's Retail Giants: Convenience Stores,Equal-Crew-3367,2022-11-05 10:27:49,https://i.redd.it/5c0vyw6h04y91.png,https://www.reddit.com/r/dataisbeautiful/comments/ymq5mj/oc_japans_retail_giants_convenience_stores/,382,382,,46,OC Japan's Retail Giants Convenience Stores,2022-11-0063.png
History of Europe 1500-2022 in Country balls [OC],TheCarloza,2022-11-05 10:51:06,https://v.redd.it/56ix1a3k24y91,https://www.reddit.com/r/dataisbeautiful/comments/ymqks1/history_of_europe_15002022_in_country_balls_oc/,29231,29231,,825,History of Europe 1500-2022 in Country balls OC,2022-11-0064.png
[OC] JP Morgan is the largest US bank - visualizing how does it make money,giteam,2022-11-05 11:59:20,https://i.redd.it/ce2r979tg4y91.png,https://www.reddit.com/r/dataisbeautiful/comments/ymry3i/oc_jp_morgan_is_the_largest_us_bank_visualizing/,81,81,,13,OC JP Morgan is the largest US bank - visualizing how does it make money,2022-11-0065.png
[OC] North Korea's Missile Tests at Highest Ever in 2022,waynehihihi,2022-11-05 12:30:56,https://i.redd.it/c3d85tjvl4y91.png,https://www.reddit.com/r/dataisbeautiful/comments/ymsmko/oc_north_koreas_missile_tests_at_highest_ever_in/,105,105,,17,OC North Korea's Missile Tests at Highest Ever in 2022,2022-11-0066.png
[OC] Instagram seems to be the most gender balanced social media platform,eqqqxy,2022-11-05 13:45:13,https://i.redd.it/m9gem7zoz4y91.png,https://www.reddit.com/r/dataisbeautiful/comments/ymudll/oc_instagram_seems_to_be_the_most_gender_balanced/,63,63,,48,OC Instagram seems to be the most gender balanced social media platform,2022-11-0067.png
[OC] Meat vs Vegetable Supply Across the World in 2019,icywatermelons,2022-11-05 15:15:10,https://i.redd.it/lc264j7mf5y91.png,https://www.reddit.com/r/dataisbeautiful/comments/ymwt9j/oc_meat_vs_vegetable_supply_across_the_world_in/,146,146,,30,OC Meat vs Vegetable Supply Across the World in 2019,2022-11-0068.png
"[OC] Apple is now worth more than Alphabet, Amazon and Meta put together",eqqqxy,2022-11-05 16:41:04,https://i.redd.it/bmu44uq1v5y91.png,https://www.reddit.com/r/dataisbeautiful/comments/ymz53n/oc_apple_is_now_worth_more_than_alphabet_amazon/,14263,14263,,1179,"OC Apple is now worth more than Alphabet, Amazon and Meta put together",2022-11-0069.png
[OC] Detailed Language Family Map of the World,BLAZENIOSZ,2022-11-05 17:20:40,https://i.redd.it/esuwots326y91.png,https://www.reddit.com/r/dataisbeautiful/comments/yn08pw/oc_detailed_language_family_map_of_the_world/,224,224,,112,OC Detailed Language Family Map of the World,2022-11-0070.png
[OC] Dynamic Clouds and Landscape Generation: Morphing and Evolutionary Processes,MLRecipes,2022-11-05 18:17:31,https://v.redd.it/p0idg3g9c6y91,https://www.reddit.com/r/dataisbeautiful/comments/yn1sls/oc_dynamic_clouds_and_landscape_generation/,395,395,,5,OC Dynamic Clouds and Landscape Generation Morphing and Evolutionary Processes,2022-11-0071.png
[OC] A Bar Chart on the Historical CEO-to-Worker Compensation Ratio. 2021 Ratio Reaches 399:1,row64software,2022-11-05 21:52:40,https://i.redd.it/ed6rgpv8e7y91.jpg,https://www.reddit.com/r/dataisbeautiful/comments/yn7f62/oc_a_bar_chart_on_the_historical_ceotoworker/,13,13,,7,OC A Bar Chart on the Historical CEO-to-Worker Compensation Ratio. 2021 Ratio Reaches 3991,2022-11-0072.jpg
Minneapolis Snow Totals Last 5 Years [OC],lambofgod0492,2022-11-05 23:55:00,https://i.redd.it/wdk2i3z0i9y91.jpg,https://www.reddit.com/r/dataisbeautiful/comments/ynarvj/minneapolis_snow_totals_last_5_years_oc/,34,34,,22,Minneapolis Snow Totals Last 5 Years OC,2022-11-0073.jpg
