title,author,created_date,url,full_permalink,score,ups,downs,num_comments,sanitized_title,image_file
[OC] Road traffic death rate in the US vs Europe,flyingcatwithhorns,2022-10-11 13:42:26,https://i.redd.it/v2cd4ul8k6t91.png,https://www.reddit.com/r/dataisbeautiful/comments/y19evb/oc_road_traffic_death_rate_in_the_us_vs_europe/,21645,21645,,3081,OC Road traffic death rate in the US vs Europe,2022-10-0148.png
Roulette simulation: 10'000 players each betting 5'000 times (74% chance of having a negative return ) [OC],nautilus_red,2022-10-11 14:44:54,https://i.redd.it/u3osn5bou6t91.png,https://www.reddit.com/r/dataisbeautiful/comments/y1aw8v/roulette_simulation_10000_players_each_betting/,809,809,,114,Roulette simulation 10'000 players each betting 5'000 times (74% chance of having a negative return ) OC,2022-10-0149.png
"Average Temperatures of Summer Months in the U.S., 1895-2022 [OC]",CognitiveFeedback,2022-10-11 17:11:14,https://i.redd.it/0lr3bsoml7t91.png,https://www.reddit.com/r/dataisbeautiful/comments/y1ej02/average_temperatures_of_summer_months_in_the_us/,29,29,,4,"Average Temperatures of Summer Months in the U.S., 1895-2022 OC",2022-10-0150.png
[OC] I wanted to visualize why it is so hard for the average 30 year old to buy a house in 2022,missdopamine,2022-10-11 21:04:42,https://i.redd.it/wptjhj09r8t91.png,https://www.reddit.com/r/dataisbeautiful/comments/y1ke6t/oc_i_wanted_to_visualize_why_it_is_so_hard_for/,5335,5335,,531,OC I wanted to visualize why it is so hard for the average 30 year old to buy a house in 2022,2022-10-0151.png
"""Wild mammals make up only a few percent of the world’s mammals"" - Hannah Ritchie for Our World In Data Source:",tonymmorley,2022-10-11 22:08:14,https://ourworldindata.org/mammals#wild-mammals-make-up-only-a-few-percent-of-the-world-s-mammals,https://www.reddit.com/r/dataisbeautiful/comments/y1ly0n/wild_mammals_make_up_only_a_few_percent_of_the/,36,36,,12,Wild mammals make up only a few percent of the world’s mammals - Hannah Ritchie for Our World In Data Source,2022-10-0152.jpg
A progressive timeline of the all-time win % for all 32 active NHL teams,JoinTheBattle,2022-10-11 22:50:47,https://twitter.com/BetweenTheNums/status/1579622880056602624?s=20&t=Dic5B6LJEcNe3WnxlSR7JQ,https://www.reddit.com/r/dataisbeautiful/comments/y1mxu6/a_progressive_timeline_of_the_alltime_win_for_all/,3,3,,8,A progressive timeline of the all-time win % for all 32 active NHL teams,2022-10-0153.jpg
Global Crime Rates 2022 [OC],rosetechnology,2022-10-11 23:03:52,https://i.redd.it/o4cmvddkc9t91.png,https://www.reddit.com/r/dataisbeautiful/comments/y1n8is/global_crime_rates_2022_oc/,21,21,,18,Global Crime Rates 2022 OC,2022-10-0154.png
[OC] Percentage of individuals who own homes with no mortgage based on their education level,missdopamine,2022-10-11 23:33:56,https://i.redd.it/eq8lz5auh9t91.png,https://www.reddit.com/r/dataisbeautiful/comments/y1nx1j/oc_percentage_of_individuals_who_own_homes_with/,904,904,,187,OC Percentage of individuals who own homes with no mortgage based on their education level,2022-10-0155.png
[OC] Bull and Bear markets: Duration & Return - since 1926 as per JP Morgan,transformersh,2022-10-12 06:47:07,https://i.redd.it/nz9v90dzmbt91.jpg,https://www.reddit.com/r/dataisbeautiful/comments/y1wke0/oc_bull_and_bear_markets_duration_return_since/,5,5,,7,OC Bull and Bear markets Duration & Return - since 1926 as per JP Morgan,2022-10-0156.jpg
[OC] Amazon IPO vs Now - Revenue and profit breakdown,giteam,2022-10-12 07:58:36,https://i.redd.it/4shifa6zzbt91.png,https://www.reddit.com/r/dataisbeautiful/comments/y1xqul/oc_amazon_ipo_vs_now_revenue_and_profit_breakdown/,5928,5928,,417,OC Amazon IPO vs Now - Revenue and profit breakdown,2022-10-0157.png
"Democracy and economic equality in six major western countries, since 1980 [OC]",progressinmotion,2022-10-12 11:38:46,https://i.redd.it/9gpemf943dt91.png,https://www.reddit.com/r/dataisbeautiful/comments/y21lc8/democracy_and_economic_equality_in_six_major/,59,59,,45,"Democracy and economic equality in six major western countries, since 1980 OC",2022-10-0158.png
"[OC] Mortgages are actually cheaper now for a median earning household to buy a median priced house, compared to the 1980s and 1990s. This graph shows the annual mortgage payment on a median priced house divided by median household annual income (30-yr Mortgage, No Downpayment)",Phantom_Absolute,2022-10-12 13:27:07,https://i.imgur.com/HnG8WL2.png,https://www.reddit.com/r/dataisbeautiful/comments/y23ykn/oc_mortgages_are_actually_cheaper_now_for_a/,1153,1153,,726,"OC Mortgages are actually cheaper now for a median earning household to buy a median priced house, compared to the 1980s and 1990s. This graph shows t",2022-10-0159.png
[OC] Fraction Female Canadians less than 20 years old enrolled in Bachelors' degrees in Canada,hswerdfe_2,2022-10-12 14:11:37,https://i.redd.it/51ejtjlfudt91.png,https://www.reddit.com/r/dataisbeautiful/comments/y2509n/oc_fraction_female_canadians_less_than_20_years/,7,7,,6,OC Fraction Female Canadians less than 20 years old enrolled in Bachelors' degrees in Canada,2022-10-0160.png
US Drug Overdose Deaths - 12 month ending count [OC],rosetechnology,2022-10-12 14:26:13,https://i.redd.it/1ekbpck4xdt91.png,https://www.reddit.com/r/dataisbeautiful/comments/y25dbo/us_drug_overdose_deaths_12_month_ending_count_oc/,6276,6276,,912,US Drug Overdose Deaths - 12 month ending count OC,2022-10-0161.png
Graphing Every Idea in History,mahiyet,2022-10-12 14:51:02,https://griffsgraphs.wordpress.com/2012/07/20/the-graph-of-ideas-2-0/,https://www.reddit.com/r/dataisbeautiful/comments/y25z99/graphing_every_idea_in_history/,15,15,,2,Graphing Every Idea in History,2022-10-0162.jpg
"[OC] The Interest in the term ""Biological Warfare"" by Languages over time (centred around when covid hits) Made during the Alfy Online (free) Bootcamp, when I was learning to work with Python & Big-Data, and the Wikipedia-API",ababasababa,2022-10-12 16:31:47,https://v.redd.it/qw3if293jet91,https://www.reddit.com/r/dataisbeautiful/comments/y28jsd/oc_the_interest_in_the_term_biological_warfare_by/,174,174,,5,"OC The Interest in the term Biological Warfare by Languages over time (centred around when covid hits) Made during the Alfy Online (free) Bootcamp, wh",2022-10-0163.png
"[OC] People in Chiapas, Mexico, drink more than Coke than anyone else in the world: over 2 liters every day.",latinometrics,2022-10-12 21:11:02,https://i.imgur.com/ZdWjM4t.jpg,https://www.reddit.com/r/dataisbeautiful/comments/y2fmsu/oc_people_in_chiapas_mexico_drink_more_than_coke/,15953,15953,,1209,"OC People in Chiapas, Mexico, drink more than Coke than anyone else in the world over 2 liters every day.",2022-10-0164.jpg
"[OC] Monthly U.S. Homicides, 1999-2020",academiaadvice,2022-10-13 05:00:53,https://i.redd.it/ecqmmru69it91.png,https://www.reddit.com/r/dataisbeautiful/comments/y2pvj3/oc_monthly_us_homicides_19992020/,16206,16206,,2492,"OC Monthly U.S. Homicides, 1999-2020",2022-10-0165.png
[OC] The crude birth rate in European Union from 1960 to 2020,Due_Log_6718,2022-10-13 05:49:18,https://v.redd.it/8fusqepnhit91,https://www.reddit.com/r/dataisbeautiful/comments/y2qq2z/oc_the_crude_birth_rate_in_european_union_from/,333,333,,40,OC The crude birth rate in European Union from 1960 to 2020,2022-10-0166.png
[OC] Number of police killings in developed countries,flyingcatwithhorns,2022-10-13 11:05:11,https://i.redd.it/iv2lvkix1kt91.png,https://www.reddit.com/r/dataisbeautiful/comments/y2vtsr/oc_number_of_police_killings_in_developed/,24855,24855,,3594,OC Number of police killings in developed countries,2022-10-0167.png
[OC] Tableau predicts the estimated nuclear stockpile in Russia and NATO,eqqqxy,2022-10-13 11:46:24,https://i.redd.it/m7htepfe9kt91.png,https://www.reddit.com/r/dataisbeautiful/comments/y2wlj9/oc_tableau_predicts_the_estimated_nuclear/,0,0,,24,OC Tableau predicts the estimated nuclear stockpile in Russia and NATO,2022-10-0168.png
[OC] The Legal Age of Consent Around the World (2019),eqqqxy,2022-10-13 12:10:38,https://i.redd.it/9r2ex4cudkt91.png,https://www.reddit.com/r/dataisbeautiful/comments/y2x345/oc_the_legal_age_of_consent_around_the_world_2019/,12,12,,35,OC The Legal Age of Consent Around the World (2019),2022-10-0169.png
[OC] Results of the United Nations Vote on the Territorial Integrity of Ukraine,Snugglosaurus,2022-10-13 12:13:41,https://i.redd.it/jsykzr6ydkt91.png,https://www.reddit.com/r/dataisbeautiful/comments/y2x5cs/oc_results_of_the_united_nations_vote_on_the/,4113,4113,,694,OC Results of the United Nations Vote on the Territorial Integrity of Ukraine,2022-10-0170.png
Indian states: Population vs GDP per Capita [OC],fuckboiiii6969,2022-10-13 12:52:18,https://i.redd.it/j1khbzp4lkt91.png,https://www.reddit.com/r/dataisbeautiful/comments/y2xyty/indian_states_population_vs_gdp_per_capita_oc/,79,79,,8,Indian states Population vs GDP per Capita OC,2022-10-0171.png
[OC] Highest Budget TV Series Per Episode of All Time (as of 2022),Spirited-Focus-7312,2022-10-13 14:37:07,https://i.redd.it/p9kleiny3lt91.png,https://www.reddit.com/r/dataisbeautiful/comments/y30dku/oc_highest_budget_tv_series_per_episode_of_all/,4981,4981,,754,OC Highest Budget TV Series Per Episode of All Time (as of 2022),2022-10-0172.png
"[OC] Warren Buffet's public stock portfolio as of June 30th, 2022",giteam,2022-10-13 14:54:49,https://i.redd.it/0bnrplf07lt91.png,https://www.reddit.com/r/dataisbeautiful/comments/y30snm/oc_warren_buffets_public_stock_portfolio_as_of/,470,470,,63,"OC Warren Buffet's public stock portfolio as of June 30th, 2022",2022-10-0173.png
[OC] Would you earn money if you made a film in Singapore?,rightontimothy,2022-10-13 15:56:22,https://i.redd.it/32kdydr0clt91.png,https://www.reddit.com/r/dataisbeautiful/comments/y32a5f/oc_would_you_earn_money_if_you_made_a_film_in/,4,4,,6,OC Would you earn money if you made a film in Singapore,2022-10-0174.png
What United HealthCare pays your doctor for a C-section [OC],alecs-dolt,2022-10-13 16:37:51,https://www.dolthub.com/blog/static/b9ab629c792a5d682fb78856952e1f1e/52ab5/sl-c-sec.png,https://www.reddit.com/r/dataisbeautiful/comments/y33anf/what_united_healthcare_pays_your_doctor_for_a/,38,38,,15,What United HealthCare pays your doctor for a C-section OC,2022-10-0175.png
[OC] Rise in U.S. Consumer Price Index Compared to Last Year,Metalytiq,2022-10-13 16:40:12,https://i.redd.it/s954opnuplt91.jpg,https://www.reddit.com/r/dataisbeautiful/comments/y33cn3/oc_rise_in_us_consumer_price_index_compared_to/,188,188,,55,OC Rise in U.S. Consumer Price Index Compared to Last Year,2022-10-0176.jpg
Police Killings per Capita v Homicide Rate per Capita for Select OECD Countries [OC],dr5c,2022-10-13 17:47:38,https://i.redd.it/o72cnb8w1mt91.png,https://www.reddit.com/r/dataisbeautiful/comments/y350kf/police_killings_per_capita_v_homicide_rate_per/,1123,1123,,185,Police Killings per Capita v Homicide Rate per Capita for Select OECD Countries OC,2022-10-0177.png
Nathan's Famous Hot Dog Contest (Kobayashi isn't as good as might think) [OC],Crash_Recovery,2022-10-13 18:13:26,https://i.redd.it/ogmpur7i6mt91.png,https://www.reddit.com/r/dataisbeautiful/comments/y35nic/nathans_famous_hot_dog_contest_kobayashi_isnt_as/,19,19,,6,Nathan's Famous Hot Dog Contest (Kobayashi isn't as good as might think) OC,2022-10-0178.png
"[OC] Russian Tank Losses in Ukraine. Over 1300 tanks have been visually confirmed as lost, and the number of old tanks lost is increasing rapidly.",VinViz,2022-10-13 19:38:49,https://i.redd.it/bfgpcogolmt91.png,https://www.reddit.com/r/dataisbeautiful/comments/y37t7p/oc_russian_tank_losses_in_ukraine_over_1300_tanks/,567,567,,79,"OC Russian Tank Losses in Ukraine. Over 1300 tanks have been visually confirmed as lost, and the number of old tanks lost is increasing rapidly.",2022-10-0179.png
US Unemployment percentage and the amount changed from start to end for each US President. Positive results indicate increased unemployment. [OC],quantuminous,2022-10-13 20:00:57,https://i.redd.it/h32sup8qpmt91.png,https://www.reddit.com/r/dataisbeautiful/comments/y38edi/us_unemployment_percentage_and_the_amount_changed/,18151,18151,,2003,US Unemployment percentage and the amount changed from start to end for each US President. Positive results indicate increased unemployment. OC,2022-10-0180.png
[OC] Monthly US Homicides,aidansean,2022-10-14 00:08:04,https://i.redd.it/tf8oa4nuxnt91.png,https://www.reddit.com/r/dataisbeautiful/comments/y3ehdm/oc_monthly_us_homicides/,54,54,,66,OC Monthly US Homicides,2022-10-0181.png
"[OC] 8 response metrics, 3 predictor metrics: KS, MO, ID, MT –– 2020 election",terrykrohe,2022-10-14 01:55:38,https://i.redd.it/oj9oimj1hot91.png,https://www.reddit.com/r/dataisbeautiful/comments/y3gt1w/oc_8_response_metrics_3_predictor_metrics_ks_mo/,1,1,,4,"OC 8 response metrics, 3 predictor metrics KS, MO, ID, MT –– 2020 election",2022-10-0182.png
[OC] The global stockpile of nuclear weapons,jcceagle,2022-10-14 08:19:03,https://v.redd.it/vgpux73xcqt91,https://www.reddit.com/r/dataisbeautiful/comments/y3o00f/oc_the_global_stockpile_of_nuclear_weapons/,15903,15903,,1503,OC The global stockpile of nuclear weapons,2022-10-0183.png
[OC] Google IPO vs Now - breaking down revenue and profit sources,giteam,2022-10-14 13:26:07,https://i.redd.it/ktbioyt7wrt91.png,https://www.reddit.com/r/dataisbeautiful/comments/y3txle/oc_google_ipo_vs_now_breaking_down_revenue_and/,391,391,,57,OC Google IPO vs Now - breaking down revenue and profit sources,2022-10-0184.png
[OC] Travel restrictions of the German government,dev_bln,2022-10-14 14:10:46,https://i.redd.it/4vv51ly24st91.png,https://www.reddit.com/r/dataisbeautiful/comments/y3v0s4/oc_travel_restrictions_of_the_german_government/,3279,3279,,372,OC Travel restrictions of the German government,2022-10-0185.png
[OC] Biggest Trading Losses,SayNo2Tennis,2022-10-14 14:46:45,https://i.redd.it/qske3ixaast91.png,https://www.reddit.com/r/dataisbeautiful/comments/y3vx5s/oc_biggest_trading_losses/,60,60,,6,OC Biggest Trading Losses,2022-10-0186.png
[OC] There are more African-Latinos than African-Americans. Here's where they live:,latinometrics,2022-10-14 14:48:25,https://i.redd.it/57rqqhfqast91.png,https://www.reddit.com/r/dataisbeautiful/comments/y3vyoc/oc_there_are_more_africanlatinos_than/,1558,1558,,535,OC There are more African-Latinos than African-Americans. Here's where they live,2022-10-0187.png
"[OC] Top Killers in 2019, do you think it's ranked differently now?",biantongfrom,2022-10-14 14:55:14,https://i.redd.it/h8s6ax11cst91.jpg,https://www.reddit.com/r/dataisbeautiful/comments/y3w4xm/oc_top_killers_in_2019_do_you_think_its_ranked/,60,60,,23,"OC Top Killers in 2019, do you think it's ranked differently now",2022-10-0188.jpg
[OC] Suicide Rate vs GDP per capita for various countries. Notice that the upper right triangle is almost empty i.e. generally increase in GDP per capita results in decrease in suicide rates.,ankuprk,2022-10-14 20:04:14,https://i.redd.it/t5hu8290vtt91.png,https://www.reddit.com/r/dataisbeautiful/comments/y43rx8/oc_suicide_rate_vs_gdp_per_capita_for_various/,549,549,,129,OC Suicide Rate vs GDP per capita for various countries. Notice that the upper right triangle is almost empty i.e. generally increase in GDP per capit,2022-10-0189.png
Comic Characters with the Most Powers by Publisher [OC],Equal_Astronaut_5696,2022-10-15 06:52:25,https://i.redd.it/pyiebmso2xt91.png,https://www.reddit.com/r/dataisbeautiful/comments/y4gwzi/comic_characters_with_the_most_powers_by/,14,14,,15,Comic Characters with the Most Powers by Publisher OC,2022-10-0190.png
10 Years of global EV sales,tommos,2022-10-15 08:28:20,https://www.visualcapitalist.com/visualizing-10-years-of-global-ev-sales-by-country/,https://www.reddit.com/r/dataisbeautiful/comments/y4ig98/10_years_of_global_ev_sales/,75,75,,60,10 Years of global EV sales,2022-10-0191.jpg
[OC] Travel advice and advisories by the Canadian Government,dev_bln,2022-10-15 10:05:34,https://i.redd.it/ctmzl6h81yt91.png,https://www.reddit.com/r/dataisbeautiful/comments/y4k21g/oc_travel_advice_and_advisories_by_the_canadian/,4176,4176,,769,OC Travel advice and advisories by the Canadian Government,2022-10-0192.png
[OC] Obesity rate in the United States (1985–2021) / Coronavirus update,Powerpuff_Rangers,2022-10-15 11:36:00,https://v.redd.it/q4biybztgyt91,https://www.reddit.com/r/dataisbeautiful/comments/y4logi/oc_obesity_rate_in_the_united_states_19852021/,38354,38354,,4691,OC Obesity rate in the United States (1985–2021) Coronavirus update,2022-10-0193.png
[OC] Which earthquakes have had the highest economic and human costs since 1900?,earthlymonarch,2022-10-15 12:52:37,https://v.redd.it/vi8b8g42vyt91,https://www.reddit.com/r/dataisbeautiful/comments/y4n7hr/oc_which_earthquakes_have_had_the_highest/,340,340,,17,OC Which earthquakes have had the highest economic and human costs since 1900,2022-10-0194.png
"[OC] Comparing global advertising industry and its top 5 players, 2010 vs 2020",giteam,2022-10-15 16:43:46,https://i.redd.it/7wbcgoid00u91.png,https://www.reddit.com/r/dataisbeautiful/comments/y4skyg/oc_comparing_global_advertising_industry_and_its/,104,104,,7,"OC Comparing global advertising industry and its top 5 players, 2010 vs 2020",2022-10-0195.png
[OC] Fifa 2023 Data Based on BMI (Body mass index),alx_www,2022-10-15 17:17:16,https://i.redd.it/366x7rbe60u91.jpg,https://www.reddit.com/r/dataisbeautiful/comments/y4tdbu/oc_fifa_2023_data_based_on_bmi_body_mass_index/,19,19,,10,OC Fifa 2023 Data Based on BMI (Body mass index),2022-10-0196.jpg
[OC] Most popular unisex names (US + UK + Canada + Australia),byJoanic,2022-10-16 00:57:12,https://i.redd.it/rhc6b5kpf2u91.png,https://www.reddit.com/r/dataisbeautiful/comments/y53ka2/oc_most_popular_unisex_names_us_uk_canada/,265,265,,98,OC Most popular unisex names (US + UK + Canada + Australia),2022-10-0197.png
"Population density of Australia, 2020. 1km2 grid. The dark grey background areas have no population. Many of the isolated single points are individual remote Indigenous communities, cattle stations, sheep stations and mines.",Rd28T,2022-10-16 03:38:24,https://absstats.maps.arcgis.com/apps/MapSeries/index.html?appid=b2fa123c0032456a8d47fbd0203a3dec,https://www.reddit.com/r/dataisbeautiful/comments/y56njd/population_density_of_australia_2020_1km2_grid/,29,29,,1,"Population density of Australia, 2020. 1km2 grid. The dark grey background areas have no population. Many of the isolated single points are individual",2022-10-0198.jpg
[OC] James Bond songs that made it onto the UK Charts (top 40). Six made it to the top 3,Make_the_music_stop,2022-10-16 11:00:02,https://i.redd.it/s3lwtcquf5u91.png,https://www.reddit.com/r/dataisbeautiful/comments/y5e1c2/oc_james_bond_songs_that_made_it_onto_the_uk/,538,538,,60,OC James Bond songs that made it onto the UK Charts (top 40). Six made it to the top 3,2022-10-0199.png
[OC] The representation of the Swedish parties in the Swedish parliament over time since 1911.,MaxEin,2022-10-16 11:27:30,https://i.redd.it/51yg77g7k5u91.jpg,https://www.reddit.com/r/dataisbeautiful/comments/y5ej3q/oc_the_representation_of_the_swedish_parties_in/,65,65,,19,OC The representation of the Swedish parties in the Swedish parliament over time since 1911.,2022-10-0200.jpg
[OC] Where Does Pepsi Co's Money Come From and Go To?,Magix6317,2022-10-16 13:16:36,https://i.redd.it/m448nblt36u91.png,https://www.reddit.com/r/dataisbeautiful/comments/y5glf6/oc_where_does_pepsi_cos_money_come_from_and_go_to/,6599,6599,,591,OC Where Does Pepsi Co's Money Come From and Go To,2022-10-0201.png
COVID vaccination correlation with test positivities & death rates (per country and day) [OC],akboudalis,2022-10-16 15:07:44,https://v.redd.it/r2uqfh05n6u91,https://www.reddit.com/r/dataisbeautiful/comments/y5j3zh/covid_vaccination_correlation_with_test/,1,1,,1,COVID vaccination correlation with test positivities & death rates (per country and day) OC,2022-10-0202.png
"[OC] The Top 5 Longest News Cycle Topics in 2022, measured by Mainstream Media Frontpage Analysis",rohankshirsagr,2022-10-16 16:35:42,https://v.redd.it/fzgwsddl37u91,https://www.reddit.com/r/dataisbeautiful/comments/y5l8w2/oc_the_top_5_longest_news_cycle_topics_in_2022/,117,117,,13,"OC The Top 5 Longest News Cycle Topics in 2022, measured by Mainstream Media Frontpage Analysis",2022-10-0203.png
Everyone Thinks They Are Middle Class [OC],theimpossiblesalad,2022-10-16 17:31:13,https://i.redd.it/aduriviqd7u91.jpg,https://www.reddit.com/r/dataisbeautiful/comments/y5mlhu/everyone_thinks_they_are_middle_class_oc/,31722,31722,,4182,Everyone Thinks They Are Middle Class OC,2022-10-0204.jpg
[OC] Number of NFL Teams by State (based on the location of their home stadium),Slight_Author_8386,2022-10-16 19:05:35,https://i.redd.it/ie9x3n5lu7u91.png,https://www.reddit.com/r/dataisbeautiful/comments/y5oy1y/oc_number_of_nfl_teams_by_state_based_on_the/,55,55,,46,OC Number of NFL Teams by State (based on the location of their home stadium),2022-10-0205.png
"GS payscale, total employees at higher grades and the prevalence of degrees in those grades [OC]",KJ6BWB,2022-10-16 22:42:34,https://i.redd.it/18h4ty8cx8u91.png,https://www.reddit.com/r/dataisbeautiful/comments/y5u6nm/gs_payscale_total_employees_at_higher_grades_and/,17,17,,4,"GS payscale, total employees at higher grades and the prevalence of degrees in those grades OC",2022-10-0206.png
A shaded relief map of Washington rendered from 3d data and satellite imagery [OC],visualgeomatics,2022-10-17 06:08:25,https://i.redd.it/21szsj8t4bu91.jpg,https://www.reddit.com/r/dataisbeautiful/comments/y636ko/a_shaded_relief_map_of_washington_rendered_from/,1986,1986,,49,A shaded relief map of Washington rendered from 3d data and satellite imagery OC,2022-10-0207.jpg
[OC] The most popular car brands on Reddit (r/cars),madredditscientist,2022-10-17 06:46:21,https://i.redd.it/iz0mfndnbbu91.png,https://www.reddit.com/r/dataisbeautiful/comments/y63tbi/oc_the_most_popular_car_brands_on_reddit_rcars/,10799,10799,,1522,OC The most popular car brands on Reddit (rcars),2022-10-0208.png
[OC] 3 largest global payment networks - measured by total payment volume each year ($B),giteam,2022-10-17 08:48:53,https://i.redd.it/2d0g5yfixbu91.png,https://www.reddit.com/r/dataisbeautiful/comments/y65s2o/oc_3_largest_global_payment_networks_measured_by/,1798,1798,,208,OC 3 largest global payment networks - measured by total payment volume each year ($B),2022-10-0209.png
[OC] The Daily Average Sale Price of The Most Popular Reddit Avatar Collections,ARoyaleWithCheese,2022-10-17 13:30:57,https://i.imgur.com/urc5phR.png,https://www.reddit.com/r/dataisbeautiful/comments/y6bdbq/oc_the_daily_average_sale_price_of_the_most/,0,0,,3,OC The Daily Average Sale Price of The Most Popular Reddit Avatar Collections,2022-10-0210.png
US Fed's Reverse Repo Facility [OC],rosetechnology,2022-10-17 13:57:49,https://i.redd.it/azvl6nykgdu91.png,https://www.reddit.com/r/dataisbeautiful/comments/y6bzk0/us_feds_reverse_repo_facility_oc/,30,30,,19,US Fed's Reverse Repo Facility OC,2022-10-0211.png
[OC] Gold as a store of value,jcceagle,2022-10-17 14:12:40,https://v.redd.it/drczlh40jdu91,https://www.reddit.com/r/dataisbeautiful/comments/y6cbqf/oc_gold_as_a_store_of_value/,73,73,,47,OC Gold as a store of value,2022-10-0212.png
[OC] Fruit Efficient-C Analysis,Inevitable-Clue9840,2022-10-17 14:19:08,https://i.redd.it/r4jhc4ddkdu91.png,https://www.reddit.com/r/dataisbeautiful/comments/y6cgof/oc_fruit_efficientc_analysis/,2489,2489,,247,OC Fruit Efficient-C Analysis,2022-10-0213.png
[OC] Disney Parks Annual Attendance Visualized 2011 to 2021,row64software,2022-10-17 14:59:27,https://v.redd.it/b9defo6grdu91,https://www.reddit.com/r/dataisbeautiful/comments/y6dewp/oc_disney_parks_annual_attendance_visualized_2011/,251,251,,19,OC Disney Parks Annual Attendance Visualized 2011 to 2021,2022-10-0214.png
My 3-month job search as a Professional Environmental Engineer[OC],gamingsniper,2022-10-17 15:48:57,https://i.redd.it/h1mu08m20eu91.png,https://www.reddit.com/r/dataisbeautiful/comments/y6ek5z/my_3month_job_search_as_a_professional/,27,27,,8,My 3-month job search as a Professional Environmental EngineerOC,2022-10-0215.png
Animated map of my two week January camper van trip around Iceland [OC],basedrifter,2022-10-17 17:22:21,https://v.redd.it/giyedt23heu91,https://www.reddit.com/r/dataisbeautiful/comments/y6gy05/animated_map_of_my_two_week_january_camper_van/,1762,1762,,123,Animated map of my two week January camper van trip around Iceland OC,2022-10-0216.png
[OC] Popularity of Latin America's most renowned authors over time.,latinometrics,2022-10-17 19:17:44,https://i.redd.it/tqb3gajj1fu91.png,https://www.reddit.com/r/dataisbeautiful/comments/y6jvh8/oc_popularity_of_latin_americas_most_renowned/,0,0,,16,OC Popularity of Latin America's most renowned authors over time.,2022-10-0217.png
[OC] How much each of 20 most popular artists earns from Spotify.,alx_www,2022-10-17 19:36:11,https://i.redd.it/bwhgcn205fu91.jpg,https://www.reddit.com/r/dataisbeautiful/comments/y6kc7m/oc_how_much_each_of_20_most_popular_artists_earns/,15737,15737,,2484,OC How much each of 20 most popular artists earns from Spotify.,2022-10-0218.jpg
[OC] Where Am I Talking About? Frequency of state/province mentions in my text data,Pattyclecle,2022-10-17 20:13:27,https://i.redd.it/s6zz0qh8bfu91.png,https://www.reddit.com/r/dataisbeautiful/comments/y6lbdu/oc_where_am_i_talking_about_frequency_of/,8,8,,9,OC Where Am I Talking About Frequency of stateprovince mentions in my text data,2022-10-0219.png
[OC] I made a word cloud of my LinkedIn messages,benthecoderX,2022-10-17 21:46:03,https://i.redd.it/r3h9vov5sfu91.png,https://www.reddit.com/r/dataisbeautiful/comments/y6nqk0/oc_i_made_a_word_cloud_of_my_linkedin_messages/,16,16,,8,OC I made a word cloud of my LinkedIn messages,2022-10-0220.png
