title,author,created_date,url,full_permalink,score,ups,downs,num_comments,sanitized_title,image_file
Quality of life by U.S. state,quiet_repub,2022-10-01 00:45:29,https://factsmaps.com/quality-of-life-ranking-by-us-state/,https://www.reddit.com/r/dataisbeautiful/comments/xshkfo/quality_of_life_by_us_state/,0,0,,0,Quality of life by U.S. state,2022-10-0000.jpg
[OC] The most time-efficient public transport systems are not where you'd expect,earthlymonarch,2022-10-01 09:55:46,https://i.redd.it/wfbxpibs26r91.png,https://www.reddit.com/r/dataisbeautiful/comments/xsregc/oc_the_most_timeefficient_public_transport/,7449,7449,,819,OC The most time-efficient public transport systems are not where you'd expect,2022-10-0001.png
[OC] All space launches in the last 10 years,PieChartPirate,2022-10-01 12:44:56,https://v.redd.it/sripk4w9w6r91,https://www.reddit.com/r/dataisbeautiful/comments/xsue5o/oc_all_space_launches_in_the_last_10_years/,646,646,,34,OC All space launches in the last 10 years,2022-10-0002.png
[OC] Median age difference between US Senators and the US population (1950-2022) v2,JolietJakeLebowski,2022-10-01 12:54:03,https://i.redd.it/07iuuxdhy6r91.png,https://www.reddit.com/r/dataisbeautiful/comments/xsukyf/oc_median_age_difference_between_us_senators_and/,2159,2159,,89,OC Median age difference between US Senators and the US population (1950-2022) v2,2022-10-0003.png
Common City Name Prefixes in the United States [OC],BoMcCready,2022-10-01 13:02:49,https://i.redd.it/v8b84v4707r91.png,https://www.reddit.com/r/dataisbeautiful/comments/xsurvg/common_city_name_prefixes_in_the_united_states_oc/,1242,1242,,71,Common City Name Prefixes in the United States OC,2022-10-0004.png
[OC] The world's biggest polluters based on cumulative CO2 emissions,flyingcatwithhorns,2022-10-01 16:32:02,https://i.redd.it/gk7qtjezy7r91.png,https://www.reddit.com/r/dataisbeautiful/comments/xszr7k/oc_the_worlds_biggest_polluters_based_on/,1964,1964,,374,OC The world's biggest polluters based on cumulative CO2 emissions,2022-10-0005.png
"[OC] Jay-Z's use of multiple entendre in his verse on ""GOD DID""",Metalytiq,2022-10-01 17:13:22,https://i.redd.it/h7p117jt88r91.jpg,https://www.reddit.com/r/dataisbeautiful/comments/xt0rlq/oc_jayzs_use_of_multiple_entendre_in_his_verse_on/,17,17,,5,OC Jay-Z's use of multiple entendre in his verse on GOD DID,2022-10-0006.jpg
[OC] Happy Nigerian Independence Day. Here are all the Nigerian-born players in NFL history.,JPAnalyst,2022-10-01 20:22:44,https://i.redd.it/jfdfu9sp69r91.png,https://www.reddit.com/r/dataisbeautiful/comments/xt57p7/oc_happy_nigerian_independence_day_here_are_all/,49,49,,5,OC Happy Nigerian Independence Day. Here are all the Nigerian-born players in NFL history.,2022-10-0007.png
"[OC] U.S. Psychologists by Gender, 1980-2020",academiaadvice,2022-10-02 01:17:49,https://i.redd.it/9fmh7h2dnar91.png,https://www.reddit.com/r/dataisbeautiful/comments/xtbp2f/oc_us_psychologists_by_gender_19802020/,11024,11024,,1220,"OC U.S. Psychologists by Gender, 1980-2020",2022-10-0008.png
"[OC] Nothing else to do, so I tracked my miles over the course of a month. 2,098.5 miles total.",-mya,2022-10-02 03:29:01,https://i.redd.it/qaht148rabr91.png,https://www.reddit.com/r/dataisbeautiful/comments/xte9re/oc_nothing_else_to_do_so_i_tracked_my_miles_over/,22,22,,6,"OC Nothing else to do, so I tracked my miles over the course of a month. 2,098.5 miles total.",2022-10-0009.png
The Most Visited Website in Every Country (That Isn’t A Search Engine),leoxwastaken,2022-10-02 09:34:40,https://www.hostinger.com/tutorials/the-most-visited-website-in-every-country,https://www.reddit.com/r/dataisbeautiful/comments/xtkic3/the_most_visited_website_in_every_country_that/,52,52,,12,The Most Visited Website in Every Country (That Isn’t A Search Engine),2022-10-0010.jpg
[OC] Do people tip in restaurants in Poland?,scheisskopf53,2022-10-02 11:40:27,https://i.redd.it/ulv0redeqdr91.png,https://www.reddit.com/r/dataisbeautiful/comments/xtmntf/oc_do_people_tip_in_restaurants_in_poland/,47,47,,31,OC Do people tip in restaurants in Poland,2022-10-0011.png
"[OC] How to Mathematically Win at Rock, Paper, Scissors",waynehihihi,2022-10-02 12:38:42,https://i.redd.it/0ka5828l0er91.png,https://www.reddit.com/r/dataisbeautiful/comments/xtnsj3/oc_how_to_mathematically_win_at_rock_paper/,33876,33876,,659,"OC How to Mathematically Win at Rock, Paper, Scissors",2022-10-0012.png
[OC] Healthcare expenditure per capita vs life expectancy years,giteam,2022-10-02 12:50:31,https://i.redd.it/2i2e8w3l2er91.png,https://www.reddit.com/r/dataisbeautiful/comments/xto16m/oc_healthcare_expenditure_per_capita_vs_life/,4430,4430,,545,OC Healthcare expenditure per capita vs life expectancy years,2022-10-0013.png
[OC] Residential solar generation and use over four years,animatedb,2022-10-02 15:29:07,https://i.redd.it/39yt6sn7ver91.png,https://www.reddit.com/r/dataisbeautiful/comments/xtrl4j/oc_residential_solar_generation_and_use_over_four/,38,38,,8,OC Residential solar generation and use over four years,2022-10-0014.png
[OC] Top 10 Richest Russian Oligarchs in 2022 and their links to Putin,Spirited-Focus-7312,2022-10-02 15:41:26,https://i.redd.it/wk6my3n1xer91.png,https://www.reddit.com/r/dataisbeautiful/comments/xtrvg3/oc_top_10_richest_russian_oligarchs_in_2022_and/,284,284,,76,OC Top 10 Richest Russian Oligarchs in 2022 and their links to Putin,2022-10-0015.png
[OC] Regional Differences in Obesity and Eating Disorder Rates,icywatermelons,2022-10-02 15:41:26,https://i.redd.it/65blw618xer91.png,https://www.reddit.com/r/dataisbeautiful/comments/xtrvgh/oc_regional_differences_in_obesity_and_eating/,28,28,,7,OC Regional Differences in Obesity and Eating Disorder Rates,2022-10-0016.png
[OC] The most expensive hurricanes in the Atlantic and the most affected areas.,latinometrics,2022-10-02 18:49:32,https://i.redd.it/gv1ih8yhufr91.png,https://www.reddit.com/r/dataisbeautiful/comments/xtwhtz/oc_the_most_expensive_hurricanes_in_the_atlantic/,560,560,,79,OC The most expensive hurricanes in the Atlantic and the most affected areas.,2022-10-0017.png
Hours of daylight vs latitude vs day of year,Johannes8,2022-10-02 21:24:59,https://commons.m.wikimedia.org/wiki/File:Hours_of_daylight_vs_latitude_vs_day_of_year_cmglee.svg#mw-jump-to-license,https://www.reddit.com/r/dataisbeautiful/comments/xu0bni/hours_of_daylight_vs_latitude_vs_day_of_year/,44,44,,9,Hours of daylight vs latitude vs day of year,2022-10-0018.jpg
[OC] 11 developing countries with higher life expectancy than the United States,flyingcatwithhorns,2022-10-02 23:02:53,https://i.redd.it/qwmknil04hr91.png,https://www.reddit.com/r/dataisbeautiful/comments/xu2ml4/oc_11_developing_countries_with_higher_life/,2128,2128,,470,OC 11 developing countries with higher life expectancy than the United States,2022-10-0019.png
Every Country’s Wikipedia Protection Status,JustinTheGreat1928,2022-10-02 23:13:42,https://www.reddit.com/r/MapPorn/comments/xtacuy/every_countrys_wikipedia_protection_status/?utm_source=share&utm_medium=ios_app&utm_name=iossmf,https://www.reddit.com/r/dataisbeautiful/comments/xu2v8k/every_countrys_wikipedia_protection_status/,14,14,,0,Every Country’s Wikipedia Protection Status,2022-10-0020.jpg
Element Scarcity - EuChemS Periodic Table (2021),marketrent,2022-10-02 23:29:19,https://www.euchems.eu/euchems-periodic-table/,https://www.reddit.com/r/dataisbeautiful/comments/xu37ev/element_scarcity_euchems_periodic_table_2021/,7,7,,2,Element Scarcity - EuChemS Periodic Table (2021),2022-10-0021.jpg
[OC] The side effects of three competing Insomnia medications visualized by frequency. Interactive version in the comments.,Chattypyre,2022-10-02 23:31:47,https://i.redd.it/pmblp6p69hr91.png,https://www.reddit.com/r/dataisbeautiful/comments/xu39cf/oc_the_side_effects_of_three_competing_insomnia/,30,30,,10,OC The side effects of three competing Insomnia medications visualized by frequency. Interactive version in the comments.,2022-10-0022.png
[OC] Mouse Sensitivities across some different FPS games,EstablishmentOk6147,2022-10-03 01:14:28,https://i.redd.it/otkvbtparhr91.png,https://www.reddit.com/r/dataisbeautiful/comments/xu5foq/oc_mouse_sensitivities_across_some_different_fps/,82,82,,5,OC Mouse Sensitivities across some different FPS games,2022-10-0023.png
[OC] SoCal on 30k monthly income,millennial-money,2022-10-03 06:26:45,https://i.redd.it/sqfewhjebjr91.jpg,https://www.reddit.com/r/dataisbeautiful/comments/xublij/oc_socal_on_30k_monthly_income/,0,0,,55,OC SoCal on 30k monthly income,2022-10-0024.jpg
[OC] Around 1 month of job searching in Lisbon with a degree in Computer Science and Engineering,SweetCaramelo,2022-10-03 07:41:00,https://i.redd.it/4j9pny9mojr91.png,https://www.reddit.com/r/dataisbeautiful/comments/xuctvp/oc_around_1_month_of_job_searching_in_lisbon_with/,14357,14357,,625,OC Around 1 month of job searching in Lisbon with a degree in Computer Science and Engineering,2022-10-0025.png
[OC] Only 3 out of 10 Booktok Books Contain Porn,meller12_3,2022-10-03 09:45:31,https://i.redd.it/tro11jytakr91.png,https://www.reddit.com/r/dataisbeautiful/comments/xueujh/oc_only_3_out_of_10_booktok_books_contain_porn/,11,11,,6,OC Only 3 out of 10 Booktok Books Contain Porn,2022-10-0026.png
"In light of the Try Guys' Cheating Scandal, I asked 50 friends whether they thought physical or emotional cheating was worse [oc]",hannigong4dmi,2022-10-03 12:00:36,https://i.redd.it/04nnr4i3zjr91.png,https://www.reddit.com/r/dataisbeautiful/comments/xuhhjg/in_light_of_the_try_guys_cheating_scandal_i_asked/,0,0,,73,"In light of the Try Guys' Cheating Scandal, I asked 50 friends whether they thought physical or emotional cheating was worse oc",2022-10-0027.png
"More than 70% of researchers have tried and failed to reproduce another scientist's experiments, and more than half have failed to reproduce their own experiments.",madredditscientist,2022-10-03 12:46:52,https://www.nature.com/articles/533452a,https://www.reddit.com/r/dataisbeautiful/comments/xuiiep/more_than_70_of_researchers_have_tried_and_failed/,11081,11081,,526,"More than 70% of researchers have tried and failed to reproduce another scientist's experiments, and more than half have failed to reproduce their own",2022-10-0028.jpg
Common City Name Suffixes in the United States [OC],BoMcCready,2022-10-03 13:24:22,https://i.redd.it/l7cv9bpudlr91.png,https://www.reddit.com/r/dataisbeautiful/comments/xuje1c/common_city_name_suffixes_in_the_united_states_oc/,703,703,,66,Common City Name Suffixes in the United States OC,2022-10-0029.png
"The returns to learning the most common words, by language [OC]",orgtre,2022-10-03 13:32:53,https://i.redd.it/jt62igjaflr91.png,https://www.reddit.com/r/dataisbeautiful/comments/xujlqk/the_returns_to_learning_the_most_common_words_by/,74,74,,34,"The returns to learning the most common words, by language OC",2022-10-0030.png
[OC] The Stock Market is at a New Low for 2022,Janman14,2022-10-03 13:52:57,https://v.redd.it/ebe5x2vailr91,https://www.reddit.com/r/dataisbeautiful/comments/xuk355/oc_the_stock_market_is_at_a_new_low_for_2022/,830,830,,42,OC The Stock Market is at a New Low for 2022,2022-10-0031.png
Global Happiness Scores [OC],rosetechnology,2022-10-03 13:59:32,https://i.redd.it/3cdjg9h6klr91.png,https://www.reddit.com/r/dataisbeautiful/comments/xuk8qp/global_happiness_scores_oc/,1,1,,12,Global Happiness Scores OC,2022-10-0032.png
"[OC] Prices for common food products, August 2010 vs 2022.",robert_ritz,2022-10-03 14:45:57,https://i.redd.it/syt4viwfslr91.jpg,https://www.reddit.com/r/dataisbeautiful/comments/xulfo3/oc_prices_for_common_food_products_august_2010_vs/,224,224,,71,"OC Prices for common food products, August 2010 vs 2022.",2022-10-0033.jpg
[OC] Spam emails in my gmail spam folder categorized by type,SmallDickGirlLover,2022-10-03 15:17:19,https://i.redd.it/1qspmudyxlr91.png,https://www.reddit.com/r/dataisbeautiful/comments/xum8w1/oc_spam_emails_in_my_gmail_spam_folder/,68,68,,6,OC Spam emails in my gmail spam folder categorized by type,2022-10-0034.png
[OC] 1.2% of adults own 47.8% of world's wealth,veleros,2022-10-03 15:30:11,https://i.redd.it/9a08ox550mr91.png,https://www.reddit.com/r/dataisbeautiful/comments/xumkvo/oc_12_of_adults_own_478_of_worlds_wealth/,3836,3836,,455,OC 1.2% of adults own 47.8% of world's wealth,2022-10-0035.png
Erling Haaland's Record Goal-Scoring Pace [OC],BoMcCready,2022-10-03 15:53:04,https://i.redd.it/hbdip3wc4mr91.png,https://www.reddit.com/r/dataisbeautiful/comments/xun6n7/erling_haalands_record_goalscoring_pace_oc/,134,134,,22,Erling Haaland's Record Goal-Scoring Pace OC,2022-10-0036.png
Which country has the most palm species? [OC],vividmaps,2022-10-03 16:04:04,https://vividmaps.com/palm-species/,https://www.reddit.com/r/dataisbeautiful/comments/xunhia/which_country_has_the_most_palm_species_oc/,8,8,,4,Which country has the most palm species OC,2022-10-0037.jpg
"Housing Affordability, USA [OC], September, 2022, dataisbeautifulized",michigician,2022-10-03 17:26:51,https://i.redd.it/smww943zkmr91.png,https://www.reddit.com/r/dataisbeautiful/comments/xupqcp/housing_affordability_usa_oc_september_2022/,1289,1289,,257,"Housing Affordability, USA OC, September, 2022, dataisbeautifulized",2022-10-0038.png
"Charting the Relationship Between Wealth and Happiness, by Country",H4R81N63R,2022-10-03 17:39:46,https://www.visualcapitalist.com/relationship-between-wealth-and-happiness-by-country/,https://www.reddit.com/r/dataisbeautiful/comments/xuq29o/charting_the_relationship_between_wealth_and/,5,5,,1,"Charting the Relationship Between Wealth and Happiness, by Country",2022-10-0039.jpg
[OC] How do Americans like their coffee?,YouGov_Official,2022-10-03 17:41:17,https://i.redd.it/seumrc3qnmr91.jpg,https://www.reddit.com/r/dataisbeautiful/comments/xuq3u5/oc_how_do_americans_like_their_coffee/,11015,11015,,1652,OC How do Americans like their coffee,2022-10-0040.jpg
[OC] A two-month job hunt as a semiconductors process engineer moving from academic research to the industry in Europe,dougsv,2022-10-03 17:59:05,https://i.imgur.com/0wz4SlP.png,https://www.reddit.com/r/dataisbeautiful/comments/xuqkol/oc_a_twomonth_job_hunt_as_a_semiconductors/,34,34,,3,OC A two-month job hunt as a semiconductors process engineer moving from academic research to the industry in Europe,2022-10-0041.png
[OC] Modified Sankey diagram of my job search as a UX designer in India between January to August 2021,chandra381,2022-10-03 19:21:20,https://i.redd.it/vpazt8av4nr91.png,https://www.reddit.com/r/dataisbeautiful/comments/xusq87/oc_modified_sankey_diagram_of_my_job_search_as_a/,15,15,,6,OC Modified Sankey diagram of my job search as a UX designer in India between January to August 2021,2022-10-0042.png
[OC] Football league title distribution across the top 5 European leagues,austin_rettig,2022-10-03 19:25:31,https://i.redd.it/jadv1eya6nr91.png,https://www.reddit.com/r/dataisbeautiful/comments/xusud5/oc_football_league_title_distribution_across_the/,49,49,,15,OC Football league title distribution across the top 5 European leagues,2022-10-0043.png
"Trends in the Distribution of Family Wealth, 1989 to 2019",idapitbwidiuatabip,2022-10-03 22:28:40,https://www.cbo.gov/publication/57598,https://www.reddit.com/r/dataisbeautiful/comments/xuxhmu/trends_in_the_distribution_of_family_wealth_1989/,11,11,,5,"Trends in the Distribution of Family Wealth, 1989 to 2019",2022-10-0044.jpg
[OC] Six years and 3795 matches of Overwatch SR,Tommie55555,2022-10-03 23:10:14,https://i.redd.it/jya976uq9or91.png,https://www.reddit.com/r/dataisbeautiful/comments/xuyh2v/oc_six_years_and_3795_matches_of_overwatch_sr/,15,15,,4,OC Six years and 3795 matches of Overwatch SR,2022-10-0045.png
[OC] Results of 1991 Ukrainian Independence Referendum,academiaadvice,2022-10-03 23:37:48,https://i.redd.it/5xh5lk9cfor91.png,https://www.reddit.com/r/dataisbeautiful/comments/xuz3p2/oc_results_of_1991_ukrainian_independence/,18149,18149,,1014,OC Results of 1991 Ukrainian Independence Referendum,2022-10-0046.png
[OC] Forgot to post this a while ago but here's my progress on my Mood Tracker!,mistermolotov,2022-10-03 23:48:56,https://i.redd.it/k5vcfz5chor91.png,https://www.reddit.com/r/dataisbeautiful/comments/xuzcnk/oc_forgot_to_post_this_a_while_ago_but_heres_my/,55,55,,5,OC Forgot to post this a while ago but here's my progress on my Mood Tracker!,2022-10-0047.png
An aggregate of all positional logs of a boss in FFXIV. Each dot represents one person with a recorded run of the boss. (FFXIV Raid Data),Velo_Dinosir,2022-10-04 02:35:32,https://twitter.com/xiv_stats/status/1571368064838684678?s=20&t=fNn-6b63Tjp0XzZE2sudzQ,https://www.reddit.com/r/dataisbeautiful/comments/xv30iw/an_aggregate_of_all_positional_logs_of_a_boss_in/,7,7,,0,An aggregate of all positional logs of a boss in FFXIV. Each dot represents one person with a recorded run of the boss. (FFXIV Raid Data),2022-10-0048.jpg
[OC] How democratic are F1 venues over the years?,alison359,2022-10-04 09:49:11,https://i.redd.it/wu6m5xkjzqr91.jpg,https://www.reddit.com/r/dataisbeautiful/comments/xvas3m/oc_how_democratic_are_f1_venues_over_the_years/,29,29,,63,OC How democratic are F1 venues over the years,2022-10-0049.jpg
[OC] Suicide rate among countries with the highest Human Development Index,flyingcatwithhorns,2022-10-04 10:33:25,https://i.redd.it/s6b5inl2orr91.png,https://www.reddit.com/r/dataisbeautiful/comments/xvbjpp/oc_suicide_rate_among_countries_with_the_highest/,11595,11595,,1274,OC Suicide rate among countries with the highest Human Development Index,2022-10-0050.png
[OC] Vapes are by far the most-used Tobacco product among American Middle and High Schoolers in 2021/22,Spirited-Focus-7312,2022-10-04 11:42:25,https://i.redd.it/79igtvki0sr91.png,https://www.reddit.com/r/dataisbeautiful/comments/xvcvoq/oc_vapes_are_by_far_the_mostused_tobacco_product/,14,14,,16,OC Vapes are by far the most-used Tobacco product among American Middle and High Schoolers in 202122,2022-10-0051.png
A study of lights at night suggests dictators lie about economic growth,statisticalanalysis_,2022-10-04 12:48:16,https://www.economist.com/graphic-detail/2022/09/29/a-study-of-lights-at-night-suggests-dictators-lie-about-economic-growth,https://www.reddit.com/r/dataisbeautiful/comments/xve8n9/a_study_of_lights_at_night_suggests_dictators_lie/,153,153,,25,A study of lights at night suggests dictators lie about economic growth,2022-10-0052.jpg
Most common native languages of foreigners in Germany [OC],staplehill,2022-10-04 13:50:17,https://i.imgur.com/6gKf2tU.jpg,https://www.reddit.com/r/dataisbeautiful/comments/xvfn2w/most_common_native_languages_of_foreigners_in/,670,670,,46,Most common native languages of foreigners in Germany OC,2022-10-0053.jpg
Global Agricultural Land Use v. Agricultural Production [OC],rosetechnology,2022-10-04 14:31:04,https://i.redd.it/w3095xrpusr91.png,https://www.reddit.com/r/dataisbeautiful/comments/xvgmuw/global_agricultural_land_use_v_agricultural/,2403,2403,,153,Global Agricultural Land Use v. Agricultural Production OC,2022-10-0054.png
[OC] Kanye's Most Used Words In His Songs,mightybonerlord,2022-10-04 15:50:48,https://i.redd.it/2k4jgcsr8tr91.jpg,https://www.reddit.com/r/dataisbeautiful/comments/xvilxk/oc_kanyes_most_used_words_in_his_songs/,6,6,,2,OC Kanye's Most Used Words In His Songs,2022-10-0055.jpg
[OC] The Majority of PostgreSQL Servers on the Internet are Insecure,data_dan_,2022-10-04 20:12:35,https://i.redd.it/b8yi69sjjur91.png,https://www.reddit.com/r/dataisbeautiful/comments/xvpbyh/oc_the_majority_of_postgresql_servers_on_the/,22,22,,7,OC The Majority of PostgreSQL Servers on the Internet are Insecure,2022-10-0056.png
Median Household Income (county and state levels - 2020) [OC],-ofx,2022-10-04 21:44:19,https://i.redd.it/xmne67fuzur91.png,https://www.reddit.com/r/dataisbeautiful/comments/xvro1z/median_household_income_county_and_state_levels/,7646,7646,,816,Median Household Income (county and state levels - 2020) OC,2022-10-0057.png
"[OC] Search popularity of ""Vigilante"" surges after Taylor Swift's ""Midnights Mayhem With Me""",Consistent-Two-9376,2022-10-05 02:05:15,https://i.redd.it/qzc8hdow9wr91.png,https://www.reddit.com/r/dataisbeautiful/comments/xvxl82/oc_search_popularity_of_vigilante_surges_after/,7,7,,2,OC Search popularity of Vigilante surges after Taylor Swift's Midnights Mayhem With Me,2022-10-0058.png
[OC] Prices for meat over the past 10 years in the US,robert_ritz,2022-10-05 07:12:41,https://i.redd.it/5ol493oetxr91.png,https://www.reddit.com/r/dataisbeautiful/comments/xw3lff/oc_prices_for_meat_over_the_past_10_years_in_the/,116,116,,71,OC Prices for meat over the past 10 years in the US,2022-10-0059.png
Where is each ore found in a 1.19 minecraft world? [OC],tigeer,2022-10-05 09:30:25,https://i.redd.it/s9rv5hzvhyr91.png,https://www.reddit.com/r/dataisbeautiful/comments/xw5vyq/where_is_each_ore_found_in_a_119_minecraft_world/,40610,40610,,1027,Where is each ore found in a 1.19 minecraft world OC,2022-10-0060.png
[OC] Chanel is THE powerhouse of fashion,alison359,2022-10-05 10:57:50,https://i.redd.it/n9mibe7axyr91.jpg,https://www.reddit.com/r/dataisbeautiful/comments/xw7fyd/oc_chanel_is_the_powerhouse_of_fashion/,18,18,,10,OC Chanel is THE powerhouse of fashion,2022-10-0061.jpg
"[OC] Character relations visualization of the Mobile Game ""Guardian Tales""",DarkMatterOne,2022-10-05 11:44:35,https://i.redd.it/fqn542iw5zr91.png,https://www.reddit.com/r/dataisbeautiful/comments/xw8dqm/oc_character_relations_visualization_of_the/,11,11,,9,OC Character relations visualization of the Mobile Game Guardian Tales,2022-10-0062.png
[OC] U.S. Streamflow Conditions September 2022,houndrunner,2022-10-05 12:28:53,https://i.redd.it/cioc0o9rdzr91.png,https://www.reddit.com/r/dataisbeautiful/comments/xw9c9y/oc_us_streamflow_conditions_september_2022/,13,13,,1,OC U.S. Streamflow Conditions September 2022,2022-10-0063.png
[OC] What is the most popular US Sports League in Mexico? Here's a breakdown per state:,latinometrics,2022-10-05 14:43:45,https://i.redd.it/cdtuwvpo10s91.png,https://www.reddit.com/r/dataisbeautiful/comments/xwchuj/oc_what_is_the_most_popular_us_sports_league_in/,82,82,,24,OC What is the most popular US Sports League in Mexico Here's a breakdown per state,2022-10-0064.png
[OC] Ethnic Differences in Representation for Bachelor/Master Degree Holders in the US (2019),icywatermelons,2022-10-05 14:52:52,https://i.redd.it/1b36uycf30s91.png,https://www.reddit.com/r/dataisbeautiful/comments/xwcq4j/oc_ethnic_differences_in_representation_for/,53,53,,75,OC Ethnic Differences in Representation for BachelorMaster Degree Holders in the US (2019),2022-10-0065.png
Oil v. US Inflation [OC],rosetechnology,2022-10-05 15:17:52,https://i.redd.it/app76vny70s91.png,https://www.reddit.com/r/dataisbeautiful/comments/xwddlc/oil_v_us_inflation_oc/,17,17,,9,Oil v. US Inflation OC,2022-10-0066.png
"USA MLS Home Listings with Price Reduction, as a Percent of Active Listings, by County, September, 2022 [OC]",michigician,2022-10-05 15:43:52,https://i.redd.it/r9tlxdheb0s91.png,https://www.reddit.com/r/dataisbeautiful/comments/xwe1iq/usa_mls_home_listings_with_price_reduction_as_a/,262,262,,49,"USA MLS Home Listings with Price Reduction, as a Percent of Active Listings, by County, September, 2022 OC",2022-10-0067.png
How long leaders stay in power versus how authoritarian their government is [OC],HavenAWilliams,2022-10-05 15:45:32,https://i.redd.it/i9lp1alnc0s91.png,https://www.reddit.com/r/dataisbeautiful/comments/xwe31i/how_long_leaders_stay_in_power_versus_how/,23,23,,6,How long leaders stay in power versus how authoritarian their government is OC,2022-10-0068.png
Bitcoin mining: Watt is money? | FT Standpoint,financialtimes,2022-10-05 15:49:04,https://www.ft.com/video/4195bbed-8749-481e-a3a4-94815057df5f,https://www.reddit.com/r/dataisbeautiful/comments/xwe6b0/bitcoin_mining_watt_is_money_ft_standpoint/,2,2,,1,Bitcoin mining Watt is money FT Standpoint,2022-10-0069.jpg
[OC] Spacewomen,datagist,2022-10-05 16:21:52,https://i.redd.it/72pq70r7j0s91.png,https://www.reddit.com/r/dataisbeautiful/comments/xwf1h4/oc_spacewomen/,24,24,,2,OC Spacewomen,2022-10-0070.png
Share of global plastic waste emitted to the ocean,Atlantis1910,2022-10-05 16:32:34,https://ourworldindata.org/grapher/share-of-global-plastic-waste-emitted-to-the-ocean?country=Africa~Asia~Europe~South+America~North+America~Oceania,https://www.reddit.com/r/dataisbeautiful/comments/xwfbce/share_of_global_plastic_waste_emitted_to_the_ocean/,4,4,,3,Share of global plastic waste emitted to the ocean,2022-10-0071.jpg
[OC] Men-Women Ratio in Wealthiest and Poorest Countries,biantongfrom,2022-10-05 16:33:34,https://i.redd.it/nyzqqzxgl0s91.jpg,https://www.reddit.com/r/dataisbeautiful/comments/xwfc9j/oc_menwomen_ratio_in_wealthiest_and_poorest/,11,11,,24,OC Men-Women Ratio in Wealthiest and Poorest Countries,2022-10-0072.jpg
"[OC] We are still living mostly on gas, oil & coal - Global primary energy consumption by source (TWh)",giteam,2022-10-05 20:52:04,https://i.redd.it/v4tnszalv1s91.png,https://www.reddit.com/r/dataisbeautiful/comments/xwlzf5/oc_we_are_still_living_mostly_on_gas_oil_coal/,6225,6225,,667,"OC We are still living mostly on gas, oil & coal - Global primary energy consumption by source (TWh)",2022-10-0073.png
[OC] Location Shooting and Television in Old Hollywood,cinemaAI,2022-10-05 23:47:31,https://i.redd.it/60sk6638q2s91.png,https://www.reddit.com/r/dataisbeautiful/comments/xwq8u2/oc_location_shooting_and_television_in_old/,6,6,,2,OC Location Shooting and Television in Old Hollywood,2022-10-0074.png
Timeline: 150 Years of U.S. National Debt,jeffsmith202,2022-10-06 00:13:09,https://www.visualcapitalist.com/timeline-150-years-of-u-s-national-debt/,https://www.reddit.com/r/dataisbeautiful/comments/xwqtde/timeline_150_years_of_us_national_debt/,7,7,,9,Timeline 150 Years of U.S. National Debt,2022-10-0075.jpg
