title,author,created_date,url,full_permalink,score,ups,downs,num_comments,sanitized_title,image_file
"There was a large influx of babies named ""Rhiannon"" in the US following Fleetwood Mac's hit rock song ""Rhiannon"" in June 1976. [OC]",SocialSlack,2022-11-20 17:16:07,https://i.redd.it/k22nxtqt251a1.png,https://www.reddit.com/r/dataisbeautiful/comments/z09j59/there_was_a_large_influx_of_babies_named_rhiannon/,224,224,,19,There was a large influx of babies named Rhiannon in the US following Fleetwood Mac's hit rock song Rhiannon in June 1976. OC,2022-11-0296.png
Pop music doesn’t have key changes anymore,hmoof,2022-11-20 17:51:02,https://tedium.co/2022/11/09/the-death-of-the-key-change,https://www.reddit.com/r/dataisbeautiful/comments/z0af2z/pop_music_doesnt_have_key_changes_anymore/,1,1,,0,Pop music doesn’t have key changes anymore,2022-11-0297.jpg
[OC] Number of pubs in districts of Austria,coopigeon,2022-11-20 23:34:57,https://i.imgur.com/uRKIsEn.jpg,https://www.reddit.com/r/dataisbeautiful/comments/z0j0wo/oc_number_of_pubs_in_districts_of_austria/,47,47,,17,OC Number of pubs in districts of Austria,2022-11-0298.png
Interesting breakdown of shark tank entrepreneurs compared to deals made.,StinkyWinkyPoo,2022-11-21 01:52:14,https://www.businessinsider.com/demographics-of-shark-tank-investments-2015-1,https://www.reddit.com/r/dataisbeautiful/comments/z0m3xv/interesting_breakdown_of_shark_tank_entrepreneurs/,4,4,,6,Interesting breakdown of shark tank entrepreneurs compared to deals made.,2022-11-0299.jpg
Digital Personal Data Protection Bill - India's own GDPR is taking shape,JamieTaylor_Pulseway,2022-11-21 03:54:05,https://www.thecybersecuritytimes.com/digital-personal-data-protection-bill-indias-own-gdpr-is-taking-shape/,https://www.reddit.com/r/dataisbeautiful/comments/z0oorz/digital_personal_data_protection_bill_indias_own/,24,24,,7,Digital Personal Data Protection Bill - India's own GDPR is taking shape,2022-11-0300.jpg
[OC] Essential equations for an evenly lit tree,PixelWrangler,2022-11-21 04:46:00,https://i.redd.it/9gsdyiqwh81a1.png,https://www.reddit.com/r/dataisbeautiful/comments/z0pqcn/oc_essential_equations_for_an_evenly_lit_tree/,2008,2008,,74,OC Essential equations for an evenly lit tree,2022-11-0301.png
% Players at World Cup by number of international caps [OC],hcrx,2022-11-21 09:51:06,https://i.redd.it/mobu1s2g0a1a1.png,https://www.reddit.com/r/dataisbeautiful/comments/z0uz4v/players_at_world_cup_by_number_of_international/,0,0,,3,% Players at World Cup by number of international caps OC,2022-11-0302.png
Environmental Impacts of Food Production,Corvid-Moon,2022-11-21 10:56:49,https://ourworldindata.org/environmental-impacts-of-food,https://www.reddit.com/r/dataisbeautiful/comments/z0w2vt/environmental_impacts_of_food_production/,31,31,,19,Environmental Impacts of Food Production,2022-11-0303.jpg
[OC] Celebrating a successful 4 month job search for a PreSales Manager role with a graph.,stan-k,2022-11-21 12:27:16,https://i.redd.it/xkwifuh8sa1a1.png,https://www.reddit.com/r/dataisbeautiful/comments/z0xrjr/oc_celebrating_a_successful_4_month_job_search/,25,25,,13,OC Celebrating a successful 4 month job search for a PreSales Manager role with a graph.,2022-11-0304.png
[OC] UPDATE - 2.5 years of my GF and I tracking the sleep quality impact of various choices/behaviours. These were the 9 most significant effects. Note - white dash indicates the % effect 5 months ago.,HeroJournal,2022-11-21 13:17:47,https://i.redd.it/m57w7jmk0b1a1.png,https://www.reddit.com/r/dataisbeautiful/comments/z0ys9b/oc_update_25_years_of_my_gf_and_i_tracking_the/,40366,40366,,2270,OC UPDATE - 2.5 years of my GF and I tracking the sleep quality impact of various choicesbehaviours. These were the 9 most significant effects. Note -,2022-11-0305.png
Top 50 Programming Languages Ranked by the Number of Influenced Languages [OC],yaph,2022-11-21 13:20:47,https://i.redd.it/9ti1o4wr1b1a1.jpg,https://www.reddit.com/r/dataisbeautiful/comments/z0yul2/top_50_programming_languages_ranked_by_the_number/,140,140,,25,Top 50 Programming Languages Ranked by the Number of Influenced Languages OC,2022-11-0306.jpg
"[OC] Spectacular Videos: Synthetic Universes, with Star Collision Graph",MLRecipes,2022-11-21 14:46:03,https://v.redd.it/nbkv02a4hb1a1,https://www.reddit.com/r/dataisbeautiful/comments/z10q93/oc_spectacular_videos_synthetic_universes_with/,437,437,,24,"OC Spectacular Videos Synthetic Universes, with Star Collision Graph",2022-11-0307.png
World Cup Ticketing App Problem Delays Fans At England-Iran,Objective_Mistake_86,2022-11-21 14:55:54,https://www.muhabarishaji.com/world-cup-ticketing-app-problem-delays-fans-at-england-iran/,https://www.reddit.com/r/dataisbeautiful/comments/z10ycn/world_cup_ticketing_app_problem_delays_fans_at/,3,3,,1,World Cup Ticketing App Problem Delays Fans At England-Iran,2022-11-0308.jpg
5 vendors take up 1/3 of my deliveries [OC],Altruistic_Olives,2022-11-21 17:28:53,https://i.imgur.com/jNde1He.jpg,https://www.reddit.com/r/dataisbeautiful/comments/z14noy/5_vendors_take_up_13_of_my_deliveries_oc/,9870,9870,,616,5 vendors take up 13 of my deliveries OC,2022-11-0309.jpg
Mapping Famous Art Colors On To Irises [OC],beingsubmitted,2022-11-21 18:03:01,https://imgur.com/a/2tT7563,https://www.reddit.com/r/dataisbeautiful/comments/z15ich/mapping_famous_art_colors_on_to_irises_oc/,20,20,,8,Mapping Famous Art Colors On To Irises OC,2022-11-0310.jpg
[OC] Top 8 NBA Rookie Of The Year Players,BasketballBully,2022-11-21 18:15:14,https://i.redd.it/g5bymuxvhc1a1.jpg,https://www.reddit.com/r/dataisbeautiful/comments/z15tqz/oc_top_8_nba_rookie_of_the_year_players/,5,5,,4,OC Top 8 NBA Rookie Of The Year Players,2022-11-0311.jpg
[OC] USD Inflation Delta Since 1990,FuckMyHeart,2022-11-21 20:39:50,https://i.redd.it/qt8b3sy68d1a1.png,https://www.reddit.com/r/dataisbeautiful/comments/z19l01/oc_usd_inflation_delta_since_1990/,15,15,,26,OC USD Inflation Delta Since 1990,2022-11-0312.png
"My job application history. Left: graduate during pandemic, Right: recently as a young professional [OC]",doplo123,2022-11-21 21:51:53,https://i.redd.it/2k6qvmwm2f1a1.jpg,https://www.reddit.com/r/dataisbeautiful/comments/z1bg46/my_job_application_history_left_graduate_during/,50,50,,32,"My job application history. Left graduate during pandemic, Right recently as a young professional OC",2022-11-0313.jpg
80% of movies on Netflix were released after 2015 [OC],df_iris,2022-11-21 22:02:54,https://i.redd.it/741qgfd0nd1a1.png,https://www.reddit.com/r/dataisbeautiful/comments/z1bqp4/80_of_movies_on_netflix_were_released_after_2015/,4403,4403,,246,80% of movies on Netflix were released after 2015 OC,2022-11-0314.png
Airports Sorted by Locations Reached in Two Hops [OC],CharcoalCharts,2022-11-22 03:57:42,https://i.redd.it/5ntvzeoxdf1a1.png,https://www.reddit.com/r/dataisbeautiful/comments/z1jp5u/airports_sorted_by_locations_reached_in_two_hops/,3,3,,10,Airports Sorted by Locations Reached in Two Hops OC,2022-11-0315.png
A plot of the goals scored per game in the 2022 MLS season. [OC],sinfulducking,2022-11-22 08:26:44,https://i.redd.it/p7t9v6sw7i1a1.jpg,https://www.reddit.com/r/dataisbeautiful/comments/z1ocxi/a_plot_of_the_goals_scored_per_game_in_the_2022/,30,30,,10,A plot of the goals scored per game in the 2022 MLS season. OC,2022-11-0316.jpg
"[OC] Royal Mail, Europe's 3rd largest postal service by market cap - breaking down its 2021 annual report",giteam,2022-11-22 09:26:51,https://i.redd.it/4pvd0d81zg1a1.png,https://www.reddit.com/r/dataisbeautiful/comments/z1p99b/oc_royal_mail_europes_3rd_largest_postal_service/,376,376,,27,"OC Royal Mail, Europe's 3rd largest postal service by market cap - breaking down its 2021 annual report",2022-11-0317.png
"[OC] We're 28 years away from 2050, can we get to net zero by then? Last year we emitted ~33 billion tons of CO2",giteam,2022-11-22 09:33:23,https://i.redd.it/tulaaun82h1a1.png,https://www.reddit.com/r/dataisbeautiful/comments/z1pcwy/oc_were_28_years_away_from_2050_can_we_get_to_net/,12785,12785,,1314,"OC We're 28 years away from 2050, can we get to net zero by then Last year we emitted ~33 billion tons of CO2",2022-11-0318.png
2021 vs 2022 Market cap change in the Tech Industry (Top 10 tech stocks by market cap as of 21 Nov 2022) [OC],Savoy_Cabbage,2022-11-22 11:26:33,https://i.redd.it/pl24skfemh1a1.png,https://www.reddit.com/r/dataisbeautiful/comments/z1r6n9/2021_vs_2022_market_cap_change_in_the_tech/,331,331,,79,2021 vs 2022 Market cap change in the Tech Industry (Top 10 tech stocks by market cap as of 21 Nov 2022) OC,2022-11-0319.png
[Bloomberg] Here’s How America Uses Its Land,JPAnalyst,2022-11-22 11:50:35,https://www.bloomberg.com/graphics/2018-us-land-use/?leadSource=uverify%20wall,https://www.reddit.com/r/dataisbeautiful/comments/z1rm34/bloomberg_heres_how_america_uses_its_land/,548,548,,69,Bloomberg Here’s How America Uses Its Land,2022-11-0320.jpg
Disney Princess Baby Name Trends [OC],BoMcCready,2022-11-22 14:16:59,https://i.redd.it/hukt9azrgi1a1.png,https://www.reddit.com/r/dataisbeautiful/comments/z1up1s/disney_princess_baby_name_trends_oc/,3172,3172,,247,Disney Princess Baby Name Trends OC,2022-11-0321.png
World Cup: Argentina v Saudi Arabia [OC],123Javi123,2022-11-22 15:39:50,https://i.redd.it/mwgg4di6dk1a1.jpg,https://www.reddit.com/r/dataisbeautiful/comments/z1wpmv/world_cup_argentina_v_saudi_arabia_oc/,89,89,,24,World Cup Argentina v Saudi Arabia OC,2022-11-0322.jpg
India's Leading Source of Import by Country 2021-22 [OC],ixaditya,2022-11-22 16:13:20,https://i.redd.it/m8ph4fja1j1a1.jpg,https://www.reddit.com/r/dataisbeautiful/comments/z1xjub/indias_leading_source_of_import_by_country_202122/,45,45,,14,India's Leading Source of Import by Country 2021-22 OC,2022-11-0323.jpg
[OC] Irreligion in Canada,BLAZENIOSZ,2022-11-22 16:14:04,https://i.redd.it/2394pdtq1j1a1.png,https://www.reddit.com/r/dataisbeautiful/comments/z1xkfc/oc_irreligion_in_canada/,14365,14365,,1168,OC Irreligion in Canada,2022-11-0324.png
Diversity and population density across six West Coast US cities [OC],themadmapper,2022-11-22 17:39:34,https://v.redd.it/jr6h9n3vgj1a1,https://www.reddit.com/r/dataisbeautiful/comments/z1zp7f/diversity_and_population_density_across_six_west/,607,607,,44,Diversity and population density across six West Coast US cities OC,2022-11-0325.png
Wildland Fire Time-Lapse with Deep Learning Classification [OC],seamacke,2022-11-22 19:52:12,https://v.redd.it/dyuro5d04k1a1,https://www.reddit.com/r/dataisbeautiful/comments/z233if/wildland_fire_timelapse_with_deep_learning/,209,209,,7,Wildland Fire Time-Lapse with Deep Learning Classification OC,2022-11-0326.png
Data viz meets memoir in a new piece about economic mobility and migration [OC],pudding-cool,2022-11-22 20:35:33,https://pudding.cool/2022/11/upward-mobility/,https://www.reddit.com/r/dataisbeautiful/comments/z247y5/data_viz_meets_memoir_in_a_new_piece_about/,1,1,,0,Data viz meets memoir in a new piece about economic mobility and migration OC,2022-11-0327.jpg
"CO2 spiked while sleeping in apartment alone with windows open, no idea why [OC]",SawdustAndWoodGlue,2022-11-22 20:44:31,https://imgur.com/a/Og4NdXe,https://www.reddit.com/r/dataisbeautiful/comments/z24g7a/co2_spiked_while_sleeping_in_apartment_alone_with/,12,12,,37,"CO2 spiked while sleeping in apartment alone with windows open, no idea why OC",2022-11-0328.jpg
Visualizing the World’s Top Social Media and Messaging Apps,akkio-Giorgio,2022-11-22 21:09:16,https://www.visualcapitalist.com/social-media-universe-2022/,https://www.reddit.com/r/dataisbeautiful/comments/z253tq/visualizing_the_worlds_top_social_media_and/,1,1,,0,Visualizing the World’s Top Social Media and Messaging Apps,2022-11-0329.jpg
Energy crisis no more: the rise and fall of European power prices,Adjournorburn,2022-11-22 22:52:55,https://www.fdiintelligence.com/content/data-trends/energy-crisis-no-more-the-rise-and-fall-of-european-power-prices-81628,https://www.reddit.com/r/dataisbeautiful/comments/z27uvc/energy_crisis_no_more_the_rise_and_fall_of/,19,19,,0,Energy crisis no more the rise and fall of European power prices,2022-11-0330.jpg
[OC] Saudi Defenders against Argentina [OC],Anas27Omar,2022-11-22 23:10:44,https://i.redd.it/vi7zs4o24l1a1.png,https://www.reddit.com/r/dataisbeautiful/comments/z28bix/oc_saudi_defenders_against_argentina_oc/,12,12,,2,OC Saudi Defenders against Argentina OC,2022-11-0331.png
[OC] Just as grateful: American consistently spend the same value on Thanksgiving accounting for Inflation,ranger934,2022-11-22 23:32:41,https://i.redd.it/opt915lj7l1a1.jpg,https://www.reddit.com/r/dataisbeautiful/comments/z28v30/oc_just_as_grateful_american_consistently_spend/,146,146,,32,OC Just as grateful American consistently spend the same value on Thanksgiving accounting for Inflation,2022-11-0332.jpg
[OC] Words That Are Used More Often In 2022,OfficialWireGrind,2022-11-22 23:55:02,https://i.redd.it/uetgubdkbl1a1.png,https://www.reddit.com/r/dataisbeautiful/comments/z29e9t/oc_words_that_are_used_more_often_in_2022/,2278,2278,,105,OC Words That Are Used More Often In 2022,2022-11-0333.png
[OC] The Best European Cities for McDonald's According to Google Maps Reviews,Fun-Ant-5808,2022-11-23 00:42:10,https://i.redd.it/t01ndvlijl1a1.png,https://www.reddit.com/r/dataisbeautiful/comments/z2ah9e/oc_the_best_european_cities_for_mcdonalds/,377,377,,108,OC The Best European Cities for McDonald's According to Google Maps Reviews,2022-11-0334.png
[OC] Building “CoreTable” and the Our World in Data “Data Explorer”,breck,2022-11-23 01:28:54,https://docs.google.com/presentation/d/1CgTbCPSYdKY2_oSvqV63GueIlUggnfdwGJhYgEvMTZI/edit?usp=sharing,https://www.reddit.com/r/dataisbeautiful/comments/z2bi4t/oc_building_coretable_and_the_our_world_in_data/,1,1,,0,OC Building “CoreTable” and the Our World in Data “Data Explorer”,2022-11-0335.jpg
[OC] How Every Nation Has Fared Throughout World Cup History,mpforstein,2022-11-23 03:16:17,https://docs.google.com/spreadsheets/d/1FmF9dt6-SbPmH6faVYLhfG--s8acqskrJq_HAbb6RGI/edit?usp=sharing,https://www.reddit.com/r/dataisbeautiful/comments/z2dt1c/oc_how_every_nation_has_fared_throughout_world/,1,1,,1,OC How Every Nation Has Fared Throughout World Cup History,2022-11-0336.jpg
US Social media companies KPI comparison last 4 quarters [OC],hcrx,2022-11-23 09:32:53,https://i.redd.it/a03phjyw6o1a1.png,https://www.reddit.com/r/dataisbeautiful/comments/z2kq40/us_social_media_companies_kpi_comparison_last_4/,6,6,,1,US Social media companies KPI comparison last 4 quarters OC,2022-11-0337.png
African -climate mobility- visualized in 50+ maps,GertFranke,2022-11-23 13:25:06,https://africa.climatemobility.org,https://www.reddit.com/r/dataisbeautiful/comments/z2p2fc/african_climate_mobility_visualized_in_50_maps/,15,15,,1,African -climate mobility- visualized in 50+ maps,2022-11-0338.jpg
"Manchester United may be up for sale, so is the team profitable? [OC]",NicuCalcea,2022-11-23 15:24:50,https://i.redd.it/kwk02nrfwp1a1.png,https://www.reddit.com/r/dataisbeautiful/comments/z2rx3w/manchester_united_may_be_up_for_sale_so_is_the/,2551,2551,,128,"Manchester United may be up for sale, so is the team profitable OC",2022-11-0339.png
Roads of the World [OC],symmy546,2022-11-23 17:33:27,https://i.redd.it/06g52dttkq1a1.png,https://www.reddit.com/r/dataisbeautiful/comments/z2v6vr/roads_of_the_world_oc/,2469,2469,,97,Roads of the World OC,2022-11-0340.png
"In August 2022, there were 1.5 million layoffs and discharges across the U.S., which increased just a little (by 91,000) compared to August 2021",kickresume,2022-11-23 17:40:23,https://blog.kickresume.com/infographics/layoffs-and-discharges-by-industry-in-2022/,https://www.reddit.com/r/dataisbeautiful/comments/z2vd8x/in_august_2022_there_were_15_million_layoffs_and/,40,40,,10,"In August 2022, there were 1.5 million layoffs and discharges across the U.S., which increased just a little (by 91,000) compared to August 2021",2022-11-0341.jpg
How rich is Elon Musk? A side scrolling adventure,EngagingData,2022-11-23 18:07:51,https://engaging-data.com/how-rich-is-elon-musk/,https://www.reddit.com/r/dataisbeautiful/comments/z2w2sb/how_rich_is_elon_musk_a_side_scrolling_adventure/,3604,3604,,726,How rich is Elon Musk A side scrolling adventure,2022-11-0342.jpg
"Today's Stocks, an interactive 3-D view of the Data Landscape [OC]",charlie350,2022-11-23 19:22:16,https://v.redd.it/pkx4raym1r1a1,https://www.reddit.com/r/dataisbeautiful/comments/z2xyq2/todays_stocks_an_interactive_3d_view_of_the_data/,6,6,,6,"Today's Stocks, an interactive 3-D view of the Data Landscape OC",2022-11-0343.png
Vladimir Putin wants to be a conqueror,statisticalanalysis_,2022-11-23 21:17:54,https://www.economist.com/graphic-detail/2022/11/23/vladimir-putin-wants-to-be-a-conqueror,https://www.reddit.com/r/dataisbeautiful/comments/z30uht/vladimir_putin_wants_to_be_a_conqueror/,10,10,,2,Vladimir Putin wants to be a conqueror,2022-11-0344.jpg
[OC] Rate of water quality violations in the US,USAFacts_Official,2022-11-23 22:03:03,https://i.redd.it/xmdwcnolwr1a1.png,https://www.reddit.com/r/dataisbeautiful/comments/z31ypj/oc_rate_of_water_quality_violations_in_the_us/,3377,3377,,338,OC Rate of water quality violations in the US,2022-11-0345.png
Qatar not looking good as clearly the least sustainable country in the world on a per capita basis.,alexjones85,2022-11-24 06:13:42,https://ourworldindata.org/grapher/per-capita-co2-by-fuel?time=2019&country=CHN~USA~OWID_WRL~IND~GBR~BRA~AUS~SWE~FRA~DEU~ZAF~QAT~SAU,https://www.reddit.com/r/dataisbeautiful/comments/z3c7d5/qatar_not_looking_good_as_clearly_the_least/,1237,1237,,95,Qatar not looking good as clearly the least sustainable country in the world on a per capita basis.,2022-11-0346.jpg
Incumbent governors and POTUS by generation in every february from 1960 to 2022 [OC],angryredfrog,2022-11-24 10:37:40,https://v.redd.it/ecfi51t3mv1a1,https://www.reddit.com/r/dataisbeautiful/comments/z3gpio/incumbent_governors_and_potus_by_generation_in/,59,59,,11,Incumbent governors and POTUS by generation in every february from 1960 to 2022 OC,2022-11-0347.png
[OC] What leagues do players that make up the 2022 World Cup Squads play in?,d0xical,2022-11-24 13:18:06,https://i.redd.it/d0f1004yfw1a1.png,https://www.reddit.com/r/dataisbeautiful/comments/z3jqn2/oc_what_leagues_do_players_that_make_up_the_2022/,19,19,,29,OC What leagues do players that make up the 2022 World Cup Squads play in,2022-11-0348.png
[OC] Most Populated Country in 2050? IND vs CHN vs USA,Project_Nile,2022-11-24 13:56:23,https://v.redd.it/qy996nmxmw1a1,https://www.reddit.com/r/dataisbeautiful/comments/z3km1l/oc_most_populated_country_in_2050_ind_vs_chn_vs/,2,2,,2,OC Most Populated Country in 2050 IND vs CHN vs USA,2022-11-0349.png
Are European Nations Drinking Less in Recent Years? (interactive version in comment) [OC],data_n_stuff,2022-11-24 14:28:26,https://i.redd.it/nhljbqh5sw1a1.png,https://www.reddit.com/r/dataisbeautiful/comments/z3lcmx/are_european_nations_drinking_less_in_recent/,64,64,,19,Are European Nations Drinking Less in Recent Years (interactive version in comment) OC,2022-11-0350.png
Where Do World Cup Players Ply Their Trade [OC],crcalpha,2022-11-24 14:51:11,https://i.redd.it/c4dtu6moww1a1.png,https://www.reddit.com/r/dataisbeautiful/comments/z3lvuc/where_do_world_cup_players_ply_their_trade_oc/,0,0,,1,Where Do World Cup Players Ply Their Trade OC,2022-11-0351.png
Here's a dataset you can play around with!,jollygoodlad,2022-11-24 15:36:15,https://www.kaggle.com/datasets/amorybristol/playboy-playmate-features,https://www.reddit.com/r/dataisbeautiful/comments/z3mzga/heres_a_dataset_you_can_play_around_with/,0,0,,2,Here's a dataset you can play around with!,2022-11-0352.jpg
Alaska House Election RCV Detailed Results,EmeraldNorthStar,2022-11-24 15:59:51,https://www.reddit.com/r/alaska/comments/z39nyd/alaska_house_election_rcv_detailed_results/,https://www.reddit.com/r/dataisbeautiful/comments/z3nk1g/alaska_house_election_rcv_detailed_results/,40,40,,2,Alaska House Election RCV Detailed Results,2022-11-0353.png
Alaska Senate Election RCV Detailed Results,EmeraldNorthStar,2022-11-24 16:11:41,https://www.reddit.com/r/alaska/comments/z3a3o6/alaska_senate_election_rcv_detailed_results/,https://www.reddit.com/r/dataisbeautiful/comments/z3nv29/alaska_senate_election_rcv_detailed_results/,10,10,,0,Alaska Senate Election RCV Detailed Results,2022-11-0354.png
The 25 Most Visited Places in the National Park System,WhiteyKC,2022-11-24 16:32:49,https://www.aaastateofplay.com/the-25-most-visited-places-in-the-national-park-system/,https://www.reddit.com/r/dataisbeautiful/comments/z3odsu/the_25_most_visited_places_in_the_national_park/,20,20,,3,The 25 Most Visited Places in the National Park System,2022-11-0355.jpg
Why Does the U.S. Have So Many Mass Shootings? Research Is Clear: Guns. (Published 2017),JohnHazardWandering,2022-11-24 16:35:33,https://www.nytimes.com/2017/11/07/world/americas/mass-shootings-us-international.html?unlocked_article_code=t7FfpC4U5Ax0fHG1Bm-_A3W_kP_zOvxOeSuGBWpgGxFNEp2_02EzBbZF3bTUWiFqvlx-z52RFYC0h08foVdcrj5Amg4zn4MgH4OZMGWQqnQA6pHbhHrwaeLVLiWi9BMzJB0jbxeHgHSUcBOQQWRJy7Hv1r-dfGlHNw28yBQSPR8qDYz40R__GjH0DcsmuhBC7kAlQvDf-bpd1zJHGdYUDgyrPty6F8ZUXEnpN_AbDorv0-gr-g0JMMg7rPSwzpIQn1svaHRPmfzIcQHT-BxonfAgKTaRt_J11eS2_1OP1oYtUbDmy8rQ9DDF4AoB2N20DwYWlFdfHHH75B4fB-ov7KcMhM5V6jCarOksbcCZXEY&smid=share-url,https://www.reddit.com/r/dataisbeautiful/comments/z3ogaz/why_does_the_us_have_so_many_mass_shootings/,13826,13826,,4411,Why Does the U.S. Have So Many Mass Shootings Research Is Clear Guns. (Published 2017),2022-11-0356.jpg
[OC] Endogamy of Ashkenazi Jews visualized through DNA matches,ItsDaBunnyYT,2022-11-24 18:06:29,https://i.redd.it/y6dkqyf8vx1a1.png,https://www.reddit.com/r/dataisbeautiful/comments/z3qlnr/oc_endogamy_of_ashkenazi_jews_visualized_through/,29,29,,25,OC Endogamy of Ashkenazi Jews visualized through DNA matches,2022-11-0357.png
[OC] BlackRock is the world's largest asset manager - breaking down how it makes money,giteam,2022-11-24 22:49:35,https://i.redd.it/vr242ui2az1a1.png,https://www.reddit.com/r/dataisbeautiful/comments/z3wycr/oc_blackrock_is_the_worlds_largest_asset_manager/,3850,3850,,245,OC BlackRock is the world's largest asset manager - breaking down how it makes money,2022-11-0358.png
[OC] incarceration vs 'predictor' metrics – 2020 election,terrykrohe,2022-11-25 03:37:54,https://i.redd.it/rpjaoadkp02a1.png,https://www.reddit.com/r/dataisbeautiful/comments/z42ub4/oc_incarceration_vs_predictor_metrics_2020/,9,9,,15,OC incarceration vs 'predictor' metrics – 2020 election,2022-11-0359.png
"According to Twitter, Twitter’s algorithm favours conservatives - Its data shows a bias aiding unreliable media, regardless of ideology, and right-wing political parties",statisticalanalysis_,2022-11-25 11:49:51,https://www.economist.com/graphic-detail/2021/11/13/according-to-twitter-twitters-algorithm-favours-conservatives,https://www.reddit.com/r/dataisbeautiful/comments/z4bi13/according_to_twitter_twitters_algorithm_favours/,8951,8951,,602,"According to Twitter, Twitter’s algorithm favours conservatives - Its data shows a bias aiding unreliable media, regardless of ideology, and right-win",2022-11-0360.jpg
Global Rank of Railroad Quality (interactive version in comment) [OC],data_n_stuff,2022-11-25 13:05:32,https://i.redd.it/2smq4pmei32a1.png,https://www.reddit.com/r/dataisbeautiful/comments/z4cxqw/global_rank_of_railroad_quality_interactive/,145,145,,77,Global Rank of Railroad Quality (interactive version in comment) OC,2022-11-0361.png
Social Media Users [OC],Landgeist,2022-11-25 13:51:23,https://i.redd.it/188of67zq32a1.png,https://www.reddit.com/r/dataisbeautiful/comments/z4dvrj/social_media_users_oc/,37,37,,3,Social Media Users OC,2022-11-0362.png
World's Largest Pension Funds,dildobagginss,2022-11-25 13:54:07,https://www.visualcapitalist.com/worlds-100-biggest-pension-funds/,https://www.reddit.com/r/dataisbeautiful/comments/z4dxsg/worlds_largest_pension_funds/,11,11,,7,World's Largest Pension Funds,2022-11-0363.jpg
[OC] Countries the most museums in top 50 most visited,hcrx,2022-11-25 14:09:08,https://i.redd.it/9gf5gb74u32a1.png,https://www.reddit.com/r/dataisbeautiful/comments/z4e9q9/oc_countries_the_most_museums_in_top_50_most/,0,0,,19,OC Countries the most museums in top 50 most visited,2022-11-0364.png
[OC]: Does domestic league form or previous international performance better predict how a footballer will perform at an international tournament?,Evidently_21,2022-11-25 14:33:13,https://i.redd.it/c0z2pv66y32a1.png,https://www.reddit.com/r/dataisbeautiful/comments/z4eslz/oc_does_domestic_league_form_or_previous/,8,8,,1,OC Does domestic league form or previous international performance better predict how a footballer will perform at an international tournament,2022-11-0365.png
[OC] Top 10 largest oil fields by 2021 production,giteam,2022-11-25 17:18:28,https://i.redd.it/tno0g81xr42a1.png,https://www.reddit.com/r/dataisbeautiful/comments/z4ipyx/oc_top_10_largest_oil_fields_by_2021_production/,146,146,,19,OC Top 10 largest oil fields by 2021 production,2022-11-0366.png
Rivers of South America [OC],symmy546,2022-11-25 18:54:11,https://i.redd.it/y3aqh7b2952a1.jpg,https://www.reddit.com/r/dataisbeautiful/comments/z4l1pj/rivers_of_south_america_oc/,5352,5352,,77,Rivers of South America OC,2022-11-0367.jpg
[OC] The Largest Entertainment Streaming Companies,Dremarious,2022-11-25 19:08:12,https://i.redd.it/y78gywuhb52a1.png,https://www.reddit.com/r/dataisbeautiful/comments/z4le59/oc_the_largest_entertainment_streaming_companies/,1609,1609,,207,OC The Largest Entertainment Streaming Companies,2022-11-0368.png
IMDB Top Movies and TV Series [OC],Southparkcitizens,2022-11-25 23:32:16,https://i.redd.it/jua9i14om62a1.png,https://www.reddit.com/r/dataisbeautiful/comments/z4rqqa/imdb_top_movies_and_tv_series_oc/,14,14,,3,IMDB Top Movies and TV Series OC,2022-11-0369.png
