title,author,created_date,url,full_permalink,score,ups,downs,num_comments,sanitized_title,image_file
Visualizing Companies with the Most Patents Granted in 2021,jbo999,2022-11-11 00:46:57,https://www.visualcapitalist.com/visualizing-companies-with-the-most-patents-granted-in-2021/,https://www.reddit.com/r/dataisbeautiful/comments/yrwt90/visualizing_companies_with_the_most_patents/,15,15,,2,Visualizing Companies with the Most Patents Granted in 2021,2022-11-0146.jpg
"Private jet emissions in the last 3 years of well-known individuals, computed using open ADS-B data",AndooBundoo,2022-11-11 08:59:25,https://i.redd.it/q1p718pedaz91.png,https://www.reddit.com/r/dataisbeautiful/comments/ys5eyz/private_jet_emissions_in_the_last_3_years_of/,17571,17571,,1262,"Private jet emissions in the last 3 years of well-known individuals, computed using open ADS-B data",2022-11-0147.png
How China Overtook the U.S. as the World’s Major Trading Partner,publius-varus,2022-11-11 09:39:39,https://www.visualcapitalist.com/china-u-s-worlds-trading-partner/,https://www.reddit.com/r/dataisbeautiful/comments/ys6097/how_china_overtook_the_us_as_the_worlds_major/,19,19,,14,How China Overtook the U.S. as the World’s Major Trading Partner,2022-11-0148.jpg
UK - Population Pyramid,r-vishwas,2022-11-11 10:56:53,https://canvasjs.com/vuejs-charts/multiseries-chart/,https://www.reddit.com/r/dataisbeautiful/comments/ys76jf/uk_population_pyramid/,1,1,,6,UK - Population Pyramid,2022-11-0149.jpg
"[OC] Housing has become increasingly unaffordable in Singapore, more so than in other high-cost cities",earthlymonarch,2022-11-11 12:04:18,https://i.redd.it/q9rp3e45bbz91.png,https://www.reddit.com/r/dataisbeautiful/comments/ys8hqu/oc_housing_has_become_increasingly_unaffordable/,349,349,,83,"OC Housing has become increasingly unaffordable in Singapore, more so than in other high-cost cities",2022-11-0150.png
"Resources to See Which Hospitals Are Penalized by Medicare... Direct links to databases of hospitals penalized by Medicare for readmissions, in-hospital infections, and in-hospital avoidable injuries",BurdenofPain,2022-11-11 12:20:54,https://www.daily-remedy.com/resources-to-see-which-hospitals-are-penalized-by-medicare/,https://www.reddit.com/r/dataisbeautiful/comments/ys8uzh/resources_to_see_which_hospitals_are_penalized_by/,13,13,,0,"Resources to See Which Hospitals Are Penalized by Medicare... Direct links to databases of hospitals penalized by Medicare for readmissions, in-hospit",2022-11-0151.jpg
"[OC] Deforestation has significantly impacted climate change, biodiversity, and local communities. These countries are pledging stronger conservation efforts. However, much of the deforestation has favored Soy, Cobalt & Palm Oil exports, which play an important role in their economy.",RobinWheeliams,2022-11-11 12:27:45,https://i.redd.it/v1oba9nbfbz91.png,https://www.reddit.com/r/dataisbeautiful/comments/ys90rg/oc_deforestation_has_significantly_impacted/,135,135,,4,"OC Deforestation has significantly impacted climate change, biodiversity, and local communities. These countries are pledging stronger conservation ef",2022-11-0152.png
[OC] Binance - FTX saga in 4 mini charts,giteam,2022-11-11 13:47:46,https://i.redd.it/1vrhyd8mtbz91.png,https://www.reddit.com/r/dataisbeautiful/comments/ysazj9/oc_binance_ftx_saga_in_4_mini_charts/,31,31,,22,OC Binance - FTX saga in 4 mini charts,2022-11-0153.png
"The effect of the First World War on names, in France [OC]",bjco,2022-11-11 15:55:26,https://i.redd.it/skivbnd8gcz91.png,https://www.reddit.com/r/dataisbeautiful/comments/ysedll/the_effect_of_the_first_world_war_on_names_in/,8721,8721,,191,"The effect of the First World War on names, in France OC",2022-11-0154.png
[OC] College Majors and their Respective Changes in Earnings (2010 vs 2019),icywatermelons,2022-11-11 16:12:36,https://i.redd.it/qehtxop8jcz91.png,https://www.reddit.com/r/dataisbeautiful/comments/ysevg8/oc_college_majors_and_their_respective_changes_in/,74,74,,37,OC College Majors and their Respective Changes in Earnings (2010 vs 2019),2022-11-0155.png
[OC] Visualizing Nicaragua's Dependency in US Gold Exports,latinometrics,2022-11-11 21:26:43,https://i.imgur.com/LNQY0KQ.jpg,https://www.reddit.com/r/dataisbeautiful/comments/ysnofn/oc_visualizing_nicaraguas_dependency_in_us_gold/,19,19,,14,OC Visualizing Nicaragua's Dependency in US Gold Exports,2022-11-0156.jpg
Most Streamed Arctic Monkeys Songs by Album (Spotify) [OC],niko8848,2022-11-12 02:11:29,https://i.redd.it/nqc6cn93ifz91.png,https://www.reddit.com/r/dataisbeautiful/comments/ystw7p/most_streamed_arctic_monkeys_songs_by_album/,1,1,,1,Most Streamed Arctic Monkeys Songs by Album (Spotify) OC,2022-11-0157.png
[OC] Correlation between GDP Growth and Self reported happiness '09-'19 (dataset in comments),hcrx,2022-11-12 08:43:15,https://i.redd.it/iewsqql6ghz91.png,https://www.reddit.com/r/dataisbeautiful/comments/yt17kl/oc_correlation_between_gdp_growth_and_self/,11,11,,16,OC Correlation between GDP Growth and Self reported happiness '09-'19 (dataset in comments),2022-11-0158.png
[OC] European Y-Chromosome (male) and mtDNA (female) genetic admixture in 5 Latin American countries,Existing-Class-140,2022-11-12 09:56:47,https://i.redd.it/8722ob4hshz91.jpg,https://www.reddit.com/r/dataisbeautiful/comments/yt2mrv/oc_european_ychromosome_male_and_mtdna_female/,2640,2640,,279,OC European Y-Chromosome (male) and mtDNA (female) genetic admixture in 5 Latin American countries,2022-11-0159.jpg
[OC] Anime Sources - Where does Anime come from?,Smooth_Trifle7561,2022-11-12 10:32:41,https://i.redd.it/80ixb7rlzhz91.jpg,https://www.reddit.com/r/dataisbeautiful/comments/yt3cds/oc_anime_sources_where_does_anime_come_from/,3237,3237,,109,OC Anime Sources - Where does Anime come from,2022-11-0160.jpg
[OC] Visualizing Apple's revenue and profit sources since 1980 when it IPOed,giteam,2022-11-12 12:55:54,https://v.redd.it/r6nwxwj9piz91,https://www.reddit.com/r/dataisbeautiful/comments/yt6bdf/oc_visualizing_apples_revenue_and_profit_sources/,63,63,,15,OC Visualizing Apple's revenue and profit sources since 1980 when it IPOed,2022-11-0161.png
[OC] Cultured Wars: Which Yakult Flavour is the Most Popular?,waynehihihi,2022-11-12 13:01:29,https://i.redd.it/0hi5ow97qiz91.png,https://www.reddit.com/r/dataisbeautiful/comments/yt6g7q/oc_cultured_wars_which_yakult_flavour_is_the_most/,0,0,,9,OC Cultured Wars Which Yakult Flavour is the Most Popular,2022-11-0162.png
[OC] Frequency of Continent-Specific mtDNA Haplotypes in the Brazilian mtDNA Pool (Dark Theme Friendly),LupusDeusMagnus,2022-11-12 15:02:53,https://i.redd.it/g29iqx7wbjz91.png,https://www.reddit.com/r/dataisbeautiful/comments/yt9f6u/oc_frequency_of_continentspecific_mtdna/,48,48,,9,OC Frequency of Continent-Specific mtDNA Haplotypes in the Brazilian mtDNA Pool (Dark Theme Friendly),2022-11-0163.png
[OC] Get married in Kazakistan and then move to Vietnam,theverybigapple,2022-11-12 15:03:44,https://i.redd.it/9niodq0ybjz91.png,https://www.reddit.com/r/dataisbeautiful/comments/yt9fwr/oc_get_married_in_kazakistan_and_then_move_to/,0,0,,9,OC Get married in Kazakistan and then move to Vietnam,2022-11-0164.png
[OC] Most Popular Movie Genre Combinations,shahinrostami,2022-11-12 15:59:51,https://v.redd.it/yr8qe9mzljz91,https://www.reddit.com/r/dataisbeautiful/comments/ytawbt/oc_most_popular_movie_genre_combinations/,5662,5662,,109,OC Most Popular Movie Genre Combinations,2022-11-0165.png
Number of Church of Jesus Christ (Mormon) temples built or in progress in each country (revised) [OC],DataSittingAlone,2022-11-12 18:03:09,https://i.redd.it/q1e7qsrmplz91.jpg,https://www.reddit.com/r/dataisbeautiful/comments/yte426/number_of_church_of_jesus_christ_mormon_temples/,1301,1301,,417,Number of Church of Jesus Christ (Mormon) temples built or in progress in each country (revised) OC,2022-11-0166.jpg
[OC] Many flights around the World,Frosty_Pineapple78,2022-11-12 22:17:26,https://i.redd.it/366rmfobhlz91.png,https://www.reddit.com/r/dataisbeautiful/comments/ytk1wd/oc_many_flights_around_the_world/,70,70,,15,OC Many flights around the World,2022-11-0167.png
[OC] How long would it take for 10 different cities to afford the IPhone 14 Pro?,hannigong4dmi,2022-11-13 12:47:47,https://i.redd.it/bqdzc778ppz91.png,https://www.reddit.com/r/dataisbeautiful/comments/yu0q3a/oc_how_long_would_it_take_for_10_different_cities/,0,0,,13,OC How long would it take for 10 different cities to afford the IPhone 14 Pro,2022-11-0168.png
[OC] FIFA World Cup : Average goal per match,TheRaphael0000,2022-11-13 14:35:33,https://i.redd.it/m69hxcywbqz91.png,https://www.reddit.com/r/dataisbeautiful/comments/yu3dvi/oc_fifa_world_cup_average_goal_per_match/,21,21,,6,OC FIFA World Cup Average goal per match,2022-11-0169.png
The Twitter share price with regard to the statements of the most important shareholder [OC],Chris_Schmitz,2022-11-13 15:51:58,https://i.redd.it/xswq2k5apqz91.png,https://www.reddit.com/r/dataisbeautiful/comments/yu5glj/the_twitter_share_price_with_regard_to_the/,12,12,,4,The Twitter share price with regard to the statements of the most important shareholder OC,2022-11-0170.png
[OC] Union Pacific is the 2nd largest freight railroad company - breaking down how it makes money,giteam,2022-11-13 15:59:46,https://i.redd.it/72fi11yxqqz91.png,https://www.reddit.com/r/dataisbeautiful/comments/yu5o0w/oc_union_pacific_is_the_2nd_largest_freight/,131,131,,16,OC Union Pacific is the 2nd largest freight railroad company - breaking down how it makes money,2022-11-0171.png
[OC] I bought and cooked 5.5 lb of chicken quarters. This is the breakdown of the weight throughout the process,dreaming-in-colour,2022-11-13 19:23:25,https://i.redd.it/q9wjlrr0rrz91.png,https://www.reddit.com/r/dataisbeautiful/comments/yub6ps/oc_i_bought_and_cooked_55_lb_of_chicken_quarters/,3832,3832,,150,OC I bought and cooked 5.5 lb of chicken quarters. This is the breakdown of the weight throughout the process,2022-11-0172.png
[OC] USL Championship (Tier 2 US soccer) Final Preview,goatony,2022-11-13 19:46:34,https://i.redd.it/rgs77z79vrz91.png,https://www.reddit.com/r/dataisbeautiful/comments/yubv3i/oc_usl_championship_tier_2_us_soccer_final_preview/,11,11,,1,OC USL Championship (Tier 2 US soccer) Final Preview,2022-11-0173.png
Homicide rate by country [OC],whaldener,2022-11-13 22:36:49,https://v.redd.it/ted0lalspsz91,https://www.reddit.com/r/dataisbeautiful/comments/yugxy4/homicide_rate_by_country_oc/,119,119,,35,Homicide rate by country OC,2022-11-0174.jpg
Homicide rate by country [oc],whaldener,2022-11-13 22:54:44,https://i.redd.it/ksk8f9x0tsz91.jpg,https://www.reddit.com/r/dataisbeautiful/comments/yuhgng/homicide_rate_by_country_oc/,18477,18477,,2605,Homicide rate by country oc,2022-11-0175.jpg
[OC] John Wick Series - Doubling the Budget Doubles the Gross,Cogniscience,2022-11-14 00:43:15,https://i.redd.it/b954qy3ybtz91.png,https://www.reddit.com/r/dataisbeautiful/comments/yuk3lb/oc_john_wick_series_doubling_the_budget_doubles/,1645,1645,,66,OC John Wick Series - Doubling the Budget Doubles the Gross,2022-11-0176.png
[OC] Map of California Parks,No_Statement_3317,2022-11-14 01:30:51,https://i.redd.it/r4ar4q9wktz91.jpg,https://www.reddit.com/r/dataisbeautiful/comments/yul4jz/oc_map_of_california_parks/,32,32,,10,OC Map of California Parks,2022-11-0177.jpg
[OC] Man United is the largest publicly traded sports club in the world - breaking down how it makes money,giteam,2022-11-14 09:36:05,https://i.redd.it/gdfec1jgzvz91.png,https://www.reddit.com/r/dataisbeautiful/comments/yuu415/oc_man_united_is_the_largest_publicly_traded/,45,45,,16,OC Man United is the largest publicly traded sports club in the world - breaking down how it makes money,2022-11-0178.png
[OC] EBIDTA margin of US public social media companies (w/ Twitter),hcrx,2022-11-14 10:17:04,https://i.redd.it/ejvzmjon6wz91.png,https://www.reddit.com/r/dataisbeautiful/comments/yuuync/oc_ebidta_margin_of_us_public_social_media/,7,7,,4,OC EBIDTA margin of US public social media companies (w Twitter),2022-11-0179.png
[OC] Most valuable brands this millennia,jcceagle,2022-11-14 11:02:12,https://v.redd.it/kev4n9mmewz91,https://www.reddit.com/r/dataisbeautiful/comments/yuvx5t/oc_most_valuable_brands_this_millennia/,17706,17706,,1466,OC Most valuable brands this millennia,2022-11-0180.png
"[OC] Respective Gains/Loss in Median Earnings Across College Majors, Aged 25-29 (2010 vs 2019)",icywatermelons,2022-11-14 11:53:58,https://i.redd.it/9dmtwurynwz91.png,https://www.reddit.com/r/dataisbeautiful/comments/yux2nh/oc_respective_gainsloss_in_median_earnings_across/,225,225,,62,"OC Respective GainsLoss in Median Earnings Across College Majors, Aged 25-29 (2010 vs 2019)",2022-11-0181.png
"[OC] A year of trying to reach 78kg (172lbs). I'm 25 years old, male and 188cm tall (6'2). More info in the comments",leovolpe,2022-11-14 12:51:02,https://i.redd.it/zcxcinr8ywz91.jpg,https://www.reddit.com/r/dataisbeautiful/comments/yuyfmp/oc_a_year_of_trying_to_reach_78kg_172lbs_im_25/,260,260,,61,"OC A year of trying to reach 78kg (172lbs). I'm 25 years old, male and 188cm tall (6'2). More info in the comments",2022-11-0182.jpg
"Realistically-sized 3D visualization of replacing the Washington Monument with Barad-dûr, Sauron's Dark Tower [OC]",tylermw8,2022-11-14 14:04:25,https://v.redd.it/sp8ykze5bxz91,https://www.reddit.com/r/dataisbeautiful/comments/yv0cei/realisticallysized_3d_visualization_of_replacing/,6520,6520,,205,"Realistically-sized 3D visualization of replacing the Washington Monument with Barad-dûr, Sauron's Dark Tower OC",2022-11-0183.png
[OC] I tracked how stressed I felt over a 4-week finals period,hannigong4dmi,2022-11-14 14:18:57,https://i.redd.it/stes1yrudxz91.png,https://www.reddit.com/r/dataisbeautiful/comments/yv0qot/oc_i_tracked_how_stressed_i_felt_over_a_4week/,0,0,,2,OC I tracked how stressed I felt over a 4-week finals period,2022-11-0184.png
[OC] Plant-Based Meat Now Costs Less Than Animal Meat In The Netherlands,eqqqxy,2022-11-14 14:46:49,https://i.redd.it/x67yewrrixz91.png,https://www.reddit.com/r/dataisbeautiful/comments/yv1ikb/oc_plantbased_meat_now_costs_less_than_animal/,3853,3853,,437,OC Plant-Based Meat Now Costs Less Than Animal Meat In The Netherlands,2022-11-0185.png
"[OC] Globally, higher fertility rates are linked to higher infant mortality rates.",SnooPoems2010,2022-11-14 15:29:16,https://i.redd.it/arn8njdfqxz91.png,https://www.reddit.com/r/dataisbeautiful/comments/yv2qf0/oc_globally_higher_fertility_rates_are_linked_to/,26,26,,15,"OC Globally, higher fertility rates are linked to higher infant mortality rates.",2022-11-0186.png
[OC] Share of foreign born STEM workers in US is increasing,jtsg_,2022-11-14 15:35:37,https://i.redd.it/4l8npkehrxz91.png,https://www.reddit.com/r/dataisbeautiful/comments/yv2x9k/oc_share_of_foreign_born_stem_workers_in_us_is/,94,94,,45,OC Share of foreign born STEM workers in US is increasing,2022-11-0187.png
My Personal Golden Age of SciFi Television [OC],whitestar11,2022-11-14 16:14:21,https://imgur.com/a/AQykFUe,https://www.reddit.com/r/dataisbeautiful/comments/yv422i/my_personal_golden_age_of_scifi_television_oc/,0,0,,4,My Personal Golden Age of SciFi Television OC,2022-11-0188.jpg
US 60/40 Portfolio Return v. Personal Income [OC],rosetechnology,2022-11-14 16:40:57,https://i.redd.it/neqkqniskzz91.png,https://www.reddit.com/r/dataisbeautiful/comments/yv4vm6/us_6040_portfolio_return_v_personal_income_oc/,9,9,,5,US 6040 Portfolio Return v. Personal Income OC,2022-11-0189.png
"Interactive map of world's largest emitters, measured in equivalent CO2 emissions (by Climate TRACE)",gitisgroot,2022-11-14 19:02:08,https://climatetrace.org/map,https://www.reddit.com/r/dataisbeautiful/comments/yv93gy/interactive_map_of_worlds_largest_emitters/,8,8,,0,"Interactive map of world's largest emitters, measured in equivalent CO2 emissions (by Climate TRACE)",2022-11-0190.jpg
[OC] My 2022 diary visualized in 3 charts,HoldMyDirrk,2022-11-14 19:03:17,https://i.redd.it/knssle9lsyz91.png,https://www.reddit.com/r/dataisbeautiful/comments/yv94nj/oc_my_2022_diary_visualized_in_3_charts/,70,70,,50,OC My 2022 diary visualized in 3 charts,2022-11-0191.png
Comparing U.S. COVID deaths by county and 2020 presidential voting preference,r4816,2022-11-14 19:41:31,https://www.pewresearch.org/politics/2022/03/03/the-changing-political-geography-of-covid-19-over-the-last-two-years/,https://www.reddit.com/r/dataisbeautiful/comments/yva8gu/comparing_us_covid_deaths_by_county_and_2020/,7,7,,5,Comparing U.S. COVID deaths by county and 2020 presidential voting preference,2022-11-0192.jpg
"My job search history comparison. Left: Graduate during pandemic, Sept 2020. Right: Young professional recently [OC]",doplo123,2022-11-14 19:58:34,https://i.redd.it/7epcyjqi2zz91.jpg,https://www.reddit.com/r/dataisbeautiful/comments/yvaq9w/my_job_search_history_comparison_left_graduate/,1,1,,8,"My job search history comparison. Left Graduate during pandemic, Sept 2020. Right Young professional recently OC",2022-11-0193.jpg
[OC] College Basketball BPI Rankings for all 363 teams. Check out the strong correlation between offense and defense. Link to interactive version in comment.,Bischrob,2022-11-14 22:51:45,https://i.redd.it/uqs4uxt3xzz91.png,https://www.reddit.com/r/dataisbeautiful/comments/yvfbiq/oc_college_basketball_bpi_rankings_for_all_363/,0,0,,7,OC College Basketball BPI Rankings for all 363 teams. Check out the strong correlation between offense and defense. Link to interactive version in com,2022-11-0194.png
Travel and tourism: share of global GDP 2021,chmendez,2022-11-15 00:28:17,https://www.statista.com/statistics/1099933/travel-and-tourism-share-of-gdp/,https://www.reddit.com/r/dataisbeautiful/comments/yvhlnl/travel_and_tourism_share_of_global_gdp_2021/,0,0,,2,Travel and tourism share of global GDP 2021,2022-11-0195.jpg
World population has just hit the 8 billion mark!,dolfieman,2022-11-15 08:02:31,https://www.worldometers.info/world-population/,https://www.reddit.com/r/dataisbeautiful/comments/yvqkzl/world_population_has_just_hit_the_8_billion_mark/,0,0,,5,World population has just hit the 8 billion mark!,2022-11-0196.jpg
[OC] Monthly Active Users per social media platform,hcrx,2022-11-15 09:01:51,https://i.redd.it/7illdog7y20a1.png,https://www.reddit.com/r/dataisbeautiful/comments/yvrix0/oc_monthly_active_users_per_social_media_platform/,92,92,,35,OC Monthly Active Users per social media platform,2022-11-0197.png
The tech sector in Silicon Valley is rebooting the system [OC],Chris_Schmitz,2022-11-15 11:20:24,https://i.redd.it/zfdjjqxqm30a1.png,https://www.reddit.com/r/dataisbeautiful/comments/yvuarc/the_tech_sector_in_silicon_valley_is_rebooting/,7,7,,10,The tech sector in Silicon Valley is rebooting the system OC,2022-11-0198.png
[OC] Best-selling video games of all time,giteam,2022-11-15 12:22:34,https://i.redd.it/wnmr89x1y30a1.png,https://www.reddit.com/r/dataisbeautiful/comments/yvvmp3/oc_bestselling_video_games_of_all_time/,3229,3229,,338,OC Best-selling video games of all time,2022-11-0199.png
[OC] Is Netflix's catalogue quantity over quality or vice versa?,biantongfrom,2022-11-15 13:26:26,https://i.redd.it/026rnuf8940a1.jpg,https://www.reddit.com/r/dataisbeautiful/comments/yvx6nd/oc_is_netflixs_catalogue_quantity_over_quality_or/,19,19,,12,OC Is Netflix's catalogue quantity over quality or vice versa,2022-11-0200.jpg
K-12 Shootings in the US (Location-Based Trends) [OC],Crash_Recovery,2022-11-15 14:11:05,https://i.redd.it/ldtii4ddh40a1.png,https://www.reddit.com/r/dataisbeautiful/comments/yvyc9i/k12_shootings_in_the_us_locationbased_trends_oc/,27,27,,35,K-12 Shootings in the US (Location-Based Trends) OC,2022-11-0201.png
National per capita CO2 emissions in 2021 [OC],woodest,2022-11-15 14:40:21,https://i.redd.it/8a76dof0m40a1.png,https://www.reddit.com/r/dataisbeautiful/comments/yvz4ni/national_per_capita_co2_emissions_in_2021_oc/,8377,8377,,755,National per capita CO2 emissions in 2021 OC,2022-11-0202.png
[OC] Evolution of a newborn sleep and feeding routine during the first weeks.,M4-Lema,2022-11-15 14:49:33,https://i.redd.it/mrqg204zn40a1.png,https://www.reddit.com/r/dataisbeautiful/comments/yvzcyc/oc_evolution_of_a_newborn_sleep_and_feeding/,36,36,,17,OC Evolution of a newborn sleep and feeding routine during the first weeks.,2022-11-0203.png
"The firebrand rose: Shorthand representation of data captured from an emberometer, an instrument that characterizes the size and trajectory of wildfire embers. [OC]",nist,2022-11-15 17:13:59,https://i.redd.it/99cxh0i5d50a1.png,https://www.reddit.com/r/dataisbeautiful/comments/yw3fnn/the_firebrand_rose_shorthand_representation_of/,268,268,,8,"The firebrand rose Shorthand representation of data captured from an emberometer, an instrument that characterizes the size and trajectory of wildfire",2022-11-0204.png
"Breakdown of my week long honeymoon to Orlando, FL [OC]",greenzeppelin,2022-11-15 17:41:10,https://i.redd.it/1gjzs2jli50a1.png,https://www.reddit.com/r/dataisbeautiful/comments/yw4862/breakdown_of_my_week_long_honeymoon_to_orlando_fl/,4,4,,51,"Breakdown of my week long honeymoon to Orlando, FL OC",2022-11-0205.png
Correlation between police training and fatal police shootings [OC],snacksy13,2022-11-15 18:44:27,https://i.redd.it/09f3iac7u50a1.png,https://www.reddit.com/r/dataisbeautiful/comments/yw5xb8/correlation_between_police_training_and_fatal/,13164,13164,,754,Correlation between police training and fatal police shootings OC,2022-11-0206.png
[OC] Daily Satellite Imagery is used to track exactly when buildings are destroyed in Mariupol.,docfilmworkshop,2022-11-15 20:37:53,https://v.redd.it/kubtbi5be60a1,https://www.reddit.com/r/dataisbeautiful/comments/yw8tw5/oc_daily_satellite_imagery_is_used_to_track/,526,526,,12,OC Daily Satellite Imagery is used to track exactly when buildings are destroyed in Mariupol.,2022-11-0207.png
[OC] Earth's population reaches 8 billion,PietroViolo,2022-11-15 21:44:37,https://i.redd.it/c946g808q60a1.jpg,https://www.reddit.com/r/dataisbeautiful/comments/ywaj8s/oc_earths_population_reaches_8_billion/,16142,16142,,1006,OC Earth's population reaches 8 billion,2022-11-0208.jpg
The World’s Population at 8 Billion,shamansufi,2022-11-15 21:47:06,https://www.visualcapitalist.com/visualized-the-worlds-population-at-8-billion/?fbclid=IwAR2EIl4qXMKWgzNctyex-T4u-AkG3L4K2_p1jru6gOZsOn6rsnFrPg8ePqE,https://www.reddit.com/r/dataisbeautiful/comments/ywalh5/the_worlds_population_at_8_billion/,0,0,,0,The World’s Population at 8 Billion,2022-11-0209.jpg
"Voter turnout in Brazil, by age group - 2022 Presidential elections, 2nd round (30 October 2022 ) [OC]",PandaReturns,2022-11-16 01:06:01,https://i.redd.it/nzpr5sk9q70a1.png,https://www.reddit.com/r/dataisbeautiful/comments/ywfaej/voter_turnout_in_brazil_by_age_group_2022/,119,119,,33,"Voter turnout in Brazil, by age group - 2022 Presidential elections, 2nd round (30 October 2022 ) OC",2022-11-0210.png
"[OC] Interactive comparison of democracy index, population and gdp per capita",skipjack-,2022-11-16 02:38:14,https://i.redd.it/tdc2oh16z70a1.png,https://www.reddit.com/r/dataisbeautiful/comments/ywhbhr/oc_interactive_comparison_of_democracy_index/,2,2,,10,"OC Interactive comparison of democracy index, population and gdp per capita",2022-11-0211.png
[OC] Data sonification (audio+ chart) mapping Mark Zuckerberg's net worth to a Sad Trombone noise,capybara75,2022-11-16 03:15:39,https://v.redd.it/ahe0i8ebd80a1,https://www.reddit.com/r/dataisbeautiful/comments/ywi55g/oc_data_sonification_audio_chart_mapping_mark/,916,916,,63,OC Data sonification (audio+ chart) mapping Mark Zuckerberg's net worth to a Sad Trombone noise,2022-11-0212.png
The Top 10 EV Battery Manufacturers in 2022,jeffsmith202,2022-11-16 03:32:20,https://www.visualcapitalist.com/the-top-10-ev-battery-manufacturers-in-2022/,https://www.reddit.com/r/dataisbeautiful/comments/ywiial/the_top_10_ev_battery_manufacturers_in_2022/,5,5,,1,The Top 10 EV Battery Manufacturers in 2022,2022-11-0213.jpg
"US States, Police Training v Shootings/Violent Crime (per million) [OC]",tommytornado,2022-11-16 09:23:41,https://i.redd.it/laevfzu17a0a1.jpg,https://www.reddit.com/r/dataisbeautiful/comments/ywowl8/us_states_police_training_v_shootingsviolent/,164,164,,145,"US States, Police Training v ShootingsViolent Crime (per million) OC",2022-11-0214.jpg
Who works from home in 2022? Rates by industry [OC],DavidWaldron,2022-11-16 11:19:04,https://i.redd.it/e1rtnu5ira0a1.png,https://www.reddit.com/r/dataisbeautiful/comments/ywqs2b/who_works_from_home_in_2022_rates_by_industry_oc/,25,25,,8,Who works from home in 2022 Rates by industry OC,2022-11-0215.png
2022 World Cup Rosters and Player Club Locations [OC],BoMcCready,2022-11-16 14:39:15,https://i.redd.it/pozigjkarb0a1.png,https://www.reddit.com/r/dataisbeautiful/comments/ywv6u2/2022_world_cup_rosters_and_player_club_locations/,180,180,,52,2022 World Cup Rosters and Player Club Locations OC,2022-11-0216.png
Oat Milk Still Wants To Dethrone The King Of Alt Milks: Almond [OC],chartr,2022-11-16 15:53:27,https://i.redd.it/sz4yz3yh4c0a1.jpg,https://www.reddit.com/r/dataisbeautiful/comments/ywx5lg/oat_milk_still_wants_to_dethrone_the_king_of_alt/,7790,7790,,1768,Oat Milk Still Wants To Dethrone The King Of Alt Milks Almond OC,2022-11-0217.jpg
Rising carbon dioxide concentration and global temperature after 27 UN climate summits.,Udab,2022-11-16 16:27:55,https://twitter.com/ClimateHuman/status/1592028682633478144,https://www.reddit.com/r/dataisbeautiful/comments/ywy6wa/rising_carbon_dioxide_concentration_and_global/,33,33,,27,Rising carbon dioxide concentration and global temperature after 27 UN climate summits.,2022-11-0218.jpg
