title,author,created_date,url,full_permalink,score,ups,downs,num_comments,sanitized_title,image_file
The best [world health] stats you've ever seen? Surely Hans Rosling is this sub's Grandad. 20 min watch,rutlandclimber,2022-11-06 08:40:39,https://www.ted.com/talks/hans_rosling_the_best_stats_you_ve_ever_seen?language=en,https://www.reddit.com/r/dataisbeautiful/comments/ynku8f/the_best_world_health_stats_youve_ever_seen/,243,243,,26,The best world health stats you've ever seen Surely Hans Rosling is this sub's Grandad. 20 min watch,2022-11-0074.jpg
[OC] How many VFX jobs do blockbuster films create?,earthlymonarch,2022-11-06 10:13:47,https://i.redd.it/rd3lcpqv2by91.png,https://www.reddit.com/r/dataisbeautiful/comments/ynmarf/oc_how_many_vfx_jobs_do_blockbuster_films_create/,124,124,,13,OC How many VFX jobs do blockbuster films create,2022-11-0075.png
[OC] Breaking down revenue and profit sources for Goldman Sachs - the largest investment bank in the world,giteam,2022-11-06 11:02:31,https://i.redd.it/3vshi6okbby91.png,https://www.reddit.com/r/dataisbeautiful/comments/ynn3gi/oc_breaking_down_revenue_and_profit_sources_for/,9567,9567,,836,OC Breaking down revenue and profit sources for Goldman Sachs - the largest investment bank in the world,2022-11-0076.png
Mayors of turkey's provinces by generation between 1989-2019 [OC],angryredfrog,2022-11-06 13:07:35,https://v.redd.it/od74s57uxby91,https://www.reddit.com/r/dataisbeautiful/comments/ynpha2/mayors_of_turkeys_provinces_by_generation_between/,127,127,,6,Mayors of turkey's provinces by generation between 1989-2019 OC,2022-11-0077.png
[OC] Election Results in the Weimar Republic / Germany (1919 to 1938),Dk1902,2022-11-06 13:08:08,https://i.redd.it/ik0f904wxby91.png,https://www.reddit.com/r/dataisbeautiful/comments/ynphp8/oc_election_results_in_the_weimar_republic/,5055,5055,,580,OC Election Results in the Weimar Republic Germany (1919 to 1938),2022-11-0078.png
The most popular events as they were presented by the largest news agencies from October 30 to November 5 [OC],mrdimosthenis,2022-11-06 13:14:25,https://v.redd.it/2xb0jpm3zby91,https://www.reddit.com/r/dataisbeautiful/comments/ynpmir/the_most_popular_events_as_they_were_presented_by/,135,135,,27,The most popular events as they were presented by the largest news agencies from October 30 to November 5 OC,2022-11-0079.png
[OC] How much has MrBeast spent on his YouTube videos? According to his video titles.,PieChartPirate,2022-11-06 13:37:10,https://v.redd.it/t5wkxhe33cy91,https://www.reddit.com/r/dataisbeautiful/comments/ynq4fh/oc_how_much_has_mrbeast_spent_on_his_youtube/,11092,11092,,1039,OC How much has MrBeast spent on his YouTube videos According to his video titles.,2022-11-0080.png
Food inflation in the United Kingdom over the 12 months,Ok-Street8152,2022-11-06 15:08:26,https://www.walesonline.co.uk/news/cost-of-living/price-budget-supermarket-food-rising-25443984,https://www.reddit.com/r/dataisbeautiful/comments/ynsf09/food_inflation_in_the_united_kingdom_over_the_12/,10,10,,5,Food inflation in the United Kingdom over the 12 months,2022-11-0081.jpg
"[OC] An Ironman Triathlon, by the minute",ptgorman,2022-11-06 16:00:41,https://i.redd.it/lsfwmksmscy91.png,https://www.reddit.com/r/dataisbeautiful/comments/yntz7i/oc_an_ironman_triathlon_by_the_minute/,1140,1140,,65,"OC An Ironman Triathlon, by the minute",2022-11-0082.png
[OC] The 2022 MLB Postseason Tree. Arrows go from winner to loser. Teams that lost to the same team are arranged left to right in the order it happened.,TravisJungroth,2022-11-06 17:12:12,https://i.redd.it/8p1oyiug5dy91.png,https://www.reddit.com/r/dataisbeautiful/comments/ynw4td/oc_the_2022_mlb_postseason_tree_arrows_go_from/,0,0,,16,OC The 2022 MLB Postseason Tree. Arrows go from winner to loser. Teams that lost to the same team are arranged left to right in the order it happened.,2022-11-0083.png
Live Map of Air Quality - UNEP,233C,2022-11-06 20:37:29,https://www.iqair.com/unep,https://www.reddit.com/r/dataisbeautiful/comments/yo1y44/live_map_of_air_quality_unep/,3,3,,2,Live Map of Air Quality - UNEP,2022-11-0084.jpg
Over the road truck driving since 2016 via the Fog Of World app. [OC],snakalope,2022-11-07 01:41:40,https://i.redd.it/32o88puy5hy91.jpg,https://www.reddit.com/r/dataisbeautiful/comments/yo97x9/over_the_road_truck_driving_since_2016_via_the/,5977,5977,,243,Over the road truck driving since 2016 via the Fog Of World app. OC,2022-11-0085.jpg
Population density in Quebec City [OC],realguyfromthenorth,2022-11-07 02:19:16,https://i.redd.it/ebuqi2e5vfy91.jpg,https://www.reddit.com/r/dataisbeautiful/comments/yoa14r/population_density_in_quebec_city_oc/,33,33,,3,Population density in Quebec City OC,2022-11-0086.jpg
[OC] Median Housing Monthly Payment Affordability (1971-2022 - CPI adjusted),Dont____Panic,2022-11-07 04:10:57,https://i.redd.it/yj4nqwmxegy91.jpg,https://www.reddit.com/r/dataisbeautiful/comments/yocaon/oc_median_housing_monthly_payment_affordability/,29,29,,12,OC Median Housing Monthly Payment Affordability (1971-2022 - CPI adjusted),2022-11-0087.jpg
[OC] Nuclear stockpile in Russia and NATO (1948-2022),eqqqxy,2022-11-07 04:12:58,https://i.redd.it/yxc1vdcffgy91.png,https://www.reddit.com/r/dataisbeautiful/comments/yocc2a/oc_nuclear_stockpile_in_russia_and_nato_19482022/,104,104,,28,OC Nuclear stockpile in Russia and NATO (1948-2022),2022-11-0088.png
"[OC] The eurodollar futures curve, which is pointing to a US recession next year",jcceagle,2022-11-07 09:31:18,https://v.redd.it/gqkkpoowzhy91,https://www.reddit.com/r/dataisbeautiful/comments/yoht4k/oc_the_eurodollar_futures_curve_which_is_pointing/,985,985,,107,"OC The eurodollar futures curve, which is pointing to a US recession next year",2022-11-0089.png
Location Data : US Zip Codes : [OC] Source: USPS Tool: Tabreau,tonyk999,2022-11-07 09:59:00,https://i.redd.it/1plf85c15iy91.png,https://www.reddit.com/r/dataisbeautiful/comments/yoi8v2/location_data_us_zip_codes_oc_source_usps_tool/,0,0,,10,Location Data US Zip Codes OC Source USPS Tool Tabreau,2022-11-0090.png
India's Top export destination per continent [OC],ixaditya,2022-11-07 12:13:09,https://i.redd.it/6kz9j1izsiy91.jpg,https://www.reddit.com/r/dataisbeautiful/comments/yol0en/indias_top_export_destination_per_continent_oc/,288,288,,59,India's Top export destination per continent OC,2022-11-0091.jpg
Message frequency by daytime for some of my chats [OC],joweich,2022-11-07 15:30:51,https://i.redd.it/zat7ghedsjy91.jpg,https://www.reddit.com/r/dataisbeautiful/comments/yoqe5l/message_frequency_by_daytime_for_some_of_my_chats/,30880,30880,,508,Message frequency by daytime for some of my chats OC,2022-11-0092.jpg
[OC] Top investments by Berkshire Hathaway as of 3Q 2022,giteam,2022-11-07 16:06:33,https://i.redd.it/ti9q14iqyjy91.png,https://www.reddit.com/r/dataisbeautiful/comments/yorgan/oc_top_investments_by_berkshire_hathaway_as_of_3q/,142,142,,28,OC Top investments by Berkshire Hathaway as of 3Q 2022,2022-11-0093.png
Visualizing Rivers and Floodplains with USGS Data - Using USGS elevation data to visualize stunning views of the flow of water through rivers and floodplains (with QGIS and RiverREM Python library). [OC],jonkeegan,2022-11-07 16:47:37,https://www.beautifulpublicdata.com/visualizing-rivers-and-floodplains/,https://www.reddit.com/r/dataisbeautiful/comments/yospct/visualizing_rivers_and_floodplains_with_usgs_data/,15,15,,0,Visualizing Rivers and Floodplains with USGS Data - Using USGS elevation data to visualize stunning views of the flow of water through rivers and floo,2022-11-0094.jpg
What Is the Most Snow Each State Has Gotten in One Day?,CaptainFoyle,2022-11-07 17:11:25,https://www.titlemax.com/discovery-center/the-ultimate-road-trip/what-is-the-most-snow-each-state-has-gotten-in-one-day/,https://www.reddit.com/r/dataisbeautiful/comments/yotfnc/what_is_the_most_snow_each_state_has_gotten_in/,0,0,,8,What Is the Most Snow Each State Has Gotten in One Day,2022-11-0095.jpg
5 months of applying for a midlevel UX Designer role [OC],travesto,2022-11-07 20:23:06,https://i.redd.it/0y4dii3f8ly91.png,https://www.reddit.com/r/dataisbeautiful/comments/yoz4u3/5_months_of_applying_for_a_midlevel_ux_designer/,12,12,,3,5 months of applying for a midlevel UX Designer role OC,2022-11-0096.png
"World Values Survey. Share of people who agree that Imagination is one of the most important qualities that children should be encouraged to learn at home, % [OC]",Populationdemography,2022-11-07 21:51:05,https://i.redd.it/92uyhecxnly91.png,https://www.reddit.com/r/dataisbeautiful/comments/yp1oqj/world_values_survey_share_of_people_who_agree/,72,72,,25,World Values Survey. Share of people who agree that Imagination is one of the most important qualities that children should be encouraged to learn at,2022-11-0097.png
My Summer 2023 Internship Search Results [OC],Rogggiii,2022-11-07 22:42:32,https://i.redd.it/p01s27saxly91.png,https://www.reddit.com/r/dataisbeautiful/comments/yp38h8/my_summer_2023_internship_search_results_oc/,63,63,,7,My Summer 2023 Internship Search Results OC,2022-11-0098.png
"[OC] First and last frost dates for Concord, NH for 80 years. The growing season is getting longer. Repost because the image got deleted somehow.",reficius1,2022-11-07 23:37:38,https://i.imgur.com/SYibYes.jpg,https://www.reddit.com/r/dataisbeautiful/comments/yp4sra/oc_first_and_last_frost_dates_for_concord_nh_for/,339,339,,38,"OC First and last frost dates for Concord, NH for 80 years. The growing season is getting longer. Repost because the image got deleted somehow.",2022-11-0099.png
Top 100 Most Valuable Brands as Illustrated by Visual Capitalist,ziogio998,2022-11-08 02:36:32,https://www.visualcapitalist.com/top-100-most-valuable-brands-in-2022/,https://www.reddit.com/r/dataisbeautiful/comments/yp8sg8/top_100_most_valuable_brands_as_illustrated_by/,11,11,,8,Top 100 Most Valuable Brands as Illustrated by Visual Capitalist,2022-11-0100.jpg
[OC] What shows does Netflix think makes them the most money? Are they right? Taking a look at Netflix's addition of differently-rated shows across the years.,biantongfrom,2022-11-08 08:39:51,https://i.redd.it/cbwfswz6soy91.jpg,https://www.reddit.com/r/dataisbeautiful/comments/ypfuc6/oc_what_shows_does_netflix_think_makes_them_the/,0,0,,6,OC What shows does Netflix think makes them the most money Are they right Taking a look at Netflix's addition of differently-rated shows across the ye,2022-11-0101.jpg
[OC] Highway speed limits by country (2022),EvilSpySnail,2022-11-08 09:01:59,https://i.redd.it/3crg0ftnzoy91.png,https://www.reddit.com/r/dataisbeautiful/comments/ypgasf/oc_highway_speed_limits_by_country_2022/,13,13,,26,OC Highway speed limits by country (2022),2022-11-0102.png
[OC] Hong Kong has the highest proportion of female prisoners,Equal-Crew-3367,2022-11-08 10:10:35,https://i.redd.it/5ga9k6n4cpy91.png,https://www.reddit.com/r/dataisbeautiful/comments/yphout/oc_hong_kong_has_the_highest_proportion_of_female/,15004,15004,,661,OC Hong Kong has the highest proportion of female prisoners,2022-11-0103.png
"[OC] A Comparison of Energy Sources according to Pollution, Death Rate, Price and Land Use",Alyx1337,2022-11-08 10:10:37,https://i.redd.it/vlnbmibrbpy91.png,https://www.reddit.com/r/dataisbeautiful/comments/yphovx/oc_a_comparison_of_energy_sources_according_to/,1735,1735,,285,"OC A Comparison of Energy Sources according to Pollution, Death Rate, Price and Land Use",2022-11-0104.png
"[OC] What if you had invested $100 in META, AMZN, AAPL, NFLX and GOOG 5 years ago? 🤔",Oktay_LS,2022-11-08 10:21:54,https://v.redd.it/c5uwf5exdpy91,https://www.reddit.com/r/dataisbeautiful/comments/yphx9s/oc_what_if_you_had_invested_100_in_meta_amzn_aapl/,2544,2544,,151,"OC What if you had invested $100 in META, AMZN, AAPL, NFLX and GOOG 5 years ago 🤔",2022-11-0105.png
[OC] Which countries suffer the most food wastage?,earthlymonarch,2022-11-08 11:53:47,https://i.redd.it/gwmdiaqiupy91.png,https://www.reddit.com/r/dataisbeautiful/comments/ypjw8a/oc_which_countries_suffer_the_most_food_wastage/,154,154,,30,OC Which countries suffer the most food wastage,2022-11-0106.png
When can we expect to know Election Day results? State by state reporting from 2020 (scroll to see) [NYT],Disgruntledballoon,2022-11-08 13:11:20,https://www.nytimes.com/interactive/2022/11/07/us/elections/election-results-time.html,https://www.reddit.com/r/dataisbeautiful/comments/ypls9a/when_can_we_expect_to_know_election_day_results/,13,13,,4,When can we expect to know Election Day results State by state reporting from 2020 (scroll to see) NYT,2022-11-0107.jpg
"Number of new users on Mastodon, by day",EnglishMobster,2022-11-08 13:46:37,https://files.mastodon.social/media_attachments/files/109/308/445/123/501/831/original/a96a5b3b26748dfd.png,https://www.reddit.com/r/dataisbeautiful/comments/ypmpa5/number_of_new_users_on_mastodon_by_day/,7,7,,2,"Number of new users on Mastodon, by day",2022-11-0108.png
[OC] Historical Highest Marginal Income Tax Rates For The Top Earners In America,OfficialTutti,2022-11-08 14:55:46,https://i.redd.it/m2noaupkqqy91.png,https://www.reddit.com/r/dataisbeautiful/comments/ypol8c/oc_historical_highest_marginal_income_tax_rates/,837,837,,194,OC Historical Highest Marginal Income Tax Rates For The Top Earners In America,2022-11-0109.png
[OC] Alcohol Consumption in the United States 2022,eqqqxy,2022-11-08 16:11:56,https://i.redd.it/pmis3h0m4ry91.png,https://www.reddit.com/r/dataisbeautiful/comments/ypqr3u/oc_alcohol_consumption_in_the_united_states_2022/,98,98,,57,OC Alcohol Consumption in the United States 2022,2022-11-0110.png
The Road to Recovery: Which Economies are Reopening?,one_true_manager,2022-11-08 16:13:38,https://www.visualcapitalist.com/the-road-to-recovery-which-economies-are-reopening-covid-19/,https://www.reddit.com/r/dataisbeautiful/comments/ypqsrk/the_road_to_recovery_which_economies_are_reopening/,0,0,,3,The Road to Recovery Which Economies are Reopening,2022-11-0111.jpg
[OC] 3D Render of a 2000 Geologic Map of Utah Created in Blender,BigBallerBenzie,2022-11-08 18:50:05,https://i.redd.it/b5w4do1qwry91.jpg,https://www.reddit.com/r/dataisbeautiful/comments/ypuyzm/oc_3d_render_of_a_2000_geologic_map_of_utah/,442,442,,20,OC 3D Render of a 2000 Geologic Map of Utah Created in Blender,2022-11-0112.jpg
[OC] World's top economies threatened by increasing ratio of elderly dependents,jtsg_,2022-11-08 21:00:00,https://i.redd.it/j2onkeuyjsy91.png,https://www.reddit.com/r/dataisbeautiful/comments/ypyc4j/oc_worlds_top_economies_threatened_by_increasing/,3617,3617,,654,OC World's top economies threatened by increasing ratio of elderly dependents,2022-11-0113.png
Revised outlet assortment in my 1975 home. [OC],ImmortalRedhead,2022-11-08 22:18:17,https://i.redd.it/4dmdaykwxsy91.jpg,https://www.reddit.com/r/dataisbeautiful/comments/yq0dpa/revised_outlet_assortment_in_my_1975_home_oc/,51,51,,9,Revised outlet assortment in my 1975 home. OC,2022-11-0114.jpg
"[OC] New York City map identifying what tract, in NYC, incarcerated New Yorkers come from",LukaCola,2022-11-08 22:23:35,https://i.redd.it/1s604kc7ysy91.png,https://www.reddit.com/r/dataisbeautiful/comments/yq0ik8/oc_new_york_city_map_identifying_what_tract_in/,507,507,,69,"OC New York City map identifying what tract, in NYC, incarcerated New Yorkers come from",2022-11-0115.png
More people are employed in clean energy than in fossil fuels,kickresume,2022-11-08 22:28:36,https://blog.kickresume.com/infographics/employment-in-clean-energy-sector/,https://www.reddit.com/r/dataisbeautiful/comments/yq0n0i/more_people_are_employed_in_clean_energy_than_in/,1894,1894,,99,More people are employed in clean energy than in fossil fuels,2022-11-0116.jpg
A shaded relief map of Europe rendered from 3d data and satellite imagery [OC],visualgeomatics,2022-11-09 07:08:03,https://i.redd.it/921khpiakvy91.jpg,https://www.reddit.com/r/dataisbeautiful/comments/yqbfui/a_shaded_relief_map_of_europe_rendered_from_3d/,20087,20087,,360,A shaded relief map of Europe rendered from 3d data and satellite imagery OC,2022-11-0117.jpg
"[OC] Twitter is now a private company, visualizing its final public quarterly results (June 2022 quarter)",giteam,2022-11-09 10:51:56,https://i.redd.it/n4lmtb1fowy91.png,https://www.reddit.com/r/dataisbeautiful/comments/yqfefj/oc_twitter_is_now_a_private_company_visualizing/,36,36,,19,"OC Twitter is now a private company, visualizing its final public quarterly results (June 2022 quarter)",2022-11-0118.png
[OC] Number of companies in Apple supply chain per country. Source is Apple's own published supply chain document. Note the absence of the DRC.,Free_Albatross3928,2022-11-09 11:02:22,https://i.redd.it/s39sz2st7yy91.jpg,https://www.reddit.com/r/dataisbeautiful/comments/yqfn3m/oc_number_of_companies_in_apple_supply_chain_per/,27,27,,31,OC Number of companies in Apple supply chain per country. Source is Apple's own published supply chain document. Note the absence of the DRC.,2022-11-0119.jpg
[OC] Apple's Revenue Streams by Product Type,waynehihihi,2022-11-09 12:31:29,https://i.redd.it/uvh85yi46xy91.png,https://www.reddit.com/r/dataisbeautiful/comments/yqhodf/oc_apples_revenue_streams_by_product_type/,94,94,,25,OC Apple's Revenue Streams by Product Type,2022-11-0120.png
"[OC] Electricity gCO2/kWh vs Share of renewables in electricity (%) (1990-2020), in Europe",233C,2022-11-09 14:34:32,https://i.redd.it/oek463pzrxy91.png,https://www.reddit.com/r/dataisbeautiful/comments/yqko1t/oc_electricity_gco2kwh_vs_share_of_renewables_in/,6,6,,20,"OC Electricity gCO2kWh vs Share of renewables in electricity (%) (1990-2020), in Europe",2022-11-0121.png
Top Artists on Spotify by Number of Streams [OC],rosetechnology,2022-11-09 15:27:32,https://i.redd.it/o8jhvc9j1yy91.png,https://www.reddit.com/r/dataisbeautiful/comments/yqm2me/top_artists_on_spotify_by_number_of_streams_oc/,67,67,,21,Top Artists on Spotify by Number of Streams OC,2022-11-0122.png
[OC] Fertility rate in the US boomed for the first time in 15 years in 2021. LatAm-born mothers drove the highest increase.,latinometrics,2022-11-09 16:18:00,https://i.redd.it/lvjins8iayy91.png,https://www.reddit.com/r/dataisbeautiful/comments/yqni7m/oc_fertility_rate_in_the_us_boomed_for_the_first/,43,43,,17,OC Fertility rate in the US boomed for the first time in 15 years in 2021. LatAm-born mothers drove the highest increase.,2022-11-0123.png
"Flu Season Is Back, With Infections In The US Spiking Earlier Than Usual [OC]",chartr,2022-11-09 16:52:37,https://i.redd.it/y7vk32qogyy91.jpg,https://www.reddit.com/r/dataisbeautiful/comments/yqogdm/flu_season_is_back_with_infections_in_the_us/,576,576,,78,"Flu Season Is Back, With Infections In The US Spiking Earlier Than Usual OC",2022-11-0124.jpg
"Frequency of billion-dollar natural disasters in the US (2021 dollars), 1980 – 2022 [OC]",USAFacts_Official,2022-11-09 18:42:58,https://i.redd.it/cb7qmcywzyy91.png,https://www.reddit.com/r/dataisbeautiful/comments/yqrl9q/frequency_of_billiondollar_natural_disasters_in/,143,143,,56,"Frequency of billion-dollar natural disasters in the US (2021 dollars), 1980 – 2022 OC",2022-11-0125.png
Jedi Knight Population Of The UK,BodybuilderStrong993,2022-11-09 19:53:16,https://brilliantmaps.com/jedi-knight-uk/,https://www.reddit.com/r/dataisbeautiful/comments/yqtlf1/jedi_knight_population_of_the_uk/,8,8,,8,Jedi Knight Population Of The UK,2022-11-0126.jpg
"[OC] Tech Layoffs in 2022 so far, percentage of total workforce",PieChartPirate,2022-11-09 20:33:13,https://i.redd.it/ofcbe573kzy91.png,https://www.reddit.com/r/dataisbeautiful/comments/yququ5/oc_tech_layoffs_in_2022_so_far_percentage_of/,1884,1884,,154,"OC Tech Layoffs in 2022 so far, percentage of total workforce",2022-11-0127.png
"[OC] Which countries have Americans heard of, and which do they like?",desfirsit,2022-11-09 21:31:57,https://i.redd.it/qn3gsib0uzy91.png,https://www.reddit.com/r/dataisbeautiful/comments/yqw7dh/oc_which_countries_have_americans_heard_of_and/,14558,14558,,1737,"OC Which countries have Americans heard of, and which do they like",2022-11-0128.png
"[OC] Meta lays off 11k people, after growing headcount by 15k in 2022",jtsg_,2022-11-09 21:40:33,https://i.redd.it/c94hnp9kvzy91.png,https://www.reddit.com/r/dataisbeautiful/comments/yqweue/oc_meta_lays_off_11k_people_after_growing/,5059,5059,,300,"OC Meta lays off 11k people, after growing headcount by 15k in 2022",2022-11-0129.png
The climate crisis explained in 10 charts,HenryCorp,2022-11-10 01:30:34,https://www.theguardian.com/environment/2022/nov/04/the-climate-crisis-explained-in-10-charts,https://www.reddit.com/r/dataisbeautiful/comments/yr1oor/the_climate_crisis_explained_in_10_charts/,24,24,,13,The climate crisis explained in 10 charts,2022-11-0130.jpg
Dragon is beautiful [OC],vermithrax,2022-11-10 02:58:19,https://i.redd.it/d8p0eelqg1z91.png,https://www.reddit.com/r/dataisbeautiful/comments/yr3hbm/dragon_is_beautiful_oc/,39,39,,15,Dragon is beautiful OC,2022-11-0131.png
[OC] CVS is the largest pharmacy retailer in US - breaking down how it makes money,giteam,2022-11-10 09:06:35,https://i.redd.it/qyvhzdkja3z91.png,https://www.reddit.com/r/dataisbeautiful/comments/yr9sij/oc_cvs_is_the_largest_pharmacy_retailer_in_us/,28,28,,6,OC CVS is the largest pharmacy retailer in US - breaking down how it makes money,2022-11-0132.png
[OC] Which policies do Americans think would be effective at decreasing inflation?,YouGov_Official,2022-11-10 10:16:57,https://i.redd.it/8wqjcsm1n3z91.png,https://www.reddit.com/r/dataisbeautiful/comments/yravgu/oc_which_policies_do_americans_think_would_be/,5871,5871,,1668,OC Which policies do Americans think would be effective at decreasing inflation,2022-11-0133.png
[OC] Who Targets You? Top Contested Facebook & Instagram Ad Audiences in US 2022 midterms,fabiofavusmaximus,2022-11-10 12:23:43,https://i.redd.it/vkxb939n94z91.jpg,https://www.reddit.com/r/dataisbeautiful/comments/yrdcr9/oc_who_targets_you_top_contested_facebook/,499,499,,174,OC Who Targets You Top Contested Facebook & Instagram Ad Audiences in US 2022 midterms,2022-11-0134.jpg
[OC] Where Military Aid to Ukraine Comes From,eqqqxy,2022-11-10 13:30:34,https://i.redd.it/vxsead2ml4z91.png,https://www.reddit.com/r/dataisbeautiful/comments/yrf10w/oc_where_military_aid_to_ukraine_comes_from/,8283,8283,,1293,OC Where Military Aid to Ukraine Comes From,2022-11-0135.png
"[OC] 8 response metrics, avg, 3 predictor metrics: UT, OK, CO, NM – 2020 election",terrykrohe,2022-11-10 15:12:06,https://i.redd.it/drlaec9r35z91.png,https://www.reddit.com/r/dataisbeautiful/comments/yrhw8z/oc_8_response_metrics_avg_3_predictor_metrics_ut/,0,0,,5,"OC 8 response metrics, avg, 3 predictor metrics UT, OK, CO, NM – 2020 election",2022-11-0136.png
[OC] Serie A has the least variance amongst Winners of the Top 5 Leagues since 2010,reddevil131313,2022-11-10 15:38:59,https://i.redd.it/0i6502bj85z91.png,https://www.reddit.com/r/dataisbeautiful/comments/yrio6y/oc_serie_a_has_the_least_variance_amongst_winners/,14,14,,9,OC Serie A has the least variance amongst Winners of the Top 5 Leagues since 2010,2022-11-0137.png
[OC] Visualizing how big are the top 25 stocks now in S&P 500 index,giteam,2022-11-10 15:58:48,https://i.redd.it/ol6i2m33c5z91.png,https://www.reddit.com/r/dataisbeautiful/comments/yrj8pt/oc_visualizing_how_big_are_the_top_25_stocks_now/,91,91,,27,OC Visualizing how big are the top 25 stocks now in S&P 500 index,2022-11-0138.png
The level of inequality in r/dataisbeautiful [OC],maanyos,2022-11-10 16:21:23,https://i.redd.it/tc45g5dnf5z91.png,https://www.reddit.com/r/dataisbeautiful/comments/yrjxe0/the_level_of_inequality_in_rdataisbeautiful_oc/,10979,10979,,239,The level of inequality in rdataisbeautiful OC,2022-11-0139.png
[OC] College Majors with the Highest Gains/Loss in Median Earnings (2010 vs 2019),icywatermelons,2022-11-10 16:52:53,https://i.redd.it/hqyyicyel5z91.png,https://www.reddit.com/r/dataisbeautiful/comments/yrkv8b/oc_college_majors_with_the_highest_gainsloss_in/,36,36,,15,OC College Majors with the Highest GainsLoss in Median Earnings (2010 vs 2019),2022-11-0140.png
Tracking overdose deaths in B.C.: Who's dying and what's killing them,DifficultFormula,2022-11-10 17:28:02,https://vancouversun.com/news/local-news/tracking-overdose-deaths-in-british-columbia,https://www.reddit.com/r/dataisbeautiful/comments/yrlvjk/tracking_overdose_deaths_in_bc_whos_dying_and/,9,9,,1,Tracking overdose deaths in B.C. Who's dying and what's killing them,2022-11-0141.jpg
Average Age of ATP No. 1 Rank Since 1975 [OC],pato_aceves,2022-11-10 18:35:23,https://i.redd.it/p8rsug1146z91.png,https://www.reddit.com/r/dataisbeautiful/comments/yrnr4a/average_age_of_atp_no_1_rank_since_1975_oc/,8,8,,9,Average Age of ATP No. 1 Rank Since 1975 OC,2022-11-0142.png
Life Satisfaction and Age,dwaxe,2022-11-10 19:06:27,https://flowingdata.com/2022/11/10/life-satisfaction-and-age/,https://www.reddit.com/r/dataisbeautiful/comments/yrolte/life_satisfaction_and_age/,31,31,,12,Life Satisfaction and Age,2022-11-0143.jpg
Votes to protect or expand reproductive rights are winning on every state ballot measure [OC].,YepYepYepYepYepUhHuh,2022-11-10 19:54:48,https://i.redd.it/libu6riph6z91.png,https://www.reddit.com/r/dataisbeautiful/comments/yrpytj/votes_to_protect_or_expand_reproductive_rights/,1595,1595,,113,Votes to protect or expand reproductive rights are winning on every state ballot measure OC.,2022-11-0144.png
"USA Home Listings, Median Days on Market, Percent Change September to October, 2022, by US County [OC]",michigician,2022-11-10 21:07:36,https://i.redd.it/s2phr6puu6z91.png,https://www.reddit.com/r/dataisbeautiful/comments/yrruqr/usa_home_listings_median_days_on_market_percent/,19,19,,28,"USA Home Listings, Median Days on Market, Percent Change September to October, 2022, by US County OC",2022-11-0145.png
