title,author,created_date,url,full_permalink,score,ups,downs,num_comments,sanitized_title,image_file
"[OC] Incarceration rate in the US vs Europe. While the US has only 5% of the world’s population, it has nearly 25% of the world's prisoners",flyingcatwithhorns,2022-10-06 00:33:52,https://i.redd.it/o3c3uun2z2s91.png,https://www.reddit.com/r/dataisbeautiful/comments/xwr9ba/oc_incarceration_rate_in_the_us_vs_europe_while/,24444,24444,,2622,"OC Incarceration rate in the US vs Europe. While the US has only 5% of the world’s population, it has nearly 25% of the world's prisoners",2022-10-0076.png
A comment that appears when search for social sentiment on Halloween candy past 3 months [OC],rpaul9578,2022-10-06 01:51:53,https://i.redd.it/pdczgnd2d3s91.png,https://www.reddit.com/r/dataisbeautiful/comments/xwsxgs/a_comment_that_appears_when_search_for_social/,0,0,,6,A comment that appears when search for social sentiment on Halloween candy past 3 months OC,2022-10-0077.png
[OC] Singapore's population composition over the years,meljap,2022-10-06 03:57:29,https://i.redd.it/47pdshrdz3s91.jpg,https://www.reddit.com/r/dataisbeautiful/comments/xwvhhr/oc_singapores_population_composition_over_the/,33,33,,6,OC Singapore's population composition over the years,2022-10-0078.jpg
A shaded relief map centred on Greece and the Aegean Sea rendered from 3d data and satellite imagery [OC],visualgeomatics,2022-10-06 04:38:56,https://i.redd.it/jw0tf4hm64s91.jpg,https://www.reddit.com/r/dataisbeautiful/comments/xwwa28/a_shaded_relief_map_centred_on_greece_and_the/,481,481,,21,A shaded relief map centred on Greece and the Aegean Sea rendered from 3d data and satellite imagery OC,2022-10-0079.jpg
[OC] Cumulative CO2 emissions in tons by country (1750 - 2020),giteam,2022-10-06 07:00:09,https://i.redd.it/9d90ozk1w4s91.png,https://www.reddit.com/r/dataisbeautiful/comments/xwyp92/oc_cumulative_co2_emissions_in_tons_by_country/,2521,2521,,369,OC Cumulative CO2 emissions in tons by country (1750 - 2020),2022-10-0080.png
"[OC] Countries where women face election-related violence, with Vatican City as an exception",meller12_3,2022-10-06 09:36:53,https://i.redd.it/6yg4xz8xi5s91.png,https://www.reddit.com/r/dataisbeautiful/comments/xx120j/oc_countries_where_women_face_electionrelated/,0,0,,19,"OC Countries where women face election-related violence, with Vatican City as an exception",2022-10-0081.png
[OC] The United States is not the country with the highest obesity rates.,Equal-Crew-3367,2022-10-06 09:38:31,https://i.redd.it/yyygascco5s91.jpg,https://www.reddit.com/r/dataisbeautiful/comments/xx12vl/oc_the_united_states_is_not_the_country_with_the/,0,0,,24,OC The United States is not the country with the highest obesity rates.,2022-10-0082.jpg
[OC] Distribution of the miles reached by cars in the UK grouped by their fuel type,matt_thorne,2022-10-06 09:58:10,https://i.redd.it/27qjw5vqr5s91.png,https://www.reddit.com/r/dataisbeautiful/comments/xx1dlx/oc_distribution_of_the_miles_reached_by_cars_in/,208,208,,93,OC Distribution of the miles reached by cars in the UK grouped by their fuel type,2022-10-0083.png
[OC] China and India's military spending mirrors each other,Round-Bodybuilder187,2022-10-06 11:36:50,https://i.redd.it/xpncbm8f96s91.png,https://www.reddit.com/r/dataisbeautiful/comments/xx31rg/oc_china_and_indias_military_spending_mirrors/,31,31,,23,OC China and India's military spending mirrors each other,2022-10-0084.png
Streaming TV Exclusives (Prime is a Shitshow!) [OC],Crash_Recovery,2022-10-06 12:32:39,https://i.redd.it/4ou94yg2j6s91.png,https://www.reddit.com/r/dataisbeautiful/comments/xx445h/streaming_tv_exclusives_prime_is_a_shitshow_oc/,14785,14785,,1008,Streaming TV Exclusives (Prime is a Shitshow!) OC,2022-10-0085.png
Where is there the most fall color? [OC],cremepat,2022-10-06 12:34:02,https://i.redd.it/t2gfcpvlj6s91.jpg,https://www.reddit.com/r/dataisbeautiful/comments/xx4573/where_is_there_the_most_fall_color_oc/,2665,2665,,145,Where is there the most fall color OC,2022-10-0086.jpg
[OC] Cyclone Batsirai - The Longest Lasting Cyclone of 2022,mightylighthouse,2022-10-06 13:52:34,https://v.redd.it/bntc1uz7x6s91,https://www.reddit.com/r/dataisbeautiful/comments/xx5tnt/oc_cyclone_batsirai_the_longest_lasting_cyclone/,1580,1580,,52,OC Cyclone Batsirai - The Longest Lasting Cyclone of 2022,2022-10-0087.png
"Eliud Kipchoge's New Marathon World Record, Visualized [OC]",chartr,2022-10-06 14:33:11,https://i.redd.it/sznsdpkv47s91.jpg,https://www.reddit.com/r/dataisbeautiful/comments/xx6r6m/eliud_kipchoges_new_marathon_world_record/,1113,1113,,128,"Eliud Kipchoge's New Marathon World Record, Visualized OC",2022-10-0088.jpg
[OC] Cumulative per Capita CO2 Emissions from 1990 to 2019,ModoZ,2022-10-06 14:44:03,https://i.redd.it/ao7u4b7k67s91.png,https://www.reddit.com/r/dataisbeautiful/comments/xx706k/oc_cumulative_per_capita_co2_emissions_from_1990/,10,10,,2,OC Cumulative per Capita CO2 Emissions from 1990 to 2019,2022-10-0089.png
Nuclear Stockpiles: USA v. Russia [OC],rosetechnology,2022-10-06 15:19:25,https://i.redd.it/r2ohmwd3d7s91.png,https://www.reddit.com/r/dataisbeautiful/comments/xx7uh0/nuclear_stockpiles_usa_v_russia_oc/,30,30,,23,Nuclear Stockpiles USA v. Russia OC,2022-10-0090.png
[OC] World Map of Cumulative CO2 Emissions per Capita from 1990 to 2019,ModoZ,2022-10-06 15:28:17,https://i.redd.it/kcd1rndpe7s91.png,https://www.reddit.com/r/dataisbeautiful/comments/xx821p/oc_world_map_of_cumulative_co2_emissions_per/,37,37,,8,OC World Map of Cumulative CO2 Emissions per Capita from 1990 to 2019,2022-10-0091.png
[OC] The most popular attractions in TOP-10 most visited cities (based on Google Maps data). Link to the research in comments.,Miserable_Fold4086,2022-10-06 16:55:55,https://v.redd.it/jp6lvihbu7s91,https://www.reddit.com/r/dataisbeautiful/comments/xxa6vl/oc_the_most_popular_attractions_in_top10_most/,233,233,,15,OC The most popular attractions in TOP-10 most visited cities (based on Google Maps data). Link to the research in comments.,2022-10-0092.png
China and India import Russian oil,jeffsmith202,2022-10-06 19:54:03,https://timesofindia.indiatimes.com/business/india-business/explained-how-indias-import-of-russian-oil-is-part-of-inflation-management/articleshow/94082622.cms,https://www.reddit.com/r/dataisbeautiful/comments/xxejxf/china_and_india_import_russian_oil/,1,1,,0,China and India import Russian oil,2022-10-0093.jpg
[OC] U.S. States visualized to show the most and least connected,tk-data,2022-10-06 19:58:18,https://i.redd.it/6187twxnq8s91.png,https://www.reddit.com/r/dataisbeautiful/comments/xxenmd/oc_us_states_visualized_to_show_the_most_and/,1715,1715,,206,OC U.S. States visualized to show the most and least connected,2022-10-0094.png
"[OC] One of the most traded products during Bolsonaro's administration was Soybean, a product with a significant environmental impact in the Amazon forest.",RobinWheeliams,2022-10-06 20:43:29,https://i.redd.it/6s49sfdjy8s91.png,https://www.reddit.com/r/dataisbeautiful/comments/xxfrdv/oc_one_of_the_most_traded_products_during/,11,11,,7,"OC One of the most traded products during Bolsonaro's administration was Soybean, a product with a significant environmental impact in the Amazon fore",2022-10-0095.png
"Mass incarceration is unimaginably large. - The actual number of Americans jailed or imprisoned, about 2.3 million",ueberklaus,2022-10-06 22:03:34,https://mkorostoff.github.io/incarceration-in-real-numbers/,https://www.reddit.com/r/dataisbeautiful/comments/xxhp4v/mass_incarceration_is_unimaginably_large_the/,20519,20519,,1344,"Mass incarceration is unimaginably large. - The actual number of Americans jailed or imprisoned, about 2.3 million",2022-10-0096.jpg
[OC] US infant mortality vs 3 'predictor' metrics º 2020 election,terrykrohe,2022-10-07 02:44:20,https://i.redd.it/a2sz3qncras91.png,https://www.reddit.com/r/dataisbeautiful/comments/xxnkl0/oc_us_infant_mortality_vs_3_predictor_metrics_º/,11,11,,10,OC US infant mortality vs 3 'predictor' metrics º 2020 election,2022-10-0097.png
[OC] Defense stocks have been unable to hold onto gains since the invasion of Ukraine,OverlookedAlpha,2022-10-07 05:14:56,https://i.redd.it/9f7sm6k3ibs91.png,https://www.reddit.com/r/dataisbeautiful/comments/xxqf8a/oc_defense_stocks_have_been_unable_to_hold_onto/,9,9,,4,OC Defense stocks have been unable to hold onto gains since the invasion of Ukraine,2022-10-0098.png
India Maps,DhyanKar0,2022-10-07 09:19:41,https://medium.com/@dhyankaroabhi/finding-places-to-live-in-india-df0e4eb9c49b,https://www.reddit.com/r/dataisbeautiful/comments/xxue4w/india_maps/,8,8,,1,India Maps,2022-10-0099.jpg
[OC] Apple IPO vs Now - Breaking down revenue and profit sources,giteam,2022-10-07 12:42:00,https://i.redd.it/kwojd3czpds91.png,https://www.reddit.com/r/dataisbeautiful/comments/xxy4vs/oc_apple_ipo_vs_now_breaking_down_revenue_and/,1240,1240,,210,OC Apple IPO vs Now - Breaking down revenue and profit sources,2022-10-0100.png
[OC] How much Poor / Rich is a country by GDP (PPP) Per Capita,two_plus_two_is_zero,2022-10-07 13:41:47,https://i.redd.it/1uxoffjj0es91.png,https://www.reddit.com/r/dataisbeautiful/comments/xxzhex/oc_how_much_poor_rich_is_a_country_by_gdp_ppp_per/,24,24,,8,OC How much Poor Rich is a country by GDP (PPP) Per Capita,2022-10-0101.png
[OC] The GDP of US Latinos is greater than Brazil’s and Mexico’s combined.,latinometrics,2022-10-07 14:33:35,https://i.redd.it/h4bjt3cs9es91.png,https://www.reddit.com/r/dataisbeautiful/comments/xy0pte/oc_the_gdp_of_us_latinos_is_greater_than_brazils/,0,0,,77,OC The GDP of US Latinos is greater than Brazil’s and Mexico’s combined.,2022-10-0102.png
"Strategic Petroleum Reserve v. Oil Price: Now that it's October, releases from the SPR have stopped. What happens next? [OC]",rosetechnology,2022-10-07 14:36:16,https://i.redd.it/qlyewz1daes91.png,https://www.reddit.com/r/dataisbeautiful/comments/xy0s40/strategic_petroleum_reserve_v_oil_price_now_that/,14,14,,8,"Strategic Petroleum Reserve v. Oil Price Now that it's October, releases from the SPR have stopped. What happens next OC",2022-10-0103.png
The Most Visited Website in Every Country,AmishGraphicDesigner,2022-10-07 14:38:08,https://www.hostinger.com/tutorials/the-most-visited-website-in-every-country?utm_campaign=mb&utm_medium=newsletter&utm_source=morning_brew,https://www.reddit.com/r/dataisbeautiful/comments/xy0tpr/the_most_visited_website_in_every_country/,9,9,,2,The Most Visited Website in Every Country,2022-10-0104.jpg
Internet censorship: Visualizing how Iran's internet is becoming increasingly controlled by the government,berlinflu,2022-10-07 15:50:14,https://interaktiv.tagesspiegel.de/lab/internet-sperren-im-iran-blackouts-gegen-die-freiheit/,https://www.reddit.com/r/dataisbeautiful/comments/xy2lq9/internet_censorship_visualizing_how_irans/,24,24,,2,Internet censorship Visualizing how Iran's internet is becoming increasingly controlled by the government,2022-10-0105.jpg
[OC] Ukraine & Russian Tank Losses by Type,elijahmeeks,2022-10-07 16:20:36,https://i.redd.it/qfrspoyuses91.png,https://www.reddit.com/r/dataisbeautiful/comments/xy3crr/oc_ukraine_russian_tank_losses_by_type/,27,27,,18,OC Ukraine & Russian Tank Losses by Type,2022-10-0106.png
[OC] The gender breakdown of NCAA head coaches,USAFacts_Official,2022-10-07 16:39:52,https://i.redd.it/s544n5ixves91.png,https://www.reddit.com/r/dataisbeautiful/comments/xy3tni/oc_the_gender_breakdown_of_ncaa_head_coaches/,18,18,,5,OC The gender breakdown of NCAA head coaches,2022-10-0107.png
[OC] Availability of Best Picture Oscar Winners on Streaming Services. HBO Max has the most and it's not close.,Clemario,2022-10-07 16:55:00,https://i.redd.it/a8wbtj9ryes91.png,https://www.reddit.com/r/dataisbeautiful/comments/xy46l5/oc_availability_of_best_picture_oscar_winners_on/,180,180,,39,OC Availability of Best Picture Oscar Winners on Streaming Services. HBO Max has the most and it's not close.,2022-10-0108.png
Where are the bars and restaurants of Europe? [OC],symmy546,2022-10-07 17:15:45,https://i.redd.it/vnvurndt2fs91.png,https://www.reddit.com/r/dataisbeautiful/comments/xy4pb0/where_are_the_bars_and_restaurants_of_europe_oc/,189,189,,34,Where are the bars and restaurants of Europe OC,2022-10-0109.png
Playoff Streaks and Droughts in Major League Baseball [OC],BoMcCready,2022-10-07 17:40:17,https://i.redd.it/e1jr4dn47fs91.png,https://www.reddit.com/r/dataisbeautiful/comments/xy5asn/playoff_streaks_and_droughts_in_major_league/,14,14,,4,Playoff Streaks and Droughts in Major League Baseball OC,2022-10-0110.png
"[OC] Forget seltzers, Constellation Brands beer sales, visualized",bradocapital,2022-10-07 18:16:00,https://i.redd.it/84vpxid7dfs91.png,https://www.reddit.com/r/dataisbeautiful/comments/xy66v2/oc_forget_seltzers_constellation_brands_beer/,6,6,,3,"OC Forget seltzers, Constellation Brands beer sales, visualized",2022-10-0111.png
Heatmap of U.S. states where people paying over $1k/month to finance their new cars,spare_wheel_o_cheese,2022-10-07 19:16:31,https://www.edmunds.com/car-loan-apr-interest-rate/#payments,https://www.reddit.com/r/dataisbeautiful/comments/xy7mit/heatmap_of_us_states_where_people_paying_over/,33,33,,12,Heatmap of U.S. states where people paying over $1kmonth to finance their new cars,2022-10-0112.jpg
[OC] House price you can afford by paying 1000/month for 30 years vs. interest rate,hmiamid,2022-10-07 19:21:25,https://i.redd.it/8zygown3pfs91.png,https://www.reddit.com/r/dataisbeautiful/comments/xy7qym/oc_house_price_you_can_afford_by_paying_1000month/,630,630,,118,OC House price you can afford by paying 1000month for 30 years vs. interest rate,2022-10-0113.png
Russia is now Ukraine's largest arms supplier after 8 months of fighting... [OC],ewat456,2022-10-07 19:54:31,https://i.redd.it/b10rvgr1vfs91.png,https://www.reddit.com/r/dataisbeautiful/comments/xy8jle/russia_is_now_ukraines_largest_arms_supplier/,15985,15985,,552,Russia is now Ukraine's largest arms supplier after 8 months of fighting... OC,2022-10-0114.png
[OC] Is Dating Apps the place to find your Prince Charming or Cinderella?,Equal-Crew-3367,2022-10-08 10:45:26,https://i.redd.it/4lwvo9l3aks91.png,https://www.reddit.com/r/dataisbeautiful/comments/xypn5l/oc_is_dating_apps_the_place_to_find_your_prince/,29,29,,12,OC Is Dating Apps the place to find your Prince Charming or Cinderella,2022-10-0115.png
[OC] Countries that produce the most Eggplants 🍆,PieChartPirate,2022-10-08 14:01:24,https://v.redd.it/duvn3v1z8ls91,https://www.reddit.com/r/dataisbeautiful/comments/xytk1h/oc_countries_that_produce_the_most_eggplants/,16293,16293,,861,OC Countries that produce the most Eggplants 🍆,2022-10-0116.png
[OC] Animation of rainfall during 1997 Central European flood,Quba_quba,2022-10-08 16:04:33,https://v.redd.it/akr9t32yuls91,https://www.reddit.com/r/dataisbeautiful/comments/xywf1o/oc_animation_of_rainfall_during_1997_central/,226,226,,6,OC Animation of rainfall during 1997 Central European flood,2022-10-0117.png
US Strategic Petroleum Reserves - Percent Change [OC],CountBayesie,2022-10-08 16:47:02,https://i.redd.it/be9u79s02ms91.png,https://www.reddit.com/r/dataisbeautiful/comments/xyxfgh/us_strategic_petroleum_reserves_percent_change_oc/,1893,1893,,359,US Strategic Petroleum Reserves - Percent Change OC,2022-10-0118.png
[OC] Cause of Death on California's Death Row,academiaadvice,2022-10-08 17:11:03,https://i.redd.it/tz0t0k9v6ms91.png,https://www.reddit.com/r/dataisbeautiful/comments/xyy0u5/oc_cause_of_death_on_californias_death_row/,131,131,,32,OC Cause of Death on California's Death Row,2022-10-0119.png
"[OC] Retro Video Game Price Comparison (NES, PS1, GCN)",MHoggs17,2022-10-08 17:12:15,https://i.redd.it/5sqmym807ms91.jpg,https://www.reddit.com/r/dataisbeautiful/comments/xyy1wh/oc_retro_video_game_price_comparison_nes_ps1_gcn/,6,6,,5,"OC Retro Video Game Price Comparison (NES, PS1, GCN)",2022-10-0120.jpg
[OC] (Interactive) Housing price-to-income ratios for U.S. metro areas,theMadcap,2022-10-08 19:09:37,https://i.redd.it/sng7nb6zrms91.png,https://www.reddit.com/r/dataisbeautiful/comments/xz0v3g/oc_interactive_housing_pricetoincome_ratios_for/,11,11,,18,OC (Interactive) Housing price-to-income ratios for U.S. metro areas,2022-10-0121.png
[OC] Can we predict household food expenditure based on inflation rate?,watermelon-sugar9,2022-10-09 01:25:21,https://i.redd.it/4hqlfxkymos91.png,https://www.reddit.com/r/dataisbeautiful/comments/xz92jj/oc_can_we_predict_household_food_expenditure/,13,13,,6,OC Can we predict household food expenditure based on inflation rate,2022-10-0122.png
[OC] Americans opinions of Will Smith and Chris Rock in 2022 following the Oscars Incident,Spirited-Focus-7312,2022-10-09 08:31:21,https://i.redd.it/xjw65wgzqqs91.png,https://www.reddit.com/r/dataisbeautiful/comments/xzgfkg/oc_americans_opinions_of_will_smith_and_chris/,5059,5059,,491,OC Americans opinions of Will Smith and Chris Rock in 2022 following the Oscars Incident,2022-10-0123.png
[OC] Percent of human moves matching computer recommended moves in top chess tournaments,Evidently_21,2022-10-09 08:50:18,https://i.redd.it/9nxrv857uqs91.png,https://www.reddit.com/r/dataisbeautiful/comments/xzgqi5/oc_percent_of_human_moves_matching_computer/,387,387,,48,OC Percent of human moves matching computer recommended moves in top chess tournaments,2022-10-0124.png
[OC] Price differences per gas station brand (Germany),wann-tanken,2022-10-09 09:39:08,https://i.redd.it/0j9ai1j33rs91.png,https://www.reddit.com/r/dataisbeautiful/comments/xzhicq/oc_price_differences_per_gas_station_brand_germany/,71,71,,13,OC Price differences per gas station brand (Germany),2022-10-0125.png
[OC] 50 countries with the highest CO2 emissions - 1900 vs 2020,giteam,2022-10-09 12:56:37,https://i.redd.it/0fcnabed2ss91.png,https://www.reddit.com/r/dataisbeautiful/comments/xzl0z2/oc_50_countries_with_the_highest_co2_emissions/,3921,3921,,358,OC 50 countries with the highest CO2 emissions - 1900 vs 2020,2022-10-0126.png
[OC] How do philosophers define happiness? Using 2000 of my notes and almost 100 books as data,pkmckirtap,2022-10-09 14:49:31,https://i.redd.it/rblahdvulss91.png,https://www.reddit.com/r/dataisbeautiful/comments/xznhay/oc_how_do_philosophers_define_happiness_using/,904,904,,71,OC How do philosophers define happiness Using 2000 of my notes and almost 100 books as data,2022-10-0127.png
"Gun violence in Philadeplphia. Not beautiful, but...",uhhiforget,2022-10-09 14:49:51,https://controller.phila.gov/philadelphia-audits/mapping-gun-violence/#/?year=2022&map=10.00%2F40.05329%2F-75.13935&layers=Point%20locations,https://www.reddit.com/r/dataisbeautiful/comments/xznhkm/gun_violence_in_philadeplphia_not_beautiful_but/,1,1,,56,"Gun violence in Philadeplphia. Not beautiful, but...",2022-10-0128.jpg
"[OC] Top 10 countries with the highest death rate from opioid overdoses. The United States in particular has seen a very steep rise in overdose deaths, with drug overdoses being the leading cause of death in adults under 50 years old",flyingcatwithhorns,2022-10-09 18:51:15,https://i.redd.it/f6susa1hsts91.png,https://www.reddit.com/r/dataisbeautiful/comments/xzt54g/oc_top_10_countries_with_the_highest_death_rate/,3323,3323,,557,"OC Top 10 countries with the highest death rate from opioid overdoses. The United States in particular has seen a very steep rise in overdose deaths,",2022-10-0129.png
"[OC] Visualizing the exchange (crafting, smelting, trading) of items in Minecraft",Coolfoolsalot,2022-10-09 20:27:28,https://v.redd.it/s49pfdcnaus91,https://www.reddit.com/r/dataisbeautiful/comments/xzvf3n/oc_visualizing_the_exchange_crafting_smelting/,823,823,,16,"OC Visualizing the exchange (crafting, smelting, trading) of items in Minecraft",2022-10-0130.png
"World Capitals Ranked by Land Considered ""Points of Interest"". [OC]",CharcoalCharts,2022-10-09 21:37:40,https://i.redd.it/yrvs5c06nus91.png,https://www.reddit.com/r/dataisbeautiful/comments/xzx2aq/world_capitals_ranked_by_land_considered_points/,15,15,,21,World Capitals Ranked by Land Considered Points of Interest. OC,2022-10-0131.png
"""How much of the world’s food production is dependent on pollinators?"" - Hannah Ritchie for Our World In Data",tonymmorley,2022-10-10 02:29:01,https://ourworldindata.org/pollinator-dependence?utm_source=OWID+Newsletter&utm_campaign=be8ef3992c-biweekly-digest-2022-10-07&utm_medium=email&utm_term=0_2e166c1fc1-be8ef3992c-537059914#what-crops-are-dependent-on-pollinators,https://www.reddit.com/r/dataisbeautiful/comments/y03586/how_much_of_the_worlds_food_production_is/,214,214,,3,How much of the world’s food production is dependent on pollinators - Hannah Ritchie for Our World In Data,2022-10-0132.jpg
[OC] Celebration of Indigenous Peoples' Day in the U.S,Metalytiq,2022-10-10 05:04:48,https://i.redd.it/w14cts0zuws91.png,https://www.reddit.com/r/dataisbeautiful/comments/y062o9/oc_celebration_of_indigenous_peoples_day_in_the_us/,597,597,,105,OC Celebration of Indigenous Peoples' Day in the U.S,2022-10-0133.png
[OC] Microsoft IPO vs Now - Breaking down its revenue and profits,giteam,2022-10-10 09:11:42,https://i.redd.it/tg9iwrv03ys91.png,https://www.reddit.com/r/dataisbeautiful/comments/y0a0ek/oc_microsoft_ipo_vs_now_breaking_down_its_revenue/,20381,20381,,1114,OC Microsoft IPO vs Now - Breaking down its revenue and profits,2022-10-0134.png
[OC] Texting Habits with my Girlfriend Post-Long Distance,teddarific,2022-10-10 10:43:41,https://i.redd.it/9tfgeb7mjys91.jpg,https://www.reddit.com/r/dataisbeautiful/comments/y0bi2j/oc_texting_habits_with_my_girlfriend_postlong/,7529,7529,,305,OC Texting Habits with my Girlfriend Post-Long Distance,2022-10-0135.jpg
[OC] 3 years worth of toddler's color picking,slashjasper,2022-10-10 12:33:39,https://i.redd.it/fbmp7mr23zs91.png,https://www.reddit.com/r/dataisbeautiful/comments/y0dng0/oc_3_years_worth_of_toddlers_color_picking/,7385,7385,,139,OC 3 years worth of toddler's color picking,2022-10-0136.png
[OC] Emailing 800 companies asking for a software internship,yungBez0s,2022-10-10 15:46:33,https://i.redd.it/9e6jraej10t91.png,https://www.reddit.com/r/dataisbeautiful/comments/y0i2r4/oc_emailing_800_companies_asking_for_a_software/,7738,7738,,349,OC Emailing 800 companies asking for a software internship,2022-10-0137.png
[OC] Lap by lap visualisation of full F1 seasons. Using self-made system (welcoming any feedback),spectrummonkey,2022-10-10 16:05:21,https://spectrummonkey.com/thedatadudes/,https://www.reddit.com/r/dataisbeautiful/comments/y0ijku/oc_lap_by_lap_visualisation_of_full_f1_seasons/,6,6,,2,OC Lap by lap visualisation of full F1 seasons. Using self-made system (welcoming any feedback),2022-10-0138.jpg
"[OC] In 2020, India is producing the most milk in the world",eqqqxy,2022-10-10 16:25:57,https://i.redd.it/carhzn4j80t91.png,https://www.reddit.com/r/dataisbeautiful/comments/y0j27w/oc_in_2020_india_is_producing_the_most_milk_in/,1,1,,18,"OC In 2020, India is producing the most milk in the world",2022-10-0139.png
1st Year in London - All Expenses excl. Rent (14/9/2021 to 13/9/2022) [OC],ermendonce,2022-10-10 17:41:34,https://i.redd.it/lix24jafl0t91.png,https://www.reddit.com/r/dataisbeautiful/comments/y0kz10/1st_year_in_london_all_expenses_excl_rent_1492021/,9,9,,20,1st Year in London - All Expenses excl. Rent (1492021 to 1392022) OC,2022-10-0140.png
[OC] My post PhD job search adventure into biomedical industry. Ended up landing an amazing position in cell therapy (CAR-T) field in a mid-sized company. Was a fun rollercoaster getting there!,theimmortalgene,2022-10-10 22:07:56,https://i.redd.it/yw9hknpcx1t91.png,https://www.reddit.com/r/dataisbeautiful/comments/y0rl17/oc_my_post_phd_job_search_adventure_into/,463,463,,23,OC My post PhD job search adventure into biomedical industry. Ended up landing an amazing position in cell therapy (CAR-T) field in a mid-sized compan,2022-10-0141.png
[OC] I made a list of the most likely bird you'll see if you go birding in my area. Taken over a 6 day period.,DauphDaddy,2022-10-11 07:37:45,https://i.redd.it/mrkfrz97q4t91.jpg,https://www.reddit.com/r/dataisbeautiful/comments/y12r0p/oc_i_made_a_list_of_the_most_likely_bird_youll/,13001,13001,,447,OC I made a list of the most likely bird you'll see if you go birding in my area. Taken over a 6 day period.,2022-10-0142.jpg
[OC] Largest renewable energy companies in the world,giteam,2022-10-11 07:58:05,https://i.redd.it/4hji5wczu4t91.png,https://www.reddit.com/r/dataisbeautiful/comments/y1327v/oc_largest_renewable_energy_companies_in_the_world/,84,84,,19,OC Largest renewable energy companies in the world,2022-10-0143.png
[OC] Windows to macOS userbase ratio,ShadyInternetUser,2022-10-11 08:24:24,https://www.datawrapper.de/_/vz1Im/,https://www.reddit.com/r/dataisbeautiful/comments/y13hdz/oc_windows_to_macos_userbase_ratio/,2,2,,3,OC Windows to macOS userbase ratio,2022-10-0144.jpg
"[OC] Rising Deaths by Road Accidents in the United States, compared to 7 other Developed Countries",biantongfrom,2022-10-11 09:20:26,https://i.redd.it/9rjw8b1l95t91.jpg,https://www.reddit.com/r/dataisbeautiful/comments/y14dmd/oc_rising_deaths_by_road_accidents_in_the_united/,2133,2133,,621,"OC Rising Deaths by Road Accidents in the United States, compared to 7 other Developed Countries",2022-10-0145.jpg
[OC] EVERYTHING EVERYWHERE ALL AT ONCE IS A24'S HIGHEST EARNING MOVIE IN 2022,meller12_3,2022-10-11 09:27:58,https://i.redd.it/yb2ncchya5t91.png,https://www.reddit.com/r/dataisbeautiful/comments/y14hwm/oc_everything_everywhere_all_at_once_is_a24s/,8,8,,12,OC EVERYTHING EVERYWHERE ALL AT ONCE IS A24'S HIGHEST EARNING MOVIE IN 2022,2022-10-0146.png
Job Openings vs. People Unemployed In The US [OC],chartr,2022-10-11 12:32:05,https://i.redd.it/hplt38wt76t91.jpg,https://www.reddit.com/r/dataisbeautiful/comments/y17vr9/job_openings_vs_people_unemployed_in_the_us_oc/,1795,1795,,158,Job Openings vs. People Unemployed In The US OC,2022-10-0147.jpg
