title,author,created_date,url,full_permalink,score,ups,downs,num_comments,sanitized_title,image_file
[OC] Pizza eating challenge by a non-professional eater in a local competition,Tambury,2022-10-24 05:59:30,https://i.redd.it/t7atn0yh1pv91.png,https://www.reddit.com/r/dataisbeautiful/comments/yc3j4r/oc_pizza_eating_challenge_by_a_nonprofessional/,1930,1930,,134,OC Pizza eating challenge by a non-professional eater in a local competition,2022-10-0296.png
"[OC] Elon Musk's acquisition of Twitter is bigger than the combined super-big-tech acquisitions of Microsoft, Salesforce and Meta respectively. More context in comment 👇",karthik1967,2022-10-24 08:08:27,https://i.redd.it/v3o5w766opv91.png,https://www.reddit.com/r/dataisbeautiful/comments/yc5i85/oc_elon_musks_acquisition_of_twitter_is_bigger/,71,71,,48,"OC Elon Musk's acquisition of Twitter is bigger than the combined super-big-tech acquisitions of Microsoft, Salesforce and Meta respectively. More con",2022-10-0297.png
[OC] Interactive map showing consistency of surf spots around the world - Tableau (link in comments),Ryrylonsdale,2022-10-24 08:51:00,https://i.redd.it/p10rbtp7wpv91.png,https://www.reddit.com/r/dataisbeautiful/comments/yc65s4/oc_interactive_map_showing_consistency_of_surf/,14,14,,7,OC Interactive map showing consistency of surf spots around the world - Tableau (link in comments),2022-10-0298.png
[OC] Visualising 12 months of running with Strava,detalbruh,2022-10-24 10:42:57,https://i.redd.it/p8yi2xnrxrv91.png,https://www.reddit.com/r/dataisbeautiful/comments/yc7ybf/oc_visualising_12_months_of_running_with_strava/,676,676,,82,OC Visualising 12 months of running with Strava,2022-10-0299.png
UPI transactions in India dropped by around 20% during the India vs Pakistan Cricket Worldcup match. (UPI is a digital way to transfer funds between bank accounts/pay for stuff online in India. with over 6.5 Billion transactions done per month using it),Existing-Table689,2022-10-24 12:19:52,https://twitter.com/theMihirV/status/1584455583050391553,https://www.reddit.com/r/dataisbeautiful/comments/yc9rs5/upi_transactions_in_india_dropped_by_around_20/,159,159,,4,UPI transactions in India dropped by around 20% during the India vs Pakistan Cricket Worldcup match. (UPI is a digital way to transfer funds between b,2022-10-0300.jpg
[OC] Most Popular MARVEL Superheroes by Geography,reddevil131313,2022-10-24 12:48:36,https://i.redd.it/dc371s1i2rv91.png,https://www.reddit.com/r/dataisbeautiful/comments/ycadmh/oc_most_popular_marvel_superheroes_by_geography/,1,1,,2,OC Most Popular MARVEL Superheroes by Geography,2022-10-0301.png
USA: Who do we spend time with across our lifetimes? [OC],rosetechnology,2022-10-24 14:04:08,https://i.redd.it/ycyk26wvfrv91.png,https://www.reddit.com/r/dataisbeautiful/comments/ycc4dz/usa_who_do_we_spend_time_with_across_our/,50876,50876,,2629,USA Who do we spend time with across our lifetimes OC,2022-10-0302.png
[OC] Close up wind map on Central America because the Andes are beautiful.,nestor2509,2022-10-24 14:38:47,https://v.redd.it/9tceiaa0mrv91,https://www.reddit.com/r/dataisbeautiful/comments/yccyiz/oc_close_up_wind_map_on_central_america_because/,2066,2066,,46,OC Close up wind map on Central America because the Andes are beautiful.,2022-10-0303.png
[OC] Winds of the 22nd of october 2022,nestor2509,2022-10-24 14:42:29,https://v.redd.it/qp3hp0dxmrv91,https://www.reddit.com/r/dataisbeautiful/comments/ycd1wp/oc_winds_of_the_22nd_of_october_2022/,898,898,,22,OC Winds of the 22nd of october 2022,2022-10-0304.png
"[OC] Market beliefs in future stock price distributions for WMT, AMZN, META and TWTR",CountBayesie,2022-10-24 14:53:02,https://i.redd.it/bebjq6amorv91.png,https://www.reddit.com/r/dataisbeautiful/comments/ycdbaj/oc_market_beliefs_in_future_stock_price/,18,18,,3,"OC Market beliefs in future stock price distributions for WMT, AMZN, META and TWTR",2022-10-0305.png
"[OC] House of the Dragon is MORE POPULAR than Rings of Power, says Google",rightontimothy,2022-10-24 14:54:18,https://i.redd.it/3ooy31vtorv91.png,https://www.reddit.com/r/dataisbeautiful/comments/ycdcc9/oc_house_of_the_dragon_is_more_popular_than_rings/,0,0,,10,"OC House of the Dragon is MORE POPULAR than Rings of Power, says Google",2022-10-0306.png
Top sources of meaning across different countries,PaulHasselbaink,2022-10-24 15:00:17,https://www.pewresearch.org/global/wp-content/uploads/sites/2/2021/11/PG_11.18.21_meaning-of-life_0_2.png?w=640,https://www.reddit.com/r/dataisbeautiful/comments/ycdhq2/top_sources_of_meaning_across_different_countries/,427,427,,168,Top sources of meaning across different countries,2022-10-0307.png
Publicly owned electrical utilities are generally cheaper than investor-owned utilities (U.S.A.) [OC],ptunnel,2022-10-24 15:52:38,https://i.redd.it/8aj54u2fzrv91.png,https://www.reddit.com/r/dataisbeautiful/comments/ycesrb/publicly_owned_electrical_utilities_are_generally/,147,147,,39,Publicly owned electrical utilities are generally cheaper than investor-owned utilities (U.S.A.) OC,2022-10-0308.png
Highest and Lowest Housing Vacancy Rates by State,hcbaron,2022-10-24 16:36:04,https://www.lendingtree.com/home/mortgage/vacancy-rates-study/,https://www.reddit.com/r/dataisbeautiful/comments/ycfwv4/highest_and_lowest_housing_vacancy_rates_by_state/,9,9,,7,Highest and Lowest Housing Vacancy Rates by State,2022-10-0309.jpg
"[OC] My aggressive (and comparatively sad) 1-month job hunt as a software engineer with 6 months experience, before accepting a counter-offer from my current company.",coaster132,2022-10-24 17:38:26,https://i.redd.it/rp7a7362isv91.png,https://www.reddit.com/r/dataisbeautiful/comments/ychhcx/oc_my_aggressive_and_comparatively_sad_1month_job/,159,159,,31,"OC My aggressive (and comparatively sad) 1-month job hunt as a software engineer with 6 months experience, before accepting a counter-offer from my cu",2022-10-0310.png
"A visualization of my 4,834 Dota 2 Games Showing Win Rate and # of Games Played by Patch Number (2016-2022) [OC]",mid_juan,2022-10-24 17:57:01,https://i.redd.it/l3vj92orksv91.png,https://www.reddit.com/r/dataisbeautiful/comments/ychxlt/a_visualization_of_my_4834_dota_2_games_showing/,6,6,,1,"A visualization of my 4,834 Dota 2 Games Showing Win Rate and # of Games Played by Patch Number (2016-2022) OC",2022-10-0311.png
[OC] World's 20 Largest Solar Plants - Data Viz Redesign for Coursera Class,ChrisN-Coursera,2022-10-24 20:22:18,https://i.redd.it/osd6mcdlbtv91.jpg,https://www.reddit.com/r/dataisbeautiful/comments/yclkxd/oc_worlds_20_largest_solar_plants_data_viz/,1,1,,2,OC World's 20 Largest Solar Plants - Data Viz Redesign for Coursera Class,2022-10-0312.jpg
[OC] From 3D Contour Plots to AI-Generated Art,MLRecipes,2022-10-24 22:52:26,https://v.redd.it/6h1syykd2uv91,https://www.reddit.com/r/dataisbeautiful/comments/ycp4u4/oc_from_3d_contour_plots_to_aigenerated_art/,80,80,,6,OC From 3D Contour Plots to AI-Generated Art,2022-10-0313.png
[OC] Climbing Accidents in North American Climbing,chnetka,2022-10-25 02:13:14,https://i.redd.it/f81tqutefuv91.jpg,https://www.reddit.com/r/dataisbeautiful/comments/yct9ka/oc_climbing_accidents_in_north_american_climbing/,96,96,,29,OC Climbing Accidents in North American Climbing,2022-10-0314.jpg
How California's Electricity is Generated [OC],HammerOfTheMoops,2022-10-25 07:37:29,https://i.redd.it/f8dt9m11owv91.png,https://www.reddit.com/r/dataisbeautiful/comments/ycytpr/how_californias_electricity_is_generated_oc/,9,9,,7,How California's Electricity is Generated OC,2022-10-0315.png
"Where the world wants to move to, visualized as a graph [OC]",Tall_Ad426,2022-10-25 08:47:19,https://i.redd.it/vxkb8clc0xv91.png,https://www.reddit.com/r/dataisbeautiful/comments/ycztz9/where_the_world_wants_to_move_to_visualized_as_a/,9707,9707,,1850,"Where the world wants to move to, visualized as a graph OC",2022-10-0316.png
"[OC] Is Gyaru, a 1990s Japanese subculture, making a comeback?",Equal-Crew-3367,2022-10-25 09:38:16,https://i.redd.it/yuaokiul9xv91.png,https://www.reddit.com/r/dataisbeautiful/comments/yd0kou/oc_is_gyaru_a_1990s_japanese_subculture_making_a/,0,0,,5,"OC Is Gyaru, a 1990s Japanese subculture, making a comeback",2022-10-0317.png
The number of Americans citing difficulty remembering and concentrating increased by about a million since the pandemic began [OC],DavidWaldron,2022-10-25 10:07:13,https://i.redd.it/w8o9dwnoexv91.png,https://www.reddit.com/r/dataisbeautiful/comments/yd11aw/the_number_of_americans_citing_difficulty/,8440,8440,,639,The number of Americans citing difficulty remembering and concentrating increased by about a million since the pandemic began OC,2022-10-0318.png
[OC] Interactive map show surf consistency at spots around the world (v2.0) - Tableau,Ryrylonsdale,2022-10-25 11:07:06,https://v.redd.it/wqthrm91pxv91,https://www.reddit.com/r/dataisbeautiful/comments/yd236j/oc_interactive_map_show_surf_consistency_at_spots/,87,87,,4,OC Interactive map show surf consistency at spots around the world (v2.0) - Tableau,2022-10-0319.png
[OC] European Gas Storage in %fill vs. %Storage of Average Annual Consumption,shortdaYOLO,2022-10-25 12:37:17,https://i.redd.it/tzm0afh75yv91.png,https://www.reddit.com/r/dataisbeautiful/comments/yd3sy1/oc_european_gas_storage_in_fill_vs_storage_of/,48,48,,20,OC European Gas Storage in %fill vs. %Storage of Average Annual Consumption,2022-10-0320.png
Erling Haaland EPL Domination,M1sf1,2022-10-25 12:43:08,https://www.reddit.com/r/MCFC/comments/yd2qtt/i_will_never_get_tired_of_seeing_haaland_stats/?utm_source=share&utm_medium=android_app&utm_name=androidcss&utm_term=1&utm_content=share_button,https://www.reddit.com/r/dataisbeautiful/comments/yd3wxb/erling_haaland_epl_domination/,3,3,,2,Erling Haaland EPL Domination,2022-10-0321.jpg
[OC] Undergraduate Degrees and their Respective Increases in Employment Rates & Salaries,icywatermelons,2022-10-25 12:46:29,https://i.redd.it/lg9knhx57yv91.png,https://www.reddit.com/r/dataisbeautiful/comments/yd3z9g/oc_undergraduate_degrees_and_their_respective/,29,29,,15,OC Undergraduate Degrees and their Respective Increases in Employment Rates & Salaries,2022-10-0322.png
[OC] Are the most transmissible viruses/diseases the most deadly?,waynehihihi,2022-10-25 12:49:42,https://i.redd.it/7hzzbo1h7yv91.png,https://www.reddit.com/r/dataisbeautiful/comments/yd41ht/oc_are_the_most_transmissible_virusesdiseases_the/,76,76,,35,OC Are the most transmissible virusesdiseases the most deadly,2022-10-0323.png
"The day after Diwali, #Delhi continued with ""very poor"" Air Quality Index.",dipurai,2022-10-25 13:21:20,https://twitter.com/IndiaToday/status/1584895850568093696?s=20&t=Q7qx0RdyJc57IW0ZSxvBfA,https://www.reddit.com/r/dataisbeautiful/comments/yd4p2m/the_day_after_diwali_delhi_continued_with_very/,5,5,,0,"The day after Diwali, #Delhi continued with very poor Air Quality Index.",2022-10-0324.jpg
Vladimir Putin is dragging the world back to a bloodier time,statisticalanalysis_,2022-10-25 13:23:27,https://www.economist.com/interactive/international/2022/10/24/vladimir-putin-is-dragging-the-world-back-to-a-bloodier-time,https://www.reddit.com/r/dataisbeautiful/comments/yd4qoh/vladimir_putin_is_dragging_the_world_back_to_a/,12,12,,2,Vladimir Putin is dragging the world back to a bloodier time,2022-10-0325.jpg
Chinese stocks plummeted on Monday [OC],Janman14,2022-10-25 13:49:43,https://v.redd.it/38yh6l96iyv91,https://www.reddit.com/r/dataisbeautiful/comments/yd5ben/chinese_stocks_plummeted_on_monday_oc/,1193,1193,,142,Chinese stocks plummeted on Monday OC,2022-10-0326.png
[OC] Top 10 Fastest and Slowest Countries for Internet Speed in 2022,PlasticWriter407,2022-10-25 14:33:57,https://i.redd.it/2ao30ofcqyv91.png,https://www.reddit.com/r/dataisbeautiful/comments/yd6c1f/oc_top_10_fastest_and_slowest_countries_for/,71,71,,46,OC Top 10 Fastest and Slowest Countries for Internet Speed in 2022,2022-10-0327.png
[OC] Country of origin of the Top 10 World's Best Olive Oils 2012-2022 (tool:Excel),provenzal,2022-10-25 15:26:29,https://i.redd.it/wr5jdqs9h0w91.jpg,https://www.reddit.com/r/dataisbeautiful/comments/yd7kbb/oc_country_of_origin_of_the_top_10_worlds_best/,414,414,,88,OC Country of origin of the Top 10 World's Best Olive Oils 2012-2022 (toolExcel),2022-10-0328.jpg
How Big is the U.S. Cheese Stockpile?,Riftbreaker,2022-10-25 17:30:56,https://www.visualcapitalist.com/us-cheese-stockpile/,https://www.reddit.com/r/dataisbeautiful/comments/ydalx6/how_big_is_the_us_cheese_stockpile/,20,20,,18,How Big is the U.S. Cheese Stockpile,2022-10-0329.jpg
[OC] Whose stuff does the British Museum have?,tabthough,2022-10-25 18:33:00,https://i.redd.it/rgpgh82xwzv91.png,https://www.reddit.com/r/dataisbeautiful/comments/ydc3r8/oc_whose_stuff_does_the_british_museum_have/,23669,23669,,2942,OC Whose stuff does the British Museum have,2022-10-0330.png
[OC] Top 10 Costliest US Hurricanes/Cyclones since WWII,row64software,2022-10-25 18:44:08,https://v.redd.it/28wrkkdvyzv91,https://www.reddit.com/r/dataisbeautiful/comments/ydcczu/oc_top_10_costliest_us_hurricanescyclones_since/,235,235,,35,OC Top 10 Costliest US HurricanesCyclones since WWII,2022-10-0331.png
The Simpsons Treehouse of Horror Stories + Inspirations [OC],BoMcCready,2022-10-25 21:12:36,https://i.redd.it/o8vliqtbp0w91.png,https://www.reddit.com/r/dataisbeautiful/comments/ydfx4g/the_simpsons_treehouse_of_horror_stories/,37,37,,7,The Simpsons Treehouse of Horror Stories + Inspirations OC,2022-10-0332.png
"[OC] Breaking down Google's latest quarterly results - how they make money, and how much",giteam,2022-10-25 21:32:52,https://i.redd.it/tgoty404t0w91.png,https://www.reddit.com/r/dataisbeautiful/comments/ydgeb8/oc_breaking_down_googles_latest_quarterly_results/,164,164,,27,"OC Breaking down Google's latest quarterly results - how they make money, and how much",2022-10-0333.png
[OC] COVID 19 Effect on Issuing Canadian Permanent Residents Visas for Top 10 Source Countries,set-the-data-free,2022-10-25 22:14:24,https://i.redd.it/70eks77601w91.png,https://www.reddit.com/r/dataisbeautiful/comments/ydhcbj/oc_covid_19_effect_on_issuing_canadian_permanent/,43,43,,9,OC COVID 19 Effect on Issuing Canadian Permanent Residents Visas for Top 10 Source Countries,2022-10-0334.png
All the Metals We Mined in 2021,CakeTo,2022-10-25 23:19:45,https://www.visualcapitalist.com/all-the-metals-we-mined-in-2021-visualized/,https://www.reddit.com/r/dataisbeautiful/comments/ydiro1/all_the_metals_we_mined_in_2021/,12,12,,0,All the Metals We Mined in 2021,2022-10-0335.jpg
McDonald's Locations by Country,DataDevOps,2022-10-26 01:21:36,https://cybercoastal.com/mcdonalds-locations-by-country/,https://www.reddit.com/r/dataisbeautiful/comments/ydl9qs/mcdonalds_locations_by_country/,0,0,,2,McDonald's Locations by Country,2022-10-0336.jpg
"[OC] As of October 26, there has been as many orbital launch attempts in 2022 as in the entirety of 2021.",Nosudrum,2022-10-26 07:56:01,https://i.redd.it/z3xl3j9qv3w91.png,https://www.reddit.com/r/dataisbeautiful/comments/yds8v8/oc_as_of_october_26_there_has_been_as_many/,67,67,,24,"OC As of October 26, there has been as many orbital launch attempts in 2022 as in the entirety of 2021.",2022-10-0337.png
[OC] Cost of hosting the World Cup,giteam,2022-10-26 11:22:50,https://i.redd.it/e0rn2tk5x4w91.png,https://www.reddit.com/r/dataisbeautiful/comments/ydvl63/oc_cost_of_hosting_the_world_cup/,46034,46034,,4068,OC Cost of hosting the World Cup,2022-10-0338.png
[OC] Birth pulse of the world,futilon,2022-10-26 12:11:42,https://v.redd.it/ztz5a78s55w91,https://www.reddit.com/r/dataisbeautiful/comments/ydwk85/oc_birth_pulse_of_the_world/,1224,1224,,68,OC Birth pulse of the world,2022-10-0339.png
"[OC] In 20 years, Southeast Asia lost 610,000 sq km of forest, a land area larger than Thailand.",Glad-Introduction-14,2022-10-26 12:14:48,https://i.redd.it/goymmo8f65w91.png,https://www.reddit.com/r/dataisbeautiful/comments/ydwmcy/oc_in_20_years_southeast_asia_lost_610000_sq_km/,427,427,,40,"OC In 20 years, Southeast Asia lost 610,000 sq km of forest, a land area larger than Thailand.",2022-10-0340.png
[OC] The tech industry has the highest incidence of insider trading between 2020 to 2022,Round-Bodybuilder187,2022-10-26 12:57:28,https://i.redd.it/b3mmn3s8d5w91.png,https://www.reddit.com/r/dataisbeautiful/comments/ydxhjz/oc_the_tech_industry_has_the_highest_incidence_of/,77,77,,22,OC The tech industry has the highest incidence of insider trading between 2020 to 2022,2022-10-0341.png
"Data Insights from 10,000 Garmin inReach SOS Incidents | Blog",Famous_Relative2500,2022-10-26 13:37:25,https://www.garmin.com/en-US/blog/saved-by-garmin/data-insights-from-10000-garmin-inreach-sos-incidents/,https://www.reddit.com/r/dataisbeautiful/comments/ydyceu/data_insights_from_10000_garmin_inreach_sos/,7,7,,2,"Data Insights from 10,000 Garmin inReach SOS Incidents Blog",2022-10-0342.jpg
[OC] The world's most popular leaders by approval rating as of October 2022.,latinometrics,2022-10-26 14:07:16,https://i.redd.it/2f0hqa6bq5w91.png,https://www.reddit.com/r/dataisbeautiful/comments/ydz029/oc_the_worlds_most_popular_leaders_by_approval/,0,0,,31,OC The world's most popular leaders by approval rating as of October 2022.,2022-10-0343.png
[OC] Tree Nut Macronutrient Analysis,Inevitable-Clue9840,2022-10-26 15:10:51,https://i.redd.it/gpyr4ebp16w91.png,https://www.reddit.com/r/dataisbeautiful/comments/ye0gv2/oc_tree_nut_macronutrient_analysis/,95,95,,13,OC Tree Nut Macronutrient Analysis,2022-10-0344.png
[OC] Salaries Distribution by Programming Languages in 2022,__dacia__,2022-10-26 15:42:27,https://i.redd.it/11jzdryf76w91.png,https://www.reddit.com/r/dataisbeautiful/comments/ye17nc/oc_salaries_distribution_by_programming_languages/,330,330,,90,OC Salaries Distribution by Programming Languages in 2022,2022-10-0345.png
[OC] Where do humans and computers play on a chess board?,Evidently_21,2022-10-26 16:48:30,https://i.redd.it/ih4p6796j6w91.png,https://www.reddit.com/r/dataisbeautiful/comments/ye2sll/oc_where_do_humans_and_computers_play_on_a_chess/,189,189,,14,OC Where do humans and computers play on a chess board,2022-10-0346.png
GDP growth visualized as absolutes at per capital level with ppp,mucking4on,2022-10-26 17:47:26,https://pdfhost.io/v/UJ5zvLlUi_understanding_fastest_gdp_growth,https://www.reddit.com/r/dataisbeautiful/comments/ye48db/gdp_growth_visualized_as_absolutes_at_per_capital/,1,1,,0,GDP growth visualized as absolutes at per capital level with ppp,2022-10-0347.jpg
[OC] All births and deaths in 2021 visualized with dots. One pink dot: 1000 births. One yellow dot: 1000 deaths.,desfirsit,2022-10-26 21:20:23,https://v.redd.it/nlseh1q8v7w91,https://www.reddit.com/r/dataisbeautiful/comments/ye9b3g/oc_all_births_and_deaths_in_2021_visualized_with/,944,944,,76,OC All births and deaths in 2021 visualized with dots. One pink dot 1000 births. One yellow dot 1000 deaths.,2022-10-0348.png
[OC] Number of road deaths per 100k motor vehicles per year,scottpaulin,2022-10-26 21:52:33,https://i.redd.it/nlx1vkpf18w91.png,https://www.reddit.com/r/dataisbeautiful/comments/yea31i/oc_number_of_road_deaths_per_100k_motor_vehicles/,19,19,,9,OC Number of road deaths per 100k motor vehicles per year,2022-10-0349.png
The Top 50 Importers and Exporters of Beer in the World,outrageouslyoffended,2022-10-26 23:42:15,https://howlongtocook.org/tips/top-importers-exporters-beer,https://www.reddit.com/r/dataisbeautiful/comments/yeckxh/the_top_50_importers_and_exporters_of_beer_in_the/,23,23,,8,The Top 50 Importers and Exporters of Beer in the World,2022-10-0350.jpg
"[OC] What share of the defense budget each European NATO country sent as military aid to Ukraine, versus distance of their capitals to Moscow",gkanor,2022-10-26 23:52:13,https://i.redd.it/9e9d2yz8m8w91.png,https://www.reddit.com/r/dataisbeautiful/comments/yectad/oc_what_share_of_the_defense_budget_each_european/,7611,7611,,610,"OC What share of the defense budget each European NATO country sent as military aid to Ukraine, versus distance of their capitals to Moscow",2022-10-0351.png
Switzerland is an island of peace in the ocean 2022 with waves of inflation [OC],Chris_Schmitz,2022-10-27 04:23:53,https://i.redd.it/0dajar4yy9w91.png,https://www.reddit.com/r/dataisbeautiful/comments/yeid8e/switzerland_is_an_island_of_peace_in_the_ocean/,14,14,,6,Switzerland is an island of peace in the ocean 2022 with waves of inflation OC,2022-10-0352.png
Feelings at Work,dwaxe,2022-10-27 04:46:27,https://flowingdata.com/2022/10/26/feelings-at-work/,https://www.reddit.com/r/dataisbeautiful/comments/yeis5o/feelings_at_work/,7,7,,1,Feelings at Work,2022-10-0353.jpg
[OC] How Meta made (or struggled to make) money in Q3 👇,Oktay_LS,2022-10-27 10:06:55,https://i.redd.it/n1b030riobw91.png,https://www.reddit.com/r/dataisbeautiful/comments/yeo103/oc_how_meta_made_or_struggled_to_make_money_in_q3/,1302,1302,,226,OC How Meta made (or struggled to make) money in Q3 👇,2022-10-0354.png
[oc] Top 10 Citibike Routes in NYC - 2017 (R),Ryrylonsdale,2022-10-27 10:51:13,https://v.redd.it/icxkos4cwbw91,https://www.reddit.com/r/dataisbeautiful/comments/yeos39/oc_top_10_citibike_routes_in_nyc_2017_r/,185,185,,9,oc Top 10 Citibike Routes in NYC - 2017 (R),2022-10-0355.png
"[OC] The value of cheese imports per head of (15+) population in 2020 by country in US$, adjusted for purchasing power",MrBookman_LibraryCop,2022-10-27 11:40:06,https://i.redd.it/55nkrv445cw91.png,https://www.reddit.com/r/dataisbeautiful/comments/yepp0y/oc_the_value_of_cheese_imports_per_head_of_15/,37,37,,10,"OC The value of cheese imports per head of (15+) population in 2020 by country in US$, adjusted for purchasing power",2022-10-0356.png
[OC] What type of coffee do you drink the most? Latte for me personally,biantongfrom,2022-10-27 12:59:10,https://i.redd.it/wg4ggvx5jcw91.png,https://www.reddit.com/r/dataisbeautiful/comments/yerc8h/oc_what_type_of_coffee_do_you_drink_the_most/,9,9,,19,OC What type of coffee do you drink the most Latte for me personally,2022-10-0357.png
USA Real Short Term Interest Rates Before & After the Creation of the Federal Reserve [OC],rosetechnology,2022-10-27 13:52:39,https://i.redd.it/7i96ddhoscw91.png,https://www.reddit.com/r/dataisbeautiful/comments/yesjm5/usa_real_short_term_interest_rates_before_after/,20,20,,11,USA Real Short Term Interest Rates Before & After the Creation of the Federal Reserve OC,2022-10-0358.png
[OC] Average Elevation by Country,two_plus_two_is_zero,2022-10-27 14:33:06,https://i.redd.it/yc29d6ryzcw91.jpg,https://www.reddit.com/r/dataisbeautiful/comments/yetjh6/oc_average_elevation_by_country/,62,62,,20,OC Average Elevation by Country,2022-10-0359.jpg
[OC] Where do Democrats and Republicans stand on free speech and the internet?,YouGov_Official,2022-10-27 14:54:46,https://i.redd.it/twem6rpp3dw91.jpg,https://www.reddit.com/r/dataisbeautiful/comments/yeu2r4/oc_where_do_democrats_and_republicans_stand_on/,13558,13558,,3930,OC Where do Democrats and Republicans stand on free speech and the internet,2022-10-0360.jpg
[OC] Percentage of countries with over 6% inflation,robs62,2022-10-27 15:37:28,https://i.redd.it/q1vlyxp2bdw91.png,https://www.reddit.com/r/dataisbeautiful/comments/yev4th/oc_percentage_of_countries_with_over_6_inflation/,44,44,,9,OC Percentage of countries with over 6% inflation,2022-10-0361.png
A shaded relief map of Contiguous USA rendered from 3d data and satellite imagery [OC],visualgeomatics,2022-10-27 18:38:06,https://i.redd.it/w4advbxl7ew91.jpg,https://www.reddit.com/r/dataisbeautiful/comments/yezpai/a_shaded_relief_map_of_contiguous_usa_rendered/,13526,13526,,536,A shaded relief map of Contiguous USA rendered from 3d data and satellite imagery OC,2022-10-0363.jpg
State GDP and Federal Dependence,Broad-Vacation-642,2022-10-27 19:48:54,https://www.moneygeek.com/living/states-most-reliant-federal-government/,https://www.reddit.com/r/dataisbeautiful/comments/yf1gme/state_gdp_and_federal_dependence/,17,17,,7,State GDP and Federal Dependence,2022-10-0364.jpg
"CEO pay has skyrocketed 1,460% since 1978: CEOs were paid 399 times as much as a typical worker in 2021",sillychillly,2022-10-27 20:42:54,https://www.epi.org/publication/ceo-pay-in-2021/,https://www.reddit.com/r/dataisbeautiful/comments/yf2sza/ceo_pay_has_skyrocketed_1460_since_1978_ceos_were/,3979,3979,,447,"CEO pay has skyrocketed 1,460% since 1978 CEOs were paid 399 times as much as a typical worker in 2021",2022-10-0365.jpg
"Always liked a bird's eye perspective. Share it with your family, friends etc. [OC]",TimeSpentWasting,2022-10-27 21:22:12,https://i.imgur.com/ZPFmzGA.jpg,https://www.reddit.com/r/dataisbeautiful/comments/yf3s1s/always_liked_a_birds_eye_perspective_share_it/,0,0,,14,"Always liked a bird's eye perspective. Share it with your family, friends etc. OC",2022-10-0366.jpg
"[OC] Racial breakdown of students at Harvard, Yale, Princeton, MIT, Stanford compared to students scoring 1400+ on the SAT",tabthough,2022-10-27 21:33:39,https://i.redd.it/dvgbiegs2fw91.png,https://www.reddit.com/r/dataisbeautiful/comments/yf42se/oc_racial_breakdown_of_students_at_harvard_yale/,834,834,,187,"OC Racial breakdown of students at Harvard, Yale, Princeton, MIT, Stanford compared to students scoring 1400+ on the SAT",2022-10-0367.png
[OC] 2022 Mid-Term Ballots already cast by Seniors 65+ outweighs Young Voters 11 to 1,SexyDoorDasherDude,2022-10-27 22:58:14,https://i.redd.it/ud5ispw3ifw91.png,https://www.reddit.com/r/dataisbeautiful/comments/yf67kw/oc_2022_midterm_ballots_already_cast_by_seniors/,2681,2681,,657,OC 2022 Mid-Term Ballots already cast by Seniors 65+ outweighs Young Voters 11 to 1,2022-10-0368.png
